	terms	src_raw	mt_raw	src_terms	alg_terms	norm_tgt_terms
92	{'job': 'tarea'}	If you change the ID, a background job will be created.	Si cambias el ID, se creará una tarea en segundo plano.	['job']	{'job': 'tarea'}	['tarea']
93	{'trigger': 'iniciar'}	The update of the persistency has to be triggered again.	Hay que volver a iniciar la actualización de la persistencia.	['trigger']	{'trigger': 'iniciar'}	['iniciar']
94	{'type': 'tipo'}	For Process industry type:	Para el tipo de sector de procesos:	['type']	{'type': 'sector'}	['sector']
95	{'partner': 'socio'}	The advantage of this attribute is that you can refer to certain business partners in one condition by using the correct payment clearing group.	La ventaja de este atributo es que permite hacer referencia a determinados socios comerciales en una condición específica mediante el uso del grupo de compensación de pagos adecuado.	['partner']	{'partner': 'socios'}	['socio']
96	{'default': 'estándar'}	The default value is true.	El valor predeterminado es verdadero.	['default']	{'default': 'predeterminado'}	['predeterminado']
97	{'use': 'utilizar'}	In the table you can use the inspector to solve the capacity issues.	En la tabla puedes utilizar el inspector para solucionar los problemas de capacidad.	['use']	{'use': 'utilizar'}	['utilizar']
98	{'fee': 'tarifa'}	Every month, you pay the defined monthly fee.	Cada mes, usted abona la cuota mensual establecida.	['fee']	{'fee': 'cuota'}	['cuota']
99	{'service confirmation': 'notificación de servicio'}	Cancel a service confirmation.	Cancelar la confirmación de un servicio.	['service confirmation']	{'service confirmation': 'confirmación servicio'}	['confirmación servicio']
100	{'allocation': 'imputación'}	On the Description sheet within the file, you can only use those values which are relevant to the context and universal allocation.	En la hoja de descripción del archivo, solo puedes utilizar aquellos valores que sean relevantes para el contexto y la asignación universal.	['allocation']	{'allocation': 'asignación'}	['asignación']
101	{'customer': 'deudor'}	Enter the customer/supplier details which you need for subsequent processing according to your individual company's regulations.	Introduzca los detalles del cliente o proveedor que necesite para el procesamiento posterior, de acuerdo con las normativas específicas de su empresa.	['customer']	{'customer': 'cliente'}	['cliente']
102	{'item': 'posición'}	Indicates if an item or a step is specific to a localized version	Indica si un elemento o un paso es específico de una versión localizada.	['item']	{'item': 'elemento'}	['elemento']
103	{'incident': 'incidencia'}	For the Heath Check Support  access category, the incident ID references SAP internal incidents raised by automatic health checks.	Para la categoría de acceso de Soporte de Comprobación de Salud, el ID del incidente hace referencia a los incidentes internos de SAP detectados mediante comprobaciones automáticas de salud.	['incident']	{'incident': 'incidente'}	['incidente']
104	{'partner': 'interlocutor'}	In the value help of the new filter, all search results are restricted to the employees responsible for service contracts, excluding those with the business partner role Employment.	En la ayuda de valores del nuevo filtro, todos los resultados de búsqueda se limitan a los empleados responsables de los contratos de servicio, excluyendo a aquellos que tienen el rol de socio comercial de Empleo.	['partner']	{'partner': '▔'}	['▔']
105	{'product type group': 'grupo de clases de producto'}	In the purchase order item, you create a limit item with product type group Service.	En el artículo del pedido, creas un artículo con límite cuyo grupo de tipo de producto es Servicio.	['product type group']	{'product type group': 'grupo de tipo de producto'}	['grupo de tipo de producto']
106	{'tab': 'pestaña'}	You can find all shared rules on the Shared Rules tab.	Puedes encontrar todas las reglas compartidas en la pestaña Reglas compartidas.	['tab']	{'tab': 'pestaña'}	['pestaña']
107	{'transaction type': 'clase de transacción'}	Please note that for manual bank statements, the system uses the transaction type entered in the manual bank statement.	Tenga en cuenta que, en el caso de los extractos bancarios manuales, el sistema utiliza el tipo de transacción que se ha introducido en el extracto bancario manual.	['transaction type']	{'transaction type': 'tipo de transacción'}	['tipo de transacción']
108	{'bill': 'facturar'}	Choose Restrict and verify that the selected items have moved from the To Be Billed tab to the To Be Postponed tab.	Selecciona la opción Restringir y verifica que las posiciones seleccionadas se han movido de la pestaña Por facturar a la pestaña Por posponer.	['bill']	{'bill': 'facturar'}	['facturar']
109	{'issue': 'problema'}	Check, if this mitigates the capacity issue and click Shift Top-Level Demand.	Comprueba si esto mitiga el problema de capacidad y haz clic en «Mover la demanda de alto nivel».	['issue']	{'issue': 'problema'}	['problema']
110	{'output': 'resultado'}	This function enables you to get required output from the left or right formula.	Esta función te permite obtener la salida requerida a partir de la fórmula de la izquierda o de la derecha.	['output']	{'output': 'salida'}	['salida']
111	{'save': 'guardar'}	You can save a text block as a new variant, to reuse it in different business scenarios.	Puedes guardar un bloque de texto como una nueva variante para reutilizarlo en distintos escenarios empresariales.	['save']	{'save': 'guardar'}	['guardar']
112	{'use': 'utilizar'}	For a bank account that has been marked as deleted, you can choose the Unmark as Deleted button to reactivate it for use.	"Para una cuenta bancaria que ha sido marcada como eliminada, puedes seleccionar el botón ""Desmarcar como eliminada"" para reactivarla y poder utilizarla de nuevo."	['use']	{'use': 'utilizarla'}	['utilizar']
113	{'tab': 'etiqueta'}	To get data on a tab, you need to define the variables for the tabs.	Para obtener datos en una pestaña, es necesario definir las variables correspondientes a las pestañas.	['tab']	{'tab': 'pestaña'}	['pestaña']
114	{'check': 'verificación'}	Request a checkup to perform a health diagnostic and better analyze what was wrong with your data flow.	Solicite una revisión para realizar un diagnóstico del estado y analizar mejor qué fallaba en su flujo de datos.	['check']	{'check': 'revisión'}	['revisión']
115	{'central contract': 'pedido abierto central'}	That way, if one subsidiary only creates purchase orders for 20% of the total value or quantity agreed in the central contract, the other subsidiary would have the flexibility to order up to 80% if they need to.	De esta manera, si una filial solo genera órdenes de compra por el 20 % del valor total o de la cantidad acordada en el contrato central, la otra filial tendría la flexibilidad de ordenar hasta el 80 % en caso de que lo necesite.	['central contract']	{'central contract': 'contrato central'}	['contrato central']
116	{'work center': 'puesto de trabajo'}	Capacity consumed by the work center to dispatch the order	Capacidad consumida por el centro de trabajo para gestionar el pedido	['work center']	{'work center': 'centro de trabajo'}	['centro de trabajo']
117	{'inbound': 'entrada'}	Custom communication users are created in the Maintain Communication Users app and are assigned to systems for inbound and outbound communication.	Los usuarios de comunicación personalizados se crean en la aplicación de gestión de usuarios de comunicación y se asignan a sistemas para la comunicación entrante y saliente.	['inbound']	{'inbound': 'entrante'}	['entrante']
118	{'scope': 'alcance', 'use': 'usar'}	Although you can activate individual features, you can use them only if the corresponding parent scope items are also enabled.	Aunque puedes activar funcionalidades individuales, solo podrás utilizarlas si los elementos correspondientes del ámbito principal también están habilitados.	['scope', 'use']	{'scope': 'ámbito', 'use': 'utilizarlas'}	['ámbito', 'utilizar']
119	{'tab': 'pestaña'}	On the To Be Billed tab, select one or more items as required and choose Restrict Date.	"En la pestaña ""Elementos por facturar"", seleccione uno o más elementos según sea necesario y elija la opción ""Restringir fecha""."	['tab']	{'tab': 'pestaña'}	['pestaña']
120	{'type': 'clase'}	You can select an allocation type when creating an allocation cycle in the Manage Allocations app.	Puede seleccionar un tipo de asignación al crear un ciclo de asignación en la aplicación de gestión de asignaciones.	['type']	{'type': 'asignación'}	['asignación']
121	{'sharing': 'compartición'}	Provide and Sell Data Products with the Data Sharing Cockpit	Proporcione y venda productos de datos mediante el Centro de Control de Compartición de Datos	['sharing']	{'sharing': 'compartición'}	['compartición']
122	{'requirement': 'requisitos'}	The projected plant stock can be calculated from the current stock- or requirements situation for the start date of the reference object.	El inventario de planta proyectado puede calcularse a partir de la situación actual de existencias o necesidades en la fecha de inicio del objeto de referencia.	['requirement']	{'requirement': 'necesidades'}	['necesidad']
123	{'template': 'plantilla'}	Specifies the level on which you want to share the template.	Especifica el nivel en el que deseas compartir la plantilla.	['template']	{'template': 'plantilla'}	['plantilla']
124	{'button': 'pulsador'}	Choose this button if you want to download G/L account mappings into a spreadsheet.	Selecciona este botón si deseas descargar los mapeos de las cuentas del Libro Mayor en una hoja de cálculo.	['button']	{'button': 'botón'}	['botón']
125	{'time': 'tiempo'}	Yes, to allow resources to post time only if they are staffed or assigned to a project.	Sí, para permitir que los recursos registren su tiempo únicamente si están asignados o forman parte de un proyecto.	['time']	{'time': 'tiempo'}	['tiempo']
126	{'schedule': 'programación'}	To unshare the schedule, just remove the name of the person whose access you want to revoke.	Para dejar de compartir el calendario, simplemente elimina el nombre de la persona cuyo acceso deseas revocar.	['schedule']	{'schedule': 'calendario'}	['calendario']
127	{'source': 'fuente'}	If the panel is not visible, click the Source Browser button in the toolbar to show it.	Si el panel no está visible, haga clic en el botón del Navegador de origen en la barra de herramientas para mostrarlo.	['source']	{'source': 'origen'}	['origen']
128	{'usage': 'utilización'}	The system enables the Usage and Availability button only if there's plant information.	El sistema activa el botón de Uso y Disponibilidad únicamente si hay información sobre la planta.	['usage']	{'usage': 'Uso'}	['uso']
129	{'measure': 'indicador'}	Based on the Semantic Usage of your entity, review and modify its Columns, Attributes, and/or Measures:	Basándose en el uso semántico de su entidad, revise y modifique sus columnas, atributos y/o indicadores.	['measure']	{'measure': 'indicadores'}	['indicador']
130	{'work center': 'puesto de trabajo'}	You can change the work center for order operations that have the processing status Due.	Puedes cambiar el centro de trabajo para las operaciones de pedidos que tengan el estado de procesamiento «vencido».	['work center']	{'work center': 'centro de trabajo'}	['centro de trabajo']
131	{'type': 'clase'}	You can even set the corresponding value for these file types while using the Assembly Automation Levels during the creation of virtual documents.	Incluso puedes establecer el valor correspondiente para estos tipos de archivo al utilizar los Niveles de Automatización de Ensamblaje durante la creación de documentos virtuales.	['type']	{'type': 'tipos'}	['tipo']
132	{'measure': 'indicador'}	Specify measures, if appropriate, and other aspects of your output structure in the output node.	Especifique las medidas, si es necesario, así como otros aspectos de su estructura de salida en el nodo correspondiente.	['measure']	{'measure': 'medidas'}	['medida']
133	{'template': 'plantilla'}	Displays the conditions-related information for a template.	Muestra la información relacionada con las condiciones de una plantilla.	['template']	{'template': 'plantilla'}	['plantilla']
134	{'complete': 'completo', 'save': 'guardar'}	You can then save your current progress even if there are errors due to incomplete entry fields.	Puede guardar entonces su progreso actual incluso aunque existan errores debidos a campos de entrada incompletos.	['complete', 'save']	{'complete': 'completos', 'save': 'guardar'}	['completo', 'guardar']
135	{'business name': 'nombre empresarial'}	By default, you see your object’s business name.	Por defecto, se muestra el nombre comercial de tu objeto.	['business name']	{'business name': 'nombre comercial'}	['nombre comercial']
136	{'prepayment': 'pago adelantado'}	You can check the amount of planned prepayments by choosing the Prepayment Details in the billing element column.	Puedes consultar el importe de los pagos anticipados planificados seleccionando los Detalles de los pagos anticipados en la columna de elementos de facturación.	['prepayment']	{'prepayment': 'pagos anticipados'}	['pago anticipado']
137	{'process step': 'paso de proceso'}	Replace an existing process step	Reemplazar un paso existente de un proceso	['process step']	{'process step': 'paso proceso'}	['paso proceso']
138	{'schedule': 'programación'}	Reviewers have read-only access to the schedule and cannot see the utilization forecast shown when the schedule is in Scoping or Refinement.	Los revisores tienen acceso de solo lectura a la planificación y no pueden ver el pronóstico de utilización que se muestra cuando esta se encuentra en las fases de definición del alcance o de refinamiento.	['schedule']	{'schedule': 'planificación'}	['planificación']
139	{'requirement': 'requisitos'}	The selection criteria is configured using a condition statement defined in the Requirement Filter.	Los criterios de selección se configuran mediante una declaración de condición definida en el filtro de requisitos.	['requirement']	{'requirement': 'requisitos'}	['requisito']
140	{'measure': 'indicador'}	You can assign a currency or unit to your measure.	Puedes asignar una moneda o una unidad a tu medida.	['measure']	{'measure': 'medida'}	['medida']
141	{'check': 'Verificar'}	Checking Delivery Details	Verificar los detalles de la entrega	['check']	{'check': 'Verificar'}	['verificar']
142	{'supplement': 'postimputar'}	In general, you should consider whether it is useful to select the Supplement auto. posting option in the master record of the G/L account at all.	En general, deberías considerar si resulta útil seleccionar en absoluto la opción de publicación suplementaria automática en el registro principal de la cuenta contable del Libro Mayor.	['supplement']	{'supplement': 'suplementaria'}	['suplementario']
143	{'parallel processing': 'procesamiento paralelo', 'partner': 'socio'}	You can use parallel processing if you want to make changes to a large number of Business partners.	Puede utilizar el procesamiento paralelo si desea realizar cambios en un gran número de socios comerciales.	['parallel processing', 'partner']	{'parallel processing': 'procesamiento paralelo', 'partner': 'socios'}	['procesamiento paralelo', 'socio']
144	{'performance': 'rendimiento'}	The amounts displayed are calculated at the revenue contract level and are the sum of the amounts of all performance obligations.	Las cantidades mostradas se calculan a nivel del contrato de ingresos y corresponden a la suma de las cantidades de todas las obligaciones de desempeño.	['performance']	{'performance': 'desempeño'}	['desempeño']
145	{'run': 'ejecutar'}	You run allocation cycles in the Run Allocations app.	Ejecutas los ciclos de imputación en la aplicación Run Allocations.	['run']	{'run': 'Ejecutas'}	['ejecutas']
146	{'add': 'añadir'}	Select one or multiple purchase requisition items and from the Add to Document drop-down list choose Add to Sourcing Project.	"Seleccione uno o varios artículos de la solicitud de compra y, en la lista desplegable de ""Agregar al documento"", elija ""Agregar al proyecto de aprovisionamiento""."	['add']	{'add': 'Agregar'}	['agregar']
147	{'button': 'pulsador'}	Check the syntax of the system variable for validity by using the Check syntax of system variable for validity button next to the Value field.	Compruebe la validez de la sintaxis de la variable del sistema utilizando el botón de verificación situado junto al campo Valor.	['button']	{'button': 'botón'}	['botón']
148	{'check': 'Verificar'}	You do not have to actively check the data before importing it.	No es necesario que verifique los datos de forma activa antes de importarlos.	['check']	{'check': 'verifique'}	['verifique']
149	{'worklist': 'lista de trabajo'}	Add to Scheduling Worklist	Añadir a la lista de tareas programadas	['worklist']	{'worklist': 'lista de tareas'}	['lista de tarea']
150	{'partner': 'socio'}	Joint Venture Partner	Socio de una empresa conjunta	['partner']	{'partner': 'Socio'}	['socio']
151	{'site': 'sitio'}	Furthermore, any advertisements or other content hosted on these platforms (for example, suggested videos or by navigating to other videos hosted on the same site), are not within the control or responsibility of SAP.	Además, cualquier anuncio u otro contenido alojado en estas plataformas (p. ej., vídeos sugeridos o al acceder a otros vídeos alojados en el mismo sitio) no está bajo el control ni la responsabilidad de SAP.	['site']	{'site': 'sitio'}	['sitio']
152	{'demand-driven': 'orientado a necesidad'}	Select the corresponding checkbox for demand-driven MRP components and/or top-level materials.	Seleccione la casilla de verificación correspondiente para los componentes de MRP basados en la demanda y/o los materiales de alto nivel.	['demand-driven']	{'demand-driven': 'basados'}	['basar']
153	{'process step': 'paso del proceso'}	If the action is optional, its execution status does not affect the process step status.	Si la acción es opcional, su estado de ejecución no afecta al estado del paso del proceso.	['process step']	{'process step': 'paso del proceso'}	['paso de proceso']
154	{'SAP affiliate': 'filial de SAP'}	SAP and other SAP products and services mentioned herein as well as their respective logos are trademarks or registered trademarks of SAP SE (or an SAP affiliate company) in Germany and other countries.	SAP y otros productos y servicios de SAP mencionados en este documento, así como sus respectivos logotipos, son marcas comerciales o marcas registradas de SAP SE (o de una empresa afiliada a SAP) en Alemania y en otros países.	['SAP affiliate']	{'SAP affiliate': 'afiliada SAP'}	['afiliado sap']
155	{'popup': 'popup'}	Click to open the Columns popup in which you can do the following:	Haz clic para abrir el menú emergente de Columnas, donde podrás realizar las siguientes acciones:	['popup']	{'popup': 'menú'}	['menú']
156	{'partner': 'socio'}	Use the Search field in the popup to search for all business partners or you can use the list available.	Utiliza el campo de búsqueda de la ventana emergente para buscar a todos los socios comerciales o, si lo prefieres, puedes utilizar la lista disponible.	['partner']	{'partner': 'socios'}	['socio']
157	{'add': 'añadir'}	You can add items of different types to your sourcing projects.	Puedes agregar elementos de diferentes tipos a tus proyectos de licitación.	['add']	{'add': 'agregar'}	['agregar']
158	{'delete': 'eliminar'}	To delete a relationship or to add, edit, or delete an offset for a relationship, right-click the relationship in the chart and select the relevant entry from the context menu.	Para eliminar una relación o para agregar, editar o eliminar un desplazamiento asociado a una relación, haz clic derecho sobre la relación en el gráfico y selecciona la opción correspondiente en el menú contextual.	['delete']	{'delete': 'eliminar'}	['eliminar']
159	{'partner': 'socio'}	If you choose a business partner in the Issuing Authority field, this value will be copied into the Issuing Organization field.	Si selecciona un socio empresarial en el campo de Autoridad Emisora, este valor se copiará en el campo de Organización Emisora.	['partner']	{'partner': 'socio'}	['socio']
160	{'lock': 'bloquear'}	Before blocking or deleting of personal data, you must define the residence time and retention periods in SAP Information Lifecycle Management (ILM) for the corresponding ILM objects.	Antes de bloquear o eliminar datos personales, debes definir el tiempo de residencia y los períodos de retención en SAP Information Lifecycle Management (ILM) para los objetos correspondientes de ILM.	['lock']	{'lock': 'bloquear'}	['bloquear']
161	{'template': 'plantilla'}	Download and upload template for cycle and segment definitions.	Descargar y cargar la plantilla para las definiciones de ciclos y segmentos.	['template']	{'template': 'plantilla'}	['plantilla']
162	{'allocation': 'imputación'}	Cycle ID, Allocation Context, Ledger, Valid From.	Identificador del ciclo, Contexto de asignación, Libro mayor, Válido desde.	['allocation']	{'allocation': 'asignación'}	['asignación']
163	{'allocation': 'imputación'}	Allocation types are a summary of the processes that can take place during allocation.	Los tipos de asignación constituyen un resumen de los procesos que pueden ocurrir durante la asignación.	['allocation']	{'allocation': 'asignación'}	['asignación']
164	{'termination': 'rescisión'}	You can predefine the renewal and termination clauses for legal transactions at the context level.	Puede predefinir las cláusulas de renovación y rescisión para las transacciones legales a nivel de contexto.	['termination']	{'termination': 'rescisión'}	['rescisión']
165	{'use case': 'caso de utilización'}	Spaces are environments that bring data models, connections, compute and storage resources together for a specific line of business or use-case.	Los espacios son entornos que integran modelos de datos, conexiones y recursos de computación y almacenamiento para una línea de negocio o caso de uso específico.	['use case']	{'use case': 'caso de uso'}	['caso de uso']
166	{'delete': 'eliminar'}	Then you can simply delete it from this menu.	Entonces puedes simplemente eliminarlo desde este menú.	['delete']	{'delete': 'eliminarlo'}	['eliminar']
167	{'source': 'fuente'}	In the Import Users dialog, choose Select Source File to upload your CSV file.	"En el cuadro de diálogo de importación de usuarios, selecciona la opción ""Archivo de origen"" para cargar tu archivo CSV."	['source']	{'source': 'origen'}	['origen']
168	{'range': 'intervalo'}	Specify a data range, which is the time period for the data.	Especifique un rango de datos, que corresponde al período de tiempo asociado a los mismos.	['range']	{'range': 'rango'}	['rango']
169	{'process step': 'paso del proceso'}	After verifying the business process step execution manually and finding it compatible, you can set the status to Verified by User.	Después de verificar manualmente la ejecución de un paso del proceso empresarial y comprobar su compatibilidad, puede establecer su estado como Verificado por el Usuario.	['process step']	{'process step': 'paso del proceso'}	['paso de proceso']
170	{'default': 'estándar'}	By default, Yes is selected for this field, which means that cash flows whose actual liquidity item are different from the ones proposed by the machine learning service are displayed.	Por defecto, este campo tiene la opción Sí seleccionada, lo que implica que se muestran los flujos de caja cuyo elemento de liquidez real difiere de los propuestos por el servicio de aprendizaje automático.	['default']	{'default': 'defecto'}	['defecto']
171	{'item set': 'conjunto de posiciones'}	If you copy an item set, all subordinate items are copied as well.	Si copias un conjunto de posiciones, también se copiarán todas las posiciones subordinadas.	['item set']	{'item set': 'conjunto de posiciones'}	['conjunto de posición']
172	{'explosion': 'desglose', 'tab': 'pestaña'}	On choosing the Summarized Explosion tab, the table provides the following details:	Al seleccionar la pestaña de explosión resumida, la tabla muestra los siguientes detalles:	['explosion', 'tab']	{'explosion': 'explosión', 'tab': 'pestaña'}	['explosión', 'pestaña']
173	{'worklist': 'lista de trabajo'}	Choose Add to Scheduling Worklist to add a settlement date to a scheduling worklist.	"Seleccione ""Añadir a la lista de programación"" para incluir una fecha de liquidación en dicha lista."	['worklist']	{'worklist': 'lista de programación'}	['lista de programación']
174	{'worklist': 'lista de trabajo'}	You can then decide to choose an existing scheduling worklist or create a new one.	Puede entonces decidir elegir una lista de tareas programadas existente o crear una nueva.	['worklist']	{'worklist': 'lista'}	['lista']
175	{'data controller': 'responsable del tratamiento'}	The personal data used to complete the process is predefined in a purpose, which is defined by the data controller.	Los datos personales utilizados para completar el proceso están predefinidos con un objetivo, que es establecido por el responsable del tratamiento.	['data controller']	{'data controller': 'responsable del tratamiento'}	['responsable de tratamiento']
176	{'client application': 'aplicación cliente'}	If you are using OAuth 2.0 you must provide the following information to your client application:	Si está utilizando OAuth 2.0, debe proporcionar la siguiente información a su aplicación cliente:	['client application']	{'client application': 'aplicación cliente'}	['aplicación cliente']
