	terms	src_raw	mt_raw	src_terms	alg_terms	norm_tgt_terms
0	{'space': 'Space'}	The status of each individual space can be seen from the color code on the upper left corner.	Der Status jedes einzelnen Space kann anhand des Farbcodes in der oberen linken Ecke abgelesen werden.	['space']	{'space': 'Space'}	['space']
1	{'storage': 'Speicher'}	Your contract includes a total number of available capacity units per month which you can allocate as you wish to the compute and storage resources.	Ihr Vertrag umfasst eine monatliche Gesamtzahl an verfügbaren Kapazitätseinheiten, die Sie nach Belieben den Rechen- und Speicherressourcen zuweisen können.	['storage']	{'storage': 'Speicherressourcen'}	['speicherressourcen']
2	{'share': 'teilen'}	share the URL link to other users with the proper editing rights	Teilen Sie den URL-Link mit anderen Benutzern, die über die entsprechenden Bearbeitungsrechte verfügen.	['share']	{'share': 'Teilen'}	['teil|teilen']
3	{'constraint': 'Einschränkung'}	Once you remove the constraint for the successor operation, the operation can be rescheduled automatically.	Sobald Sie die Einschränkung für die Nachfolgeroperation aufheben, kann diese automatisch neu geplant werden.	['constraint']	{'constraint': 'Einschränkung'}	['einschränkung']
4	{'create': 'erstellen'}	As long as you have not configured the tenant, you can use only administration features of SAP Data Warehouse Cloud (but you cannot create spaces in the Space Management page).	Solange Sie den Tenant nicht konfiguriert haben, können Sie nur die Administrationsfunktionen von SAP Data Warehouse Cloud nutzen. Sie können jedoch keine Spaces auf der Seite für das Space-Management erstellen.	['create']	{'create': 'erstellen'}	['erstellen']
5	{'area of responsibility': 'Zuständigkeitsbereich'}	All resources in your area of responsibility will be displayed.	Alle Ressourcen in Ihrem Zuständigkeitsbereich werden angezeigt.	['area of responsibility']	{'area of responsibility': 'Zuständigkeitsbereich'}	['zuständigkeitsbereich']
6	{'trigger': 'Auslöser'}	Required Permissions for Oracle Trigger-Based Replication in the SAP HANA Smart Data Integration and SAP HANA Smart Data Quality Installation and Configuration Guide	Erforderliche Berechtigungen für die triggerbasierte Oracle-Replikation im Installations- und Konfigurationshandbuch für SAP HANA Smart Data Integration und SAP HANA Smart Data Quality	['trigger']	{'trigger': 'triggerbasierte'}	['triggerbasieren']
7	{'connector': 'Konnektor'}	Integrate an account with your space to be able to create connections for connector instances and use the connections for data flows.	Verknüpfen Sie ein Konto mit Ihrem Bereich, um Verbindungen für Konnektor-Instanzen erstellen und diese für Datenflüsse nutzen zu können.	['connector']	{'connector': 'Konnektor-Instanzen'}	['konnektor']
8	{'customer': 'Debitor', 'supplier': 'Kreditor'}	A payment clearing group is an attribute with which you can categorize your suppliers and customers into groups.	Eine Zahlungsabwicklungsgruppe ist ein Attribut, mit dem Sie Ihre Kreditoren und Debitoren in Gruppen einteilen können.	['customer', 'supplier']	{'customer': 'Kreditoren', 'supplier': 'Kreditoren'}	['kreditor', 'kreditor']
9	{'demand-driven': 'bedarfsorientiert'}	Select the corresponding checkbox for demand-driven MRP components and/or top-level materials.	Wählen Sie das entsprechende Kontrollkästchen für bedarfsorientierte MRP-Komponenten und/oder Top-Level-Materialien aus.	['demand-driven']	{'demand-driven': 'bedarfsorientierte'}	['bedarfsorientieren']
10	{'create': 'erstellen'}	Click Create License to create a license for one or multiple of your data products and generate activation keys that you can share with consumers to allow them to use the licensed scope of data products.	Klicken Sie auf „Lizenz erstellen“, um eine Lizenz für eines oder mehrere Ihrer Datenprodukte zu erstellen und Aktivierungsschlüssel zu generieren, die Sie mit Verbrauchern teilen können, damit diese den lizenzierten Umfang der Datenprodukte nutzen können.	['create']	{'create': 'erstellen'}	['erstellen']
11	{'side panel': 'Seitenbereich'}	Control your union in the Mappings section of its side panel:	Steuern Sie Ihre Union im Mappings-Bereich des zugehörigen Seitenbereichs.	['side panel']	{'side panel': 'Seitenbereichs'}	['seitenbereich']
12	{'indicator': 'Indikator'}	The performance of the model version is evaluated using two main indicators.	Die Leistung der Modellversion wird anhand von zwei Hauptindikatoren bewertet.	['indicator']	{'indicator': 'Hauptindikatoren'}	['hauptindikator']
13	{'query': 'Abfrage'}	The database then has to decide which job or query has to be dealt with first.	Die Datenbank muss dann entscheiden, welche Aufgabe oder Abfrage als Erstes bearbeitet werden soll.	['query']	{'query': 'Abfrage'}	['abfrage']
14	{'provider': 'Provider'}	Address, e-mail, phone number, etc of the provider	Adresse, E-Mail, Telefonnummer usw. des Providers	['provider']	{'provider': 'Providers'}	['provider']
15	{'space': 'Space'}	The name should be unique within a space.	Der Name sollte innerhalb eines Space eindeutig sein.	['space']	{'space': 'Space'}	['space']
16	{'intercompany': 'buchungskreisübergreifend'}	Display the IDs of intercompany customer invoices, customer invoices, and intercompany supplier invoices	Zeigen Sie die IDs der buchungskreisübergreifenden Kunderechnungen, der Kunderechnungen sowie der buchungskreisübergreifenden Lieferantenrechnungen an.	['intercompany']	{'intercompany': 'buchungskreisübergreifenden'}	['buchungskreisübergreifen']
17	{'history': 'Verlauf', 'release': 'Release'}	To lock a specific release of a data product, open the release history of the selected product, select the release you want to lock and select the checkbox Locked.	Um einen bestimmten Release eines Datenprodukts zu sperren, öffnen Sie den Release-Verlauf des ausgewählten Produkts, wählen Sie den Release aus, den Sie sperren möchten, und aktivieren Sie das Kontrollkästchen „Gesperrt“.	['history', 'release']	{'history': 'Release-Verlauf', 'release': 'Release'}	['release', 'release']
18	{'data provider': 'Datenprovider'}	This varies depending on how the data provider offers their products.	Dies hängt davon ab, wie der Datenprovider seine Produkte anbietet.	['data provider']	{'data provider': 'Datenprovider'}	['datenprovider']
19	{'access control': 'Zugriffskontrolle'}	Create a data access control to filter data in views and business layer objects by one or more criteria.	Erstellen Sie eine Zugriffskontrolle für Daten, um Daten in Ansichten und Geschäftsschicht-Objekten anhand eines oder mehrerer Kriterien zu filtern.	['access control']	{'access control': 'Zugriffskontrolle'}	['zugriffskontrolle']
20	{'data provider': 'Datenprovider'}	Retrieve your favorite data providers and data products.	Rufen Sie Ihre bevorzugten Datenprovider und Datenprodukte auf.	['data provider']	{'data provider': 'Datenprovider'}	['datenprovider']
21	{'section': 'Bereich'}	Choose Fuzzy Match to display the Match Thresholds section.	Wählen Sie „Fuzzy Match“, um den Bereich „Match-Schwellenwerte“ anzuzeigen.	['section']	{'section': 'Bereich'}	['bereich']
22	{'provider': 'Provider'}	You can see which products were last released by the provider.	Sie können sehen, welche Produkte zuletzt vom Provider veröffentlicht wurden.	['provider']	{'provider': 'Provider'}	['provider']
23	{'provider': 'Provider'}	It’s maintained by the provider and the information might differs from one provider to another.	Es wird vom Provider gepflegt, und die Informationen können je nach Provider variieren.	['provider']	{'provider': 'Provider'}	['provider']
24	{'release': 'Release'}	To lock all the releases of a data product, select the product and select the checkbox Locked.	Um alle Releases eines Datenprodukts zu sperren, wählen Sie das Produkt aus und aktivieren Sie das Kontrollkästchen „Gesperrt“.	['release']	{'release': 'Releases'}	['release']
25	{'assigned': 'zugewiesen'}	The Product Allocation Order Items card displays only those order items with confirmation quantity assigned to a characteristic value combination containing the specified characteristic or values.	Die Karte für Bestellpositionen der Produktzuweisung zeigt nur diejenigen Bestellpositionen an, bei denen die bestätigte Menge einer Merkmalswertkombination zugewiesen ist, die das angegebene Merkmal bzw. die angegebenen Werte enthält.	['assigned']	{'assigned': 'zugewiesen'}	['zuweisen']
26	{'storage': 'Speicher', 'space': 'Platz'}	This space is close to exceeding it's storage quota.	Dieser Platz steht kurz davor, sein Speicherkontingent zu überschreiten.	['storage', 'space']	{'storage': 'Speicherkontingent', 'space': 'Platz'}	['speicherkontingent', 'platz']
27	{'period': 'Zeitraum'}	Older period includes data older than the last year.	Der ältere Zeitraum umfasst Daten, die älter als das letzte Jahr sind.	['period']	{'period': 'Zeitraum'}	['zeitraum']
28	{'data provider': 'Datenprovider', 'create': 'erstellen'}	Create or Edit a Data Provider Profile	Datenprovider-Profil erstellen oder bearbeiten	['data provider', 'create']	{'data provider': 'Datenprovider-Profil', 'create': 'erstellen'}	['datenprovider', 'erstellen']
29	{'data provider': 'Datenprovider'}	In the Switch Data Provider dialog:	Im Dialog „Datenprovider wechseln“:	['data provider']	{'data provider': 'Datenprovider'}	['datenprovider']
30	{'space': 'Space'}	Select your Space	Wählen Sie Ihren Space aus	['space']	{'space': 'Space'}	['space']
31	{'data provider': 'Datenprovider'}	Thanks to the product page created by the data provider you get detailed information on the data product and eventually access to sample data, if available.	Dank der vom Datenprovider erstellten Produktseite erhalten Sie detaillierte Informationen über das Datenprodukt und gegebenenfalls Zugang zu Beispieldaten, sofern diese verfügbar sind.	['data provider']	{'data provider': 'Datenprovider'}	['datenprovider']
32	{'consumption model': 'Verbrauchsmodell'}	To guarantee a smooth roll-out of updates to any object without immediately affecting or even breaking fact models, consumption models, or perspectives, you can derive versions of objects.	Um einen reibungslosen Roll-out von Updates für beliebige Objekte zu gewährleisten, ohne dabei Faktmodelle, Verbrauchsmodelle oder Perspektiven unmittelbar zu beeinträchtigen oder gar zu zerstören, können Sie Versionen der Objekte ableiten.	['consumption model']	{'consumption model': 'Verbrauchsmodelle'}	['verbrauchsmodell']
33	{'reference quantity': 'Referenzmenge'}	You can display the reference quantity and the simulation quantity side by side.	Sie können die Referenzmenge und die Simulationsmenge nebeneinander darstellen.	['reference quantity']	{'reference quantity': 'Referenzmenge'}	['referenzmenge']
34	{'period': 'Periode'}	The inspector detects issues for each top-level material per time period.	Der Inspektor erkennt für jedes Material auf oberster Ebene Probleme pro Periode.	['period']	{'period': 'Periode'}	['periode']
35	{'root': 'Stamm'}	Any path used with this connection will be prefixed with this root path.	Jeder Pfad, der mit dieser Verbindung verwendet wird, wird mit diesem Stammverzeichnis vorangestellt.	['root']	{'root': 'Stammverzeichnis'}	['stammverzeichnen']
36	{'type': 'Art'}	It must be unique for the clause type in each language.	Es muss für jeden Klauseltyp in jeder Sprache eindeutig sein.	['type']	{'type': 'Klauseltyp'}	['klauseltyp']
37	{'acceptance': 'Abnahme'}	Enables you to indicate if the acceptance of an ordered item is to take place at the point of origin.	Ermöglicht Ihnen anzugeben, ob die Abnahme eines bestellten Artikels am Ursprungsort erfolgen soll.	['acceptance']	{'acceptance': 'Abnahme'}	['abnahme']
38	{'space': 'Space'}	Enter a name for your space.	Geben Sie einen Namen für Ihren Space ein.	['space']	{'space': 'Space'}	['space']
39	{'revision': 'überarbeitete Version'}	Changes within the same version are saved as new revisions.	Änderungen innerhalb derselben Version werden als neue Revisionen gespeichert.	['revision']	{'revision': 'Revisionen'}	['revision']
40	{'data provider': 'Datenprovider'}	You can search and purchase analytical data from data providers.	Sie können analytische Daten bei Datenprovidern suchen und kaufen.	['data provider']	{'data provider': 'Datenprovidern'}	['datenprovidern']
41	{'start': 'Start'}	The projected plant stock can be calculated from the current stock- or requirements situation for the start date of the reference object.	Der prognostizierte Anlagenbestand kann basierend auf der aktuellen Bestands- oder Bedarfssituation zum Startzeitpunkt des Referenzobjekts berechnet werden.	['start']	{'start': 'Startzeitpunkt'}	['startzeitpunkt']
42	{'pricing date': 'Preisfindungsdatum'}	Provide all the mandatory details such as the Pricing Date, Currency, and Quantity, and choose Simulate.	Geben Sie alle erforderlichen Angaben wie das Preisfindungsdatum, die Währung und die Menge ein und wählen Sie „Simulieren“ aus.	['pricing date']	{'pricing date': 'Preisfindungsdatum'}	['preisfindungsdatum']
43	{'layer': 'Schicht'}	Data Layer Object Properties - Shared Content Between WA and HP	Eigenschaften von Objekten der Daten-Schicht – Gemeinsame Inhalte zwischen WA und HP	['layer']	{'layer': 'Daten-Schicht'}	['datum']
44	{'create': 'erstellen'}	Select Create Filter and add your filter conditions:	Wählen Sie „Filter erstellen“ aus und fügen Sie Ihre Filterbedingungen hinzu.	['create']	{'create': 'erstellen'}	['erstellen']
45	{'space': 'Space'}	Create a new space.	Erstelle einen neuen Space.	['space']	{'space': 'Space'}	['space']
46	{'type': 'Typ'}	In each condition record where you define a scale value, you can further specify the scale type.	In jedem Bedingungsdatensatz, in dem Sie einen Skalenwert definieren, können Sie zusätzlich den Skalentyp spezifizieren.	['type']	{'type': 'Skalentyp'}	['skalentyp']
47	{'schedule': 'Zeitplan', 'summary': 'Übersicht'}	This is the summary of your schedule.	Dies ist die Übersicht Ihres Zeitplans.	['schedule', 'summary']	{'schedule': 'Zeitplans', 'summary': 'Übersicht'}	['zeitplan', 'übersicht']
48	{'space': 'Space'}	Select the Space you would like to work in.	Wählen Sie den Space aus, in dem Sie arbeiten möchten.	['space']	{'space': 'Space'}	['space']
49	{'report': 'Bericht'}	The following reporting periods are not available in this app:	Die folgenden Berichtszeiträume stehen in dieser App nicht zur Verfügung:	['report']	{'report': 'Berichtszeiträume'}	['berichtszeitraum']
50	{'consumption model': 'Verbrauchsmodell'}	You can define measures for your consumption model.	Sie können Messgrößen für Ihr Verbrauchsmodell festlegen.	['consumption model']	{'consumption model': 'Verbrauchsmodell'}	['verbrauchsmodell']
51	{'trigger': 'Auslöser'}	[if Enable Statement-level Triggers = true] Create Statement-level Insert Triggers	[Wenn Anweisungs-Level-Auslöser aktiviert sind (true)] Erstellen Sie Insert-Auslöser auf Anweisungsebene.	['trigger']	{'trigger': 'Auslöser'}	['auslöser']
52	{'order': 'Auftrag'}	The Work Center column lists the resource of the corresponding order.	Die Spalte „Arbeitszentrum“ listet die Ressource des zugehörigen Auftrags auf.	['order']	{'order': 'Auftrags'}	['auftrag']
53	{'client': 'Client'}	Make your view visible to analytical clients.	Stellen Sie Ihre Ansicht für analytische Clients sichtbar dar.	['client']	{'client': 'Clients'}	['client']
54	{'interval': 'Intervall'}	Defines a relative time interval for which you want to determine the creation of the necessary physical inventory documents for your cycle counting process.	Definiert ein relatives Zeitintervall, für das Sie die Erstellung der notwendigen physischen Bestandsdokumente für Ihren zyklischen Inventurprozess festlegen möchten.	['interval']	{'interval': 'Zeitintervall'}	['zeitintervall']
55	{'space': 'Space'}	see the storage status of your space	Überprüfen Sie den Speicherstatus Ihres Space.	['space']	{'space': 'Space'}	['space']
56	{'create': 'erstellen'}	If you wish to create a role without extending a predefined standard role, choose the blank template.	Wenn Sie eine Rolle erstellen möchten, ohne eine vordefinierte Standardrolle zu erweitern, wählen Sie die leere Vorlage aus.	['create']	{'create': 'erstellen'}	['erstellen']
57	{'task log': 'Aufgabenprotokoll'}	You access these detailed task logs by navigating to the Data Integration Monitor - Details screen of the relevant task.	Sie greifen auf diese detaillierten Aufgabenprotokolle zu, indem Sie zur Detailansicht des Data Integration Monitors der entsprechenden Aufgabe navigieren.	['task log']	{'task log': 'Aufgabenprotokolle'}	['aufgabenprotokoll']
58	{'provider': 'Provider'}	When a new delivery is made available by the provider, the Status of your data product is outdated.	Wenn der Provider eine neue Lieferung bereitstellt, ist der Status Ihres Datenprodukts nicht mehr aktuell.	['provider']	{'provider': 'Provider'}	['provider']
59	{'connector': 'Connector'}	Cloud Connectors that you want to use for data flows only don't require an entry in this list.	Cloud-Connector, die Sie ausschließlich für Datenströme verwenden möchten, benötigen keinen Eintrag in dieser Liste.	['connector']	{'connector': 'Cloud-Connector'}	['cloud']
60	{'release': 'Release'}	To publish the release at a later point in time, click Save.	Um das Release zu einem späteren Zeitpunkt zu veröffentlichen, klicken Sie auf „Speichern“.	['release']	{'release': 'Release'}	['release']
61	{'skill': 'Qualifikation'}	These skills are specified in the resource request.	Diese Qualifikationen sind in der Ressourcenanforderung spezifiziert.	['skill']	{'skill': 'Qualifikationen'}	['qualifikation']
62	{'provider': 'Provider'}	The provider has removed the data product from the available data product list.	Der Provider hat das Datenprodukt aus der Liste der verfügbaren Datenprodukte entfernt.	['provider']	{'provider': 'Provider'}	['provider']
63	{'data provider': 'Datenprovider'}	To activate a data provider profile for which you’ve received an activation key, click Activate, enter the key, and click Activate.	Um ein Datenprovider-Profil zu aktivieren, für das Sie einen Aktivierungsschlüssel erhalten haben, klicken Sie auf „Aktivieren“, geben Sie den Schlüssel ein und klicken Sie anschließend erneut auf „Aktivieren“.	['data provider']	{'data provider': 'Datenprovider'}	['datenprovider']
64	{'Menu': 'Menü'}	Rename a column by clicking MenuChange Business Name	Benennen Sie eine Spalte um, indem Sie im Menü auf „Geschäftsname ändern“ klicken.	['Menu']	{'Menu': 'Menü'}	['menü']
65	{'allocation': 'Zuordnung'}	Dynamic Memory Allocation for Data Flows	Dynamische Speicherzuordnung für Datenströme	['allocation']	{'allocation': 'Speicherzuordnung'}	['speicherzuordnungen']
66	{'data provider': 'Datenprovider'}	To manage your products and licenses, to publish new releases, and to maintain your data provider profile page, the Data Sharing Cockpit offers you tailored apps for each task and workflow.	Um Ihre Produkte und Lizenzen zu verwalten, neue Versionen zu veröffentlichen und Ihr Datenprovider-Profil zu pflegen, bietet Ihnen das Data Sharing Cockpit maßgeschneiderte Apps für jede Aufgabe und jeden Arbeitsablauf an.	['data provider']	{'data provider': 'Datenprovider'}	['datenprovider']
67	{'release': 'Release'}	Save or publish a release.	Speichern oder veröffentlichen Sie ein Release.	['release']	{'release': 'Release'}	['release']
68	{'message': 'Nachricht'}	Read the messages to understand if there are any errors or warnings, if the actions you performed on the template were successful, if further action is required from you, and so on.	Lesen Sie die Nachrichten, um festzustellen, ob es Fehler oder Warnungen gibt, ob die von Ihnen an der Vorlage durchgeführten Aktionen erfolgreich waren, ob weitere Maßnahmen von Ihnen erforderlich sind, und so weiter.	['message']	{'message': 'Nachrichten'}	['nachricht']
69	{'space': 'Platz'}	Resolve the memory issues by deleting unecessary data in your space or by assigning more memory to your space.	Lösen Sie die Speicherprobleme, indem Sie unnötige Daten in Ihrem Speicherplatz löschen oder Ihrem Speicherplatz mehr Speicher zuweisen.	['space']	{'space': 'Speicherplatz'}	['speicherplatz']
70	{'end user': 'Endbenutzer'}	Choose the Go to App button to open the end user app.	Klicken Sie auf die Schaltfläche „Zur App gehen“, um die Endbenutzer-App zu öffnen.	['end user']	{'end user': 'Endbenutzer'}	['endbenutzer']
71	{'data provider': 'Datenprovider'}	Enter an email address for the internal communication between you as the data provider and SAP.	Geben Sie eine E-Mail-Adresse für die interne Kommunikation zwischen Ihnen als Datenprovider und SAP ein.	['data provider']	{'data provider': 'Datenprovider'}	['datenprovider']
72	{'data provider': 'Datenprovider'}	You can now switch to the data provider profile.	Sie können jetzt zum Profil des Datenproviders wechseln.	['data provider']	{'data provider': 'Datenproviders'}	['datenprovider']
73	{'create': 'erstellen'}	Create Local Tables	Lokale Tabellen erstellen	['create']	{'create': '▔'}	['▔ertrat<sos>']
74	{'create': 'erstellen'}	If the required connection is not available for selection, you or an administrator need to create the tunnel connection before you can create the SAP BW/4HANA Model Transfer connection.	Wenn die erforderliche Verbindung nicht zur Auswahl steht, müssen Sie oder ein Administrator zunächst die Tunnelverbindung erstellen, bevor Sie die SAP BW/4HANA Model Transfer-Verbindung einrichten können.	['create']	{'create': 'erstellen'}	['erstellen']
75	{'space': 'Space'}	Set your space priority.	Legen Sie Ihre Priorität für den Space fest.	['space']	{'space': 'Space'}	['space']
76	{'breadcrumb': 'Klickpfad'}	Click the consumption model name in the shell bar breadcrumbs to return to it, and then click the  Perspectives tab.	Klicken Sie im Klickpfad der Shell-Leiste auf den Namen des Verbrauchsmodells, um dorthin zurückzukehren, und klicken Sie dann auf die Registerkarte „Perspektiven“.	['breadcrumb']	{'breadcrumb': 'Klickpfad'}	['klickpfad']
77	{'provider': 'Provider'}	You can edit the predefined email and then send it to the provider who then gets in touch with you.	Sie können die vordefinierte E-Mail bearbeiten und sie anschließend an den Provider senden, der sich dann mit Ihnen in Verbindung setzt.	['provider']	{'provider': 'Provider'}	['provider']
78	{'incident': 'Meldung'}	For the Heath Check Support  access category, the incident ID references SAP internal incidents raised by automatic health checks.	Für die Zugriffskategorie „Health Check Support“ bezieht sich die Meldungs-ID auf interne SAP-Meldungen, die durch automatische Gesundheitsprüfungen ausgelöst werden.	['incident']	{'incident': 'Meldungs-ID'}	['meldung']
79	{'business name': 'betriebswirtschaftlicher Name'}	Modify the properties of objects, including providing business names for them to make them easier to identify and use for non-technical users.	Ändern Sie die Eigenschaften von Objekten, einschließlich der Vergabe betriebswirtschaftlicher Namen, um sie für nicht-technische Benutzer einfacher identifizierbar und nutzbar zu machen.	['business name']	{'business name': 'betriebswirtschaftlicher Namen'}	['betriebswirtschaftlichern name']
80	{'work center': 'Arbeitsplatz'}	You can view all top-level materials of the work center.	Sie können alle Materialien der obersten Ebene des Arbeitsplatzes einsehen.	['work center']	{'work center': 'Arbeitsplatz'}	['arbeitsplatz']
81	{'residence period': 'Residenzzeit'}	The residence period is part of the overall retention period.	Die Residenzzeit ist Teil der gesamten Aufbewahrungsfrist.	['residence period']	{'residence period': 'Residenzzeit'}	['residenzzeien']
82	{'trigger': 'Auslöser'}	[if Enable Compound Triggers = true] Flush Threshold of Compound Triggers	[Wenn komplexe Auslöser aktiviert sind = wahr] Schwellenwert zum Löschen komplexer Auslöser	['trigger']	{'trigger': 'Auslöser'}	['auslöser']
83	{'identifier': 'Identifikator', 'ID': 'ID'}	If such a column does not exist, you may choose to create a calculated column and concatenate values from other columns into it to provide unique identifier values.	Wenn eine solche Spalte nicht existiert, können Sie eine berechnete Spalte erstellen und Werte aus anderen Spalten darin verketten, um eindeutige Identifikatoren zu generieren.	['identifier', 'ID']	{'identifier': 'Identifikatoren', 'ID': 'Identifikatoren'}	['identifatatoren', 'identifatatoren']
84	{'start': 'Start'}	If no period range is defined, the start date of the Period Range selection defaults to the current date.	Wenn kein Zeitraum definiert ist, wird das Startdatum der Zeitraum-Auswahl standardmäßig auf das aktuelle Datum gesetzt.	['start']	{'start': 'Startdatum'}	['startdatum']
85	{'key mapping': 'Schlüsselzuordnung'}	If switched on, it indicates that each data record of the currently opened business entity finds a match in the selected target business entity with the configured key mapping.	Wenn es aktiviert ist, zeigt es an, dass jeder Datensatz der aktuell geöffneten Geschäftsentität eine Entsprechung in der ausgewählten Zielgeschäftsentität findet – basierend auf der konfigurierten Schlüsselzuordnung.	['key mapping']	{'key mapping': 'Schlüsselzuordnung'}	['schlüsselzuordnungen']
