	terms	src_raw	mt_raw	src_terms	alg_terms	norm_tgt_terms
287	{'access control': 'Zugriffskontrolle'}	The column containing users ids must be selected as the Principal Name Column in your data access control.	Die Spalte, die die Benutzer-IDs enthält, muss in Ihrer Zugriffskontrolle als Hauptnamen-Spalte festgelegt werden.	['access control']	{'access control': 'Zugriffskontrolle'}	['zugriffskontrolle']
288	{'notification': 'Benachrichtigung'}	List of Notifications	Liste der Benachrichtigungen	['notification']	{'notification': 'Benachrichtigungen'}	['benachrichtigung']
289	{'create': 'anlegen'}	Click AddCreate User.	Klicken Sie auf „Benutzer anlegen“.	['create']	{'create': '▔'}	['▔ertrat<sos>']
290	{'space': 'Space'}	Save your space.	Speichern Sie Ihren Space.	['space']	{'space': 'Space'}	['space']
291	{'document': 'Beleg'}	Documents - Communication Status	Dokumente – Kommunikationsstatus	['document']	{'document': 'Dokumente'}	['dokument']
292	{'request': 'Antrag'}	Click Submit Request.	Klicken Sie auf „Antrag einreichen“.	['request']	{'request': 'Antrag'}	['antrag']
293	{'grouping rule': 'Gruppierungsregel'}	You can trigger the creation of new grouping rules, search for existing grouping rules, and delete grouping rules that are no longer required.	Sie können die Erstellung neuer Gruppierungsregeln auslösen, nach bestehenden Gruppierungsregeln suchen und nicht mehr benötigte Gruppierungsregeln löschen.	['grouping rule']	{'grouping rule': 'Gruppierungsregeln'}	['grupperungsregeln']
294	{'execute': 'ausführen'}	Check the status before you execute changes.	Überprüfen Sie den Status, bevor Sie Änderungen vornehmen.	['execute']	{'execute': 'Änderungen'}	['änderung']
295	{'asset': 'Anlage'}	Navigate from Asset Depreciation Values.	Navigieren Sie von den Abschreibungswerten der Anlage aus weiter.	['asset']	{'asset': 'Anlage'}	['anlage']
296	{'assignment': 'Einsatz'}	You have the following options to show assignment changes:	Sie haben folgende Optionen, um Änderungen im Einsatz anzuzeigen:	['assignment']	{'assignment': 'Einsatz'}	['einsatz']
297	{'requirement': 'Bedarf'}	Create a Custom Requirement	Erstellen Sie einen benutzerdefinierten Bedarf	['requirement']	{'requirement': 'Bedarf'}	['bedarf']
298	{'comment': 'Comment'}	Click to add file comment	Klicken Sie hier, um einen Kommentar zur Datei hinzuzufügen.	['comment']	{'comment': 'Kommentar'}	['kommentar']
299	{'Procedure': 'Verfahren', 'create': 'erstellen'}	This procedure provides the option to create SAP HANA virtual tables in the open SQL schema that refer to objects in data lake.	Dieses Verfahren ermöglicht es, virtuelle SAP HANA-Tabellen im offenen SQL-Schema zu erstellen, die auf Objekte im Data Lake verweisen.	['Procedure', 'create']	{'Procedure': 'Verfahren', 'create': 'erstellen'}	['verfahren', 'erstellen']
300	{'cost component': 'Kostenkomponente'}	Enter the name of the cost component in the Name field.	Geben Sie den Namen der Kostenkomponente in das Feld „Name“ ein.	['cost component']	{'cost component': 'Kostenkomponente'}	['kostenkomponenten']
301	{'issue': 'Issue'}	Create an issue:	Ein Issue erstellen:	['issue']	{'issue': 'Issue'}	['yssuen']
302	{'query': 'Abfrage'}	Save the query.	Speichern Sie die Abfrage.	['query']	{'query': 'Abfrage'}	['abfrage']
303	{'workflow': 'Workflow', 'create': 'anlegen'}	Create Workflow for Sourcing Projects	Workflow für Beschaffungsprojekte erstellen	['workflow', 'create']	{'workflow': 'Workflow', 'create': 'erstellen'}	['workflow', 'erstellen']
304	{'scope': 'Umfang'}	Delete a scope.	Einen Umfang entfernen.	['scope']	{'scope': 'Umfang'}	['umfang']
305	{'space': 'Space'}	Save the space.	Speichere den Speicherplatz.	['space']	{'space': 'Speicherplatz'}	['speicherplatz']
306	{'tenant': 'Mandant'}	URL of the SuccessFactors Employee Central tenant	URL des Mandanten von SuccessFactors Employee Central	['tenant']	{'tenant': 'Mandanten'}	['mandant']
307	{'status': 'Status'}	Indicates the current status of a master data record.	Gibt den aktuellen Status eines Stammdatensatzes an.	['status']	{'status': 'Status'}	['status']
308	{'stage': 'Abschnitt'}	Navigate to Stages.	Gehe zum Abschnitt „Stages“.	['stage']	{'stage': 'Stages'}	['stages']
309	{'source': 'Source'}	Activation of Data Source:	Aktivierung der Datenquelle:	['source']	{'source': 'Datenquelle'}	['datenquellen']
310	{'level': 'Stufe'}	Packaging levels are used for the following purposes:	Verpackungsstufen werden für die folgenden Zwecke eingesetzt:	['level']	{'level': 'Verpackungsstufen'}	['verpackunstufen']
311	{'create': 'erstellen'}	Create a Target Table in Data Flow	Erstellen Sie eine Zieltabelle im Datenfluss.	['create']	{'create': 'Zieltabelle'}	['zieltabelle']
312	{'mapping': 'Zuordnung'}	Enter an optional description for the mapping.	Geben Sie eine optionale Beschreibung für die Zuordnung ein.	['mapping']	{'mapping': 'Zuordnung'}	['zuordnung']
313	{'location': 'Ort'}	Specify the locations for the following options:	Geben Sie die Standorte für die folgenden Optionen an:	['location']	{'location': 'Standorte'}	['standort']
314	{'classification': 'Klassifikation'}	· Select Classification	· Klassifikation auswählen	['classification']	{'classification': 'Klassifikation'}	['klassifikation']
315	{'document type': 'Dokumentart'}	To specify the document type as scheduling agreement.	Die Dokumentart als Planungsvereinbarung festlegen.	['document type']	{'document type': 'Dokumentart'}	['dokumentart']
316	{'term': 'Term'}	Enter the term.	Geben Sie den Term ein.	['term']	{'term': 'Term'}	['term']
317	{'create': 'erstellen'}	Go to the Filter tab Select Create filter and define your filter conditions:	Gehen Sie zur Registerkarte „Filter“, wählen Sie „Filter erstellen“ aus und definieren Sie Ihre Filterbedingungen.	['create']	{'create': 'erstellen'}	['erstellen']
318	{'schedule': 'Terminplan'}	Review the schedule.	Überprüfen Sie den Terminplan.	['schedule']	{'schedule': 'Terminplan'}	['terminplan']
319	{'release': 'Release'}	Edit a Release	Einen Release bearbeiten	['release']	{'release': 'Release'}	['release']
320	{'limit': 'Grenzwert'}	For clearing, the lower of the limit defined for your user and the limit defined for your business partner applies.You can also define amount limits for your Financial Accounting users.	Für die Abstimmung gilt der niedrigere der beiden Grenzwerte, die für Ihren Benutzer bzw. Ihren Geschäftspartner definiert sind. Sie können zudem Betragsgrenzen für Ihre Benutzer in der Finanzbuchhaltung festlegen.	['limit']	{'limit': '▔'}	['▔ertrat<sos>']
321	{'Group': 'Group', 'group': 'group'}	For more information, see Service Group Publishing.	Für weitere Informationen wenden Sie sich bitte an Service Group Publishing.	['Group', 'group']	{'Group': 'Group', 'group': 'Group'}	['group', 'group']
322	{'income': 'Einnahmen'}	Format for Income Classification	Format für die Einnahmenklassifizierung	['income']	{'income': 'Einnahmen'}	['einnahme']
323	{'access control': 'Zugriffskontrolle'}	You must select one or more columns containing filter criteria as Output Columns in your data access control.	Sie müssen in Ihrer Zugriffskontrolle eine oder mehrere Spalten, die Filterkriterien enthalten, als Ausgabespalten auswählen.	['access control']	{'access control': 'Zugriffskontrolle'}	['zugriffskontrolle']
324	{'space': 'Space'}	Name of the space the product belongs to.	Name des Space, dem das Produkt zugeordnet ist.	['space']	{'space': 'Space'}	['space']
325	{'restriction': 'Einschränkung'}	Restrictions on Capture:	Einschränkungen bei der Erfassung:	['restriction']	{'restriction': 'Einschränkungen'}	['einschränkung']
326	{'item': 'Element'}	Long descriptions are available for the following items:	Lange Beschreibungen stehen für die folgenden Elemente zur Verfügung:	['item']	{'item': 'Elemente'}	['element']
327	{'schedule': 'Zeitplan'}	Save the schedule.	Speichern Sie den Zeitplan.	['schedule']	{'schedule': 'Zeitplan'}	['zeitplan']
328	{'owner': 'Eigentümer'}	Click Select Owner.	Klicken Sie auf „Eigentümer auswählen“.	['owner']	{'owner': 'Eigentümer'}	['eigentümer']
329	{'sequence': 'Abfolge'}	Clear as Sequence	Klar wie eine Abfolge	['sequence']	{'sequence': 'Abfolge'}	['abfolge']
330	{'joint venture accounting': 'Joint Venture Accounting', 'Accounting': 'Accounting'}	Setting up Joint Venture Accounting Cost Objects:	Einrichtung von Kostenobjekten für die Joint Venture Accounting	['joint venture accounting', 'Accounting']	{'joint venture accounting': 'Joint Venture Accounting', 'Accounting': 'Accounting'}	['joint venturen accounting', 'accounting']
331	{'load': 'Load'}	Download the following files:	Laden Sie die folgenden Dateien herunter:	['load']	{'load': 'Laden'}	['laden']
332	{'template': 'Vorlage'}	For more information about creating an equipment template, see .	Für weitere Informationen zum Erstellen einer Ausrüstungsvorlage siehe .	['template']	{'template': 'Vorlage'}	['vorlage']
333	{'batch': 'Batch', 'call': 'Call'}	On the SAP Easy Access menu, choose  Joint venture accounting  Actual posting  Cash call batch ses.	Im SAP Easy Access Menü wählen Sie „Gemeinschaftsunternehmen-Buchhaltung“, „Ist-Buchung“ und „Cash-Call-Batch-Sitzung“ aus.	['batch', 'call']	{'batch': 'Sitzung', 'call': 'Sitzung'}	['sitzung', 'sitzung']
334	{'type': 'Typ'}	Profile types include the following:	Profiltypen umfassen Folgendes:	['type']	{'type': 'Profiltypen'}	['profiltypen']
335	{'project manager': 'Projektleiter', 'requested': 'angefragt'}	It allows you to create an assignment exactly as requested by the project manager.This action is available if the project manager requested a specific resource and no resource has been assigned to the request yet.	Es ermöglicht Ihnen, eine Aufgabe genau so zu erstellen, wie es der Projektleiter angefordert hat. Diese Funktion steht zur Verfügung, wenn der Projektleiter eine bestimmte Ressource angefordert hat und dieser Anfrage bisher noch keine Ressource zugewiesen wurde.	['project manager', 'requested']	{'project manager': 'Projektleiter', 'requested': 'angefordert'}	['projektleiter', 'anfordern']
336	{'document class': 'Belegklasse', 'select': 'auswählen'}	The characteristic value columns list the values that have been maintained for the characteristics defined for the document class.You can select the characteristic value by entering the value manually (possible entries are then suggested by the app) or, alternatively, by choosing the value in the subsequent characteristic dialog screen.	Die Spalten der Merkmalswerte listen die Werte auf, die für die in der Belegklasse definierten Merkmale gepflegt wurden. Sie können den Merkmalswert entweder manuell eingeben – dabei schlägt Ihnen die App mögliche Eingaben vor – oder alternativ den Wert im nachfolgenden Merkmalsdialog auswählen.	['document class', 'select']	{'document class': 'Belegklasse', 'select': 'auswählen'}	['belegklassen', 'auswählen']
337	{'action': 'Aktion', 'Action': 'Aktion'}	This column shows you if quick actions are available for a resource request.If a quick action is available, a link is shown.	Diese Spalte zeigt Ihnen, ob für eine Ressourcenanfrage schnelle Aktionen verfügbar sind. Ist eine schnelle Aktion verfügbar, wird ein Link angezeigt.	['action', 'Action']	{'action': 'Aktionen', 'Action': 'Aktionen'}	['aktion', 'aktion']
338	{'obsolete': 'obsolet'}	Indicates whether the MRS item is obsolete.	Gibt an, ob der MRS-Eintrag veraltet ist.	['obsolete']	{'obsolete': 'veraltet'}	['veraltet']
339	{'release': 'Release'}	Locking a Release	Ein Release sperren	['release']	{'release': 'Release'}	['release']
340	{'audit log': 'Audit-Protokoll'}	Audit log missing detailed information	Im Audit-Protokoll fehlen detaillierte Informationen.	['audit log']	{'audit log': 'Audit-Protokoll'}	['audit']
341	{'transaction': 'Transaktion'}	<description of the transaction>	<Beschreibung der Transaktion>	['transaction']	{'transaction': '▔'}	['▔ertrat<sos>']
342	{'apply': 'anwenden'}	Click Apply to save your new tile.	Klicken Sie auf „Anwenden“, um Ihre neue Kachel zu speichern.	['apply']	{'apply': 'Anwenden'}	['anwenden']
343	{'space': 'Space'}	The following views are made available in this space:	Die folgenden Ansichten stehen in diesem Space zur Verfügung:	['space']	{'space': 'Space'}	['space']
344	{'section': 'Abschnitt'}	In the Trusted Origins section, choose between the following options:	Im Abschnitt „Vertrauenswürdige Ursprünge“ können Sie zwischen den folgenden Optionen auswählen:	['section']	{'section': 'Abschnitt'}	['abschnitt']
345	{'operation': 'Vorgang'}	The dependencies are assigned to the operation.	Die Abhängigkeiten werden dem Vorgang zugeordnet.	['operation']	{'operation': 'Vorgang'}	['vorgang']
346	{'template': 'Vorlage'}	Doc.Template Name in Structure	Dokumentvorlagenname in der Struktur	['template']	{'template': 'Dokumentvorlagenname'}	['dokumentvorlagenname']
347	{'primary contact': 'Hauptansprechpartner'}	Primary Contact Indicator	Hauptansprechpartner-Kennzeichen	['primary contact']	{'primary contact': 'Hauptansprechpartner'}	['hauptansprechpartner']
348	{'message': 'Nachricht'}	These messages are enabled by default.	Diese Nachrichten sind standardmäßig aktiviert.	['message']	{'message': 'Nachrichten'}	['nachricht']
349	{'transfer': 'Übertragung', 'check': 'Prüfung'}	Open Check and Transfer of Staffing Assignments.	Überprüfung und Übertragung von Personaleinsatzplanungen freigeben.	['transfer', 'check']	{'transfer': 'Übertragung', 'check': 'Überprüfung'}	['übertragung', 'überprüfung']
350	{'compliance requirement': 'Compliance-Anforderung'}	Tasks are created in the compliance requirement.	Aufgaben werden im Rahmen der Compliance-Anforderung erstellt.	['compliance requirement']	{'compliance requirement': 'Compliance-Anforderung'}	['compliance']
351	{'run': 'Lauf'}	Run In Simulation	In der Simulation ausführen	['run']	{'run': 'ausführen'}	['ausführen']
352	{'transfer amount': 'Überweisungsbetrag'}	Cash Pool Minimum Transfer Amount	Mindestüberweisungsbetrag für den Cash Pool	['transfer amount']	{'transfer amount': 'Mindestüberweisungsbetrag'}	['mindestüberweisungsbetragen']
353	{'unit of measure': 'Mengeneinheit'}	This class is used to convert a quantity from one unit of measurement to another.	Diese Klasse dient dazu, eine Größe von einer Mengeneinheit in eine andere umzurechnen.	['unit of measure']	{'unit of measure': 'Mengeneinheit'}	['mengeneinheien']
354	{'project manager': 'Projektleiter', 'requested': 'angefragt', 'staffed': 'Person zugeordnet'}	If a resource has been requested and the request has not yet been staffed, you'll see a Quick Assignment link in the Actions column.This allows you to create the assignment exactly as requested by the project manager.	Wenn eine Ressource angefordert wurde und der Anfrage noch keine Person zugeordnet wurde, sehen Sie einen Link „Schnelle Zuweisung“ in der Spalte „Aktionen“. Dies ermöglicht es Ihnen, die Zuweisung genau so zu erstellen, wie es der Projektleiter angefordert hat.	['project manager', 'requested', 'staffed']	{'project manager': 'Projektleiter', 'requested': 'angefordert', 'staffed': 'zugeordnet'}	['projektleiter', 'anfordern', 'zuordnen']
355	{'connectivity': 'Konnektivität'}	Under Connectivity, choose Destinations.	Wählen Sie unter „Konnektivität“ die Ziele aus.	['connectivity']	{'connectivity': 'Konnektivität'}	['konnektivität']
356	{'open': 'offen'}	Open port in Cloud Foundry environments	Port in Cloud Foundry-Umgebungen öffnen	['open']	{'open': 'öffnen'}	['öffnen']
357	{'create': 'erstellen'}	Choose Create new contract from the dropdown list.	Wählen Sie „Neuen Vertrag erstellen“ aus der Dropdown-Liste aus.	['create']	{'create': 'erstellen'}	['erstellen']
358	{'space': 'Space'}	You can decide how important your space is compared to other spaces.	Sie können entscheiden, wie wichtig Ihr Space im Vergleich zu anderen Spaces ist.	['space']	{'space': 'Spaces'}	['space']
359	{'business user': 'Geschäftsbenutzer'}	To add a business user, proceed as follows:	Um einen Geschäftsbenutzer hinzuzufügen, gehen Sie wie folgt vor:	['business user']	{'business user': 'Geschäftsbenutzer'}	['geschäftsbenutzer']
360	{'location': 'Standort'}	Select a location.	Wählen Sie einen Standort aus.	['location']	{'location': 'Standort'}	['standort']
361	{'payment details': 'Zahlungsdetails'}	You can choose one of the following options for managing payment details:	Sie können eine der folgenden Optionen zur Verwaltung Ihrer Zahlungsdetails auswählen:	['payment details']	{'payment details': 'Zahlungsdetails'}	['zahlungsdetails']
362	{'consumption model': 'Verbrauchsmodell'}	The exposed dimension sources can the be used in your consumption models.	Die zugänglichen Dimensionsquellen können in Ihren Verbrauchsmodellen eingesetzt werden.	['consumption model']	{'consumption model': 'Verbrauchsmodellen'}	['verbrauchsmodellen']
363	{'document': 'Beleg'}	Specifies the revision date of the document.	Gibt das Überarbeitungsdatum des Dokuments an.	['document']	{'document': 'Dokuments'}	['dokument']
364	{'create': 'erstellen'}	Create and delete teams.	Teams erstellen und löschen.	['create']	{'create': 'erstellen'}	['erstellen']
365	{'transfer': 'Transfer'}	You can also enter your own mass transfer ID.	Sie können auch Ihre eigene ID für den Massentransfer eingeben.	['transfer']	{'transfer': 'Massentransfer'}	['massentransfer']
366	{'scope': 'Konsolidierungskreis'}	Go to Scope Builder.	Gehe zum Konsolidierungskreis-Editor.	['scope']	{'scope': 'Konsolidierungskreis-Editor'}	['konsolidierungskreisen']
367	{'type': 'Typ'}	Choose the relative date type.	Wählen Sie den relativen Datentyp aus.	['type']	{'type': 'Datentyp'}	['datentyp']
368	{'property': 'Immobilie'}	Enter Additional Property Information	Geben Sie weitere Informationen zur Immobilie ein.	['property']	{'property': 'Immobilie'}	['immobilie']
369	{'schedule': 'Terminplan'}	Build a schedule by adding and removing order operations	Erstelle einen Terminplan, indem du Auftragsoperationen hinzufügst oder entfernst.	['schedule']	{'schedule': 'Terminplan'}	['terminplan']
370	{'query': 'Abfrage'}	The end date and time for the query.	Das Enddatum und die Endzeit der Abfrage.	['query']	{'query': 'Abfrage'}	['abfrage']
371	{'association': 'Zuordnung'}	Associations between entities	Beziehungen zwischen Entitäten	['association']	{'association': 'Beziehungen'}	['beziehung']
372	{'batch': 'Charge'}	You can perform batch postings for the activities.	Sie können Chargenbuchungen für die Aktivitäten durchführen.	['batch']	{'batch': 'Chargenbuchungen'}	['chargenbuchung']
373	{'history': 'Verlauf'}	The history displays information such as:	Der Verlauf zeigt Informationen wie z. B. folgende an:	['history']	{'history': 'Verlauf'}	['verlauf']
374	{'report': 'Bericht'}	Click on the reporting task you want to process.	Klicken Sie auf die Berichtsaufgabe, die Sie bearbeiten möchten.	['report']	{'report': 'Berichtsaufgabe'}	['berichtsaufgaben']
375	{'business name': 'betriebswirtschaftlicher Name'}	Dimensions are used to group data whose content is logicallyBy default, you see your object’s business name.	Dimensionen werden verwendet, um Daten zu gruppieren, deren Inhalt logisch zusammenhängt. Standardmäßig wird der betriebswirtschaftliche Name Ihres Objekts angezeigt.	['business name']	{'business name': 'betriebswirtschaftliche Name'}	['betriebswirtschaftlichen name']
376	{'create': 'erstellen'}	Create and manage requisitions using Microsoft Excel	Erstellen und verwalten Sie Anforderungen mit Microsoft Excel.	['create']	{'create': 'Erstellen'}	['erstellen']
377	{'service': 'Service'}	Create a Service Key	Erstelle einen Service-Schlüssel	['service']	{'service': 'Service'}	['service']
378	{'audit': 'Audit'}	Select the Store Audit tab page.	Wählen Sie die Registerkarte „Store-Audit“ aus.	['audit']	{'audit': 'Store-Audit'}	['store']
379	{'scenario': 'Szenario'}	Intelligent Scenarios Name	Intelligente Szenarien – Name	['scenario']	{'scenario': 'Szenarien'}	['szenarienen']
380	{'item': 'Element'}	Select the item you want to change.	Wählen Sie das Element aus, das Sie ändern möchten.	['item']	{'item': 'Element'}	['element']
381	{'display': 'Anzeige'}	173 Display Phantom Hierarchy	173 Anzeige der Phantom-Hierarchie	['display']	{'display': 'Anzeige'}	['anzeige']
382	{'document type': 'Dokumentenart'}	Change the document type.	Ändern Sie die Dokumentenart.	['document type']	{'document type': 'Dokumentenart'}	['dokumentenaren']
383	{'report': 'Report'}	The report does not display any data.	Der Report zeigt keine Daten an.	['report']	{'report': 'Report'}	['report']
384	{'package': 'Paket'}	You can define the following which applies to the packages:	Sie können Folgendes definieren, das für die Pakete gilt:	['package']	{'package': 'Pakete'}	['paket']
385	{'access': 'Zugriff'}	For a simple step-by-step guide see Accessing your HDI container .	Für eine einfache Schritt-für-Schritt-Anleitung siehe den Zugriff auf Ihren HDI-Container.	['access']	{'access': 'Zugriff'}	['zugriff']
386	{'origin': 'Ursprung'}	Origin of Rule	Ursprung der Regel	['origin']	{'origin': 'Ursprung'}	['ursprung']
387	{'forecast': 'Forecast'}	Search for forecast.	Suche nach dem Forecast.	['forecast']	{'forecast': 'Forecast'}	['forecaen']
388	{'asset': 'Anlage'}	Navigate to the superior asset.	Navigieren Sie zur übergeordneten Anlage.	['asset']	{'asset': 'Anlage'}	['anlage']
389	{'indicator': 'Indikator'}	There are two types of busy indicator:	Es gibt zwei Arten von Belegungsindikatoren.	['indicator']	{'indicator': 'Belegungsindikatoren'}	['belenngsindikatoren']
390	{'reference characteristic': 'Bezugsmerkmal'}	Handling of reference Characteristics.	Behandlung von Bezugsmerkmalen	['reference characteristic']	{'reference characteristic': 'Bezugsmerkmalen'}	['bezugsmerkmalen']
391	{'document': 'Beleg'}	the document tab is clicked,	Die Registerkarte „Beleg“ wird angeklickt.	['document']	{'document': 'Beleg'}	['beleg']
392	{'work package': 'Work-Package'}	A work package combines the following information:	Ein Work-Package fasst die folgenden Informationen zusammen:	['work package']	{'work package': 'Work-Package'}	['work']
393	{'create': 'erstellen'}	You just need to create a Data Provider Profile.	Du musst lediglich ein Datenanbieterprofil erstellen.	['create']	{'create': 'erstellen'}	['erstellen']
394	{'item': 'Artikel'}	To add an item, select the item from the Items list.	Um einen Artikel hinzuzufügen, wählen Sie diesen aus der Artikel-Liste aus.	['item']	{'item': 'Artikel'}	['artikel']
395	{'time frame': 'Zeitraum'}	You can define a time frame in the following ways:	Sie können einen Zeitraum auf folgende Weise definieren:	['time frame']	{'time frame': 'Zeitraum'}	['zeitraum']
396	{'panel': 'Bereich'}	If the Source Browser panel is not visible on the left of the screen, click Source Browser in the toolbar to show it.	Wenn der Bereich des Source Browsers nicht links auf dem Bildschirm sichtbar ist, klicken Sie in der Symbolleiste auf „Source Browser“, um ihn anzuzeigen.	['panel']	{'panel': 'Bereich'}	['bereich']
397	{'facility': 'Objekt'}	Provides general information about the facility.	Bietet allgemeine Informationen über das Objekt an.	['facility']	{'facility': 'Objekt'}	['objekt']
398	{'attribute type': 'Attributstyp'}	Select the attribute type from the following options:	Wählen Sie den Attributstyp aus den folgenden Optionen aus:	['attribute type']	{'attribute type': 'Attributstyp'}	['attributstyp']
399	{'entitlement': 'Anrecht'}	Displays the consumption data for the entitlement.	Zeigt die Verbrauchsdaten für das Anrecht an.	['entitlement']	{'entitlement': 'Anrecht'}	['anrecht']
400	{'layer': 'Layer', 'item': 'Artikel'}	Displays the available item value on this layer.	Zeigt den verfügbaren Wert des Artikels auf diesem Layer an.	['layer', 'item']	{'layer': 'Layer', 'item': 'Artikel'}	['layer', 'artikel']
401	{'connector': 'Konnektor'}	Check the state of the connectors:	Überprüfen Sie den Zustand der Konnektoren.	['connector']	{'connector': 'Konnektoren'}	['konnektor']
402	{'package': 'Packstück'}	The package contents are displayed.	Der Inhalt des Packstücks wird angezeigt.	['package']	{'package': 'Packstücks'}	['packstück']
403	{'message': 'Meldung'}	The X-Message is no longer raised.	Die X-Meldung wird nicht mehr ausgelöst.	['message']	{'message': 'Meldung'}	['meldung']
404	{'message': 'Meldung'}	A system messageconfirming that the changes have been saved appears.	Es erscheint eine Systemmeldung, die bestätigt, dass die Änderungen gespeichert wurden.	['message']	{'message': 'Systemmeldung'}	['systemmeldung']
405	{'process': 'Process'}	Process Additional information data	Verarbeiten Sie zusätzliche Informationsdaten.	['process']	{'process': 'Verarbeiten'}	['verarbeit']
406	{'order': 'Order'}	Order Fulfillment Cockpit	Bestellabwicklungs-Cockpit	['order']	{'order': 'Bestellabwicklungs'}	['bestellabwicklungen']
407	{'monitoring': 'Überwachung'}	This is a monitoring list.	Dies ist eine Überwachungsliste.	['monitoring']	{'monitoring': 'Überwachungsliste'}	['kberwachungsliste']
408	{'restriction': 'Einschränkung'}	Limitations and Restrictions	Einschränkungen und Beschränkungen	['restriction']	{'restriction': 'Einschränkungen'}	['einschränkung']
409	{'create': 'erstellen', 'type': 'Typ'}	You can create the following two types of hierarchies:	Sie können die folgenden beiden Hierarchietypen erstellen:	['create', 'type']	{'create': 'erstellen', 'type': 'Hierarchietypen'}	['erstellen', 'hierarchietypen']
