	terms	src_raw	mt_raw	src_terms	alg_terms	norm_tgt_terms
0	{'container': 'container'}	Why would you need to access HDI containers?	¿Por qué necesitarías acceder a los contenedores de HDI?	['container']	{'container': 'contenedores'}	['contenedor']
1	{'parallel processing': 'procesamiento paralelo', 'job': 'job'}	Decide if you want to use parallel processing for this job:	Decida si desea utilizar el procesamiento paralelo para esta tarea.	['parallel processing', 'job']	{'parallel processing': 'procesamiento paralelo', 'job': 'tarea'}	['procesamiento paralelo', 'tarea']
2	{'report': 'report'}	Displays in the list report billing elements with or without planned prepayments.	El informe en forma de lista muestra los elementos de facturación, ya sea con o sin pagos anticipados planificados.	['report']	{'report': 'informe'}	['informe']
3	{'average': 'media'}	The KPI shows the average age in days of assets under construction, and individual items are listed below.	El KPI muestra la edad media en días de los activos en construcción, y los elementos individuales se enumeran a continuación.	['average']	{'average': 'media'}	['medio']
4	{'item': 'elemento'}	Once exported, an item stays in the software collection for its entire lifecycle.	Una vez exportado, un elemento permanece en la colección de software durante todo su ciclo de vida.	['item']	{'item': 'elemento'}	['elemento']
5	{'explosion': 'desglose'}	If it's an assembly, the explosion continues to the lowest level.	Si se trata de un ensamblaje, la explosión se extiende hasta el nivel más inferior.	['explosion']	{'explosion': 'explosión'}	['explosión']
6	{'add': 'agregar'}	Add a New OAuth Client (Non-SAP Data Center)	Añadir un nuevo cliente OAuth (Centro de datos no perteneciente a SAP)	['add']	{'add': 'Añadir'}	['añadir']
7	{'range': 'intervalo'}	Each compute block provides a certain number of vCPUs and a range of 60 to 64 GB of RAM, depending on the hyperscaler.	Cada bloque de cómputo proporciona un número determinado de vCPU y un rango de 60 a 64 GB de RAM, en función del hiperescalador.	['range']	{'range': 'rango'}	['rango']
8	{'source': 'fuente'}	Source systems connected to an SAP LT Replication Server are supported down to:	Los sistemas de origen conectados a un servidor de replicación SAP LT están soportados hasta el siguiente nivel:	['source']	{'source': 'origen'}	['origen']
9	{'template': 'modelo'}	After you create a new template, you will be directed to the template page, to add text blocks to the template.	Después de crear una nueva plantilla, serás redirigido a la página de la plantilla para agregar bloques de texto a la misma.	['template']	{'template': 'plantilla'}	['plantilla']
10	{'source': 'fuente'}	Data is accessed directly from the source (federation) and read from the virtual table.	Los datos se acceden directamente desde la fuente (la federación) y se leen desde la tabla virtual.	['source']	{'source': 'fuente'}	['fuente']
11	{'edit': 'editar'}	Edit Default Waste Generator	Editar el productor de residuos por defecto	['edit']	{'edit': 'Editar'}	['editar']
12	{'reset': 'restablecer'}	Resets the filters.	Reinicia los filtros.	['reset']	{'reset': 'reinicia'}	['reinicia']
13	{'add': 'añadir'}	You can copy existing items or item sets to add new ones to the sourcing project.	Puedes copiar elementos o conjuntos de elementos existentes para añadir otros nuevos al proyecto de aprovisionamiento.	['add']	{'add': 'añadir'}	['añadir']
14	{'incident': 'incidencia'}	Access of this category is not based on individual support cases or incidents.	El acceso a esta categoría no se basa en casos o incidentes de soporte individuales.	['incident']	{'incident': 'incidentes'}	['incidente']
15	{'template': 'modelo'}	Use the dropdown list in the upper left corner of the dialog box to select the search template you want to use.	Utilice la lista desplegable que se encuentra en la esquina superior izquierda de la ventana para seleccionar la plantilla de búsqueda que desee utilizar.	['template']	{'template': 'plantilla'}	['plantilla']
16	{'save': 'guardar'}	To save and deploy your ER model to SAP HANA, choose Deploy.	Para guardar e implementar su modelo ER en SAP HANA, seleccione la opción Desplegar.	['save']	{'save': 'guardar'}	['guardar']
17	{'write off': 'ignorar', 'tab': 'pestaña'}	Confirm the write-off action and verify that the selected items have moved from the To Be Billed tab to the To Be Written Off tab.	"Confirme la acción de amortización y verifique que los elementos seleccionados se han trasladado de la pestaña ""Elementos por facturar"" a la pestaña ""Elementos por amortizar""."	['write off', 'tab']	{'write off': 'amortización', 'tab': 'pestaña'}	['amortización', 'pestaña']
18	{'partner': 'socio', 'rule': 'regla'}	You create an installment plan, if there are one or more open items in the contract account of a business partner and the business partner cannot fulfill the payment obligation within the scope of the usual payment rules.	Creas un plan de pagos si existen una o más partidas abiertas en la cuenta contractual de un socio comercial y este no puede cumplir con la obligación de pago dentro del ámbito de las normas de pago habituales.	['partner', 'rule']	{'partner': 'socio', 'rule': 'normas'}	['socio', 'norma']
19	{'reset': 'restablecer'}	Defines when the valuation takes place and whether it is reset.	Define cuándo se realiza la valoración y si esta se restablece.	['reset']	{'reset': 'restablece'}	['restablecer']
20	{'category': 'tipo'}	Choose Service Part Items as the item category from the Show dropdown list.	"Seleccione la categoría ""Artículos de piezas de servicio"" desde la lista desplegable de ""Mostrar""."	['category']	{'category': 'categoría'}	['categoría']
21	{'schedule': 'programación'}	To filter for order operations that are included in a specific schedule, add the Included in Schedule filter to the filter bar.	"Para filtrar las operaciones de pedidos incluidas en un horario específico, añade el filtro ""Incluido en el horario"" a la barra de filtros."	['schedule']	{'schedule': 'horario'}	['horario']
22	{'edit': 'editar'}	You can only edit headers for Inactive units.	Solo puedes editar los encabezados de las unidades inactivas.	['edit']	{'edit': 'editar'}	['editar']
23	{'completed': 'concluido'}	This overview contains all repair objects that have not been completed yet.	Este resumen incluye todos los objetos de reparación que todavía no han sido completados.	['completed']	{'completed': 'completados'}	['completado']
24	{'pause': 'interrumpir'}	Pause real-time replication to enable editing connection properties.	Pausa la replicación en tiempo real para poder editar las propiedades de conexión.	['pause']	{'pause': 'Pausa'}	['pausa']
25	{'use': 'utilizar'}	Save your business entity to make it available for use in fact models and consumption models.	Guarda tu entidad empresarial para que esté disponible para su uso en modelos de hechos y modelos de consumo.	['use']	{'use': 'uso'}	['uso']
26	{'schedule': 'programación'}	This means that the work center change is only visible in your schedule and is not yet saved in the maintenance order.	Esto significa que el cambio de centro de trabajo solo es visible en tu planificación y todavía no se ha guardado en la orden de mantenimiento.	['schedule']	{'schedule': 'planificación'}	['planificación']
27	{'delete': 'eliminar'}	To delete an activation key, click the first column of the corresponding row and then Delete.	Para eliminar una clave de activación, haz clic en la primera columna de la fila correspondiente y, a continuación, selecciona Eliminar.	['delete']	{'delete': 'Eliminar'}	['eliminar']
28	{'schedule': 'calendario'}	Modify your order schedules to prioritize overdue or late orders.	Modifica tus cronogramas de pedidos para dar prioridad a los pedidos atrasados o retrasados.	['schedule']	{'schedule': 'cronogramas'}	['cronograma']
29	{'work center': 'puesto de trabajo'}	Reviewers do not require any work center assignment.	Los revisores no necesitan estar asignados a ningún centro de trabajo.	['work center']	{'work center': 'centro de trabajo'}	['centro de trabajo']
30	{'customer': 'deudor'}	For correspondence with the customer/supplier	Para la correspondencia con el cliente/proveedor	['customer']	{'customer': 'cliente'}	['cliente']
31	{'range': 'intervalo'}	Within a time range	Dentro de un intervalo de tiempo	['range']	{'range': 'intervalo'}	['intervalo']
32	{'delivery': 'entrega'}	Only one data delivery is provided without any additional corrections or updates.	Solo se proporciona una entrega de datos sin ninguna corrección ni actualización adicional.	['delivery']	{'delivery': 'entrega'}	['entrega']
33	{'processing': 'procesamiento'}	If the credit memos are processed successfully, the system posts a document during the processing of the payment advice note by means of the amount credited and, if necessary, charges are posted.	Si las notas de crédito se procesan correctamente, el sistema registra un documento durante el procesamiento de la nota de aviso de pago mediante el importe acreditado y, si es necesario, se registran los cargos correspondientes.	['processing']	{'processing': 'procesamiento'}	['procesamiento']
34	{'upgrade': 'upgrade'}	Post-upgrade test processes	Procesos de prueba posteriores a la actualización	['upgrade']	{'upgrade': 'actualización'}	['actualización']
35	{'tab': 'pestaña'}	You can see these items on the To Be Written Off  tab and verify that they're non-billable by looking at the Billing Control Category column.	Puedes ver estos elementos en la pestaña «Por Amortizar» y comprobar que no son facturables consultando la columna «Categoría de Control de Facturación».	['tab']	{'tab': 'pestaña'}	['pestaña']
36	{'recurrence pattern': 'patrón de repetición'}	Define Recurrence Pattern	Definir patrón de recurrencia	['recurrence pattern']	{'recurrence pattern': 'patrón de recurrencia'}	['patrón de recurrencia']
37	{'public': 'pública'}	To directly consume data in data flows, the Oracle database must be available on the public internet.	Para consumir datos directamente en los flujos de datos, es necesario que la base de datos Oracle esté disponible en Internet público.	['public']	{'public': 'público'}	['público']
38	{'schedule': 'plan'}	Shows that the object will be activated automatically during the next scheduled data aging run for this object and the aging run is not scheduled for the selected data aging object.	Indica que el objeto se activará automáticamente durante la próxima ejecución programada de envejecimiento de datos correspondiente a este objeto, y que dicha ejecución no está programada para el objeto de envejecimiento de datos seleccionado.	['schedule']	{'schedule': 'programada'}	['programado']
39	{'save': 'guardar'}	Please note that date and time are not included when you save a filter variant.	Tenga en cuenta que al guardar una variante de filtro, la fecha y la hora no se incluyen.	['save']	{'save': 'guardar'}	['guardar']
40	{'default': 'predefinir'}	The attribute can be used to identify bank accounts that belong to the same defaultable counterparty.	El atributo puede utilizarse para identificar las cuentas bancarias que pertenecen a la misma contraparte susceptible de incumplimiento.	['default']	{'default': '▔'}	['▔']
41	{'reset': 'restablecer'}	Reset Availability Data	Restablecer los datos de disponibilidad	['reset']	{'reset': 'Restablecer'}	['restablecer']
42	{'replenishment': 'reaprovisionamiento'}	The signal for replenishment is issued by an indicator, that is sent by a demand source (consumer) to the supply source (supplier).	La señal de reposición es generada por un indicador y enviada por una fuente de demanda (consumidor) a la fuente de suministro (proveedor).	['replenishment']	{'replenishment': '▔'}	['▔']
43	{'tab': 'pestaña'}	Check the objects on the Business Builder and Data Builder tabs.	Revisa los objetos en las pestañas del Generador de Negocios y del Generador de Datos.	['tab']	{'tab': 'pestañas'}	['pestaña']
44	{'template': 'modelo'}	You can create a new template by specifying the content type, governing law, and language.	Puedes crear una nueva plantilla especificando el tipo de contenido, la ley aplicable y el idioma.	['template']	{'template': 'plantilla'}	['plantilla']
45	{'process': 'procesar'}	You can define one or more preconditions that must be met before the credit memo request workflow can be processed.	Puedes definir una o más condiciones previas que deben cumplirse antes de que se pueda procesar el flujo de trabajo de solicitud de abono de crédito.	['process']	{'process': 'procesar'}	['procesar']
46	{'job': 'job'}	To change scheduled jobs	Modificar los trabajos programados	['job']	{'job': 'trabajos'}	['trabajo']
47	{'recurrence pattern': 'patrón de repetición'}	Define the recurrence pattern, such as daily or weekly	Define el patrón de recurrencia, como por ejemplo el diario o el semanal.	['recurrence pattern']	{'recurrence pattern': 'patrón de recurrencia'}	['patrón de recurrencia']
48	{'tab': 'pestaña'}	Use the tabs in the Data Preview panel to review and process the results.	Utilice las pestañas del panel de vista previa de datos para revisar y procesar los resultados.	['tab']	{'tab': 'pestañas'}	['pestaña']
49	{'completed': 'concluido'}	When you're displaying service confirmations assigned to a standard service order, you can use this button to release service confirmations that have status Completed for billing.	"Cuando visualices las confirmaciones de servicio asignadas a una orden de servicio estándar, podrás utilizar este botón para liberar las confirmaciones de servicio que tengan el estado ""Completado"" para su facturación."	['completed']	{'completed': 'Completado'}	['completado']
50	{'reporting': 'informes'}	It provides a consolidation view along this segment hierarchy by populating the Segment Eliminated reporting dimension.	Proporciona una vista consolidada a lo largo de esta jerarquía de segmentos mediante el relleno de la dimensión de informes de segmentos eliminados.	['reporting']	{'reporting': 'informes'}	['informe']
51	{'save as': 'guardar como'}	Save As New Version:(Available for templates and text blocks)	Guardar como nueva versión: (Disponible para plantillas y bloques de texto)	['save as']	{'save as': 'Guardar como'}	['guardar como']
52	{'search result': 'resultado del proceso de búsqueda'}	You can use this field to filter your search results for the latest bank statements that you have received from your house bank accounts.	Puedes utilizar este campo para filtrar los resultados de tu búsqueda y encontrar los últimos extractos bancarios recibidos de tus cuentas bancarias personales.	['search result']	{'search result': 'resultados'}	['resultado']
53	{'schedule': 'programación'}	A schedule task is defined for this data flow.	Se ha definido una tarea programada para este flujo de datos.	['schedule']	{'schedule': 'programada'}	['programado']
54	{'job': 'job'}	To change scheduled jobs, do the following:	Para modificar los trabajos programados, sigue los siguientes pasos:	['job']	{'job': 'trabajos'}	['trabajo']
55	{'customer': 'deudor'}	Customer/supplier branch number	Número de sucursal de cliente/proveedor	['customer']	{'customer': 'cliente'}	['cliente']
56	{'recurrence pattern': 'patrón de repetición'}	Define the recurrence pattern of the job.	Defina el patrón de recurrencia del trabajo.	['recurrence pattern']	{'recurrence pattern': 'patrón de recurrencia'}	['patrón de recurrencia']
57	{'substitute': 'suplente'}	Define your personal settings for email notifications and substitutes.	Configura tus ajustes personales para las notificaciones por correo electrónico y los suplentes.	['substitute']	{'substitute': 'suplentes'}	['suplente']
58	{'review': 'revisión'}	Set fuzzy match scores to decide when to place input records in the Matched and Review results categories.	Establezca las puntuaciones de coincidencia difusa para determinar cuándo clasificar los registros de entrada en las categorías de resultados Coincidencias y Revisión.	['review']	{'review': 'Revisión'}	['revisión']
59	{'feature': 'característica'}	Find further information on the Extended Statistics feature in the product assistance.	Encontrará más información sobre la función de estadísticas extendidas en la asistencia del producto.	['feature']	{'feature': 'función'}	['función']
60	{'customer': 'deudor'}	As a search criterion for items in the customer/supplier account	Como criterio de búsqueda de partidas en la cuenta de cliente o proveedor	['customer']	{'customer': 'cliente'}	['cliente']
61	{'call': 'llamada', 'tab': 'etiqueta'}	The variables are different for the different data source called to for the charts of a tab.	Las variables difieren según la fuente de datos utilizada para los gráficos de una pestaña.	['call', 'tab']	{'call': 'fuente', 'tab': 'pestaña'}	['fuente', 'pestaña']
62	{'replication': 'reproducción'}	Required Permissions for Oracle Trigger-Based Replication in the SAP HANA Smart Data Integration and SAP HANA Smart Data Quality Installation and Configuration Guide	Permisos requeridos para la replicación basada en triggers de Oracle en la guía de instalación y configuración de SAP HANA Smart Data Integration y SAP HANA Smart Data Quality	['replication']	{'replication': 'replicación'}	['replicación']
63	{'set': 'definir'}	If you lock a release which is not the latest release, all releases which have been published after the release of the locked release are also set to locked.	Si bloqueas una versión que no es la más reciente, todas las versiones publicadas con posterioridad a la versión bloqueada también quedarán bloqueadas.	['set']	{'set': 'bloqueadas'}	['bloqueado']
64	{'change': 'modificación'}	You need to re-deploy your intelligent lookup each time your make a change to it.	Debes volver a desplegar tu búsqueda inteligente cada vez que realices cambios en ella.	['change']	{'change': 'cambios'}	['cambio']
65	{'delete': 'eliminar'}	Delete an Activation Key	Eliminar una clave de activación	['delete']	{'delete': 'Eliminar'}	['eliminar']
66	{'add': 'añadir'}	Click the Edit button to add or delete buttons or change column names and data types.	Haz clic en el botón Editar para agregar o eliminar botones o modificar los nombres de las columnas y los tipos de datos.	['add']	{'add': 'agregar'}	['agregar']
67	{'account assignment': 'imputación', 'partner': 'socio', 'default': 'predefinir'}	You specify a defaultable business partner for banks when using bank reconciliation accounts in G/L account assignment.	Especificas un socio comercial predefinido para los bancos cuando se utilizan cuentas de conciliación bancaria en la asignación de cuentas del libro mayor.	['account assignment', 'partner', 'default']	{'account assignment': 'asignación cuentas', 'partner': 'socio', 'default': 'predefinido'}	['asignación cuenta', 'socio', 'predefinido']
68	{'write off': 'ignorar'}	On the To Be Billed tab, select one or more items as required and choose Write Off.	"En la pestaña ""Elementos pendientes de facturación"", seleccione uno o más elementos según sea necesario y elija darlos de baja."	['write off']	{'write off': 'baja'}	['bajo']
69	{'measure': 'indicador'}	Select a type of measure and define the properties.	Seleccione un tipo de medida y defina sus propiedades.	['measure']	{'measure': 'medida'}	['medida']
70	{'transaction': 'operación', 'customer': 'deudor'}	Transaction number under which a controversial transaction is managed at the customer/supplier	Número de transacción bajo el cual se gestiona una transacción conflictiva entre el cliente y el proveedor.	['transaction', 'customer']	{'transaction': 'transacción', 'customer': 'cliente'}	['transacción', 'cliente']
71	{'record': 'registro'}	The RECORD COUNT type is a table-wide statistic.	El tipo CONTEO DE REGISTROS constituye una estadística que abarca toda la tabla.	['record']	{'record': 'REGISTROS'}	['registros']
72	{'header': 'cabecera'}	Click the column header in the table area.	Haz clic en el encabezado de la columna dentro del área de la tabla.	['header']	{'header': 'encabezado'}	['encabezado']
73	{'performance': 'rendimiento'}	At the performance obligation level they are calculated as follows:	A nivel de la obligación de rendimiento, su cálculo se realiza de la siguiente manera:	['performance']	{'performance': 'rendimiento'}	['rendimiento']
74	{'worklist': 'lista de trabajo'}	Adds a selected settlement date with the settlement status Open, Due, Due Today, or Overdue to a scheduling worklist to schedule the settlement of the selected settlement date.	Añade una fecha de liquidación seleccionada con el estado de liquidación Abierto, Pendiente, Pendiente hoy o Vencido a una lista de tareas de programación para programar la liquidación de dicha fecha.	['worklist']	{'worklist': 'lista de tareas'}	['lista de tarea']
75	{'type': 'tipo'}	If you want the automated reprocessing rule to post your bank statement items in only one step, select 001 (One-Step Posting) as the value of the Procedure Type field.	Si desea que la regla de reprocesamiento automático contabilice los elementos de su extracto bancario en un solo paso, seleccione 001 (Contabilización en un solo paso) como valor del campo Tipo de procedimiento.	['type']	{'type': 'procedimiento'}	['procedimiento']
76	{'tab': 'pestaña'}	In the pane on the right, check the objects on the Business Builder and Data Builder tabs:	En el panel de la derecha, comprueba los objetos de las pestañas Business Builder y Constructor de Datos.	['tab']	{'tab': 'pestañas'}	['pestaña']
77	{'schedule': 'programación'}	If the operation is included in one schedule, the schedule opens directly.	Si la operación está incluida en un horario, este se abre directamente.	['schedule']	{'schedule': 'horario'}	['horario']
78	{'worklist': 'lista de trabajo'}	The new Manage Fixed Assets card replaces the Asset Master Worklist card from previous versions.	La nueva tarjeta de Gestión de Activos Fijos reemplaza la tarjeta de Lista Maestra de Activos de las versiones anteriores.	['worklist']	{'worklist': 'Lista'}	['lista']
79	{'add': 'añadir'}	Add or remove columns to the overview	Añadir o eliminar columnas de la vista general	['add']	{'add': 'Añadir'}	['añadir']
80	{'allocation': 'imputación'}	Use this function to download a preformatted CSV file template that you can use to create new allocation cycles and segments or edit existing ones.	Utilice esta función para descargar una plantilla de archivo CSV preformateada que puede usar para crear nuevos ciclos y segmentos de asignación o para editar los ya existentes.	['allocation']	{'allocation': 'asignación'}	['asignación']
81	{'profile page': 'página del perfil'}	The data provider profile page provides additional information about the data provider and other products or product groups.	La página de perfil del proveedor de datos proporciona información adicional sobre el proveedor y otros productos o grupos de productos.	['profile page']	{'profile page': 'página de perfil'}	['página de perfil']
82	{'allocation': 'imputación'}	You can only use it with the cost center and profit center allocation contexts.	Solo puedes utilizarlo en los contextos de asignación de centros de costes y de beneficios.	['allocation']	{'allocation': 'asignación'}	['asignación']
83	{'partner': 'socio'}	You can maintain Sales Area Details, Sales Taxes, and Partner Functions.	Puedes gestionar los detalles del área de ventas, los impuestos sobre ventas y las funciones de los socios.	['partner']	{'partner': 'socios'}	['socio']
84	{'incident': 'incidencia'}	The incident ID is empty for SAP support user access with the Operations access category.	El ID del incidente está vacío para el acceso de usuario de soporte de SAP en la categoría de acceso de operaciones.	['incident']	{'incident': 'incidente'}	['incidente']
85	{'consumption': 'compensación', 'allocation': 'contingente'}	Displays data for allocation periods in which allocation consumption is below 20%.	Muestra datos correspondientes a los períodos de asignación en los que el consumo de asignación es inferior al 20 %.	['consumption', 'allocation']	{'consumption': 'consumo', 'allocation': 'asignación'}	['consumo', 'asignación']
86	{'assembly': 'conjunto', 'icon': 'icono'}	The Information icon appears if any or all of following exists for an assembly:	El icono de Información aparece si existe alguno o todos los siguientes elementos para un ensamblado:	['assembly', 'icon']	{'assembly': 'ensamblado', 'icon': 'icono'}	['ensamblado', 'icono']
87	{'delete': 'eliminar'}	To delete a mapping, click the link and then click the Delete tool.	Para eliminar una asignación, haz clic en el enlace y, a continuación, haz clic en la herramienta Eliminar.	['delete']	{'delete': 'Eliminar'}	['eliminar']
88	{'sorting': 'orden'}	Using filters, search, or sorting, you can quickly find the connection type.	Utilizando filtros, la búsqueda o la ordenación, podrás encontrar rápidamente el tipo de conexión.	['sorting']	{'sorting': 'ordenación'}	['ordenación']
89	{'job': 'job'}	The Number of Jobs and Package Size fields are deactivated and not relevant for this job.	Los campos Número de trabajos y Tamaño del paquete están desactivados y no son relevantes para esta tarea.	['job']	{'job': 'tarea'}	['tarea']
90	{'client': 'cliente'}	Enter the system client number.	Introduzca el número de cliente del sistema.	['client']	{'client': 'cliente'}	['cliente']
91	{'report': 'report'}	If you choose No, the system will exclude from the list report all billing elements with prepayment items.	Si seleccionas «No», el sistema excluirá del informe de lista todos los elementos de facturación que incluyan artículos de prepago.	['report']	{'report': 'informe'}	['informe']
