	terms	src_raw	mt_raw	src_terms	alg_terms	norm_tgt_terms
170	{'trigger': 'Auslöser'}	For more information, see Oracle Trigger-Based Replication in the SAP HANA Smart Data Integration and SAP HANA Smart Data Quality Installation and Configuration Guide.	Weitere Informationen finden Sie unter „Oracle-Auslöser-basierte Replikation“ im Installations- und Konfigurationshandbuch für SAP HANA Smart Data Integration und SAP HANA Smart Data Quality.	['trigger']	{'trigger': 'Auslöser'}	['auslöser']
171	{'side panel': 'Seitenbereich'}	Complete or consult other side panel sections as appropriate:	Vervollständigen Sie bei Bedarf andere Abschnitte des Seitenbereichs oder konsultieren Sie diese.	['side panel']	{'side panel': 'Seitenbereich'}	['seitenbereich']
172	{'create': 'erstellen'}	Choose an appropriate data entity to provide data to your business entity and click Create to open the editor.	Wählen Sie eine geeignete Datenentität aus, um Daten für Ihre Geschäftsentität bereitzustellen, und klicken Sie auf „Erstellen“, um den Editor zu öffnen.	['create']	{'create': 'Erstellen'}	['erstellen']
173	{'type': 'Art'}	Choose from the following types:	Wählen Sie aus den folgenden Arten aus:	['type']	{'type': 'Arten'}	['art']
174	{'message': 'Nachricht'}	The messages are grouped in the following categories:	Die Nachrichten sind in den folgenden Kategorien gruppiert:	['message']	{'message': 'Nachrichten'}	['nachricht']
175	{'order': 'Auftrag'}	Narrow down the list of orders based on their main work center.	Grenzen Sie die Liste der Aufträge basierend auf ihrem Hauptarbeitszentrum ein.	['order']	{'order': 'Aufträge'}	['auftrag']
176	{'incident': 'Meldung'}	Once the incident has been processed, you can create the  bridge instance in the dedicated page SAP BW Bridge of the Configuration area with the size you’ve allocated (see ).	Sobald die Meldung bearbeitet wurde, können Sie die Bridge-Instanz auf der dedizierten Seite „SAP BW Bridge“ im Konfigurationsbereich mit der von Ihnen zugewiesenen Größe erstellen (siehe).	['incident']	{'incident': 'Meldung'}	['meldung']
177	{'session': 'Sitzung'}	Select a session.	Wählen Sie eine Sitzung aus.	['session']	{'session': 'Sitzung'}	['sitzung']
178	{'schedule': 'Dokument'}	Create a schedule:	Erstellen Sie einen Zeitplan:	['schedule']	{'schedule': 'Zeitplan'}	['zeitplan']
179	{'document': 'Beleg'}	Document - Action Required	Beleg – Handlungsbedarf erforderlich	['document']	{'document': 'Beleg'}	['beleg']
180	{'schedule': 'Terminplan'}	In the Share Schedule dialog, just remove the name of the person whose access you want to revoke.	Im Dialog „Terminplan freigeben“ entfernen Sie einfach den Namen der Person, deren Zugriff Sie widerrufen möchten.	['schedule']	{'schedule': 'Terminplan'}	['terminplan']
181	{'chart': 'Diagramm'}	You can change the start date and time of order operations by dragging them one at a time to the desired date in the chart.	Sie können das Startdatum und die Startzeit von Auftragsoperationen ändern, indem Sie diese einzeln auf das gewünschte Datum im Diagramm ziehen.	['chart']	{'chart': 'Diagramm'}	['diagramm']
182	{'release': 'Release'}	Release Restriction Note	Hinweis zu Einschränkungen des Releases	['release']	{'release': 'Releases'}	['release']
183	{'type': 'Art'}	You can only display and use these two Planned Count Date From - To fields, when you use the date selection type Static.	Sie können diese beiden Felder „Geplantes Zähldatum von – bis“ nur anzeigen und verwenden, wenn Sie den Datenauswahltyp „Statisch“ verwenden.	['type']	{'type': 'Datenauswahltyp'}	['datenauswahltyp']
184	{'document': 'Beleg'}	Documents - Action Required	Belege – Aktion erforderlich	['document']	{'document': 'Belege'}	['beleg']
185	{'revision': 'überarbeitete Version'}	Restoring an Older Version or Revision of a Text Block	Wiederherstellung einer älteren Version oder überarbeiteten Fassung eines Textblocks	['revision']	{'revision': 'überarbeiteten'}	['überarbeiten']
186	{'data provider': 'Datenprovider'}	The Data Provider profile provides additional information about other products or product groups.	Das Profil des Datenproviders liefert zusätzliche Informationen über andere Produkte oder Produktgruppen.	['data provider']	{'data provider': 'Datenproviders'}	['datenprovider']
187	{'notification': 'Benachrichtigung'}	Notification Sent Date	Datum des Versands der Benachrichtigung	['notification']	{'notification': 'Benachrichtigung'}	['benachrichtigung']
188	{'transfer': 'übertragen'}	Check and Transfer Staffing Assignments	Überprüfen und Übertragen von Personaleinsatzzuweisungen	['transfer']	{'transfer': 'Übertragen'}	['übertragen']
189	{'create': 'erstellen'}	You can also create your own scenarios.	Sie können auch eigene Szenarien erstellen.	['create']	{'create': 'erstellen'}	['erstellen']
190	{'page': 'Page'}	Select your homepage from the dropdown menu.	Wählen Sie Ihre Startseite aus dem Dropdown-Menü aus.	['page']	{'page': 'Startseite'}	['startseite']
191	{'restriction': 'Restriktion'}	The following restrictions are applicable:	Die folgenden Restriktionen gelten:	['restriction']	{'restriction': 'Restriktionen'}	['restriktion']
192	{'about': 'über'}	About Approval Process	Über den Genehmigungsprozess	['about']	{'about': 'Genehmigungsprozess'}	['genehmigungsprozen']
193	{'compliance requirement': 'Compliance-Anforderung'}	Once you have selected a category, you must select a subcategory, such as Tasks by Status or Tasks by Status and Compliance Requirement, to refine your analysis results further.	Sobald Sie eine Kategorie ausgewählt haben, müssen Sie eine Unterkategorie wie „Aufgaben nach Status“ oder „Aufgaben nach Status und Compliance-Anforderung“ auswählen, um Ihre Analyseergebnisse weiter zu verfeinern.	['compliance requirement']	{'compliance requirement': 'Compliance-Anforderung'}	['compliance']
194	{'table view': 'Tabellenansicht'}	You can perform the following actions in table view:	Sie können die folgenden Aktionen in der Tabellenansicht durchführen:	['table view']	{'table view': 'Tabellenansicht'}	['tabellenansicht']
195	{'routing': 'Weiterleitung'}	Routing Information Retrieval	Abruf von Weiterleitungsinformationen	['routing']	{'routing': 'Weiterleitungsinformationen'}	['weiterleitungsinformation']
196	{'storage type': 'Speichertyp'}	You can filter by schema or by storage type.	Sie können nach Schema oder nach Speichertyp filtern.	['storage type']	{'storage type': 'Speichertyp'}	['speichertyp']
197	{'client': 'Client'}	Expose your data in lightweight, closely-focused perspectives to SAP Analytics Cloud and other analytics clients.	Stellen Sie Ihre Daten in effizienten, fokussierten Perspektiven für SAP Analytics Cloud und andere Analyse-Clients zur Verfügung.	['client']	{'client': 'Clients'}	['client']
198	{'check': 'Prüfung'}	Enterprise Edition check:	Enterprise-Edition-Prüfung:	['check']	{'check': 'Prüfung'}	['prüfung']
199	{'consumption model': 'Verbrauchsmodell'}	You can add more specific measures to your consumption model.	Sie können Ihrem Verbrauchsmodell spezifischere Maßnahmen hinzufügen.	['consumption model']	{'consumption model': 'Verbrauchsmodell'}	['verbrauchsmodell']
200	{'schedule': 'Terminplan'}	Reviewers are not allowed to make any changes to the schedule and they do not see the utilization forecast shown when the schedule is in Scoping and Refinement.	Prüfer dürfen keine Änderungen am Terminplan vornehmen und haben keinen Einblick in die Auslastungsprognose, die während der Phasen der Projektumfangfestlegung und Verfeinerung angezeigt wird.	['schedule']	{'schedule': 'Terminplan'}	['terminplan']
201	{'query': 'Abfrage'}	In the side navigation area, click , select the space you want to work in, and click Remote Query Monitor to open the monitor.	Klicken Sie im Seitennavigationsbereich, wählen Sie den gewünschten Arbeitsbereich aus und klicken Sie anschließend auf „Remote-Abfrage-Monitor“, um den Monitor zu öffnen.	['query']	{'query': 'Abfrage-Monitor'}	['abfrage']
202	{'space': 'Space'}	Enter your key, accept the terms of use and select a space where the data should be stored.	Geben Sie Ihren Schlüssel ein, akzeptieren Sie die Nutzungsbedingungen und wählen Sie einen Space aus, in dem die Daten gespeichert werden sollen.	['space']	{'space': 'Space'}	['space']
203	{'assignment': 'Einsatz'}	Save the assignment.	Speichern Sie den Auftrag.	['assignment']	{'assignment': 'Auftrag'}	['auftrag']
204	{'queue': 'Warteschlange'}	Change queue assignments.	Ändern Sie die Zuweisungen in der Warteschlange.	['queue']	{'queue': 'Warteschlange'}	['warteschlange']
205	{'project': 'Project'}	The following project44 add-ons are available:	Die folgenden Project44-Add-ons stehen zur Verfügung:	['project']	{'project': 'Project44'}	['projustingen']
206	{'work package': 'Work-Package'}	Create new Work Package	Neues Work-Package anlegen	['work package']	{'work package': 'Work-Package'}	['work']
207	{'type': 'Art'}	The following work item types are available:	Die folgenden Arbeitselementtypen stehen zur Verfügung:	['type']	{'type': 'Arbeitselementtypen'}	['arbeitselementtypen']
208	{'item': 'Artikel'}	To create a new item, choose one of the following options:	Um einen neuen Artikel zu erstellen, wählen Sie bitte eine der folgenden Optionen aus.	['item']	{'item': 'Artikel'}	['artikel']
209	{'action': 'Aktion', 'Action': 'Aktion'}	This column shows you if quick actions are available.	Diese Spalte zeigt Ihnen an, ob schnelle Aktionen verfügbar sind.	['action', 'Action']	{'action': 'Aktionen', 'Action': 'Aktionen'}	['aktion', 'aktion']
210	{'schedule': 'Terminplan'}	Included in Schedule (Filter)	Im Terminplan enthalten (Filter)	['schedule']	{'schedule': 'Terminplan'}	['terminplan']
211	{'create': 'anlegen'}	Click Create Needs.	Klicken Sie auf „Bedürfnisse anlegen“.	['create']	{'create': 'anlegen'}	['anlegen']
212	{'intercompany': 'unternehmensübergreifend'}	Check Intercompany Transactions	Überprüfen Sie die unternehmensübergreifenden Transaktionen.	['intercompany']	{'intercompany': 'unternehmensübergreifenden'}	['unternehmensübergreifenden']
213	{'usage': 'Nutzung'}	Provides additional information about metering of usage.	Bietet zusätzliche Informationen zur Messung der Nutzungsdaten.	['usage']	{'usage': 'Nutzungsdaten'}	['nutzungsdoten']
214	{'Production Order': 'Produktionsauftrag', 'production order': 'Produktionsauftrag'}	The Production Order:	Der Produktionsauftrag:	['Production Order', 'production order']	{'Production Order': 'Produktionsauftrag', 'production order': 'Produktionsauftrag'}	['produktionsauftragen', 'produktionsauftragen']
215	{'document status': 'Dokumentstatus'}	Document Status - Text	Dokumentstatus – Text	['document status']	{'document status': 'Dokumentstatus'}	['dokumentstatusen']
216	{'appointment': 'Torbelegung'}	To create a dock appointment, proceed as follows:	Um einen Dock-Termin zu erstellen, gehen Sie wie folgt vor:	['appointment']	{'appointment': 'Termin'}	['termin']
217	{'space': 'Space'}	Limitation of a locked space:	Einschränkung eines gesicherten Bereichs:	['space']	{'space': 'Einschränkung'}	['einschränkung']
218	{'type': 'Typ'}	Select one of the following shipment types:	Wählen Sie einen der folgenden Versandtypen aus:	['type']	{'type': 'Versandtypen'}	['versandtypen']
219	{'position': 'Bestand'}	You have the following position:	Sie haben folgende Position inne:	['position']	{'position': 'Position'}	['position']
220	{'load': 'Last'}	Highloaded Periods Card	Karte der Zeiträume mit hoher Last	['load']	{'load': 'Last'}	['last']
221	{'troubleshooting': 'Fehlerbehebung'}	The following troubleshooting modes are available:	Die folgenden Fehlerbehebungsmodi stehen zur Verfügung:	['troubleshooting']	{'troubleshooting': 'Fehlerbehebungsmodi'}	['fehlerbehebungsmoden']
222	{'access control': 'Zugriffskontrolle'}	When a data access control is applied to a data layer view or a business layer object, the rows of data contained in the object are filtered based on the specified criteria.	Wenn eine Zugriffskontrolle auf eine Datenebenenansicht oder ein Geschäftsebenenobjekt angewendet wird, werden die darin enthaltenen Datenzeilen basierend auf den festgelegten Kriterien gefiltert.	['access control']	{'access control': 'Zugriffskontrolle'}	['zugriffskontrolle']
223	{'reset': 'Reset'}	Reset not required	Reset nicht erforderlich	['reset']	{'reset': 'Reset'}	['resen']
224	{'pause': 'pausieren'}	Pause Real-Time Replication for an Agent	Pausieren Sie die Echtzeit-Replikation für einen Agenten.	['pause']	{'pause': 'Pausieren'}	['pausieren']
225	{'refresh': 'aktualisieren'}	Enables you to refresh purchase requisitions.	Ermöglicht Ihnen die Aktualisierung von Bestellanforderungen.	['refresh']	{'refresh': 'Aktualisierung'}	['aktualisierung']
226	{'accept': 'annehmen'}	Then choose Accept.	Wählen Sie dann „Annehmen“ aus.	['accept']	{'accept': 'Annehmen'}	['annehmen']
227	{'item': 'Artikel'}	Item expiration Date	Artikelablaufdatum	['item']	{'item': 'Artikelablaufdatum'}	['artikelablaufdatum']
228	{'disclosure': 'Auskunft'}	Accept Legal Disclosure.	Akzeptieren Sie die rechtliche Offenlegung.	['disclosure']	{'disclosure': 'Offenlegung'}	['offenlegeng']
229	{'provider': 'Anbieter'}	You can edit the predefined email and then send it to the provider.	Sie können die vordefinierte E-Mail bearbeiten und sie anschließend an den Anbieter senden.	['provider']	{'provider': 'Anbieter'}	['anbieter']
230	{'task': 'Tätigkeit'}	This task is optional.	Diese Aufgabe ist optional.	['task']	{'task': 'Aufgabe'}	['aufgabe']
231	{'processing': 'Verarbeitung'}	Released for Processing	Freigegeben für die Verarbeitung	['processing']	{'processing': 'Verarbeitung'}	['verarbeitung']
232	{'collection': 'Sammlung'}	Enter the name and the description of your role collection.	Geben Sie den Namen und die Beschreibung Ihrer Rollen-Sammlung ein.	['collection']	{'collection': 'Sammlung'}	['sammlung']
233	{'icon': 'Symbol'}	Icon on the tab indicates the following:	Das Symbol auf dem Tab zeigt Folgendes an:	['icon']	{'icon': 'Symbol'}	['symbol']
234	{'default': 'Voreinstellung'}	By default the check box is unchecked.	Standardmäßig ist das Kontrollkästchen nicht aktiviert.	['default']	{'default': 'Standardmäßig'}	['standardmäßig']
235	{'sales': 'Verkauf', 'Sales': 'Verkauf'}	In the sales and delivery processes, the placeholders are resolved in the languages in which the document is printed.	Im Verkaufsprozess und im Lieferprozess werden die Platzhalter in den Sprachen aufgelöst, in denen das Dokument gedruckt wird.	['sales', 'Sales']	{'sales': 'Verkaufsprozess', 'Sales': 'Verkaufsprozess'}	['verkaufsprozen', 'verkaufsprozen']
236	{'assignment': 'Einsatz'}	P Paste Assignment	P Einfüge-Aufgabe	['assignment']	{'assignment': 'Einfüge-Aufgabe'}	['einfügen']
237	{'document': 'Beleg'}	FICA document will be displayed.	Der FICA-Beleg wird angezeigt.	['document']	{'document': 'Beleg'}	['beleg']
238	{'payment method': 'Zahlweg'}	Payment Method Text	Zahlungsmethodentext	['payment method']	{'payment method': 'Zahlungsmethodentext'}	['zahlungsmethodentegen']
239	{'split criterion': 'Splitkriterium', 'material group': 'Materialgruppe'}	Create, edit and display a single order fulfillment responsibility for a specific split criterion (for example, plant or material group) or a combination of multiple split criteria.	Erstellen, bearbeiten und zeigen Sie eine einzelne Verantwortung für die Auftragserfüllung für ein bestimmtes Splitkriterium (z. B. Werk oder Materialgruppe) oder eine Kombination mehrerer Splitkriterien an.	['split criterion', 'material group']	{'split criterion': 'Splitkriterium', 'material group': 'Materialgruppe'}	['qplitkriteren', 'materialgruppe']
240	{'personal data': 'personenbezogene Daten', 'report': 'Bericht'}	Personal Data Report	Bericht über personenbezogene Daten	['personal data', 'report']	{'personal data': 'personenbezogene Daten', 'report': 'Bericht'}	['personenbezogen datum', 'bericht']
241	{'check': 'Scheck'}	Choose Add Check.	Wählen Sie „Check hinzufügen“ aus.	['check']	{'check': 'Check'}	['checken']
242	{'compliance requirement': 'Compliance-Anforderung'}	Choose View Compliance Requirements.	Wählen Sie „Compliance-Anforderungen anzeigen“ aus.	['compliance requirement']	{'compliance requirement': 'Compliance-Anforderungen'}	['compliance']
243	{'score': 'Punktzahl'}	Score Output Type	Ausgabetyp der Punktzahl	['score']	{'score': 'Punktzahl'}	['punktzahl']
244	{'sequence': 'Reihenfolge'}	Display the segments in which the sequence is used.	Zeige die Segmente an, in denen die Sequenz verwendet wird.	['sequence']	{'sequence': 'Sequenz'}	['sequenz']
245	{'create': 'anlegen'}	Click Create Schedule.	Klicken Sie auf „Zeitplan anlegen“.	['create']	{'create': 'anlegen'}	['anlegen']
246	{'cancel': 'zurücknehmen'}	Choose Cancel Dispatch.	Wählen Sie „Versand zurücknehmen“ aus.	['cancel']	{'cancel': 'zurücknehmen'}	['zurücknehmen']
247	{'difference': 'Abweichung'}	Differences between target costs and actual costs that cannot be attributed to any above mentioned category.	Abweichungen zwischen den Zielkosten und den Istkosten, die keiner der oben genannten Kategorien zugeordnet werden können.	['difference']	{'difference': 'Abweichungen'}	['abweichung']
248	{'routing': 'Weiterleitung'}	The following routing methods are supported:	Die folgenden Routing-Methoden werden unterstützt:	['routing']	{'routing': 'Routing-Methoden'}	['routing']
249	{'notification': 'Mitteilung'}	via Notifications or	über Mitteilungen oder	['notification']	{'notification': 'Mitteilungen'}	['mitteilung']
250	{'verification': 'Verifizierung'}	Controls the verification of the host name field of the server certificate:	Steuert die Verifizierung des Hostnamenfelds im Serverzertifikat.	['verification']	{'verification': 'Verifizierung'}	['verifizierung']
251	{'following': 'Following', 'action': 'Action', 'Action': 'Action'}	Perform one of the following actions:	Führen Sie eine der folgenden Aktionen aus:	['following', 'action', 'Action']	{'following': 'folgenden', 'action': 'Aktionen', 'Action': 'Aktionen'}	['folgend', 'aktion', 'aktion']
252	{'upload': 'Upload'}	Upload Field Fuel	Treibstofffeld hochladen	['upload']	{'upload': 'Hochladen'}	['hochladen']
253	{'maintenance plan': 'Instandhaltungsplan', 'schedule': 'Terminplan', 'share': 'teilen'}	Maintenance planners can modify, share, or delete the schedule.	Wartungsplaner können den Terminplan ändern, teilen oder löschen.	['maintenance plan', 'schedule', 'share']	{'maintenance plan': 'Wartungsplaner', 'schedule': 'Terminplan', 'share': 'teilen'}	['wartungsplaner', 'terminplan', 'teilen']
254	{'percentage': 'prozentual'}	For example, you can specify which availability match percentage to use for the calculation of the total suitability match.	Sie können beispielsweise festlegen, welchen prozentualen Verfügbarkeitsübereinstimmungswert Sie für die Berechnung der gesamten Eignungsübereinstimmung verwenden möchten.	['percentage']	{'percentage': 'prozentualen'}	['prozentualen']
255	{'assigned': 'zugewiesen'}	The Product Allocation Order Items card displays only those order items which have product allocation confirmation quantity assigned to characteristic value combinations which belong to the selected product allocation object.	Die Karte „Produktzuordnungs-Auftragspositionen“ zeigt nur diejenigen Auftragspositionen an, bei denen eine Bestätigungsmenge für die Produktzuordnung den Merkmalswertkombinationen zugewiesen ist, die zum ausgewählten Produktzuordnungsobjekt gehören.	['assigned']	{'assigned': 'zugewiesen'}	['zuweisen']
256	{'compliance requirement': 'Compliance-Anforderung'}	Unreleased Compliance Requirements	Unveröffentlichte Compliance-Anforderungen	['compliance requirement']	{'compliance requirement': 'Compliance-Anforderungen'}	['compliance']
257	{'value': 'Wert'}	By selecting the search button in the field, you are taken to the Define Conditions:the characteristics displayed here are the standard characteristic values that can be used when, for example, you configure product allocation objects.	Durch Auswahl des Suchbuttons im Feld gelangen Sie zu „Bedingungen definieren“: Die hier angezeigten Merkmale sind die Standardmerkmalswerte, die beispielsweise bei der Konfiguration von Produktzuweisungsobjekten verwendet werden können.	['value']	{'value': 'Merkmalswerte'}	['merkmalswerten']
258	{'create': 'erstellen'}	Create Analytic Applications	Analytische Anwendungen erstellen	['create']	{'create': 'erstellen'}	['erstellen']
259	{'history': 'History'}	History Retention Period:	Aufbewahrungszeitraum für die History:	['history']	{'history': 'Aufbewahrungszeitraum'}	['aufbewahrungszeitraumen']
260	{'retention period': 'Aufbewahrungszeitraum'}	Setup of Retention Period	Einrichtung des Aufbewahrungszeitraums	['retention period']	{'retention period': 'Aufbewahrungszeitraums'}	['aufbewahrungszeitraumen']
261	{'item': 'Element'}	Go to Items Completed.	Gehe zu den abgeschlossenen Elementen.	['item']	{'item': 'Elementen'}	['element']
262	{'create': 'erstellen'}	Create New Options	Neue Optionen erstellen	['create']	{'create': '▔'}	['▔ertrat<sos>']
263	{'payment advice': 'Avis'}	Manage Payment Advices	Zahlungsavis verwalten	['payment advice']	{'payment advice': 'Zahlungsavis'}	['zahlungsavisen']
264	{'following': 'Following'}	You have entered the following data:	Sie haben die folgenden Daten eingegeben:	['following']	{'following': 'folgenden'}	['folgend']
265	{'dialog text': 'Text im Dialog'}	Select Dialog Text.	Wählen Sie den Text im Dialog aus.	['dialog text']	{'dialog text': 'Text im Dialog'}	['text in dialog']
266	{'contract': 'Vertrag'}	No Valid Contract	Kein gültiger Vertrag	['contract']	{'contract': 'Vertrag'}	['vertrag']
267	{'report': 'Report'}	Enter the title for your report:	Geben Sie den Titel Ihres Reports ein:	['report']	{'report': 'Reports'}	['report']
268	{'data point': 'Datenpunkt'}	Save Data Points	Datenpunkte speichern	['data point']	{'data point': 'Datenpunkte'}	['datenpunkt']
269	{'side panel': 'Seitenbereich'}	In the side panel, do the following:	Im Seitenbereich führen Sie bitte Folgendes aus:	['side panel']	{'side panel': 'Seitenbereich'}	['seitenbereich']
270	{'space': 'Space'}	Delete audit log entries by space.	Löschen Sie Protokolleinträge nach dem Kriterium des Speicherplatzes.	['space']	{'space': 'Speicherplatz'}	['speicherplatz']
271	{'frame': 'Rahmen'}	To calculate the match percentage, the app sums up the free hours per month for the entire request time frame.The result is then divided by total number of required hours.	Um den Übereinstimmungsprozentsatz zu berechnen, summiert die App die freien Stunden pro Monat für den gesamten Anforderungszeitraum auf und teilt das Ergebnis dann durch die Gesamtzahl der benötigten Stunden.	['frame']	{'frame': 'Anforderungszeitraum'}	['anforderungszeitraumen']
272	{'store': 'Filiale'}	Select the Stores tab page.	Wählen Sie die Registerkarte „Filialen“ aus.	['store']	{'store': 'Filialen'}	['filiale']
273	{'deployment': 'Deployment'}	Deployment and Activation	Bereitstellung und Aktivierung	['deployment']	{'deployment': 'Bereitstellung'}	['bereitstellung']
274	{'create': 'erstellen'}	You need the DW Administrator role to create database user groups.	Sie benötigen die Rolle des DW-Administrators, um Benutzergruppen in der Datenbank erstellen zu können.	['create']	{'create': 'erstellen'}	['erstellen']
275	{'type': 'Typ'}	Select the test plan type from the dropdown list.	Wählen Sie den Testplantyp aus der Dropdown-Liste aus.	['type']	{'type': 'Testplantyp'}	['testplantyp']
276	{'space': 'Space'}	Administration in Spaces	Verwaltung in Spaces	['space']	{'space': 'Spaces'}	['space']
277	{'association': 'Assoziation'}	Select the association(s) to copy and click Create.	Wählen Sie die zu kopierende(n) Assoziation(en) aus und klicken Sie auf „Erstellen“.	['association']	{'association': 'Assoziation'}	['assoziation']
278	{'space': 'Space'}	Choose a space from the drop-down list.	Wählen Sie einen Space aus der Dropdown-Liste aus.	['space']	{'space': 'Space'}	['space']
279	{'create': 'erstellen'}	Choose Create Connection.	Wählen Sie „Verbindung erstellen“ aus.	['create']	{'create': 'erstellen'}	['erstellen']
280	{'asset': 'Vermögenswert'}	There are two kinds of assets:	Es gibt zwei Arten von Vermögenswerten:	['asset']	{'asset': 'Vermögenswerten'}	['vermögenswert']
281	{'clearing entry': 'Ausgleichsbeleg'}	You can reset the clearing of line items as well as reverse the clearing entry.	Sie können die Abstimmung von Posten zurücksetzen sowie den Ausgleichsbeleg rückgängig machen.	['clearing entry']	{'clearing entry': 'Ausgleichsbeleg'}	['ausgleichsbeleg']
282	{'regulation': 'Vorschrift'}	Create New Regulation	Neue Vorschrift anlegen	['regulation']	{'regulation': 'Vorschrift'}	['vorschrift']
283	{'change document': 'Änderungsdokument', 'type': 'Art'}	Type of Change Document	Art des Änderungsdokuments	['change document', 'type']	{'change document': 'Änderungsdokuments', 'type': 'Art'}	['änderungsdokument', 'art']
284	{'create': 'anlegen'}	Create a conditional	Erstellen Sie eine Bedingung.	['create']	{'create': 'Erstellen'}	['erstellen']
285	{'compliance requirement': 'Compliance-Anforderung'}	Compliance Requirement Country	Compliance-Anforderung nach Land	['compliance requirement']	{'compliance requirement': 'Compliance-Anforderung'}	['compliance']
286	{'category': 'Warengruppe'}	You must choose at least one category.	Sie müssen mindestens eine Kategorie auswählen.	['category']	{'category': 'Kategorie'}	['kategorie']
