	terms	src_raw	mt_raw	src_terms	alg_terms	norm_tgt_terms
86	{'data selection': 'Datenauswahl', 'item': 'Element'}	If you want to restrict the data to include in the release, select a view from the Items table and enter or paste your data queries in the Data Selection section.	Wenn Sie die Daten einschränken möchten, die in die Veröffentlichung aufgenommen werden sollen, wählen Sie eine Ansicht aus der Element-Tabelle aus und geben Sie Ihre Datenabfragen im Bereich „Datenauswahl“ ein oder fügen Sie sie dort ein.	['data selection', 'item']	{'data selection': 'Datenauswahl', 'item': 'Element-Tabelle'}	['datenauswahl', 'element']
87	{'minimum score': 'Mindest-Score'}	Set the minimum score needed to match an input record with a lookup record and place it in the Review results category.	Legen Sie den Mindest-Score fest, der erforderlich ist, um einen Eingabedatensatz mit einem Suchdatensatz abzugleichen und ihn in die Kategorie der Überprüfungsergebnisse einzustufen.	['minimum score']	{'minimum score': 'Mindest-Score'}	['mindest']
88	{'side panel': 'Seitenbereich'}	Control your join in the Mappings section of its side panel:	Steuern Sie Ihre Verknüpfung im Zuordnungsbereich des Seitenbereichs.	['side panel']	{'side panel': 'Seitenbereich'}	['seitenbereich']
89	{'space': 'Space'}	data related to spaces,	Daten im Zusammenhang mit Spaces.	['space']	{'space': 'Spaces'}	['space']
90	{'space': 'Space', 'allow': 'erlauben'}	You could also allow your space data to be consumed in your HDI containers.	Sie könnten auch zulassen, dass Ihre Space-Daten in Ihren HDI-Containern verwendet werden.	['space', 'allow']	{'space': 'Space-Daten', 'allow': 'zulassen'}	['space', 'zulassen']
91	{'minimum score': 'Mindest-Score'}	Set the minimum score needed to match an input record with a lookup record and place it in the Matched results category.	Legen Sie den Mindest-Score fest, der erforderlich ist, um einen Eingabedatensatz mit einem Suchdatensatz abzugleichen und ihn in die Kategorie der übereinstimmenden Ergebnisse einzuordnen.	['minimum score']	{'minimum score': 'Mindest-Score'}	['mindest']
92	{'action': 'Aktion', 'Action': 'Aktion'}	Possible quick actions are:	Mögliche Schnellaktionen sind:	['action', 'Action']	{'action': 'Schnellaktionen', 'Action': 'Schnellaktionen'}	['schnellaktion', 'schnellaktion']
93	{'condition': 'Bedingung'}	The advantage of this attribute is that you can refer to certain business partners in one condition by using the correct payment clearing group.	Der Vorteil dieses Attributs besteht darin, dass Sie bestimmte Geschäftspartner unter einer Bedingung mithilfe der korrekten Zahlungsabwicklungsgruppe referenzieren können.	['condition']	{'condition': 'Bedingung'}	['bedingung']
94	{'compliance requirement': 'Compliance-Anforderung'}	Specifies the Valid To date for compliance requirements.	Legt das Gültigkeitsenddatum für Compliance-Anforderungen fest.	['compliance requirement']	{'compliance requirement': 'Compliance-Anforderungen'}	['compliance']
95	{'data provider': 'Datenprovider'}	The data provider has entered some details about the product:	Der Datenprovider hat einige Details zum Produkt eingegeben.	['data provider']	{'data provider': 'Datenprovider'}	['datenprovider']
96	{'release': 'Release', 'create': 'erstellen'}	Information on the contained data, which is entered in the Create Release wizard.	Informationen zu den enthaltenen Daten, die im Assistenten zum Erstellen eines Releases eingegeben werden.	['release', 'create']	{'release': 'Release', 'create': 'Erstellen'}	['release', 'erstellen']
97	{'type': 'Typ'}	In the Permissions page individual permissions assigned to privilege types are displayed	Auf der Berechtigungsseite werden die einzelnen Berechtigungen angezeigt, die den Berechtigungstypen zugeordnet sind.	['type']	{'type': 'Berechtigungstypen'}	['berechtigungstypen']
98	{'connector': 'Connector'}	Note that Cloud Connectors that you want to use for data flows only don't require an entry in this list.	Beachten Sie, dass Cloud-Connectoren, die ausschließlich für Datenströme verwendet werden sollen, keinen Eintrag in dieser Liste benötigen.	['connector']	{'connector': 'Cloud-Connectoren'}	['cloud']
99	{'space': 'Space'}	The space that was selected to store the data product.	Der Space, der zum Speichern des Datenprodukts ausgewählt wurde.	['space']	{'space': 'Space'}	['space']
100	{'schedule': 'Zeitplan', 'change': 'Änderung'}	This means that the work center change is only visible in your schedule and is not yet saved in the maintenance order.	Das bedeutet, dass die Änderung des Arbeitsplatzes nur in Ihrem Zeitplan sichtbar ist und noch nicht im Wartungsauftrag gespeichert wurde.	['schedule', 'change']	{'schedule': 'Zeitplan', 'change': 'Änderung'}	['zeitplan', 'änderung']
101	{'category': 'Kategorie'}	New records that have the same pairing column value as an existing pairing group are automatically placed in the appropriate results category for that pairing group.	Neue Datensätze, die den gleichen Wert in der Paarungsspalte wie eine bestehende Paarungsgruppe aufweisen, werden automatisch in die zugehörige Ergebnis-Kategorie dieser Paarungsgruppe eingeordnet.	['category']	{'category': 'Ergebnis-Kategorie'}	['ergebnis']
102	{'service': 'Service'}	SAP and other SAP products and services mentioned herein as well as their respective logos are trademarks or registered trademarks of SAP SE (or an SAP affiliate company) in Germany and other countries.	SAP sowie die hier genannten SAP-Produkte und -Services und deren jeweilige Logos sind Marken oder eingetragene Marken der SAP SE (oder eines SAP-Tochterunternehmens) in Deutschland und anderen Ländern.	['service']	{'service': 'Services'}	['service']
103	{'data provider': 'Datenprovider'}	To be able to use the data product, the data provider will send an activation key via email that provides authorization to access one or multiple data products.	Um das Datenprodukt nutzen zu können, sendet der Datenprovider einen Aktivierungsschlüssel per E-Mail, der den Zugriff auf ein oder mehrere Datenprodukte ermöglicht.	['data provider']	{'data provider': 'Datenprovider'}	['datenprovider']
104	{'assigned': 'zugewiesen', 'space': 'Platz'}	It might make sense to delete unnecessary data in your space or to extend the assigned storage.	Es könnte sinnvoll sein, unnötige Daten auf Ihrem Speicherplatz zu löschen oder den zugewiesenen Speicher zu erweitern.	['assigned', 'space']	{'assigned': 'zugewiesenen', 'space': 'Speicherplatz'}	['zuwiesen', 'speicherplatz']
105	{'insight': 'Analysen'}	There are many ways to collect and combine data to create business insights:	Es gibt zahlreiche Möglichkeiten, Daten zu sammeln und zu kombinieren, um geschäftliche Erkenntnisse zu gewinnen:	['insight']	{'insight': 'Erkenntnisse'}	['erkenntnis']
106	{'create': 'anlegen'}	You can create a text block inside the text block library.	Sie können innerhalb der Textblock-Bibliothek einen Textblock anlegen.	['create']	{'create': 'anlegen'}	['anlegen']
107	{'space': 'Space'}	This space is no longer active.	Dieser Space ist nicht mehr aktiv.	['space']	{'space': 'Space'}	['space']
108	{'storage': 'Speicher'}	Allocate your capacity units to compute and storage resources.	Weisen Sie Ihre Kapazitätseinheiten den Rechen- und Speicherressourcen zu.	['storage']	{'storage': 'Speicherressourcen'}	['speicherressourcen']
109	{'share': 'freigeben'}	Generate keys that you can share with consumers to allow them to use the licensed scope of data products.	Generieren Sie Schlüssel, die Sie mit den Verbrauchern teilen können, um ihnen die Nutzung des lizenzierten Umfangs der Datenprodukte zu ermöglichen.	['share']	{'share': 'teilen'}	['teilen']
110	{'release': 'Release'}	The release is highlighted on the landing page with the flag “Not published yet”.	Das Release wird auf der Landing Page mit dem Hinweis „Noch nicht veröffentlicht“ gekennzeichnet.	['release']	{'release': 'Release'}	['release']
111	{'access control': 'Zugriffskontrolle', 'restriction': 'Beschränkung'}	For each business entity used as data restriction, you need to map each key member to the data access control's output column.	Für jede Geschäftsentität, die als Datenbeschränkung verwendet wird, müssen Sie jedes Schlüsselattribut der Ausgabespalte der Zugriffskontrolle zuordnen.	['access control', 'restriction']	{'access control': 'Zugriffskontrolle', 'restriction': 'Datenbeschränkung'}	['zugriffskontrolle', 'datenbeschränkung']
112	{'snapshot': 'Snapshot'}	Create a schedule to load new snapshot of data asynchronously and recurrently in the background according to the defined settings.	Erstellen Sie einen Zeitplan, um neue Daten-Snapshots gemäß den definierten Einstellungen asynchron und wiederkehrend im Hintergrund zu laden.	['snapshot']	{'snapshot': 'Daten-Snapshots'}	['datum']
113	{'interface': 'Schnittstelle', 'message': 'Nachricht'}	The interfaces you have subscribed to for monitoring, including the status of the individual messages.	Die Schnittstellen, die Sie für die Überwachung abonniert haben, einschließlich des Status der einzelnen Nachrichten.	['interface', 'message']	{'interface': 'Schnittstellen', 'message': 'Nachrichten'}	['schnittstelle', 'nachricht']
114	{'deployment': 'Implementierung'}	A pop up informs you about the source updates before you can go with deployment.	Ein Pop-up informiert Sie über die Quellcode-Updates, bevor Sie mit der Implementierung fortfahren können.	['deployment']	{'deployment': 'Implementierung'}	['implementierung']
115	{'data provider': 'Datenprovider'}	To edit an existing data provider profile, click .	Um ein bestehendes Datenprovider-Profil zu bearbeiten, klicken Sie bitte hier.	['data provider']	{'data provider': 'Datenprovider'}	['datenprovider']
116	{'reference': 'Referenz'}	In this app, you can create the reference data that are used for the simulations.	In dieser App können Sie die Referenzdaten erstellen, die für die Simulationen verwendet werden.	['reference']	{'reference': 'Referenzdaten'}	['referenzdaten']
117	{'deployment': 'Implementierung'}	Note that after a redeployment, the persistency is deleted and the data access is changed back to virtual.	Beachten Sie, dass nach einer erneuten Implementierung die Persistenz gelöscht und der Datenzugriff wieder auf virtuell umgestellt wird.	['deployment']	{'deployment': 'Implementierung'}	['implementierung']
118	{'release': 'Release'}	Specify date and text information for the release.	Geben Sie Datum und Textinformationen für den Release an.	['release']	{'release': 'Release'}	['release']
119	{'data provider': 'Datenprovider'}	You can search and browse for data products and data providers.	Sie können nach Datenprodukten und Datenprovidern suchen und diese durchstöbern.	['data provider']	{'data provider': 'Datenprovidern'}	['datenprovidern']
120	{'deployment': 'Implementierung'}	saving is available but deployment is blocked	Speichern ist möglich, die Implementierung ist jedoch blockiert.	['deployment']	{'deployment': 'Implementierung'}	['implementierung']
121	{'update': 'aktualisieren'}	You can donwload it to get a data update.	Sie können es herunterladen, um ein Datenupdate zu erhalten.	['update']	{'update': 'Datenupdate'}	['datenupdat']
122	{'skill': 'Qualifikation'}	Skills with a check mark are provided by the resource.	Qualifikationen, die mit einem Häkchen versehen sind, werden von der Ressource bereitgestellt.	['skill']	{'skill': 'Qualifikationen'}	['qualifikation']
123	{'feedback': 'Feedback'}	This provides you feedback on how many entries within the current business entity there are and how many of them match to entries of the target business entity.	Dies gibt Ihnen Feedback darüber, wie viele Einträge in der aktuellen Geschäftseinheit vorhanden sind und wie viele davon mit Einträgen der Ziel-Geschäftseinheit übereinstimmen.	['feedback']	{'feedback': 'Feedback'}	['feedback']
124	{'data provider': 'Datenprovider'}	The data provider profile page provides additional information about the data provider and other products or product groups.	Die Profilseite des Datenproviders bietet zusätzliche Informationen über den Datenprovider sowie über weitere Produkte oder Produktgruppen.	['data provider']	{'data provider': 'Datenprovider'}	['datenprovider']
125	{'insert': 'einfügen'}	insert privilege is removed from the Space Manager	Das Einfügeprivileg wird dem Space Manager entzogen.	['insert']	{'insert': 'Einfügeprivileg'}	['einfügeprivileg']
126	{'Table': 'Tabelle'}	Remote Table Monitor - short descriptions	Fern-Tabellenmonitor – Kurzbeschreibungen	['Table']	{'Table': 'Tabellenmonitor'}	['tabellenmonitor']
127	{'insight': 'Analysen'}	First Steps to Create Insights	Erste Schritte zur Erstellung von Erkenntnissen	['insight']	{'insight': 'Erkenntnissen'}	['erkenntnis']
128	{'deployment': 'Implementierung'}	[read-only] Displays the deployment and error status of the object.	**[Schreibgeschützt] Zeigt den Implementierungs- und Fehlerstatus des Objekts an.**	['deployment']	{'deployment': 'Implementierungs'}	['implementierungen']
129	{'space': 'Space'}	Keeping an overloaded space active can impact running jobs.	Das Aufrechterhalten eines überlasteten Space im aktiven Zustand kann laufende Jobs beeinträchtigen.	['space']	{'space': 'Space'}	['space']
130	{'personal data': 'personenbezogene Daten'}	Personal data concerning insurances and bank or credit card accounts	Personenbezogene Daten im Zusammenhang mit Versicherungen und Bank- oder Kreditkartenkonten	['personal data']	{'personal data': 'Personenbezogene Daten'}	['personenbezogen datum']
131	{'work center': 'Arbeitsplatz'}	Reviewers do not require any work center assignment.	Prüfer benötigen keine Zuweisung zu einem Arbeitsplatz.	['work center']	{'work center': 'Arbeitsplatz'}	['arbeitsplatz']
132	{'create': 'anlegen'}	You can create clauses and signature blocks with this option.	Mit dieser Option können Sie Klauseln und Signaturblöcke erstellen.	['create']	{'create': 'erstellen'}	['erstellen']
133	{'release': 'Release'}	Enter a text briefly describing the data contained in the release, and enter a comment.	Gib einen Text ein, der die im Release enthaltenen Daten kurz beschreibt, und füge einen Kommentar hinzu.	['release']	{'release': 'Release'}	['release']
134	{'space': 'Space'}	Create users so you can assign them to a space.	Erstellen Sie Benutzer, damit Sie sie einem Space zuordnen können.	['space']	{'space': 'Space'}	['space']
135	{'business': 'geschäftlich'}	This allows for multiple associations between the same business entities (in different contexts) and provides additional business meaning to the association.	Dies ermöglicht mehrere Verknüpfungen zwischen denselben geschäftlichen Einheiten (in unterschiedlichen Kontexten) und verleiht diesen Verknüpfungen zusätzliche geschäftliche Bedeutung.	['business']	{'business': 'geschäftlichen'}	['schäftlichen']
136	{'consumption model': 'Verbrauchsmodell'}	The associated business entities will be available as dimensions when you create a consumption model.	Die zugehörigen Geschäftseinheiten stehen Ihnen als Dimensionen zur Verfügung, wenn Sie ein Verbrauchsmodell erstellen.	['consumption model']	{'consumption model': 'Verbrauchsmodell'}	['verbrauchsmodell']
137	{'issue': 'Problem'}	Click an issue.	Wählen Sie ein Problem aus, indem Sie darauf klicken.	['issue']	{'issue': 'Problem'}	['problem']
138	{'consumption model': 'Verbrauchsmodell'}	They allow data to flow into the Business Builder and are combined together to produce fact models and consumption models.	Sie ermöglichen den Datenfluss in den Business Builder und werden kombiniert, um Faktmodelle und Verbrauchsmodelle zu generieren.	['consumption model']	{'consumption model': 'Verbrauchsmodelle'}	['verbrauchsmodell']
139	{'start': 'Start'}	Plant stock at start date of reference	Pflanzenbestand zum Referenzstartdatum	['start']	{'start': 'Startdatum'}	['startdatum']
140	{'namespace': 'Namespace'}	Enable ABAP Manageable Trigger Namespace	ABAP-verwaltbaren Trigger-Namespace aktivieren	['namespace']	{'namespace': 'Trigger-Namespace'}	['trigger']
141	{'deployment': 'Implementierung'}	If the view uses other views that were not changed, these views are not touched by the deployment and therefore the persistency is still available.	Wenn die Ansicht andere Ansichten verwendet, die nicht geändert wurden, werden diese Ansichten von der Implementierung nicht beeinflusst, und die Persistenz bleibt daher weiterhin verfügbar.	['deployment']	{'deployment': 'Implementierung'}	['implementierung']
142	{'job': 'Job'}	Using the Time From and Time To fields, you can filter for jobs that have been created between these two points in time.	Mit den Feldern „Von Uhrzeit“ und „Bis Uhrzeit“ können Sie nach Jobs filtern, die in diesem Zeitraum erstellt wurden.	['job']	{'job': 'Jobs'}	['job']
143	{'space': 'Space'}	Select a space from the drop-down menu.	Wählen Sie einen Space aus dem Dropdown-Menü aus.	['space']	{'space': 'Space'}	['space']
144	{'space': 'Space'}	A database user lets you ingest data from third-party SQL tools and also allows you to expose your space data to third-party SQL tools.	Ein Datenbankbenutzer ermöglicht es Ihnen, Daten aus SQL-Tools von Drittanbietern zu importieren und Ihre Space-Daten auch für SQL-Tools von Drittanbietern verfügbar zu machen.	['space']	{'space': 'Space-Daten'}	['space']
145	{'available capacity': 'Kapazitätsangebot'}	In this popup you can select different periods and change the available capacity of the work center.	In diesem Pop-up können Sie verschiedene Zeiträume auswählen und die verfügbare Kapazität des Arbeitszentrums ändern.	['available capacity']	{'available capacity': 'verfügbare Kapazität'}	['verfügbaren kapazität']
146	{'contract': 'Kontrakt'}	For example, while creating a contract, if you need to exit the contract creation process to double-check and clarify certain details, you can select Contract in Preparation.	Wenn Sie beispielsweise während der Erstellung eines Kontrakts den Prozess unterbrechen müssen, um bestimmte Details zu überprüfen und zu klären, können Sie die Option „Kontrakt in Vorbereitung“ auswählen.	['contract']	{'contract': 'Kontrakt'}	['kontrakt']
147	{'renewal': 'Erneuerung'}	All Dates:You can see all the dates that are auto-generated when the renewal and termination clauses are either defined in the legal transaction or predefined in the context.	Alle Termine: Sie können alle automatisch generierten Termine einsehen, wenn die Klauseln zur Erneuerung und Kündigung entweder in der rechtlichen Transaktion festgelegt oder im Kontext vordefiniert sind.	['renewal']	{'renewal': 'Erneuerung'}	['erneuerung']
148	{'data provider': 'Datenprovider'}	The Data Sharing Cockpit is the tool you use as a the data provider.	Das Data Sharing Cockpit ist das Tool, das Sie als Datenprovider verwenden.	['data provider']	{'data provider': 'Datenprovider'}	['datenprovider']
149	{'space': 'Space'}	The business catalog gives you an overview of all the models you can use, across all the Spaces you are authorized for.	Der Geschäftskatalog bietet Ihnen einen Überblick über alle Modelle, die Sie nutzen können, und zwar über alle Spaces hinweg, für die Sie autorisiert sind.	['space']	{'space': 'Spaces'}	['space']
150	{'space': 'Platz'}	Check how much spaces the task logs are using on a tenant, and define criteria to manually or automatically delete them.	Überprüfen Sie, wie viel Speicherplatz die Aufgabenprotokolle bei einem Mandanten in Anspruch nehmen, und definieren Sie Kriterien, um sie manuell oder automatisch zu löschen.	['space']	{'space': 'Speicherplatz'}	['speicherplatz']
151	{'create': 'erstellen'}	With connection type Open Connectors you can now create connections to the third-party data sources available as connector instances with your  account.	Mit dem Verbindungstyp Open Connectors können Sie jetzt Verbindungen zu den über Ihr Konto als Connector-Instanzen verfügbaren Drittanbieter-Datenquellen erstellen.	['create']	{'create': 'erstellen'}	['erstellen']
152	{'restriction': 'Beschränkung'}	Based on implicit data restrictions, every user has access to the relevant data according to his or her role.	Auf der Grundlage impliziter Datenbeschränkungen hat jeder Benutzer Zugriff auf die für seine Rolle relevanten Daten.	['restriction']	{'restriction': 'Datenbeschränkungen'}	['datenbeschränken']
153	{'transfer': 'übertragen'}	Transfer staffing assignments according to your selection criteria.	Übertragen Sie die Personaleinsatzplanungen gemäß Ihren Auswahlkriterien.	['transfer']	{'transfer': 'Übertragen'}	['übertragen']
154	{'renewal': 'Erneuerung'}	All Dates:You can see all the dates that are auto-generated when renewal and termination clauses are predefined.	Alle Termine: Sie können alle automatisch generierten Termine einsehen, wenn die Klauseln für Erneuerung und Kündigung vorab festgelegt sind.	['renewal']	{'renewal': 'Erneuerung'}	['erneuerung']
155	{'consumption model': 'Verbrauchsmodell'}	Create a fact model to group associated analytical data sets and dimensions together for use in multiple consumption models.	Erstellen Sie ein Faktenmodell, um assoziierte analytische Datensätze und Dimensionen zusammenzufassen, sodass diese in mehreren Verbrauchsmodellen genutzt werden können.	['consumption model']	{'consumption model': 'Verbrauchsmodellen'}	['verbrauchsmodellen']
156	{'space': 'Space'}	This is done to prevent over usage of the space.	Dies geschieht, um eine Überbeanspruchung des Speicherplatzes zu verhindern.	['space']	{'space': 'Speicherplatz'}	['speicherplatz']
157	{'Services': 'Dienste', 'service': 'Dienst'}	Table Services - Enable the In-Memory Storage option to store the table data directly in memory (see ).	Tabellendienste – Aktivieren Sie die Option für den In-Memory-Speicher, um die Tabellendaten direkt im Arbeitsspeicher zu speichern (siehe ).	['Services', 'service']	{'Services': 'Tabellendienste', 'service': 'Dienste'}	['tabellendienst', 'dienst']
158	{'reference': 'Verweis'}	Attributes in consumption models can either reference attributes from the included fact or dimension sources or be calculated from other attributes of the current consumption model.	Attribute in Verbrauchsmodellen können entweder auf Attribute aus den enthaltenen Fakten- oder Dimensionsquellen verweisen oder aus anderen Attributen des aktuellen Verbrauchsmodells berechnet werden.	['reference']	{'reference': 'verweisen'}	['verweisen']
159	{'item': 'Element'}	A configuration (or implementation) item may contain implementation steps which are executed in end user apps.	Ein Konfigurations- (oder Implementierungs-)Element kann Implementierungsschritte umfassen, die in Endbenutzer-Apps ausgeführt werden.	['item']	{'item': 'Element'}	['element']
160	{'space': 'Space'}	Access SAP HANA Deployment Infrastructure containers through  and use your data in the Data Builder or gain access to your space data from your HDI container.	Greifen Sie auf SAP HANA Deployment Infrastructure-Container zu und nutzen Sie Ihre Daten im Data Builder, oder rufen Sie Ihre Space-Daten aus Ihrem HDI-Container ab.	['space']	{'space': 'Space-Daten'}	['space']
161	{'end user': 'Endbenutzer'}	Because the implementation step is executed in an end user app, the changes are not transportable from the Q system to P system.	Da der Implementierungsschritt in einer Endbenutzer-App ausgeführt wird, können die Änderungen nicht vom Q-System zum P-System übertragen werden.	['end user']	{'end user': 'Endbenutzer-App'}	['endbenutzer']
162	{'creator': 'Creator'}	The BI Content Creator creates and changes stories.	Der BI-Content-Creator erstellt und bearbeitet Storys.	['creator']	{'creator': 'Content-Creator'}	['content']
163	{'graphical view': 'grafischer View'}	Click the New Graphical View tile to enter the builder.	Klicken Sie auf die Kachel „Neuer grafischer View“, um den Builder aufzurufen.	['graphical view']	{'graphical view': 'grafischer View'}	['grafisch view']
164	{'issue': 'Problem', 'panel': 'Fenster'}	Click a colored cell or the entire row to view more details about the issues and their category in the Issues panel.	Klicken Sie auf eine farbige Zelle oder die gesamte Zeile, um weitere Details zu den Problemen und deren Kategorie im Problemfenster anzuzeigen.	['issue', 'panel']	{'issue': 'Problemen', 'panel': 'Problemfenster'}	['problem', 'problemfenster']
165	{'bucket': 'Periode'}	The quantities are displayed per month or week (bucket).	Die Mengen werden monatlich oder wöchentlich (pro Periode) angezeigt.	['bucket']	{'bucket': 'Periode'}	['periode']
166	{'script': 'Skript'}	SQLScript (Table Function) - Use SQL Script with support for  statements, loops, and other more complex structures.	SQLScript (Tabellenfunktion) – Verwenden Sie SQLScript mit Unterstützung für Anweisungen, Schleifen und andere komplexere Strukturen.	['script']	{'script': 'SQLScript'}	['sqlscript']
167	{'update': 'Aktualisierung'}	No updates are made on your system.	Auf Ihrem System werden keine Aktualisierungen vorgenommen.	['update']	{'update': 'Aktualisierungen'}	['aktualisierung']
168	{'message': 'Nachricht'}	There are six types of messages:	Es gibt sechs Arten von Nachrichten.	['message']	{'message': 'Nachrichten'}	['nachricht']
169	{'space': 'Space'}	The Business Catalog gives an overview of all the models the business user can use, across all the Spaces they are authorized for.	Der Business-Katalog bietet einen Überblick über alle Modelle, die ein Geschäftsanwender nutzen kann, und zwar in allen Spaces, für die er berechtigt ist.	['space']	{'space': 'Spaces'}	['space']
