	terms	src_raw	mt_raw	src_terms	alg_terms	norm_tgt_terms
177	{'view type': 'clase de vista'}	The lower-level bars visible in expanded view always show assignment information, regardless of the view type you set for the top-level bars.	Las barras de nivel inferior visibles en la vista expandida siempre muestran información de asignación, independientemente del tipo de vista que hayas configurado para las barras de nivel superior.	['view type']	{'view type': 'tipo de vista'}	['tipo de vista']
178	{'save': 'guardar'}	If needed, you can change a team's global ID before you save a team's definition.	Si es necesario, puedes cambiar el ID global de un equipo antes de guardar su definición.	['save']	{'save': 'guardar'}	['guardar']
179	{'job': 'job'}	Activate this field to run this job in online mode.	Activa este campo para ejecutar esta tarea en modo en línea.	['job']	{'job': 'tarea'}	['tarea']
180	{'measure': 'indicador'}	You need to select a measure type.	Debes seleccionar un tipo de medida.	['measure']	{'measure': 'medida'}	['medida']
181	{'template': 'modelo'}	Read the messages to understand if there are any errors or warnings, if the actions you performed on the template were successful, if further action is required from you, and so on.	Lee los mensajes para saber si hay algún error o advertencia, si las acciones que realizaste en la plantilla fueron exitosas, si necesitas realizar alguna acción adicional y así sucesivamente.	['template']	{'template': 'plantilla'}	['plantilla']
182	{'allocation': 'imputación'}	Summary of processes that take place during allocation.	Resumen de los procesos que tienen lugar durante la asignación.	['allocation']	{'allocation': 'asignación'}	['asignación']
183	{'stage': 'fase'}	The JOA has different development stages, such as engineering and design, construction, and production.	El JOA cuenta con distintas fases de desarrollo, como la ingeniería y el diseño, la construcción y la producción.	['stage']	{'stage': 'fases'}	['fase']
184	{'allocation': 'imputación'}	Select this checkbox to allocate costs in the original posted transaction currency during an allocation run.	Marque esta casilla para asignar los costes en la divisa original de la transacción registrada durante el proceso de asignación.	['allocation']	{'allocation': 'asignación'}	['asignación']
185	{'work center': 'puesto de trabajo'}	Choose either one of the scheduling controls to realign your work center schedules:	Selecciona cualquiera de los controles de programación para reorganizar los horarios de tu centro de trabajo.	['work center']	{'work center': 'centro de trabajo'}	['centro de trabajo']
186	{'remove': 'quitar', 'add': 'añadir'}	Add other operators to remove or create columns and filter or aggregate data.	Añade otros operadores para eliminar o crear columnas y filtrar o agrupar datos.	['remove', 'add']	{'remove': 'eliminar', 'add': 'Añade'}	['eliminar', 'añadir']
187	{'business activity': 'actividad empresarial'}	The period of time between the end of the last business activity involving a specific object (for example, a business partner) and the deletion of the corresponding data, subject to applicable laws.	El período de tiempo que transcurre entre el final de la última actividad empresarial relacionada con un objeto específico (por ejemplo, un socio comercial) y la eliminación de los datos correspondientes, con sujeción a la legislación aplicable.	['business activity']	{'business activity': 'actividad empresarial'}	['actividad empresarial']
188	{'add': 'agregar'}	Adding a control characteristic	Agregar una característica de control	['add']	{'add': 'Agregar'}	['agregar']
189	{'partner': 'socio'}	You assign billable costs to the appropriate partners.	Usted asigna los costes facturables a los socios correspondientes.	['partner']	{'partner': 'socios'}	['socio']
190	{'acquisition': 'alta'}	Shows acquisition and retirement information.	Muestra información sobre adquisiciones y bajas.	['acquisition']	{'acquisition': 'adquisiciones'}	['adquisición']
191	{'template': 'plantilla'}	A condition contains expressions and resulting actions defined for a text block used in a template.	Una condición contiene expresiones y las acciones resultantes que se definen para un bloque de texto utilizado en una plantilla.	['template']	{'template': 'plantilla'}	['plantilla']
192	{'item': 'elemento'}	However, there may be exceptions,for instance, when you create a dependency to an item in a different software collection.	Sin embargo, puede haber excepciones, por ejemplo, cuando se crea una dependencia con un elemento de una colección de software diferente.	['item']	{'item': 'elemento'}	['elemento']
193	{'class': 'clase'}	You can create different kinds of bonds by defining class data and the conditions accordingly:	Puedes crear diferentes tipos de vínculos definiendo los datos de la clase y las condiciones correspondientes.	['class']	{'class': 'clase'}	['clase']
194	{'inventory': 'existencias'}	Value changes are posted to the balance sheet account in inventory accounting	Los cambios de valor se contabilizan en la cuenta del balance dentro de la contabilidad de inventarios.	['inventory']	{'inventory': 'inventarios'}	['inventario']
195	{'tab': 'etiqueta'}	On a specific tab, choose Edit Prompts at the right corner, and .	En una pestaña específica, selecciona **Editar indicaciones** en la esquina derecha y procede.	['tab']	{'tab': 'pestaña'}	['pestaña']
196	{'time': 'hora', 'date': 'fecha'}	The categories Text Type, Number Type, and Data Time Type help to validate that the expression matches the chosen data type.	Las categorías Tipo de texto, Tipo numérico y Tipo de datos de tiempo ayudan a verificar que la expresión coincide con el tipo de datos seleccionado.	['time', 'date']	{'time': 'tiempo', 'date': '▔'}	['tiempo', '▔']
197	{'launchpad': 'plataforma de lanzamiento'}	Secure Text is sent only through secure communication channels such as the SAP Fiori launchpad.	El texto seguro solo se envía a través de canales de comunicación seguros, como el SAP Fiori launchpad.	['launchpad']	{'launchpad': 'launchpad'}	['launchpad']
198	{'update': 'actualizar'}	You need to fix the error to be able to complete the persistent view creation or update.	Debes corregir el error para poder completar la creación o actualización de la vista persistente.	['update']	{'update': 'actualización'}	['actualización']
199	{'item': 'posición'}	When choosing to edit, the requisition or item moves out of the Rejected status and enables resubmission.	Al optar por editar, la solicitud o el elemento abandona el estado de Rechazado y permite su reenvío.	['item']	{'item': 'elemento'}	['elemento']
200	{'work center': 'centro de trabajo'}	In this popup you can select different periods and change the available capacity of the work center.	En esta ventana emergente puedes seleccionar distintos períodos y modificar la capacidad disponible del centro de trabajo.	['work center']	{'work center': 'centro de trabajo'}	['centro de trabajo']
201	{'default': 'estándar'}	You can keep the default waste generator or choose the value help in the mandatory Waste Generator field and a dialog box will appear.	Puedes mantener el generador de residuos predeterminado o seleccionar la ayuda de valores en el campo obligatorio de Generador de residuos, y se abrirá una ventana.	['default']	{'default': 'predeterminado'}	['predeterminado']
202	{'save': 'guardar'}	Click Save to active the log access.	Haz clic en Guardar para activar el acceso al registro.	['save']	{'save': 'Guardar'}	['guardar']
203	{'type': 'clase'}	Add run types by choosing Add and selecting run types from the list.	Añade tipos de ejecución seleccionando la opción Añadir y eligiendo los tipos de ejecución de la lista.	['type']	{'type': 'ejecución'}	['ejecución']
204	{'sharing': 'compartición'}	The Data Sharing Cockpit is the tool you use as a the data provider.	El Panel de Compartición de Datos es la herramienta que utilizas como proveedor de datos.	['sharing']	{'sharing': 'compartición'}	['compartición']
205	{'template': 'plantilla'}	An alternative text block is a released version of a text block that is assigned as a possible replacement for another text block used in the template.	Un bloque de texto alternativo es una versión publicada de un bloque de texto que se asigna como posible sustituto de otro bloque de texto utilizado en la plantilla.	['template']	{'template': 'plantilla'}	['plantilla']
206	{'save as': 'grabar como'}	Save as Tile	Guardar como mosaico	['save as']	{'save as': 'mosaico'}	['mosaico']
207	{'tab': 'pestaña'}	Click (Show or hide data preview) to open the Data Preview panel and select any table or view on the editor panel or in the Repository tab of the sources browser.	Haga clic en (Mostrar u ocultar vista previa de datos) para abrir el panel de vista previa y seleccionar cualquier tabla o vista en el panel del editor o en la pestaña del repositorio del navegador de fuentes.	['tab']	{'tab': 'pestaña'}	['pestaña']
208	{'set': 'definir'}	If you lock a release that is not the latest release, all releases which have been published after the release of the marked release are also set to locked.	Si bloqueas una versión que no es la más reciente, todas las versiones publicadas con posterioridad a la versión marcada también quedarán bloqueadas.	['set']	{'set': 'bloqueadas'}	['bloqueado']
209	{'role template': 'plantilla de rol'}	If you want to change the role template that your new custom role will be based on, select  (Select Template), and choose a role.	Si deseas cambiar la plantilla de rol en la que se basará tu nuevo rol personalizado, selecciona (Seleccionar plantilla) y elige un rol.	['role template']	{'role template': 'plantilla de rol'}	['plantilla de rol']
210	{'template': 'modelo'}	If you want to use a different template instead, click on the X to deselect the default template.	Si deseas utilizar una plantilla diferente, haz clic en la X para deseleccionar la plantilla predeterminada.	['template']	{'template': 'plantilla'}	['plantilla']
211	{'item': 'posición', 'add': 'añadir'}	If you want to publish a sourcing project with at least one item of type Project Item, you have to add at least one procurement project and the related information in the section Project Details.	Si deseas publicar un proyecto de aprovisionamiento que incluya al menos un elemento de tipo artículo del proyecto, debes agregar al menos un proyecto de compra y la información relacionada en la sección Detalles del Proyecto.	['item', 'add']	{'item': 'artículo', 'add': 'agregar'}	['artículo', 'agregar']
212	{'usage': 'utilización'}	This is done to prevent over usage of the space.	Esto se hace para evitar un uso excesivo del espacio.	['usage']	{'usage': 'uso'}	['uso']
213	{'endpoint': 'punto final'}	AWS region in your Amazon Athena regional endpoint that you use to make your requests.	Región de AWS en el punto de conexión regional de Amazon Athena que utilizas para realizar tus solicitudes.	['endpoint']	{'endpoint': 'punto'}	['punto']
214	{'delete': 'eliminar'}	In the side navigation area, click  and then click the My Content folder to display the list of packages that you have exported and those from other systems that you have permission to edit or delete.	En el área de navegación lateral, haz clic y, a continuación, haz clic en la carpeta Mi Contenido para mostrar la lista de paquetes que has exportado y aquellos de otros sistemas sobre los que tienes permiso para editar o eliminar.	['delete']	{'delete': 'eliminar'}	['eliminar']
215	{'retrieval': 'retrieval'}	The information retrieval framework (IRF) supports you to comply with the relevant legal requirements for data protection by allowing you to search for and retrieve all personal data of a specified data subject.	El marco de recuperación de información (IRF) te ayuda a cumplir con los requisitos legales pertinentes en materia de protección de datos, al permitirte buscar y recuperar todos los datos personales de un sujeto de datos específico.	['retrieval']	{'retrieval': 'recuperación'}	['recuperación']
216	{'service organization': 'organización de prestación de servicio'}	Service Organization ID	Identificador de la organización de servicio	['service organization']	{'service organization': 'organización de servicio'}	['organización de servicio']
217	{'collection': 'recopilación', 'item set': 'conjunto de posiciones'}	Item set is a collection of items.	Un conjunto de posiciones es una colección de elementos.	['collection', 'item set']	{'collection': 'colección', 'item set': 'conjunto de posiciones'}	['colección', 'conjunto de posición']
218	{'filter': 'filtrar'}	Click in the Create Transform bar, select Filter, and complete the formula ().	"Haz clic en la barra ""Crear transformación"", selecciona ""Filtro"" y completa la fórmula ()."	['filter']	{'filter': 'Filtro'}	['filtro']
219	{'schedule': 'programación'}	If a schedule is set for the data flow, see by when the next run is scheduled.	Si se ha establecido una programación para el flujo de datos, comprueba cuándo está programada la próxima ejecución.	['schedule']	{'schedule': 'programación'}	['programación']
220	{'default': 'por defecto'}	This is now the default setting.	Ahora esta es la configuración predeterminada.	['default']	{'default': 'predeterminada'}	['predeterminado']
221	{'template': 'plantilla'}	Select a task template.	Seleccione una plantilla de tarea.	['template']	{'template': 'plantilla'}	['plantilla']
222	{'union': 'unión'}	The union operator combines two data sets that share the same schema definition.	El operador de unión combina dos conjuntos de datos que comparten la misma definición de esquema.	['union']	{'union': 'unión'}	['unión']
223	{'run type': 'clase de ejecución'}	When you create or edit a situation type, you can define the run type settings:	Al crear o editar un tipo de situación, puedes definir las configuraciones del tipo de ejecución.	['run type']	{'run type': 'ejecución'}	['ejecución']
224	{'recurrence pattern': 'modelo de repetición'}	Define a recurrence pattern for the job.	Defina un patrón de recurrencia para el trabajo.	['recurrence pattern']	{'recurrence pattern': 'patrón de recurrencia'}	['patrón de recurrencia']
225	{'statement': 'declaración'}	[if Create Statement-level Insert Triggers = true] Create Statement-level Update Triggers	"[si la opción ""Crear desencadenadores de inserción a nivel de declaración"" es verdadera] Crear desencadenadores de actualización a nivel de declaración"	['statement']	{'statement': 'declaración'}	['declaración']
226	{'feature': 'función'}	This Feature Scope Description	Esta descripción del alcance de la funcionalidad	['feature']	{'feature': 'funcionalidad'}	['funcionalidad']
227	{'adjustment': 'corrección'}	Billing indicators are assigned to billable postings and identify the type of posting involved, including cash call, normal expenditure, and audit adjustment to a particular partner account.	Los indicadores de facturación se asignan a los registros facturables e identifican el tipo de registro en cuestión, como las solicitudes de efectivo, los gastos normales y los ajustes de auditoría en una cuenta de socio específica.	['adjustment']	{'adjustment': 'ajustes'}	['ajuste']
228	{'local repository': 'repositorio local', 'save': 'guardar'}	To save your table in the local repository, choose Save.	Para guardar su tabla en el repositorio local, seleccione la opción Guardar.	['local repository', 'save']	{'local repository': 'repositorio local', 'save': 'guardar'}	['repositorio local', 'guardar']
229	{'use': 'utilizar'}	In the connections list of your space, select the new connection and click  (Validate Connection) to check if you can use the connection or if it contains any errors.	En la lista de conexiones de tu espacio, selecciona la nueva conexión y haz clic en (Validar conexión) para comprobar si puedes usarla o si contiene algún error.	['use']	{'use': 'usar'}	['usar']
230	{'statement': 'extracto'}	Displays the current status of the statement.	Muestra el estado actual de la declaración.	['statement']	{'statement': 'declaración'}	['declaración']
231	{'consumption': 'compensación', 'allocation': 'contingente'}	Displays data for allocation periods in which allocation consumption exceeds 100%.	Muestra los datos correspondientes a los períodos de asignación en los que el consumo supera el 100 %.	['consumption', 'allocation']	{'consumption': 'consumo', 'allocation': 'asignación'}	['consumo', 'asignación']
232	{'replication': 'reproducción'}	For more information, see Microsoft SQL Server Trigger-Based Replication in the SAP HANA Smart Data Integration and SAP HANA Smart Data Quality Installation and Configuration Guide.	Para obtener más información, consulte la replicación basada en desencadenadores de Microsoft SQL Server en la Guía de instalación y configuración de SAP HANA Smart Data Integration y SAP HANA Smart Data Quality.	['replication']	{'replication': 'replicación'}	['replicación']
233	{'approval': 'autorización', 'Approval': 'Autorización'}	No Approval Required:	No se requiere aprobación	['approval', 'Approval']	{'approval': 'aprobación', 'Approval': 'aprobación'}	['aprobación', 'aprobación']
234	{'transfer': 'transferencia'}	In the Manage Your Solution app under Configure Your Solution make system settings under FinanceContract AccountingPosting and DocumentsDefine Short Assignment for Transfer Postings.	En la aplicación Manage Your Solution, dentro de la sección Configurar tu solución, accede a las opciones del sistema en las categorías Contrato financiero, Contabilidad de publicaciones y Documentos, y define una asignación corta para los registros de transferencias.	['transfer']	{'transfer': 'transferencias'}	['transferencia']
235	{'tab': 'ficha'}	Go to the Parameters tab.	Vaya a la pestaña Parámetros.	['tab']	{'tab': 'pestaña'}	['pestaña']
236	{'production version': 'versión de producción'}	The Production Version:	La versión de producción:	['production version']	{'production version': 'versión de producción'}	['versión de producción']
237	{'replication': 'replicación'}	Choose Publish to finalize the exclusion of fields, or the removal of excluded tables and fields before replication to the target SAP Cloud Platform system.	Seleccione la opción Publicar para finalizar la exclusión de campos o la eliminación de las tablas y campos excluidos antes de la replicación en el sistema SAP Cloud Platform de destino.	['replication']	{'replication': 'replicación'}	['replicación']
238	{'set': 'definir'}	Set Document Status	Establecer el estado del documento	['set']	{'set': 'estado'}	['estado']
239	{'reporting': 'informes'}	It provides a consolidation view along this profit center hierarchy by populating the Profit Center Eliminated reporting dimension.	Proporciona una vista consolidada de esta jerarquía de centros de beneficio mediante el relleno de la dimensión de informe correspondiente al Centro de Beneficio Eliminado.	['reporting']	{'reporting': 'informe'}	['informe']
240	{'use': 'utilizar'}	The authentication type to be used:	Tipo de autenticación que se debe utilizar:	['use']	{'use': 'utilizar'}	['utilizar']
241	{'save': 'guardar'}	The Save Model dialog opens.	Se abre el cuadro de diálogo para guardar el modelo.	['save']	{'save': 'guardar'}	['guardar']
242	{'step': 'paso'}	For implementaiton steps, you will see Go to App button instead of the Configure button.	"Para los pasos de implementación, verás el botón ""Ir a la aplicación"" en lugar del botón ""Configurar""."	['step']	{'step': 'pasos'}	['paso']
243	{'purpose': 'objetivo'}	Complete the Business Purpose section to let others know what your view is about.	Completa la sección de Propósito Empresarial para que los demás sepan tu opinión al respecto.	['purpose']	{'purpose': 'Propósito'}	['propósito']
244	{'quantity contract': 'contrato por cantidad'}	Quantity Contract (MK)	Contrato de Cantidad (MK)	['quantity contract']	{'quantity contract': 'Contrato de Cantidad'}	['contrato de cantidad']
245	{'complete': 'completa'}	You can use the Cancel button to cancel a service confirmation that has been set to completed.	Puedes utilizar el botón Cancelar para anular una confirmación de servicio que haya sido marcada como completada.	['complete']	{'complete': 'completada'}	['completar']
246	{'template': 'plantilla'}	Task Template Status	Estado de la plantilla de tareas	['template']	{'template': 'plantilla'}	['plantilla']
247	{'approval': 'autorización', 'Approval': 'Autorización'}	Approval Process Flow	Flujo del proceso de aprobación	['approval', 'Approval']	{'approval': 'aprobación', 'Approval': 'flujo'}	['aprobación', 'flujo']
248	{'issue': 'problema'}	Fiscal Year and Fiscal Period of issue	Ejercicio fiscal y período fiscal de emisión	['issue']	{'issue': 'emisión'}	['emisión']
249	{'report': 'informe'}	You can use this report to:	Puede utilizar este informe para lo siguiente:	['report']	{'report': 'informe'}	['informe']
250	{'tab': 'ficha'}	You can perform the following actions on this tab:	Puedes realizar las siguientes acciones en esta pestaña:	['tab']	{'tab': 'pestaña'}	['pestaña']
251	{'tab': 'etiqueta'}	Withholding Tax tab.	Pestaña de retención fiscal.	['tab']	{'tab': 'Pestaña'}	['pestaña']
252	{'partner': 'socio'}	Business Partner's IBAN	IBAN del socio comercial	['partner']	{'partner': 'socio'}	['socio']
253	{'network': 'red'}	Enter the network number.	Introduzca el número de red.	['network']	{'network': 'red'}	['red']
254	{'partner': 'socio'}	Business Partner name	Nombre del socio comercial	['partner']	{'partner': 'socio'}	['socio']
255	{'edit': 'editar'}	Edit Service Contracts	Editar contratos de servicio	['edit']	{'edit': 'Editar'}	['editar']
256	{'template': 'modelo', 'delete': 'borrar'}	Select a template and click Delete.	Seleccione una plantilla y haga clic en Eliminar.	['template', 'delete']	{'template': 'plantilla', 'delete': 'Eliminar'}	['plantilla', 'eliminar']
257	{'about': 'info'}	About Goods Issue	Sobre la expedición de mercancías	['about']	{'about': 'Sobre'}	['sobre']
258	{'partner': 'socio'}	Business Partner Name	Nombre del socio comercial	['partner']	{'partner': 'socio'}	['socio']
259	{'role': 'función'}	Business Partner Role	Rol del socio comercial	['role']	{'role': 'Rol'}	['rol']
260	{'template': 'modelo'}	Enter a description for the template in the Description field.	Introduce una descripción para la plantilla en el campo correspondiente.	['template']	{'template': 'plantilla'}	['plantilla']
261	{'performance management': 'gestión del rendimiento'}	SI Performance Management (SF)	Gestión del Rendimiento de SI (SF)	['performance management']	{'performance management': 'Gestión del Rendimiento'}	['gestión de rendimiento']
262	{'contract account': 'cuenta contractual'}	Contract Account Check	Verificación de la cuenta contractual	['contract account']	{'contract account': 'cuenta contractual'}	['cuenta contractual']
263	{'save': 'guardar'}	Save User Settings	Guardar las opciones del usuario	['save']	{'save': 'guardar'}	['guardar']
264	{'type': 'clase'}	Delivery Type Code	Código de tipo de entrega	['type']	{'type': 'tipo'}	['tipo']
265	{'edit': 'tratar'}	You can edit the following UDQs:	Puedes editar las siguientes UDQs:	['edit']	{'edit': 'editar'}	['editar']
266	{'template': 'plantilla'}	Contains one or more expressions and resulting actions defined for a text block present in a template.	Contiene una o más expresiones y las acciones resultantes definidas para un bloque de texto presente en una plantilla.	['template']	{'template': 'plantilla'}	['plantilla']
267	{'tax type': 'tipo de impuesto'}	Description of the tax type.	Descripción del tipo de impuesto.	['tax type']	{'tax type': 'tipo de impuesto'}	['tipo de impuesto']
268	{'usage': 'utilización'}	Add Usage Data	Añadir datos de uso	['usage']	{'usage': 'uso'}	['uso']
269	{'approval': 'autorización', 'Approval': 'Autorización'}	Approval in Progress	Aprobación en trámite	['approval', 'Approval']	{'approval': 'Aprobación', 'Approval': 'Aprobación'}	['aprobación', 'aprobación']
270	{'business content': 'contenido empresarial'}	Business Content Hub	Centro de Contenido de Negocios	['business content']	{'business content': 'Contenido Negocios'}	['contenido negocio']
271	{'mass processing': 'procesamiento en masa'}	Asset Mass Processing	Procesamiento Masivo de Activos	['mass processing']	{'mass processing': 'Procesamiento Masivo'}	['procesamiento masivo']
272	{'schedule': 'programación'}	Your role determines what you can do with a schedule.	Tu rol determina lo que puedes hacer con un horario.	['schedule']	{'schedule': 'horario'}	['horario']
273	{'job': 'tarea'}	specify a limit to avoid excessive concurrent processing due to too many jobs.	Establezca un límite para evitar un procesamiento concurrente excesivo debido a un número demasiado elevado de tareas.	['job']	{'job': 'tareas'}	['tarea']
274	{'target': 'destino'}	Navigate to other targets	Navegar a otros destinos	['target']	{'target': 'destinos'}	['destino']
275	{'role template': 'plantilla de rol'}	Select a role template.	Seleccione una plantilla de rol.	['role template']	{'role template': 'plantilla'}	['plantilla']
276	{'schedule': 'programar'}	Schedule Tax Jobs	Programar tareas relacionadas con impuestos	['schedule']	{'schedule': 'Programar'}	['programar']
277	{'Purchase Orders': 'pedidos', 'about': 'info'}	About Purchase Order	Sobre las órdenes de compra	['Purchase Orders', 'about']	{'Purchase Orders': 'órdenes compra', 'about': 'Sobre'}	['orden compra', 'sobre']
278	{'partner': 'socio'}	Business Partner Event	Evento de Socios de Negocio	['partner']	{'partner': 'Socios'}	['socios']
