	terms	src_raw	mt_raw	src_terms	alg_terms	norm_tgt_terms
0	{'space': 'Space'}	The status of each individual space can be seen from the color code on the upper left corner.	Der Status jedes einzelnen Raumes kann durch den Farbcode in der oberen linken Ecke angezeigt werden.	['space']	{'space': 'Raumes'}	['raum']
1	{'storage': 'Speicher'}	Your contract includes a total number of available capacity units per month which you can allocate as you wish to the compute and storage resources.	Ihr Vertrag enthält eine Gesamtzahl der verfügbaren Speicher-Einheiten pro Monat, die Sie für die Berechnung und Speicher-Ressourcen bereitstellen können.	['storage']	{'storage': 'Speicher-Ressourcen'}	['speicher']
2	{'share': 'teilen'}	share the URL link to other users with the proper editing rights	Teilen Sie den URL-Link mit anderen Benutzern mit den richtigen Bearbeitungsrechten.	['share']	{'share': 'Teilen'}	['teil|teilen']
3	{'constraint': 'Einschränkung'}	Once you remove the constraint for the successor operation, the operation can be rescheduled automatically.	Sobald Sie die Einschränkung für die Nachfolgefunktion entfernt haben, kann die Operation automatisch umgesetzt werden.	['constraint']	{'constraint': 'Einschränkung'}	['einschränkung']
4	{'create': 'erstellen'}	As long as you have not configured the tenant, you can use only administration features of SAP Data Warehouse Cloud (but you cannot create spaces in the Space Management page).	Solange Sie den Mieter nicht konfiguriert haben, können Sie nur Verwaltungsanwendungen der SAP Data Warehouse Cloud verwenden (aber Sie können keine Räume in der Speicherverwaltung erstellen).	['create']	{'create': 'erstellen'}	['erstellen']
5	{'area of responsibility': 'Zuständigkeitsbereich'}	All resources in your area of responsibility will be displayed.	Alle Ressourcen in Ihrer Zuständigkeitsbereich werden angezeigt.	['area of responsibility']	{'area of responsibility': 'Zuständigkeitsbereich'}	['zuständigkeitsbereich']
6	{'trigger': 'Auslöser'}	Required Permissions for Oracle Trigger-Based Replication in the SAP HANA Smart Data Integration and SAP HANA Smart Data Quality Installation and Configuration Guide	Erforderliche Berechtigungen für Oracle Auslöserbasierte Replikation in der SAP HANA Smart Data Integration und SAP HANA Qualitätsinstallation und Konfigurationsleitfaden	['trigger']	{'trigger': 'Auslöserbasierte'}	['auslöserbasieren']
7	{'connector': 'Konnektor'}	Integrate an account with your space to be able to create connections for connector instances and use the connections for data flows.	Integrieren Sie ein Konto mit Ihrem Speicherplatz, um Verbindungen für Konnektorinstantien zu erstellen und die Verbindungen für Datenströme zu nutzen.	['connector']	{'connector': 'Konnektorinstantien'}	['konnektorinstantien']
8	{'customer': 'Debitor', 'supplier': 'Kreditor'}	A payment clearing group is an attribute with which you can categorize your suppliers and customers into groups.	Eine Kreditgebergruppe ist ein Attribut, mit dem Sie Ihre Lieferanten und Kunden in Gruppen kategorisieren können.	['customer', 'supplier']	{'customer': 'Kunden', 'supplier': 'Lieferanten'}	['kunde', 'lieferant']
9	{'demand-driven': 'bedarfsorientiert'}	Select the corresponding checkbox for demand-driven MRP components and/or top-level materials.	Wählen Sie die entsprechende Kontrollleiste für bedarfsorientiert MRP-Komponenten und/oder Top-Level-Materialien aus.	['demand-driven']	{'demand-driven': 'bedarfsorientiert'}	['bedarfsorientieren']
10	{'create': 'erstellen'}	Click Create License to create a license for one or multiple of your data products and generate activation keys that you can share with consumers to allow them to use the licensed scope of data products.	Klicken Sie auf Erstellen einer Lizenz, um eine Lizenz für ein oder mehrere Ihrer Datenprodukte zu erstellen und aktivierungsschlüssel zu generieren, die Sie mit den Verbrauchern teilen können, damit sie den Lizenzbereich der Datenprodukte nutzen können.	['create']	{'create': 'Erstellen'}	['erstellen']
11	{'side panel': 'Seitenbereich'}	Control your union in the Mappings section of its side panel:	Steuern Sie Ihre Union im Bereich Mapping der Seitenbereich:	['side panel']	{'side panel': 'Seitenbereich'}	['seitenbereich']
12	{'indicator': 'Indikator'}	The performance of the model version is evaluated using two main indicators.	Die Leistung der Modellversion wird mit zwei Hauptindikatoren bewertet.	['indicator']	{'indicator': 'Hauptindikatoren'}	['hauptindikator']
13	{'query': 'Abfrage'}	The database then has to decide which job or query has to be dealt with first.	Die Datenbank muss dann entscheiden, welcher Job oder Abfrage zuerst behandelt werden soll.	['query']	{'query': 'Abfrage'}	['abfrage']
14	{'provider': 'Provider'}	Address, e-mail, phone number, etc of the provider	Adresse, E-Mail, Telefonnummer usw. des Anbieters	['provider']	{'provider': 'Anbieters'}	['anbieter']
15	{'space': 'Space'}	The name should be unique within a space.	Der Name sollte innerhalb eines Raumes einzigartig sein.	['space']	{'space': 'Raum'}	['raum']
16	{'intercompany': 'buchungskreisübergreifend'}	Display the IDs of intercompany customer invoices, customer invoices, and intercompany supplier invoices	Anzeigen Sie die IDs der buchungskreisübergreifend, Kundenreifend und der Buchungskreisübergreifend.	['intercompany']	{'intercompany': 'buchungskreisübergreifend'}	['buchungskreisübergreifend']
17	{'history': 'Verlauf', 'release': 'Release'}	To lock a specific release of a data product, open the release history of the selected product, select the release you want to lock and select the checkbox Locked.	Um eine bestimmte Verlauf eines Datenprodukts zu sperren, öffnen Sie die Verlauf des ausgewählten Produkts, wählen Sie die Verlauf, die Sie sperren möchten, und wählen Sie das Kontrollkästchen Sperren.	['history', 'release']	{'history': 'Verlauf', 'release': 'Verlauf'}	['verlauf', 'verlauf']
18	{'data provider': 'Datenprovider'}	This varies depending on how the data provider offers their products.	Dies hängt davon ab, wie der Datenprovider seine Produkte anbietet.	['data provider']	{'data provider': 'Datenprovider'}	['datenprovider']
19	{'access control': 'Zugriffskontrolle'}	Create a data access control to filter data in views and business layer objects by one or more criteria.	Erstellen Sie eine Zugriffskontrolle, um Daten in Ansichten und Business-Layer Objekte nach einem oder mehreren Kriterien zu filtern.	['access control']	{'access control': 'Zugriffskontrolle'}	['zugriffskontrolle']
20	{'data provider': 'Datenprovider'}	Retrieve your favorite data providers and data products.	Erhalten Sie Ihre Lieblingsdatenprovider und Produkte.	['data provider']	{'data provider': 'Datenprovider'}	['datenprovider']
21	{'section': 'Bereich'}	Choose Fuzzy Match to display the Match Thresholds section.	"Wählen Sie Fuzzy Match, um den Bereich ""Schwellen der Übereinstimmung"" anzuzeigen."	['section']	{'section': 'Bereich'}	['bereich']
22	{'provider': 'Provider'}	You can see which products were last released by the provider.	Sie können sehen, welche Produkte zuletzt vom Anbieter veröffentlicht wurden.	['provider']	{'provider': 'Anbieter'}	['anbieter']
23	{'provider': 'Provider'}	It’s maintained by the provider and the information might differs from one provider to another.	Sie wird vom Anbieter aufbewahrt und die Informationen können von einem Anbieter zum anderen unterschiedlich sein.	['provider']	{'provider': 'Anbieter'}	['anbieter']
24	{'release': 'Release'}	To lock all the releases of a data product, select the product and select the checkbox Locked.	Um alle Releases eines Datenprodukts zu sperren, wählen Sie das Produkt aus und wählen Sie das Kontrollkästchen Sperren.	['release']	{'release': 'Releases'}	['release']
25	{'assigned': 'zugewiesen'}	The Product Allocation Order Items card displays only those order items with confirmation quantity assigned to a characteristic value combination containing the specified characteristic or values.	Die Karte Produktzuweisung Bestellungen zeigt nur jene Bestellungen an, die mit der Zugewiesenheit zu einer charakteristischen Wertkombination zugeteilt wurden.	['assigned']	{'assigned': 'Zugewiesenheit'}	['zuwiesenheien']
26	{'storage': 'Speicher', 'space': 'Platz'}	This space is close to exceeding it's storage quota.	Dieser Platz ist fast über dem Speicherquoten.	['storage', 'space']	{'storage': 'Speicherquoten', 'space': 'Platz'}	['speicherquoten', 'platz']
27	{'period': 'Zeitraum'}	Older period includes data older than the last year.	Die Zeitperiode umfasst Daten, die älter als das letzte Jahr sind.	['period']	{'period': 'Zeitperiode'}	['zeitperiode']
28	{'data provider': 'Datenprovider', 'create': 'erstellen'}	Create or Edit a Data Provider Profile	Erstellen oder bearbeiten Sie ein Datenprovider Profil	['data provider', 'create']	{'data provider': 'Datenprovider', 'create': 'Erstellen'}	['datenprovider', 'erstellen']
29	{'data provider': 'Datenprovider'}	In the Switch Data Provider dialog:	Im Dialog Datenprovider:	['data provider']	{'data provider': 'Datenprovider'}	['datenprovider']
30	{'space': 'Space'}	Select your Space	Wählen Sie Ihren Raum aus	['space']	{'space': 'Raum'}	['raum']
31	{'data provider': 'Datenprovider'}	Thanks to the product page created by the data provider you get detailed information on the data product and eventually access to sample data, if available.	Dank der vom Datenprovider erstellten Produktseite erhalten Sie detaillierte Informationen über das Datenprodukt und erhalten dann, falls verfügbar, Zugang zu Daten.	['data provider']	{'data provider': 'Datenprovider'}	['datenprovider']
32	{'consumption model': 'Verbrauchsmodell'}	To guarantee a smooth roll-out of updates to any object without immediately affecting or even breaking fact models, consumption models, or perspectives, you can derive versions of objects.	Um eine reibungslose Ausführung von Updates auf jedes Objekt zu gewährleisten, ohne dass dies sofort Faktenmodelle, Verbrauchsmodelle oder Perspektiven beeinflusst oder sogar zerstört wird, können Versionen von Objekten abgeleitet werden.	['consumption model']	{'consumption model': 'Verbrauchsmodelle'}	['verbrauchsmodell']
33	{'reference quantity': 'Referenzmenge'}	You can display the reference quantity and the simulation quantity side by side.	Sie können die Referenzmenge und die Simulation Seite an Seite anzeigen.	['reference quantity']	{'reference quantity': 'Referenzmenge'}	['referenzmenge']
34	{'period': 'Periode'}	The inspector detects issues for each top-level material per time period.	Der Inspektor erkennt Probleme für jedes Material auf höchster Ebene pro Periode.	['period']	{'period': 'Periode'}	['periode']
35	{'root': 'Stamm'}	Any path used with this connection will be prefixed with this root path.	Jeder mit dieser Verbindung verwendete Weg wird mit diesem Stamm vorgeordnet.	['root']	{'root': 'Stamm'}	['stamm']
36	{'type': 'Art'}	It must be unique for the clause type in each language.	Sie muss für den Art der Art in jeder Sprache einzigartig sein.	['type']	{'type': 'Art'}	['art']
37	{'acceptance': 'Abnahme'}	Enables you to indicate if the acceptance of an ordered item is to take place at the point of origin.	Erlaubt es Ihnen, anzugeben, ob die Abnahme eines bestellten Artikels am Ursprungsort stattfinden soll.	['acceptance']	{'acceptance': 'Abnahme'}	['abnahme']
38	{'space': 'Space'}	Enter a name for your space.	Geben Sie einen Namen für Ihren Raum ein.	['space']	{'space': 'Raum'}	['raum']
39	{'revision': 'überarbeitete Version'}	Changes within the same version are saved as new revisions.	Änderungen innerhalb derselben Version werden als neue Überarbeitete gespeichert.	['revision']	{'revision': 'Überarbeitete'}	['gberarbeiten']
40	{'data provider': 'Datenprovider'}	You can search and purchase analytical data from data providers.	Sie können analytische Daten von Datenprovider suchen und kaufen.	['data provider']	{'data provider': 'Datenprovider'}	['datenprovider']
41	{'start': 'Start'}	The projected plant stock can be calculated from the current stock- or requirements situation for the start date of the reference object.	Der geplanten Anlagenbestand kann aus der aktuellen Lager- oder Anforderungensituation für den Startdatum des Referenzobjekts berechnet werden.	['start']	{'start': 'Startdatum'}	['startdatum']
42	{'pricing date': 'Preisfindungsdatum'}	Provide all the mandatory details such as the Pricing Date, Currency, and Quantity, and choose Simulate.	Geben Sie alle obligatorischen Angaben wie Preisfindungsdatum, Währung und Menge an und wählen Sie Simulieren.	['pricing date']	{'pricing date': 'Preisfindungsdatum'}	['preisfindungsdatum']
43	{'layer': 'Schicht'}	Data Layer Object Properties - Shared Content Between WA and HP	Daten Schicht Objekteigenschaften - Geteilte Inhalte zwischen WA und HP	['layer']	{'layer': 'Schicht'}	['schicht']
44	{'create': 'erstellen'}	Select Create Filter and add your filter conditions:	Wählen Sie Filter erstellen und fügen Sie Ihre Filterbedingungen hinzu:	['create']	{'create': 'Erstellen'}	['erstellen']
45	{'space': 'Space'}	Create a new space.	Erstellen Sie einen neuen Raum.	['space']	{'space': 'Raum'}	['raum']
46	{'type': 'Typ'}	In each condition record where you define a scale value, you can further specify the scale type.	In jeder Einstellung, bei der Sie einen Typ definieren, können Sie den Typ weiter angeben.	['type']	{'type': 'Typ'}	['typ']
47	{'schedule': 'Zeitplan', 'summary': 'Übersicht'}	This is the summary of your schedule.	Dies ist die Übersicht Ihres Zeitplanes.	['schedule', 'summary']	{'schedule': 'Zeitplanes', 'summary': 'Übersicht'}	['zeitplan', 'übersicht']
48	{'space': 'Space'}	Select the Space you would like to work in.	Wählen Sie den Raum aus, in dem Sie arbeiten möchten.	['space']	{'space': 'Raum'}	['raum']
49	{'report': 'Bericht'}	The following reporting periods are not available in this app:	Die folgenden Berichtszeiten sind in dieser App nicht verfügbar:	['report']	{'report': 'Berichtszeiten'}	['berichtszeiten']
50	{'consumption model': 'Verbrauchsmodell'}	You can define measures for your consumption model.	Sie können Maßnahmen für Ihr Verbrauchsmodell definieren.	['consumption model']	{'consumption model': 'Verbrauchsmodell'}	['verbrauchsmodell']
51	{'trigger': 'Auslöser'}	[if Enable Statement-level Triggers = true] Create Statement-level Insert Triggers	[wenn Auslöser auf Auslöserniveau aktiviert werden = wahr]	['trigger']	{'trigger': 'Auslöserniveau'}	['auslöserniveauen']
52	{'order': 'Auftrag'}	The Work Center column lists the resource of the corresponding order.	Die Spalte Arbeitszentrum enthält die Ressource der entsprechenden Auftrag.	['order']	{'order': 'Auftrag'}	['auftrag']
53	{'client': 'Client'}	Make your view visible to analytical clients.	Ihre Ansicht für Analytiker sichtbar machen.	['client']	{'client': 'Analytiker'}	['analytiker']
54	{'interval': 'Intervall'}	Defines a relative time interval for which you want to determine the creation of the necessary physical inventory documents for your cycle counting process.	Definiert einen relativen Zeitrahmen, für den Sie die Erstellung der erforderlichen physischen Inventardokumente für Ihren Zyklus bestimmen möchten.	['interval']	{'interval': 'Zeitrahmen'}	['zeitrahmen']
55	{'space': 'Space'}	see the storage status of your space	Sie sehen den Speicherstatus Ihres Speicherraums an.	['space']	{'space': 'Speicherraums'}	['speicherraumen']
56	{'create': 'erstellen'}	If you wish to create a role without extending a predefined standard role, choose the blank template.	Wenn Sie eine Rolle erstellen möchten, ohne eine vordefinierte Standardrolle zu erweitern, wählen Sie die leere Vorlage.	['create']	{'create': 'erstellen'}	['erstellen']
57	{'task log': 'Aufgabenprotokoll'}	You access these detailed task logs by navigating to the Data Integration Monitor - Details screen of the relevant task.	Sie können auf diese detaillierten Aufgabenprotokollen zugreifen, indem Sie zum Datenintegrationsmonitor - Details der betreffenden Aufgabe navigieren.	['task log']	{'task log': 'Aufgabenprotokollen'}	['aufgabenprotokoll']
58	{'provider': 'Provider'}	When a new delivery is made available by the provider, the Status of your data product is outdated.	Wenn der Anbieter eine neue Lieferung bereitstellt, wird der Status Ihres Datenprodukts veraltet.	['provider']	{'provider': 'Anbieter'}	['anbieter']
59	{'connector': 'Connector'}	Cloud Connectors that you want to use for data flows only don't require an entry in this list.	Cloud Connectors, die Sie nur für Datenströme verwenden möchten, benötigen keine Einträge in dieser Liste.	['connector']	{'connector': '▔'}	['▔ertrat<sos>']
60	{'release': 'Release'}	To publish the release at a later point in time, click Save.	Um die Veröffentlichung zu einem späteren Zeitpunkt zu veröffentlichen, klicken Sie auf Speichern.	['release']	{'release': 'Veröffentlichung'}	['veröffentlichung']
61	{'skill': 'Qualifikation'}	These skills are specified in the resource request.	Diese Qualifikation wird im Ressourcenanfragen angegeben.	['skill']	{'skill': 'Qualifikation'}	['qualifikation']
62	{'provider': 'Provider'}	The provider has removed the data product from the available data product list.	Der Anbieter hat das Datenprodukt aus der verfügbaren Liste entfernt.	['provider']	{'provider': 'Anbieter'}	['anbieter']
63	{'data provider': 'Datenprovider'}	To activate a data provider profile for which you’ve received an activation key, click Activate, enter the key, and click Activate.	Um ein Datenprovider-Profil zu aktivieren, für den Sie einen Aktivierungsschlüssel erhalten haben, klicken Sie auf Aktivieren, geben Sie den Schlüssel ein und klicken Sie auf Aktivieren.	['data provider']	{'data provider': 'Datenprovider'}	['datenprovider']
64	{'Menu': 'Menü'}	Rename a column by clicking MenuChange Business Name	Eine Spalte umbenennen, indem Sie auf MenüChange Name klicken	['Menu']	{'Menu': 'Menü'}	['menü']
65	{'allocation': 'Zuordnung'}	Dynamic Memory Allocation for Data Flows	Dynamische Zuordnung für Datenflüsse	['allocation']	{'allocation': 'Zuordnung'}	['zuordnung']
66	{'data provider': 'Datenprovider'}	To manage your products and licenses, to publish new releases, and to maintain your data provider profile page, the Data Sharing Cockpit offers you tailored apps for each task and workflow.	Um Ihre Produkte und Lizenzen zu verwalten, neue Veröffentlichungen zu veröffentlichen und Ihre Datenprovider-Profilseite zu pflegen, bietet Ihnen das Data Sharing Cockpit für jede Aufgabe und jeden Workflow maßgeschneiderte Apps an.	['data provider']	{'data provider': 'Datenprovider'}	['datenprovider']
67	{'release': 'Release'}	Save or publish a release.	Speichern oder veröffentlichen Sie eine Veröffentlichung.	['release']	{'release': 'Veröffentlichung'}	['veröffentlichung']
68	{'message': 'Nachricht'}	Read the messages to understand if there are any errors or warnings, if the actions you performed on the template were successful, if further action is required from you, and so on.	Lesen Sie die Nachrichten, um zu verstehen, ob Fehler oder Warnungen vorliegen, ob die von Ihnen durchgeführten Nachrichten erfolgreich waren, ob weitere Maßnahmen erforderlich sind, usw.	['message']	{'message': 'Nachrichten'}	['nachricht']
69	{'space': 'Platz'}	Resolve the memory issues by deleting unecessary data in your space or by assigning more memory to your space.	Beheben Sie die Probleme mit dem Speicher, indem Sie unnötige Daten in Ihrem Platz löschen oder mehr Speicherplatz zuweisen.	['space']	{'space': 'Platz'}	['platz']
70	{'end user': 'Endbenutzer'}	Choose the Go to App button to open the end user app.	"Wählen Sie den Knopf ""Gehen Sie zur Anwendung"" zum Öffnen der Endbenutzer-App."	['end user']	{'end user': 'Endbenutzer'}	['endbenutzer']
71	{'data provider': 'Datenprovider'}	Enter an email address for the internal communication between you as the data provider and SAP.	Geben Sie eine E-Mail-Adresse für die interne Kommunikation zwischen Ihnen als Datenprovider und SAP ein.	['data provider']	{'data provider': 'Datenprovider'}	['datenprovider']
72	{'data provider': 'Datenprovider'}	You can now switch to the data provider profile.	Jetzt können Sie auf das Datenprovider-Profil wechseln.	['data provider']	{'data provider': 'Datenprovider'}	['datenprovider']
73	{'create': 'erstellen'}	Create Local Tables	Lokale Tabellen erstellen	['create']	{'create': 'erstellen'}	['erstellen']
74	{'create': 'erstellen'}	If the required connection is not available for selection, you or an administrator need to create the tunnel connection before you can create the SAP BW/4HANA Model Transfer connection.	Wenn die erforderliche Verbindung nicht zur Auswahl verfügbar ist, müssen Sie oder ein Administrator die Tunnelverbindung erstellen, bevor Sie die SAP/4HANA Model Transferverbindung erstellen können.	['create']	{'create': 'erstellen'}	['erstellen']
75	{'space': 'Space'}	Set your space priority.	Stellen Sie Ihre Priorität für den Raum fest.	['space']	{'space': 'Raum'}	['raum']
76	{'breadcrumb': 'Klickpfad'}	Click the consumption model name in the shell bar breadcrumbs to return to it, and then click the  Perspectives tab.	Klicken Sie auf den Verbrauchsmodellnamen in den Klickpfad, um zurückzukehren, und klicken Sie dann auf die Registerkarte Perspektiven.	['breadcrumb']	{'breadcrumb': 'Klickpfad'}	['klickpfad']
77	{'provider': 'Provider'}	You can edit the predefined email and then send it to the provider who then gets in touch with you.	Sie können die vordefinierte E-Mail bearbeiten und dann an den Anbieter senden, der sich dann mit Ihnen in Kontakt setzt.	['provider']	{'provider': 'Anbieter'}	['anbieter']
78	{'incident': 'Meldung'}	For the Heath Check Support  access category, the incident ID references SAP internal incidents raised by automatic health checks.	Für die Kategorie Meldung Unterstützung für den Gesundheitscheck wird die Meldung mit den internen SAP-Incidenzen verwiesen.	['incident']	{'incident': 'Meldung'}	['meldung']
79	{'business name': 'betriebswirtschaftlicher Name'}	Modify the properties of objects, including providing business names for them to make them easier to identify and use for non-technical users.	Modifizieren Sie die Eigenschaften von Objekten, einschließlich der Bereitstellung von betriebswirtschaftlichen Namen, um sie für nichttechnische Benutzer einfacher zu identifizieren und zu verwenden.	['business name']	{'business name': 'betriebswirtschaftlichen Namen'}	['betriebswirtschaftlich name']
80	{'work center': 'Arbeitsplatz'}	You can view all top-level materials of the work center.	Sie können alle hochrangigen Materialien des Arbeitsplatzes anzeigen.	['work center']	{'work center': 'Arbeitsplatz'}	['arbeitsplatz']
81	{'residence period': 'Residenzzeit'}	The residence period is part of the overall retention period.	Die Residenzzeit ist Teil der gesamten Aufbewahrungszeit.	['residence period']	{'residence period': 'Residenzzeit'}	['residenzzeien']
82	{'trigger': 'Auslöser'}	[if Enable Compound Triggers = true] Flush Threshold of Compound Triggers	[wenn Auslöser aktiviert werden = wahr] Flush Threshold of Compound	['trigger']	{'trigger': 'Auslöser'}	['auslöser']
83	{'identifier': 'Identifikator', 'ID': 'ID'}	If such a column does not exist, you may choose to create a calculated column and concatenate values from other columns into it to provide unique identifier values.	Wenn eine solche Spalte nicht existiert, können Sie eine kalkulierte Spalte und Konzentrierwerte aus anderen Spalten erstellen, um einzigartige Identifikator zu liefern.	['identifier', 'ID']	{'identifier': 'Identifikator', 'ID': 'Identifikator'}	['identifikator', 'identifikator']
84	{'start': 'Start'}	If no period range is defined, the start date of the Period Range selection defaults to the current date.	Wenn keine Periode definiert ist, wird das Startdatum der Auswahl der Periode auf die aktuelle Zeit festgelegt.	['start']	{'start': '▔'}	['▔ertrat<sos>']
85	{'key mapping': 'Schlüsselzuordnung'}	If switched on, it indicates that each data record of the currently opened business entity finds a match in the selected target business entity with the configured key mapping.	Wenn sie aktiviert ist, zeigt sie an, dass jede Datenanzeige der aktuell geöffneten Geschäftsordnung in der ausgewählten Zielordnung mit der konfigurierten Schlüsselzuordnung übereinstimmt.	['key mapping']	{'key mapping': 'Schlüsselzuordnung'}	['schlüsselzuordnungen']
86	{'data selection': 'Datenauswahl', 'item': 'Element'}	If you want to restrict the data to include in the release, select a view from the Items table and enter or paste your data queries in the Data Selection section.	Wenn Sie die Daten einschränken möchten, die in der Veröffentlichung enthalten sind, wählen Sie eine Ansicht aus der Tabelle Elemente und geben Sie Ihre Datenanfragen in den Abschnitt Datenauswahl ein oder einfügen.	['data selection', 'item']	{'data selection': 'Datenauswahl', 'item': 'Elemente'}	['datenauswahl', 'element']
87	{'minimum score': 'Mindest-Score'}	Set the minimum score needed to match an input record with a lookup record and place it in the Review results category.	Stellen Sie die Mindest-Score fest, die erforderlich ist, um eine Eingabe-Datei mit einer Such-Datei zu kombinieren, und legen Sie sie in die Kategorie Ergebnisse der Überprüfung ein.	['minimum score']	{'minimum score': 'Mindest-Score'}	['mindest']
88	{'side panel': 'Seitenbereich'}	Control your join in the Mappings section of its side panel:	Steuern Sie Ihre Verbindung im Bereich Mapping der Seitenbereich:	['side panel']	{'side panel': 'Seitenbereich'}	['seitenbereich']
89	{'space': 'Space'}	data related to spaces,	Daten, die mit Raum, Raum und Raum zusammenhängen	['space']	{'space': 'Raum'}	['raum']
