	terms	src_raw	mt_raw	src_terms	alg_terms	norm_tgt_terms
180	{'schedule': 'Terminplan'}	In the Share Schedule dialog, just remove the name of the person whose access you want to revoke.	Im Dialog Terminplan teilen, entfernen Sie einfach den Namen der Person, deren Zugriff Sie widerrufen möchten.	['schedule']	{'schedule': 'Terminplan'}	['terminplan']
181	{'chart': 'Diagramm'}	You can change the start date and time of order operations by dragging them one at a time to the desired date in the chart.	Sie können das Startdatum und die Zeit der Bestellungen ändern, indem Sie sie einzeln zum gewünschten Diagramm ziehen.	['chart']	{'chart': 'Diagramm'}	['diagramm']
182	{'release': 'Release'}	Release Restriction Note	Freigabe Einschränkung Notiz	['release']	{'release': 'Einschränkung'}	['einschränkung']
183	{'type': 'Art'}	You can only display and use these two Planned Count Date From - To fields, when you use the date selection type Static.	Sie können diese beiden geplanten Count Date From - To Felder nur anzeigen und verwenden, wenn Sie den Datum-Auswahltyp Static verwenden.	['type']	{'type': 'Auswahltyp'}	['auswahltyp']
184	{'document': 'Beleg'}	Documents - Action Required	Beleg - Aktion erforderlich	['document']	{'document': 'Beleg'}	['beleg']
185	{'revision': 'überarbeitete Version'}	Restoring an Older Version or Revision of a Text Block	Wiederherstellen einer älteren Version oder Überarbeitete eines Textbloks	['revision']	{'revision': 'Überarbeitete'}	['gberarbeiten']
186	{'data provider': 'Datenprovider'}	The Data Provider profile provides additional information about other products or product groups.	Das Datenprovider-Profil bietet zusätzliche Informationen über andere Produkte oder Produktgruppen.	['data provider']	{'data provider': 'Datenprovider'}	['datenprovider']
187	{'notification': 'Benachrichtigung'}	Notification Sent Date	Benachrichtigung Gesandtes Datum	['notification']	{'notification': 'Gesandtes'}	['gesehen']
188	{'transfer': 'übertragen'}	Check and Transfer Staffing Assignments	Übertragen und überprüfen	['transfer']	{'transfer': 'Übertragen'}	['übertragen']
189	{'create': 'erstellen'}	You can also create your own scenarios.	Sie können auch Ihre eigenen Szenarien erstellen.	['create']	{'create': 'erstellen'}	['erstellen']
190	{'page': 'Page'}	Select your homepage from the dropdown menu.	Wählen Sie Ihre Homepage aus dem Dropdownmenü aus.	['page']	{'page': 'Homepage'}	['homepage']
191	{'restriction': 'Restriktion'}	The following restrictions are applicable:	Die folgenden Restriktion gilt:	['restriction']	{'restriction': 'Restriktion'}	['restriktion']
192	{'about': 'über'}	About Approval Process	Über den Genehmigungsprozess	['about']	{'about': 'Über'}	['über']
193	{'compliance requirement': 'Compliance-Anforderung'}	Once you have selected a category, you must select a subcategory, such as Tasks by Status or Tasks by Status and Compliance Requirement, to refine your analysis results further.	Sobald Sie eine Kategorie ausgewählt haben, müssen Sie eine Unterkategorie auswählen, wie z. B. Aufgaben nach Status oder Aufgaben nach Status und Anforderung, um die Ergebnisse Ihrer Analyse weiter zu verfeinern.	['compliance requirement']	{'compliance requirement': 'Anforderung'}	['anforderung']
194	{'table view': 'Tabellenansicht'}	You can perform the following actions in table view:	In der Tabellenansicht können Sie folgende Aktionen durchführen:	['table view']	{'table view': 'Tabellenansicht'}	['tabellenansicht']
195	{'routing': 'Weiterleitung'}	Routing Information Retrieval	Weiterleitung	['routing']	{'routing': 'Weiterleitung'}	['weiterleitung']
196	{'storage type': 'Speichertyp'}	You can filter by schema or by storage type.	Sie können nach Schema oder Speichertyp filtern.	['storage type']	{'storage type': 'Speichertyp'}	['speichertyp']
197	{'client': 'Client'}	Expose your data in lightweight, closely-focused perspectives to SAP Analytics Cloud and other analytics clients.	Darstellen Sie Ihre Daten in leichtem, genau fokussierten Kontext für SAP Analytics Cloud und andere Analytikclients.	['client']	{'client': 'Analytikclients'}	['analytikclients']
198	{'check': 'Prüfung'}	Enterprise Edition check:	Prüfung Enterprise Edition:	['check']	{'check': 'Prüfung'}	['prüfung']
199	{'consumption model': 'Verbrauchsmodell'}	You can add more specific measures to your consumption model.	Sie können Ihrem Verbrauchsmodell spezifischere Maßnahmen hinzufügen.	['consumption model']	{'consumption model': 'Verbrauchsmodell'}	['verbrauchsmodell']
200	{'schedule': 'Terminplan'}	Reviewers are not allowed to make any changes to the schedule and they do not see the utilization forecast shown when the schedule is in Scoping and Refinement.	Die Bewertungsleute dürfen keinen Terminplan ändern und sehen die Nutzungsprozesse nicht, wenn der Terminplan in Scoping und Refinement angezeigt wird.	['schedule']	{'schedule': 'Terminplan'}	['terminplan']
201	{'query': 'Abfrage'}	In the side navigation area, click , select the space you want to work in, and click Remote Query Monitor to open the monitor.	Klicken Sie im Neben-Navigationsbereich, wählen Sie den Raum, in dem Sie arbeiten möchten, und klicken Sie auf Remote Qufrage Monitor, um den Monitor zu öffnen.	['query']	{'query': 'Qufrage'}	['pufragen']
202	{'space': 'Space'}	Enter your key, accept the terms of use and select a space where the data should be stored.	Geben Sie Ihren Schlüssel ein, akzeptieren Sie die Bedingungen und wählen Sie einen Raum aus, in dem die Daten gespeichert werden sollen.	['space']	{'space': 'Raum'}	['raum']
203	{'assignment': 'Einsatz'}	Save the assignment.	Einsatz speichern.	['assignment']	{'assignment': 'Einsatz'}	['einsatz']
204	{'queue': 'Warteschlange'}	Change queue assignments.	Warteschlange zu ändern.	['queue']	{'queue': 'Warteschlange'}	['warteschlange']
205	{'project': 'Project'}	The following project44 add-ons are available:	Die folgenden Project44 Add-ons sind verfügbar:	['project']	{'project': 'Project44'}	['projustingen']
206	{'work package': 'Work-Package'}	Create new Work Package	Neues Work-Package erstellen	['work package']	{'work package': 'Work-Package'}	['work']
207	{'type': 'Art'}	The following work item types are available:	Es gibt folgende Art von Art.	['type']	{'type': 'Art'}	['art']
208	{'item': 'Artikel'}	To create a new item, choose one of the following options:	Um einen neuen Artikel zu erstellen, wählen Sie eine der folgenden Optionen:	['item']	{'item': 'Artikel'}	['artikel']
209	{'action': 'Aktion', 'Action': 'Aktion'}	This column shows you if quick actions are available.	Diese Spalte zeigt Ihnen, ob Aktion verfügbar ist.	['action', 'Action']	{'action': 'Aktion', 'Action': 'Aktion'}	['aktion', 'aktion']
210	{'schedule': 'Terminplan'}	Included in Schedule (Filter)	In Terminplan (Filter) enthalten	['schedule']	{'schedule': 'Terminplan'}	['terminplan']
211	{'create': 'anlegen'}	Click Create Needs.	Klicken Sie auf Anlegen.	['create']	{'create': 'Anlegen'}	['anlegen']
212	{'intercompany': 'unternehmensübergreifend'}	Check Intercompany Transactions	Unternehmensübergreifend überprüfen	['intercompany']	{'intercompany': 'unternehmensübergreifend'}	['unternehmensübergreifend']
213	{'usage': 'Nutzung'}	Provides additional information about metering of usage.	Er liefert zusätzliche Informationen zur Nutzung.	['usage']	{'usage': 'Nutzung'}	['nutzung']
214	{'Production Order': 'Produktionsauftrag', 'production order': 'Produktionsauftrag'}	The Production Order:	Die Produktionsauftrag:	['Production Order', 'production order']	{'Production Order': '▔', 'production order': 'Produktionsauftrag'}	['▔ertrat<sos>', 'produktionsauftragen']
215	{'document status': 'Dokumentstatus'}	Document Status - Text	Dokumentstatus - Text	['document status']	{'document status': 'Dokumentstatus'}	['dokumentstatusen']
216	{'appointment': 'Torbelegung'}	To create a dock appointment, proceed as follows:	Um eine Torbelegung zu erstellen, gehen Sie wie folgt vor:	['appointment']	{'appointment': 'Belegung'}	['belegung']
217	{'space': 'Space'}	Limitation of a locked space:	Beschränkung eines verschlossenen Raumes:	['space']	{'space': 'Raumes'}	['raum']
218	{'type': 'Typ'}	Select one of the following shipment types:	Wählen Sie einen der folgenden Types aus:	['type']	{'type': 'Types'}	['type']
219	{'position': 'Bestand'}	You have the following position:	Sie haben die folgende Bestand:	['position']	{'position': 'Bestand'}	['bestand']
220	{'load': 'Last'}	Highloaded Periods Card	Last-Periodes Karte	['load']	{'load': 'Last-Periodes'}	['last']
221	{'troubleshooting': 'Fehlerbehebung'}	The following troubleshooting modes are available:	Die folgenden Fehlerbehebungmöglichkeiten sind verfügbar:	['troubleshooting']	{'troubleshooting': 'Fehlerbehebungmöglichkeiten'}	['fehlerbehebungmöglichkeiten']
222	{'access control': 'Zugriffskontrolle'}	When a data access control is applied to a data layer view or a business layer object, the rows of data contained in the object are filtered based on the specified criteria.	Wenn eine Zugriffskontrolle auf eine Ansicht der Datenschicht oder ein Business-Schichtobjekt angewendet wird, werden die in dem Objekt enthaltenen Datenreihen basierend auf den angegebenen Kriterien gefiltert.	['access control']	{'access control': 'Zugriffskontrolle'}	['zugriffskontrolle']
223	{'reset': 'Reset'}	Reset not required	Nicht benötigt wird, um die Reset zu starten	['reset']	{'reset': '▔'}	['▔ertrat<sos>']
224	{'pause': 'pausieren'}	Pause Real-Time Replication for an Agent	Pausieren Echtzeit-Replikation für einen Agenten	['pause']	{'pause': 'Echtzeit-Replikation'}	['echtzeit']
225	{'refresh': 'aktualisieren'}	Enables you to refresh purchase requisitions.	Ermöglicht es Ihnen, die Anfragen zur Aktualisieren zu aktualisieren.	['refresh']	{'refresh': 'Aktualisieren'}	['aktualisieren']
226	{'accept': 'annehmen'}	Then choose Accept.	Dann wählen Sie Annehmen.	['accept']	{'accept': 'Annehmen'}	['annehmen']
227	{'item': 'Artikel'}	Item expiration Date	Artikel Ablaufdatum	['item']	{'item': 'Artikel'}	['artikel']
228	{'disclosure': 'Auskunft'}	Accept Legal Disclosure.	Akzeptieren Sie die Auskunft.	['disclosure']	{'disclosure': 'Auskunft'}	['auskunft']
229	{'provider': 'Anbieter'}	You can edit the predefined email and then send it to the provider.	Sie können die vordefinierte E-Mail bearbeiten und dann an den Anbieter senden.	['provider']	{'provider': 'Anbieter'}	['anbieter']
230	{'task': 'Tätigkeit'}	This task is optional.	Diese Tätigkeit ist optional.	['task']	{'task': 'Tätigkeit'}	['tätigkeit']
231	{'processing': 'Verarbeitung'}	Released for Processing	Verarbeitung veröffentlicht	['processing']	{'processing': 'Verarbeitung'}	['verarbeitung']
232	{'collection': 'Sammlung'}	Enter the name and the description of your role collection.	Geben Sie den Namen und die Beschreibung Ihrer Rolle Sammlung ein.	['collection']	{'collection': 'Sammlung'}	['sammlung']
233	{'icon': 'Symbol'}	Icon on the tab indicates the following:	Das Symbol auf dem Registerkarten zeigt Folgendes an:	['icon']	{'icon': 'Symbol'}	['symbol']
234	{'default': 'Voreinstellung'}	By default the check box is unchecked.	Standardmäßig ist die Voreinstellung nicht gecheckt.	['default']	{'default': 'Voreinstellung'}	['voreinstellung']
235	{'sales': 'Verkauf', 'Sales': 'Verkauf'}	In the sales and delivery processes, the placeholders are resolved in the languages in which the document is printed.	Bei Verkauf und Lieferung werden die Platzhalter in den Sprachen, in denen das Dokument gedruckt wird, gelöst.	['sales', 'Sales']	{'sales': 'Verkauf', 'Sales': 'Verkauf'}	['verkauf', 'verkauf']
236	{'assignment': 'Einsatz'}	P Paste Assignment	P Einsatz einfügen	['assignment']	{'assignment': 'Einsatz'}	['einsatz']
237	{'document': 'Beleg'}	FICA document will be displayed.	Das Beleg wird angezeigt.	['document']	{'document': 'Beleg'}	['beleg']
238	{'payment method': 'Zahlweg'}	Payment Method Text	Zahlweg	['payment method']	{'payment method': 'Zahlweg'}	['zahlwege']
239	{'split criterion': 'Splitkriterium', 'material group': 'Materialgruppe'}	Create, edit and display a single order fulfillment responsibility for a specific split criterion (for example, plant or material group) or a combination of multiple split criteria.	Erstellen, bearbeiten und zeigen Sie eine einzige Verantwortung für die Erfüllung eines bestimmten Splitkriterium (z. B. eine Pflanzen- oder Materialgruppe) oder eine Kombination aus mehreren Splitkriterien an.	['split criterion', 'material group']	{'split criterion': 'Splitkriterium', 'material group': 'Materialgruppe'}	['qplitkriteren', 'materialgruppe']
240	{'personal data': 'personenbezogene Daten', 'report': 'Bericht'}	Personal Data Report	Bericht personenbezogene Daten	['personal data', 'report']	{'personal data': 'personenbezogene Daten', 'report': 'Bericht'}	['personenbezogen datum', 'bericht']
241	{'check': 'Scheck'}	Choose Add Check.	Wählen Sie Scheck hinzufügen.	['check']	{'check': 'Scheck'}	['scheck']
242	{'compliance requirement': 'Compliance-Anforderung'}	Choose View Compliance Requirements.	Wählen Sie die Ansicht-Anforderung.	['compliance requirement']	{'compliance requirement': 'Anforderung'}	['anforderung']
243	{'score': 'Punktzahl'}	Score Output Type	Punktzahl Ausgabe Typ	['score']	{'score': 'Punktzahl'}	['punktzahl']
244	{'sequence': 'Reihenfolge'}	Display the segments in which the sequence is used.	Zeigen Sie die Segmente an, in denen die Reihenfolge verwendet wird.	['sequence']	{'sequence': 'Reihenfolge'}	['reihenfolge']
245	{'create': 'anlegen'}	Click Create Schedule.	Klicken Sie auf Anlegen.	['create']	{'create': 'Anlegen'}	['anlegen']
246	{'cancel': 'zurücknehmen'}	Choose Cancel Dispatch.	Wählen Sie zurücknehmen.	['cancel']	{'cancel': 'zurücknehmen'}	['zurücknehmen']
247	{'difference': 'Abweichung'}	Differences between target costs and actual costs that cannot be attributed to any above mentioned category.	Unterschiede zwischen Zielkosten und tatsächlichen Abweichungskosten, die nicht auf eine der oben genannten Kategorien zurückzuführen sind.	['difference']	{'difference': 'Unterschiede'}	['unterschied']
248	{'routing': 'Weiterleitung'}	The following routing methods are supported:	Die folgenden Weiterleitung werden unterstützt:	['routing']	{'routing': 'Weiterleitung'}	['weiterleitung']
249	{'notification': 'Mitteilung'}	via Notifications or	über Mitteilung oder	['notification']	{'notification': 'Mitteilung'}	['mitteilung']
250	{'verification': 'Verifizierung'}	Controls the verification of the host name field of the server certificate:	Kontrolliert die Verifizierung des Hostnamenfeldes des Serverzertifikats:	['verification']	{'verification': 'Verifizierung'}	['verifizierung']
251	{'following': 'Following', 'action': 'Action', 'Action': 'Action'}	Perform one of the following actions:	Folgende Aktion ausführen:	['following', 'action', 'Action']	{'following': 'Folgende', 'action': 'Aktion', 'Action': 'Aktion'}	['folgend', 'aktion', 'aktion']
252	{'upload': 'Upload'}	Upload Field Fuel	Feldbrennstoff hochladen	['upload']	{'upload': 'Brennstoff'}	['brennstoff']
253	{'maintenance plan': 'Instandhaltungsplan', 'schedule': 'Terminplan', 'share': 'teilen'}	Maintenance planners can modify, share, or delete the schedule.	Instandhaltungsplaner können den Terminplan ändern, teilen oder löschen.	['maintenance plan', 'schedule', 'share']	{'maintenance plan': 'Instandhaltungsplan', 'schedule': 'Terminplan', 'share': 'teilen'}	['instandhaltungsplan', 'terminplan', 'teilen']
254	{'percentage': 'prozentual'}	For example, you can specify which availability match percentage to use for the calculation of the total suitability match.	Zum Beispiel können Sie festlegen, welcher Prozentual der Verfügbarkeit für die Berechnung des Gesamt-Eignungs-Matches verwendet werden soll.	['percentage']	{'percentage': 'Prozentual'}	['prozentual']
255	{'assigned': 'zugewiesen'}	The Product Allocation Order Items card displays only those order items which have product allocation confirmation quantity assigned to characteristic value combinations which belong to the selected product allocation object.	Die Karte Produktzuweisung Bestellpunkte zeigt nur jene Bestellpunkte an, die zu den gewählten Objekten gehören, die zu den charakteristischen Wertschöpfungskombinationen zugewiesen wurden.	['assigned']	{'assigned': 'zugewiesen'}	['zuweisen']
256	{'compliance requirement': 'Compliance-Anforderung'}	Unreleased Compliance Requirements	Unerlassene Compliance-Anforderung	['compliance requirement']	{'compliance requirement': 'Compliance-Anforderung'}	['compliance']
257	{'value': 'Wert'}	By selecting the search button in the field, you are taken to the Define Conditions:the characteristics displayed here are the standard characteristic values that can be used when, for example, you configure product allocation objects.	Durch die Auswahl des Suchknopfes im Feld werden Sie in die Bedingungen definieren:die hier angezeigten Merkmale sind die Standardwerte, die verwendet werden können, wenn Sie zum Beispiel Produktzuweisungobjekte konfigurieren.	['value']	{'value': 'Standardwerte'}	['standardwerten']
258	{'create': 'erstellen'}	Create Analytic Applications	Analytische Anwendungen erstellen	['create']	{'create': 'erstellen'}	['erstellen']
259	{'history': 'History'}	History Retention Period:	Geschichte Speicherung:	['history']	{'history': 'Geschichte'}	['geschichte']
260	{'retention period': 'Aufbewahrungszeitraum'}	Setup of Retention Period	Aufbewahrungszeitraum einrichten	['retention period']	{'retention period': 'Aufbewahrungszeitraum'}	['aufbewahrungszeitraumen']
261	{'item': 'Element'}	Go to Items Completed.	Gehen Sie zu Elementen abgeschlossen.	['item']	{'item': 'Elementen'}	['element']
262	{'create': 'erstellen'}	Create New Options	Neue Erstellen erstellen	['create']	{'create': 'Erstellen'}	['erstellen']
263	{'payment advice': 'Avis'}	Manage Payment Advices	Avis verwalten	['payment advice']	{'payment advice': 'Avis'}	['avis']
264	{'following': 'Following'}	You have entered the following data:	Sie haben folgende Daten eingegeben:	['following']	{'following': 'folgende'}	['folgend']
265	{'dialog text': 'Text im Dialog'}	Select Dialog Text.	Wählen Sie Text im Dialog.	['dialog text']	{'dialog text': 'Text im Dialog'}	['text in dialog']
266	{'contract': 'Vertrag'}	No Valid Contract	Keine gültige Vertrag	['contract']	{'contract': 'Vertrag'}	['vertrag']
267	{'report': 'Report'}	Enter the title for your report:	Geben Sie den Titel für Ihren Bericht ein:	['report']	{'report': 'Bericht'}	['bericht']
268	{'data point': 'Datenpunkt'}	Save Data Points	Datenpunkt speichern	['data point']	{'data point': 'Datenpunkt'}	['datenpunkt']
269	{'side panel': 'Seitenbereich'}	In the side panel, do the following:	Im Seitenbereich tun Sie Folgendes:	['side panel']	{'side panel': 'Seitenbereich'}	['seitenbereich']
270	{'space': 'Space'}	Delete audit log entries by space.	Löschen Sie die Einträge des Auditlogs nach Raum.	['space']	{'space': 'Raum'}	['raum']
271	{'frame': 'Rahmen'}	To calculate the match percentage, the app sums up the free hours per month for the entire request time frame.The result is then divided by total number of required hours.	Um den Prozentsatz zu berechnen, wird die App die freien Stunden pro Monat für den gesamten Rahmen der Anfrage zusammenfassen. Das Ergebnis wird dann durch die Gesamtzahl der erforderlichen Stunden geteilt.	['frame']	{'frame': 'Rahmen'}	['rahmen']
272	{'store': 'Filiale'}	Select the Stores tab page.	Wählen Sie die Seite Filiale.	['store']	{'store': 'Filiale'}	['filiale']
273	{'deployment': 'Deployment'}	Deployment and Activation	Ausrichtung und Aktivierung	['deployment']	{'deployment': 'Ausrichtung'}	['ausrichtung']
274	{'create': 'erstellen'}	You need the DW Administrator role to create database user groups.	Sie benötigen die Rolle des DW-Administrators, um Datenbankgruppen zu erstellen.	['create']	{'create': 'erstellen'}	['erstellen']
275	{'type': 'Typ'}	Select the test plan type from the dropdown list.	Wählen Sie den Typ des Testplans aus der Dropdownliste aus.	['type']	{'type': 'Typ'}	['typ']
276	{'space': 'Space'}	Administration in Spaces	Verwaltung in den Räumen	['space']	{'space': 'Räumen'}	['raum|räumen']
277	{'association': 'Assoziation'}	Select the association(s) to copy and click Create.	Wählen Sie die Assoziation (s) zum Kopieren und klicken Sie auf Erstellen.	['association']	{'association': 'Assoziation'}	['assoziation']
278	{'space': 'Space'}	Choose a space from the drop-down list.	Wählen Sie einen Raum aus der Spülliste aus.	['space']	{'space': 'Raum'}	['raum']
279	{'create': 'erstellen'}	Choose Create Connection.	Wählen Sie Erstellen Verbindung.	['create']	{'create': 'Erstellen'}	['erstellen']
280	{'asset': 'Vermögenswert'}	There are two kinds of assets:	Es gibt zwei Arten von Vermögenswert:	['asset']	{'asset': 'Vermögenswert'}	['vermögenswert']
281	{'clearing entry': 'Ausgleichsbeleg'}	You can reset the clearing of line items as well as reverse the clearing entry.	Sie können die Ausgleichsbeleg wieder einstellen und den Eintrag umkehren.	['clearing entry']	{'clearing entry': 'Ausgleichsbeleg'}	['ausgleichsbeleg']
282	{'regulation': 'Vorschrift'}	Create New Regulation	Eine neue Vorschrift erstellen	['regulation']	{'regulation': 'Vorschrift'}	['vorschrift']
283	{'change document': 'Änderungsdokument', 'type': 'Art'}	Type of Change Document	Änderungungsdokument	['change document', 'type']	{'change document': '▔', 'type': '▔'}	['▔ertrat<sos>', '▔ertrat<sos>']
284	{'create': 'anlegen'}	Create a conditional	Ein bedingtes Anlegen erstellen	['create']	{'create': 'Anlegen'}	['anlegen']
285	{'compliance requirement': 'Compliance-Anforderung'}	Compliance Requirement Country	Compliance-Anforderung Land	['compliance requirement']	{'compliance requirement': 'Compliance-Anforderung'}	['compliance']
286	{'category': 'Warengruppe'}	You must choose at least one category.	Sie müssen mindestens eine Warengruppe auswählen.	['category']	{'category': 'Warengruppe'}	['warengruppe']
287	{'access control': 'Zugriffskontrolle'}	The column containing users ids must be selected as the Principal Name Column in your data access control.	Die Spalte mit Benutzer-Idn müssen als Hauptnamen in der Zugriffskontrolle ausgewählt werden.	['access control']	{'access control': 'Zugriffskontrolle'}	['zugriffskontrolle']
288	{'notification': 'Benachrichtigung'}	List of Notifications	Benachrichtigung	['notification']	{'notification': 'Benachrichtigung'}	['benachrichtigung']
289	{'create': 'anlegen'}	Click AddCreate User.	Klicken Sie auf Anlegen anlegen.	['create']	{'create': 'anlegen'}	['anlegen']
290	{'space': 'Space'}	Save your space.	Speichern Sie Ihren Platz.	['space']	{'space': 'Platz'}	['platz']
291	{'document': 'Beleg'}	Documents - Communication Status	Beleg - Kommunikationsstatus	['document']	{'document': 'Beleg'}	['beleg']
292	{'request': 'Antrag'}	Click Submit Request.	Klicken Sie auf Antrag einreichen.	['request']	{'request': 'Antrag'}	['antrag']
293	{'grouping rule': 'Gruppierungsregel'}	You can trigger the creation of new grouping rules, search for existing grouping rules, and delete grouping rules that are no longer required.	Sie können die Erstellung neuer Gruppierungsregel auslösen, nach bestehenden Gruppenregel suchen und nicht mehr benötigte Löschen löschen.	['grouping rule']	{'grouping rule': 'Gruppierungsregel'}	['gruppierungsregel']
294	{'execute': 'ausführen'}	Check the status before you execute changes.	Überprüfen Sie den Status, bevor Sie Änderungen ausführen.	['execute']	{'execute': 'ausführen'}	['ausführen']
295	{'asset': 'Anlage'}	Navigate from Asset Depreciation Values.	Navigieren Sie von Anlage Abwertung.	['asset']	{'asset': 'Anlage'}	['anlage']
296	{'assignment': 'Einsatz'}	You have the following options to show assignment changes:	Sie haben folgende Einsatzmöglichkeiten zur Anzeige von Einsatzänderungen:	['assignment']	{'assignment': 'Einsatzmöglichkeiten'}	['einsatzmöglichkeit']
297	{'requirement': 'Bedarf'}	Create a Custom Requirement	Ein Bedarf erstellen	['requirement']	{'requirement': 'Bedarf'}	['bedarf']
298	{'comment': 'Comment'}	Click to add file comment	Klicken Sie, um einen Kommentar hinzuzufügen.	['comment']	{'comment': 'Kommentar'}	['kommentar']
299	{'Procedure': 'Verfahren', 'create': 'erstellen'}	This procedure provides the option to create SAP HANA virtual tables in the open SQL schema that refer to objects in data lake.	Dieses Verfahren bietet die Möglichkeit, virtuelle Tabellen von SAP HANA im offenen SQL-Schema zu erstellen, die sich auf Objekte im Datenmeer beziehen.	['Procedure', 'create']	{'Procedure': 'Verfahren', 'create': 'erstellen'}	['verfahren', 'erstellen']
300	{'cost component': 'Kostenkomponente'}	Enter the name of the cost component in the Name field.	Geben Sie den Namen der Kostenkomponente im Feld Name ein.	['cost component']	{'cost component': 'Kostenkomponente'}	['kostenkomponenten']
301	{'issue': 'Issue'}	Create an issue:	Ein Problem erstellen:	['issue']	{'issue': 'Problem'}	['problem']
302	{'query': 'Abfrage'}	Save the query.	Speichern Sie die Abfrage.	['query']	{'query': 'Abfrage'}	['abfrage']
303	{'workflow': 'Workflow', 'create': 'anlegen'}	Create Workflow for Sourcing Projects	Workflow für Sourcing Projekte erstellen	['workflow', 'create']	{'workflow': 'Workflow', 'create': 'erstellen'}	['workflow', 'erstellen']
304	{'scope': 'Umfang'}	Delete a scope.	Umfang löschen.	['scope']	{'scope': 'Umfang'}	['umfang']
305	{'space': 'Space'}	Save the space.	Speichern Sie den Raum.	['space']	{'space': 'Raum'}	['raum']
306	{'tenant': 'Mandant'}	URL of the SuccessFactors Employee Central tenant	URL der Mandant	['tenant']	{'tenant': 'Mandant'}	['mandant']
307	{'status': 'Status'}	Indicates the current status of a master data record.	Zeigt den Status eines Master-Daten-Dateies an.	['status']	{'status': 'Status'}	['status']
