	terms	src_raw	mt_raw	src_terms	alg_terms	norm_tgt_terms
308	{'stage': 'Abschnitt'}	Navigate to Stages.	Navigieren Sie in Abschnitt.	['stage']	{'stage': 'Abschnitt'}	['abschnitt']
309	{'source': 'Source'}	Activation of Data Source:	Aktivierung der Datenquelle:	['source']	{'source': 'Datenquelle'}	['datenquellen']
310	{'level': 'Stufe'}	Packaging levels are used for the following purposes:	Stufe werden für folgende Zwecke verwendet:	['level']	{'level': 'Stufe'}	['stufe']
311	{'create': 'erstellen'}	Create a Target Table in Data Flow	Eine Zieltabelle im Datenfluss erstellen	['create']	{'create': 'Zieltabelle'}	['zieltabelle']
312	{'mapping': 'Zuordnung'}	Enter an optional description for the mapping.	Geben Sie eine optional beschriebene Zuordnung ein.	['mapping']	{'mapping': 'Zuordnung'}	['zuordnung']
313	{'location': 'Ort'}	Specify the locations for the following options:	Geben Sie die Ort für die folgenden Optionen an:	['location']	{'location': 'Ort'}	['ort']
314	{'classification': 'Klassifikation'}	· Select Classification	· Klassifikation auswählen	['classification']	{'classification': 'Klassifikation'}	['klassifikation']
315	{'document type': 'Dokumentart'}	To specify the document type as scheduling agreement.	Um den Dokumentart als Zeitplanvereinbarung anzugeben.	['document type']	{'document type': 'Dokumentart'}	['dokumentart']
316	{'term': 'Term'}	Enter the term.	Geben Sie den Term ein.	['term']	{'term': 'Term'}	['term']
317	{'create': 'erstellen'}	Go to the Filter tab Select Create filter and define your filter conditions:	Gehen Sie zum Registerblatt Filter wählen Erstellen und definieren Sie Ihre Bedingungen:	['create']	{'create': 'Erstellen'}	['erstellen']
318	{'schedule': 'Terminplan'}	Review the schedule.	Überprüfen Sie den Terminplan.	['schedule']	{'schedule': 'Terminplan'}	['terminplan']
319	{'release': 'Release'}	Edit a Release	Eine Veröffentlichung bearbeiten	['release']	{'release': 'Veröffentlichung'}	['veröffentlichung']
320	{'limit': 'Grenzwert'}	For clearing, the lower of the limit defined for your user and the limit defined for your business partner applies.You can also define amount limits for your Financial Accounting users.	Für die Clearing gilt die Grenzwert, die für den Benutzer und den Geschäftspartner festgelegt ist. Sie können auch die Grenzwert für die Finanzbuchhaltung definieren.	['limit']	{'limit': 'Grenzwert'}	['grenzwert']
321	{'Group': 'Group', 'group': 'group'}	For more information, see Service Group Publishing.	Für weitere Informationen finden Sie in der Service Group Publishing.	['Group', 'group']	{'Group': '▔', 'group': 'Group'}	['▔ertrat<sos>', 'group']
322	{'income': 'Einnahmen'}	Format for Income Classification	Format für Einnahmen	['income']	{'income': 'Einnahmen'}	['einnahme']
323	{'access control': 'Zugriffskontrolle'}	You must select one or more columns containing filter criteria as Output Columns in your data access control.	Sie müssen eine oder mehrere Spalten mit Filterkriterien als Ausgangsspalten in Ihrer Zugriffskontrolle auswählen.	['access control']	{'access control': 'Zugriffskontrolle'}	['zugriffskontrolle']
324	{'space': 'Space'}	Name of the space the product belongs to.	Name des Raumes, dem das Produkt gehört.	['space']	{'space': 'Raumes'}	['raum']
325	{'restriction': 'Einschränkung'}	Restrictions on Capture:	Einschränkung:	['restriction']	{'restriction': 'Einschränkung'}	['einschränkung']
326	{'item': 'Element'}	Long descriptions are available for the following items:	Für folgende Elemente stehen lange Beschreibungen zur Verfügung:	['item']	{'item': 'Elemente'}	['element']
327	{'schedule': 'Zeitplan'}	Save the schedule.	Zeitplan speichern.	['schedule']	{'schedule': 'Zeitplan'}	['zeitplan']
328	{'owner': 'Eigentümer'}	Click Select Owner.	Klicken Sie auf Eigentümer.	['owner']	{'owner': 'Eigentümer'}	['eigentümer']
329	{'sequence': 'Abfolge'}	Clear as Sequence	Als Abfolge klar	['sequence']	{'sequence': 'Abfolge'}	['abfolge']
330	{'joint venture accounting': 'Joint Venture Accounting', 'Accounting': 'Accounting'}	Setting up Joint Venture Accounting Cost Objects:	Kosten für Joint Venture Einrichten:	['joint venture accounting', 'Accounting']	{'joint venture accounting': 'Joint Venture', 'Accounting': 'Kosten'}	['joint venturen', 'kosten']
331	{'load': 'Load'}	Download the following files:	Die folgenden Dateien herunterladen:	['load']	{'load': '▔'}	['▔ertrat<sos>']
332	{'template': 'Vorlage'}	For more information about creating an equipment template, see .	Für weitere Informationen zur Erstellung einer Vorlage für Geräte, siehe .	['template']	{'template': 'Vorlage'}	['vorlage']
333	{'batch': 'Batch', 'call': 'Call'}	On the SAP Easy Access menu, choose  Joint venture accounting  Actual posting  Cash call batch ses.	Wählen Sie im Menü SAP Easy Access die Aktualisierung von Cash Call ses.	['batch', 'call']	{'batch': 'Wählen', 'call': 'Wählen'}	['wählen', 'wählen']
334	{'type': 'Typ'}	Profile types include the following:	Zu den Types gehören folgende:	['type']	{'type': 'Types'}	['type']
335	{'project manager': 'Projektleiter', 'requested': 'angefragt'}	It allows you to create an assignment exactly as requested by the project manager.This action is available if the project manager requested a specific resource and no resource has been assigned to the request yet.	Sie ermöglicht es Ihnen, eine Aufgabe genau so zu erstellen, wie vom Projektleiter angefordert wird. Diese Aktion ist verfügbar, wenn der Projektleiter eine bestimmte Ressource angefordert hat und noch keine Ressource zur Anfrage zugewiesen wurde.	['project manager', 'requested']	{'project manager': 'Projektleiter', 'requested': 'angefordert'}	['projektleiter', 'anfordern']
336	{'document class': 'Belegklasse', 'select': 'auswählen'}	The characteristic value columns list the values that have been maintained for the characteristics defined for the document class.You can select the characteristic value by entering the value manually (possible entries are then suggested by the app) or, alternatively, by choosing the value in the subsequent characteristic dialog screen.	Die charakteristischen Wertspalten verzeichnen die Werte, die für die für die Belegklasse definierten Eigenschaften aufbewahrt wurden. Sie können den charakteristischen Wert wählen, indem Sie den Wert manuell eingeben (die möglichen Einträge werden dann von der App vorgeschlagen) oder alternativ den Wert im folgenden Dialog auswählen.	['document class', 'select']	{'document class': 'Belegklasse', 'select': 'wählen'}	['belegklassen', 'wählen']
337	{'action': 'Aktion', 'Action': 'Aktion'}	This column shows you if quick actions are available for a resource request.If a quick action is available, a link is shown.	Diese Spalte zeigt Ihnen, ob eine Aktion für eine Ressourcenanfrage verfügbar ist. Wenn eine Aktion verfügbar ist, wird ein Link angezeigt.	['action', 'Action']	{'action': 'Aktion', 'Action': 'Aktion'}	['aktion', 'aktion']
338	{'obsolete': 'obsolet'}	Indicates whether the MRS item is obsolete.	Zeigt an, ob der MRS-Eintrag obsolet ist.	['obsolete']	{'obsolete': 'obsolet'}	['obsolet']
339	{'release': 'Release'}	Locking a Release	Ein Release sperren	['release']	{'release': 'Release'}	['release']
340	{'audit log': 'Audit-Protokoll'}	Audit log missing detailed information	Audit-Protokoll fehlt detaillierte Informationen	['audit log']	{'audit log': 'Audit-Protokoll'}	['audit']
341	{'transaction': 'Transaktion'}	<description of the transaction>	<Transaktionbeschreibung>	['transaction']	{'transaction': 'Transaktionbeschreibung'}	['transaktionbeschreiben']
342	{'apply': 'anwenden'}	Click Apply to save your new tile.	Klicken Sie auf anwenden, um Ihre neue Fliese zu speichern.	['apply']	{'apply': 'anwenden'}	['anwenden']
343	{'space': 'Space'}	The following views are made available in this space:	In diesem Raum stehen folgende Ansichten zur Verfügung:	['space']	{'space': 'Raum'}	['raum']
344	{'section': 'Abschnitt'}	In the Trusted Origins section, choose between the following options:	Im Abschnitt Vertrauenswürdige Origins wählen Sie zwischen den folgenden Optionen:	['section']	{'section': 'Abschnitt'}	['abschnitt']
345	{'operation': 'Vorgang'}	The dependencies are assigned to the operation.	Die Abhängigkeiten werden der Vorgang zugewiesen.	['operation']	{'operation': 'Vorgang'}	['vorgang']
346	{'template': 'Vorlage'}	Doc.Template Name in Structure	Doc.Template Name in Struktur	['template']	{'template': 'Struktur'}	['struktur']
347	{'primary contact': 'Hauptansprechpartner'}	Primary Contact Indicator	Hauptansprechpartner	['primary contact']	{'primary contact': 'Hauptansprechpartner'}	['hauptansprechpartner']
348	{'message': 'Nachricht'}	These messages are enabled by default.	Diese Nachricht ist standardmäßig aktiviert.	['message']	{'message': 'Nachricht'}	['nachricht']
349	{'transfer': 'Übertragung', 'check': 'Prüfung'}	Open Check and Transfer of Staffing Assignments.	Übertragung von Aufgaben öffnen.	['transfer', 'check']	{'transfer': 'Übertragung', 'check': 'Übertragung'}	['übertragung', 'übertragung']
350	{'compliance requirement': 'Compliance-Anforderung'}	Tasks are created in the compliance requirement.	Aufgaben werden im Compliance-Anforderung erstellt.	['compliance requirement']	{'compliance requirement': 'Compliance-Anforderung'}	['compliance']
351	{'run': 'Lauf'}	Run In Simulation	Lauf in Simulation	['run']	{'run': 'Lauf'}	['lauf']
352	{'transfer amount': 'Überweisungsbetrag'}	Cash Pool Minimum Transfer Amount	Überweisungsbetrag	['transfer amount']	{'transfer amount': 'Überweisungsbetrag'}	['überweisungsbetragen']
353	{'unit of measure': 'Mengeneinheit'}	This class is used to convert a quantity from one unit of measurement to another.	Diese Klasse wird verwendet, um eine Menge von einer Mengeneneinheit in eine andere zu konvertieren.	['unit of measure']	{'unit of measure': 'Mengeneneinheit'}	['mengeneneinheien']
354	{'project manager': 'Projektleiter', 'requested': 'angefragt', 'staffed': 'Person zugeordnet'}	If a resource has been requested and the request has not yet been staffed, you'll see a Quick Assignment link in the Actions column.This allows you to create the assignment exactly as requested by the project manager.	Wenn eine Ressource angefordert wurde und die Anfrage noch nicht beschäftigt wurde, wird im Spalte Aktionen eine Verbindung zur schnellen Zuordnung angezeigt. Damit können Sie die Aufgabe genau so erstellen, wie vom Projektleiter angefordert wurde.	['project manager', 'requested', 'staffed']	{'project manager': 'Projektleiter', 'requested': 'angefordert', 'staffed': 'beschäftigt'}	['projektleiter', 'anfordern', 'beschäftigen']
355	{'connectivity': 'Konnektivität'}	Under Connectivity, choose Destinations.	Wählen Sie unter Konnektivität Destinationen aus.	['connectivity']	{'connectivity': 'Konnektivität'}	['konnektivität']
356	{'open': 'offen'}	Open port in Cloud Foundry environments	In Cloud Foundry offenen	['open']	{'open': 'offenen'}	['offen']
357	{'create': 'erstellen'}	Choose Create new contract from the dropdown list.	Wählen Sie aus der Spülliste einen neuen Vertrag erstellen.	['create']	{'create': 'erstellen'}	['erstellen']
358	{'space': 'Space'}	You can decide how important your space is compared to other spaces.	Sie können entscheiden, wie wichtig Ihr Raum im Vergleich zu anderen ist.	['space']	{'space': 'Raum'}	['raum']
359	{'business user': 'Geschäftsbenutzer'}	To add a business user, proceed as follows:	Um einen Geschäftsbenutzer hinzuzufügen, gehen Sie wie folgt vor:	['business user']	{'business user': 'Geschäftsbenutzer'}	['geschäftsbenutzer']
360	{'location': 'Standort'}	Select a location.	Wählen Sie einen Standort aus.	['location']	{'location': 'Standort'}	['standort']
361	{'payment details': 'Zahlungsdetails'}	You can choose one of the following options for managing payment details:	Sie können eine der folgenden Optionen für die Verwaltung von Zahlungsdetails auswählen:	['payment details']	{'payment details': 'Zahlungsdetails'}	['zahlungsdetails']
362	{'consumption model': 'Verbrauchsmodell'}	The exposed dimension sources can the be used in your consumption models.	Die offengelegten Dimensionquellen können in Ihren Verbrauchsmodell verwendet werden.	['consumption model']	{'consumption model': 'Verbrauchsmodell'}	['verbrauchsmodell']
363	{'document': 'Beleg'}	Specifies the revision date of the document.	Geben Sie das Datum der Überarbeitung des Belegs an.	['document']	{'document': 'Belegs'}	['beleg']
364	{'create': 'erstellen'}	Create and delete teams.	Teams erstellen und löschen.	['create']	{'create': 'erstellen'}	['erstellen']
365	{'transfer': 'Transfer'}	You can also enter your own mass transfer ID.	Sie können auch Ihre eigene Transfer-ID eingeben.	['transfer']	{'transfer': 'Transfer-ID'}	['transfer']
366	{'scope': 'Konsolidierungskreis'}	Go to Scope Builder.	Gehen Sie zum Konsolidierungskreis.	['scope']	{'scope': 'Konsolidierungskreis'}	['konsolidierungskreisen']
367	{'type': 'Typ'}	Choose the relative date type.	Wählen Sie den Typ der relativen Datum.	['type']	{'type': 'Typ'}	['typ']
368	{'property': 'Immobilie'}	Enter Additional Property Information	Geben Sie zusätzliche Immobilie-Informationen ein	['property']	{'property': 'Immobilie'}	['immobilie']
369	{'schedule': 'Terminplan'}	Build a schedule by adding and removing order operations	Erstellen Sie einen Terminplan, indem Sie einen Terminplan hinzufügen und entfernen	['schedule']	{'schedule': 'Terminplan'}	['terminplan']
370	{'query': 'Abfrage'}	The end date and time for the query.	Das Enddatum und die Zeit für die Abfrage.	['query']	{'query': 'Abfrage'}	['abfrage']
371	{'association': 'Zuordnung'}	Associations between entities	Zuordnung zwischen den Einheiten	['association']	{'association': 'Zuordnung'}	['zuordnung']
372	{'batch': 'Charge'}	You can perform batch postings for the activities.	Sie können Charge für die Aktivitäten durchführen.	['batch']	{'batch': 'Charge'}	['charge']
373	{'history': 'Verlauf'}	The history displays information such as:	Die Verlauf zeigt Informationen an wie:	['history']	{'history': 'Verlauf'}	['verlauf']
374	{'report': 'Bericht'}	Click on the reporting task you want to process.	Klicken Sie auf die zu bearbeiten erforderliche Berichtsfunktion.	['report']	{'report': 'Berichtsfunktion'}	['berichtsfunktion']
375	{'business name': 'betriebswirtschaftlicher Name'}	Dimensions are used to group data whose content is logicallyBy default, you see your object’s business name.	Dimensionen werden verwendet, um Daten zu gruppieren, deren Inhalt logisch ist. Standardmäßig sehen Sie den Namen des Geschäftsobjektes.	['business name']	{'business name': 'Geschäftsobjektes'}	['geschäftsobjeken']
376	{'create': 'erstellen'}	Create and manage requisitions using Microsoft Excel	Anfragen erstellen und verwalten mit Microsoft Excel	['create']	{'create': 'erstellen'}	['erstellen']
377	{'service': 'Service'}	Create a Service Key	Erstellen Sie einen Service Key	['service']	{'service': 'Service'}	['service']
378	{'audit': 'Audit'}	Select the Store Audit tab page.	Wählen Sie die Registerkarte Audit.	['audit']	{'audit': 'Audit'}	['audit']
379	{'scenario': 'Szenario'}	Intelligent Scenarios Name	Szenario Name	['scenario']	{'scenario': 'Szenario'}	['szenario']
380	{'item': 'Element'}	Select the item you want to change.	Wählen Sie den Element aus, den Sie ändern möchten.	['item']	{'item': 'Element'}	['element']
381	{'display': 'Anzeige'}	173 Display Phantom Hierarchy	173 Anzeige Anzeige	['display']	{'display': 'Anzeige'}	['anzeige']
382	{'document type': 'Dokumentenart'}	Change the document type.	Ändern Sie den Dokumentenart.	['document type']	{'document type': 'Dokumentenart'}	['dokumentenaren']
383	{'report': 'Report'}	The report does not display any data.	Der Bericht zeigt keine Daten an.	['report']	{'report': 'Bericht'}	['bericht']
384	{'package': 'Paket'}	You can define the following which applies to the packages:	Sie können Folgendes definieren, das für die Pakete gilt:	['package']	{'package': 'Pakete'}	['paket']
385	{'access': 'Zugriff'}	For a simple step-by-step guide see Accessing your HDI container .	Für einen einfachen Schritt für Schritt Anleitung finden Sie Zugriff auf Ihren HDI-Container .	['access']	{'access': 'Zugriff'}	['zugriff']
386	{'origin': 'Ursprung'}	Origin of Rule	Ursprung der Regel	['origin']	{'origin': 'Ursprung'}	['ursprung']
387	{'forecast': 'Forecast'}	Search for forecast.	Suchen Sie nach Prognose.	['forecast']	{'forecast': 'Prognose'}	['prognose']
388	{'asset': 'Anlage'}	Navigate to the superior asset.	Navigieren Sie zum Anlage.	['asset']	{'asset': 'Anlage'}	['anlage']
389	{'indicator': 'Indikator'}	There are two types of busy indicator:	Es gibt zwei Arten von Indiikator:	['indicator']	{'indicator': 'Indiikator'}	['indiikator']
390	{'reference characteristic': 'Bezugsmerkmal'}	Handling of reference Characteristics.	Bezugsmerkmal.	['reference characteristic']	{'reference characteristic': 'Bezugsmerkmal'}	['bezugsmerkmal']
391	{'document': 'Beleg'}	the document tab is clicked,	Die Registerkarte Beleg wird geklickt,	['document']	{'document': 'Beleg'}	['beleg']
392	{'work package': 'Work-Package'}	A work package combines the following information:	Ein Work-Package kombiniert folgende Informationen:	['work package']	{'work package': 'Work-Package'}	['work']
393	{'create': 'erstellen'}	You just need to create a Data Provider Profile.	Sie müssen nur ein Datenanbieterprofil erstellen.	['create']	{'create': 'erstellen'}	['erstellen']
394	{'item': 'Artikel'}	To add an item, select the item from the Items list.	Um einen Artikel hinzuzufügen, wählen Sie den Artikel aus der Liste aus.	['item']	{'item': 'Artikel'}	['artikel']
395	{'time frame': 'Zeitraum'}	You can define a time frame in the following ways:	Sie können einen Zeitraum auf folgende Weise definieren:	['time frame']	{'time frame': 'Zeitraum'}	['zeitraum']
396	{'panel': 'Bereich'}	If the Source Browser panel is not visible on the left of the screen, click Source Browser in the toolbar to show it.	Wenn der Bereich der Quellenbrowser nicht auf der linken Seite des Bildschirms sichtbar ist, klicken Sie auf Quellen in der Werkzeugleiste, um ihn anzuzeigen.	['panel']	{'panel': 'Bereich'}	['bereich']
397	{'facility': 'Objekt'}	Provides general information about the facility.	Er liefert allgemeine Informationen über das Objekt.	['facility']	{'facility': 'Objekt'}	['objekt']
398	{'attribute type': 'Attributstyp'}	Select the attribute type from the following options:	Wählen Sie den Attributstyp aus den folgenden Optionen aus:	['attribute type']	{'attribute type': 'Attributstyp'}	['attributstyp']
399	{'entitlement': 'Anrecht'}	Displays the consumption data for the entitlement.	Zeigt die Verbrauchsdaten für das Anrecht an.	['entitlement']	{'entitlement': 'Anrecht'}	['anrecht']
400	{'layer': 'Layer', 'item': 'Artikel'}	Displays the available item value on this layer.	Zeigt den verfügbaren Artikelwert auf dieser Schicht an.	['layer', 'item']	{'layer': 'Schicht', 'item': 'Artikelwert'}	['schicht', 'artikelwert']
401	{'connector': 'Konnektor'}	Check the state of the connectors:	Überprüfen Sie den Status der Konnektor:	['connector']	{'connector': 'Konnektor'}	['konnektor']
402	{'package': 'Packstück'}	The package contents are displayed.	Die Packstück wird angezeigt.	['package']	{'package': 'Packstück'}	['packstück']
403	{'message': 'Meldung'}	The X-Message is no longer raised.	Die Meldung wird nicht mehr angezeigt.	['message']	{'message': 'Meldung'}	['meldung']
404	{'message': 'Meldung'}	A system messageconfirming that the changes have been saved appears.	Eine Meldung bestätigt, dass die Änderungen gespeichert wurden.	['message']	{'message': 'Meldung'}	['meldung']
405	{'process': 'Process'}	Process Additional information data	Prozess Zusätzliche Informationsdaten	['process']	{'process': 'Prozess'}	['prozeß']
406	{'order': 'Order'}	Order Fulfillment Cockpit	Order-Erfüllung Cockpit	['order']	{'order': 'Erfüllung'}	['erfüllung']
407	{'monitoring': 'Überwachung'}	This is a monitoring list.	Dies ist eine Überwachungsliste.	['monitoring']	{'monitoring': 'Überwachungsliste'}	['kberwachungsliste']
408	{'restriction': 'Einschränkung'}	Limitations and Restrictions	Einschränkung und Einschränkung	['restriction']	{'restriction': 'Einschränkung'}	['einschränkung']
409	{'create': 'erstellen', 'type': 'Typ'}	You can create the following two types of hierarchies:	Sie können die folgenden zwei Types von Hierarchien erstellen:	['create', 'type']	{'create': 'erstellen', 'type': 'Types'}	['erstellen', 'type']
410	{'flag': 'markieren'}	If you flag the Execute ABC checkbox, the alternative control is active and will be used productively when you click Save.	Wenn Sie das Markieren ABC markieren, ist die alternative Steuerung aktiv und wird produktiv verwendet, wenn Sie auf Speichern klicken.	['flag']	{'flag': 'Markieren'}	['markieren']
411	{'raw material': 'Rohmaterial', 'assessment': 'Bewertung', 'compliance': 'Compliance'}	Check the compliance assessments of the raw material.	Überprüfen Sie die Bewertung der Rohmaterialkonformität.	['raw material', 'assessment', 'compliance']	{'raw material': 'Rohmaterial', 'assessment': 'Bewertung', 'compliance': 'Konformität'}	['rohmaterial', 'bewertung', 'konformität']
412	{'processing': 'Verarbeitung'}	BDT - Intrastat Processing	BDT - Intrastat Verarbeitung	['processing']	{'processing': 'Verarbeitung'}	['verarbeitung']
413	{'interaction': 'Kontakt'}	Search for Interactions	Suche nach Kontakt	['interaction']	{'interaction': 'Kontakt'}	['kontakt']
414	{'release': 'Freigabe'}	Release to Production	Freigabe zur Produktion	['release']	{'release': 'Freigabe'}	['freigabe']
415	{'vendor invoice': 'Kreditorenrechnung'}	Enter a description for your vendor invoice.	Geben Sie eine Beschreibung für Ihre Kreditorenrechnung ein.	['vendor invoice']	{'vendor invoice': 'Kreditorenrechnung'}	['kreditorenrechnehen']
416	{'intercompany': 'unternehmensübergreifend'}	Display the Intercompany transactions	Die Unternehmensübergreifend anzeigen	['intercompany']	{'intercompany': 'Unternehmensübergreifend'}	['unternehmensübergreifend']
417	{'create': 'erstellen'}	To create a Forms by Adobe print template, proceed as follows:	Um eine Formular durch Adobe-Druckvorlage zu erstellen, verfolgen Sie Folgendes:	['create']	{'create': 'erstellen'}	['erstellen']
418	{'personal data': 'personenbezogene Daten'}	BAdI, personal data,	BAdI, personenbezogene Daten,	['personal data']	{'personal data': 'personenbezogene Daten'}	['personenbezogen datum']
419	{'relationship': 'Relation'}	Relationships for other SAP applications	Beziehungen für andere SAP-Anwendungen	['relationship']	{'relationship': 'Beziehungen'}	['beziehung']
420	{'table view': 'Tabellenansicht'}	Click Table view.	Klicken Sie auf Tabellenansicht.	['table view']	{'table view': 'Tabellenansicht'}	['tabellenansicht']
421	{'import': 'importieren'}	Issues with importing compliance requirements	Probleme beim Import von Einhaltungserfordernissen	['import']	{'import': 'Import'}	['import']
422	{'note': 'Hinweis'}	Description and Notes	Hinweis und Hinweis	['note']	{'note': 'Hinweis'}	['hinweis']
423	{'apply': 'anwenden'}	Click Apply to close.	Klicken Sie auf anwenden, um zu schließen.	['apply']	{'apply': 'anwenden'}	['anwenden']
424	{'agent': 'Agent'}	Select an agent.	Wählen Sie einen Agent aus.	['agent']	{'agent': 'Agent'}	['agent']
425	{'suspend': 'aussetzen'}	Suspending and Removing Projects, Partners, and Equity Groups from Suspense	Projekte, Partner und Equity Groups aus Suspense auszusetzen und zu entfernen	['suspend']	{'suspend': 'auszusetzen'}	['aussetzen']
426	{'allocation': 'Verrechnung'}	The following allocation steps are included:	Die folgenden Verrechnungsschritte sind enthalten:	['allocation']	{'allocation': 'Verrechnungsschritte'}	['verrechnungsschreiten']
427	{'attachment': 'Anhang'}	The following applies to this type of attachment:	Für diese Anhangsart gilt Folgendes:	['attachment']	{'attachment': 'Anhangsart'}	['anhangsart']
428	{'order': 'Auftrag'}	The Order Card displays the following details:	Die Auftragkarte zeigt folgende Details an:	['order']	{'order': 'Auftragkarte'}	['auftragkarte']
429	{'subscription item': 'Abonnementposition'}	You can now edit the following details of subscription items:	Jetzt können Sie die folgenden Details der Abonnementposition bearbeiten:	['subscription item']	{'subscription item': 'Abonnementposition'}	['abonnementposition']
430	{'contract': 'Kontrakt'}	Creating a contract that references a purchase requisition.	Erstellt einen Vertrag, der auf eine Kaufrequisition verweist.	['contract']	{'contract': 'Vertrag'}	['vertrag']
431	{'classification': 'Klassifizierung'}	In the area Classification	Im Bereich Klassifizierung	['classification']	{'classification': 'Klassifizierung'}	['klassifizierung']
432	{'customer': 'Customer'}	In Customer Business Planning,	In der Kunden-Business Planning	['customer']	{'customer': 'Kunden'}	['kunde']
433	{'characteristic': 'Merkmal'}	Has the following characteristics:	Sie hat folgende Merkmalen:	['characteristic']	{'characteristic': 'Merkmalen'}	['merkmal']
434	{'terminate': 'beenden'}	Terminate the scheduled jobs	Beenden Sie die geplanten Aufgaben	['terminate']	{'terminate': 'Beenden'}	['beend']
435	{'level': 'Stufe'}	The level is now selected.	Die Stufe ist nun ausgewählt.	['level']	{'level': 'Stufe'}	['stufe']
436	{'space': 'Space'}	Currently, only one space can be assigned to access and use the data lake.	Zurzeit kann nur ein Raum zur Nutzung des Datenschiffs zugeteilt werden.	['space']	{'space': 'Raum'}	['raum']
437	{'type': 'Typ'}	Displays the type of the selected algorithm.	Zeigt den Typ des gewählten Algorithmus an.	['type']	{'type': 'Typ'}	['typ']
