	terms	src_raw	mt_raw	src_terms	alg_terms	norm_tgt_terms
90	{'space': 'Space', 'allow': 'erlauben'}	You could also allow your space data to be consumed in your HDI containers.	Sie können auch erlauben, dass Ihre Speicherdaten in Ihren HDI-Containern verbraucht werden.	['space', 'allow']	{'space': 'Speicherdaten', 'allow': 'erlauben'}	['speicherdun', 'erlauben']
91	{'minimum score': 'Mindest-Score'}	Set the minimum score needed to match an input record with a lookup record and place it in the Matched results category.	"Stellen Sie die Mindest-Score fest, die erforderlich ist, um eine Eingabe-Datei mit einer Such-Datei zu kombinieren, und legen Sie sie in die Kategorie ""Matched-Results"" ein."	['minimum score']	{'minimum score': 'Mindest-Score'}	['mindest']
92	{'action': 'Aktion', 'Action': 'Aktion'}	Possible quick actions are:	Aktion ist möglich:	['action', 'Action']	{'action': 'Aktion', 'Action': 'Aktion'}	['aktion', 'aktion']
93	{'condition': 'Bedingung'}	The advantage of this attribute is that you can refer to certain business partners in one condition by using the correct payment clearing group.	Der Vorteil dieses Attributs besteht darin, dass Sie sich mit der richtigen Zahlungsgruppe auf bestimmte Geschäftspartner unter einer Bedingung beziehen können.	['condition']	{'condition': 'Bedingung'}	['bedingung']
94	{'compliance requirement': 'Compliance-Anforderung'}	Specifies the Valid To date for compliance requirements.	Geben Sie den Anforderung-Anforderung für die Anforderung an.	['compliance requirement']	{'compliance requirement': 'Anforderung-Anforderung'}	['anforderung']
95	{'data provider': 'Datenprovider'}	The data provider has entered some details about the product:	Der Datenprovider hat einige Details über das Produkt eingegeben:	['data provider']	{'data provider': 'Datenprovider'}	['datenprovider']
96	{'release': 'Release', 'create': 'erstellen'}	Information on the contained data, which is entered in the Create Release wizard.	Informationen zu den enthaltenen Daten, die im Assistenten erstellen eingegeben werden.	['release', 'create']	{'release': 'Assistenten', 'create': '▔'}	['assistent', '▔ertrat<sos>']
97	{'type': 'Typ'}	In the Permissions page individual permissions assigned to privilege types are displayed	Auf der Seite Erlaubnisse werden einzelne Berechtigungen angezeigt, die den Typ der Privilegien zugewiesen sind.	['type']	{'type': 'Privilegien'}	['privilegium']
98	{'connector': 'Connector'}	Note that Cloud Connectors that you want to use for data flows only don't require an entry in this list.	Beachten Sie, dass Cloud Connectors, die Sie nur für Datenströme verwenden möchten, keine Einträge in dieser Liste benötigen.	['connector']	{'connector': '▔'}	['▔ertrat<sos>']
99	{'space': 'Space'}	The space that was selected to store the data product.	Der Speicherplatz, der für die Speicherung des Datenprodukts ausgewählt wurde.	['space']	{'space': 'Speicherplatz'}	['speicherplatz']
100	{'schedule': 'Zeitplan', 'change': 'Änderung'}	This means that the work center change is only visible in your schedule and is not yet saved in the maintenance order.	Das bedeutet, dass die Änderung des Arbeitszentrums nur im Zeitplan sichtbar ist und noch nicht in der Wartungskarte gespeichert ist.	['schedule', 'change']	{'schedule': 'Zeitplan', 'change': 'Änderung'}	['zeitplan', 'änderung']
101	{'category': 'Kategorie'}	New records that have the same pairing column value as an existing pairing group are automatically placed in the appropriate results category for that pairing group.	Neue Aufzeichnungen mit dem gleichen Paarungs-Säulenwert wie eine bestehende Gruppe werden automatisch in die entsprechende Kategorie für diese Kategorie eingesetzt.	['category']	{'category': 'Kategorie'}	['kategorie']
102	{'service': 'Service'}	SAP and other SAP products and services mentioned herein as well as their respective logos are trademarks or registered trademarks of SAP SE (or an SAP affiliate company) in Germany and other countries.	SAP und die hier genannten Produkte und Dienstleistungen sowie ihre jeweiligen Logos sind Handelsmarken oder eingetragenen Warenzeichen von SAP SE (oder einer SAP-Gesellschafterin) in Deutschland und anderen Ländern.	['service']	{'service': 'Dienstleistungen'}	['dienstleistung']
103	{'data provider': 'Datenprovider'}	To be able to use the data product, the data provider will send an activation key via email that provides authorization to access one or multiple data products.	Um das Datenprodukt nutzen zu können, wird der Datenprovider eine Aktivierungsschlüssel per E-Mail senden, die die Berechtigung zum Zugriff auf ein oder mehrere Datenprodukte ermöglicht.	['data provider']	{'data provider': 'Datenprovider'}	['datenprovider']
104	{'assigned': 'zugewiesen', 'space': 'Platz'}	It might make sense to delete unnecessary data in your space or to extend the assigned storage.	Es kann sinnvoll sein, unnötige Daten in Ihrem Platz zu löschen oder die zugewiesenene Speicherung zu erweitern.	['assigned', 'space']	{'assigned': 'zugewiesenene', 'space': 'Platz'}	['zugewiesenen', 'platz']
105	{'insight': 'Analysen'}	There are many ways to collect and combine data to create business insights:	Es gibt viele Möglichkeiten, Daten zu sammeln und zu kombinieren, um Geschäftsinformationen zu erstellen:	['insight']	{'insight': 'Geschäftsinformationen'}	['geschäftsinformation']
106	{'create': 'anlegen'}	You can create a text block inside the text block library.	Sie können einen Textblock in der Textbibliothek erstellen.	['create']	{'create': 'erstellen'}	['erstellen']
107	{'space': 'Space'}	This space is no longer active.	Dieser Raum ist nicht mehr aktiv.	['space']	{'space': 'Raum'}	['raum']
108	{'storage': 'Speicher'}	Allocate your capacity units to compute and storage resources.	Bereitstellen Sie Ihre Speicher-Einheiten zur Berechnung und Speicherressourcen.	['storage']	{'storage': 'Speicherressourcen'}	['speicherressourcen']
109	{'share': 'freigeben'}	Generate keys that you can share with consumers to allow them to use the licensed scope of data products.	Erzeugen Sie Schlüssel, die Sie mit den Verbrauchern teilen können, damit sie den Lizenzbereich der Datenprodukte nutzen können.	['share']	{'share': 'teilen'}	['teilen']
110	{'release': 'Release'}	The release is highlighted on the landing page with the flag “Not published yet”.	Die Veröffentlichung wird auf der Landing-Seite mit der Flagge noch nicht veröffentlicht.	['release']	{'release': 'Veröffentlichung'}	['veröffentlichung']
111	{'access control': 'Zugriffskontrolle', 'restriction': 'Beschränkung'}	For each business entity used as data restriction, you need to map each key member to the data access control's output column.	Für jede als Zugriffskontrolle verwendete Geschäftsgruppe müssen Sie jedes Schlüsselmitglied in die Ausgangsspalte der Beschränkung des Zugriffskontrolles einführen.	['access control', 'restriction']	{'access control': 'Zugriffskontrolle', 'restriction': 'Beschränkung'}	['zugriffskontrolle', 'beschränkung']
112	{'snapshot': 'Snapshot'}	Create a schedule to load new snapshot of data asynchronously and recurrently in the background according to the defined settings.	Erstellen Sie einen Zeitplan, um neue Snapshots von Daten in den Hintergrund nach den definierten Einstellungen asynchron und wiederholt zu laden.	['snapshot']	{'snapshot': 'Snapshots'}	['snapshot']
113	{'interface': 'Schnittstelle', 'message': 'Nachricht'}	The interfaces you have subscribed to for monitoring, including the status of the individual messages.	Die Schnittstelle, auf die Sie sich zur Überwachung abonniert haben, einschließlich des Status der einzelnen Nachricht.	['interface', 'message']	{'interface': 'Schnittstelle', 'message': 'Nachricht'}	['schnittstelle', 'nachricht']
114	{'deployment': 'Implementierung'}	A pop up informs you about the source updates before you can go with deployment.	Ein Popup informiert Sie über die Quell-Updates, bevor Sie mit der Implementierung beginnen können.	['deployment']	{'deployment': 'Implementierung'}	['implementierung']
115	{'data provider': 'Datenprovider'}	To edit an existing data provider profile, click .	Um ein vorhandenes Datenprovider-Profil zu bearbeiten, klicken Sie auf .	['data provider']	{'data provider': 'Datenprovider'}	['datenprovider']
116	{'reference': 'Referenz'}	In this app, you can create the reference data that are used for the simulations.	In dieser App können Sie die Referenzdaten erstellen, die für die Simulationen verwendet werden.	['reference']	{'reference': 'Referenzdaten'}	['referenzdaten']
117	{'deployment': 'Implementierung'}	Note that after a redeployment, the persistency is deleted and the data access is changed back to virtual.	Beachten Sie, dass nach einer Neupleemierung die Persistenz gelöscht wird und der Datenaustausch wieder virtuell wird.	['deployment']	{'deployment': 'Neupleemierung'}	['neupleemierung']
118	{'release': 'Release'}	Specify date and text information for the release.	Geben Sie Datum und Textinformationen für die Veröffentlichung an.	['release']	{'release': 'Veröffentlichung'}	['veröffentlichung']
119	{'data provider': 'Datenprovider'}	You can search and browse for data products and data providers.	Sie können nach Datenprodukten und Datenprovider suchen und durchsuchen.	['data provider']	{'data provider': 'Datenprovider'}	['datenprovider']
120	{'deployment': 'Implementierung'}	saving is available but deployment is blocked	Speicherung ist verfügbar, aber Implementierung ist blockiert	['deployment']	{'deployment': 'Implementierung'}	['implementierung']
121	{'update': 'aktualisieren'}	You can donwload it to get a data update.	Sie können es herunterladen, um eine aktuisieren Daten zu erhalten.	['update']	{'update': 'aktuisieren'}	['aktuisieren']
122	{'skill': 'Qualifikation'}	Skills with a check mark are provided by the resource.	Qualifikation mit einem Überprüfungsschild werden von der Ressource bereitgestellt.	['skill']	{'skill': 'Qualifikation'}	['qualifikation']
123	{'feedback': 'Feedback'}	This provides you feedback on how many entries within the current business entity there are and how many of them match to entries of the target business entity.	Dies gibt Ihnen Feedback darüber, wie viele Einträge innerhalb des aktuellen Geschäftsentituts vorhanden sind und wie viele davon mit dem Zielentitlement übereinstimmen.	['feedback']	{'feedback': 'Feedback'}	['feedback']
124	{'data provider': 'Datenprovider'}	The data provider profile page provides additional information about the data provider and other products or product groups.	Die Datenprovider-Profilseite bietet zusätzliche Informationen über den Datenprovider und andere Produkte oder Produktgruppen.	['data provider']	{'data provider': 'Datenprovider'}	['datenprovider']
125	{'insert': 'einfügen'}	insert privilege is removed from the Space Manager	Einfügen wird vom Raummanager entfernt	['insert']	{'insert': 'Einfügen'}	['einfugen']
126	{'Table': 'Tabelle'}	Remote Table Monitor - short descriptions	Tabelle - kurze Beschreibungen	['Table']	{'Table': 'Tabelle'}	['tabelle']
127	{'insight': 'Analysen'}	First Steps to Create Insights	Erste Schritte zur Erstellung von Analysen	['insight']	{'insight': 'Analysen'}	['analyse']
128	{'deployment': 'Implementierung'}	[read-only] Displays the deployment and error status of the object.	[nur für Lesen] zeigt die Implementierung und den Fehlerstatus des Objekts an.	['deployment']	{'deployment': 'Implementierung'}	['implementierung']
129	{'space': 'Space'}	Keeping an overloaded space active can impact running jobs.	Wenn ein überlasteter Raum aktiv bleibt, kann es Auswirkungen auf die Arbeitsplätze haben.	['space']	{'space': 'Raum'}	['raum']
130	{'personal data': 'personenbezogene Daten'}	Personal data concerning insurances and bank or credit card accounts	Personenbezogene Daten über Versicherungen und Bank- oder Kreditkartenkonten	['personal data']	{'personal data': 'personenbezogene Daten'}	['personenbezogen datum']
131	{'work center': 'Arbeitsplatz'}	Reviewers do not require any work center assignment.	Die Prüfer benötigen keine Arbeitsplatzvergabe.	['work center']	{'work center': 'Arbeitsplatzvergabe'}	['arbeitsplatzvergabe']
132	{'create': 'anlegen'}	You can create clauses and signature blocks with this option.	Mit dieser Option können Sie Klauseln und Anlegenblöcke erstellen.	['create']	{'create': 'erstellen'}	['erstellen']
133	{'release': 'Release'}	Enter a text briefly describing the data contained in the release, and enter a comment.	Geben Sie einen Text ein, der die Daten der Veröffentlichung kurz beschreibt, und geben Sie einen Kommentar ein.	['release']	{'release': 'Veröffentlichung'}	['veröffentlichung']
134	{'space': 'Space'}	Create users so you can assign them to a space.	Benutzer erstellen, damit Sie sie einem Raum zuweisen können.	['space']	{'space': 'Raum'}	['raum']
135	{'business': 'geschäftlich'}	This allows for multiple associations between the same business entities (in different contexts) and provides additional business meaning to the association.	Dies ermöglicht mehrere Assoziationen zwischen den gleichen geschäftlichen Einrichtungen (in verschiedenen Kontexten) und bietet der Vereinigung zusätzliche geschäftliche Bedeutung.	['business']	{'business': 'geschäftlichen'}	['schäftlichen']
136	{'consumption model': 'Verbrauchsmodell'}	The associated business entities will be available as dimensions when you create a consumption model.	Die zugehörigen Geschäftssektoren werden als Dimensionen verfügbar sein, wenn Sie ein Verbrauchsmodell erstellen.	['consumption model']	{'consumption model': 'Verbrauchsmodell'}	['verbrauchsmodell']
137	{'issue': 'Problem'}	Click an issue.	Klicken Sie auf ein Problem.	['issue']	{'issue': 'Problem'}	['problem']
138	{'consumption model': 'Verbrauchsmodell'}	They allow data to flow into the Business Builder and are combined together to produce fact models and consumption models.	Sie ermöglichen den Datenfluss in den Business Builder und werden zusammen kombiniert, um Faktenmodelle und Verbrauchsmodelle zu erzeugen.	['consumption model']	{'consumption model': 'Verbrauchsmodelle'}	['verbrauchsmodell']
139	{'start': 'Start'}	Plant stock at start date of reference	Anlagebestand zum Startdatum der Referenz	['start']	{'start': 'Startdatum'}	['startdatum']
140	{'namespace': 'Namespace'}	Enable ABAP Manageable Trigger Namespace	Aktivieren Sie den ABAP-Manageable Trigger Namespace	['namespace']	{'namespace': 'Namespace'}	['namespacen']
141	{'deployment': 'Implementierung'}	If the view uses other views that were not changed, these views are not touched by the deployment and therefore the persistency is still available.	Wenn die Ansicht andere Ansichten verwendet, die nicht geändert wurden, werden diese Ansichten nicht durch die Implementierung berührt und daher ist die Persistenz noch verfügbar.	['deployment']	{'deployment': 'Implementierung'}	['implementierung']
142	{'job': 'Job'}	Using the Time From and Time To fields, you can filter for jobs that have been created between these two points in time.	Mit den Feldern Zeit von und Zeit zu können Sie nach Jobs filtern, die zwischen diesen beiden Punkten erstellt wurden.	['job']	{'job': 'Jobs'}	['job']
143	{'space': 'Space'}	Select a space from the drop-down menu.	Wählen Sie einen Raum aus dem Spülmenü aus.	['space']	{'space': 'Raum'}	['raum']
144	{'space': 'Space'}	A database user lets you ingest data from third-party SQL tools and also allows you to expose your space data to third-party SQL tools.	Ein Datenbanknutzer ermöglicht es Ihnen, Daten von SQL-Tools von Drittanbietern einzunehmen und ermöglicht es Ihnen auch, Ihren Raum für Drittanbieter auszusetzen.	['space']	{'space': 'Raum'}	['raum']
145	{'available capacity': 'Kapazitätsangebot'}	In this popup you can select different periods and change the available capacity of the work center.	In diesem Popup können Sie verschiedene Perioden auswählen und die Kapazitätsangebot des Arbeitszentrums ändern.	['available capacity']	{'available capacity': 'Kapazitätsangebot'}	['kapazitätsangebot']
146	{'contract': 'Kontrakt'}	For example, while creating a contract, if you need to exit the contract creation process to double-check and clarify certain details, you can select Contract in Preparation.	Wenn Sie zum Beispiel beim Erstellen eines Vertrags aus dem Vertragsschöpfungsprozess herausgehen müssen, um bestimmte Details zu überprüfen und zu klären, können Sie den Vertrag in Vorbereitung auswählen.	['contract']	{'contract': 'Vertrag'}	['vertrag']
147	{'renewal': 'Erneuerung'}	All Dates:You can see all the dates that are auto-generated when the renewal and termination clauses are either defined in the legal transaction or predefined in the context.	Alle Daten: Alle Daten werden automatisch erstellt, wenn die Erneuerung und die Kündigung der Klauseln entweder im rechtlichen Geschäft definiert oder im Kontext vordefiniert werden.	['renewal']	{'renewal': 'Erneuerung'}	['erneuerung']
148	{'data provider': 'Datenprovider'}	The Data Sharing Cockpit is the tool you use as a the data provider.	Das Datenverteilungs Cockpit ist das Werkzeug, das Sie als Datenprovider verwenden.	['data provider']	{'data provider': 'Datenprovider'}	['datenprovider']
149	{'space': 'Space'}	The business catalog gives you an overview of all the models you can use, across all the Spaces you are authorized for.	Der Geschäftskatalog gibt Ihnen einen Überblick über alle Modelle, die Sie nutzen können, über alle Bereiche, für die Sie autorisiert sind.	['space']	{'space': 'Bereiche'}	['bereich']
150	{'space': 'Platz'}	Check how much spaces the task logs are using on a tenant, and define criteria to manually or automatically delete them.	Überprüfen Sie, wie viele Platz die Aufgabenprotokolle auf einem Mieter verwenden und definieren Sie Kriterien, um sie manuell oder automatisch zu löschen.	['space']	{'space': 'Platz'}	['platz']
151	{'create': 'erstellen'}	With connection type Open Connectors you can now create connections to the third-party data sources available as connector instances with your  account.	Mit dem Anschlusstyp Open Connectors können Sie jetzt Verbindungen zu den als Konstellungen verfügbaren Datenquellen von Drittanbietern mit Ihrem Konto erstellen.	['create']	{'create': 'erstellen'}	['erstellen']
152	{'restriction': 'Beschränkung'}	Based on implicit data restrictions, every user has access to the relevant data according to his or her role.	Auf Basis von impliziten Beschränkung haben alle Benutzer Zugang zu den relevanten Daten nach ihrer Rolle.	['restriction']	{'restriction': 'Beschränkung'}	['beschränkung']
153	{'transfer': 'übertragen'}	Transfer staffing assignments according to your selection criteria.	Übertragen Sie die Aufgaben nach Ihren Auswahlkriterien.	['transfer']	{'transfer': 'Übertragen'}	['übertragen']
154	{'renewal': 'Erneuerung'}	All Dates:You can see all the dates that are auto-generated when renewal and termination clauses are predefined.	Alle Daten: Sie können alle Daten sehen, die automatisch erzeugt werden, wenn Erneuerung und Kündigung vordefiniert werden.	['renewal']	{'renewal': 'Erneuerung'}	['erneuerung']
155	{'consumption model': 'Verbrauchsmodell'}	Create a fact model to group associated analytical data sets and dimensions together for use in multiple consumption models.	Erstellen Sie ein Faktenmodell, um die zugehörigen analytischen Datenmengen und -dimensionen zusammenzuschließen, um sie in mehreren Verbrauchsmodellen zu verwenden.	['consumption model']	{'consumption model': 'Verbrauchsmodellen'}	['verbrauchsmodellen']
156	{'space': 'Space'}	This is done to prevent over usage of the space.	Dies soll zur Verhinderung einer Übernutzung des Speichers dienen.	['space']	{'space': 'Speichers'}	['speicher']
157	{'Services': 'Dienste', 'service': 'Dienst'}	Table Services - Enable the In-Memory Storage option to store the table data directly in memory (see ).	Dienste in der Speicherung (siehe Dienst)	['Services', 'service']	{'Services': 'Dienste', 'service': 'Dienste'}	['dienst', 'dienst']
158	{'reference': 'Verweis'}	Attributes in consumption models can either reference attributes from the included fact or dimension sources or be calculated from other attributes of the current consumption model.	Attribute in Verbrauchsmodellen können entweder aus den enthaltenen Fakten- oder Dimensionquellen bezogen werden oder aus anderen Merkmalen des aktuellen Verweismodells berechnet werden.	['reference']	{'reference': 'bezogen'}	['beziehen']
159	{'item': 'Element'}	A configuration (or implementation) item may contain implementation steps which are executed in end user apps.	Ein Element der Konfiguration (oder Implementierung) kann Implementierungsschritte enthalten, die in Endnutzeranwendungen ausgeführt werden.	['item']	{'item': 'Element'}	['element']
160	{'space': 'Space'}	Access SAP HANA Deployment Infrastructure containers through  and use your data in the Data Builder or gain access to your space data from your HDI container.	Zugriff auf die Container der SAP HANA Deployment Infrastructure durch den Datenbauer oder Zugang zu den Speicherplatz aus dem HDI-Container.	['space']	{'space': 'Speicherplatz'}	['speicherplatz']
161	{'end user': 'Endbenutzer'}	Because the implementation step is executed in an end user app, the changes are not transportable from the Q system to P system.	Da der Implementierungsschritt in einer Endbenutzer-App ausgeführt wird, können die Änderungen nicht vom Q-System zum P-System transportiert werden.	['end user']	{'end user': 'Endbenutzer-App'}	['endbenutzer']
162	{'creator': 'Creator'}	The BI Content Creator creates and changes stories.	Der BI Content Creator erstellt und ändert Geschichten.	['creator']	{'creator': 'Creator'}	['creator']
163	{'graphical view': 'grafischer View'}	Click the New Graphical View tile to enter the builder.	Klicken Sie auf die Zeile Neue Grafikcher Ansicht, um den Builder einzugeben.	['graphical view']	{'graphical view': 'Grafikcher Ansicht'}	['grafikcher ansicht']
164	{'issue': 'Problem', 'panel': 'Fenster'}	Click a colored cell or the entire row to view more details about the issues and their category in the Issues panel.	Klicken Sie auf eine Farbe oder die gesamte Zeile, um weitere Details über die Probleme und ihre Kategorie im Fenster zu sehen.	['issue', 'panel']	{'issue': 'Probleme', 'panel': 'Fenster'}	['problem', 'fenster']
165	{'bucket': 'Periode'}	The quantities are displayed per month or week (bucket).	Die Mengen werden pro Monat oder Woche angezeigt (Bucket).	['bucket']	{'bucket': 'Bucket'}	['bucket']
166	{'script': 'Skript'}	SQLScript (Table Function) - Use SQL Script with support for  statements, loops, and other more complex structures.	SQLScript (Tabellenfunktion) - SQL Script mit Unterstützung für Anweisungen, Schleifen und andere komplexere Strukturen.	['script']	{'script': 'Script'}	['scripen']
167	{'update': 'Aktualisierung'}	No updates are made on your system.	Keine Aktualisierung wird auf Ihrem System durchgeführt.	['update']	{'update': 'Aktualisierung'}	['aktualisierung']
168	{'message': 'Nachricht'}	There are six types of messages:	Es gibt sechs Nachrichttypen:	['message']	{'message': 'Nachrichttypen'}	['nachrichttypen']
169	{'space': 'Space'}	The Business Catalog gives an overview of all the models the business user can use, across all the Spaces they are authorized for.	Der Business Catalog gibt einen Überblick über alle Modelle, die der Geschäftsnutzer nutzen kann, in allen Bereichen, für die er autorisiert ist.	['space']	{'space': 'Bereichen'}	['bereich']
170	{'trigger': 'Auslöser'}	For more information, see Oracle Trigger-Based Replication in the SAP HANA Smart Data Integration and SAP HANA Smart Data Quality Installation and Configuration Guide.	Weitere Informationen finden Sie in Oracle Trigger-Based Replication in der SAP HANA Smart Data Integration und SAP HANA Quality Installation and Configuration Guide.	['trigger']	{'trigger': 'Trigger-Based'}	['trigger']
171	{'side panel': 'Seitenbereich'}	Complete or consult other side panel sections as appropriate:	Füllen Sie die Seitenbereich aus oder konsultieren Sie sie entsprechend:	['side panel']	{'side panel': 'Seitenbereich'}	['seitenbereich']
172	{'create': 'erstellen'}	Choose an appropriate data entity to provide data to your business entity and click Create to open the editor.	Wählen Sie eine geeignete Datenentität, um Daten an Ihr Unternehmen zu erstellen, und klicken Sie auf Erstellen, um den Editor zu öffnen.	['create']	{'create': 'Erstellen'}	['erstellen']
173	{'type': 'Art'}	Choose from the following types:	Wählen Sie aus den folgenden Art:	['type']	{'type': 'Art'}	['art']
174	{'message': 'Nachricht'}	The messages are grouped in the following categories:	Die Nachricht wird in folgenden Kategorien gruppiert:	['message']	{'message': 'Nachricht'}	['nachricht']
175	{'order': 'Auftrag'}	Narrow down the list of orders based on their main work center.	Verknüpfen Sie die Auftragliste nach ihrem Hauptzentrum.	['order']	{'order': 'Auftragliste'}	['auftraglisen']
176	{'incident': 'Meldung'}	Once the incident has been processed, you can create the  bridge instance in the dedicated page SAP BW Bridge of the Configuration area with the size you’ve allocated (see ).	Nach der Bearbeitung des Vorfalls können Sie die Meldung in der speziellen Seite SAP BW Bridge des Konfigurationsbereichs mit der angegebenen Größe erstellen (siehe	['incident']	{'incident': 'Vorfalls'}	['vorfall']
177	{'session': 'Sitzung'}	Select a session.	Wählen Sie eine Sitzung aus.	['session']	{'session': 'Sitzung'}	['sitzung']
178	{'schedule': 'Dokument'}	Create a schedule:	Ein Dokument erstellen:	['schedule']	{'schedule': 'Dokument'}	['dokument']
179	{'document': 'Beleg'}	Document - Action Required	Beleg - Aktion erforderlich	['document']	{'document': 'Beleg'}	['beleg']
