	terms	src_raw	mt_raw	src_terms	alg_terms	norm_tgt_terms
174	{'message': 'Nachricht'}	The messages are grouped in the following categories:	Die Nachrichten sind in folgende Kategorien unterteilt:	['message']	{'message': 'Nachrichten'}	['nachricht']
175	{'order': 'Auftrag'}	Narrow down the list of orders based on their main work center.	Die Liste der Aufträge basierend auf ihrem Hauptarbeitsplatz eingrenzen.	['order']	{'order': 'Aufträge'}	['auftrag']
176	{'incident': 'Meldung'}	Once the incident has been processed, you can create the  bridge instance in the dedicated page SAP BW Bridge of the Configuration area with the size you’ve allocated (see ).	Sobald die Meldung bearbeitet wurde, können Sie die Brückeninstanz auf der speziellen Seite SAP BW Bridge im Konfigurationsbereich mit der von Ihnen zugewiesenen Größe erstellen (siehe ).	['incident']	{'incident': 'Meldung'}	['meldung']
177	{'session': 'Sitzung'}	Select a session.	Wählen Sie eine Sitzung.	['session']	{'session': 'Sitzung'}	['sitzung']
178	{'schedule': 'Dokument'}	Create a schedule:	Erstellen Sie ein Dokument:	['schedule']	{'schedule': 'Dokument'}	['dokument']
179	{'document': 'Beleg'}	Document - Action Required	Beleg - erforderliche Maßnahmen	['document']	{'document': 'Beleg'}	['beleg']
180	{'schedule': 'Terminplan'}	In the Share Schedule dialog, just remove the name of the person whose access you want to revoke.	"Entfernen Sie einfach im Dialog ""Terminplan freigeben"" den Namen der Person, deren Zugriff Sie widerrufen möchten."	['schedule']	{'schedule': 'Terminplan'}	['terminplan']
181	{'chart': 'Diagramm'}	You can change the start date and time of order operations by dragging them one at a time to the desired date in the chart.	Sie können das Startdatum und die Uhrzeit der Auftragsoperationen ändern, indem Sie diese einzeln im Diagramm auf das gewünschte Datum ziehen.	['chart']	{'chart': 'Diagramm'}	['diagramm']
182	{'release': 'Release'}	Release Restriction Note	Release-Beschränkungsvermerk	['release']	{'release': 'Release-Beschränkungsvermerk'}	['release']
183	{'type': 'Art'}	You can only display and use these two Planned Count Date From - To fields, when you use the date selection type Static.	"Sie können die beiden Felder ""Geplantes Zähldatum von - bis"" nur anzeigen und verwenden, wenn Sie die Datumswahlart ""Statisch"" verwenden."	['type']	{'type': 'Datumswahlart'}	['datumswahlaren']
184	{'document': 'Beleg'}	Documents - Action Required	Belege - erforderliche Maßnahmen	['document']	{'document': 'Belege'}	['beleg']
185	{'revision': 'überarbeitete Version'}	Restoring an Older Version or Revision of a Text Block	Wiederherstellung einer älteren Version oder einer überarbeiteten Version eines Textblocks	['revision']	{'revision': 'überarbeiteten'}	['überarbeiten']
186	{'data provider': 'Datenprovider'}	The Data Provider profile provides additional information about other products or product groups.	Das Datenprovider-Profil bietet zusätzliche Informationen zu anderen Produkten oder Produktgruppen.	['data provider']	{'data provider': 'Datenprovider'}	['datenprovider']
187	{'notification': 'Benachrichtigung'}	Notification Sent Date	Versanddatum der Benachrichtigung	['notification']	{'notification': 'Benachrichtigung'}	['benachrichtigung']
188	{'transfer': 'übertragen'}	Check and Transfer Staffing Assignments	Überprüfen und Übertragen von Personalzuweisungen	['transfer']	{'transfer': 'Übertragen'}	['übertragen']
189	{'create': 'erstellen'}	You can also create your own scenarios.	Sie können auch eigene Szenarien erstellen.	['create']	{'create': 'erstellen'}	['erstellen']
190	{'page': 'Page'}	Select your homepage from the dropdown menu.	Wählen Sie Ihre HomePage aus dem Dropdown-Menü aus.	['page']	{'page': 'HomePage'}	['homepagen']
191	{'restriction': 'Restriktion'}	The following restrictions are applicable:	Die folgenden Restriktionen sind anwendbar:	['restriction']	{'restriction': 'Restriktionen'}	['restriktion']
192	{'about': 'über'}	About Approval Process	Zum Genehmigungsprozess	['about']	{'about': 'Genehmigungsprozess'}	['genehmigungsprozen']
193	{'compliance requirement': 'Compliance-Anforderung'}	Once you have selected a category, you must select a subcategory, such as Tasks by Status or Tasks by Status and Compliance Requirement, to refine your analysis results further.	Sobald Sie eine Kategorie ausgewählt haben, müssen Sie eine Unterkategorie auswählen, z. B. Aufgaben nach Status oder Aufgaben nach Status und Compliance-Anforderung, um Ihre Analyseergebnisse weiter zu verfeinern.	['compliance requirement']	{'compliance requirement': 'Compliance-Anforderung'}	['compliance']
194	{'table view': 'Tabellenansicht'}	You can perform the following actions in table view:	In der Tabellenansicht können Sie die folgenden Aktionen ausführen:	['table view']	{'table view': 'Tabellenansicht'}	['tabellenansicht']
195	{'routing': 'Weiterleitung'}	Routing Information Retrieval	Abruf von Weiterleitungsinformationen	['routing']	{'routing': 'Weiterleitungsinformationen'}	['weiterleitungsinformation']
196	{'storage type': 'Speichertyp'}	You can filter by schema or by storage type.	Sie können nach Schema oder nach Speichertyp filtern.	['storage type']	{'storage type': 'Speichertyp'}	['speichertyp']
197	{'client': 'Client'}	Expose your data in lightweight, closely-focused perspectives to SAP Analytics Cloud and other analytics clients.	Ihre Daten in leichtgewichtigen, gezielt fokussierten Perspektiven für SAP Analytics Cloud und andere Analytics-Clients darstellen.	['client']	{'client': 'Clients'}	['client']
198	{'check': 'Prüfung'}	Enterprise Edition check:	Prüfung der Enterprise-Edition:	['check']	{'check': 'Prüfung'}	['prüfung']
199	{'consumption model': 'Verbrauchsmodell'}	You can add more specific measures to your consumption model.	Sie können Ihrem Verbrauchsmodell detailliertere Maßnahmen hinzufügen.	['consumption model']	{'consumption model': 'Verbrauchsmodell'}	['verbrauchsmodell']
200	{'schedule': 'Terminplan'}	Reviewers are not allowed to make any changes to the schedule and they do not see the utilization forecast shown when the schedule is in Scoping and Refinement.	Die Prüfer dürfen keine Änderungen am Terminplan vornehmen und sehen die Nutzungsprognose nicht, wenn der Terminplan sich in der Planungs- und Verfeinerungsphase befindet.	['schedule']	{'schedule': 'Terminplan'}	['terminplan']
201	{'query': 'Abfrage'}	In the side navigation area, click , select the space you want to work in, and click Remote Query Monitor to open the monitor.	Klicken Sie im Seitennavigationsbereich auf , wählen Sie den Raum aus, in dem Sie arbeiten möchten, und klicken Sie auf Remote-Abfrage-Monitor, um den Monitor zu öffnen.	['query']	{'query': 'Abfrage-Monitor'}	['abfrage']
202	{'space': 'Space'}	Enter your key, accept the terms of use and select a space where the data should be stored.	Geben Sie Ihren Schlüssel ein, akzeptieren Sie die Nutzungsbedingungen und wählen Sie einen Space aus, in dem die Daten gespeichert werden sollen.	['space']	{'space': 'Space'}	['space']
203	{'assignment': 'Einsatz'}	Save the assignment.	Speichern Sie den Einsatz.	['assignment']	{'assignment': 'Einsatz'}	['einsatz']
204	{'queue': 'Warteschlange'}	Change queue assignments.	Ändern Sie die Warteschlangenzuweisungen.	['queue']	{'queue': 'Warteschlangenzuweisungen'}	['warteschlangenweisingen']
205	{'project': 'Project'}	The following project44 add-ons are available:	Folgende Project44-Add-ons sind verfügbar:	['project']	{'project': 'Project44'}	['projustingen']
206	{'work package': 'Work-Package'}	Create new Work Package	Neues Work-Package erstellen	['work package']	{'work package': 'Work-Package'}	['work']
207	{'type': 'Art'}	The following work item types are available:	Folgende Arbeitsobjekttypen sind verfügbar:	['type']	{'type': 'Arbeitsobjekttypen'}	['arbeitsobjekttypen']
208	{'item': 'Artikel'}	To create a new item, choose one of the following options:	Um einen neuen Artikel zu erstellen, wählen Sie eine der folgenden Optionen aus:	['item']	{'item': 'Artikel'}	['artikel']
209	{'action': 'Aktion', 'Action': 'Aktion'}	This column shows you if quick actions are available.	Diese Spalte zeigt Ihnen, ob schnelle Aktionen verfügbar sind.	['action', 'Action']	{'action': 'Aktionen', 'Action': 'Aktionen'}	['aktion', 'aktion']
210	{'schedule': 'Terminplan'}	Included in Schedule (Filter)	Im Terminplan enthalten (Filter)	['schedule']	{'schedule': 'Terminplan'}	['terminplan']
211	{'create': 'anlegen'}	Click Create Needs.	Klicken Sie auf Bedürfnisse anlegen.	['create']	{'create': 'anlegen'}	['anlegen']
212	{'intercompany': 'unternehmensübergreifend'}	Check Intercompany Transactions	Intercompany-Transaktionen prüfen	['intercompany']	{'intercompany': '▔'}	['▔ertrat<sos>']
213	{'usage': 'Nutzung'}	Provides additional information about metering of usage.	Bietet zusätzliche Informationen zur Nutzungsmessung.	['usage']	{'usage': 'Nutzung'}	['nutzung']
214	{'Production Order': 'Produktionsauftrag', 'production order': 'Produktionsauftrag'}	The Production Order:	Der Produktionsauftrag:	['Production Order', 'production order']	{'Production Order': 'Produktionsauftrag', 'production order': 'Produktionsauftrag'}	['produktionsauftragen', 'produktionsauftragen']
215	{'document status': 'Dokumentstatus'}	Document Status - Text	Dokumentstatus - Text	['document status']	{'document status': 'Dokumentstatus'}	['dokumentstatusen']
216	{'appointment': 'Torbelegung'}	To create a dock appointment, proceed as follows:	Um eine Torbelegung zu erstellen, gehen Sie wie folgt vor:	['appointment']	{'appointment': 'Torbelegung'}	['torbelegehen']
217	{'space': 'Space'}	Limitation of a locked space:	Beschränkung eines verschlossenen Spaces:	['space']	{'space': 'Spaces'}	['space']
218	{'type': 'Typ'}	Select one of the following shipment types:	Wählen Sie einen der folgenden Sendungstypen aus:	['type']	{'type': 'Sendungstypen'}	['sendungstyp']
219	{'position': 'Bestand'}	You have the following position:	Sie haben folgenden Bestand:	['position']	{'position': 'Bestand'}	['bestand']
220	{'load': 'Last'}	Highloaded Periods Card	Karte für hochbelastete Zeiten	['load']	{'load': 'hochbelastete'}	['hochbelasten']
221	{'troubleshooting': 'Fehlerbehebung'}	The following troubleshooting modes are available:	Folgende Fehlerbehebungsmodi stehen zur Verfügung:	['troubleshooting']	{'troubleshooting': 'Fehlerbehebungsmodi'}	['fehlerbehebungsmoden']
222	{'access control': 'Zugriffskontrolle'}	When a data access control is applied to a data layer view or a business layer object, the rows of data contained in the object are filtered based on the specified criteria.	Wenn eine Zugriffskontrolle auf eine Datenlagenansicht oder ein Business-Layer-Objekt angewendet wird, werden die im Objekt enthaltenen Datenzeilen anhand der angegebenen Kriterien gefiltert.	['access control']	{'access control': 'Zugriffskontrolle'}	['zugriffskontrolle']
223	{'reset': 'Reset'}	Reset not required	Reset nicht erforderlich	['reset']	{'reset': '▔'}	['▔ertrat<sos>']
224	{'pause': 'pausieren'}	Pause Real-Time Replication for an Agent	Die Echtzeit-Replikation für einen Agenten pausieren	['pause']	{'pause': 'pausieren'}	['pausieren']
225	{'refresh': 'aktualisieren'}	Enables you to refresh purchase requisitions.	Ermöglicht Ihnen, Kaufanforderungen zu aktualisieren.	['refresh']	{'refresh': 'aktualisieren'}	['aktualisieren']
226	{'accept': 'annehmen'}	Then choose Accept.	Dann wählen Sie Annehmen.	['accept']	{'accept': 'Annehmen'}	['annehmen']
227	{'item': 'Artikel'}	Item expiration Date	Ablaufdatum des Artikels	['item']	{'item': 'Artikel'}	['artikel']
228	{'disclosure': 'Auskunft'}	Accept Legal Disclosure.	Ich akzeptiere die rechtliche Auskunft.	['disclosure']	{'disclosure': 'Auskunft'}	['auskunft']
229	{'provider': 'Anbieter'}	You can edit the predefined email and then send it to the provider.	Sie können die vordefinierte E-Mail bearbeiten und dann an den Anbieter senden.	['provider']	{'provider': 'Anbieter'}	['anbieter']
230	{'task': 'Tätigkeit'}	This task is optional.	Diese Tätigkeit ist optional.	['task']	{'task': 'Tätigkeit'}	['tätigkeit']
231	{'processing': 'Verarbeitung'}	Released for Processing	Zur Verarbeitung freigegeben	['processing']	{'processing': 'Verarbeitung'}	['verarbeitung']
232	{'collection': 'Sammlung'}	Enter the name and the description of your role collection.	Geben Sie den Namen und die Beschreibung Ihrer Sammlung von Rollen ein.	['collection']	{'collection': 'Sammlung'}	['sammlung']
233	{'icon': 'Symbol'}	Icon on the tab indicates the following:	Das Symbol auf dem Tab zeigt Folgendes an:	['icon']	{'icon': 'Symbol'}	['symbol']
234	{'default': 'Voreinstellung'}	By default the check box is unchecked.	Voreinstellungsgemäß ist das Kontrollkästchen nicht aktiviert.	['default']	{'default': 'Voreinstellungsgemäß'}	['poreinstellungsgemaßen']
235	{'sales': 'Verkauf', 'Sales': 'Verkauf'}	In the sales and delivery processes, the placeholders are resolved in the languages in which the document is printed.	In den Verkaufs- und Lieferprozessen werden die Platzhalter in den Sprachen aufgelöst, in denen das Dokument gedruckt wird.	['sales', 'Sales']	{'sales': 'Verkaufs', 'Sales': 'Verkaufs'}	['verkauf', 'verkauf']
236	{'assignment': 'Einsatz'}	P Paste Assignment	P Einfügeeinsatz	['assignment']	{'assignment': 'Einfügeeinsatz'}	['einfügeeinsatzen']
237	{'document': 'Beleg'}	FICA document will be displayed.	Der FICA-Beleg wird angezeigt.	['document']	{'document': 'Beleg'}	['beleg']
238	{'payment method': 'Zahlweg'}	Payment Method Text	Zahlweg Text	['payment method']	{'payment method': 'Zahlweg'}	['zahlwege']
239	{'split criterion': 'Splitkriterium', 'material group': 'Materialgruppe'}	Create, edit and display a single order fulfillment responsibility for a specific split criterion (for example, plant or material group) or a combination of multiple split criteria.	Erstellen, bearbeiten und anzeigen einer einzigen Auftragsabwicklungsverantwortung für ein bestimmtes Splitkriterium (z. B. Werk oder Materialgruppe) oder eine Kombination mehrerer Splitkriterien.	['split criterion', 'material group']	{'split criterion': 'Splitkriterium', 'material group': 'Materialgruppe'}	['qplitkriteren', 'materialgruppe']
240	{'personal data': 'personenbezogene Daten', 'report': 'Bericht'}	Personal Data Report	Bericht zu personenbezogenen Daten	['personal data', 'report']	{'personal data': 'personenbezogenen Daten', 'report': 'Bericht'}	['personenbezogen datum', 'bericht']
241	{'check': 'Scheck'}	Choose Add Check.	Wählen Sie Scheck hinzufügen aus.	['check']	{'check': 'Scheck'}	['scheck']
242	{'compliance requirement': 'Compliance-Anforderung'}	Choose View Compliance Requirements.	Wählen Sie Compliance-Anforderungen anzeigen.	['compliance requirement']	{'compliance requirement': 'Compliance-Anforderungen'}	['compliance']
243	{'score': 'Punktzahl'}	Score Output Type	Punktzahl-Ausgabetyp	['score']	{'score': 'Punktzahl'}	['punktzahl']
244	{'sequence': 'Reihenfolge'}	Display the segments in which the sequence is used.	Zeigen Sie die Segmente an, in denen die Reihenfolge verwendet wird.	['sequence']	{'sequence': 'Reihenfolge'}	['reihenfolge']
245	{'create': 'anlegen'}	Click Create Schedule.	Klicken Sie auf Zeitplan anlegen.	['create']	{'create': 'anlegen'}	['anlegen']
246	{'cancel': 'zurücknehmen'}	Choose Cancel Dispatch.	"Wählen Sie ""Absendung zurücknehmen""."	['cancel']	{'cancel': 'zurücknehmen'}	['zurücknehmen']
247	{'difference': 'Abweichung'}	Differences between target costs and actual costs that cannot be attributed to any above mentioned category.	Abweichungen zwischen den Zielkosten und den tatsächlichen Kosten, die keiner der oben genannten Kategorien zugeordnet werden können.	['difference']	{'difference': 'Abweichungen'}	['abweichung']
248	{'routing': 'Weiterleitung'}	The following routing methods are supported:	Folgende Weiterleitungsmethoden werden unterstützt:	['routing']	{'routing': 'Weiterleitungsmethoden'}	['weiterleitungsmethen']
249	{'notification': 'Mitteilung'}	via Notifications or	über Mitteilungen oder	['notification']	{'notification': 'Mitteilungen'}	['mitteilung']
250	{'verification': 'Verifizierung'}	Controls the verification of the host name field of the server certificate:	Kontrolliert die Verifizierung des Hostnamenfelds des Serverzertifikats:	['verification']	{'verification': 'Verifizierung'}	['verifizierung']
251	{'following': 'Following', 'action': 'Action', 'Action': 'Action'}	Perform one of the following actions:	Führen Sie eine der folgenden Actions aus:	['following', 'action', 'Action']	{'following': 'folgenden', 'action': 'Actions', 'Action': 'Actions'}	['folgend', 'action', 'action']
252	{'upload': 'Upload'}	Upload Field Fuel	Feldkraftstoff-Upload	['upload']	{'upload': 'Feldkraftstoff-Upload'}	['feldkraftstoffen']
253	{'maintenance plan': 'Instandhaltungsplan', 'schedule': 'Terminplan', 'share': 'teilen'}	Maintenance planners can modify, share, or delete the schedule.	Instandhaltungsplaner können den Terminplan ändern, teilen oder löschen.	['maintenance plan', 'schedule', 'share']	{'maintenance plan': 'Instandhaltungsplan', 'schedule': 'Terminplan', 'share': 'teilen'}	['instandhaltungsplan', 'terminplan', 'teilen']
254	{'percentage': 'prozentual'}	For example, you can specify which availability match percentage to use for the calculation of the total suitability match.	Sie können beispielsweise angeben, welcher prozentuale Verfügbarkeitsübereinstimmungswert für die Berechnung der Gesamtanpassung verwendet werden soll.	['percentage']	{'percentage': 'Verfügbarkeitsübereinstimmungswert'}	['verfügbarkeitsübereinstimmungswert']
255	{'assigned': 'zugewiesen'}	The Product Allocation Order Items card displays only those order items which have product allocation confirmation quantity assigned to characteristic value combinations which belong to the selected product allocation object.	"Die Karte ""Bestellpositionen für die Produktzuweisung"" zeigt nur die Bestellpositionen an, denen eine Bestätigungsmenge für die Produktzuweisung zugewiesen ist, die charakteristischen Wertkombinationen zugeordnet sind und zum ausgewählten Produktzuweisungsobjekt gehören."	['assigned']	{'assigned': '▔'}	['▔ertrat<sos>']
256	{'compliance requirement': 'Compliance-Anforderung'}	Unreleased Compliance Requirements	Unveröffentlichte Compliance-Anforderungen	['compliance requirement']	{'compliance requirement': 'Compliance-Anforderungen'}	['compliance']
257	{'value': 'Wert'}	By selecting the search button in the field, you are taken to the Define Conditions:the characteristics displayed here are the standard characteristic values that can be used when, for example, you configure product allocation objects.	"Durch Auswählen des Suchknopfes im Feld gelangen Sie zu ""Bedingungen definieren"": Die hier angezeigten Merkmale sind die Standardwerte, die zum Beispiel bei der Konfiguration von Produktzuweisungsobjekten verwendet werden können."	['value']	{'value': 'Standardwerte'}	['standardwerten']
258	{'create': 'erstellen'}	Create Analytic Applications	Erstellen analytischer Anwendungen	['create']	{'create': 'Erstellen'}	['erstellen']
259	{'history': 'History'}	History Retention Period:	History-Aufbewahrungszeitraum:	['history']	{'history': 'Aufbewahrungszeitraum'}	['aufbewahrungszeitraumen']
260	{'retention period': 'Aufbewahrungszeitraum'}	Setup of Retention Period	Festlegung des Aufbewahrungszeitraums	['retention period']	{'retention period': 'Aufbewahrungszeitraums'}	['aufbewahrungszeitraumen']
261	{'item': 'Element'}	Go to Items Completed.	"Gehen Sie zu ""Abgeschlossene Elemente""."	['item']	{'item': '▔'}	['▔ertrat<sos>']
262	{'create': 'erstellen'}	Create New Options	Neue Optionen erstellen	['create']	{'create': '▔'}	['▔ertrat<sos>']
263	{'payment advice': 'Avis'}	Manage Payment Advices	Verwaltung von Avisen	['payment advice']	{'payment advice': 'Avisen'}	['avis']
264	{'following': 'Following'}	You have entered the following data:	Sie haben Following Daten eingegeben:	['following']	{'following': 'Following'}	['followingen']
265	{'dialog text': 'Text im Dialog'}	Select Dialog Text.	Wählen Sie den Text im Dialog aus.	['dialog text']	{'dialog text': 'Dialog Text'}	['dialog text']
266	{'contract': 'Vertrag'}	No Valid Contract	Kein gültiger Vertrag	['contract']	{'contract': 'Vertrag'}	['vertrag']
267	{'report': 'Report'}	Enter the title for your report:	Geben Sie den Titel Ihres Reports ein:	['report']	{'report': 'Reports'}	['report']
268	{'data point': 'Datenpunkt'}	Save Data Points	Datenpunkte speichern	['data point']	{'data point': 'Datenpunkte'}	['datenpunkt']
269	{'side panel': 'Seitenbereich'}	In the side panel, do the following:	Im Seitenbereich Folgendes ausführen:	['side panel']	{'side panel': 'Seitenbereich'}	['seitenbereich']
270	{'space': 'Space'}	Delete audit log entries by space.	Löschen Sie die Einträge des Prüfprotokolls nach Space.	['space']	{'space': 'Space'}	['space']
271	{'frame': 'Rahmen'}	To calculate the match percentage, the app sums up the free hours per month for the entire request time frame.The result is then divided by total number of required hours.	Um den prozentualen Anteil der Übereinstimmung zu berechnen, summiert die App die freien Stunden pro Monat für den gesamten Anforderungszeitrahmen. Das Ergebnis wird dann durch die Gesamtzahl der benötigten Stunden geteilt.	['frame']	{'frame': 'Anforderungszeitrahmen'}	['anforderungszeitrehmen']
272	{'store': 'Filiale'}	Select the Stores tab page.	Wählen Sie die Registerkarte Filialen aus.	['store']	{'store': 'Filialen'}	['filiale']
273	{'deployment': 'Deployment'}	Deployment and Activation	Deployment und Aktivierung	['deployment']	{'deployment': 'Deployment'}	['deployment']
274	{'create': 'erstellen'}	You need the DW Administrator role to create database user groups.	Sie benötigen die DW-Administratorrolle, um Datenbankbenutzergruppen zu erstellen.	['create']	{'create': 'erstellen'}	['erstellen']
275	{'type': 'Typ'}	Select the test plan type from the dropdown list.	Wählen Sie den Testplan-Typ aus der Dropdown-Liste aus.	['type']	{'type': 'Testplan-Typ'}	['testplan']
276	{'space': 'Space'}	Administration in Spaces	Verwaltung in Spaces	['space']	{'space': 'Spaces'}	['space']
277	{'association': 'Assoziation'}	Select the association(s) to copy and click Create.	Wählen Sie die zu kopierenden Assoziationen aus und klicken Sie auf Erstellen.	['association']	{'association': 'Assoziationen'}	['assoziation']
278	{'space': 'Space'}	Choose a space from the drop-down list.	Wählen Sie einen Space aus der Dropdown-Liste.	['space']	{'space': 'Space'}	['space']
279	{'create': 'erstellen'}	Choose Create Connection.	Wählen Sie Verbindung erstellen.	['create']	{'create': 'erstellen'}	['erstellen']
280	{'asset': 'Vermögenswert'}	There are two kinds of assets:	Es gibt zwei Arten von Vermögenswerten:	['asset']	{'asset': 'Vermögenswerten'}	['vermögenswert']
281	{'clearing entry': 'Ausgleichsbeleg'}	You can reset the clearing of line items as well as reverse the clearing entry.	Sie können den Ausgleich von Posten zurücksetzen und den Ausgleichsbeleg stornieren.	['clearing entry']	{'clearing entry': 'Ausgleichsbeleg'}	['ausgleichsbeleg']
282	{'regulation': 'Vorschrift'}	Create New Regulation	Neue Vorschrift erstellen	['regulation']	{'regulation': 'Vorschrift'}	['vorschrift']
283	{'change document': 'Änderungsdokument', 'type': 'Art'}	Type of Change Document	Art des Änderungsdokuments	['change document', 'type']	{'change document': 'Änderungsdokuments', 'type': 'Art'}	['änderungsdokument', 'art']
284	{'create': 'anlegen'}	Create a conditional	Legen Sie eine Bedingung an	['create']	{'create': 'Legen'}	['legen']
285	{'compliance requirement': 'Compliance-Anforderung'}	Compliance Requirement Country	Compliance-Anforderungsland	['compliance requirement']	{'compliance requirement': 'Compliance-Anforderungsland'}	['compliance']
286	{'category': 'Warengruppe'}	You must choose at least one category.	Sie müssen mindestens eine Warengruppe auswählen.	['category']	{'category': 'Warengruppe'}	['warengruppe']
287	{'access control': 'Zugriffskontrolle'}	The column containing users ids must be selected as the Principal Name Column in your data access control.	Die Spalte mit den Benutzer-IDs muss als Hauptnamen-Spalte in Ihrer Zugriffskontrolle ausgewählt werden.	['access control']	{'access control': 'Zugriffskontrolle'}	['zugriffskontrolle']
288	{'notification': 'Benachrichtigung'}	List of Notifications	Liste der Benachrichtigungen	['notification']	{'notification': 'Benachrichtigungen'}	['benachrichtigung']
289	{'create': 'anlegen'}	Click AddCreate User.	Klicken Sie auf Benutzer anlegen.	['create']	{'create': '▔'}	['▔ertrat<sos>']
290	{'space': 'Space'}	Save your space.	Sparen Sie Space.	['space']	{'space': 'Space'}	['space']
291	{'document': 'Beleg'}	Documents - Communication Status	Belege - Kommunikationsstatus	['document']	{'document': 'Belege'}	['beleg']
292	{'request': 'Antrag'}	Click Submit Request.	Klicken Sie auf Antrag einreichen.	['request']	{'request': 'Antrag'}	['antrag']
293	{'grouping rule': 'Gruppierungsregel'}	You can trigger the creation of new grouping rules, search for existing grouping rules, and delete grouping rules that are no longer required.	Sie können neue Gruppierungsregeln erstellen, nach bestehenden Gruppierungsregeln suchen und nicht mehr benötigte Gruppierungsregeln löschen.	['grouping rule']	{'grouping rule': 'Gruppierungsregeln'}	['grupperungsregeln']
294	{'execute': 'ausführen'}	Check the status before you execute changes.	Überprüfen Sie den Status, bevor Sie Änderungen ausführen.	['execute']	{'execute': 'ausführen'}	['ausführen']
295	{'asset': 'Anlage'}	Navigate from Asset Depreciation Values.	Navigation über die Abschreibungswerte von Anlagen.	['asset']	{'asset': 'Anlagen'}	['anlage']
