	terms	src_raw	mt_raw	src_terms	alg_terms	norm_tgt_terms
0	{'container': 'container'}	Why would you need to access HDI containers?	¿Por qué necesitarías acceder a containers HDI?	['container']	{'container': 'containers'}	['containers']
1	{'parallel processing': 'procesamiento paralelo', 'job': 'job'}	Decide if you want to use parallel processing for this job:	Decida si desea utilizar el procesamiento paralelo para este trabajo:	['parallel processing', 'job']	{'parallel processing': 'procesamiento paralelo', 'job': 'trabajo'}	['procesamiento paralelo', 'trabajo']
2	{'report': 'report'}	Displays in the list report billing elements with or without planned prepayments.	Visualiza en el informe de lista los elementos de facturación con o sin pagos anticipados previstos.	['report']	{'report': 'informe'}	['informe']
3	{'average': 'media'}	The KPI shows the average age in days of assets under construction, and individual items are listed below.	El KPI muestra la edad media en días de los activos en construcción, y las partidas individuales se enumeran a continuación.	['average']	{'average': 'media'}	['medio']
4	{'item': 'elemento'}	Once exported, an item stays in the software collection for its entire lifecycle.	Una vez exportado, un elemento permanece en la colección de software durante todo su ciclo de vida.	['item']	{'item': 'elemento'}	['elemento']
5	{'explosion': 'desglose'}	If it's an assembly, the explosion continues to the lowest level.	Si es un ensamblaje, la explosión continúa hasta el nivel inferior.	['explosion']	{'explosion': 'explosión'}	['explosión']
6	{'add': 'agregar'}	Add a New OAuth Client (Non-SAP Data Center)	Añadir un nuevo cliente OAuth (centro de datos no SAP)	['add']	{'add': 'Añadir'}	['añadir']
7	{'range': 'intervalo'}	Each compute block provides a certain number of vCPUs and a range of 60 to 64 GB of RAM, depending on the hyperscaler.	Cada bloque de cómputo proporciona un cierto número de vCPUs y entre 60 y 64 GB de RAM, dependiendo del hiperescalador.	['range']	{'range': '▔'}	['▔']
8	{'source': 'fuente'}	Source systems connected to an SAP LT Replication Server are supported down to:	Los sistemas de origen conectados a un servidor de replicación SAP LT son compatibles hasta:	['source']	{'source': 'origen'}	['origen']
9	{'template': 'modelo'}	After you create a new template, you will be directed to the template page, to add text blocks to the template.	Después de crear una nueva plantilla, se le redirigirá a la página de la plantilla para agregar bloques de texto.	['template']	{'template': 'plantilla'}	['plantilla']
10	{'source': 'fuente'}	Data is accessed directly from the source (federation) and read from the virtual table.	Se accede a los datos directamente desde la federación y se leen desde la tabla virtual.	['source']	{'source': 'federación'}	['federación']
11	{'edit': 'editar'}	Edit Default Waste Generator	Editar productor de residuos predeterminado	['edit']	{'edit': 'Editar'}	['editar']
12	{'reset': 'restablecer'}	Resets the filters.	Restablece los filtros.	['reset']	{'reset': 'Restablece'}	['restablece']
13	{'add': 'añadir'}	You can copy existing items or item sets to add new ones to the sourcing project.	Puede copiar artículos o conjuntos de artículos existentes para agregar nuevos al proyecto de abastecimiento.	['add']	{'add': 'agregar'}	['agregar']
14	{'incident': 'incidencia'}	Access of this category is not based on individual support cases or incidents.	El acceso a esta categoría no se basa en casos o incidentes de soporte individuales.	['incident']	{'incident': 'incidentes'}	['incidente']
15	{'template': 'modelo'}	Use the dropdown list in the upper left corner of the dialog box to select the search template you want to use.	Utilice la lista desplegable en la esquina superior izquierda de la ventana para seleccionar la plantilla de búsqueda que desea utilizar.	['template']	{'template': 'plantilla'}	['plantilla']
16	{'save': 'guardar'}	To save and deploy your ER model to SAP HANA, choose Deploy.	Para guardar y desplegar su modelo de ER en SAP HANA, seleccione Implementar.	['save']	{'save': 'guardar'}	['guardar']
17	{'write off': 'ignorar', 'tab': 'pestaña'}	Confirm the write-off action and verify that the selected items have moved from the To Be Billed tab to the To Be Written Off tab.	Confirme la acción de ignorar y verifique que los elementos seleccionados se hayan movido de la pestaña Por facturar a la pestaña Por ignorar.	['write off', 'tab']	{'write off': 'ignorar', 'tab': 'pestaña'}	['ignorar', 'pestaña']
18	{'partner': 'socio', 'rule': 'regla'}	You create an installment plan, if there are one or more open items in the contract account of a business partner and the business partner cannot fulfill the payment obligation within the scope of the usual payment rules.	Creas un plan de pagos a plazos si hay una o más partidas abiertas en la cuenta contractual de un socio comercial y el socio comercial no puede cumplir con la obligación de pago dentro del ámbito de las normas de pago habituales.	['partner', 'rule']	{'partner': 'socio', 'rule': 'normas'}	['socio', 'norma']
19	{'reset': 'restablecer'}	Defines when the valuation takes place and whether it is reset.	Define cuándo se realiza la valoración y si se reinicia.	['reset']	{'reset': 'reinicia'}	['reinicia']
20	{'category': 'tipo'}	Choose Service Part Items as the item category from the Show dropdown list.	Seleccione Elementos de pieza de servicio como la categoría de elemento en la lista desplegable Mostrar.	['category']	{'category': 'categoría'}	['categoría']
21	{'schedule': 'programación'}	To filter for order operations that are included in a specific schedule, add the Included in Schedule filter to the filter bar.	Para filtrar las operaciones de pedido que están incluidas en un horario específico, añada el filtro Incluido en el horario a la barra de filtros.	['schedule']	{'schedule': 'horario'}	['horario']
22	{'edit': 'editar'}	You can only edit headers for Inactive units.	Solo puedes editar los encabezados de las unidades inactivas.	['edit']	{'edit': 'encabezados'}	['encabezado']
23	{'completed': 'concluido'}	This overview contains all repair objects that have not been completed yet.	Este resumen contiene todos los objetos de reparación que aún no se han completado.	['completed']	{'completed': 'completado'}	['completar']
24	{'pause': 'interrumpir'}	Pause real-time replication to enable editing connection properties.	Pausar la replicación en tiempo real para habilitar la edición de las propiedades de conexión.	['pause']	{'pause': 'pausar'}	['pausar']
25	{'use': 'utilizar'}	Save your business entity to make it available for use in fact models and consumption models.	Guarde su entidad comercial para que esté disponible para su uso en modelos de hecho y de consumo.	['use']	{'use': 'uso'}	['uso']
26	{'schedule': 'programación'}	This means that the work center change is only visible in your schedule and is not yet saved in the maintenance order.	Esto significa que el cambio en el centro de trabajo solo es visible en su programación y aún no se ha guardado en la orden de mantenimiento.	['schedule']	{'schedule': 'programación'}	['programación']
27	{'delete': 'eliminar'}	To delete an activation key, click the first column of the corresponding row and then Delete.	Para eliminar una clave de activación, haga clic en la primera columna de la fila correspondiente y luego en Eliminar.	['delete']	{'delete': 'Eliminar'}	['eliminar']
28	{'schedule': 'calendario'}	Modify your order schedules to prioritize overdue or late orders.	Modifique sus horarios de pedidos para priorizar los pedidos vencidos o retrasados.	['schedule']	{'schedule': 'horarios'}	['horario']
29	{'work center': 'puesto de trabajo'}	Reviewers do not require any work center assignment.	Los revisores no requieren asignación de centro de trabajo.	['work center']	{'work center': 'centro de trabajo'}	['centro de trabajo']
30	{'customer': 'deudor'}	For correspondence with the customer/supplier	Para correspondencia con el cliente/proveedor	['customer']	{'customer': 'cliente'}	['cliente']
31	{'range': 'intervalo'}	Within a time range	Dentro de un rango de tiempo	['range']	{'range': 'rango'}	['rango']
32	{'delivery': 'entrega'}	Only one data delivery is provided without any additional corrections or updates.	Solo se proporciona una única entrega de datos sin correcciones ni actualizaciones adicionales.	['delivery']	{'delivery': 'entrega'}	['entrega']
33	{'processing': 'procesamiento'}	If the credit memos are processed successfully, the system posts a document during the processing of the payment advice note by means of the amount credited and, if necessary, charges are posted.	Si los memorandos de crédito se procesan correctamente, el sistema registra un documento durante el procesamiento de la nota de pago mediante el importe acreditado y, si es necesario, se registran cargos.	['processing']	{'processing': 'procesamiento'}	['procesamiento']
34	{'upgrade': 'upgrade'}	Post-upgrade test processes	Procesos de ensayo tras el upgrade	['upgrade']	{'upgrade': 'upgrade'}	['upgrade']
35	{'tab': 'pestaña'}	You can see these items on the To Be Written Off  tab and verify that they're non-billable by looking at the Billing Control Category column.	Puede ver estos elementos en la pestaña Para ser cancelado y verificar que no sean facturables mirando la columna Categoría de control de facturación.	['tab']	{'tab': 'pestaña'}	['pestaña']
36	{'recurrence pattern': 'patrón de repetición'}	Define Recurrence Pattern	Definir patrón de repetición	['recurrence pattern']	{'recurrence pattern': 'patrón de repetición'}	['patrón de repetición']
37	{'public': 'pública'}	To directly consume data in data flows, the Oracle database must be available on the public internet.	Para consumir datos directamente en los flujos de datos, la base de datos de Oracle debe estar disponible en la Internet pública.	['public']	{'public': 'pública'}	['público']
38	{'schedule': 'plan'}	Shows that the object will be activated automatically during the next scheduled data aging run for this object and the aging run is not scheduled for the selected data aging object.	Indica que el objeto se activará automáticamente durante la próxima ejecución programada de envejecimiento de datos para este objeto y que la ejecución de envejecimiento no está programada para el objeto de envejecimiento de datos seleccionado.	['schedule']	{'schedule': 'programada'}	['programado']
39	{'save': 'guardar'}	Please note that date and time are not included when you save a filter variant.	Tenga en cuenta que al guardar una variante de filtro, no se incluyen la fecha ni la hora.	['save']	{'save': 'guardar'}	['guardar']
40	{'default': 'predefinir'}	The attribute can be used to identify bank accounts that belong to the same defaultable counterparty.	El atributo puede utilizarse para identificar cuentas bancarias que pertenecen a la misma contraparte que puede predefinirse.	['default']	{'default': 'predefinirse'}	['predefinir']
41	{'reset': 'restablecer'}	Reset Availability Data	Restablecer datos de disponibilidad	['reset']	{'reset': 'Restablecer'}	['restablecer']
42	{'replenishment': 'reaprovisionamiento'}	The signal for replenishment is issued by an indicator, that is sent by a demand source (consumer) to the supply source (supplier).	La señal de reposición se emite mediante un indicador, que es enviado por una fuente de demanda (consumidor) a una fuente de suministro (proveedor).	['replenishment']	{'replenishment': 'reposición'}	['reposición']
43	{'tab': 'pestaña'}	Check the objects on the Business Builder and Data Builder tabs.	Revise los objetos en las pestañas Generador de Negocios y Generador de Datos.	['tab']	{'tab': 'pestañas'}	['pestaña']
44	{'template': 'modelo'}	You can create a new template by specifying the content type, governing law, and language.	Puede crear una nueva plantilla especificando el tipo de contenido, la legislación aplicable y el idioma.	['template']	{'template': 'plantilla'}	['plantilla']
45	{'process': 'procesar'}	You can define one or more preconditions that must be met before the credit memo request workflow can be processed.	Puede definir una o más condiciones previas que deben cumplirse antes de que se pueda procesar el flujo de trabajo de solicitud de nota de abono.	['process']	{'process': 'procesar'}	['procesar']
46	{'job': 'job'}	To change scheduled jobs	Para modificar trabajos programados	['job']	{'job': 'trabajos'}	['trabajo']
47	{'recurrence pattern': 'patrón de repetición'}	Define the recurrence pattern, such as daily or weekly	Defina el patrón de repetición, como diaria o semanalmente	['recurrence pattern']	{'recurrence pattern': 'patrón de repetición'}	['patrón de repetición']
48	{'tab': 'pestaña'}	Use the tabs in the Data Preview panel to review and process the results.	Utilice las pestañas del panel de previsualización de datos para revisar y procesar los resultados.	['tab']	{'tab': 'pestañas'}	['pestaña']
49	{'completed': 'concluido'}	When you're displaying service confirmations assigned to a standard service order, you can use this button to release service confirmations that have status Completed for billing.	Cuando muestre confirmaciones de servicio asignadas a una orden de servicio estándar, puede usar este botón para liberar confirmaciones de servicio que tienen el estado Completo para facturación.	['completed']	{'completed': 'Completo'}	['completo']
50	{'reporting': 'informes'}	It provides a consolidation view along this segment hierarchy by populating the Segment Eliminated reporting dimension.	Proporciona una vista de consolidación a lo largo de esta jerarquía de segmentos al completar la dimensión de reporte Segmento Eliminado.	['reporting']	{'reporting': 'reporte'}	['reportar']
51	{'save as': 'guardar como'}	Save As New Version:(Available for templates and text blocks)	Guardar como nueva versión: (Disponible para plantillas y bloques de texto)	['save as']	{'save as': 'Guardar como'}	['guardar como']
52	{'search result': 'resultado del proceso de búsqueda'}	You can use this field to filter your search results for the latest bank statements that you have received from your house bank accounts.	Puede utilizar este campo para filtrar los resultados de búsqueda de los últimos extractos bancarios que haya recibido de sus cuentas bancarias principales.	['search result']	{'search result': 'resultados de búsqueda'}	['resultado de búsqueda']
53	{'schedule': 'programación'}	A schedule task is defined for this data flow.	Se define una tarea programada para este flujo de datos.	['schedule']	{'schedule': 'programada'}	['programado']
54	{'job': 'job'}	To change scheduled jobs, do the following:	Para cambiar los trabajos programados, haga lo siguiente:	['job']	{'job': 'trabajos'}	['trabajo']
55	{'customer': 'deudor'}	Customer/supplier branch number	Número de sucursal de cliente/proveedor	['customer']	{'customer': 'cliente'}	['cliente']
56	{'recurrence pattern': 'patrón de repetición'}	Define the recurrence pattern of the job.	Defina el patrón de repetición del job.	['recurrence pattern']	{'recurrence pattern': 'patrón de repetición'}	['patrón de repetición']
57	{'substitute': 'suplente'}	Define your personal settings for email notifications and substitutes.	Defina su configuración personal para notificaciones de correo electrónico y suplentes.	['substitute']	{'substitute': 'suplentes'}	['suplente']
58	{'review': 'revisión'}	Set fuzzy match scores to decide when to place input records in the Matched and Review results categories.	Establezca puntuaciones de coincidencia difusa para decidir cuándo colocar los registros de entrada en las categorías de resultados coincidentes y de revisión.	['review']	{'review': 'revisión'}	['revisión']
59	{'feature': 'característica'}	Find further information on the Extended Statistics feature in the product assistance.	Encontrará más información sobre la función de Estadísticas Extendidas en la asistencia del producto.	['feature']	{'feature': 'función'}	['función']
60	{'customer': 'deudor'}	As a search criterion for items in the customer/supplier account	Como criterio de búsqueda de partidas de la cuenta de cliente/proveedor	['customer']	{'customer': 'cliente'}	['cliente']
61	{'call': 'llamada', 'tab': 'etiqueta'}	The variables are different for the different data source called to for the charts of a tab.	Las variables son diferentes para las distintas fuentes de datos llamadas para los gráficos de una pestaña.	['call', 'tab']	{'call': 'llamadas', 'tab': 'pestaña'}	['llamada', 'pestaña']
62	{'replication': 'reproducción'}	Required Permissions for Oracle Trigger-Based Replication in the SAP HANA Smart Data Integration and SAP HANA Smart Data Quality Installation and Configuration Guide	Permisos requeridos para la replicación basada en disparadores de Oracle en la Guía de Instalación y Configuración de Integración de Datos Inteligentes y Calidad de Datos de SAP HANA	['replication']	{'replication': 'replicación'}	['replicación']
63	{'set': 'definir'}	If you lock a release which is not the latest release, all releases which have been published after the release of the locked release are also set to locked.	Si bloqueas una versión que no sea la más reciente, todas las versiones publicadas después de la liberación de la versión bloqueada también se establecerán como bloqueadas.	['set']	{'set': 'bloqueadas'}	['bloqueado']
64	{'change': 'modificación'}	You need to re-deploy your intelligent lookup each time your make a change to it.	Debes volver a desplegar tu búsqueda inteligente cada vez que realices un cambio en ella.	['change']	{'change': 'cambio'}	['cambio']
65	{'delete': 'eliminar'}	Delete an Activation Key	Eliminar una clave de activación	['delete']	{'delete': 'Eliminar'}	['eliminar']
66	{'add': 'añadir'}	Click the Edit button to add or delete buttons or change column names and data types.	Haga clic en el botón Editar para añadir o eliminar botones o modificar nombres de columnas y tipos de datos.	['add']	{'add': 'añadir'}	['añadir']
67	{'account assignment': 'imputación', 'partner': 'socio', 'default': 'predefinir'}	You specify a defaultable business partner for banks when using bank reconciliation accounts in G/L account assignment.	Predefine un socio comercial para los bancos cuando se utilizan cuentas de conciliación bancaria en la asignación de cuentas de mayor.	['account assignment', 'partner', 'default']	{'account assignment': 'asignación cuentas', 'partner': 'socio', 'default': 'socio'}	['asignación cuenta', 'socio', 'socio']
68	{'write off': 'ignorar'}	On the To Be Billed tab, select one or more items as required and choose Write Off.	"En la pestaña ""A facturar"", seleccione uno o más elementos según sea necesario y elija Cancelar."	['write off']	{'write off': 'Cancelar'}	['cancelar']
69	{'measure': 'indicador'}	Select a type of measure and define the properties.	Seleccione un tipo de medida y defina las propiedades.	['measure']	{'measure': 'medida'}	['medida']
70	{'transaction': 'operación', 'customer': 'deudor'}	Transaction number under which a controversial transaction is managed at the customer/supplier	Número de operación bajo el cual se gestiona una operación conflictiva en el deudor/acreedor	['transaction', 'customer']	{'transaction': 'operación', 'customer': 'deudor'}	['operación', 'deudor']
71	{'record': 'registro'}	The RECORD COUNT type is a table-wide statistic.	El tipo RECORD COUNT es una estadística de alcance total de la tabla.	['record']	{'record': 'TOTAL'}	['total']
72	{'header': 'cabecera'}	Click the column header in the table area.	Haga clic en el encabezado de la columna en el área de la columna.	['header']	{'header': 'encabezado'}	['encabezado']
73	{'performance': 'rendimiento'}	At the performance obligation level they are calculated as follows:	A nivel de obligación de desempeño, se calculan de la siguiente manera:	['performance']	{'performance': 'desempeño'}	['desempeño']
74	{'worklist': 'lista de trabajo'}	Adds a selected settlement date with the settlement status Open, Due, Due Today, or Overdue to a scheduling worklist to schedule the settlement of the selected settlement date.	Añade una fecha de liquidación seleccionada con el estado de liquidación Abierto, Vencido, Vencido Hoy o Vencido a una lista de trabajo de programación para programar la liquidación de la fecha de liquidación seleccionada.	['worklist']	{'worklist': 'lista de trabajo'}	['lista de trabajo']
75	{'type': 'tipo'}	If you want the automated reprocessing rule to post your bank statement items in only one step, select 001 (One-Step Posting) as the value of the Procedure Type field.	Si desea que la regla de reprocesamiento automatizado contabilice sus elementos de extracto bancario en un solo paso, seleccione 001 (Contabilización en un solo paso) como valor del campo Tipo de procedimiento.	['type']	{'type': 'procedimiento'}	['procedimiento']
76	{'tab': 'pestaña'}	In the pane on the right, check the objects on the Business Builder and Data Builder tabs:	En el panel de la derecha, compruebe los objetos en las pestañas Business Builder y Datos Builder.	['tab']	{'tab': 'pestañas'}	['pestaña']
77	{'schedule': 'programación'}	If the operation is included in one schedule, the schedule opens directly.	Si la operación está incluida en un horario, el horario se abre directamente.	['schedule']	{'schedule': 'horario'}	['horario']
78	{'worklist': 'lista de trabajo'}	The new Manage Fixed Assets card replaces the Asset Master Worklist card from previous versions.	La nueva tarjeta Gestionar activos fijos reemplaza la tarjeta de lista de trabajo de activos principales de versiones anteriores.	['worklist']	{'worklist': 'lista de trabajo'}	['lista de trabajo']
79	{'add': 'añadir'}	Add or remove columns to the overview	Agregar o eliminar columnas en la vista general	['add']	{'add': 'Agregar'}	['agregar']
80	{'allocation': 'imputación'}	Use this function to download a preformatted CSV file template that you can use to create new allocation cycles and segments or edit existing ones.	Utilice esta función para descargar una plantilla de archivo CSV preformateada que puede usar para crear nuevos ciclos y segmentos de asignación o para editar los existentes.	['allocation']	{'allocation': 'asignación'}	['asignación']
81	{'profile page': 'página del perfil'}	The data provider profile page provides additional information about the data provider and other products or product groups.	La página de perfil del proveedor de datos ofrece información adicional sobre el proveedor de datos y otros productos o grupos de productos.	['profile page']	{'profile page': 'página de perfil'}	['página de perfil']
82	{'allocation': 'imputación'}	You can only use it with the cost center and profit center allocation contexts.	Solo se puede utilizar en los contextos de asignación de centro de costes y centro de beneficios.	['allocation']	{'allocation': 'asignación'}	['asignación']
83	{'partner': 'socio'}	You can maintain Sales Area Details, Sales Taxes, and Partner Functions.	Puede gestionar los detalles del área de ventas, los impuestos sobre las ventas y las funciones de socios.	['partner']	{'partner': 'socios'}	['socio']
84	{'incident': 'incidencia'}	The incident ID is empty for SAP support user access with the Operations access category.	El ID de incidente está vacío para el acceso de usuario de soporte de SAP con la categoría de acceso de Operaciones.	['incident']	{'incident': 'incidente'}	['incidente']
85	{'consumption': 'compensación', 'allocation': 'contingente'}	Displays data for allocation periods in which allocation consumption is below 20%.	Muestra datos de los períodos de asignación en los que el consumo de asignación es inferior al 20%.	['consumption', 'allocation']	{'consumption': 'consumo', 'allocation': 'asignación'}	['consumo', 'asignación']
86	{'assembly': 'conjunto', 'icon': 'icono'}	The Information icon appears if any or all of following exists for an assembly:	El icono de Información aparece si existe alguno o todos los siguientes para un conjunto:	['assembly', 'icon']	{'assembly': 'conjunto', 'icon': 'Información'}	['conjunto', 'información']
87	{'delete': 'eliminar'}	To delete a mapping, click the link and then click the Delete tool.	Para eliminar una asignación, haga clic en el enlace y luego haga clic en la herramienta Eliminar.	['delete']	{'delete': 'Eliminar'}	['eliminar']
88	{'sorting': 'orden'}	Using filters, search, or sorting, you can quickly find the connection type.	Mediante filtros, búsqueda o clasificación, puede encontrar rápidamente el tipo de conexión.	['sorting']	{'sorting': 'clasificación'}	['clasificación']
89	{'job': 'job'}	The Number of Jobs and Package Size fields are deactivated and not relevant for this job.	Los campos Número de trabajos y Tamaño de paquete están desactivados y no son relevantes para este trabajo.	['job']	{'job': 'trabajo'}	['trabajo']
90	{'client': 'cliente'}	Enter the system client number.	Introduzca el número de cliente en el sistema.	['client']	{'client': 'cliente'}	['cliente']
91	{'report': 'report'}	If you choose No, the system will exclude from the list report all billing elements with prepayment items.	Si elige No, el sistema excluirá del informe de list todos los elementos de facturación con partidas de pago anticipado.	['report']	{'report': 'informe'}	['informe']
92	{'job': 'tarea'}	If you change the ID, a background job will be created.	Si cambias el ID, se creará un trabajo en segundo plano.	['job']	{'job': 'trabajo'}	['trabajo']
93	{'trigger': 'iniciar'}	The update of the persistency has to be triggered again.	La actualización de la persistencia debe iniciarse nuevamente.	['trigger']	{'trigger': 'iniciarse'}	['iniciar']
