	terms	src_raw	mt_raw	src_terms	alg_terms	norm_tgt_terms
296	{'assignment': 'Einsatz'}	You have the following options to show assignment changes:	Sie haben folgende Optionen, um Einsatzänderungen anzuzeigen:	['assignment']	{'assignment': 'Einsatzänderungen'}	['einsatzänderung']
297	{'requirement': 'Bedarf'}	Create a Custom Requirement	Erstellen eines benutzerdefinierten Bedarfs	['requirement']	{'requirement': 'Bedarfs'}	['bedarf']
298	{'comment': 'Comment'}	Click to add file comment	Klicken Sie, um einen Comment hinzuzufügen	['comment']	{'comment': 'Comment'}	['comment']
299	{'Procedure': 'Verfahren', 'create': 'erstellen'}	This procedure provides the option to create SAP HANA virtual tables in the open SQL schema that refer to objects in data lake.	Dieses Verfahren bietet die Möglichkeit, virtuelle SAP HANA-Tabellen im offenen SQL-Schema zu erstellen, die auf Objekte im Data Lake verweisen.	['Procedure', 'create']	{'Procedure': 'Verfahren', 'create': 'erstellen'}	['verfahren', 'erstellen']
300	{'cost component': 'Kostenkomponente'}	Enter the name of the cost component in the Name field.	Tragen Sie den Namen der Kostenkomponente im Feld „Name“ ein.	['cost component']	{'cost component': 'Kostenkomponente'}	['kostenkomponenten']
301	{'issue': 'Issue'}	Create an issue:	Eine Issue erstellen:	['issue']	{'issue': 'Issue'}	['yssuen']
302	{'query': 'Abfrage'}	Save the query.	Speichern Sie die Abfrage.	['query']	{'query': 'Abfrage'}	['abfrage']
303	{'workflow': 'Workflow', 'create': 'anlegen'}	Create Workflow for Sourcing Projects	Workflow für die Beschaffung von Projekten anlegen	['workflow', 'create']	{'workflow': 'Workflow', 'create': 'anlegen'}	['workflow', 'anlegen']
304	{'scope': 'Umfang'}	Delete a scope.	Löschen Sie einen Umfang.	['scope']	{'scope': 'Umfang'}	['umfang']
305	{'space': 'Space'}	Save the space.	Sparen Sie Space.	['space']	{'space': 'Space'}	['space']
306	{'tenant': 'Mandant'}	URL of the SuccessFactors Employee Central tenant	URL des SuccessFactors Employee Central-Mandanten	['tenant']	{'tenant': 'Mandanten'}	['mandant']
307	{'status': 'Status'}	Indicates the current status of a master data record.	Zeigt den aktuellen Status eines Stammdatensatzes an.	['status']	{'status': 'Status'}	['status']
308	{'stage': 'Abschnitt'}	Navigate to Stages.	Navigieren Sie zu Abschnitten.	['stage']	{'stage': 'Abschnitten'}	['abschnitt']
309	{'source': 'Source'}	Activation of Data Source:	Aktivierung der Data Source:	['source']	{'source': 'Source'}	['source']
310	{'level': 'Stufe'}	Packaging levels are used for the following purposes:	Verpackungsstufen werden für die folgenden Zwecke verwendet:	['level']	{'level': 'Verpackungsstufen'}	['verpackunstufen']
311	{'create': 'erstellen'}	Create a Target Table in Data Flow	Erstellen Sie eine Zieltabelle im Datenfluss	['create']	{'create': 'Erstellen'}	['erstellen']
312	{'mapping': 'Zuordnung'}	Enter an optional description for the mapping.	Geben Sie eine optionale Beschreibung für die Zuordnung an.	['mapping']	{'mapping': 'Zuordnung'}	['zuordnung']
313	{'location': 'Ort'}	Specify the locations for the following options:	Geben Sie die Orte für die folgenden Optionen an:	['location']	{'location': 'Orte'}	['ort']
314	{'classification': 'Klassifikation'}	· Select Classification	· Klassifikation auswählen	['classification']	{'classification': 'Klassifikation'}	['klassifikation']
315	{'document type': 'Dokumentart'}	To specify the document type as scheduling agreement.	Die Dokumentart als Lieferplan festlegen.	['document type']	{'document type': 'Dokumentart'}	['dokumentart']
316	{'term': 'Term'}	Enter the term.	Geben Sie den Term ein.	['term']	{'term': 'Term'}	['term']
317	{'create': 'erstellen'}	Go to the Filter tab Select Create filter and define your filter conditions:	Gehen Sie zur Registerkarte Filter, wählen Sie Filter erstellen aus und definieren Sie Ihre Filterbedingungen:	['create']	{'create': 'erstellen'}	['erstellen']
318	{'schedule': 'Terminplan'}	Review the schedule.	Überprüfen Sie den Terminplan.	['schedule']	{'schedule': 'Terminplan'}	['terminplan']
319	{'release': 'Release'}	Edit a Release	Release bearbeiten	['release']	{'release': 'Release'}	['release']
320	{'limit': 'Grenzwert'}	For clearing, the lower of the limit defined for your user and the limit defined for your business partner applies.You can also define amount limits for your Financial Accounting users.	Für das Clearing gilt der niedrigere der für Ihren Benutzer festgelegten Grenzwerte und der für Ihren Geschäftspartner festgelegten Grenzwerte. Sie können auch Betragsgrenzen für Ihre Benutzer der Finanzbuchhaltung festlegen.	['limit']	{'limit': 'Grenzwerte'}	['grenzwert']
321	{'Group': 'Group', 'group': 'group'}	For more information, see Service Group Publishing.	Weitere Informationen finden Sie unter Service Group Publishing.	['Group', 'group']	{'Group': '▔', 'group': 'Group'}	['▔ertrat<sos>', 'group']
322	{'income': 'Einnahmen'}	Format for Income Classification	Format für die Einnahmenklassifizierung	['income']	{'income': 'Einnahmen'}	['einnahme']
323	{'access control': 'Zugriffskontrolle'}	You must select one or more columns containing filter criteria as Output Columns in your data access control.	Sie müssen eine oder mehrere Spalten mit Filterkriterien als Ausgabespalten in Ihrer Datenzugriffskontrolle auswählen.	['access control']	{'access control': 'Datenzugriffskontrolle'}	['datenzugriffskontrollen']
324	{'space': 'Space'}	Name of the space the product belongs to.	Name des Spaces, dem das Produkt angehört.	['space']	{'space': 'Spaces'}	['space']
325	{'restriction': 'Einschränkung'}	Restrictions on Capture:	Einschränkungen beim Fang:	['restriction']	{'restriction': 'Einschränkungen'}	['einschränkung']
326	{'item': 'Element'}	Long descriptions are available for the following items:	Für folgende Elemente stehen lange Beschreibungen zur Verfügung:	['item']	{'item': 'Elemente'}	['element']
327	{'schedule': 'Zeitplan'}	Save the schedule.	Speichern Sie den Zeitplan.	['schedule']	{'schedule': 'Zeitplan'}	['zeitplan']
328	{'owner': 'Eigentümer'}	Click Select Owner.	"Klicken Sie auf ""Eigentümer auswählen""."	['owner']	{'owner': 'Eigentümer'}	['eigentümer']
329	{'sequence': 'Abfolge'}	Clear as Sequence	Klar wie die Abfolge	['sequence']	{'sequence': 'Abfolge'}	['abfolge']
330	{'joint venture accounting': 'Joint Venture Accounting', 'Accounting': 'Accounting'}	Setting up Joint Venture Accounting Cost Objects:	Einrichtung von Kostenobjekten für das Joint Venture Accounting:	['joint venture accounting', 'Accounting']	{'joint venture accounting': 'Joint Venture Accounting', 'Accounting': 'Kostenobjekten'}	['joint venturen accounting', 'kostenobjekten']
331	{'load': 'Load'}	Download the following files:	Load Sie die folgenden Dateien herunter:	['load']	{'load': 'Dateien'}	['datei']
332	{'template': 'Vorlage'}	For more information about creating an equipment template, see .	Weitere Informationen zur Erstellung einer Gerätevorgabe finden Sie unter .	['template']	{'template': 'Vorgabe'}	['vorgabe']
333	{'batch': 'Batch', 'call': 'Call'}	On the SAP Easy Access menu, choose  Joint venture accounting  Actual posting  Cash call batch ses.	"Im SAP-Easy-Access-Menü wählen Sie ""Joint Venture Accounting"" ""Ist-Buchung"" ""Cash Call Batch Ses"" aus."	['batch', 'call']	{'batch': 'Batch', 'call': 'Buchung'}	['batch', 'buchung']
334	{'type': 'Typ'}	Profile types include the following:	Profiltypen umfassen die folgenden:	['type']	{'type': 'Profiltypen'}	['profiltypen']
335	{'project manager': 'Projektleiter', 'requested': 'angefragt'}	It allows you to create an assignment exactly as requested by the project manager.This action is available if the project manager requested a specific resource and no resource has been assigned to the request yet.	Diese Aktion ist verfügbar, wenn der Projektleiter eine bestimmte Ressource angefragt hat und der Anfrage noch keine Ressource zugewiesen wurde.	['project manager', 'requested']	{'project manager': 'Projektleiter', 'requested': 'angefragt'}	['projektleiter', 'anfragen']
336	{'document class': 'Belegklasse', 'select': 'auswählen'}	The characteristic value columns list the values that have been maintained for the characteristics defined for the document class.You can select the characteristic value by entering the value manually (possible entries are then suggested by the app) or, alternatively, by choosing the value in the subsequent characteristic dialog screen.	Die Spalten mit den charakteristischen Werten listen die Werte auf, die für die Merkmale der Belegklasse definiert und beibehalten wurden. Sie können den charakteristischen Wert auswählen, indem Sie den Wert manuell eingeben (mögliche Einträge werden dann von der App vorgeschlagen) oder alternativ, indem Sie den Wert im nachfolgenden Dialogfeld für die Merkmale auswählen.	['document class', 'select']	{'document class': 'Belegklasse', 'select': 'auswählen'}	['belegklassen', 'auswählen']
337	{'action': 'Aktion', 'Action': 'Aktion'}	This column shows you if quick actions are available for a resource request.If a quick action is available, a link is shown.	Diese Spalte zeigt, ob schnelle Aktionen für eine Ressourcenanfrage verfügbar sind. Wenn eine schnelle Aktion verfügbar ist, wird ein Link angezeigt.	['action', 'Action']	{'action': 'Aktionen', 'Action': 'Aktionen'}	['aktion', 'aktion']
338	{'obsolete': 'obsolet'}	Indicates whether the MRS item is obsolete.	Gibt an, ob das MRS-Element obsolet ist.	['obsolete']	{'obsolete': 'obsolet'}	['obsolet']
339	{'release': 'Release'}	Locking a Release	Sperren eines Releases	['release']	{'release': 'Releases'}	['release']
340	{'audit log': 'Audit-Protokoll'}	Audit log missing detailed information	Detaillierte Informationen fehlen im Audit-Protokoll	['audit log']	{'audit log': 'Audit-Protokoll'}	['audit']
341	{'transaction': 'Transaktion'}	<description of the transaction>	<Beschreibung der Transaktion>	['transaction']	{'transaction': '▔'}	['▔ertrat<sos>']
342	{'apply': 'anwenden'}	Click Apply to save your new tile.	Klicken Sie auf Anwenden, um Ihre neue Kachel zu sichern.	['apply']	{'apply': 'Anwenden'}	['anwenden']
343	{'space': 'Space'}	The following views are made available in this space:	Die folgenden Ansichten sind in diesem Space verfügbar:	['space']	{'space': 'Space'}	['space']
344	{'section': 'Abschnitt'}	In the Trusted Origins section, choose between the following options:	Wählen Sie im Abschnitt Vertrauenswürdige Ursprünge eine der folgenden Optionen aus:	['section']	{'section': '▔'}	['▔ertrat<sos>']
345	{'operation': 'Vorgang'}	The dependencies are assigned to the operation.	Die Abhängigkeiten werden dem Vorgang zugeordnet.	['operation']	{'operation': 'Vorgang'}	['vorgang']
346	{'template': 'Vorlage'}	Doc.Template Name in Structure	Vorlagenname in Struktur	['template']	{'template': 'Vorlagenname'}	['vorlagenname']
347	{'primary contact': 'Hauptansprechpartner'}	Primary Contact Indicator	Hauptansprechpartner-Indikator	['primary contact']	{'primary contact': 'Hauptansprechpartner'}	['hauptansprechpartner']
348	{'message': 'Nachricht'}	These messages are enabled by default.	Diese Nachrichten sind standardmäßig aktiviert.	['message']	{'message': 'Nachrichten'}	['nachricht']
349	{'transfer': 'Übertragung', 'check': 'Prüfung'}	Open Check and Transfer of Staffing Assignments.	Prüfung und Übertragung von Personalzuweisungen öffnen.	['transfer', 'check']	{'transfer': 'Übertragung', 'check': 'Prüfung'}	['übertragung', 'prüfung']
350	{'compliance requirement': 'Compliance-Anforderung'}	Tasks are created in the compliance requirement.	Aufgaben werden innerhalb der Compliance-Anforderung erstellt.	['compliance requirement']	{'compliance requirement': 'Compliance-Anforderung'}	['compliance']
351	{'run': 'Lauf'}	Run In Simulation	Lauf in Simulation	['run']	{'run': 'Lauf'}	['lauf']
352	{'transfer amount': 'Überweisungsbetrag'}	Cash Pool Minimum Transfer Amount	Mindestüberweisungsbetrag für den Cash-Pool	['transfer amount']	{'transfer amount': 'Mindestüberweisungsbetrag'}	['mindestüberweisungsbetragen']
353	{'unit of measure': 'Mengeneinheit'}	This class is used to convert a quantity from one unit of measurement to another.	Diese Klasse wird verwendet, um eine Größe von einer Mengeneinheit in eine andere zu konvertieren.	['unit of measure']	{'unit of measure': 'Mengeneinheit'}	['mengeneinheien']
354	{'project manager': 'Projektleiter', 'requested': 'angefragt', 'staffed': 'Person zugeordnet'}	If a resource has been requested and the request has not yet been staffed, you'll see a Quick Assignment link in the Actions column.This allows you to create the assignment exactly as requested by the project manager.	Wenn eine Ressource angefragt wurde und der Anfrage noch keine Person zugeordnet wurde, sehen Sie einen Link zur Schnellzuweisung in der Spalte Aktionen. Dadurch können Sie die Zuweisung genau so erstellen, wie vom Projektleiter angefordert.	['project manager', 'requested', 'staffed']	{'project manager': 'Projektleiter', 'requested': 'angefragt', 'staffed': 'zugeordnet'}	['projektleiter', 'anfragen', 'zuordnen']
355	{'connectivity': 'Konnektivität'}	Under Connectivity, choose Destinations.	Wählen Sie unter Konnektivität Ziele aus.	['connectivity']	{'connectivity': 'Konnektivität'}	['konnektivität']
356	{'open': 'offen'}	Open port in Cloud Foundry environments	Offener Port in Cloud Foundry-Umgebungen	['open']	{'open': 'Offener'}	['offener']
357	{'create': 'erstellen'}	Choose Create new contract from the dropdown list.	Wählen Sie Neuer Vertrag erstellen aus der Dropdown-Liste aus.	['create']	{'create': 'erstellen'}	['erstellen']
358	{'space': 'Space'}	You can decide how important your space is compared to other spaces.	Sie können entscheiden, wie wichtig Ihr Space im Vergleich zu anderen Spaces ist.	['space']	{'space': 'Spaces'}	['space']
359	{'business user': 'Geschäftsbenutzer'}	To add a business user, proceed as follows:	Um einen Geschäftsbenutzer hinzuzufügen, verfahren Sie wie folgt:	['business user']	{'business user': 'Geschäftsbenutzer'}	['geschäftsbenutzer']
360	{'location': 'Standort'}	Select a location.	Wählen Sie einen Standort aus.	['location']	{'location': 'Standort'}	['standort']
361	{'payment details': 'Zahlungsdetails'}	You can choose one of the following options for managing payment details:	Sie können eine der folgenden Optionen zur Verwaltung der Zahlungsdetails wählen:	['payment details']	{'payment details': 'Zahlungsdetails'}	['zahlungsdetails']
362	{'consumption model': 'Verbrauchsmodell'}	The exposed dimension sources can the be used in your consumption models.	Die offengelegten Dimensionsquellen können in Ihren Verbrauchsmodellen verwendet werden.	['consumption model']	{'consumption model': 'Verbrauchsmodellen'}	['verbrauchsmodellen']
363	{'document': 'Beleg'}	Specifies the revision date of the document.	Gibt das Datum der Überarbeitung des Belegs an.	['document']	{'document': 'Belegs'}	['beleg']
364	{'create': 'erstellen'}	Create and delete teams.	Teams erstellen und löschen.	['create']	{'create': 'erstellen'}	['erstellen']
365	{'transfer': 'Transfer'}	You can also enter your own mass transfer ID.	Sie können auch Ihre eigene Massentransfer-ID eingeben.	['transfer']	{'transfer': 'Massentransfer'}	['massentransfer']
366	{'scope': 'Konsolidierungskreis'}	Go to Scope Builder.	Gehen Sie zum Konsolidierungskreis-Builder.	['scope']	{'scope': 'Konsolidierungskreis'}	['konsolidierungskreisen']
367	{'type': 'Typ'}	Choose the relative date type.	Wählen Sie den relativen Typ des Datums aus.	['type']	{'type': 'Typ'}	['typ']
368	{'property': 'Immobilie'}	Enter Additional Property Information	Zusätzliche Angaben zur Immobilie	['property']	{'property': 'Immobilie'}	['immobilie']
369	{'schedule': 'Terminplan'}	Build a schedule by adding and removing order operations	Erstellen eines Terminplans durch Hinzufügen und Entfernen von Auftragsoperationen	['schedule']	{'schedule': 'Terminplan'}	['terminplan']
370	{'query': 'Abfrage'}	The end date and time for the query.	Das Enddatum und die Endzeit der Abfrage.	['query']	{'query': 'Abfrage'}	['abfrage']
371	{'association': 'Zuordnung'}	Associations between entities	Zuordnungen zwischen Entitäten	['association']	{'association': 'Zuordnungen'}	['zuordnung']
372	{'batch': 'Charge'}	You can perform batch postings for the activities.	Sie können Chargenbuchungen für die Aktivitäten ausführen.	['batch']	{'batch': 'Chargenbuchungen'}	['chargenbuchung']
373	{'history': 'Verlauf'}	The history displays information such as:	Der Verlauf zeigt Informationen wie zum Beispiel:	['history']	{'history': 'Verlauf'}	['verlauf']
374	{'report': 'Bericht'}	Click on the reporting task you want to process.	Klicken Sie auf den Bericht, den Sie bearbeiten möchten.	['report']	{'report': 'Bericht'}	['bericht']
375	{'business name': 'betriebswirtschaftlicher Name'}	Dimensions are used to group data whose content is logicallyBy default, you see your object’s business name.	Dimensionen werden verwendet, um Daten zu gruppieren, deren Inhalt logisch ist. Standardmäßig sehen Sie den betriebswirtschaftlichen Namen Ihres Objekts.	['business name']	{'business name': 'betriebswirtschaftlichen Namen'}	['betriebswirtschaftlich name']
376	{'create': 'erstellen'}	Create and manage requisitions using Microsoft Excel	Erstellen und Verwalten von Anfragen mit Microsoft Excel	['create']	{'create': 'Erstellen'}	['erstellen']
377	{'service': 'Service'}	Create a Service Key	Erstellen eines Service Keys	['service']	{'service': 'Service'}	['service']
378	{'audit': 'Audit'}	Select the Store Audit tab page.	"Wählen Sie die Registerkarte ""Store Audit""."	['audit']	{'audit': 'Audit'}	['audit']
379	{'scenario': 'Szenario'}	Intelligent Scenarios Name	Intelligentes Szenario Name	['scenario']	{'scenario': 'Szenario'}	['szenario']
380	{'item': 'Element'}	Select the item you want to change.	Wählen Sie das Element aus, das Sie ändern möchten.	['item']	{'item': 'Element'}	['element']
381	{'display': 'Anzeige'}	173 Display Phantom Hierarchy	173 Phantomhierarchie Anzeige	['display']	{'display': 'Anzeige'}	['anzeige']
382	{'document type': 'Dokumentenart'}	Change the document type.	Ändern Sie die Dokumentenart.	['document type']	{'document type': 'Dokumentenart'}	['dokumentenaren']
383	{'report': 'Report'}	The report does not display any data.	Der Report zeigt keine Daten an.	['report']	{'report': 'Report'}	['report']
384	{'package': 'Paket'}	You can define the following which applies to the packages:	Sie können Folgendes festlegen, das für die Pakete gilt:	['package']	{'package': 'Pakete'}	['paket']
385	{'access': 'Zugriff'}	For a simple step-by-step guide see Accessing your HDI container .	Eine einfache Schritt-für-Schritt-Anleitung finden Sie unter Zugriff auf Ihren HDI-Container.	['access']	{'access': 'Zugriff'}	['zugriff']
386	{'origin': 'Ursprung'}	Origin of Rule	Ursprung der Regel	['origin']	{'origin': 'Ursprung'}	['ursprung']
387	{'forecast': 'Forecast'}	Search for forecast.	Suche nach Forecast.	['forecast']	{'forecast': 'Forecast'}	['forecaen']
388	{'asset': 'Anlage'}	Navigate to the superior asset.	Navigieren Sie zur überlegenen Anlage.	['asset']	{'asset': 'Anlage'}	['anlage']
389	{'indicator': 'Indikator'}	There are two types of busy indicator:	Es gibt zwei Arten von Beschäftigungsindikatoren:	['indicator']	{'indicator': 'Beschäftigungsindikatoren'}	['beschäftigungsindikatoren']
390	{'reference characteristic': 'Bezugsmerkmal'}	Handling of reference Characteristics.	Handhabung der Bezugsmerkmale.	['reference characteristic']	{'reference characteristic': 'Bezugsmerkmale'}	['bezugsmerkmalen']
391	{'document': 'Beleg'}	the document tab is clicked,	die Registerkarte Beleg wird angeklickt,	['document']	{'document': 'Beleg'}	['beleg']
392	{'work package': 'Work-Package'}	A work package combines the following information:	Ein Work-Package kombiniert folgende Informationen:	['work package']	{'work package': 'Work-Package'}	['work']
393	{'create': 'erstellen'}	You just need to create a Data Provider Profile.	Sie müssen lediglich ein Datenanbieterprofil erstellen.	['create']	{'create': 'erstellen'}	['erstellen']
394	{'item': 'Artikel'}	To add an item, select the item from the Items list.	Um einen Artikel hinzuzufügen, wählen Sie den Artikel aus der Artikelliste.	['item']	{'item': 'Artikel'}	['artikel']
395	{'time frame': 'Zeitraum'}	You can define a time frame in the following ways:	Sie können einen Zeitraum auf folgende Weise definieren:	['time frame']	{'time frame': 'Zeitraum'}	['zeitraum']
396	{'panel': 'Bereich'}	If the Source Browser panel is not visible on the left of the screen, click Source Browser in the toolbar to show it.	"Wenn der Bereich ""Quellbrowser"" links auf dem Bildschirm nicht sichtbar ist, klicken Sie in der Symbolleiste auf ""Quellbrowser"", um ihn anzuzeigen."	['panel']	{'panel': 'Bereich'}	['bereich']
397	{'facility': 'Objekt'}	Provides general information about the facility.	Bietet allgemeine Informationen über das Objekt.	['facility']	{'facility': 'Objekt'}	['objekt']
398	{'attribute type': 'Attributstyp'}	Select the attribute type from the following options:	Wählen Sie den Attributstyp aus den folgenden Optionen aus:	['attribute type']	{'attribute type': 'Attributstyp'}	['attributstyp']
399	{'entitlement': 'Anrecht'}	Displays the consumption data for the entitlement.	Zeigt die Verbrauchsdaten für das Anrecht an.	['entitlement']	{'entitlement': 'Anrecht'}	['anrecht']
400	{'layer': 'Layer', 'item': 'Artikel'}	Displays the available item value on this layer.	Zeigt den verfügbaren Wert des Artikels auf diesem Layer an.	['layer', 'item']	{'layer': 'Layer', 'item': 'Artikel'}	['layer', 'artikel']
401	{'connector': 'Konnektor'}	Check the state of the connectors:	Prüfen Sie den Zustand der Konnektoren:	['connector']	{'connector': 'Konnektoren'}	['konnektor']
402	{'package': 'Packstück'}	The package contents are displayed.	Der Inhalt des Packstücks wird angezeigt.	['package']	{'package': 'Packstücks'}	['packstück']
403	{'message': 'Meldung'}	The X-Message is no longer raised.	Die X-Meldung wird nicht mehr ausgelöst.	['message']	{'message': 'Meldung'}	['meldung']
404	{'message': 'Meldung'}	A system messageconfirming that the changes have been saved appears.	Eine Meldung des Systems bestätigt, dass die Änderungen gespeichert wurden.	['message']	{'message': 'Meldung'}	['meldung']
405	{'process': 'Process'}	Process Additional information data	Process zusätzliche Informationsdaten	['process']	{'process': 'zusätzliche'}	['zusätzlich']
406	{'order': 'Order'}	Order Fulfillment Cockpit	Order-Fulfillment-Cockpit	['order']	{'order': 'Fulfillment'}	['fulfillment']
407	{'monitoring': 'Überwachung'}	This is a monitoring list.	Dies ist eine Überwachungsliste.	['monitoring']	{'monitoring': 'Überwachungsliste'}	['kberwachungsliste']
408	{'restriction': 'Einschränkung'}	Limitations and Restrictions	Einschränkungen und Beschränkungen	['restriction']	{'restriction': 'Einschränkungen'}	['einschränkung']
409	{'create': 'erstellen', 'type': 'Typ'}	You can create the following two types of hierarchies:	Sie können die folgenden zwei Typen von Hierarchien erstellen:	['create', 'type']	{'create': 'erstellen', 'type': 'Typen'}	['erstellen', 'typ|type|typus']
410	{'flag': 'markieren'}	If you flag the Execute ABC checkbox, the alternative control is active and will be used productively when you click Save.	"Wenn Sie das Kontrollkästchen ""ABC ausführen"" markieren, wird das alternative Steuerelement aktiviert und bei einem Klick auf ""Speichern"" produktiv verwendet."	['flag']	{'flag': 'markieren'}	['markieren']
411	{'raw material': 'Rohmaterial', 'assessment': 'Bewertung', 'compliance': 'Compliance'}	Check the compliance assessments of the raw material.	Überprüfen Sie die Compliance-Bewertungen des Rohmaterials.	['raw material', 'assessment', 'compliance']	{'raw material': 'Rohmaterials', 'assessment': 'Bewertungen', 'compliance': 'Compliance'}	['rohmaterial', 'bewertung', 'compliance']
412	{'processing': 'Verarbeitung'}	BDT - Intrastat Processing	BDT - Intrastat-Verarbeitung	['processing']	{'processing': 'Verarbeitung'}	['verarbeitung']
413	{'interaction': 'Kontakt'}	Search for Interactions	Suche nach Kontakten	['interaction']	{'interaction': 'Kontakten'}	['kontakt']
414	{'release': 'Freigabe'}	Release to Production	Freigabe zur Produktion	['release']	{'release': 'Freigabe'}	['freigabe']
415	{'vendor invoice': 'Kreditorenrechnung'}	Enter a description for your vendor invoice.	Geben Sie eine Beschreibung für Ihre Kreditorenrechnung ein.	['vendor invoice']	{'vendor invoice': 'Kreditorenrechnung'}	['kreditorenrechnehen']
416	{'intercompany': 'unternehmensübergreifend'}	Display the Intercompany transactions	Unternehmensübergreifende Transaktionen anzeigen	['intercompany']	{'intercompany': 'Unternehmensübergreifende'}	['unternehmensübergreifen']
417	{'create': 'erstellen'}	To create a Forms by Adobe print template, proceed as follows:	Um eine Druckvorlage mit Forms by Adobe zu erstellen, gehen Sie wie folgt vor:	['create']	{'create': 'Erstellen'}	['erstellen']
418	{'personal data': 'personenbezogene Daten'}	BAdI, personal data,	BAdI, personenbezogene Daten,	['personal data']	{'personal data': 'personenbezogene Daten'}	['personenbezogen datum']
419	{'relationship': 'Relation'}	Relationships for other SAP applications	Relationen zu anderen SAP-Anwendungen	['relationship']	{'relationship': 'Relationen'}	['relation']
420	{'table view': 'Tabellenansicht'}	Click Table view.	Klicken Sie auf die Tabellenansicht.	['table view']	{'table view': 'Tabellenansicht'}	['tabellenansicht']
421	{'import': 'importieren'}	Issues with importing compliance requirements	Probleme beim Importieren von Konformitätsanforderungen	['import']	{'import': 'Importieren'}	['importieren']
