	terms	src_raw	mt_raw	src_terms	alg_terms	norm_tgt_terms
181	{'template': 'modelo'}	Read the messages to understand if there are any errors or warnings, if the actions you performed on the template were successful, if further action is required from you, and so on.	Lea los mensajes para saber si hay errores o advertencias, si las acciones que realizó en la plantilla fueron exitosas, si se requiere más acción de usted, etc.	['template']	{'template': 'plantilla'}	['plantilla']
182	{'allocation': 'imputación'}	Summary of processes that take place during allocation.	Resumen de los procesos que ocurren durante la asignación.	['allocation']	{'allocation': 'asignación'}	['asignación']
183	{'stage': 'fase'}	The JOA has different development stages, such as engineering and design, construction, and production.	El JOA tiene distintas etapas de desarrollo, como ingeniería y diseño, construcción y producción.	['stage']	{'stage': 'etapas'}	['etapa']
184	{'allocation': 'imputación'}	Select this checkbox to allocate costs in the original posted transaction currency during an allocation run.	Seleccione esta casilla para asignar costes en la moneda de la transacción original durante una ejecución de asignación.	['allocation']	{'allocation': 'asignación'}	['asignación']
185	{'work center': 'puesto de trabajo'}	Choose either one of the scheduling controls to realign your work center schedules:	Elija uno de los controles de programación para reorganizar sus horarios de centro de trabajo:	['work center']	{'work center': 'centro de trabajo'}	['centro de trabajo']
186	{'remove': 'quitar', 'add': 'añadir'}	Add other operators to remove or create columns and filter or aggregate data.	Agregar otros operadores para eliminar o crear columnas y filtrar o agregar datos.	['remove', 'add']	{'remove': 'eliminar', 'add': 'agregar'}	['eliminar', 'agregar']
187	{'business activity': 'actividad empresarial'}	The period of time between the end of the last business activity involving a specific object (for example, a business partner) and the deletion of the corresponding data, subject to applicable laws.	El período de tiempo entre el final de la última actividad comercial que involucra a un objeto específico (por ejemplo, un socio comercial) y la eliminación de los datos correspondientes, sujeto a las leyes aplicables.	['business activity']	{'business activity': 'actividad comercial'}	['actividad comercial']
188	{'add': 'agregar'}	Adding a control characteristic	Agregar una característica de control	['add']	{'add': 'Agregar'}	['agregar']
189	{'partner': 'socio'}	You assign billable costs to the appropriate partners.	Asignan los costos facturables a los socios apropiados.	['partner']	{'partner': 'socios'}	['socio']
190	{'acquisition': 'alta'}	Shows acquisition and retirement information.	Muestra información de adquisición y baja.	['acquisition']	{'acquisition': 'adquisición'}	['adquisición']
191	{'template': 'plantilla'}	A condition contains expressions and resulting actions defined for a text block used in a template.	Una condición contiene expresiones y acciones resultantes definidas para un bloque de texto usado en una plantilla.	['template']	{'template': 'plantilla'}	['plantilla']
192	{'item': 'elemento'}	However, there may be exceptions,for instance, when you create a dependency to an item in a different software collection.	Sin embargo, puede haber excepciones, por ejemplo, cuando se crea una dependencia a un elemento de una colección de software diferente.	['item']	{'item': 'elemento'}	['elemento']
193	{'class': 'clase'}	You can create different kinds of bonds by defining class data and the conditions accordingly:	Puede crear diferentes tipos de vínculos al definir datos de clase y las condiciones correspondientes:	['class']	{'class': 'clase'}	['clase']
194	{'inventory': 'existencias'}	Value changes are posted to the balance sheet account in inventory accounting	Las variaciones de valor se contabilizan en la cuenta del balance en la contabilidad de inventario.	['inventory']	{'inventory': 'inventario'}	['inventario']
195	{'tab': 'etiqueta'}	On a specific tab, choose Edit Prompts at the right corner, and .	En una pestaña específica, elija Editar Prompts en la esquina derecha, y .	['tab']	{'tab': 'pestaña'}	['pestaña']
196	{'time': 'hora', 'date': 'fecha'}	The categories Text Type, Number Type, and Data Time Type help to validate that the expression matches the chosen data type.	Las categorías Tipo de Texto, Tipo de Número y Tipo de Tiempo de Datos ayudan a validar que la expresión coincide con el tipo de datos elegido.	['time', 'date']	{'time': 'Tiempo', 'date': '▔'}	['tiempo', '▔']
197	{'launchpad': 'plataforma de lanzamiento'}	Secure Text is sent only through secure communication channels such as the SAP Fiori launchpad.	El Texto Seguro se envía solo a través de canales de comunicación seguros, como el launchpad de SAP Fiori.	['launchpad']	{'launchpad': 'launchpad'}	['launchpad']
198	{'update': 'actualizar'}	You need to fix the error to be able to complete the persistent view creation or update.	Debe corregir el error para poder completar la creación o actualización de la vista persistente.	['update']	{'update': 'actualización'}	['actualización']
199	{'item': 'posición'}	When choosing to edit, the requisition or item moves out of the Rejected status and enables resubmission.	Al seleccionar editar, la solicitud o el elemento sale del estado de rechazado y permite la nueva presentación.	['item']	{'item': 'elemento'}	['elemento']
200	{'work center': 'centro de trabajo'}	In this popup you can select different periods and change the available capacity of the work center.	En este popup puede seleccionar diferentes períodos y cambiar la capacidad disponible del centro de trabajo.	['work center']	{'work center': 'centro de trabajo'}	['centro de trabajo']
201	{'default': 'estándar'}	You can keep the default waste generator or choose the value help in the mandatory Waste Generator field and a dialog box will appear.	Puede mantener el generador de residuos por defecto o elegir la ayuda de valor en el campo obligatorio del generador de residuos y aparecerá una ventana.	['default']	{'default': 'defecto'}	['defecto']
202	{'save': 'guardar'}	Click Save to active the log access.	Haga clic en Guardar para activar el acceso al log.	['save']	{'save': 'Guardar'}	['guardar']
203	{'type': 'clase'}	Add run types by choosing Add and selecting run types from the list.	Añade tipos de ejecución eligiendo Añadir y seleccionando tipos de ejecución de la lista.	['type']	{'type': 'tipos'}	['tipo']
204	{'sharing': 'compartición'}	The Data Sharing Cockpit is the tool you use as a the data provider.	El Data Sharing Cockpit es la herramienta que usted utiliza como proveedor de datos.	['sharing']	{'sharing': '▔'}	['▔']
205	{'template': 'plantilla'}	An alternative text block is a released version of a text block that is assigned as a possible replacement for another text block used in the template.	Un bloque de texto alternativo es una versión publicada de un bloque de texto que se asigna como posible reemplazo de otro bloque de texto utilizado en la plantilla.	['template']	{'template': 'plantilla'}	['plantilla']
206	{'save as': 'grabar como'}	Save as Tile	Guardar como mosaico	['save as']	{'save as': 'mosaico'}	['mosaico']
207	{'tab': 'pestaña'}	Click (Show or hide data preview) to open the Data Preview panel and select any table or view on the editor panel or in the Repository tab of the sources browser.	Haga clic en (Mostrar u ocultar vista previa de datos) para abrir el panel de Vista previa de datos y seleccionar cualquier tabla o vista en el panel del editor o en la pestaña Repositorio del navegador de fuentes.	['tab']	{'tab': 'pestaña'}	['pestaña']
208	{'set': 'definir'}	If you lock a release that is not the latest release, all releases which have been published after the release of the marked release are also set to locked.	Si bloqueas una versión que no es la última, todas las versiones publicadas después de la versión marcada también se establecerán como bloqueadas.	['set']	{'set': 'bloqueadas'}	['bloqueado']
209	{'role template': 'plantilla de rol'}	If you want to change the role template that your new custom role will be based on, select  (Select Template), and choose a role.	Si desea cambiar la plantilla de rol en la que se basará su nuevo rol personalizado, seleccione (Seleccionar plantilla) y elija un rol.	['role template']	{'role template': 'plantilla de rol'}	['plantilla de rol']
210	{'template': 'modelo'}	If you want to use a different template instead, click on the X to deselect the default template.	Si prefiere usar una plantilla diferente, haga clic en la X para deseleccionar la plantilla predeterminada.	['template']	{'template': 'plantilla'}	['plantilla']
211	{'item': 'posición', 'add': 'añadir'}	If you want to publish a sourcing project with at least one item of type Project Item, you have to add at least one procurement project and the related information in the section Project Details.	Si desea publicar un proyecto de abastecimiento con al menos un elemento de tipo Project Item, debe agregar al menos un proyecto de adquisición y la información relacionada en la sección Detalles del Proyecto.	['item', 'add']	{'item': 'elemento', 'add': 'agregar'}	['elemento', 'agregar']
212	{'usage': 'utilización'}	This is done to prevent over usage of the space.	Esto se realiza para evitar el uso excesivo del espacio.	['usage']	{'usage': 'uso'}	['uso']
213	{'endpoint': 'punto final'}	AWS region in your Amazon Athena regional endpoint that you use to make your requests.	Región AWS en su punto final regional de Amazon Athena que sirve para realizar sus solicitudes.	['endpoint']	{'endpoint': 'punto final'}	['punto final']
214	{'delete': 'eliminar'}	In the side navigation area, click  and then click the My Content folder to display the list of packages that you have exported and those from other systems that you have permission to edit or delete.	En el área de navegación lateral, haga clic y luego haga clic en la carpeta Mi contenido para mostrar la lista de paquetes que ha exportado y aquellos de otros sistemas que tiene permiso para editar o eliminar.	['delete']	{'delete': 'eliminar'}	['eliminar']
215	{'retrieval': 'retrieval'}	The information retrieval framework (IRF) supports you to comply with the relevant legal requirements for data protection by allowing you to search for and retrieve all personal data of a specified data subject.	El marco de recuperación de información (IRF) le permite cumplir con los requisitos legales pertinentes para la protección de datos, ya que le permite buscar y recuperar todos los datos personales de un interesado específico.	['retrieval']	{'retrieval': 'recuperación'}	['recuperación']
216	{'service organization': 'organización de prestación de servicio'}	Service Organization ID	ID de la organización de servicios	['service organization']	{'service organization': 'organización de servicios'}	['organización de servicio']
217	{'collection': 'recopilación', 'item set': 'conjunto de posiciones'}	Item set is a collection of items.	El conjunto de posiciones es una colección de posiciones.	['collection', 'item set']	{'collection': 'colección', 'item set': 'conjunto de posiciones'}	['colección', 'conjunto de posición']
218	{'filter': 'filtrar'}	Click in the Create Transform bar, select Filter, and complete the formula ().	Haga clic en la barra Crear Transformación, seleccione Filtro y complete la fórmula ().	['filter']	{'filter': 'Filtro'}	['filtro']
219	{'schedule': 'programación'}	If a schedule is set for the data flow, see by when the next run is scheduled.	Si se ha establecido un horario para el flujo de datos, verifique para cuándo está programada la próxima ejecución.	['schedule']	{'schedule': 'horario'}	['horario']
220	{'default': 'por defecto'}	This is now the default setting.	Esta es ahora la parametrización predeterminada.	['default']	{'default': 'predeterminada'}	['predeterminado']
221	{'template': 'plantilla'}	Select a task template.	Seleccione un modelo de tarea.	['template']	{'template': 'modelo'}	['modelo']
222	{'union': 'unión'}	The union operator combines two data sets that share the same schema definition.	El operador de unión combina dos conjuntos de datos que comparten la misma definición de esquema.	['union']	{'union': 'unión'}	['unión']
223	{'run type': 'clase de ejecución'}	When you create or edit a situation type, you can define the run type settings:	Cuando crea o edita un tipo de situación, puede definir la configuración del tipo de ejecución:	['run type']	{'run type': 'ejecución'}	['ejecución']
224	{'recurrence pattern': 'modelo de repetición'}	Define a recurrence pattern for the job.	Defina un patrón de repetición para el job.	['recurrence pattern']	{'recurrence pattern': 'patrón de repetición'}	['patrón de repetición']
225	{'statement': 'declaración'}	[if Create Statement-level Insert Triggers = true] Create Statement-level Update Triggers	[si Crear activadores de inserción a nivel de declaración = verdadero] Crear activadores de actualización a nivel de declaración	['statement']	{'statement': 'declaración'}	['declaración']
226	{'feature': 'función'}	This Feature Scope Description	Descripción del alcance de la función	['feature']	{'feature': 'función'}	['función']
227	{'adjustment': 'corrección'}	Billing indicators are assigned to billable postings and identify the type of posting involved, including cash call, normal expenditure, and audit adjustment to a particular partner account.	Los indicadores de facturación se asignan a las entradas facturables e identifican el tipo de publicación involucrada, incluidos los llamados de efectivo, los gastos normales y los ajustes de auditoría de una cuenta de socio específica.	['adjustment']	{'adjustment': 'ajustes'}	['ajuste']
228	{'local repository': 'repositorio local', 'save': 'guardar'}	To save your table in the local repository, choose Save.	Para guardar la tabla en el repositorio local, seleccione Guardar.	['local repository', 'save']	{'local repository': 'repositorio', 'save': 'guardar'}	['repositorio', 'guardar']
229	{'use': 'utilizar'}	In the connections list of your space, select the new connection and click  (Validate Connection) to check if you can use the connection or if it contains any errors.	En la lista de conexiones de su espacio, seleccione la nueva conexión y haga clic en (Validar conexión) para verificar si puede usar la conexión o si contiene errores.	['use']	{'use': 'usar'}	['usar']
230	{'statement': 'extracto'}	Displays the current status of the statement.	Muestra el estado actual del estado de cuenta.	['statement']	{'statement': 'cuenta'}	['cuenta']
231	{'consumption': 'compensación', 'allocation': 'contingente'}	Displays data for allocation periods in which allocation consumption exceeds 100%.	Muestra datos de los períodos de asignación en los que el consumo de asignación supera el 100%.	['consumption', 'allocation']	{'consumption': 'consumo', 'allocation': 'asignación'}	['consumo', 'asignación']
232	{'replication': 'reproducción'}	For more information, see Microsoft SQL Server Trigger-Based Replication in the SAP HANA Smart Data Integration and SAP HANA Smart Data Quality Installation and Configuration Guide.	Para obtener más información, consulte la Replicación Basada en Disparadores de Microsoft SQL Server en la Guía de Instalación y Configuración de Integración de Datos Inteligentes de SAP HANA y Calidad de Datos Inteligentes de SAP HANA.	['replication']	{'replication': 'Replicación'}	['replicación']
233	{'approval': 'autorización', 'Approval': 'Autorización'}	No Approval Required:	No se necesita aprobación:	['approval', 'Approval']	{'approval': 'aprobación', 'Approval': 'aprobación'}	['aprobación', 'aprobación']
234	{'transfer': 'transferencia'}	In the Manage Your Solution app under Configure Your Solution make system settings under FinanceContract AccountingPosting and DocumentsDefine Short Assignment for Transfer Postings.	En la aplicación Administrar su solución, bajo Configurar su solución, realice las opciones del sistema en FinanzasContrato ContabilidadPublicación y DocumentosDefinir asignación corta para transferencias.	['transfer']	{'transfer': 'transferencias'}	['transferencia']
235	{'tab': 'ficha'}	Go to the Parameters tab.	Vaya a la pestaña de Parámetros.	['tab']	{'tab': 'pestaña'}	['pestaña']
236	{'production version': 'versión de producción'}	The Production Version:	Versión de producción:	['production version']	{'production version': 'Versión de producción'}	['versión de producción']
237	{'replication': 'replicación'}	Choose Publish to finalize the exclusion of fields, or the removal of excluded tables and fields before replication to the target SAP Cloud Platform system.	Seleccione Publicar para finalizar la exclusión de campos o la eliminación de tablas y campos excluidos antes de la replicación al sistema de destino de SAP Cloud Platform.	['replication']	{'replication': 'replicación'}	['replicación']
238	{'set': 'definir'}	Set Document Status	Configurar el estado del documento	['set']	{'set': 'estado'}	['estado']
239	{'reporting': 'informes'}	It provides a consolidation view along this profit center hierarchy by populating the Profit Center Eliminated reporting dimension.	Proporciona una vista de consolidación a lo largo de esta jerarquía de centros de beneficios al completar la dimensión de informes de Eliminación de Centros de Beneficio.	['reporting']	{'reporting': 'informes'}	['informe']
240	{'use': 'utilizar'}	The authentication type to be used:	Tipo de autenticación a utilizar:	['use']	{'use': 'utilizar'}	['utilizar']
241	{'save': 'guardar'}	The Save Model dialog opens.	Se abre el cuadro de diálogo de Guardar modelo.	['save']	{'save': 'guardar'}	['guardar']
242	{'step': 'paso'}	For implementaiton steps, you will see Go to App button instead of the Configure button.	"Para los pasos de implementación, verá el botón ""Ir a la aplicación"" en lugar del botón ""Configurar""."	['step']	{'step': 'pasos'}	['paso']
243	{'purpose': 'objetivo'}	Complete the Business Purpose section to let others know what your view is about.	Complete la sección de Propósito Comercial para que otros sepan cuál es su opinión.	['purpose']	{'purpose': 'Propósito'}	['propósito']
244	{'quantity contract': 'contrato por cantidad'}	Quantity Contract (MK)	Contrato de cantidad (MK)	['quantity contract']	{'quantity contract': 'Contrato de cantidad'}	['contrato de cantidad']
245	{'complete': 'completa'}	You can use the Cancel button to cancel a service confirmation that has been set to completed.	Puede usar el botón Cancelar para anular una confirmación de servicio que se ha marcado como completada.	['complete']	{'complete': 'completada'}	['completar']
246	{'template': 'plantilla'}	Task Template Status	Estado de la plantilla de tarea	['template']	{'template': 'plantilla'}	['plantilla']
247	{'approval': 'autorización', 'Approval': 'Autorización'}	Approval Process Flow	Flujo de proceso de aprobación	['approval', 'Approval']	{'approval': 'aprobación', 'Approval': 'aprobación'}	['aprobación', 'aprobación']
248	{'issue': 'problema'}	Fiscal Year and Fiscal Period of issue	Ejercicio fiscal y período fiscal de emisión	['issue']	{'issue': 'emisión'}	['emisión']
249	{'report': 'informe'}	You can use this report to:	Puede utilizar este informe para:	['report']	{'report': 'informe'}	['informe']
250	{'tab': 'ficha'}	You can perform the following actions on this tab:	Puede realizar las siguientes acciones en esta pestaña:	['tab']	{'tab': 'pestaña'}	['pestaña']
251	{'tab': 'etiqueta'}	Withholding Tax tab.	Pestaña de Retención de Impuestos.	['tab']	{'tab': 'Pestaña'}	['pestaña']
252	{'partner': 'socio'}	Business Partner's IBAN	IBAN del socio comercial	['partner']	{'partner': 'socio'}	['socio']
253	{'network': 'red'}	Enter the network number.	Indique el número de red.	['network']	{'network': 'red'}	['red']
254	{'partner': 'socio'}	Business Partner name	Nombre del socio de negocios	['partner']	{'partner': 'socio'}	['socio']
255	{'edit': 'editar'}	Edit Service Contracts	Editar contratos de servicios	['edit']	{'edit': 'Editar'}	['editar']
256	{'template': 'modelo', 'delete': 'borrar'}	Select a template and click Delete.	Seleccione una plantilla y haga clic en Eliminar.	['template', 'delete']	{'template': 'plantilla', 'delete': 'Eliminar'}	['plantilla', 'eliminar']
257	{'about': 'info'}	About Goods Issue	Acerca de la emisión de mercancías	['about']	{'about': 'Acerca'}	['acerca']
258	{'partner': 'socio'}	Business Partner Name	Nombre del socio de negocios	['partner']	{'partner': 'socio'}	['socio']
259	{'role': 'función'}	Business Partner Role	Rol del socio comercial	['role']	{'role': 'Rol'}	['rol']
260	{'template': 'modelo'}	Enter a description for the template in the Description field.	Introduzca una descripción para la plantilla en el campo Descripción.	['template']	{'template': 'plantilla'}	['plantilla']
261	{'performance management': 'gestión del rendimiento'}	SI Performance Management (SF)	SI Gestión del Desempeño (SF)	['performance management']	{'performance management': 'Gestión del Desempeño'}	['gestión de desempeño']
262	{'contract account': 'cuenta contractual'}	Contract Account Check	Verificación de cuenta de contrato	['contract account']	{'contract account': 'cuenta contrato'}	['cuenta contrato']
263	{'save': 'guardar'}	Save User Settings	Guardar las opciones del usuario	['save']	{'save': 'guardar'}	['guardar']
264	{'type': 'clase'}	Delivery Type Code	Código de tipo de entrega	['type']	{'type': 'tipo'}	['tipo']
265	{'edit': 'tratar'}	You can edit the following UDQs:	Puede editar las siguientes UDQs:	['edit']	{'edit': 'editar'}	['editar']
266	{'template': 'plantilla'}	Contains one or more expressions and resulting actions defined for a text block present in a template.	Contiene una o más expresiones y las acciones resultantes definidas para un bloque de texto presente en una plantilla.	['template']	{'template': 'plantilla'}	['plantilla']
267	{'tax type': 'tipo de impuesto'}	Description of the tax type.	Descripción del tipo impositivo.	['tax type']	{'tax type': 'tipo impositivo'}	['tipo impositivo']
268	{'usage': 'utilización'}	Add Usage Data	Agregar datos de uso	['usage']	{'usage': 'uso'}	['uso']
269	{'approval': 'autorización', 'Approval': 'Autorización'}	Approval in Progress	Aprobación en curso	['approval', 'Approval']	{'approval': 'Aprobación', 'Approval': 'Aprobación'}	['aprobación', 'aprobación']
270	{'business content': 'contenido empresarial'}	Business Content Hub	Hub de contenido empresarial	['business content']	{'business content': 'contenido empresarial'}	['contenido empresarial']
271	{'mass processing': 'procesamiento en masa'}	Asset Mass Processing	Procesamiento masivo de activos	['mass processing']	{'mass processing': 'Procesamiento masivo'}	['procesamiento masivo']
272	{'schedule': 'programación'}	Your role determines what you can do with a schedule.	Tu rol determina lo que puedes hacer con una programación.	['schedule']	{'schedule': 'programación'}	['programación']
273	{'job': 'tarea'}	specify a limit to avoid excessive concurrent processing due to too many jobs.	especificar un límite para evitar un procesamiento simultáneo excesivo debido a un número excesivo de tareas.	['job']	{'job': 'tareas'}	['tarea']
274	{'target': 'destino'}	Navigate to other targets	Navegar hacia otros destinos	['target']	{'target': 'destinos'}	['destino']
275	{'role template': 'plantilla de rol'}	Select a role template.	Seleccione un modelo de rol.	['role template']	{'role template': 'modelo de rol'}	['modelo de rol']
276	{'schedule': 'programar'}	Schedule Tax Jobs	Programar jobs de impuestos	['schedule']	{'schedule': 'Programar'}	['programar']
277	{'Purchase Orders': 'pedidos', 'about': 'info'}	About Purchase Order	Sobre el sobre de compra	['Purchase Orders', 'about']	{'Purchase Orders': 'compra', 'about': 'sobre'}	['compra', 'sobre']
278	{'partner': 'socio'}	Business Partner Event	Evento de socios empresariales	['partner']	{'partner': 'socios'}	['socio']
279	{'item set': 'conjunto de posiciones'}	An item set can contain both standard items of types Material and Service and project items.	Un conjunto de posiciones puede contener tanto posiciones estándar de tipo Material y Servicio como posiciones de proyecto.	['item set']	{'item set': 'conjunto de posiciones'}	['conjunto de posición']
280	{'tab': 'pestaña'}	Code List tab	Pestaña Código Lista	['tab']	{'tab': 'Pestaña'}	['pestaña']
281	{'deployment': 'despliegue'}	Displays the current status of the deployment.	Muestra el estado actual del despliegue.	['deployment']	{'deployment': 'despliegue'}	['despliegue']
282	{'pause': 'detener'}	Pause and Restart Real-Time Replication	Pausar y reiniciar la replicación en tiempo real	['pause']	{'pause': 'Pausar'}	['pausar']
283	{'assessment': 'evaluación'}	The system copies substances from the composition of the unpackaged product that is also part of the most recently activated Health and Safety Management regulation whose lists are assigned to the Safety Data Sheet Management regulation used for the compliance assessment.	El sistema copia sustancias de la composición del producto sin envasar que también son parte de la normativa de gestión de la seguridad y salud más recientemente activada, cuyas listas se asignan a la normativa de gestión de la ficha de datos de seguridad utilizada para la evaluación del cumplimiento.	['assessment']	{'assessment': 'evaluación'}	['evaluación']
284	{'flow': 'flow'}	The package contains the following iFlows:	El paquete contiene los siguientes iFlows:	['flow']	{'flow': 'iFlows'}	['iflows']
