	terms	src_raw	mt_raw	src_terms	alg_terms	norm_tgt_terms
87	{'minimum score': 'Mindest-Score'}	Set the minimum score needed to match an input record with a lookup record and place it in the Review results category.	"Legen Sie den Mindest-Score fest, der erforderlich ist, um einen Eingabedatensatz mit einem Nachschlagedatensatz abzugleichen, und ordnen Sie ihn der Kategorie ""Überprüfungsergebnisse"" zu."	['minimum score']	{'minimum score': 'Mindest-Score'}	['mindest']
88	{'side panel': 'Seitenbereich'}	Control your join in the Mappings section of its side panel:	Überwachen Sie Ihre Verknüpfung im Abschnitt Mappings des Seitenbereichs:	['side panel']	{'side panel': 'Seitenbereich'}	['seitenbereich']
89	{'space': 'Space'}	data related to spaces,	Daten über Spaces,	['space']	{'space': 'Spaces'}	['space']
90	{'space': 'Space', 'allow': 'erlauben'}	You could also allow your space data to be consumed in your HDI containers.	Sie könnten auch erlauben, dass Ihre Space-Daten in Ihren HDI-Containern konsumiert werden.	['space', 'allow']	{'space': 'Space-Daten', 'allow': 'erlauben'}	['space', 'erlauben']
91	{'minimum score': 'Mindest-Score'}	Set the minimum score needed to match an input record with a lookup record and place it in the Matched results category.	"Legen Sie den Mindest-Score fest, der erforderlich ist, um einen Eingabedatensatz mit einem Nachschlagedatensatz abzugleichen, und ordnen Sie ihn der Kategorie ""Übereinstimmende Ergebnisse"" zu."	['minimum score']	{'minimum score': 'Mindest-Score'}	['mindest']
92	{'action': 'Aktion', 'Action': 'Aktion'}	Possible quick actions are:	Mögliche schnelle Aktionen sind:	['action', 'Action']	{'action': 'Aktionen', 'Action': 'Aktionen'}	['aktion', 'aktion']
93	{'condition': 'Bedingung'}	The advantage of this attribute is that you can refer to certain business partners in one condition by using the correct payment clearing group.	Der Vorteil dieses Attributs besteht darin, dass Sie bestimmte Geschäftspartner in einer Bedingung durch die Verwendung der richtigen Zahlungsabrechnungsgruppe referenzieren können.	['condition']	{'condition': 'Bedingung'}	['bedingung']
94	{'compliance requirement': 'Compliance-Anforderung'}	Specifies the Valid To date for compliance requirements.	Legt das Gültigkeitsdatum für Compliance-Anforderungen fest.	['compliance requirement']	{'compliance requirement': 'Compliance-Anforderungen'}	['compliance']
95	{'data provider': 'Datenprovider'}	The data provider has entered some details about the product:	Der Datenprovider hat einige Details zum Produkt eingegeben:	['data provider']	{'data provider': 'Datenprovider'}	['datenprovider']
96	{'release': 'Release', 'create': 'erstellen'}	Information on the contained data, which is entered in the Create Release wizard.	"Informationen zu den enthaltenen Daten, die im Assistenten ""Release erstellen"" eingegeben werden."	['release', 'create']	{'release': 'Release', 'create': 'Assistenten'}	['release', 'assistent']
97	{'type': 'Typ'}	In the Permissions page individual permissions assigned to privilege types are displayed	Auf der Seite Berechtigungen werden die einzelnen Berechtigungen angezeigt, die den Privilegtypen zugewiesen wurden.	['type']	{'type': 'Privilegtypen'}	['privilegtype']
98	{'connector': 'Connector'}	Note that Cloud Connectors that you want to use for data flows only don't require an entry in this list.	Beachten Sie, dass Cloud-Connectoren, die Sie nur für Datenflüsse verwenden möchten, keinen Eintrag in dieser Liste benötigen.	['connector']	{'connector': 'Cloud-Connectoren'}	['cloud']
99	{'space': 'Space'}	The space that was selected to store the data product.	Der Space, der für die Speicherung des Datenprodukts ausgewählt wurde.	['space']	{'space': 'Space'}	['space']
100	{'schedule': 'Zeitplan', 'change': 'Änderung'}	This means that the work center change is only visible in your schedule and is not yet saved in the maintenance order.	Dies bedeutet, dass die Änderung des Arbeitsplatzes nur in Ihrem Zeitplan sichtbar ist und noch nicht im Wartungsauftrag gespeichert ist.	['schedule', 'change']	{'schedule': 'Zeitplan', 'change': 'Änderung'}	['zeitplan', 'änderung']
101	{'category': 'Kategorie'}	New records that have the same pairing column value as an existing pairing group are automatically placed in the appropriate results category for that pairing group.	Neue Datensätze, die den gleichen Wert in der Pairingspalte haben wie eine bestehende Pairinggruppe, werden automatisch in die entsprechende Ergebniskategorie für diese Pairinggruppe eingeordnet.	['category']	{'category': 'Ergebniskategorie'}	['ergebniskategorie']
102	{'service': 'Service'}	SAP and other SAP products and services mentioned herein as well as their respective logos are trademarks or registered trademarks of SAP SE (or an SAP affiliate company) in Germany and other countries.	SAP und andere hier erwähnte SAP-Produkte und -Services sowie deren jeweiligen Logos sind Marken oder eingetragene Marken der SAP SE (oder eines SAP-Tochterunternehmens) in Deutschland und anderen Ländern.	['service']	{'service': 'Services'}	['service']
103	{'data provider': 'Datenprovider'}	To be able to use the data product, the data provider will send an activation key via email that provides authorization to access one or multiple data products.	Um das Datenprodukt nutzen zu können, sendet der Datenprovider einen Aktivierungsschlüssel per E-Mail, der den Zugriff auf ein oder mehrere Datenprodukte autorisiert.	['data provider']	{'data provider': 'Datenprovider'}	['datenprovider']
104	{'assigned': 'zugewiesen', 'space': 'Platz'}	It might make sense to delete unnecessary data in your space or to extend the assigned storage.	Es könnte sinnvoll sein, unnötige Daten in Ihrem Platz zu löschen oder den zugewiesenen Speicher zu erweitern.	['assigned', 'space']	{'assigned': 'zugewiesenen', 'space': 'Platz'}	['zuwiesen', 'platz']
105	{'insight': 'Analysen'}	There are many ways to collect and combine data to create business insights:	Es gibt viele Möglichkeiten, Daten zu sammeln und zu kombinieren, um Geschäftsanalysen zu erstellen:	['insight']	{'insight': 'Analysen'}	['analyse']
106	{'create': 'anlegen'}	You can create a text block inside the text block library.	Sie können einen Textblock innerhalb der Textblockbibliothek anlegen.	['create']	{'create': 'anlegen'}	['anlegen']
107	{'space': 'Space'}	This space is no longer active.	Dieser Space ist nicht mehr aktiv.	['space']	{'space': 'Space'}	['space']
108	{'storage': 'Speicher'}	Allocate your capacity units to compute and storage resources.	Weisen Sie Ihre Kapazitätseinheiten Rechen- und Speicherressourcen zu.	['storage']	{'storage': 'Speicherressourcen'}	['speicherressourcen']
109	{'share': 'freigeben'}	Generate keys that you can share with consumers to allow them to use the licensed scope of data products.	Erstellen Sie Schlüssel, die Sie für Verbraucher freigeben können, damit sie den lizenzierten Umfang der Datenprodukte nutzen können.	['share']	{'share': 'freigeben'}	['freigeben']
110	{'release': 'Release'}	The release is highlighted on the landing page with the flag “Not published yet”.	Das Release wird auf der Startseite mit der Flagge „Noch nicht veröffentlicht“ hervorgehoben.	['release']	{'release': 'Release'}	['release']
111	{'access control': 'Zugriffskontrolle', 'restriction': 'Beschränkung'}	For each business entity used as data restriction, you need to map each key member to the data access control's output column.	Für jede Geschäftsentität, die als Datenbeschränkung verwendet wird, müssen Sie jedes Schlüsselmitglied der Ausgabespalte der Datenzugriffskontrolle zuordnen.	['access control', 'restriction']	{'access control': 'Datenzugriffskontrolle', 'restriction': 'Datenbeschränkung'}	['datenzugriffskontrollen', 'datenbeschränkung']
112	{'snapshot': 'Snapshot'}	Create a schedule to load new snapshot of data asynchronously and recurrently in the background according to the defined settings.	Erstellen Sie einen Zeitplan, um neue Snapshots von Daten asynchron und wiederkehrend im Hintergrund gemäß den definierten Einstellungen zu laden.	['snapshot']	{'snapshot': 'Snapshots'}	['snapshot']
113	{'interface': 'Schnittstelle', 'message': 'Nachricht'}	The interfaces you have subscribed to for monitoring, including the status of the individual messages.	Die Schnittstellen, die Sie zur Überwachung abonniert haben, einschließlich des Status der jeweiligen Nachrichten.	['interface', 'message']	{'interface': 'Schnittstellen', 'message': 'Nachrichten'}	['schnittstelle', 'nachricht']
114	{'deployment': 'Implementierung'}	A pop up informs you about the source updates before you can go with deployment.	Ein Popup-Fenster informiert Sie über die Quellaktualisierungen, bevor Sie mit der Implementierung beginnen können.	['deployment']	{'deployment': 'Implementierung'}	['implementierung']
115	{'data provider': 'Datenprovider'}	To edit an existing data provider profile, click .	Um ein bestehendes Datenprovider-Profil zu bearbeiten, klicken Sie auf .	['data provider']	{'data provider': 'Datenprovider'}	['datenprovider']
116	{'reference': 'Referenz'}	In this app, you can create the reference data that are used for the simulations.	In dieser App können Sie die Referenzdaten erstellen, die für die Simulationen genutzt werden.	['reference']	{'reference': 'Referenzdaten'}	['referenzdaten']
117	{'deployment': 'Implementierung'}	Note that after a redeployment, the persistency is deleted and the data access is changed back to virtual.	Bitte beachten Sie, dass nach einer Reimplementierung die Persistenz gelöscht wird und der Datenzugriff wieder auf virtuell umgestellt wird.	['deployment']	{'deployment': 'Reimplementierung'}	['reimplementierungen']
118	{'release': 'Release'}	Specify date and text information for the release.	Datum und Textinformationen für das Release angeben.	['release']	{'release': 'Release'}	['release']
119	{'data provider': 'Datenprovider'}	You can search and browse for data products and data providers.	Sie können nach Datenprodukten und Datenprovidern suchen und stöbern.	['data provider']	{'data provider': 'Datenprovidern'}	['datenprovidern']
120	{'deployment': 'Implementierung'}	saving is available but deployment is blocked	Speicherung ist verfügbar, aber die Implementierung ist gesperrt.	['deployment']	{'deployment': 'Implementierung'}	['implementierung']
121	{'update': 'aktualisieren'}	You can donwload it to get a data update.	Sie können es herunterladen, um die Daten zu aktualisieren.	['update']	{'update': 'aktualisieren'}	['aktualisieren']
122	{'skill': 'Qualifikation'}	Skills with a check mark are provided by the resource.	Qualifikationen mit einem Häkchen werden von der Ressource bereitgestellt.	['skill']	{'skill': 'Qualifikationen'}	['qualifikation']
123	{'feedback': 'Feedback'}	This provides you feedback on how many entries within the current business entity there are and how many of them match to entries of the target business entity.	Dies gibt Ihnen Feedback darüber, wie viele Einträge innerhalb der aktuellen Geschäftseinheit vorhanden sind und wie viele davon mit Einträgen der Zielgeschäftseinheit übereinstimmen.	['feedback']	{'feedback': 'Feedback'}	['feedback']
124	{'data provider': 'Datenprovider'}	The data provider profile page provides additional information about the data provider and other products or product groups.	Die Profilseite des Datenproviders enthält zusätzliche Informationen über den Datenprovider sowie über andere Produkte oder Produktgruppen.	['data provider']	{'data provider': 'Datenprovider'}	['datenprovider']
125	{'insert': 'einfügen'}	insert privilege is removed from the Space Manager	Das Einfüge-Recht wird aus dem Space Manager entfernt.	['insert']	{'insert': 'Einfüge-Recht'}	['einfügen']
126	{'Table': 'Tabelle'}	Remote Table Monitor - short descriptions	Fernüberwachung des Tabellenmonitors - kurze Beschreibungen	['Table']	{'Table': 'Tabellenmonitors'}	['tabellenmonitorsen']
127	{'insight': 'Analysen'}	First Steps to Create Insights	Erste Schritte zur Erstellung von Analysen	['insight']	{'insight': 'Analysen'}	['analyse']
128	{'deployment': 'Implementierung'}	[read-only] Displays the deployment and error status of the object.	[nur lesbar] Zeigt den Implementierungs- und Fehlerstatus des Objekts an.	['deployment']	{'deployment': 'Implementierungs-'}	['implementierungen']
129	{'space': 'Space'}	Keeping an overloaded space active can impact running jobs.	Die Aktivität eines überlasteten Spaces kann sich auf die laufenden Arbeiten auswirken.	['space']	{'space': 'Spaces'}	['space']
130	{'personal data': 'personenbezogene Daten'}	Personal data concerning insurances and bank or credit card accounts	Personenbezogene Daten zu Versicherungen sowie Bank- oder Kreditkartenkonten	['personal data']	{'personal data': 'personenbezogene Daten'}	['personenbezogen datum']
131	{'work center': 'Arbeitsplatz'}	Reviewers do not require any work center assignment.	Die Prüfer benötigen keine Zuweisung zu einem Arbeitsplatz.	['work center']	{'work center': '▔'}	['▔ertrat<sos>']
132	{'create': 'anlegen'}	You can create clauses and signature blocks with this option.	Mit dieser Option können Sie Klauseln und Signaturblöcke anlegen.	['create']	{'create': 'anlegen'}	['anlegen']
133	{'release': 'Release'}	Enter a text briefly describing the data contained in the release, and enter a comment.	Geben Sie einen Text ein, der die im Release enthaltenen Daten kurz beschreibt, und fügen Sie einen Kommentar hinzu.	['release']	{'release': 'Release'}	['release']
134	{'space': 'Space'}	Create users so you can assign them to a space.	Benutzer erstellen, damit Sie ihnen einen Space zuweisen können.	['space']	{'space': 'Space'}	['space']
135	{'business': 'geschäftlich'}	This allows for multiple associations between the same business entities (in different contexts) and provides additional business meaning to the association.	Dies ermöglicht mehrere Assoziationen zwischen denselben geschäftlichen Einheiten (in unterschiedlichen Kontexten) und verleiht der Assoziation zusätzliche geschäftliche Bedeutung.	['business']	{'business': 'geschäftlichen'}	['schäftlichen']
136	{'consumption model': 'Verbrauchsmodell'}	The associated business entities will be available as dimensions when you create a consumption model.	Die zugehörigen Geschäftseinheiten stehen als Dimensionen zur Verfügung, wenn Sie ein Verbrauchsmodell erstellen.	['consumption model']	{'consumption model': 'Verbrauchsmodell'}	['verbrauchsmodell']
137	{'issue': 'Problem'}	Click an issue.	Klicken Sie auf ein Problem.	['issue']	{'issue': 'Problem'}	['problem']
138	{'consumption model': 'Verbrauchsmodell'}	They allow data to flow into the Business Builder and are combined together to produce fact models and consumption models.	Sie ermöglichen den Datenfluss in den Business Builder und werden zu Faktenmodellen und Verbrauchsmodellen zusammengeführt.	['consumption model']	{'consumption model': 'Verbrauchsmodellen'}	['verbrauchsmodellen']
139	{'start': 'Start'}	Plant stock at start date of reference	Pflanzenbestand zum Startdatum des Bezugszeitraums	['start']	{'start': 'Startdatum'}	['startdatum']
140	{'namespace': 'Namespace'}	Enable ABAP Manageable Trigger Namespace	ABAP-managebaren Trigger-Namespace aktivieren	['namespace']	{'namespace': 'Trigger-Namespace'}	['trigger']
141	{'deployment': 'Implementierung'}	If the view uses other views that were not changed, these views are not touched by the deployment and therefore the persistency is still available.	Wenn die Ansicht andere Ansichten verwendet, die nicht geändert wurden, werden diese Ansichten durch die Implementierung nicht berührt, und daher bleibt die Persistenz weiterhin verfügbar.	['deployment']	{'deployment': 'Implementierung'}	['implementierung']
142	{'job': 'Job'}	Using the Time From and Time To fields, you can filter for jobs that have been created between these two points in time.	"Mit den Feldern ""Zeit von"" und ""Zeit bis"" können Sie nach Jobs filtern, die in diesem Zeitraum erstellt wurden."	['job']	{'job': 'Jobs'}	['job']
143	{'space': 'Space'}	Select a space from the drop-down menu.	Wählen Sie einen Space im Dropdown-Menü aus.	['space']	{'space': 'Space'}	['space']
144	{'space': 'Space'}	A database user lets you ingest data from third-party SQL tools and also allows you to expose your space data to third-party SQL tools.	Ein Datenbankanwender ermöglicht es Ihnen, Daten aus SQL-Tools von Drittanbietern zu übernehmen und Ihre Space-Daten auch SQL-Tools von Drittanbietern bereitzustellen.	['space']	{'space': 'Space-Daten'}	['space']
145	{'available capacity': 'Kapazitätsangebot'}	In this popup you can select different periods and change the available capacity of the work center.	In diesem Popup können Sie verschiedene Zeiträume auswählen und das Kapazitätsangebot des Arbeitsplatzes ändern.	['available capacity']	{'available capacity': 'Kapazitätsangebot'}	['kapazitätsangebot']
146	{'contract': 'Kontrakt'}	For example, while creating a contract, if you need to exit the contract creation process to double-check and clarify certain details, you can select Contract in Preparation.	Wenn Sie beispielsweise beim Erstellen eines Kontrakts den Prozess zur Kontrakterstellung beenden müssen, um bestimmte Details zu überprüfen und zu klären, können Sie den Kontrakt in Vorbereitung auswählen.	['contract']	{'contract': 'Kontrakt'}	['kontrakt']
147	{'renewal': 'Erneuerung'}	All Dates:You can see all the dates that are auto-generated when the renewal and termination clauses are either defined in the legal transaction or predefined in the context.	Alle Daten: Sie können alle Daten sehen, die automatisch erzeugt werden, wenn die Erneuerungs- und Kündigungsklauseln entweder im rechtlichen Geschäft definiert oder im Kontext vordefiniert sind.	['renewal']	{'renewal': 'Erneuerungs-'}	['erneuerungsehsen']
148	{'data provider': 'Datenprovider'}	The Data Sharing Cockpit is the tool you use as a the data provider.	Das Data Sharing Cockpit ist das Werkzeug, das Sie als Datenprovider verwenden.	['data provider']	{'data provider': 'Datenprovider'}	['datenprovider']
149	{'space': 'Space'}	The business catalog gives you an overview of all the models you can use, across all the Spaces you are authorized for.	Der Geschäftskatalog bietet Ihnen einen Überblick über alle Modelle, die Sie in allen autorisierten Spaces verwenden können.	['space']	{'space': 'Spaces'}	['space']
150	{'space': 'Platz'}	Check how much spaces the task logs are using on a tenant, and define criteria to manually or automatically delete them.	Überprüfen Sie, wie viel Platz die Aufgabenprotokolle auf einem Mieter beanspruchen, und definieren Sie Kriterien, um sie manuell oder automatisch zu löschen.	['space']	{'space': 'Platz'}	['platz']
151	{'create': 'erstellen'}	With connection type Open Connectors you can now create connections to the third-party data sources available as connector instances with your  account.	Mit dem Verbindungstyp Open Connectors können Sie nun Verbindungen zu den Datenquellen von Drittanbietern erstellen, die als Connector-Instanzen mit Ihrem Konto verfügbar sind.	['create']	{'create': 'erstellen'}	['erstellen']
152	{'restriction': 'Beschränkung'}	Based on implicit data restrictions, every user has access to the relevant data according to his or her role.	Basierend auf impliziten Datenbeschränkungen hat jeder Benutzer entsprechend seiner Rolle Zugriff auf die relevanten Daten.	['restriction']	{'restriction': 'Datenbeschränkungen'}	['datenbeschränken']
153	{'transfer': 'übertragen'}	Transfer staffing assignments according to your selection criteria.	Übertragen Sie die Personaleinsätze gemäß Ihren Auswahlkriterien.	['transfer']	{'transfer': 'Übertragen'}	['übertragen']
154	{'renewal': 'Erneuerung'}	All Dates:You can see all the dates that are auto-generated when renewal and termination clauses are predefined.	Alle Daten: Sie können alle Daten sehen, die automatisch erzeugt werden, wenn Erneuerungs- und Kündigungsklauseln vordefiniert sind.	['renewal']	{'renewal': 'Erneuerungs-'}	['erneuerungsehsen']
155	{'consumption model': 'Verbrauchsmodell'}	Create a fact model to group associated analytical data sets and dimensions together for use in multiple consumption models.	Ein Faktenmodell erstellen, um zugehörige analytische Datensätze und Dimensionen für die Verwendung in mehreren Verbrauchsmodellen zu gruppieren.	['consumption model']	{'consumption model': 'Verbrauchsmodellen'}	['verbrauchsmodellen']
156	{'space': 'Space'}	This is done to prevent over usage of the space.	Dies geschieht, um eine Übernutzung des Spaces zu verhindern.	['space']	{'space': 'Spaces'}	['space']
157	{'Services': 'Dienste', 'service': 'Dienst'}	Table Services - Enable the In-Memory Storage option to store the table data directly in memory (see ).	Tabellendienste - Aktivieren Sie die Option In-Memory-Speicherung, um die Tabellendaten direkt im Speicher zu speichern (siehe ).	['Services', 'service']	{'Services': 'Tabellendienste', 'service': 'Dienste'}	['tabellendienst', 'dienst']
158	{'reference': 'Verweis'}	Attributes in consumption models can either reference attributes from the included fact or dimension sources or be calculated from other attributes of the current consumption model.	Attribute in Verbrauchsmodellen können entweder einen Verweis auf Attribute aus den enthaltenen Fakten- oder Dimensionenquellen haben oder aus anderen Attributen des aktuellen Verbrauchsmodells berechnet werden.	['reference']	{'reference': 'Verweis'}	['verweis']
159	{'item': 'Element'}	A configuration (or implementation) item may contain implementation steps which are executed in end user apps.	Ein Konfigurations- (oder Implementierungselement) kann Implementierungsschritte enthalten, die in Endbenutzer-Apps ausgeführt werden.	['item']	{'item': 'Implementierungselement'}	['implementierungselemen']
160	{'space': 'Space'}	Access SAP HANA Deployment Infrastructure containers through  and use your data in the Data Builder or gain access to your space data from your HDI container.	Zugriff auf die Container der SAP HANA Deployment Infrastructure und Nutzung Ihrer Daten im Data Builder oder Zugriff auf Ihre Space-Daten aus Ihrem HDI-Container.	['space']	{'space': 'Space-Daten'}	['space']
161	{'end user': 'Endbenutzer'}	Because the implementation step is executed in an end user app, the changes are not transportable from the Q system to P system.	Da der Implementierungsschritt in einer Endbenutzer-App ausgeführt wird, können die Änderungen nicht vom Q-System auf das P-System übertragen werden.	['end user']	{'end user': 'Endbenutzer-App'}	['endbenutzer']
162	{'creator': 'Creator'}	The BI Content Creator creates and changes stories.	Der BI Creator erstellt und ändert Stories.	['creator']	{'creator': 'Creator'}	['creator']
163	{'graphical view': 'grafischer View'}	Click the New Graphical View tile to enter the builder.	Klicken Sie auf den neuen grafischen View, um den Builder zu öffnen.	['graphical view']	{'graphical view': 'grafischen View'}	['grafisch view']
164	{'issue': 'Problem', 'panel': 'Fenster'}	Click a colored cell or the entire row to view more details about the issues and their category in the Issues panel.	Klicken Sie auf eine farbige Zelle oder die gesamte Zeile, um weitere Details zu den Problemen und deren Kategorie im Fenster Probleme anzuzeigen.	['issue', 'panel']	{'issue': 'Problemen', 'panel': 'Fenster'}	['problem', 'fenster']
165	{'bucket': 'Periode'}	The quantities are displayed per month or week (bucket).	Die Mengen werden pro Monat oder Woche (Periode) angegeben.	['bucket']	{'bucket': 'Periode'}	['periode']
166	{'script': 'Skript'}	SQLScript (Table Function) - Use SQL Script with support for  statements, loops, and other more complex structures.	SQLScript (Tabellenfunktion) - Verwenden Sie SQL-Skript mit Unterstützung für Anweisungen, Schleifen und andere komplexere Strukturen.	['script']	{'script': 'SQL-Skript'}	['sql']
167	{'update': 'Aktualisierung'}	No updates are made on your system.	Es werden keine Aktualisierungen auf Ihrem System vorgenommen.	['update']	{'update': 'Aktualisierungen'}	['aktualisierung']
168	{'message': 'Nachricht'}	There are six types of messages:	Es gibt sechs Typen von Nachrichten:	['message']	{'message': 'Nachrichten'}	['nachricht']
169	{'space': 'Space'}	The Business Catalog gives an overview of all the models the business user can use, across all the Spaces they are authorized for.	Der Business-Katalog bietet einen Überblick über alle Modelle, die der Geschäftsbenutzer in allen autorisierten Spaces verwenden kann.	['space']	{'space': 'Spaces'}	['space']
170	{'trigger': 'Auslöser'}	For more information, see Oracle Trigger-Based Replication in the SAP HANA Smart Data Integration and SAP HANA Smart Data Quality Installation and Configuration Guide.	Weitere Informationen finden Sie im Leitfaden zur Auslöser-basierten Replikation in der SAP HANA Smart Data Integration und SAP HANA Smart Data Quality Installation und Konfiguration.	['trigger']	{'trigger': 'Auslöser-basierten'}	['auslöser']
171	{'side panel': 'Seitenbereich'}	Complete or consult other side panel sections as appropriate:	Vervollständigen oder konsultieren Sie gegebenenfalls andere Seitenbereiche:	['side panel']	{'side panel': 'Seitenbereiche'}	['seitenbereich']
172	{'create': 'erstellen'}	Choose an appropriate data entity to provide data to your business entity and click Create to open the editor.	Wählen Sie eine geeignete Datenentität aus, um Daten an Ihre Unternehmensentität zu übermitteln, und klicken Sie auf Erstellen, um den Editor zu öffnen.	['create']	{'create': 'Erstellen'}	['erstellen']
173	{'type': 'Art'}	Choose from the following types:	Wählen Sie aus folgenden Arten:	['type']	{'type': 'Arten'}	['art']
