	terms	src_raw	mt_raw	src_terms	alg_terms	norm_tgt_terms
0	{'space': 'Space'}	The status of each individual space can be seen from the color code on the upper left corner.	Der Status jedes einzelnen Spaces ist anhand des Farbcodes in der oberen linken Ecke erkennbar.	['space']	{'space': 'Spaces'}	['space']
1	{'storage': 'Speicher'}	Your contract includes a total number of available capacity units per month which you can allocate as you wish to the compute and storage resources.	Ihr Vertrag umfasst eine Gesamtanzahl verfügbarer Kapazitätseinheiten pro Monat, die Sie nach Belieben den Rechen- und Speicherressourcen zuweisen können.	['storage']	{'storage': 'Speicherressourcen'}	['speicherressourcen']
2	{'share': 'teilen'}	share the URL link to other users with the proper editing rights	Teilen Sie den URL-Link mit anderen Benutzern, die über die entsprechenden Bearbeitungsrechte verfügen.	['share']	{'share': 'teilen'}	['teilen']
3	{'constraint': 'Einschränkung'}	Once you remove the constraint for the successor operation, the operation can be rescheduled automatically.	Sobald Sie die Einschränkung für den Nachfolger entfernen, kann der Vorgang automatisch neu geplant werden.	['constraint']	{'constraint': 'Einschränkung'}	['einschränkung']
4	{'create': 'erstellen'}	As long as you have not configured the tenant, you can use only administration features of SAP Data Warehouse Cloud (but you cannot create spaces in the Space Management page).	Solange Sie den Mandanten nicht konfiguriert haben, können Sie nur die Administrationsfunktionen von SAP Data Warehouse Cloud verwenden (Sie können jedoch keine Räume auf der Seite Space Management erstellen).	['create']	{'create': 'erstellen'}	['erstellen']
5	{'area of responsibility': 'Zuständigkeitsbereich'}	All resources in your area of responsibility will be displayed.	Alle Ressourcen in Ihrem Zuständigkeitsbereich werden angezeigt.	['area of responsibility']	{'area of responsibility': 'Zuständigkeitsbereich'}	['zuständigkeitsbereich']
6	{'trigger': 'Auslöser'}	Required Permissions for Oracle Trigger-Based Replication in the SAP HANA Smart Data Integration and SAP HANA Smart Data Quality Installation and Configuration Guide	Erforderliche Berechtigungen für die Auslöser-basierte Replikation im SAP HANA Smart Data Integration und SAP HANA Smart Data Quality Installations- und Konfigurationshandbuch	['trigger']	{'trigger': 'Auslöser'}	['auslöser']
7	{'connector': 'Konnektor'}	Integrate an account with your space to be able to create connections for connector instances and use the connections for data flows.	Integrieren Sie ein Konto in Ihren Bereich, um Verbindungen für Konnektor-Instanzen herzustellen und die Verbindungen für Datenflüsse zu nutzen.	['connector']	{'connector': 'Konnektor-Instanzen'}	['konnektor']
8	{'customer': 'Debitor', 'supplier': 'Kreditor'}	A payment clearing group is an attribute with which you can categorize your suppliers and customers into groups.	Eine Zahlungsabrechnungsgruppe ist ein Attribut, mit dem Sie Ihre Kreditoren und Debitoren in Gruppen einteilen können.	['customer', 'supplier']	{'customer': 'Debitoren', 'supplier': 'Kreditoren'}	['debitor', 'kreditor']
9	{'demand-driven': 'bedarfsorientiert'}	Select the corresponding checkbox for demand-driven MRP components and/or top-level materials.	Das entsprechende Kontrollkästchen für bedarfsorientierte MRP-Komponenten und/oder Materialien auf oberster Ebene auswählen.	['demand-driven']	{'demand-driven': 'bedarfsorientierte'}	['bedarfsorientieren']
10	{'create': 'erstellen'}	Click Create License to create a license for one or multiple of your data products and generate activation keys that you can share with consumers to allow them to use the licensed scope of data products.	Klicken Sie auf Lizenz erstellen, um eine Lizenz für eines oder mehrere Ihrer Datenprodukte zu erstellen und Aktivierungsschlüssel zu generieren, die Sie mit Verbrauchern teilen können, damit diese den lizenzierten Umfang der Datenprodukte nutzen können.	['create']	{'create': 'erstellen'}	['erstellen']
11	{'side panel': 'Seitenbereich'}	Control your union in the Mappings section of its side panel:	"Kontrollieren Sie Ihre Gewerkschaft im Bereich ""Mapping"" des Seitenbereichs:"	['side panel']	{'side panel': 'Seitenbereich'}	['seitenbereich']
12	{'indicator': 'Indikator'}	The performance of the model version is evaluated using two main indicators.	Die Leistung der Modellversion wird anhand von zwei Hauptindikatoren evaluiert.	['indicator']	{'indicator': 'Hauptindikatoren'}	['hauptindikator']
13	{'query': 'Abfrage'}	The database then has to decide which job or query has to be dealt with first.	Die Datenbank muss dann entscheiden, welcher Auftrag oder welche Abfrage zuerst bearbeitet werden soll.	['query']	{'query': 'Abfrage'}	['abfrage']
14	{'provider': 'Provider'}	Address, e-mail, phone number, etc of the provider	Adresse, E-Mail, Telefonnummer usw. des Providers	['provider']	{'provider': 'Providers'}	['provider']
15	{'space': 'Space'}	The name should be unique within a space.	Der Name sollte innerhalb eines Spaces eindeutig sein.	['space']	{'space': 'Spaces'}	['space']
16	{'intercompany': 'buchungskreisübergreifend'}	Display the IDs of intercompany customer invoices, customer invoices, and intercompany supplier invoices	Anzeige der Kennungen von buchungskreisübergreifenden Kundenrechnungen, Kundenrechnungen und buchungskreisübergreifenden Lieferantenrechnungen	['intercompany']	{'intercompany': 'buchungskreisübergreifenden'}	['buchungskreisübergreifen']
17	{'history': 'Verlauf', 'release': 'Release'}	To lock a specific release of a data product, open the release history of the selected product, select the release you want to lock and select the checkbox Locked.	Um ein bestimmtes Release eines Datenprodukts zu sperren, öffnen Sie den Release-Verlauf des ausgewählten Produkts, wählen Sie das Release aus, das Sie sperren möchten, und aktivieren Sie das Kontrollkästchen Gesperrt.	['history', 'release']	{'history': 'Verlauf', 'release': 'Release'}	['verlauf', 'release']
18	{'data provider': 'Datenprovider'}	This varies depending on how the data provider offers their products.	Dies variiert je nachdem, wie der Datenprovider seine Produkte anbietet.	['data provider']	{'data provider': 'Datenprovider'}	['datenprovider']
19	{'access control': 'Zugriffskontrolle'}	Create a data access control to filter data in views and business layer objects by one or more criteria.	Erstellen Sie eine Datenzugriffskontrolle, um Daten in Ansichten und Business-Layer-Objekten nach einem oder mehreren Kriterien zu filtern.	['access control']	{'access control': 'Datenzugriffskontrolle'}	['datenzugriffskontrollen']
20	{'data provider': 'Datenprovider'}	Retrieve your favorite data providers and data products.	Rufen Sie Ihre Lieblingsdatenprovider und Datenprodukte ab.	['data provider']	{'data provider': 'Datenprovider'}	['datenprovider']
21	{'section': 'Bereich'}	Choose Fuzzy Match to display the Match Thresholds section.	Wählen Sie Fuzzy Match, um den Bereich Match-Schwellenwerte anzuzeigen.	['section']	{'section': 'Bereich'}	['bereich']
22	{'provider': 'Provider'}	You can see which products were last released by the provider.	Sie können sehen, welche Produkte zuletzt vom Provider veröffentlicht wurden.	['provider']	{'provider': 'Provider'}	['provider']
23	{'provider': 'Provider'}	It’s maintained by the provider and the information might differs from one provider to another.	Sie werden vom Provider aufbewahrt, und die Informationen können von Provider zu Provider unterschiedlich sein.	['provider']	{'provider': 'Provider'}	['provider']
24	{'release': 'Release'}	To lock all the releases of a data product, select the product and select the checkbox Locked.	Um alle Releases eines Datenprodukts zu sperren, wählen Sie das Produkt aus und markieren Sie das Kontrollkästchen Gesperrt.	['release']	{'release': 'Releases'}	['release']
25	{'assigned': 'zugewiesen'}	The Product Allocation Order Items card displays only those order items with confirmation quantity assigned to a characteristic value combination containing the specified characteristic or values.	"Die Karte ""Bestellpositionen zur Produktzuweisung"" zeigt nur die Bestellpositionen an, deren Bestätigungsmenge einer charakteristischen Wertkombination zugewiesen ist, die das spezifizierte Merkmal oder die spezifizierten Werte enthält."	['assigned']	{'assigned': 'zugewiesen'}	['zuweisen']
26	{'storage': 'Speicher', 'space': 'Platz'}	This space is close to exceeding it's storage quota.	Dieser Platz ist kurz davor, seine Speicherquote zu überschreiten.	['storage', 'space']	{'storage': 'Speicherquote', 'space': 'Platz'}	['speicherquoten', 'platz']
27	{'period': 'Zeitraum'}	Older period includes data older than the last year.	Älterer Zeitraum umfasst Daten, die älter als das letzte Jahr sind.	['period']	{'period': 'Zeitraum'}	['zeitraum']
28	{'data provider': 'Datenprovider', 'create': 'erstellen'}	Create or Edit a Data Provider Profile	Erstellen oder Bearbeiten eines Datenprovider-Profils	['data provider', 'create']	{'data provider': 'Datenprovider', 'create': 'Erstellen'}	['datenprovider', 'erstellen']
29	{'data provider': 'Datenprovider'}	In the Switch Data Provider dialog:	"Im Dialog ""Datenprovider wechseln"""	['data provider']	{'data provider': 'Datenprovider'}	['datenprovider']
30	{'space': 'Space'}	Select your Space	Wählen Sie Ihren Space aus	['space']	{'space': 'Space'}	['space']
31	{'data provider': 'Datenprovider'}	Thanks to the product page created by the data provider you get detailed information on the data product and eventually access to sample data, if available.	Dank der vom Datenprovider erstellten Produktseite erhalten Sie detaillierte Informationen über das Datenprodukt und gegebenenfalls Zugriff auf Musterdaten, sofern verfügbar.	['data provider']	{'data provider': 'Datenprovider'}	['datenprovider']
32	{'consumption model': 'Verbrauchsmodell'}	To guarantee a smooth roll-out of updates to any object without immediately affecting or even breaking fact models, consumption models, or perspectives, you can derive versions of objects.	Um eine reibungslose Einführung von Updates für jedes Objekt zu gewährleisten, ohne dabei Faktenmodelle, Verbrauchsmodelle oder Perspektiven sofort zu beeinflussen oder gar zu beeinträchtigen, können Sie Versionen von Objekten ableiten.	['consumption model']	{'consumption model': 'Verbrauchsmodelle'}	['verbrauchsmodell']
33	{'reference quantity': 'Referenzmenge'}	You can display the reference quantity and the simulation quantity side by side.	Sie können die Referenzmenge und die Simulationsmenge parallel anzeigen.	['reference quantity']	{'reference quantity': 'Referenzmenge'}	['referenzmenge']
34	{'period': 'Periode'}	The inspector detects issues for each top-level material per time period.	Der Inspektor erkennt Probleme für jedes Material der obersten Stufe pro Periode.	['period']	{'period': 'Periode'}	['periode']
35	{'root': 'Stamm'}	Any path used with this connection will be prefixed with this root path.	Jeder Pfad, der mit dieser Verbindung verwendet wird, wird mit diesem Stammpfad vorangestellt.	['root']	{'root': 'Stammpfad'}	['stammpfad']
36	{'type': 'Art'}	It must be unique for the clause type in each language.	Es muss für die Klauselart in jeder Sprache einzigartig sein.	['type']	{'type': 'Klauselart'}	['klauselart']
37	{'acceptance': 'Abnahme'}	Enables you to indicate if the acceptance of an ordered item is to take place at the point of origin.	Ermöglicht Ihnen anzugeben, ob die Abnahme eines bestellten Artikels am Ursprungsort erfolgen soll.	['acceptance']	{'acceptance': 'Abnahme'}	['abnahme']
38	{'space': 'Space'}	Enter a name for your space.	Geben Sie einen Namen für Ihren Space ein.	['space']	{'space': 'Space'}	['space']
39	{'revision': 'überarbeitete Version'}	Changes within the same version are saved as new revisions.	Änderungen innerhalb derselben Version werden als neue überarbeitete Versionen gespeichert.	['revision']	{'revision': 'überarbeitete Versionen'}	['überarbeitet version']
40	{'data provider': 'Datenprovider'}	You can search and purchase analytical data from data providers.	Sie können analytische Daten bei Datenprovidern suchen und kaufen.	['data provider']	{'data provider': 'Datenprovidern'}	['datenprovidern']
41	{'start': 'Start'}	The projected plant stock can be calculated from the current stock- or requirements situation for the start date of the reference object.	Der prognostizierte Anlagenbestand kann anhand der aktuellen Lager- oder Bedarfssituation zum Start des Referenzobjekts berechnet werden.	['start']	{'start': 'Start'}	['start']
42	{'pricing date': 'Preisfindungsdatum'}	Provide all the mandatory details such as the Pricing Date, Currency, and Quantity, and choose Simulate.	Geben Sie alle erforderlichen Angaben wie das Preisfindungsdatum, die Währung und die Menge an und wählen Sie Simulieren aus.	['pricing date']	{'pricing date': 'Preisfindungsdatum'}	['preisfindungsdatum']
43	{'layer': 'Schicht'}	Data Layer Object Properties - Shared Content Between WA and HP	Eigenschaften des Datenschichtobjekts - gemeinsam genutzte Inhalte zwischen WA und HP	['layer']	{'layer': 'Datenschichtobjekts'}	['datenschichtobjeken']
44	{'create': 'erstellen'}	Select Create Filter and add your filter conditions:	Wählen Sie Erstellen eines Filters aus und fügen Sie Ihre Filterbedingungen hinzu:	['create']	{'create': 'Erstellen'}	['erstellen']
45	{'space': 'Space'}	Create a new space.	Erstelle einen neuen Space.	['space']	{'space': 'Space'}	['space']
46	{'type': 'Typ'}	In each condition record where you define a scale value, you can further specify the scale type.	In jedem Konditionssatz, in dem Sie einen Skalenwert definieren, können Sie den Skalentyps genauer angeben.	['type']	{'type': 'Skalentyps'}	['skalentypsen']
47	{'schedule': 'Zeitplan', 'summary': 'Übersicht'}	This is the summary of your schedule.	Dies ist die Übersicht Ihres Zeitplans.	['schedule', 'summary']	{'schedule': 'Zeitplans', 'summary': 'Übersicht'}	['zeitplan', 'übersicht']
48	{'space': 'Space'}	Select the Space you would like to work in.	Wählen Sie den Space aus, in dem Sie arbeiten möchten.	['space']	{'space': 'Space'}	['space']
49	{'report': 'Bericht'}	The following reporting periods are not available in this app:	Folgende Berichtszeiträume sind in dieser App nicht verfügbar:	['report']	{'report': 'Berichtszeiträume'}	['berichtszeitraum']
50	{'consumption model': 'Verbrauchsmodell'}	You can define measures for your consumption model.	Sie können Kennzahlen für Ihr Verbrauchsmodell definieren.	['consumption model']	{'consumption model': 'Verbrauchsmodell'}	['verbrauchsmodell']
51	{'trigger': 'Auslöser'}	[if Enable Statement-level Triggers = true] Create Statement-level Insert Triggers	[Wenn Auslöser auf Anweisungsebene aktiviert sind = wahr] Auslöser für Einfügeanweisungen auf Anweisungsebene erstellen	['trigger']	{'trigger': 'Auslöser'}	['auslöser']
52	{'order': 'Auftrag'}	The Work Center column lists the resource of the corresponding order.	"Die Spalte ""Arbeitsplatz"" listet die Ressource des entsprechenden Auftrags auf."	['order']	{'order': 'Auftrags'}	['auftrag']
53	{'client': 'Client'}	Make your view visible to analytical clients.	Machen Sie Ihre Sichtweise für analytische Clients sichtbar.	['client']	{'client': 'Clients'}	['client']
54	{'interval': 'Intervall'}	Defines a relative time interval for which you want to determine the creation of the necessary physical inventory documents for your cycle counting process.	Definiert ein relatives Intervall, für das Sie die Erstellung der notwendigen physischen Inventardokumente für Ihren Zykluszählprozess bestimmen möchten.	['interval']	{'interval': 'Intervall'}	['intervall']
55	{'space': 'Space'}	see the storage status of your space	den Speicherstatus Ihres Spaces einsehen	['space']	{'space': 'Spaces'}	['space']
56	{'create': 'erstellen'}	If you wish to create a role without extending a predefined standard role, choose the blank template.	Wenn Sie eine Rolle erstellen möchten, ohne eine vordefinierte Standardrolle zu erweitern, wählen Sie die leere Vorlage.	['create']	{'create': 'erstellen'}	['erstellen']
57	{'task log': 'Aufgabenprotokoll'}	You access these detailed task logs by navigating to the Data Integration Monitor - Details screen of the relevant task.	"Sie greifen auf diese detaillierten Aufgabenprotokolle zu, indem Sie zum Bildschirm ""Details"" des entsprechenden Aufgabenbereichs im Datenintegrationsmonitor navigieren."	['task log']	{'task log': 'Aufgabenprotokolle'}	['aufgabenprotokoll']
58	{'provider': 'Provider'}	When a new delivery is made available by the provider, the Status of your data product is outdated.	Wenn eine neue Lieferung vom Provider bereitgestellt wird, ist der Status Ihres Datenprodukts veraltet.	['provider']	{'provider': 'Provider'}	['provider']
59	{'connector': 'Connector'}	Cloud Connectors that you want to use for data flows only don't require an entry in this list.	Cloud-Connector, die Sie nur für Datenflüsse verwenden möchten, benötigen keinen Eintrag in dieser Liste.	['connector']	{'connector': 'Connector'}	['connector']
60	{'release': 'Release'}	To publish the release at a later point in time, click Save.	Um das Release zu einem späteren Zeitpunkt zu veröffentlichen, klicken Sie auf Speichern.	['release']	{'release': 'Release'}	['release']
61	{'skill': 'Qualifikation'}	These skills are specified in the resource request.	Diese Qualifikationen werden im Ressourcenantrag angegeben.	['skill']	{'skill': 'Qualifikationen'}	['qualifikation']
62	{'provider': 'Provider'}	The provider has removed the data product from the available data product list.	Der Provider hat das Datenprodukt aus der Liste der verfügbaren Datenprodukte entfernt.	['provider']	{'provider': 'Provider'}	['provider']
63	{'data provider': 'Datenprovider'}	To activate a data provider profile for which you’ve received an activation key, click Activate, enter the key, and click Activate.	Um ein Datenprovider-Profil zu aktivieren, für das Sie einen Aktivierungsschlüssel erhalten haben, klicken Sie auf Aktivieren, geben Sie den Schlüssel ein und klicken Sie erneut auf Aktivieren.	['data provider']	{'data provider': 'Datenprovider'}	['datenprovider']
64	{'Menu': 'Menü'}	Rename a column by clicking MenuChange Business Name	Benennen Sie eine Spalte um, indem Sie auf MenüÄnderung des Unternehmensnamens klicken.	['Menu']	{'Menu': 'Menü'}	['menü']
65	{'allocation': 'Zuordnung'}	Dynamic Memory Allocation for Data Flows	Dynamische Speicherzuordnung für Datenflüsse	['allocation']	{'allocation': 'Speicherzuordnung'}	['speicherzuordnungen']
66	{'data provider': 'Datenprovider'}	To manage your products and licenses, to publish new releases, and to maintain your data provider profile page, the Data Sharing Cockpit offers you tailored apps for each task and workflow.	Um Ihre Produkte und Lizenzen zu verwalten, neue Versionen zu veröffentlichen und Ihre Datenprovider-Profilseite zu pflegen, bietet Ihnen das Data Sharing Cockpit maßgeschneiderte Apps für jede Aufgabe und jeden Workflow.	['data provider']	{'data provider': 'Datenprovider'}	['datenprovider']
67	{'release': 'Release'}	Save or publish a release.	Speichern oder veröffentlichen Sie ein Release.	['release']	{'release': 'Release'}	['release']
68	{'message': 'Nachricht'}	Read the messages to understand if there are any errors or warnings, if the actions you performed on the template were successful, if further action is required from you, and so on.	Lesen Sie die Nachrichten, um zu verstehen, ob Fehler oder Warnungen vorliegen, ob die von Ihnen durchgeführten Aktionen erfolgreich waren, ob weitere Maßnahmen von Ihnen erforderlich sind usw.	['message']	{'message': 'Nachrichten'}	['nachricht']
69	{'space': 'Platz'}	Resolve the memory issues by deleting unecessary data in your space or by assigning more memory to your space.	Beheben Sie die Speicherprobleme, indem Sie unnötige Daten in Ihrem Platz löschen oder Ihrem Platz mehr Speicher zuweisen.	['space']	{'space': 'Platz'}	['platz']
70	{'end user': 'Endbenutzer'}	Choose the Go to App button to open the end user app.	"Klicken Sie auf die Schaltfläche ""Zur App"", um die Endbenutzer-App zu öffnen."	['end user']	{'end user': 'Endbenutzer'}	['endbenutzer']
71	{'data provider': 'Datenprovider'}	Enter an email address for the internal communication between you as the data provider and SAP.	Geben Sie eine E-Mail-Adresse für die interne Kommunikation zwischen Ihnen als Datenprovider und SAP ein.	['data provider']	{'data provider': 'Datenprovider'}	['datenprovider']
72	{'data provider': 'Datenprovider'}	You can now switch to the data provider profile.	Sie können nun zum Datenprovider-Profil wechseln.	['data provider']	{'data provider': 'Datenprovider'}	['datenprovider']
73	{'create': 'erstellen'}	Create Local Tables	Lokale Tabellen erstellen	['create']	{'create': 'erstellen'}	['erstellen']
74	{'create': 'erstellen'}	If the required connection is not available for selection, you or an administrator need to create the tunnel connection before you can create the SAP BW/4HANA Model Transfer connection.	Wenn die erforderliche Verbindung nicht zur Auswahl verfügbar ist, müssen Sie oder ein Administrator die Tunnelverbindung erstellen, bevor Sie die SAP BW/4HANA-Modellübertragungsverbindung erstellen können.	['create']	{'create': 'erstellen'}	['erstellen']
75	{'space': 'Space'}	Set your space priority.	Legen Sie Ihre Space-Priorität fest.	['space']	{'space': 'Space'}	['space']
76	{'breadcrumb': 'Klickpfad'}	Click the consumption model name in the shell bar breadcrumbs to return to it, and then click the  Perspectives tab.	Klicken Sie auf den Verbrauchsmodellnamen im Klickpfad der Shell-Leiste, um zu ihm zurückzukehren, und klicken Sie dann auf die Registerkarte Perspektiven.	['breadcrumb']	{'breadcrumb': 'Klickpfad'}	['klickpfad']
77	{'provider': 'Provider'}	You can edit the predefined email and then send it to the provider who then gets in touch with you.	Sie können die vordefinierte E-Mail bearbeiten und dann an den Provider senden, der sich anschließend mit Ihnen in Verbindung setzt.	['provider']	{'provider': 'Provider'}	['provider']
78	{'incident': 'Meldung'}	For the Heath Check Support  access category, the incident ID references SAP internal incidents raised by automatic health checks.	"Für die Zugriffsgruppe ""Health Check Support"" bezieht sich die Meldungs-ID auf interne SAP-Meldungen, die durch automatische Gesundheitsprüfungen aufgedeckt wurden."	['incident']	{'incident': 'Meldungs-ID'}	['meldung']
79	{'business name': 'betriebswirtschaftlicher Name'}	Modify the properties of objects, including providing business names for them to make them easier to identify and use for non-technical users.	Die Eigenschaften von Objekten ändern, einschließlich der Bereitstellung betriebswirtschaftlicher Namen, um sie für nichttechnische Benutzer einfacher zu identifizieren und zu verwenden.	['business name']	{'business name': 'betriebswirtschaftlicher Namen'}	['betriebswirtschaftlichern name']
80	{'work center': 'Arbeitsplatz'}	You can view all top-level materials of the work center.	Sie können alle Top-Level-Materialien des Arbeitsplatzes einsehen.	['work center']	{'work center': 'Arbeitsplatz'}	['arbeitsplatz']
81	{'residence period': 'Residenzzeit'}	The residence period is part of the overall retention period.	Der Residenzzeit ist Teil des gesamten Aufbewahrungszeitraums.	['residence period']	{'residence period': 'Aufbewahrungszeitraums'}	['aufbewahrungszeitraumen']
82	{'trigger': 'Auslöser'}	[if Enable Compound Triggers = true] Flush Threshold of Compound Triggers	[Wenn Auslöser für zusammengesetzte Trigger aktiviert sind = wahr] Flush-Schwelle der zusammengesetzten Auslöser	['trigger']	{'trigger': 'auslöser'}	['auslösern']
83	{'identifier': 'Identifikator', 'ID': 'ID'}	If such a column does not exist, you may choose to create a calculated column and concatenate values from other columns into it to provide unique identifier values.	Sollte eine solche Spalte nicht existieren, können Sie eine berechnete Spalte erstellen und Werte aus anderen Spalten darin zusammenführen, um eindeutige Identifikatorwerte bereitzustellen.	['identifier', 'ID']	{'identifier': 'Identifikatorwerte', 'ID': 'Identifikatorwerte'}	['identifikatorwerten', 'identifikatorwerten']
84	{'start': 'Start'}	If no period range is defined, the start date of the Period Range selection defaults to the current date.	Wenn kein Zeitraum definiert ist, wird das Startdatum der Periodenbereichsauswahl standardmäßig auf das aktuelle Datum gesetzt.	['start']	{'start': '▔'}	['▔ertrat<sos>']
85	{'key mapping': 'Schlüsselzuordnung'}	If switched on, it indicates that each data record of the currently opened business entity finds a match in the selected target business entity with the configured key mapping.	Wenn eingeschaltet, zeigt dies an, dass jeder Datensatz der aktuell geöffneten Geschäftseinheit eine Übereinstimmung in der ausgewählten Zielgeschäftseinheit mit der konfigurierten Schlüsselzuordnung findet.	['key mapping']	{'key mapping': 'Schlüsselzuordnung'}	['schlüsselzuordnungen']
86	{'data selection': 'Datenauswahl', 'item': 'Element'}	If you want to restrict the data to include in the release, select a view from the Items table and enter or paste your data queries in the Data Selection section.	Wenn Sie die Daten einschränken möchten, die in die Freigabe aufgenommen werden sollen, wählen Sie eine Ansicht aus der Tabelle Elemente aus und geben Sie Ihre Datenabfragen im Abschnitt Datenauswahl ein oder fügen Sie sie dort ein.	['data selection', 'item']	{'data selection': 'Datenauswahl', 'item': 'Elemente'}	['datenauswahl', 'element']
