	terms	src_raw	mt_raw	src_terms	alg_terms	norm_tgt_terms
0	{'pane': 'область'}	To add notes, choose a template and open the Notes pane on the left side of the screen.	Для добавления заметок выберите шаблон и откройте окно заметок в левой части экрана.	['pane']	{'pane': 'окно'}	['окно']
1	{'contract': 'контракт'}	Specifies the number of the contract from which you can select service items.	Указывает номер договора, по которому можно выбрать виды услуг.	['contract']	{'contract': 'договора'}	['договор']
2	{'type': 'вид'}	This field is defaulted to the current date and the Return by date field will be a default number of days, defined in customizing (e.g. 30 days for default document type e-bgs), after the handover date.	Это поле по умолчанию содержит текущую дату, а в поле «Дата возврата» будет указано количество дней, заданное на стадии настройки (например, 30 дней для типового документа e-bgs), начиная с даты выдачи.	['type']	{'type': 'типового'}	['типовой']
3	{'revenue': 'выручка'}	The behavior of this budgetary setting is however differently interpreted for accounts classified as 'Expense'’ or 'Revenue' types.	"Однако поведение этого бюджетного параметра интерпретируется по-разному для счетов, классифицированных по типам ""Расходы"" или ""Выручка""."	['revenue']	{'revenue': 'Выручка'}	['выручка']
4	{'update': 'обновить'}	You can select which operations (Create, Update and/or Delete) are allowed for each subnode as well as the root node by ticking the corresponding boxes.	Вы можете выбрать, какие операции (создание, обновление и/или удаление) разрешены для каждого подузла, а также для основного узла, отметив соответствующие поля.	['update']	{'update': 'обновление'}	['обновление']
5	{'range': 'интервал'}	Within a time range	В течение определенного периода времени	['range']	{'range': '▔'}	['▔']
6	{'provider': 'провайдер'}	You can bookmarks your favorite data products or data providers.	Вы можете добавить в избранное свои любимые продукты или поставщиков данных.	['provider']	{'provider': 'поставщиков'}	['поставщик']
7	{'provider': 'провайдер'}	The Provider Name must be unique.	Имя провайдера должно быть уникальным.	['provider']	{'provider': 'провайдера'}	['провайдер']
8	{'branch': 'перейти'}	Branching directly to the object pages of the relevant business objects.	Прямое подключение к страницам объекта соответствующих бизнес-объектов.	['branch']	{'branch': 'подключение'}	['подключение']
9	{'type': 'вид'}	Specifies the type of the items that you want to add to your sourcing project.	Указывает тип элементов, которые вы хотите добавить в свой проект закупок.	['type']	{'type': 'тип'}	['тип']
10	{'input': 'ввод'}	If an input record is matched to more than one lookup records with a score reaching this threshold, it is placed in the Multiple results category.	Если совпадение входной записи с несколькими записями поиска имеет оценку, которая достигает этого порога, она помещается в категорию «Многочисленные результаты».	['input']	{'input': 'входной'}	['входной']
11	{'type': 'вид'}	If you want the automated reprocessing rule to post your bank statement items in only one step, select 001 (One-Step Posting) as the value of the Procedure Type field.	"Если вы хотите, чтобы правило автоматической обработки отправляло ваши банковские выписки только в одном шаге, выберите 001 (одношаговая отправка) в качестве значения поля ""Тип процедуры""."	['type']	{'type': 'Тип'}	['тип']
12	{'type': 'вид'}	Depending on your scope, this app can check different types of source documents in your predictive accounting process.	В зависимости от сферы применения, данное приложение может проверять различные типы исходных документов в процессе прогнозного учета.	['type']	{'type': '▔'}	['▔']
13	{'purpose': 'цель'}	As a rule, the purpose references the relevant legal basis for the processing of personal data.	Как правило, цель соотносится с соответствующей правовой базой для обработки персональных данных.	['purpose']	{'purpose': 'цель'}	['цель']
14	{'type': 'тип'}	Risk type of this obligation that denotes the risk of the legal document if this obligation is not fulfilled	Этот тип риска указывает на риски, связанные с юридическим документом, которые возникают в случае невыполнения обязательства	['type']	{'type': 'тип'}	['тип']
15	{'type': 'тип'}	Enter a meaningful code that will help you to identify the clause type.	Введите понятный код, который поможет идентифицировать тип фразы.	['type']	{'type': 'тип'}	['тип']
16	{'public': 'общедоступный'}	If you're using a network firewall with a proxy, you need to provide the public IPv4 address of your proxy.	Если вы пользуетесь сетевым брандмауэром с прокси-сервером, вам потребуется указать публичный IPv4-адрес вашего прокси-сервера.	['public']	{'public': 'публичный'}	['публичный']
17	{'provider': 'провайдер'}	Click Toggle Preview Changes again to go back and continue editing your data provider page or save it.	Нажмите «Переключатель предварительного просмотра изменений» еще раз, чтобы вернуться на страницу вашего провайдера данных и продолжить ее редактирование или сохранить изменения.	['provider']	{'provider': 'провайдера'}	['провайдер']
18	{'input': 'ввод'}	Select the Projection operator from the toolbar and drop it in the canvas and then connect a sources or other node to it as input.	Выберите оператор проекции на панели инструментов, перетащите его в рабочее пространство и подключите к нему источник или другой узел в качестве входного сигнала.	['input']	{'input': 'сигнала'}	['сигнал']
19	{'type': 'тип'}	Depending on the contract type and the pricing model used for the data product, different information can be shown:	В зависимости от типа договора и модели ценообразования, используемой для данного продукта, отображаемая информация может отличаться:	['type']	{'type': 'типа'}	['тип']
20	{'postponed': 'отсрочено'}	Unbilled | Postponed | Write Off	Незасчитанные платежи | Перенесенные на потом платежи | Списание долга	['postponed']	{'postponed': '▔'}	['▔']
21	{'provider': 'провайдер'}	To edit an existing data provider profile, click .	Чтобы отредактировать профиль существующего источника данных, нажмите .	['provider']	{'provider': 'источника'}	['источник']
22	{'regulation': 'предписание'}	If you enter a text and you want to print documents in different languages, select a regulation and navigate to the Classify Dangerous Good - Packaged Product app.	Если вы хотите напечатать документы на разных языках, введите текст, выберите соответствующие правила и перейдите в приложение «Classify Dangerous Good - Packaged Product».	['regulation']	{'regulation': 'правила'}	['правило']
23	{'provider': 'провайдер'}	To set a data provider or data product as a bookmark, just click on the bookmark icon on the corresponding data provider or data product page.	Чтобы добавить поставщика данных или товарный продукт в закладки, просто нажмите на значок закладок на странице соответствующего поставщика данных или товарного продукта.	['provider']	{'provider': 'поставщика'}	['поставщик']
24	{'input': 'ввод'}	The join operator requires two inputs and it generates a single output.	Оператор объединения требует двух входных данных и выдает один выходной результат.	['input']	{'input': 'входных'}	['входной']
25	{'output': 'вывод'}	Adds an Unmatched Record column to the intelligent lookup output.	Добавляет столбец с несопоставленными записями в выходные данные интеллектуального поиска.	['output']	{'output': 'данные'}	['дать']
26	{'billing': 'расчет'}	In work packages that are billed against a time and expense contract, only billable postings are considered for billing.	В пакетах работ, которые оплачиваются по контракту с оплатой за время и расходы, для выставления счета учитываются только оплачиваемые операции.	['billing']	{'billing': 'выставления'}	['выставление']
27	{'explosion': 'разузлование'}	On choosing the Summarized Explosion tab, the table provides the following details:	При выборе вкладки «Сжатое описание взрыва» в таблице отображаются следующие данные:	['explosion']	{'explosion': 'взрыва'}	['взрыв']
28	{'association': 'связь'}	An association describes the relation between business entities.	Ассоциация описывает взаимосвязь между субъектами бизнеса.	['association']	{'association': 'Ассоциация'}	['ассоциация']
29	{'group': 'группировать'}	Select Group By criteria:	Выберите критерии группирования:	['group']	{'group': 'группирования'}	['группирование']
30	{'type': 'вид'}	Some of the notification preferences that you set affect all types of notifications, while others are specific to a notification type.	Некоторые настройки уведомлений, которые вы устанавливаете, применяются ко всем типам уведомлений, а некоторые — только к конкретному типу уведомлений.	['type']	{'type': 'типа'}	['тип']
31	{'contract': 'договор'}	A contract asset is your company’s right to consideration in exchange for goods or services that your company has transferred to a customer when that right is conditioned on something other than the passage of time (for example, your company’s future performance).	Договорный актив – это право вашей компании на получение компенсации за товары или услуги, которые ваша компания передала клиенту, когда это право обусловлено чем-то, кроме времени (например, будущими результатами вашей компании).	['contract']	{'contract': 'Договорный'}	['договорный']
32	{'scope': 'объем'}	The Custom Code Migration app allows you to add or remove request entry points to/from the scope manually.	Мобильное приложение Custom Code Migration позволяет вручную добавлять или удалять точки входа запросов в сферу действия или из неё.	['scope']	{'scope': 'сферу'}	['сфера']
33	{'add-on': 'дополнение'}	SAP Digital Payments Add-On processes the payments and makes them available for the payment advice notes.	Дополнительное приложение SAP Digital Payments обрабатывает платежи и предоставляет отчеты о них.	['add-on']	{'add-on': '▔'}	['▔']
34	{'mapping': 'сопоставление'}	If switched on, it indicates that each data record of the currently opened business entity finds a match in the selected target business entity with the configured key mapping.	Если он включен, то это указывает на то, что для каждой записи данных открытой на данный момент бизнес-сущности, в целевой бизнес-сущности найдена сопоставляемая запись с помощью настроенной схемы сопоставления ключей.	['mapping']	{'mapping': '▔'}	['▔']
35	{'summary': 'сводка'}	Summary of rules and settings that enable allocations.	Краткое описание правил и параметров, обеспечивающих выделение ресурсов.	['summary']	{'summary': 'описание'}	['описание']
36	{'global currency': 'валюта отчетности'}	Global Currency – The currency that has been configured for the controlling area.	Глобальная валюта — валюта, настроенная для зоны контроля.	['global currency']	{'global currency': 'Глобальная валюта'}	['глобальный валюта']
37	{'space': 'пространство'}	You can delete audit logs when needed, which will free up disk space.	Вам будет доступна возможность удаления журналов аудита по мере необходимости, и это позволит освободить дисковое пространство.	['space']	{'space': 'пространство'}	['пространство']
38	{'edit': 'редактировать'}	Edit, Save and Activate	Редактирование, сохранение и активация	['edit']	{'edit': 'Редактирование'}	['редактирование']
39	{'space': 'пространство'}	Spaces send queries or jobs to the database.	Пространства отправляют запросы или задачи в базу данных.	['space']	{'space': 'пространства'}	['пространство']
40	{'schedule': 'планирование'}	This is why SAP Data Warehouse Cloud has now a log deletion schedule activated by default.	Вот почему в SAP Data Warehouse Cloud теперь по умолчанию включен график удаления логов.	['schedule']	{'schedule': 'график'}	['график']
41	{'input': 'ввод'}	The inputs must match in number of the columns, names, data types, and order of corresponding columns.	Входные данные должны иметь одинаковое количество столбцов, одинаковые имена, одинаковые типы данных и одинаковый порядок соответствующих столбцов.	['input']	{'input': 'данные'}	['дать']
42	{'service entry sheet': 'ведомость учета услуг'}	Using the filter criterion Origin, you can decide which service entry sheets are to be displayed in the list.	Используя фильтр «Происхождение», вы можете выбрать, какие страницы записей об услугах нужно отображать в списке.	['service entry sheet']	{'service entry sheet': 'страницы услугах'}	['страница услуга']
43	{'provider': 'провайдер'}	Thanks to the product page created by the data provider you get detailed information on the data product and eventually access to sample data, if available.	Благодаря странице с информацией о продукте, созданной провайдером данных, вы получаете подробную информацию о продукте, а также, в случае наличия образцов, возможность ознакомиться с ними.	['provider']	{'provider': 'провайдером'}	['провайдер']
44	{'provider': 'провайдер'}	You can search and browse for data products and data providers.	В этом разделе вы можете искать и просматривать информацию о предоставляемых продуктах данных и провайдерах данных.	['provider']	{'provider': 'провайдерах'}	['провайдер']
45	{'range': 'интервал'}	View material consumption or availability for a given time range.	Просмотр данных об объеме потребления материалов или их наличии за заданный временной интервал.	['range']	{'range': 'интервал'}	['интервал']
46	{'input': 'ввод'}	If an input record is matched to more than one lookup records with a score between this threshold and the Matched Records Score, it is placed in the Multiple results category.	Если запись ввода сопоставляется с более чем одной записью в базе данных со значением на шкале оценки, которое находится в диапазоне от этого порога до максимального значения в категории «Сопоставление записей в базе данных», то она помещается в категорию «Множественные результаты».	['input']	{'input': 'ввода'}	['ввод']
47	{'type': 'вид'}	You can add items of different types to your sourcing projects.	Вы можете добавить товары разных типов в свои проекты закупок.	['type']	{'type': 'типов'}	['тип']
48	{'schedule': 'планирование'}	Select the relevant persisted view and create a simple or recurring schedule for your view.	Выберите соответствующее постоянное представление и создайте простой или периодический график его показа.	['schedule']	{'schedule': 'график'}	['график']
49	{'data provider': 'провайдер данных'}	To be able to use the data product, the data provider will send an activation key via email that provides authorization to access one or multiple data products.	Чтобы иметь возможность использовать продукт данных, поставщик данных отправит по электронной почте ключ активации, который позволяет получить доступ к одному или нескольким продуктам данных.	['data provider']	{'data provider': 'поставщик данных'}	['поставщик данные']
50	{'residence period': 'период активного хранения'}	At the end of the longest configured residence period, the data is blocked or deleted.	По окончании максимального предусмотренного периода хранения данные блокируются или удаляются.	['residence period']	{'residence period': 'периода хранения'}	['период хранение']
51	{'suspension': 'приостановление'}	Suspension of JVA Projects, Partners, and Equity Groups	Приостановка проектов JVA, партнеров и групп с долевым участием	['suspension']	{'suspension': 'Приостановка'}	['приостановка']
52	{'project type': 'тип проекта'}	Sourcing Project, Sourcing Project Name, Sourcing Project Type, Central Company Code, Central Purchasing Group, Central Purchasing Organization, Material Group, Currency, Purchasing Responsible, Status.	Проект по закупкам, Название проекта по закупкам, Тип проекта по закупкам, Центральный код компании, Центральная группа закупок, Центральная организация закупок, Группа материалов, Валюта, Должностное лицо, ответственное за закупки, Статус.	['project type']	{'project type': 'Тип проекта'}	['тип проект']
53	{'wizard': 'ассистент'}	Click ImportImport Permissions to open the Import Permissions wizard and follow the instructions.	Нажмите «Загрузить разрешения на импорт», чтобы открыть мастер загрузки разрешений на импорт и следуйте инструкциям.	['wizard']	{'wizard': 'мастер'}	['мастер']
54	{'flow': 'поток'}	By switching to the lineage view, you can trace the data provisioning and flow of a model.	Если вы переключитесь на просмотр по линиям, вы сможете проследить, как предоставляются данные и как модель работает.	['flow']	{'flow': 'работает'}	['работать']
55	{'mapping': 'сопоставление'}	Choose Define Mapping to assign the fields of your user data from the CSV file to the fields in user management.	Выберите пункт «Определить сопоставление», чтобы назначить поля пользовательских данных из файла CSV на поля в управлении пользователями.	['mapping']	{'mapping': 'сопоставление'}	['сопоставление']
56	{'due date': 'дата исполнения'}	The app displays all tasks (together with their attributes, such as title, type, status, due date, processor, etc.), and sorts them by due date so that all overdue and due tasks are displayed at a first place.	Приложение отображает все задачи (вместе с их атрибутами, такими как заголовок, тип, статус, срок исполнения, исполнители и т. д.) и сортирует их по срочности, чтобы в первую очередь отображались все просроченные и не выполненные задачи.	['due date']	{'due date': 'срок исполнения'}	['срок исполнение']
57	{'tag': 'отметить'}	Select one or more entries to tag your products with related SAP applications.	Выберите одну или несколько записей, чтобы пометить ваши продукты связанными приложениями SAP.	['tag']	{'tag': 'пометить'}	['пометить']
58	{'provider': 'провайдер'}	The provider has removed the data product from the available data product list.	Поставщик исключил данный продукт из списка доступных продуктов.	['provider']	{'provider': 'Поставщик'}	['поставщик']
59	{'transaction': 'транзакция'}	Source Reference Transaction	Источник ссылки: Сделка	['transaction']	{'transaction': 'Сделка'}	['сделка']
60	{'custom field': 'пользовательское поле'}	Publishing or deletion of at least one custom field failed.	Произошла ошибка при публикации или удалении как минимум одного пользовательского поля.	['custom field']	{'custom field': 'пользовательского поля'}	['пользовательский поле']
