	terms	src_raw	mt_raw	src_terms	alg_terms	norm_tgt_terms
61	{'pane': 'область'}	Additionally, the structure pane contains the options for template rules and text blocks rules.	Кроме того, в области структуры содержатся опции, связанные с правилами шаблонов и правилами текстовых блоков.	['pane']	{'pane': 'области'}	['область']
62	{'residence period': 'период активного хранения'}	The residence period is part of the overall retention period.	Период пребывания является частью общего периода удержания.	['residence period']	{'residence period': 'Период пребывания'}	['период пребывание']
63	{'part': 'деталь'}	Adds the selected part or assembly to the Target (In Work) Panel.	Добавляет выбранную часть или совокупность элементов в панель «Цель (в процессе)».	['part']	{'part': 'часть'}	['часть']
64	{'range': 'интервал'}	If you select the time range, you get to the know the available quantity of the material.	Если выбрать промежуток времени, можно узнать доступное количество материала.	['range']	{'range': 'промежуток'}	['промежуток']
65	{'provider': 'поставщик'}	In the Manage Cash Pools app, the following service providers are supported:	В приложении «Управление денежными резервами» поддерживаются следующие поставщики услуг:	['provider']	{'provider': 'поставщики'}	['поставщик']
66	{'balance': 'баланс'}	Balance Transaction Currency – The currency of the G/L account where the journal entry was posted.	Валюта балансовой операции — валюта учетной записи G/L, в которой была записана журнальная запись.	['balance']	{'balance': 'балансовой'}	['балансовый']
67	{'copy': 'скопировать'}	The Copy and Remove buttons are active only when at least one alternative control is selected.	Кнопки «Копировать» и «Удалить» активируются только после выбора хотя бы одного альтернативного элемента управления.	['copy']	{'copy': 'Копировать'}	['копировать']
68	{'accrual': 'разграничение'}	Accruals that have been manually reviewed in the Review Purchase Order Accruals - My Inbox app	Начисления, которые были проверены вручную в приложении «Просмотр начислений по заказам на покупку — Моя почта»	['accrual']	{'accrual': 'Начисления'}	['начисление']
69	{'type': 'вид'}	Select Work Pack Type from the drop-down list.	Выберите тип рабочего пакета из выпадающего списка.	['type']	{'type': 'тип'}	['тип']
70	{'use': 'использование'}	Use the File Repository	Используйте репозиторий файлов	['use']	{'use': 'Используйте'}	['использовать']
71	{'type': 'тип'}	Substitution Item Type	Тип замены компонента	['type']	{'type': 'Тип'}	['тип']
72	{'schedule': 'планирование'}	You can also modify the existing schedule of a data flow or delete it.	Также можно изменить существующий график потока данных или удалить его.	['schedule']	{'schedule': 'график'}	['график']
73	{'type': 'тип'}	Displays the available run types.	Показывает доступные режимы запуска.	['type']	{'type': 'режимы'}	['режим']
74	{'output': 'вывод', 'input': 'ввод'}	To manually map an input column to an output column, drag it from the left list and drop it onto the column in the right list.	Чтобы вручную связать столбец ввода со столбцом вывода, перетащите его из списка слева и переместите на столбец в списке справа.	['output', 'input']	{'output': 'вывода', 'input': 'ввода'}	['вывод', 'ввод']
75	{'type': 'вид'}	The RECORD COUNT type is a table-wide statistic.	Тип «RECORD COUNT» представляет собой статистику для всей таблицы.	['type']	{'type': 'Тип'}	['тип']
76	{'allocation': 'перерасчет'}	This means that essential features are missing, such as the allocation to a business area.	Это означает, что отсутствуют важные функции, например, распределение по бизнес-зонам.	['allocation']	{'allocation': 'распределение'}	['распределение']
77	{'contract': 'договор'}	The point in time when the primary processing purpose ends, for example, a contract is fulfilled.	Момент прекращения основной цели обработки данных, например, завершение действия договора.	['contract']	{'contract': 'договора'}	['договор']
78	{'edit': 'редактировать'}	Click the Edit Details link, to edit the technical details.	Нажмите ссылку «Редактировать детали» для изменения технической информации.	['edit']	{'edit': 'Редактировать'}	['редактировать']
79	{'demand-driven': 'на основе потребности'}	Select the corresponding checkbox for demand-driven MRP components and/or top-level materials.	Выберите соответствующее поле для компонентов системы MRP, управляемой спросом, и/или материалов верхнего уровня.	['demand-driven']	{'demand-driven': 'управляемой спросом'}	['управляемый спрос']
80	{'input': 'ввод', 'join': 'соединение'}	Select the Join operator from the toolbar and drop it in the canvas and then connect two sources or other nodes to it as inputs.	Выберите оператор объединения из панели инструментов, перетащите его на холст, а затем подключите два источника или другие узлы к нему в качестве входов.	['input', 'join']	{'input': 'входов', 'join': '▔'}	['вход', '▔']
81	{'space': 'пространство'}	Spaces are environments that bring data models, connections, compute and storage resources together for a specific line of business or use-case.	Пространства — это среды, объединяющие модели данных, соединения, вычислительные ресурсы и ресурсы для хранения данных для конкретного направления бизнеса или для конкретного сценария использования.	['space']	{'space': 'Пространства'}	['пространство']
82	{'accrual': 'разграничение'}	Accruals that have been manually reviewed in this app	Выплаты, которые были вручную проверены в этом приложении	['accrual']	{'accrual': 'Выплаты'}	['выплата']
83	{'residence period': 'период активного хранения'}	The retention period is a combination of the residence period and the blocking period.	Период удержания является комбинацией периода проживания и периода блокировки.	['residence period']	{'residence period': 'периода проживания'}	['период проживание']
84	{'contract': 'контракт', 'assembly': 'сборка'}	Enterprise Contract Assembly integrates with SAP S/4HANA for enterprise contract management, in order to generate virtual documents based on the templates and text blocks available in Enterprise Contract Assembly.	Интеграция Enterprise Contract Assembly с SAP S/4HANA позволяет осуществлять управление корпоративными контрактами, генерируя виртуальные документы на основе шаблонов и текстовых блоков, доступных в Enterprise Contract Assembly.	['contract', 'assembly']	{'contract': 'контрактами', 'assembly': 'Assembly'}	['контракт', 'assembly']
85	{'copy': 'копирование'}	Copy existing item to add new one	Копирование существующего элемента для добавления нового.	['copy']	{'copy': 'Копирование'}	['копирование']
86	{'schedule': 'планирование'}	Delete the schedule if required.	Удалите расписание, если это требуется.	['schedule']	{'schedule': 'расписание'}	['расписание']
87	{'accrual': 'разграничение'}	Accruals that have been automatically reviewed because the amounts are between the threshold range.	Расчеты, которые автоматически прошли проверку, поскольку суммы находятся в диапазоне порогового значения.	['accrual']	{'accrual': 'Расчеты'}	['расчёт']
88	{'provider': 'провайдер'}	Get information on the data provider and the products they sell	Получите информацию о поставщике данных и предлагаемых ими продуктах	['provider']	{'provider': 'поставщике'}	['поставщик']
89	{'service entry sheet': 'ведомость учета услуг'}	A service entry sheet can be created in one of the following ways:	Форма заявки на обслуживание может быть создана одним из следующих способов:	['service entry sheet']	{'service entry sheet': 'заявки обслуживание'}	['заявка обслуживание']
90	{'type': 'тип'}	If you like to see only free data products, select the option Free from the filter Contract Type.	Если вы хотите просмотреть только бесплатные продукты, выберите вариант Free из списка типов контрактов.	['type']	{'type': 'типов'}	['тип']
91	{'change': 'изменение'}	Change Connection Properties	Изменить параметры подключения	['change']	{'change': 'Изменить'}	['изменить']
92	{'schedule': 'планирование'}	Create a simple or recurring schedule for your data flow.	Создайте простой или периодический график потока данных.	['schedule']	{'schedule': 'график'}	['график']
93	{'undo': 'отмена'}	Undo and Redo Transformations	Отменить и повторить преобразования	['undo']	{'undo': 'Отменить'}	['отменить']
94	{'pause': 'приостановка'}	Pause Real-Time Replication	Приостановить репликацию в режиме реального времени	['pause']	{'pause': 'Приостановить'}	['приостановить']
95	{'content': 'контент'}	If objects or data on your system will be overwritten by the import, a warning appears in the import window, and next to the relevant objects in the Content list.	Если объекты или данные на вашем компьютере будут перезаписаны при импорте, предупреждение появится в окне импорта и рядом с соответствующими объектами в списке содержимого.	['content']	{'content': 'содержимого'}	['содержимое']
96	{'set': 'определить'}	In the Manage Your Solution app under Configure Your Solution make system settings under FinanceContract AccountingPosting and DocumentsDefine Account Assignment Data Relevant to Transactions.	"Чтобы выполнить эту задачу, откройте приложение ""Управление вашей системой"", перейдите на вкладку ""Настройка вашей системы"", выберите раздел ""Финансы и контракты"", ""Учет и регистрация"" и ""Определение данных присвоения счетов для операций""."	['set']	{'set': '▔'}	['▔']
97	{'thread': 'тред'}	You can enter a number of threads or a percentage.	В качестве параметра можно указать число потоков или процент.	['thread']	{'thread': 'потоков'}	['поток']
98	{'Personal Data': 'Личные данные', 'personal data': 'личные данные'}	The information retrieval feature supports you to comply with the relevant legal requirements for data protection by allowing you to search for and retrieve all personal data of a specified data subject.	Функция поиска информации поддерживает соблюдение требований законодательства по защите персональных данных, поскольку позволяет производить поиск всех данных, относящихся к конкретному лицу, и получать доступ к ним.	['Personal Data', 'personal data']	{'Personal Data': 'персональных данных', 'personal data': 'данных'}	['персональный данные', 'данные']
99	{'provider': 'поставщик'}	Data Provider Page	Страница источника данных	['provider']	{'provider': 'источника'}	['источник']
100	{'type': 'тип'}	This option deletes all of the monitored data belonging to this situation type.	Эта опция удаляет все данные, относящиеся к этому типу ситуации.	['type']	{'type': 'тип'}	['тип']
101	{'attachment': 'вложение'}	If a payment advice was not entered into the system in advance, but was instead used for clearing the current bank statement item or lockbox item, it can be uploaded as an attachment for more complete record keeping.	Если уведомление об оплате заранее не было занесено в систему, а вместо этого использовалось для списания средств с текущего банковского счета или зачета в локбоксе, его можно загрузить в качестве вложения для полного ведения записей.	['attachment']	{'attachment': 'вложения'}	['вложение']
102	{'activate': 'активация'}	Activate a supplier list or supplier list version	Активуйте список поставщиков или версию списка поставщиков	['activate']	{'activate': 'Активуйте'}	['активовать']
103	{'data provider': 'провайдер данных'}	It varies depending on how the data provider offers their products.	Это зависит от того, каким образом поставщик данных предлагает свои продукты.	['data provider']	{'data provider': 'поставщик данных'}	['поставщик данные']
104	{'reporting': 'отчеты'}	Registration for Indirect Taxation Abroad (RITA) enables indirect tax calculation and reporting for multiple countries within a single legal entity.	Регистрация в сфере косвенного налогообложения за рубежом (RITA) позволяет осуществлять расчет и составление отчетности по косвенным налогам для нескольких стран в рамках одного юридического лица.	['reporting']	{'reporting': 'отчетности'}	['отчётность']
105	{'category': 'категория'}	For example, if a service technician works on a Public Holiday whereas the Overtime Category planned was Weekend, they can change the Overtime Category.	Например, если технический специалист работает в государственный праздник, в то время как плановое время сверхурочной работы приходится на выходные, то категорию сверхурочной работы можно изменить.	['category']	{'category': 'категорию'}	['категория']
106	{'type': 'тип'}	Deletes the entire monitored data belonging to this situation type.	Удаляет всю собранную информацию, относящуюся к данному типу ситуации.	['type']	{'type': 'типу'}	['тип']
107	{'client': 'клиент'}	Add Client to Allowlist	Добавить клиента в список разрешенных пользователей	['client']	{'client': 'клиента'}	['клиент']
108	{'type': 'тип'}	Licenses control access to your data products with contract type License Key (see ).	Лицензии контролируют доступ к Вашим информационным продуктам с помощью лицензионного ключа типа «контракт» (см. ).	['type']	{'type': 'типа'}	['тип']
109	{'change': 'изменить'}	Change or Delete Assignments	Изменить или удалить задание	['change']	{'change': 'Изменить'}	['изменить']
110	{'provider': 'поставщик'}	You as a user can search and purchase analytical data from data providers.	Вы, как пользователь, можете искать и покупать аналитические данные у поставщиков данных.	['provider']	{'provider': 'поставщиков'}	['поставщик']
111	{'schedule': 'планирование'}	If a schedule is set for the data flow, see by when the next run is scheduled.	Если для потока данных установлено расписание, проверьте, на какое время запланирован следующий запуск.	['schedule']	{'schedule': 'расписание'}	['расписание']
112	{'provider': 'провайдер'}	The OData service provider URL needs to be publicly available.	URL-адрес поставщика службы OData должен быть общедоступным.	['provider']	{'provider': 'поставщика'}	['поставщик']
113	{'rate': 'курс'}	Consolidation Monthly Average Rate	Обобщенный месячный средний показатель	['rate']	{'rate': 'показатель'}	['показатель']
114	{'wizard': 'ассистент'}	For several connection types that use a Data Provisioning agent to connect to the source, you can define advanced properties in another wizard step.	Для нескольких типов подключений, которые используют агента по предоставлению данных для подключения к источнику, можно определить дополнительные свойства на следующем шаге.	['wizard']	{'wizard': 'шаге'}	['шаг']
115	{'pattern': 'шаблон'}	Define a recurrence pattern for the job.	Определите шаблон повторности для этой задачи.	['pattern']	{'pattern': 'шаблон'}	['шаблон']
116	{'type': 'тип'}	The following product types are currently supported:	На данный момент поддерживаются следующие типы товаров:	['type']	{'type': 'типы'}	['тип']
117	{'provider': 'провайдер'}	OData service provider URL of SAP SuccessFactors.	URL поставщика услуг OData системы SAP SuccessFactors.	['provider']	{'provider': 'поставщика'}	['поставщик']
118	{'inactive': 'неактивно', 'edit': 'редактировать'}	Click Edit and use the Yes/ No switch to change the version to active or inactive respectively.	Нажмите «Редактировать» и переключите переключатель «Да/Нет» для изменения версии на активную или неактивную соответственно.	['inactive', 'edit']	{'inactive': 'неактивную', 'edit': 'Редактировать'}	['неактивный', 'редактировать']
119	{'provider': 'провайдер'}	Data Provider ID	ID поставщика данных	['provider']	{'provider': 'поставщика'}	['поставщик']
120	{'schedule': 'планирование'}	Define, edit or delete scheduling options for your persisted views under Schedule.	Определите, отредактируйте или удалите параметры планирования для ваших сохраненных просмотров в разделе «Планирование».	['schedule']	{'schedule': 'Планирования'}	['планирование']
121	{'copy': 'скопировать'}	Copy time entries	Копирование временных записей	['copy']	{'copy': 'Копирование'}	['копирование']
122	{'edit': 'редактировать'}	You could also chooseEdit Chart PromptsC_FINANCIALPOSITIONQUERY1, if you only want to change the variables for a specific chart.	Вы также можете выбрать «Редактирование параметров диаграммы» -> «C_FINANCIALPOSITIONQUERY1» в случае, когда вы хотите изменить параметры только для конкретной диаграммы.	['edit']	{'edit': '▔'}	['▔']
123	{'tab': 'вкладка'}	Process History tab	Панель «История процесса»	['tab']	{'tab': 'Панель'}	['панель']
124	{'provider': 'провайдер'}	As a data provider, your main objective is to offer valuable data products to the users of the Data Marketplace in SAP Data Warehouse Cloud.	Как поставщик данных, ваша главная цель — предлагать ценные данные пользователям на площадке Data Marketplace в SAP Data Warehouse Cloud.	['provider']	{'provider': 'поставщик'}	['поставщик']
125	{'type': 'тип'}	Choose one of the following action types:	Выберите один из типов действий:	['type']	{'type': 'типов'}	['тип']
126	{'schedule': 'планирование'}	How to Schedule Destruction Runs for Archiving Files	Как запланировать уничтожение файлов для архивирования	['schedule']	{'schedule': 'запланировать'}	['запланировать']
127	{'scope': 'объем'}	The Custom Code Migration app allows you to add or remove packages to/from the scope manually.	Приложение Custom Code Migration позволяет вручную добавлять или удалять пакеты.	['scope']	{'scope': '▔'}	['▔']
128	{'contract': 'договор'}	View and analyze expired or expiring service contracts	Просмотр и анализ истекших или подлежащих истечению сервисных контрактов	['contract']	{'contract': 'контрактов'}	['контракт']
129	{'retention period': 'срок хранения'}	The retention period consists of the residence period and blocking period.	Период удержания состоит из периода пребывания и периода блокирования.	['retention period']	{'retention period': 'Период удержания'}	['период удержание']
130	{'story': 'журнал'}	SAP Analytics Cloud Story	Рассказ о SAP Analytics Cloud	['story']	{'story': 'Рассказ'}	['рассказ']
131	{'space': 'пространство'}	To solve this problem, queries from certain spaces can be favored, meaning they will be processed faster than queries from other spaces.	Для решения этой проблемы запросы из определенных пространств могут иметь приоритет, то есть обрабатываться быстрее, чем запросы из других пространств.	['space']	{'space': 'пространств'}	['пространство']
132	{'rate': 'курс'}	Budget Consolidation Monthly Average Rate	Среднемесячная процентная ставка по бюджетной консолидации	['rate']	{'rate': 'ставка'}	['ставка']
133	{'tab': 'вкладка'}	Process Flow tab	Карта потока процессов	['tab']	{'tab': 'Карта'}	['карта']
134	{'type': 'вид'}	The following calculation types are supported:	Поддерживаются следующие типы вычислений:	['type']	{'type': 'типы'}	['тип']
