	terms	src_raw	mt_raw	src_terms	alg_terms	norm_tgt_terms
0	{'pane': 'область'}	To add notes, choose a template and open the Notes pane on the left side of the screen.	Для добавления заметок выберите шаблон и откройте панель заметок в левой части экрана.	['pane']	{'pane': 'панель'}	['панель']
1	{'contract': 'контракт'}	Specifies the number of the contract from which you can select service items.	Указывает номер контракта, из которого можно выбрать позиции услуг.	['contract']	{'contract': 'контракта'}	['контракт']
2	{'type': 'вид'}	This field is defaulted to the current date and the Return by date field will be a default number of days, defined in customizing (e.g. 30 days for default document type e-bgs), after the handover date.	По умолчанию это поле заполнено текущей датой, а поле «Возврат по дате» будет иметь предварительно заданное количество дней, установленных при настройках (например 30 дней для стандартного типа документа e-bgs), после даты передачи.	['type']	{'type': 'типа'}	['тип']
3	{'revenue': 'выручка'}	The behavior of this budgetary setting is however differently interpreted for accounts classified as 'Expense'’ or 'Revenue' types.	Тем не менее, поведение этой настройки бюджета по-разному интерпретируется для счетов, классифицированных как «расходы» или как «доходы».	['revenue']	{'revenue': 'доходы'}	['доход']
4	{'update': 'обновить'}	You can select which operations (Create, Update and/or Delete) are allowed for each subnode as well as the root node by ticking the corresponding boxes.	Вы можете выбрать, какие операции разрешены для каждого подузла (Создать, Обновить и/или Удалить), а также для корневого узла, установив соответствующие флажки.	['update']	{'update': 'Обновить'}	['обновить']
5	{'range': 'интервал'}	Within a time range	В пределах временного интервала	['range']	{'range': 'интервала'}	['интервал']
6	{'provider': 'провайдер'}	You can bookmarks your favorite data products or data providers.	Вы можете добавлять в закладки свои любимые продукты или поставщиков данных.	['provider']	{'provider': 'поставщиков'}	['поставщик']
7	{'provider': 'провайдер'}	The Provider Name must be unique.	Имя провайдера должно быть уникальным.	['provider']	{'provider': 'провайдера'}	['провайдер']
8	{'branch': 'перейти'}	Branching directly to the object pages of the relevant business objects.	Переход на соответствующие страницы бизнес-объектов.	['branch']	{'branch': 'Переход'}	['переход']
9	{'type': 'вид'}	Specifies the type of the items that you want to add to your sourcing project.	Указывает тип элементов, которые нужно добавить в проект поиска поставщиков.	['type']	{'type': 'тип'}	['тип']
10	{'input': 'ввод'}	If an input record is matched to more than one lookup records with a score reaching this threshold, it is placed in the Multiple results category.	Если входная запись сопоставлена более чем с одним результатом поиска с результатом, превышающим этот порог, она помещается в категорию Множественные результаты.	['input']	{'input': 'входная'}	['входной']
11	{'type': 'вид'}	If you want the automated reprocessing rule to post your bank statement items in only one step, select 001 (One-Step Posting) as the value of the Procedure Type field.	Если вы хотите, чтобы правило автоматической обработки передавало отдельные позиции банковских выписок только в рамках одного этапа, установите в поле «Тип процедуры» значение 001 (одноэтапная передача).	['type']	{'type': 'Тип'}	['тип']
12	{'type': 'вид'}	Depending on your scope, this app can check different types of source documents in your predictive accounting process.	В зависимости от области применения, приложение может проверять различные типы документов в процессе прогнозного учета.	['type']	{'type': 'типы'}	['тип']
13	{'purpose': 'цель'}	As a rule, the purpose references the relevant legal basis for the processing of personal data.	Как правило, в цели содержится ссылка на соответствующую правовую основу для обработки персональных данных.	['purpose']	{'purpose': 'цели'}	['цель']
14	{'type': 'тип'}	Risk type of this obligation that denotes the risk of the legal document if this obligation is not fulfilled	Вид риска этого обязательства, который характеризует риск в отношении юридического документа в случае невыполнения этого обязательства	['type']	{'type': 'Вид'}	['вид']
15	{'type': 'тип'}	Enter a meaningful code that will help you to identify the clause type.	Напишите понятный для вас код, который поможет вам идентифицировать тип члена предложения.	['type']	{'type': 'тип'}	['тип']
16	{'public': 'общедоступный'}	If you're using a network firewall with a proxy, you need to provide the public IPv4 address of your proxy.	Если вы используете сетевой брандмауэр с прокси, необходимо указать общедоступный IPv4-адрес этого прокси.	['public']	{'public': 'общедоступный'}	['общедоступный']
17	{'provider': 'провайдер'}	Click Toggle Preview Changes again to go back and continue editing your data provider page or save it.	Нажмите еще раз «Переключить предпросмотр изменений», чтобы вернуться и продолжить редактирование страницы поставщика данных или сохранить ее.	['provider']	{'provider': 'поставщика'}	['поставщик']
18	{'input': 'ввод'}	Select the Projection operator from the toolbar and drop it in the canvas and then connect a sources or other node to it as input.	Выберите оператор Projection из панели инструментов, перетащите его на холст и подсоедините к нему источник или другой узел, который будет на него подавать входную информацию.	['input']	{'input': 'информацию'}	['информация']
19	{'type': 'тип'}	Depending on the contract type and the pricing model used for the data product, different information can be shown:	В зависимости от типа контракта и выбранной модели ценообразования для продукта с данными может отображаться различная информация:	['type']	{'type': 'типа'}	['тип']
20	{'postponed': 'отсрочено'}	Unbilled | Postponed | Write Off	неоплаченный | отсрочка | Списано	['postponed']	{'postponed': 'отсрочка'}	['отсрочка']
21	{'provider': 'провайдер'}	To edit an existing data provider profile, click .	Чтобы отредактировать существующий профиль источника данных, нажмите .	['provider']	{'provider': 'источника'}	['источник']
22	{'regulation': 'предписание'}	If you enter a text and you want to print documents in different languages, select a regulation and navigate to the Classify Dangerous Good - Packaged Product app.	Если вы ввели текст и хотите распечатать документы на разных языках, выберите нормативный документ и перейдите в приложение «Классификация опасных грузов — упакованных товаров».	['regulation']	{'regulation': 'нормативный'}	['нормативный']
23	{'provider': 'провайдер'}	To set a data provider or data product as a bookmark, just click on the bookmark icon on the corresponding data provider or data product page.	Чтобы добавить поставщика данных или продукт в закладку, просто кликните на значок закладки на странице соответствующего поставщика данных или продукта.	['provider']	{'provider': 'поставщика'}	['поставщик']
24	{'input': 'ввод'}	The join operator requires two inputs and it generates a single output.	Оператор соединения требует двух входных данных и генерирует единственное выходное значение.	['input']	{'input': 'входных'}	['входной']
25	{'output': 'вывод'}	Adds an Unmatched Record column to the intelligent lookup output.	Добавляет столбец «Несоответствующие записи» к результатам интеллектуального поиска.	['output']	{'output': 'результатам'}	['результат']
26	{'billing': 'расчет'}	In work packages that are billed against a time and expense contract, only billable postings are considered for billing.	В рабочих пакетах, счета по которым выставляются на основании контракта на время и расходы, учет в целях выставления счетов ведется только в отношении тех проводок, которые подлежат выставлению счетов.	['billing']	{'billing': 'выставления'}	['выставление']
27	{'explosion': 'разузлование'}	On choosing the Summarized Explosion tab, the table provides the following details:	При выборе вкладки “Подробное описание взрыва” таблица предоставляет следующие данные:	['explosion']	{'explosion': 'взрыва'}	['взрыв']
28	{'association': 'связь'}	An association describes the relation between business entities.	Ассоциирование описывает отношения между бизнес-единицами.	['association']	{'association': 'Ассоциирование'}	['ассоциирование']
29	{'group': 'группировать'}	Select Group By criteria:	Выбор критерия группировки:	['group']	{'group': 'группировки'}	['группировка']
30	{'type': 'вид'}	Some of the notification preferences that you set affect all types of notifications, while others are specific to a notification type.	Некоторые настройки уведомлений влияют на все типы уведомлений, а другие относятся к конкретному типу уведомления.	['type']	{'type': '▔'}	['▔']
31	{'contract': 'договор'}	A contract asset is your company’s right to consideration in exchange for goods or services that your company has transferred to a customer when that right is conditioned on something other than the passage of time (for example, your company’s future performance).	Актив по договору – это право вашей компании на получение вознаграждения за товары или услуги, которые она передала клиенту, но при условии, что это право обусловлено не истечением времени, а другими факторами (например, выполнением вашей компанией будущих обязательств).	['contract']	{'contract': 'договору'}	['договор']
32	{'scope': 'объем'}	The Custom Code Migration app allows you to add or remove request entry points to/from the scope manually.	Приложение Custom Code Migration позволяет вручную добавить или удалить точки входа запросов в область или из нее.	['scope']	{'scope': 'область'}	['область']
33	{'add-on': 'дополнение'}	SAP Digital Payments Add-On processes the payments and makes them available for the payment advice notes.	Расширение SAP «Цифровые платежи» обрабатывает платежи и предоставляет информацию о них для записей в платежных уведомлениях.	['add-on']	{'add-on': 'Расширение'}	['расширение']
34	{'mapping': 'сопоставление'}	If switched on, it indicates that each data record of the currently opened business entity finds a match in the selected target business entity with the configured key mapping.	При включенном состоянии этот флажок указывает на то, что для каждого набора данных, хранящегося в открытой в текущий момент бизнес-сущности, обнаружено соответствие в выбранной бизнес-сущности назначения с помощью заданного сопоставления ключей.	['mapping']	{'mapping': '▔'}	['▔']
35	{'summary': 'сводка'}	Summary of rules and settings that enable allocations.	Свод правил и настроек, которые позволяют проводить распределения.	['summary']	{'summary': 'Свод'}	['свод']
36	{'global currency': 'валюта отчетности'}	Global Currency – The currency that has been configured for the controlling area.	Глобальная валюта - Валюта, установленная для контроллинговой зоны.	['global currency']	{'global currency': 'Глобальная валюта'}	['глобальный валюта']
37	{'space': 'пространство'}	You can delete audit logs when needed, which will free up disk space.	Записи журнала аудита можно удалить по мере необходимости, что позволит высвободить дисковое пространство.	['space']	{'space': 'пространство'}	['пространство']
38	{'edit': 'редактировать'}	Edit, Save and Activate	Редактировать, сохранить и активировать	['edit']	{'edit': 'Редактировать'}	['редактировать']
39	{'space': 'пространство'}	Spaces send queries or jobs to the database.	Spaces отправляют запросы или задачи в базу данных.	['space']	{'space': 'Spaces'}	['spaces']
40	{'schedule': 'планирование'}	This is why SAP Data Warehouse Cloud has now a log deletion schedule activated by default.	Поэтому в SAP Data Warehouse Cloud теперь по умолчанию активирован график удаления логов.	['schedule']	{'schedule': 'график'}	['график']
41	{'input': 'ввод'}	The inputs must match in number of the columns, names, data types, and order of corresponding columns.	Входные данные должны совпадать по числу колонок, именам, типам данных и порядку следования соответствующих колонок.	['input']	{'input': 'данные'}	['дать']
42	{'service entry sheet': 'ведомость учета услуг'}	Using the filter criterion Origin, you can decide which service entry sheets are to be displayed in the list.	С помощью фильтра Происхождение можно определить, какие документы будут отображаться в списке.	['service entry sheet']	{'service entry sheet': 'документы'}	['документ']
43	{'provider': 'провайдер'}	Thanks to the product page created by the data provider you get detailed information on the data product and eventually access to sample data, if available.	Благодаря странице продукта, созданной провайдером, вы можете получить подробную информацию о продукте и даже ознакомиться с примерами данных, если они доступны.	['provider']	{'provider': 'провайдером'}	['провайдер']
44	{'provider': 'провайдер'}	You can search and browse for data products and data providers.	Вы можете искать и просматривать информацию о продуктах и провайдерах данных.	['provider']	{'provider': 'провайдерах'}	['провайдер']
45	{'range': 'интервал'}	View material consumption or availability for a given time range.	Посмотреть расход материала или наличие материала для заданного периода времени.	['range']	{'range': '▔'}	['▔']
46	{'input': 'ввод'}	If an input record is matched to more than one lookup records with a score between this threshold and the Matched Records Score, it is placed in the Multiple results category.	Если входная запись соответствует более чем одной записи для поиска с баллами между этим порогом и баллами совпавших записей, она помещается в категорию «Несколько результатов».	['input']	{'input': 'входная'}	['входной']
47	{'type': 'вид'}	You can add items of different types to your sourcing projects.	Вы можете добавлять в свои закупочные проекты товары разных типов.	['type']	{'type': 'типов'}	['тип']
48	{'schedule': 'планирование'}	Select the relevant persisted view and create a simple or recurring schedule for your view.	Выберите соответствующее устойчивое представление и создайте для него простое или повторяющееся расписание.	['schedule']	{'schedule': 'расписание'}	['расписание']
49	{'data provider': 'провайдер данных'}	To be able to use the data product, the data provider will send an activation key via email that provides authorization to access one or multiple data products.	Для получения доступа к продукту данных поставщик данных отправит по электронной почте активационный ключ, предоставляющий полномочия на получение доступа к одному или нескольким продуктам данных.	['data provider']	{'data provider': 'поставщик данных'}	['поставщик данные']
50	{'residence period': 'период активного хранения'}	At the end of the longest configured residence period, the data is blocked or deleted.	По истечении максимального срока активного использования данные блокируются или удаляются.	['residence period']	{'residence period': 'срока'}	['срок']
51	{'suspension': 'приостановление'}	Suspension of JVA Projects, Partners, and Equity Groups	Остановка JVA проектов, партнеров и групп участия	['suspension']	{'suspension': 'Остановка'}	['остановка']
52	{'project type': 'тип проекта'}	Sourcing Project, Sourcing Project Name, Sourcing Project Type, Central Company Code, Central Purchasing Group, Central Purchasing Organization, Material Group, Currency, Purchasing Responsible, Status.	Проект закупок, Имя проекта закупок, Тип проекта закупок, Код балансовой единицы, Центральная закупочная группа, Центральная закупочная организация, Группа материалов, Валюта, Кто ответственен за закупки, Статус	['project type']	{'project type': 'Тип проекта'}	['тип проект']
53	{'wizard': 'ассистент'}	Click ImportImport Permissions to open the Import Permissions wizard and follow the instructions.	Нажмите кнопку ИмпортироватьПользовательские полномочия для открытия мастера импорта пользовательских полномочий и выполнения указанных в нем действий.	['wizard']	{'wizard': 'мастера'}	['мастер']
54	{'flow': 'поток'}	By switching to the lineage view, you can trace the data provisioning and flow of a model.	Переключая вид на родословную (lineage view), можно отслеживать предоставление и поток данных модели.	['flow']	{'flow': 'поток'}	['поток']
55	{'mapping': 'сопоставление'}	Choose Define Mapping to assign the fields of your user data from the CSV file to the fields in user management.	Выберите опцию Define Mapping, чтобы назначить поля данных пользователей, которые получены из файла CSV, на соответствующие поля в приложении управления пользователями.	['mapping']	{'mapping': 'Mapping'}	['mapping']
56	{'due date': 'дата исполнения'}	The app displays all tasks (together with their attributes, such as title, type, status, due date, processor, etc.), and sorts them by due date so that all overdue and due tasks are displayed at a first place.	В приложении отображаются все задачи (вместе с атрибутами, такими как название, тип, статус, срок выполнения, исполнитель и т. д.), которые отсортированы по срокам выполнения, поэтому все просроченные и невыполненные задачи отображаются в первую очередь.	['due date']	{'due date': 'срокам выполнения'}	['срок выполнение']
57	{'tag': 'отметить'}	Select one or more entries to tag your products with related SAP applications.	Выберите одну или несколько записей, чтобы пометить ваши продукты соответствующими приложениями SAP.	['tag']	{'tag': 'пометить'}	['пометить']
58	{'provider': 'провайдер'}	The provider has removed the data product from the available data product list.	Поставщик удалил продукт данных из списка доступных продуктов данных.	['provider']	{'provider': 'Поставщик'}	['поставщик']
59	{'transaction': 'транзакция'}	Source Reference Transaction	Ссылочная транзакция	['transaction']	{'transaction': 'транзакция'}	['транзакция']
60	{'custom field': 'пользовательское поле'}	Publishing or deletion of at least one custom field failed.	Не удалось опубликовать или удалить хотя бы одно из пользовательских полей.	['custom field']	{'custom field': 'пользовательских полей'}	['пользовательский поле']
61	{'pane': 'область'}	Additionally, the structure pane contains the options for template rules and text blocks rules.	Кроме того, в панели структуры имеется доступ к правилам шаблонов и правилам текстовых блоков.	['pane']	{'pane': 'панели'}	['панель']
62	{'residence period': 'период активного хранения'}	The residence period is part of the overall retention period.	Этот период является частью общего срока хранения.	['residence period']	{'residence period': 'период хранения'}	['период хранение']
