	terms	src_raw	mt_raw	src_terms	alg_terms	norm_tgt_terms
283	{'assessment': 'evaluación'}	The system copies substances from the composition of the unpackaged product that is also part of the most recently activated Health and Safety Management regulation whose lists are assigned to the Safety Data Sheet Management regulation used for the compliance assessment.	El sistema copia las sustancias que figuran en la composición del producto no envasado, que también forma parte del último reglamento de gestión de la salud y seguridad activado, cuyas listas se asignan al reglamento de gestión de fichas de datos de seguridad utilizado para la evaluación de conformidad.	['assessment']	{'assessment': 'evaluación'}	['evaluación']
284	{'flow': 'flow'}	The package contains the following iFlows:	El paquete incluye los siguientes iFlows:	['flow']	{'flow': 'iFlows'}	['iflows']
285	{'aggregate': 'agregar'}	Aggregate Notifications shows whether the notifications to be sent are aggregated (Yes) or separate for each situation instance (No).	Notificaciones agrupadas indica si las notificaciones se envían de forma agrupada (Sí) o por separado para cada instancia (No).	['aggregate']	{'aggregate': 'agrupadas'}	['agrupar']
286	{'add': 'añadir'}	In the Data Access Controls section, you can add one or more data access controls to apply row-based security and control access to individual rows based on various criteria.	En la sección Controles de acceso a datos, puede agregar uno o varios controles de acceso a datos para aplicar la seguridad basada en filas y controlar el acceso a las filas individuales en función de distintos criterios.	['add']	{'add': 'agregar'}	['agregar']
287	{'transaction type': 'tipo de transacción'}	Billed Transaction Type	Tipo de transacción facturada	['transaction type']	{'transaction type': 'transacción'}	['transacción']
288	{'save': 'guardar'}	Click Save and Publish.	Haga clic en Guardar y publicar.	['save']	{'save': 'Guardar'}	['guardar']
289	{'layout': 'disposición', 'save': 'guardar'}	Together with other layout settings, you can save board settings as variants by using the My Views dropdown at the top left of the Kanban Board.	"Junto con otras opciones de diseño, puede guardar las opciones del tablero como variantes mediante el menú desplegable ""Mis vistas"" en la parte superior izquierda del tablero Kanban."	['layout', 'save']	{'layout': 'diseño', 'save': 'guardar'}	['diseño', 'guardar']
290	{'shipment': 'envío'}	Select one of the following the shipment types:	Seleccione uno de los siguientes tipos de envío:	['shipment']	{'shipment': 'envío'}	['envío']
291	{'role': 'rol'}	Choose Add Role.	Haga clic en Añadir rol.	['role']	{'role': 'rol'}	['rol']
292	{'type': 'tipo'}	New Order Type	Nuevo tipo de pedido	['type']	{'type': 'tipo'}	['tipo']
293	{'item': 'artículo'}	Remove an Item	Eliminación de un elemento	['item']	{'item': 'elemento'}	['elemento']
294	{'template': 'plantilla'}	There are two templates:	Existen dos plantillas:	['template']	{'template': 'plantillas'}	['plantilla']
295	{'template': 'plantilla'}	Choose Template Structure.	Seleccione Estructura de la plantilla.	['template']	{'template': 'estructura'}	['estructura']
296	{'endpoint': 'punto de acceso'}	This endpoint is optional.	Este endpoint es opcional.	['endpoint']	{'endpoint': 'endpoint'}	['endpoint']
297	{'schedule': 'programación'}	Sharing a Schedule	Compartir un calendario	['schedule']	{'schedule': 'calendario'}	['calendario']
298	{'grid': 'cuadrícula'}	Number of Grids	Cantidad de Cuadrículas	['grid']	{'grid': 'Cuadrículas'}	['cuadrículas']
299	{'add': 'agregar'}	Adding these roles has the following effects:	Agregar estos roles tendrá los siguientes efectos:	['add']	{'add': 'Agregar'}	['agregar']
300	{'goods receipt processing time': 'tiempo de procesamiento de entradas de mercancías'}	The goods receipt processing time is two days.	El proceso de recepción de mercancías tiene una duración de dos días.	['goods receipt processing time']	{'goods receipt processing time': 'recepción de mercancías'}	['recepción de mercancía']
301	{'step': 'paso'}	Choose Connect Step.	Seleccione la opción Conectar.	['step']	{'step': 'Opción'}	['opción']
302	{'shipment': 'envío', 'type': 'tipo'}	Select one of the following shipment types:	Seleccione uno de los tipos de envío:	['shipment', 'type']	{'shipment': 'envío', 'type': 'tipos'}	['envío', 'tipo']
303	{'type': 'clase'}	Configure Condition Type	Configurar tipo de condición	['type']	{'type': 'tipo'}	['tipo']
304	{'schedule': 'programa'}	Choose Realign Schedules.	Seleccione Realign Schedules (reajustar las programaciones).	['schedule']	{'schedule': 'programaciones'}	['programación']
305	{'tab': 'pestaña'}	Select the Keys tab.	Seleccione la pestaña Claves.	['tab']	{'tab': 'Claves'}	['claves']
306	{'partner': 'socio', 'rating': 'calificación'}	Business Partner Rating	Evaluación de socios comerciales	['partner', 'rating']	{'partner': 'socio', 'rating': 'Evaluación'}	['socio', 'evaluación']
307	{'partner': 'socio'}	A recovery indicator (RI) is assigned to the cost object to indicate whether expenses posted using the cost object are billable to Joint Venture partners.	Se asigna un indicador de recuperación RI al objeto de costes para indicar si los gastos registrados utilizando el objeto de costes se pueden cargar a los asociados en la joint venture.	['partner']	{'partner': 'asociados'}	['asociar']
308	{'drawing': 'sorteo'}	The utilization of a facility is called a drawing.	La utilización de un recurso se denomina un dibujo.	['drawing']	{'drawing': 'dibujo'}	['dibujo']
309	{'delete': 'eliminar'}	Delete a user	Eliminar un usuario	['delete']	{'delete': 'Eliminar'}	['eliminar']
310	{'partner': 'socio'}	Central Business Partner	Socio comercial	['partner']	{'partner': 'Socio'}	['socio']
311	{'bill': 'cuenta'}	For more information, see Deletion of Bill Items.	Para obtener más información, consulte Eliminación de elementos de la factura.	['bill']	{'bill': 'factura'}	['factura']
312	{'work center': 'puesto de trabajo'}	Check the forecasted work center utilization at week level	Verificar la utilización prevista de los centros de trabajo a nivel semanal	['work center']	{'work center': 'centros de trabajo'}	['centro de trabajo']
313	{'tab': 'pestaña'}	The Service Margins tab contains the following detail tabs where you can review the data:	La ficha Service Margins (Margenes de servicio) contiene las siguientes pestañas de detalle en las que se pueden revisar los datos:	['tab']	{'tab': 'pestañas'}	['pestaña']
314	{'report': 'informe'}	Report Contact Person	Informar a persona de contacto	['report']	{'report': '▔'}	['▔']
315	{'tab': 'pestaña'}	The tool includes the following tabs:	La herramienta incluye las pestañas siguientes:	['tab']	{'tab': 'pestañas'}	['pestaña']
316	{'edit': 'editar'}	Edit an application	Modificar una aplicación	['edit']	{'edit': 'Modificar'}	['modificar']
317	{'partner': 'socio'}	Business partner name	Nombre del socio comercial	['partner']	{'partner': 'socio'}	['socio']
318	{'partner': 'socio'}	Contract Account Partner	Participante del contrato	['partner']	{'partner': 'Participante'}	['participante']
319	{'partner': 'socio'}	Bank Business Partner	Socio comercial del banco	['partner']	{'partner': 'Socio'}	['socio']
320	{'display': 'visualización'}	Display Contract Account	Mostrar Cuenta contractual	['display']	{'display': '▔'}	['▔']
321	{'partner': 'socio'}	Business partner item	Posición de socio comercial	['partner']	{'partner': 'socio'}	['socio']
322	{'goods receipt processing time': 'tiempo de procesamiento de entradas de mercancías'}	The goods receipt processing time is one day.	El tiempo para procesar la recepción de mercancías es un día.	['goods receipt processing time']	{'goods receipt processing time': 'recepción de mercancías'}	['recepción de mercancía']
323	{'tab': 'pestaña'}	Situation Monitoring - MST Tab	Supervisión de la Situación - MST Tab	['tab']	{'tab': 'Tab'}	['tab']
324	{'flow': 'flujo'}	The following flow logic applies:	Se aplica la siguiente lógica:	['flow']	{'flow': 'lógica'}	['lógica']
325	{'deselect': 'anular la selección'}	You can select and deselect individual objects, or types of objects (for example, Models or Stories).	Puedes seleccionar o deseleccionar objetos individuales o tipos de objetos (por ejemplo, modelos o historias).	['deselect']	{'deselect': 'deseleccionar'}	['deseleccionar']
326	{'delete': 'eliminar'}	If you update and redeploy an existing persistent view, the persistency is deleted and the data access is changed back to virtual.	Si se actualiza y vuelve a implementar una vista persistente existente, se eliminará la persistencia y el acceso a los datos volverá al modo virtual.	['delete']	{'delete': 'eliminará'}	['eliminará']
327	{'tab': 'pestaña'}	Icon on the tab indicates the following:	El icono en la pestaña indica lo siguiente:	['tab']	{'tab': 'pestaña'}	['pestaña']
328	{'requirement': 'necesidad'}	Characteristic Value Combination per Requirement	Combinación de valores característicos por requisito	['requirement']	{'requirement': 'requisito'}	['requisito']
329	{'quota': 'cuota'}	Lists all quotas that match your filter criteria.	Muestra todas las cuotas que coinciden con los criterios de filtro seleccionados.	['quota']	{'quota': 'cuotas'}	['cuota']
330	{'add': 'añadir'}	Click to add a constraint.	Haga clic para agregar una restricción.	['add']	{'add': 'agregar'}	['agregar']
331	{'measure': 'medida'}	The query provides the following measures:	La consulta proporciona las siguientes medidas:	['measure']	{'measure': 'medidas'}	['medida']
332	{'tab': 'pestaña'}	Error Logs Tab	Tabla de registros de errores	['tab']	{'tab': 'tabla'}	['tabla']
333	{'delete': 'borrar'}	Delete a Story	Borrar una historia	['delete']	{'delete': 'Borrar'}	['borrar']
334	{'partner': 'socio'}	Business Partner Address	Dirección del Socio Comercial	['partner']	{'partner': 'Socio'}	['socio']
335	{'edit': 'tratar'}	Editing a Card	Tratar una Tarjeta	['edit']	{'edit': 'Tarjeta'}	['tarjeta']
336	{'add': 'añadir'}	Click Add Condition.	Haga clic en Añadir condición.	['add']	{'add': 'Añadir'}	['añadir']
337	{'type': 'clase'}	Cash Pool Type	Tipo de Cash Pool	['type']	{'type': '▔'}	['▔']
338	{'button': 'botón'}	Create a group using the Add button	Crea un grupo utilizando el botón Añadir	['button']	{'button': 'Añadir'}	['añadir']
339	{'partner': 'socio'}	Business Partner, Trader	Socio Comercial, Trader	['partner']	{'partner': 'Socio'}	['socio']
340	{'reporting': 'reporting'}	Predefined Reporting Activities	Actividades de informe predefinidas	['reporting']	{'reporting': 'informe'}	['informe']
341	{'report': 'report'}	To use this report, proceed as follows:	Para usar este informe, realice los siguientes pasos:	['report']	{'report': 'informe'}	['informe']
342	{'extension': 'extensión'}	For more information, see Key User Extension.	Para obtener más información, consulte Key User Extension.	['extension']	{'extension': '▔'}	['▔']
343	{'display': 'visualización'}	Display User Operations	Mostrar operaciones de usuario	['display']	{'display': 'operaciones'}	['operación']
344	{'delete': 'eliminar'}	Delete a Scope	Eliminar un alcance	['delete']	{'delete': 'eliminar'}	['eliminar']
345	{'mass processing': 'procesamiento en masa'}	Mass Processing - Start	Procesamiento masivo - Inicio	['mass processing']	{'mass processing': 'Procesamiento masivo'}	['procesamiento masivo']
346	{'business unit': 'unidad empresarial'}	Business Unit Key.	Clave de la unidad de negocio.	['business unit']	{'business unit': 'unidad negocio'}	['unidad negocio']
347	{'measure': 'indicador'}	To define additional measures:	Definir medidas adicionales:	['measure']	{'measure': 'medidas'}	['medida']
348	{'tab': 'pestaña'}	The Maintenance Order Operations tab shows operations and suboperations that are included in the filtered orders, even if the performing work centers is a different one.	La pestaña Operaciones de órdenes de mantenimiento muestra las operaciones y suboperaciones que se incluyen en las órdenes filtradas, aunque los centros de trabajo que las realizan sean diferentes.	['tab']	{'tab': 'pestaña'}	['pestaña']
349	{'reset': 'Anulación'}	You can use the Reset Cleared Items app to do the following:	Puedes utilizar la aplicación Restaurar elementos borrados para realizar las siguientes acciones:	['reset']	{'reset': 'Restaurar'}	['restaurar']
350	{'completed': 'concluido'}	It is not possible to change a completed business document that contains a blocked business partner.	Es imposible modificar un documento comercial completado que contenga un socio comercial bloqueado.	['completed']	{'completed': 'completado'}	['completar']
351	{'expiration': 'vencimiento', 'contract': 'pedido abierto'}	Expiration of Central Purchase Contract	Vencimiento del Contrato de Pedidos Centrales	['expiration', 'contract']	{'expiration': 'Vencimiento', 'contract': 'Contrato'}	['vencimiento', 'contrato']
352	{'usage': 'uso'}	Provides additional information about the metering of usage.	Proporciona más información sobre la medición del uso.	['usage']	{'usage': 'uso'}	['uso']
353	{'move': 'mover'}	Move an order operation to another date	Cambiar la fecha de ejecución de una operación de pedido	['move']	{'move': 'cambiar'}	['cambiar']
354	{'supply': 'suministrar'}	Use this for supplying materials in the production area itself.	Utilícelo para suministrar materiales en la zona de producción.	['supply']	{'supply': 'suministrar'}	['suministrar']
355	{'step': 'etapa'}	Transfer Step Description	Descripción de la etapa de transferencia	['step']	{'step': 'etapa'}	['etapa']
356	{'approval': 'autorización', 'Approval': 'Autorización'}	Supplier Approval Process	Proceso de aprobación de proveedores	['approval', 'Approval']	{'approval': 'aprobación', 'Approval': 'aprobación'}	['aprobación', 'aprobación']
357	{'use': 'utilización'}	Use of Payment Advices	Uso de Notas de Pago	['use']	{'use': 'Uso'}	['uso']
358	{'delete': 'eliminar'}	Then choose Delete.	Seleccione Eliminar.	['delete']	{'delete': 'Eliminar'}	['eliminar']
359	{'business location': 'ubicación'}	ID Business location	ID Ubicación de la empresa	['business location']	{'business location': 'Ubicación'}	['ubicación']
360	{'about': 'info'}	About Journal Entries	Sobre los Asientos en Diario	['about']	{'about': 'Sobre'}	['sobre']
361	{'tab': 'pestaña'}	On this tab you can check the status of your data deliveries.	En esta pestaña, puedes verificar el estado de los datos entregados.	['tab']	{'tab': 'pestaña'}	['pestaña']
362	{'report': 'informe'}	Run the report.	Ejecute el informe.	['report']	{'report': 'informe'}	['informe']
363	{'default': 'valor predeterminado'}	Default value for	Valor por defecto para	['default']	{'default': 'defecto'}	['defecto']
364	{'job': 'trabajo'}	Creating the Job	Crear un trabajo	['job']	{'job': 'trabajo'}	['trabajo']
365	{'scope': 'alcance'}	Creating a Scope	Creación del alcance	['scope']	{'scope': 'alcance'}	['alcance']
366	{'save': 'guardar'}	Edit the business and/or technical names as appropriate and click Save.	Edite los nombres empresariales y/o técnicos si es necesario y haga clic en Guardar.	['save']	{'save': 'Guardar'}	['guardar']
367	{'report': 'report'}	You can use this report for the following purposes:	Puedes utilizar este informe para los siguientes fines:	['report']	{'report': 'informe'}	['informe']
368	{'save': 'guardar', 'add': 'agregar'}	Click Add to save your comments.	Haga clic en Agregar para guardar sus comentarios.	['save', 'add']	{'save': 'guardar', 'add': 'Agregar'}	['guardar', 'agregar']
369	{'job': 'tarea'}	You can also choose to run the job immediately.	También puedes ejecutarlo inmediatamente.	['job']	{'job': 'ejecutarlo'}	['ejecutar']
370	{'show': 'mostrar'}	Show configuration steps	Mostrar pasos de configuración	['show']	{'show': 'Mostrar'}	['mostrar']
371	{'use': 'utilizar'}	Reuse Data Model	Reutilizar Modelo de datos	['use']	{'use': 'Modelo'}	['modelo']
372	{'save': 'guardar'}	Choose Save to save the edited chart.	Seleccione Guardar para guardar el gráfico editado.	['save']	{'save': 'guardar'}	['guardar']
373	{'save': 'guardar'}	If you want to save for future subscriptions you can use the bookmark feature contained in Data Marketplace.	Si quieres guardar la suscripción para usarla más adelante, puedes usar la función de marcador disponible en Data Marketplace.	['save']	{'save': 'guardar'}	['guardar']
374	{'item': 'artículo'}	Enter a name and description for the line item.	Introduce el nombre y una descripción de la línea.	['item']	{'item': 'línea'}	['línea']
375	{'deployment': 'implementación'}	Deployment and Activation	Instalación y activación	['deployment']	{'deployment': 'Instalación'}	['instalación']
376	{'measure': 'indicador'}	Facts need least one measure.	Los datos necesitan al menos una medida.	['measure']	{'measure': 'medida'}	['medida']
377	{'administration': 'administración'}	Administration in Spaces	Administración de espacios	['administration']	{'administration': 'Administración'}	['administración']
378	{'partner': 'socio'}	Business Partner Approach	Enfoque de socio comercial	['partner']	{'partner': 'socio'}	['socio']
379	{'partner': 'socio'}	Business Partner Position	Posición de socio empresarial	['partner']	{'partner': 'socio'}	['socio']
380	{'partner': 'socio'}	Business Partner Overview	Visión general de la relación entre socios	['partner']	{'partner': 'socios'}	['socio']
381	{'average': 'media'}	ADU = Average daily usage	ADU = Utilización media diaria	['average']	{'average': 'media'}	['medio']
382	{'partner': 'socio'}	Business Partner Category	Tipo de asociación:	['partner']	{'partner': 'Asociación'}	['asociación']
383	{'measure': 'indicador'}	For measures, proceed as follows:	Para realizar las medidas, siga los pasos siguientes:	['measure']	{'measure': 'medidas'}	['medida']
384	{'data warehouse': 'data warehouse'}	Data Warehouse Data Access Control	Control de acceso a los datos en los almacenes de datos	['data warehouse']	{'data warehouse': '▔'}	['▔']
385	{'collection': 'recopilación'}	Data Collection Status	Estado de recolección de datos	['collection']	{'collection': 'recolección'}	['recolección']
386	{'item': 'artículo'}	Duplicate an Item	Duplicar un elemento	['item']	{'item': 'elemento'}	['elemento']
387	{'remove': 'quitar'}	Remove an Account	Eliminar una cuenta	['remove']	{'remove': 'Eliminar'}	['eliminar']
388	{'rating': 'valoración'}	Choose the Rating.	Haga clic en la opción de valoración.	['rating']	{'rating': 'valoración'}	['valoración']
389	{'tile': 'mosaico'}	Choose (Remove) at the top right corner of the tile.	Selecciona Eliminar en la esquina superior derecha de la pantalla.	['tile']	{'tile': 'pantalla'}	['pantalla']
390	{'default': 'valor predeterminado'}	The default value here is DEFAULT.	El valor por defecto es DEFAULT.	['default']	{'default': 'por defecto'}	['por defecto']
391	{'qualifier': 'cualificador'}	What are the event qualifiers?	¿Cuáles son los criterios de acceso al evento?	['qualifier']	{'qualifier': 'criterios'}	['criterio']
392	{'delete': 'eliminar'}	Select the key and click on Delete.	Seleccione la clave y haga clic en Eliminar.	['delete']	{'delete': 'Eliminar'}	['eliminar']
393	{'tab': 'pestaña'}	The following options are available on the Advanced tab :	En la ficha Avanzado, están disponibles las siguientes opciones:	['tab']	{'tab': 'ficha'}	['ficha']
394	{'role': 'rol'}	You need the DW Administrator role to create a database user group.	Es necesario contar con el rol de Administrador de DW para crear un grupo de usuarios de la base de datos.	['role']	{'role': 'Administrador'}	['administrador']
395	{'partner': 'socio'}	Total Business Partners:	Total de socios comerciales:	['partner']	{'partner': 'socios'}	['socio']
396	{'edit': 'editar'}	Edit purchase orders	Modificar pedidos de compra	['edit']	{'edit': 'Modificar'}	['modificar']
397	{'tab': 'pestaña'}	You use the UI Section tab to do the following:	La pestaña Sección de IU sirve para lo siguiente:	['tab']	{'tab': 'Sección'}	['sección']
398	{'link': 'enlace'}	For more information, refer to the related links.	Para obtener más información, consulta los enlaces relacionados.	['link']	{'link': 'enlaces'}	['enlace']
399	{'source': 'fuente'}	Mapping Source Value	Mapeo del Valor Fuente	['source']	{'source': 'Fuente'}	['fuente']
400	{'type': 'tipo'}	The following document types are currently not supported in version 2:	Los siguientes tipos de documentos no son compatibles actualmente con la versión 2:	['type']	{'type': 'tipos'}	['tipo']
401	{'elimination': 'compensación'}	Which fields are required for using the FS item in performing consolidation tasks, for example, the field Partner Unit is required for receivable and payable items to perform the elimination of interunit payables and receivables.	¿Qué campos son necesarios para la utilización del elemento FS al llevar a cabo tareas de consolidación? Por ejemplo, es necesario el campo Unidad asociada para los elementos por cobrar y por pagar, para realizar la eliminación de las obligaciones y créditos intraempresariales.	['elimination']	{'elimination': 'eliminación'}	['eliminación']
402	{'link': 'vínculo'}	The system creates these links automatically.	El sistema crea estos enlaces automáticamente.	['link']	{'link': 'enlaces'}	['enlace']
403	{'dashboard': 'dashboard', 'tab': 'pestaña'}	Input Parameters for the Data Sources of the Dashboard Tabs	Parámetros de entrada para las fuentes de datos de las pestañas del panel de control	['dashboard', 'tab']	{'dashboard': 'control', 'tab': 'pestañas'}	['control', 'pestaña']
404	{'partner': 'socio'}	Business Partner Integration	Integración con socios comerciales	['partner']	{'partner': 'socio'}	['socio']
405	{'set': 'definir'}	You can then set the following parameters:	Puedes establecer los siguientes parámetros:	['set']	{'set': 'parámetros'}	['parámetro']
406	{'report': 'informe'}	You can executed the report manually.	Podemos ejecutar el informe manualmente.	['report']	{'report': 'informe'}	['informe']
407	{'benefits': 'ventajas'}	This provides the following benefits:	Esto tiene las siguientes ventajas:	['benefits']	{'benefits': 'ventajas'}	['ventaja']
408	{'business rule': 'regla empresarial'}	Creation of data controller - Using the self-service configuration app -The business Rule ID should be unique.	Creación del controlador de datos. Al utilizar la aplicación de configuración de autoservicio, el identificador de la regla empresarial debe ser único.	['business rule']	{'business rule': 'regla empresarial'}	['regla empresarial']
409	{'partner': 'socio'}	You can restrict the selection by entering specific business partners.	Puede restringir la selección ingresando socios comerciales específicos.	['partner']	{'partner': 'socios'}	['socio']
410	{'tab': 'pestaña'}	The worklist area contains the following tabs:	La lista de tareas contiene las siguientes pestañas:	['tab']	{'tab': 'pestañas'}	['pestaña']
411	{'add': 'agregar'}	Choose Add Inside.	Seleccione Agregar dentro.	['add']	{'add': 'Agregar'}	['agregar']
412	{'partner': 'socio'}	Partner End Point	Punto final de la colaboración	['partner']	{'partner': 'colaboración'}	['colaboración']
413	{'issue': 'emisión'}	Ready for Issue:	Listo para Publicación:	['issue']	{'issue': 'Publicación'}	['publicación']
414	{'partner': 'socio', 'type': 'tipo'}	Identifies the type of the business partner.	Identifica el tipo de socio comercial.	['partner', 'type']	{'partner': 'socio', 'type': 'tipo'}	['socio', 'tipo']
415	{'tab': 'pestaña'}	These tabs are described in the the following table.	Estas pestañas están descritas en la siguiente tabla.	['tab']	{'tab': 'pestañas'}	['pestaña']
416	{'partner': 'socio'}	Business partner number	Número de asociado comercial	['partner']	{'partner': 'asociado'}	['asociado']
417	{'partner': 'socio'}	Business partner master	Socio comercial maestro	['partner']	{'partner': 'Socio'}	['socio']
418	{'explosion': 'desglose'}	BOM explosion rule	Reglas de explosión LMat	['explosion']	{'explosion': 'explosión'}	['explosión']
419	{'completed': 'completado', 'purpose': 'propósito'}	Business Purpose Completed	Objetivo comercial completado	['completed', 'purpose']	{'completed': 'completado', 'purpose': 'comercial'}	['completar', 'comercial']
420	{'company role': 'rol de empresa'}	Enter company role.	Introduzca el rol de la empresa.	['company role']	{'company role': 'empresa'}	['empresa']
421	{'partner': 'socio'}	Selected Business Partners:	Empresas comerciales seleccionadas:	['partner']	{'partner': '▔'}	['▔']
422	{'usage': 'utilización'}	Address Communication Usage	Uso de la dirección de comunicación	['usage']	{'usage': 'uso'}	['uso']
423	{'template': 'plantilla'}	Create a new transaction template	Crear un nuevo modelo de transacción	['template']	{'template': 'modelo'}	['modelo']
424	{'enhancement': 'mejora'}	The new enhancements include the following:	Las nuevas mejoras incluyen lo siguiente:	['enhancement']	{'enhancement': 'mejoras'}	['mejora']
425	{'target': 'objetivo'}	It represents the difference between actual cost and target cost.	Representa la diferencia entre el costo real y el costo objetivo.	['target']	{'target': 'objetivo'}	['objetivo']
426	{'range': 'intervalo'}	By default, the start date of the Period Range selection takes the current date.	Por defecto, la fecha de inicio del período seleccionado adopta la fecha actual.	['range']	{'range': '▔'}	['▔']
427	{'flow': 'flow'}	It is the name of the workflow.	El nombre del workflow.	['flow']	{'flow': 'workflow'}	['workflow']
428	{'process template': 'modelo de proceso'}	Select a process template	Seleccione un modelo de proceso.	['process template']	{'process template': 'modelo de proceso'}	['modelo de proceso']
