	terms	src_raw	mt_raw	src_terms	alg_terms	norm_tgt_terms
179	{'job': 'job'}	Activate this field to run this job in online mode.	Activa este campo para ejecutar esta tarea en modo online.	['job']	{'job': 'tarea'}	['tarea']
180	{'measure': 'indicador'}	You need to select a measure type.	Debes seleccionar un tipo de medida.	['measure']	{'measure': 'medida'}	['medida']
181	{'template': 'modelo'}	Read the messages to understand if there are any errors or warnings, if the actions you performed on the template were successful, if further action is required from you, and so on.	Lee los mensajes para saber si hay errores o avisos, si las acciones realizadas en la plantilla funcionaron correctamente, si necesitas realizar más acciones, etc.	['template']	{'template': 'plantilla'}	['plantilla']
182	{'allocation': 'imputación'}	Summary of processes that take place during allocation.	Resumen de los procesos que tienen lugar durante la asignación.	['allocation']	{'allocation': 'asignación'}	['asignación']
183	{'stage': 'fase'}	The JOA has different development stages, such as engineering and design, construction, and production.	El JOA cuenta con diferentes etapas de desarrollo, como ingeniería y diseño, construcción y producción.	['stage']	{'stage': 'etapas'}	['etapa']
184	{'allocation': 'imputación'}	Select this checkbox to allocate costs in the original posted transaction currency during an allocation run.	Seleccione esta casilla para asignar los costes en la moneda en que se llevó a cabo la transacción original durante el proceso de asignación.	['allocation']	{'allocation': 'asignación'}	['asignación']
185	{'work center': 'puesto de trabajo'}	Choose either one of the scheduling controls to realign your work center schedules:	Seleccione uno de los controles de programación para reorganizar los horarios de su centro de trabajo:	['work center']	{'work center': 'centro de trabajo'}	['centro de trabajo']
186	{'remove': 'quitar', 'add': 'añadir'}	Add other operators to remove or create columns and filter or aggregate data.	Agregue otros operadores para eliminar o crear columnas, y filtrar o agrupar datos.	['remove', 'add']	{'remove': 'eliminar', 'add': 'Agregue'}	['eliminar', 'agregue']
187	{'business activity': 'actividad empresarial'}	The period of time between the end of the last business activity involving a specific object (for example, a business partner) and the deletion of the corresponding data, subject to applicable laws.	El período de tiempo entre la finalización de las últimas actividades comerciales relacionadas con un objeto determinado (por ejemplo, un socio comercial) y la eliminación de los datos correspondientes, sujeto a las leyes aplicables.	['business activity']	{'business activity': 'actividades comerciales'}	['actividad comercial']
188	{'add': 'agregar'}	Adding a control characteristic	Agregar una característica de control	['add']	{'add': 'Agregar'}	['agregar']
189	{'partner': 'socio'}	You assign billable costs to the appropriate partners.	Asigna los costos facturables a los socios correspondientes.	['partner']	{'partner': 'socios'}	['socio']
190	{'acquisition': 'alta'}	Shows acquisition and retirement information.	Muestra información de adquisiciones y bajas.	['acquisition']	{'acquisition': 'adquisiciones'}	['adquisición']
191	{'template': 'plantilla'}	A condition contains expressions and resulting actions defined for a text block used in a template.	Una condición contiene acciones y expresiones definidas para un bloque de texto utilizado en un modelo.	['template']	{'template': 'modelo'}	['modelo']
192	{'item': 'elemento'}	However, there may be exceptions,for instance, when you create a dependency to an item in a different software collection.	Sin embargo, puede haber excepciones, como, por ejemplo, cuando se crea una dependencia a un elemento en una colección de software diferente.	['item']	{'item': 'elemento'}	['elemento']
193	{'class': 'clase'}	You can create different kinds of bonds by defining class data and the conditions accordingly:	Puedes crear distintos tipos de vínculos definiendo los datos de la clase y las condiciones correspondientes.	['class']	{'class': 'clase'}	['clase']
194	{'inventory': 'existencias'}	Value changes are posted to the balance sheet account in inventory accounting	Los cambios de valor se contabilizan en la cuenta de inventarios	['inventory']	{'inventory': 'inventarios'}	['inventario']
195	{'tab': 'etiqueta'}	On a specific tab, choose Edit Prompts at the right corner, and .	En una pestaña específica, elija Editar instrucciones en la esquina derecha .	['tab']	{'tab': 'pestaña'}	['pestaña']
196	{'time': 'hora', 'date': 'fecha'}	The categories Text Type, Number Type, and Data Time Type help to validate that the expression matches the chosen data type.	Las categorías Tipo texto, Tipo número y Tipo de datos hora ayudan a validar que la expresión coincida con el tipo de datos seleccionado.	['time', 'date']	{'time': 'hora', 'date': 'hora'}	['hora', 'hora']
197	{'launchpad': 'plataforma de lanzamiento'}	Secure Text is sent only through secure communication channels such as the SAP Fiori launchpad.	El texto seguro se envía únicamente a través de canales de comunicación seguros como el launchpad de SAP Fiori.	['launchpad']	{'launchpad': 'launchpad'}	['launchpad']
198	{'update': 'actualizar'}	You need to fix the error to be able to complete the persistent view creation or update.	Es necesario corregir el error para poder crear o actualizar una vista persistente.	['update']	{'update': 'actualizar'}	['actualizar']
199	{'item': 'posición'}	When choosing to edit, the requisition or item moves out of the Rejected status and enables resubmission.	Al seleccionar Editar, la solicitud o artículo deja de estar en estado rechazado y se puede volver a presentar.	['item']	{'item': 'artículo'}	['artículo']
200	{'work center': 'centro de trabajo'}	In this popup you can select different periods and change the available capacity of the work center.	En este popup puedes seleccionar diferentes períodos y cambiar la capacidad disponible del centro de trabajo.	['work center']	{'work center': 'centro de trabajo'}	['centro de trabajo']
201	{'default': 'estándar'}	You can keep the default waste generator or choose the value help in the mandatory Waste Generator field and a dialog box will appear.	Puede mantener el generador de residuos predeterminado o escoger en el campo obligatorio Generador de residuos la opción de ayuda, donde aparecerá una ventana de diálogo.	['default']	{'default': 'predeterminado'}	['predeterminado']
202	{'save': 'guardar'}	Click Save to active the log access.	Haz clic en Guardar para activar el acceso al log.	['save']	{'save': 'guardar'}	['guardar']
203	{'type': 'clase'}	Add run types by choosing Add and selecting run types from the list.	Para agregar tipos de ejecución, seleccione Agregar y, a continuación, seleccione los tipos de ejecución de la lista.	['type']	{'type': 'ejecución'}	['ejecución']
204	{'sharing': 'compartición'}	The Data Sharing Cockpit is the tool you use as a the data provider.	Data Sharing Cockpit es la herramienta que utilizan los proveedores de datos.	['sharing']	{'sharing': '▔'}	['▔']
205	{'template': 'plantilla'}	An alternative text block is a released version of a text block that is assigned as a possible replacement for another text block used in the template.	Un bloque de texto alternativo es una versión publicada de un bloque de texto que se asigna como posible reemplazo a otro bloque de texto utilizado en la plantilla.	['template']	{'template': 'plantilla'}	['plantilla']
206	{'save as': 'grabar como'}	Save as Tile	Guardar como Mosaico	['save as']	{'save as': 'Mosaico'}	['mosaico']
207	{'tab': 'pestaña'}	Click (Show or hide data preview) to open the Data Preview panel and select any table or view on the editor panel or in the Repository tab of the sources browser.	Haga clic en (Mostrar/ocultar vista previa de datos) para abrir el panel Vista previa de datos y seleccione cualquier tabla o vista en el panel de edición o en la pestaña Repository del navegador de fuentes.	['tab']	{'tab': 'pestaña'}	['pestaña']
208	{'set': 'definir'}	If you lock a release that is not the latest release, all releases which have been published after the release of the marked release are also set to locked.	Si se bloquea una versión que no es la última, se marcarán también como bloqueadas todas las versiones publicadas después de la versión marcada.	['set']	{'set': 'bloqueadas'}	['bloqueado']
209	{'role template': 'plantilla de rol'}	If you want to change the role template that your new custom role will be based on, select  (Select Template), and choose a role.	Si desea cambiar la plantilla de rol en la cual se basará su nuevo rol personalizado, seleccione (Seleccionar plantilla) y elija un rol.	['role template']	{'role template': 'plantilla de rol'}	['plantilla de rol']
210	{'template': 'modelo'}	If you want to use a different template instead, click on the X to deselect the default template.	Si deseas utilizar una plantilla diferente, haz clic en la X para anular la selección de la plantilla predeterminada.	['template']	{'template': 'plantilla'}	['plantilla']
211	{'item': 'posición', 'add': 'añadir'}	If you want to publish a sourcing project with at least one item of type Project Item, you have to add at least one procurement project and the related information in the section Project Details.	"Si desea publicar un proyecto de compras con al menos un elemento de tipo ""Elemento de proyecto"", debe agregar al menos un proyecto de compra y la información relacionada en la sección Detalles del proyecto."	['item', 'add']	{'item': 'Elemento', 'add': 'agregar'}	['elemento', 'agregar']
212	{'usage': 'utilización'}	This is done to prevent over usage of the space.	Esto se hace para evitar el sobreuso del espacio.	['usage']	{'usage': 'sobreuso'}	['sobreuso']
213	{'endpoint': 'punto final'}	AWS region in your Amazon Athena regional endpoint that you use to make your requests.	AWS region en Amazon Athena regional endpoint que le sirve para realizar sus solicitudes.	['endpoint']	{'endpoint': 'endpoint'}	['endpoint']
214	{'delete': 'eliminar'}	In the side navigation area, click  and then click the My Content folder to display the list of packages that you have exported and those from other systems that you have permission to edit or delete.	En el área de navegación lateral, haga clic y, a continuación, haga clic en la carpeta My Content (Mi contenido) para mostrar la lista de paquetes que ha exportado y los de otros sistemas en los que tenga permiso para editarlos o eliminarlos.	['delete']	{'delete': 'eliminarlos'}	['eliminar']
215	{'retrieval': 'retrieval'}	The information retrieval framework (IRF) supports you to comply with the relevant legal requirements for data protection by allowing you to search for and retrieve all personal data of a specified data subject.	La herramienta IRF le permite cumplir los requisitos legales de la protección de datos al posibilitar la búsqueda y la recuperación de cualquier dato personal de un titular de datos determinado.	['retrieval']	{'retrieval': 'recuperación'}	['recuperación']
216	{'service organization': 'organización de prestación de servicio'}	Service Organization ID	Service Organization ID	['service organization']	{'service organization': '▔'}	['▔']
217	{'collection': 'recopilación', 'item set': 'conjunto de posiciones'}	Item set is a collection of items.	Una colección de posiciones.	['collection', 'item set']	{'collection': 'colección', 'item set': 'colección'}	['colección', 'colección']
218	{'filter': 'filtrar'}	Click in the Create Transform bar, select Filter, and complete the formula ().	Haga clic en Create Transform (Crear Transformación) en la barra de herramientas, seleccione Filter (Filtro) y complete la fórmula.	['filter']	{'filter': 'Filtro'}	['filtro']
219	{'schedule': 'programación'}	If a schedule is set for the data flow, see by when the next run is scheduled.	Si está configurada una programación para el flujo de datos, vea para cuándo está programada la próxima ejecución.	['schedule']	{'schedule': 'programación'}	['programación']
220	{'default': 'por defecto'}	This is now the default setting.	En la actualidad esta es la parametrización por defecto.	['default']	{'default': 'defecto'}	['defecto']
221	{'template': 'plantilla'}	Select a task template.	Seleccione una plantilla de tareas.	['template']	{'template': 'plantilla'}	['plantilla']
222	{'union': 'unión'}	The union operator combines two data sets that share the same schema definition.	El operador de unión combina dos conjuntos de datos que tienen la misma definición de esquema.	['union']	{'union': 'unión'}	['unión']
223	{'run type': 'clase de ejecución'}	When you create or edit a situation type, you can define the run type settings:	Cuando creas o editas un tipo de situación, puedes definir la configuración del tipo de ejecución:	['run type']	{'run type': 'ejecución'}	['ejecución']
224	{'recurrence pattern': 'modelo de repetición'}	Define a recurrence pattern for the job.	Defina un patrón de recurrencia para el job.	['recurrence pattern']	{'recurrence pattern': 'patrón de recurrencia'}	['patrón de recurrencia']
225	{'statement': 'declaración'}	[if Create Statement-level Insert Triggers = true] Create Statement-level Update Triggers	[Si Crear activadores de inserción a nivel de declaración = true] Crear activadores de actualización a nivel de declaración	['statement']	{'statement': 'declaración'}	['declaración']
226	{'feature': 'función'}	This Feature Scope Description	Descripción de la funcionalidad	['feature']	{'feature': 'funcionalidad'}	['funcionalidad']
227	{'adjustment': 'corrección'}	Billing indicators are assigned to billable postings and identify the type of posting involved, including cash call, normal expenditure, and audit adjustment to a particular partner account.	Los indicadores de facturación se asignan a los movimientos facturables e identifican el tipo de movimiento involucrado, entre los que se incluyen un llamado de caja, gastos normales y ajustes de auditoría con relación a una cuenta de socio específica.	['adjustment']	{'adjustment': 'ajustes'}	['ajuste']
228	{'local repository': 'repositorio local', 'save': 'guardar'}	To save your table in the local repository, choose Save.	Para guardar la tabla en el repositorio local, seleccione la opción Guardar.	['local repository', 'save']	{'local repository': 'repositorio local', 'save': 'guardar'}	['repositorio local', 'guardar']
229	{'use': 'utilizar'}	In the connections list of your space, select the new connection and click  (Validate Connection) to check if you can use the connection or if it contains any errors.	En la lista de conexiones de tu espacio, selecciona la conexión recién creada y haz clic en el botón (Convalidar Conexión) para comprobar que puedes usarla, o que no tiene errores.	['use']	{'use': 'usar'}	['usar']
230	{'statement': 'extracto'}	Displays the current status of the statement.	Muestra el estado actual de la declaración.	['statement']	{'statement': 'declaración'}	['declaración']
231	{'consumption': 'compensación', 'allocation': 'contingente'}	Displays data for allocation periods in which allocation consumption exceeds 100%.	Muestra datos para períodos de asignación en los cuales el consumo de la asignación supera el 100%.	['consumption', 'allocation']	{'consumption': 'consumo', 'allocation': 'asignación'}	['consumo', 'asignación']
232	{'replication': 'reproducción'}	For more information, see Microsoft SQL Server Trigger-Based Replication in the SAP HANA Smart Data Integration and SAP HANA Smart Data Quality Installation and Configuration Guide.	Para obtener más información, consulte Microsoft SQL Server Trigger-Based Replication (reproducción de datos por desencadenante) en la Guía de instalación y configuración de SAP HANA Smart Data Integration y SAP HANA Smart Data Quality.	['replication']	{'replication': '▔'}	['▔']
233	{'approval': 'autorización', 'Approval': 'Autorización'}	No Approval Required:	Sin necesidad de autorización:	['approval', 'Approval']	{'approval': ' autorización', 'Approval': 'Autorización'}	['autorización', 'autorización']
234	{'transfer': 'transferencia'}	In the Manage Your Solution app under Configure Your Solution make system settings under FinanceContract AccountingPosting and DocumentsDefine Short Assignment for Transfer Postings.	En Configure your solution (Configurar tu solución) de la aplicación Manage your solution (Administrar tu solución), en el apartado System settings (Opciones del sistema) seleccione la opción FinanceContract AccountingPosting y DocumentsDefine Short Assignment for Transfer Postings.	['transfer']	{'transfer': 'Transfer'}	['transfer']
235	{'tab': 'ficha'}	Go to the Parameters tab.	Vaya a la pestaña Parámetros.	['tab']	{'tab': 'pestaña'}	['pestaña']
236	{'production version': 'versión de producción'}	The Production Version:	La versión de producción:	['production version']	{'production version': 'producción'}	['producción']
237	{'replication': 'replicación'}	Choose Publish to finalize the exclusion of fields, or the removal of excluded tables and fields before replication to the target SAP Cloud Platform system.	Elija Publicar para finalizar la exclusión de campos o la eliminación de tablas y campos excluidos antes de la replicación en el sistema SAP Cloud Platform de destino.	['replication']	{'replication': 'replicación'}	['replicación']
238	{'set': 'definir'}	Set Document Status	Actualizar estado de documento	['set']	{'set': 'estado'}	['estado']
239	{'reporting': 'informes'}	It provides a consolidation view along this profit center hierarchy by populating the Profit Center Eliminated reporting dimension.	Este report proporciona una vista consolidada de acuerdo con la jerarquía de Centros de Ingreso agregando la dimensión Profit Center Eliminated en los informes.	['reporting']	{'reporting': '▔'}	['▔']
240	{'use': 'utilizar'}	The authentication type to be used:	El tipo de autenticación a utilizar:	['use']	{'use': 'utilizar'}	['utilizar']
241	{'save': 'guardar'}	The Save Model dialog opens.	Aparecerá el cuadro de diálogo Guardar modelo.	['save']	{'save': 'Guardar'}	['guardar']
242	{'step': 'paso'}	For implementaiton steps, you will see Go to App button instead of the Configure button.	En los pasos de implementación, verá el botón Go to App (Ir a la aplicación) en lugar del botón Configure (Configurar).	['step']	{'step': 'pasos'}	['paso']
243	{'purpose': 'objetivo'}	Complete the Business Purpose section to let others know what your view is about.	Completa la sección sobre el propósito del negocio para que los demás sepan cuál es tu opinión al respecto.	['purpose']	{'purpose': 'propósito'}	['propósito']
244	{'quantity contract': 'contrato por cantidad'}	Quantity Contract (MK)	Contrato por cantidad MK	['quantity contract']	{'quantity contract': 'Contrato por cantidad'}	['contrato por cantidad']
245	{'complete': 'completa'}	You can use the Cancel button to cancel a service confirmation that has been set to completed.	El usuario puede usar el botón Cancelar para cancelar una confirmación de servicio que se haya establecido como completada.	['complete']	{'complete': 'completada'}	['completar']
246	{'template': 'plantilla'}	Task Template Status	Estado de la tarea	['template']	{'template': 'Estado'}	['estado']
247	{'approval': 'autorización', 'Approval': 'Autorización'}	Approval Process Flow	Flujo del proceso de aprobación	['approval', 'Approval']	{'approval': 'aprobación', 'Approval': 'flujo'}	['aprobación', 'flujo']
248	{'issue': 'problema'}	Fiscal Year and Fiscal Period of issue	Ejercicio Financiero y Período Fiscal de Emisión	['issue']	{'issue': 'Emisión'}	['emisión']
249	{'report': 'informe'}	You can use this report to:	Puedes utilizar este informe para lo siguiente:	['report']	{'report': 'informe'}	['informe']
250	{'tab': 'ficha'}	You can perform the following actions on this tab:	Puedes realizar las siguientes acciones en esta pestaña:	['tab']	{'tab': 'pestaña'}	['pestaña']
251	{'tab': 'etiqueta'}	Withholding Tax tab.	Pestaña Retención de Impuestos.	['tab']	{'tab': 'Pestaña'}	['pestaña']
252	{'partner': 'socio'}	Business Partner's IBAN	Código IBAN de socio comercial	['partner']	{'partner': 'socio'}	['socio']
253	{'network': 'red'}	Enter the network number.	Indique el número de la red.	['network']	{'network': 'red'}	['red']
254	{'partner': 'socio'}	Business Partner name	Nombre del socio empresarial	['partner']	{'partner': 'socio'}	['socio']
255	{'edit': 'editar'}	Edit Service Contracts	Modificar contratos de servicios	['edit']	{'edit': 'Modificar'}	['modificar']
256	{'template': 'modelo', 'delete': 'borrar'}	Select a template and click Delete.	Seleccione una plantilla y haga clic en Eliminar.	['template', 'delete']	{'template': 'plantilla', 'delete': 'Eliminar'}	['plantilla', 'eliminar']
257	{'about': 'info'}	About Goods Issue	Acerca de las mercancías	['about']	{'about': 'Acerca'}	['acerca']
258	{'partner': 'socio'}	Business Partner Name	Nombre del socio comercial:	['partner']	{'partner': 'socio'}	['socio']
259	{'role': 'función'}	Business Partner Role	Rol de Socio Comercial	['role']	{'role': 'Socio'}	['socio']
260	{'template': 'modelo'}	Enter a description for the template in the Description field.	Ingrese una descripción en el campo Descripción.	['template']	{'template': '▔'}	['▔']
261	{'performance management': 'gestión del rendimiento'}	SI Performance Management (SF)	SI Gestión del rendimiento SF	['performance management']	{'performance management': 'Gestión del rendimiento'}	['gestión de rendimiento']
262	{'contract account': 'cuenta contractual'}	Contract Account Check	Verificación de cuentas contractuales	['contract account']	{'contract account': 'cuentas contractuales'}	['cuenta contractual']
263	{'save': 'guardar'}	Save User Settings	Guardar las opciones de usuario	['save']	{'save': 'guardar'}	['guardar']
264	{'type': 'clase'}	Delivery Type Code	Tipo de entrega	['type']	{'type': 'tipo'}	['tipo']
265	{'edit': 'tratar'}	You can edit the following UDQs:	Puedes editar las siguientes UDQs:	['edit']	{'edit': 'editar'}	['editar']
266	{'template': 'plantilla'}	Contains one or more expressions and resulting actions defined for a text block present in a template.	Contiene una o más expresiones y acciones resultantes definidas para un bloque de texto en una plantilla.	['template']	{'template': 'plantilla'}	['plantilla']
267	{'tax type': 'tipo de impuesto'}	Description of the tax type.	Descripción del tipo de impuesto.	['tax type']	{'tax type': 'tipo de impuesto'}	['tipo de impuesto']
268	{'usage': 'utilización'}	Add Usage Data	Añadir datos de uso	['usage']	{'usage': 'uso'}	['uso']
269	{'approval': 'autorización', 'Approval': 'Autorización'}	Approval in Progress	Aprobación en curso	['approval', 'Approval']	{'approval': 'Aprobación', 'Approval': 'Aprobación'}	['aprobación', 'aprobación']
270	{'business content': 'contenido empresarial'}	Business Content Hub	Hub de contenido para negocios	['business content']	{'business content': 'contenido negocios'}	['contenido negocio']
271	{'mass processing': 'procesamiento en masa'}	Asset Mass Processing	Procesamiento masivo de activos	['mass processing']	{'mass processing': 'masivo'}	['masivo']
272	{'schedule': 'programación'}	Your role determines what you can do with a schedule.	El rol determina qué puedes hacer con un calendario.	['schedule']	{'schedule': 'calendario'}	['calendario']
273	{'job': 'tarea'}	specify a limit to avoid excessive concurrent processing due to too many jobs.	Especificar un límite para evitar el procesamiento concurrente excesivo debido al número elevado de tareas.	['job']	{'job': 'tareas'}	['tarea']
274	{'target': 'destino'}	Navigate to other targets	Navegar a otros destinos	['target']	{'target': 'destinos'}	['destino']
275	{'role template': 'plantilla de rol'}	Select a role template.	Seleccione una plantilla.	['role template']	{'role template': 'plantilla'}	['plantilla']
276	{'schedule': 'programar'}	Schedule Tax Jobs	Programar los Tax Jobs	['schedule']	{'schedule': 'Programar'}	['programar']
277	{'Purchase Orders': 'pedidos', 'about': 'info'}	About Purchase Order	Información sobre el pedido	['Purchase Orders', 'about']	{'Purchase Orders': '▔', 'about': 'Información'}	['▔', 'información']
278	{'partner': 'socio'}	Business Partner Event	Evento para socios comerciales	['partner']	{'partner': 'Socios'}	['socios']
279	{'item set': 'conjunto de posiciones'}	An item set can contain both standard items of types Material and Service and project items.	Un grupo de posiciones puede contener tanto posiciones estándar de los tipos Material y Servicio como posiciones de proyecto.	['item set']	{'item set': 'grupo de posiciones'}	['grupo de posición']
280	{'tab': 'pestaña'}	Code List tab	Pestaña Lista de códigos	['tab']	{'tab': 'Pestaña'}	['pestaña']
281	{'deployment': 'despliegue'}	Displays the current status of the deployment.	Muestra el estado actual del despliegue.	['deployment']	{'deployment': 'despliegue'}	['despliegue']
282	{'pause': 'detener'}	Pause and Restart Real-Time Replication	Hacer pausa y reiniciar la replicación en tiempo real	['pause']	{'pause': 'pausa'}	['pausa']
