	terms	src_raw	mt_raw	src_terms	alg_terms	norm_tgt_terms
93	{'trigger': 'iniciar'}	The update of the persistency has to be triggered again.	La actualización de la persistencia se debe iniciar de nuevo.	['trigger']	{'trigger': 'iniciar'}	['iniciar']
94	{'type': 'tipo'}	For Process industry type:	Según el sector de actividad:	['type']	{'type': 'actividad'}	['actividad']
95	{'partner': 'socio'}	The advantage of this attribute is that you can refer to certain business partners in one condition by using the correct payment clearing group.	La ventaja de este atributo es que se puede hacer referencia a determinados socios comerciales en una condición mediante el uso del grupo de liquidación de pago correcto.	['partner']	{'partner': 'socios'}	['socio']
96	{'default': 'estándar'}	The default value is true.	El valor por defecto es true.	['default']	{'default': 'defecto'}	['defecto']
97	{'use': 'utilizar'}	In the table you can use the inspector to solve the capacity issues.	En la tabla puedes utilizar el inspector para solucionar los problemas de capacidad.	['use']	{'use': 'utilizar'}	['utilizar']
98	{'fee': 'tarifa'}	Every month, you pay the defined monthly fee.	Cada mes pagas la cuota mensual definida.	['fee']	{'fee': 'cuota'}	['cuota']
99	{'service confirmation': 'notificación de servicio'}	Cancel a service confirmation.	Cancelar una confirmación de reserva.	['service confirmation']	{'service confirmation': 'confirmación'}	['confirmación']
100	{'allocation': 'imputación'}	On the Description sheet within the file, you can only use those values which are relevant to the context and universal allocation.	En la hoja de descripción, dentro del archivo, sólo se pueden utilizar aquellos valores que sean relevantes para el contexto y la asignación universal.	['allocation']	{'allocation': 'asignación'}	['asignación']
101	{'customer': 'deudor'}	Enter the customer/supplier details which you need for subsequent processing according to your individual company's regulations.	Introduce los detalles del cliente o proveedor que necesites para su posterior procesamiento según los estándares de tu compañía.	['customer']	{'customer': 'cliente'}	['cliente']
102	{'item': 'posición'}	Indicates if an item or a step is specific to a localized version	Indica si un elemento o un paso son específicos de una versión localizada	['item']	{'item': 'elemento'}	['elemento']
103	{'incident': 'incidencia'}	For the Heath Check Support  access category, the incident ID references SAP internal incidents raised by automatic health checks.	En la categoría de acceso al soporte Health Check Support, el ID del incidente hace referencia a los incidentes internos de SAP generados por comprobaciones de estado automáticas.	['incident']	{'incident': 'incidente'}	['incidente']
104	{'partner': 'interlocutor'}	In the value help of the new filter, all search results are restricted to the employees responsible for service contracts, excluding those with the business partner role Employment.	En la ayuda de valores del nuevo filtro, los resultados de la búsqueda se restringen a los empleados responsables de los contratos de servicio, excluyendo aquellos con la función del socio comercial.	['partner']	{'partner': 'socio'}	['socio']
105	{'product type group': 'grupo de clases de producto'}	In the purchase order item, you create a limit item with product type group Service.	En la posición del pedido se crea una posición límite con el tipo de producto Service.	['product type group']	{'product type group': 'tipo de producto'}	['tipo de producto']
106	{'tab': 'pestaña'}	You can find all shared rules on the Shared Rules tab.	Puedes encontrar todas las reglas compartidas en la pestaña Reglas compartidas.	['tab']	{'tab': 'pestaña'}	['pestaña']
107	{'transaction type': 'clase de transacción'}	Please note that for manual bank statements, the system uses the transaction type entered in the manual bank statement.	Tenga en cuenta que, en el caso de extractos bancarios manuales, el sistema utiliza el tipo de transacción indicado en los extractos bancarios manuales.	['transaction type']	{'transaction type': 'tipo de transacción'}	['tipo de transacción']
108	{'bill': 'facturar'}	Choose Restrict and verify that the selected items have moved from the To Be Billed tab to the To Be Postponed tab.	"Seleccione Restricción y verifique que las posiciones seleccionadas se hayan movido de la pestaña ""Para facturar"" a ""Para postergar""."	['bill']	{'bill': 'facturar'}	['facturar']
109	{'issue': 'problema'}	Check, if this mitigates the capacity issue and click Shift Top-Level Demand.	Revise si esto mitiga el problema de capacidad y haga clic en Shift Top-Level Demand (Reubicar demanda de nivel superior).	['issue']	{'issue': 'problema'}	['problema']
110	{'output': 'resultado'}	This function enables you to get required output from the left or right formula.	Esta función permite obtener la salida requerida de la fórmula izquierda o derecha.	['output']	{'output': 'salida'}	['salida']
111	{'save': 'guardar'}	You can save a text block as a new variant, to reuse it in different business scenarios.	Puedes guardar un bloque de texto como una nueva variante para volver a utilizarlo en diferentes escenarios profesionales.	['save']	{'save': 'guardar'}	['guardar']
112	{'use': 'utilizar'}	For a bank account that has been marked as deleted, you can choose the Unmark as Deleted button to reactivate it for use.	Para una cuenta bancaria marcada como eliminada, se puede elegir el botón Desmarcar como Eliminada para reactivarla y volver a utilizarla.	['use']	{'use': 'utilizarla'}	['utilizar']
113	{'tab': 'etiqueta'}	To get data on a tab, you need to define the variables for the tabs.	Para obtener datos en una pestaña, debes definir las variables para las pestañas.	['tab']	{'tab': 'pestaña'}	['pestaña']
114	{'check': 'verificación'}	Request a checkup to perform a health diagnostic and better analyze what was wrong with your data flow.	Solicite una revisión para realizar un diagnóstico y analizar más profundamente qué está fallando en su flujo de datos.	['check']	{'check': 'revisión'}	['revisión']
115	{'central contract': 'pedido abierto central'}	That way, if one subsidiary only creates purchase orders for 20% of the total value or quantity agreed in the central contract, the other subsidiary would have the flexibility to order up to 80% if they need to.	De esta forma, si una subsidiaria solo genera pedidos de compra por el 20% del valor o cantidad acordados en el contrato central, la otra subsidiaria tendrá la flexibilidad de ordenar hasta un 80% si fuera necesario.	['central contract']	{'central contract': 'contrato central'}	['contrato central']
116	{'work center': 'puesto de trabajo'}	Capacity consumed by the work center to dispatch the order	Capacidad consumida por el centro de trabajo al planificar la orden	['work center']	{'work center': 'centro de trabajo'}	['centro de trabajo']
117	{'inbound': 'entrada'}	Custom communication users are created in the Maintain Communication Users app and are assigned to systems for inbound and outbound communication.	Los usuarios de Comunicación personalizados se crean en la aplicación Mantenimiento de usuarios de Comunicación y se asignan a los sistemas para la Comunicación entrante y saliente.	['inbound']	{'inbound': 'entrante'}	['entrante']
118	{'scope': 'alcance', 'use': 'usar'}	Although you can activate individual features, you can use them only if the corresponding parent scope items are also enabled.	Aunque se pueden activar funciones individuales, solo se pueden usar si los elementos del ámbito principal correspondientes también están habilitados.	['scope', 'use']	{'scope': 'ámbito', 'use': 'usar'}	['ámbito', 'usar']
119	{'tab': 'pestaña'}	On the To Be Billed tab, select one or more items as required and choose Restrict Date.	En la pestaña To Be Billed (Para facturación), seleccione uno o varios elementos según corresponda y elija Restrict Date (Restringir fecha).	['tab']	{'tab': 'pestaña'}	['pestaña']
120	{'type': 'clase'}	You can select an allocation type when creating an allocation cycle in the Manage Allocations app.	En la aplicación Manage Allocations (Administrar asignaciones), puede seleccionar un tipo de asignación al crear un ciclo de asignación.	['type']	{'type': 'asignación'}	['asignación']
121	{'sharing': 'compartición'}	Provide and Sell Data Products with the Data Sharing Cockpit	Ofrezca y venda productos de datos con la plataforma Data Sharing Cockpit	['sharing']	{'sharing': 'plataforma'}	['plataforma']
122	{'requirement': 'requisitos'}	The projected plant stock can be calculated from the current stock- or requirements situation for the start date of the reference object.	El stock de plantas proyectado se puede calcular a partir de la situación actual de stock o necesidades para la fecha de inicio del objeto de referencia.	['requirement']	{'requirement': 'necesidades'}	['necesidad']
123	{'template': 'plantilla'}	Specifies the level on which you want to share the template.	Specifies el nivel en el que desea compartir la plantilla.	['template']	{'template': 'plantilla'}	['plantilla']
124	{'button': 'pulsador'}	Choose this button if you want to download G/L account mappings into a spreadsheet.	Seleccione este botón si desea descargar los mapeos de cuentas de G/L a una hoja de cálculo.	['button']	{'button': 'botón'}	['botón']
125	{'time': 'tiempo'}	Yes, to allow resources to post time only if they are staffed or assigned to a project.	Sí, para permitir que los recursos registren tiempo únicamente si están empleados o asignados a un proyecto.	['time']	{'time': 'tiempo'}	['tiempo']
126	{'schedule': 'programación'}	To unshare the schedule, just remove the name of the person whose access you want to revoke.	Para dejar de compartir el calendario, basta con eliminar el nombre de la persona cuyo acceso deseas revocar.	['schedule']	{'schedule': 'calendario'}	['calendario']
127	{'source': 'fuente'}	If the panel is not visible, click the Source Browser button in the toolbar to show it.	Si el panel no está visible, haga clic en el botón Navegador de recursos en la barra de herramientas para mostrarlo.	['source']	{'source': 'recursos'}	['recurso']
128	{'usage': 'utilización'}	The system enables the Usage and Availability button only if there's plant information.	"Este sistema activará el botón ""Usage and Availability"" (Uso y Disponibilidad) solamente si existe información sobre la planta."	['usage']	{'usage': 'Uso'}	['uso']
129	{'measure': 'indicador'}	Based on the Semantic Usage of your entity, review and modify its Columns, Attributes, and/or Measures:	Basado en el uso semántico de su entidad, revise y modifique las columnas, atributos y/o indicadores:	['measure']	{'measure': 'indicadores'}	['indicador']
130	{'work center': 'puesto de trabajo'}	You can change the work center for order operations that have the processing status Due.	Puede cambiar el centro de trabajo de las operaciones de pedido con el estado de procesamiento vencido.	['work center']	{'work center': 'centro de trabajo'}	['centro de trabajo']
131	{'type': 'clase'}	You can even set the corresponding value for these file types while using the Assembly Automation Levels during the creation of virtual documents.	Puedes configurar los valores de este tipo de archivos mientras ajustas los Niveles de automatización en el momento de la creación de documentos virtuales.	['type']	{'type': 'tipo'}	['tipo']
132	{'measure': 'indicador'}	Specify measures, if appropriate, and other aspects of your output structure in the output node.	Especifique medidas, si procede, y otros aspectos de la estructura de salida en el nodo de salida.	['measure']	{'measure': 'medidas'}	['medida']
133	{'template': 'plantilla'}	Displays the conditions-related information for a template.	Muestra la información relacionada con las condiciones de una plantilla.	['template']	{'template': 'plantilla'}	['plantilla']
134	{'complete': 'completo', 'save': 'guardar'}	You can then save your current progress even if there are errors due to incomplete entry fields.	Podrás guardar tu estado actual, incluso si hay errores debido a los campos incompletos.	['complete', 'save']	{'complete': 'incompletos', 'save': 'guardar'}	['incompleto', 'guardar']
135	{'business name': 'nombre empresarial'}	By default, you see your object’s business name.	Por defecto, aparece el nombre comercial del objeto.	['business name']	{'business name': 'nombre comercial'}	['nombre comercial']
136	{'prepayment': 'pago adelantado'}	You can check the amount of planned prepayments by choosing the Prepayment Details in the billing element column.	Puedes consultar la cantidad de prepagos planificados si eliges Detalles de prepago en la columna de elementos de facturación.	['prepayment']	{'prepayment': 'prepago'}	['prepago']
137	{'process step': 'paso de proceso'}	Replace an existing process step	Reemplazar un paso de un proceso existente	['process step']	{'process step': 'proceso'}	['proceso']
138	{'schedule': 'programación'}	Reviewers have read-only access to the schedule and cannot see the utilization forecast shown when the schedule is in Scoping or Refinement.	"Los revisores tienen acceso solo lectura a la programación y no pueden ver la previsión de uso que se muestra cuando la programación está en ""Definición de alcance"" o en ""Refinamiento""."	['schedule']	{'schedule': 'programación'}	['programación']
139	{'requirement': 'requisitos'}	The selection criteria is configured using a condition statement defined in the Requirement Filter.	Los criterios de selección se configuran mediante una declaración de condición definida en el filtro de requisitos.	['requirement']	{'requirement': 'requisitos'}	['requisito']
140	{'measure': 'indicador'}	You can assign a currency or unit to your measure.	Puedes asignar una moneda o unidad a tus medidas.	['measure']	{'measure': 'medidas'}	['medida']
141	{'check': 'Verificar'}	Checking Delivery Details	Verificar detalles del envío	['check']	{'check': 'detalles'}	['detalle']
142	{'supplement': 'postimputar'}	In general, you should consider whether it is useful to select the Supplement auto. posting option in the master record of the G/L account at all.	En general, debe considerar si es útil seleccionar la opción de publicación automática de suplementos en el registro principal de la cuenta G/L.	['supplement']	{'supplement': 'suplementos'}	['suplemento']
143	{'parallel processing': 'procesamiento paralelo', 'partner': 'socio'}	You can use parallel processing if you want to make changes to a large number of Business partners.	Puede utilizar el procesamiento en paralelo si desea realizar cambios en una gran cantidad de Business partners.	['parallel processing', 'partner']	{'parallel processing': 'procesamiento paralelo', 'partner': 'partners'}	['procesamiento paralelo', 'partners']
144	{'performance': 'rendimiento'}	The amounts displayed are calculated at the revenue contract level and are the sum of the amounts of all performance obligations.	Los importes mostrados se calculan en el nivel del contrato de ingresos y corresponden a la suma de los importes de todas las obligaciones de desempeño.	['performance']	{'performance': 'desempeño'}	['desempeño']
145	{'run': 'ejecutar'}	You run allocation cycles in the Run Allocations app.	Realiza los ciclos de imputaciones en la aplicación Ejecutar imputaciones.	['run']	{'run': 'Ejecutar'}	['ejecutar']
146	{'add': 'añadir'}	Select one or multiple purchase requisition items and from the Add to Document drop-down list choose Add to Sourcing Project.	Seleccione una o más solicitudes de compra y en el menú desplegable Añadir al documento, seleccione Añadir a proyecto de abastecimiento.	['add']	{'add': 'Añadir'}	['añadir']
147	{'button': 'pulsador'}	Check the syntax of the system variable for validity by using the Check syntax of system variable for validity button next to the Value field.	Compruebe la sintaxis de la variable de sistema para confirmar su validez utilizando el botón Validar la sintaxis de la variable de sistema junto al campo Valor.	['button']	{'button': 'Validar'}	['validar']
148	{'check': 'Verificar'}	You do not have to actively check the data before importing it.	No es necesario verificar de forma activa los datos antes de importarlos.	['check']	{'check': 'verificar'}	['verificar']
149	{'worklist': 'lista de trabajo'}	Add to Scheduling Worklist	Añadir al calendario	['worklist']	{'worklist': '▔'}	['▔']
150	{'partner': 'socio'}	Joint Venture Partner	Socio en joint venture	['partner']	{'partner': 'Socio'}	['socio']
151	{'site': 'sitio'}	Furthermore, any advertisements or other content hosted on these platforms (for example, suggested videos or by navigating to other videos hosted on the same site), are not within the control or responsibility of SAP.	Además, cualquier publicidad u otros contenidos publicados en estas plataformas (p. ej., vídeos sugeridos o al navegar por otros vídeos alojados en el mismo sitio) no están bajo el control ni la responsabilidad de SAP.	['site']	{'site': 'sitio'}	['sitio']
152	{'demand-driven': 'orientado a necesidad'}	Select the corresponding checkbox for demand-driven MRP components and/or top-level materials.	Seleccione la casilla de verificación correspondiente para los componentes MRP accionados por demanda y/o los materiales de nivel superior.	['demand-driven']	{'demand-driven': 'accionados por demanda'}	['accionado por demanda']
153	{'process step': 'paso del proceso'}	If the action is optional, its execution status does not affect the process step status.	Si la acción es opcional, su estado de ejecución no afecta el estado del paso de proceso.	['process step']	{'process step': 'paso de proceso'}	['paso de proceso']
154	{'SAP affiliate': 'filial de SAP'}	SAP and other SAP products and services mentioned herein as well as their respective logos are trademarks or registered trademarks of SAP SE (or an SAP affiliate company) in Germany and other countries.	SAP y otros productos y servicios SAP aquí mencionados, así como sus respectivos logotipos, son marcas registradas o marcas comerciales de SAP SE (o de una empresa filial de SAP) en Alemania y otros países.	['SAP affiliate']	{'SAP affiliate': 'filial SAP'}	['filial sap']
155	{'popup': 'popup'}	Click to open the Columns popup in which you can do the following:	Haga clic para abrir el menú emergente Columnas, en el que puede realizar lo siguiente:	['popup']	{'popup': 'menú'}	['menú']
156	{'partner': 'socio'}	Use the Search field in the popup to search for all business partners or you can use the list available.	Utilice el campo de búsqueda en la ventana emergente para buscar todos los socios comerciales o utilice la lista disponible.	['partner']	{'partner': 'socios'}	['socio']
157	{'add': 'añadir'}	You can add items of different types to your sourcing projects.	Puedes agregar productos de diferentes tipos a tus proyectos de licitación.	['add']	{'add': 'agregar'}	['agregar']
158	{'delete': 'eliminar'}	To delete a relationship or to add, edit, or delete an offset for a relationship, right-click the relationship in the chart and select the relevant entry from the context menu.	Para agregar, editar o eliminar una relación, haga clic derecho en la relación en el gráfico y seleccione la entrada relevante en el menú contextual.	['delete']	{'delete': 'eliminar'}	['eliminar']
159	{'partner': 'socio'}	If you choose a business partner in the Issuing Authority field, this value will be copied into the Issuing Organization field.	Si selecciona un socio de negocios en el campo “Autoridad emisora”, este valor se copiará en el campo “Organización emisora”.	['partner']	{'partner': 'socio'}	['socio']
160	{'lock': 'bloquear'}	Before blocking or deleting of personal data, you must define the residence time and retention periods in SAP Information Lifecycle Management (ILM) for the corresponding ILM objects.	Antes de bloquear o eliminar datos personales, debe definir los tiempos de retención y los plazos de conservación en SAP Information Lifecycle Management (ILM) para los objetos ILM correspondientes.	['lock']	{'lock': 'bloquear'}	['bloquear']
161	{'template': 'plantilla'}	Download and upload template for cycle and segment definitions.	Descargar y subir plantilla para definiciones de ciclos y segmentos.	['template']	{'template': 'plantilla'}	['plantilla']
162	{'allocation': 'imputación'}	Cycle ID, Allocation Context, Ledger, Valid From.	Identificador del ciclo, Contexto de asignación, Ledger, Valid From.	['allocation']	{'allocation': 'asignación'}	['asignación']
163	{'allocation': 'imputación'}	Allocation types are a summary of the processes that can take place during allocation.	Los tipos de asignación son un resumen de los procesos que pueden ocurrir durante la asignación.	['allocation']	{'allocation': 'asignación'}	['asignación']
164	{'termination': 'rescisión'}	You can predefine the renewal and termination clauses for legal transactions at the context level.	Es posible predefinir a nivel contextual las cláusulas de renovación y terminación de los contratos legales.	['termination']	{'termination': 'terminación'}	['terminación']
165	{'use case': 'caso de utilización'}	Spaces are environments that bring data models, connections, compute and storage resources together for a specific line of business or use-case.	Los espacios son entornos que combinan modelos de datos, conexiones y recursos de computación y almacenamiento para una línea de negocio específica o para un caso de uso concreto.	['use case']	{'use case': 'caso de uso'}	['caso de uso']
166	{'delete': 'eliminar'}	Then you can simply delete it from this menu.	Entonces puedes eliminarlo de este menú.	['delete']	{'delete': 'eliminarlo'}	['eliminar']
167	{'source': 'fuente'}	In the Import Users dialog, choose Select Source File to upload your CSV file.	En el cuadro de diálogo Importar usuarios, elija Select Source File para cargar su archivo CSV.	['source']	{'source': '▔'}	['▔']
168	{'range': 'intervalo'}	Specify a data range, which is the time period for the data.	Especifique el rango de datos, es decir, el intervalo de tiempo para los datos.	['range']	{'range': 'rango'}	['rango']
169	{'process step': 'paso del proceso'}	After verifying the business process step execution manually and finding it compatible, you can set the status to Verified by User.	"Luego de verificar manualmente cada paso de la ejecución del proceso de negocio y de constatar su compatibilidad, puede establecer su estado en ""Verificado por el usuario""."	['process step']	{'process step': 'paso proceso'}	['paso proceso']
170	{'default': 'estándar'}	By default, Yes is selected for this field, which means that cash flows whose actual liquidity item are different from the ones proposed by the machine learning service are displayed.	Por defecto, Yes (Sí) está seleccionado para este campo, lo que significa que se muestran los flujos de caja cuyos elementos de liquidez reales son diferentes de los propuestos por el servicio de aprendizaje automático.	['default']	{'default': 'defecto'}	['defecto']
171	{'item set': 'conjunto de posiciones'}	If you copy an item set, all subordinate items are copied as well.	Si copias un conjunto de posiciones, todas las posiciones subordinadas también se copian.	['item set']	{'item set': 'conjunto de posiciones'}	['conjunto de posición']
172	{'explosion': 'desglose', 'tab': 'pestaña'}	On choosing the Summarized Explosion tab, the table provides the following details:	En la pestaña Resumen de explosión, la tabla proporciona la siguiente información:	['explosion', 'tab']	{'explosion': 'explosión', 'tab': 'pestaña'}	['explosión', 'pestaña']
173	{'worklist': 'lista de trabajo'}	Choose Add to Scheduling Worklist to add a settlement date to a scheduling worklist.	Elija Agregar al listado de trabajos de planificación para agregar una fecha de liquidación a un listado de trabajos de planificación.	['worklist']	{'worklist': 'listado de trabajos'}	['listado de trabajo']
174	{'worklist': 'lista de trabajo'}	You can then decide to choose an existing scheduling worklist or create a new one.	Posteriormente, puedes decidir seleccionar una lista de tareas programadas ya existente o crear una nueva.	['worklist']	{'worklist': 'lista de tareas'}	['lista de tarea']
175	{'data controller': 'responsable del tratamiento'}	The personal data used to complete the process is predefined in a purpose, which is defined by the data controller.	Los datos personales utilizados para realizar el proceso están predefinidos para un objetivo, que es definido por el responsable del tratamiento.	['data controller']	{'data controller': 'responsable del tratamiento'}	['responsable de tratamiento']
176	{'client application': 'aplicación cliente'}	If you are using OAuth 2.0 you must provide the following information to your client application:	Si utilizas OAuth 2.0, debes proporcionar la siguiente información a la aplicación cliente:	['client application']	{'client application': 'aplicación cliente'}	['aplicación cliente']
177	{'view type': 'clase de vista'}	The lower-level bars visible in expanded view always show assignment information, regardless of the view type you set for the top-level bars.	Las barras de nivel inferior visibles en la vista expandida siempre muestran información de asignación, independientemente del tipo de vista que haya establecido para las barras de nivel superior.	['view type']	{'view type': 'tipo de vista'}	['tipo de vista']
178	{'save': 'guardar'}	If needed, you can change a team's global ID before you save a team's definition.	Si es necesario, puedes cambiar el identificador global de un equipo antes de guardar la definición del equipo.	['save']	{'save': 'guardar'}	['guardar']
