	terms	src_raw	mt_raw	src_terms	alg_terms	norm_tgt_terms
0	{'container': 'container'}	Why would you need to access HDI containers?	¿Por qué necesitarías acceder a los containers de HDI?	['container']	{'container': 'containers'}	['containers']
1	{'parallel processing': 'procesamiento paralelo', 'job': 'job'}	Decide if you want to use parallel processing for this job:	Decida si desea utilizar procesamiento paralelo para esta tarea:	['parallel processing', 'job']	{'parallel processing': 'procesamiento paralelo', 'job': 'tarea'}	['procesamiento paralelo', 'tarea']
2	{'report': 'report'}	Displays in the list report billing elements with or without planned prepayments.	Visualiza en la lista de facturación elementos con o sin pagos previos planificados.	['report']	{'report': 'facturación'}	['facturación']
3	{'average': 'media'}	The KPI shows the average age in days of assets under construction, and individual items are listed below.	El KPI muestra la edad promedio de los activos en construcción, expresada en días, y a continuación se enumeran los elementos individuales:	['average']	{'average': 'promedio'}	['promedio']
4	{'item': 'elemento'}	Once exported, an item stays in the software collection for its entire lifecycle.	Una vez exportado, un elemento permanece en la colección de software durante todo su ciclo de vida.	['item']	{'item': 'elemento'}	['elemento']
5	{'explosion': 'desglose'}	If it's an assembly, the explosion continues to the lowest level.	Si es una estructura, la explosión se propaga al nivel inferior.	['explosion']	{'explosion': 'explosión'}	['explosión']
6	{'add': 'agregar'}	Add a New OAuth Client (Non-SAP Data Center)	Agregar un nuevo cliente OAuth (centro de datos externo a SAP)	['add']	{'add': 'agregar'}	['agregar']
7	{'range': 'intervalo'}	Each compute block provides a certain number of vCPUs and a range of 60 to 64 GB of RAM, depending on the hyperscaler.	Cada bloque de computación proporciona un número determinado de vCPU y un rango de entre 60 y 64 GB de RAM, dependiendo del hiperescalador.	['range']	{'range': 'rango'}	['rango']
8	{'source': 'fuente'}	Source systems connected to an SAP LT Replication Server are supported down to:	Los sistemas fuente conectados a un servidor de replicación de SAP LT están soportados hasta:	['source']	{'source': 'fuente'}	['fuente']
9	{'template': 'modelo'}	After you create a new template, you will be directed to the template page, to add text blocks to the template.	Después de crear una plantilla nueva, serás dirigido a la página de plantilla, donde podrás agregar bloques de texto a la plantilla.	['template']	{'template': 'plantilla'}	['plantilla']
10	{'source': 'fuente'}	Data is accessed directly from the source (federation) and read from the virtual table.	Se accede a los datos directamente desde la fuente (federación) y se lee desde la tabla virtual.	['source']	{'source': 'fuente'}	['fuente']
11	{'edit': 'editar'}	Edit Default Waste Generator	Editar Productor de residuos predeterminado	['edit']	{'edit': 'Editar'}	['editar']
12	{'reset': 'restablecer'}	Resets the filters.	Elimina todos los filtros.	['reset']	{'reset': 'Elimina'}	['elimina']
13	{'add': 'añadir'}	You can copy existing items or item sets to add new ones to the sourcing project.	Puede copiar elementos existentes o conjuntos de elementos para agregar nuevos al proyecto.	['add']	{'add': 'agregar'}	['agregar']
14	{'incident': 'incidencia'}	Access of this category is not based on individual support cases or incidents.	El acceso a esta categoría no se basa en casos de soporte o incidentes individuales.	['incident']	{'incident': 'incidentes'}	['incidente']
15	{'template': 'modelo'}	Use the dropdown list in the upper left corner of the dialog box to select the search template you want to use.	Utilice la lista desplegable en la esquina superior izquierda de la ventana de búsqueda para seleccionar la plantilla de búsqueda que desee usar.	['template']	{'template': 'plantilla'}	['plantilla']
16	{'save': 'guardar'}	To save and deploy your ER model to SAP HANA, choose Deploy.	Para guardar y desplegar su modelo de ER en SAP HANA, seleccione Deploy (Desplegar).	['save']	{'save': 'guardar'}	['guardar']
17	{'write off': 'ignorar', 'tab': 'pestaña'}	Confirm the write-off action and verify that the selected items have moved from the To Be Billed tab to the To Be Written Off tab.	Confirme la acción de ignorar y verifique que los ítems seleccionados se hayan movido de la pestaña Por Facturar a la pestaña Por Ignorar.	['write off', 'tab']	{'write off': 'ignorar', 'tab': 'pestaña'}	['ignorar', 'pestaña']
18	{'partner': 'socio', 'rule': 'regla'}	You create an installment plan, if there are one or more open items in the contract account of a business partner and the business partner cannot fulfill the payment obligation within the scope of the usual payment rules.	Puede crear un plan de pago aplazado, si hay uno o más importes pendientes de pago en la cuenta de contrato de un socio comercial y dicho socio comercial no puede cumplir la obligación de pago según las normas de pago habituales.	['partner', 'rule']	{'partner': 'socio', 'rule': 'normas'}	['socio', 'norma']
19	{'reset': 'restablecer'}	Defines when the valuation takes place and whether it is reset.	Define cuándo tiene lugar la valoración y si debe reajustarse.	['reset']	{'reset': 'reajustarse'}	['reajustar']
20	{'category': 'tipo'}	Choose Service Part Items as the item category from the Show dropdown list.	"Seleccione ""Piezas de repuesto"" como la categoría de elementos en la lista desplegable ""Mostrar""."	['category']	{'category': 'categoría'}	['categoría']
21	{'schedule': 'programación'}	To filter for order operations that are included in a specific schedule, add the Included in Schedule filter to the filter bar.	Para filtrar según las operaciones incluidas en una programación específica, añada el filtro “Incluidas en la programación” a la barra de filtros.	['schedule']	{'schedule': 'programación'}	['programación']
22	{'edit': 'editar'}	You can only edit headers for Inactive units.	Solo se pueden editar los encabezados de unidades inactivas.	['edit']	{'edit': 'editar'}	['editar']
23	{'completed': 'concluido'}	This overview contains all repair objects that have not been completed yet.	Esta vista general contiene todos los objetos de reparación que no se han completado aún.	['completed']	{'completed': 'completado'}	['completar']
24	{'pause': 'interrumpir'}	Pause real-time replication to enable editing connection properties.	Pausar la replicación en tiempo real para permitir editar las propiedades de conexión	['pause']	{'pause': 'Pausar'}	['pausar']
25	{'use': 'utilizar'}	Save your business entity to make it available for use in fact models and consumption models.	Guarda tu entidad comercial para utilizarla en modelos de hechos y modelos de consumo.	['use']	{'use': 'utilizarla'}	['utilizar']
26	{'schedule': 'programación'}	This means that the work center change is only visible in your schedule and is not yet saved in the maintenance order.	Esto significa que el cambio de centro de trabajo solo se muestra en la programación y aún no se ha registrado en la orden de mantenimiento.	['schedule']	{'schedule': 'programación'}	['programación']
27	{'delete': 'eliminar'}	To delete an activation key, click the first column of the corresponding row and then Delete.	Para borrar una clave de activación, haga clic en la primera columna de la fila correspondiente y, después, haga clic en Eliminar.	['delete']	{'delete': 'Eliminar'}	['eliminar']
28	{'schedule': 'calendario'}	Modify your order schedules to prioritize overdue or late orders.	Modificar los horarios de pedidos para dar prioridad a los pedidos pendientes o atrasados.	['schedule']	{'schedule': 'horarios'}	['horario']
29	{'work center': 'puesto de trabajo'}	Reviewers do not require any work center assignment.	Los revisores no requieren ninguna asignación a un centro de trabajo.	['work center']	{'work center': 'centro de trabajo'}	['centro de trabajo']
30	{'customer': 'deudor'}	For correspondence with the customer/supplier	Para la correspondencia con el cliente/proveedor	['customer']	{'customer': 'cliente'}	['cliente']
31	{'range': 'intervalo'}	Within a time range	Dentro de un intervalo de tiempo	['range']	{'range': 'intervalo'}	['intervalo']
32	{'delivery': 'entrega'}	Only one data delivery is provided without any additional corrections or updates.	Se proporciona una sola entrega de datos sin correcciones o actualizaciones adicionales.	['delivery']	{'delivery': 'entrega'}	['entrega']
33	{'processing': 'procesamiento'}	If the credit memos are processed successfully, the system posts a document during the processing of the payment advice note by means of the amount credited and, if necessary, charges are posted.	Si las notas de abono se procesan correctamente, durante el procesamiento del comprobante de pago, el sistema carga un documento con el importe de la nota de abono y, si procede, los cargos.	['processing']	{'processing': 'procesamiento'}	['procesamiento']
34	{'upgrade': 'upgrade'}	Post-upgrade test processes	Tras el upgrade:	['upgrade']	{'upgrade': 'upgrade'}	['upgrade']
35	{'tab': 'pestaña'}	You can see these items on the To Be Written Off  tab and verify that they're non-billable by looking at the Billing Control Category column.	Puede ver estos elementos en la pestaña «To Be Written Off» y verificar que no sean facturables al revisar la columna «Billing Control Category».	['tab']	{'tab': 'pestaña'}	['pestaña']
36	{'recurrence pattern': 'patrón de repetición'}	Define Recurrence Pattern	Definir Patrón de Recurrencia	['recurrence pattern']	{'recurrence pattern': 'Patrón de Recurrencia'}	['patrón de recurrencia']
37	{'public': 'pública'}	To directly consume data in data flows, the Oracle database must be available on the public internet.	Para poder consumir de forma directa datos en flujos de datos, la base de datos Oracle debe estar disponible en la Internet pública.	['public']	{'public': 'pública'}	['público']
38	{'schedule': 'plan'}	Shows that the object will be activated automatically during the next scheduled data aging run for this object and the aging run is not scheduled for the selected data aging object.	Indica que el objeto se activará automáticamente durante la próxima operación de envejecimiento de datos programada para este objeto, y la ejecución del envejecimiento no está programada para el objeto de envejecimiento de datos seleccionado.	['schedule']	{'schedule': 'programada'}	['programado']
39	{'save': 'guardar'}	Please note that date and time are not included when you save a filter variant.	Ten en cuenta que la fecha y hora no se incluyen cuando guardas una variante de filtro.	['save']	{'save': '▔'}	['▔']
40	{'default': 'predefinir'}	The attribute can be used to identify bank accounts that belong to the same defaultable counterparty.	Este atributo se utiliza para identificar cuentas bancarias que pertenecen a la misma contraparte predefinida.	['default']	{'default': '▔'}	['▔']
41	{'reset': 'restablecer'}	Reset Availability Data	Restablecer los datos de disponibilidad	['reset']	{'reset': 'Restablecer'}	['restablecer']
42	{'replenishment': 'reaprovisionamiento'}	The signal for replenishment is issued by an indicator, that is sent by a demand source (consumer) to the supply source (supplier).	La señal para reabastecimiento se emite por medio de un indicador que es enviado por una fuente de demanda (el consumidor) a la fuente de suministro (el proveedor).	['replenishment']	{'replenishment': 'reabastecimiento'}	['reabastecimiento']
43	{'tab': 'pestaña'}	Check the objects on the Business Builder and Data Builder tabs.	Consulte los objetos en las pestañas Generador de negocio y Generador de datos.	['tab']	{'tab': 'pestañas'}	['pestaña']
44	{'template': 'modelo'}	You can create a new template by specifying the content type, governing law, and language.	Puedes crear una nueva plantilla al especificar el tipo de contenido, la ley aplicable y el idioma.	['template']	{'template': 'plantilla'}	['plantilla']
45	{'process': 'procesar'}	You can define one or more preconditions that must be met before the credit memo request workflow can be processed.	Puede definir una o más condiciones previas que deben estar cumplidas para que el flujo de trabajo de solicitud de abono se pueda procesar.	['process']	{'process': 'procesar'}	['procesar']
46	{'job': 'job'}	To change scheduled jobs	Para cambiar tareas programadas	['job']	{'job': 'tareas'}	['tarea']
47	{'recurrence pattern': 'patrón de repetición'}	Define the recurrence pattern, such as daily or weekly	Defina el patrón de repetición, por ejemplo, diaria o semanalmente	['recurrence pattern']	{'recurrence pattern': 'patrón de repetición'}	['patrón de repetición']
48	{'tab': 'pestaña'}	Use the tabs in the Data Preview panel to review and process the results.	Utilice las pestañas del panel Vista previa de datos para examinar y procesar los resultados.	['tab']	{'tab': 'pestañas'}	['pestaña']
49	{'completed': 'concluido'}	When you're displaying service confirmations assigned to a standard service order, you can use this button to release service confirmations that have status Completed for billing.	"Al visualizar las confirmaciones de servicio asignadas a una orden de servicio estándar, puede utilizar este botón para liberar las confirmaciones de servicio que tienen el estado ""Completado"" para su facturación."	['completed']	{'completed': 'Completado'}	['completado']
50	{'reporting': 'informes'}	It provides a consolidation view along this segment hierarchy by populating the Segment Eliminated reporting dimension.	"Ofrece una vista de consolidación a lo largo de la jerarquía de segmentos, mediante la asignación de valores a la dimensión de informes ""Segment Eliminated"" (Segmento eliminado)."	['reporting']	{'reporting': 'informes'}	['informe']
51	{'save as': 'guardar como'}	Save As New Version:(Available for templates and text blocks)	Guardar como nueva versión: (Disponible para plantillas y bloques de texto)	['save as']	{'save as': 'nueva versión'}	['nuevo versión']
52	{'search result': 'resultado del proceso de búsqueda'}	You can use this field to filter your search results for the latest bank statements that you have received from your house bank accounts.	Puedes usar este campo para filtrar los resultados de tu búsqueda por los últimos extractos bancarios que hayas recibido de tus cuentas bancarias.	['search result']	{'search result': 'resultados'}	['resultado']
53	{'schedule': 'programación'}	A schedule task is defined for this data flow.	Se ha definido una tarea programada para este flujo de datos.	['schedule']	{'schedule': 'programada'}	['programado']
54	{'job': 'job'}	To change scheduled jobs, do the following:	Para modificar tareas programadas, haga lo siguiente:	['job']	{'job': 'tareas'}	['tarea']
55	{'customer': 'deudor'}	Customer/supplier branch number	Número de sucursal del cliente/proveedor	['customer']	{'customer': 'cliente'}	['cliente']
56	{'recurrence pattern': 'patrón de repetición'}	Define the recurrence pattern of the job.	Defina el patrón de repetición del job.	['recurrence pattern']	{'recurrence pattern': 'patrón de repetición'}	['patrón de repetición']
57	{'substitute': 'suplente'}	Define your personal settings for email notifications and substitutes.	Defina sus opciones de configuración personal para las notificaciones de correo electrónico y para los suplentes.	['substitute']	{'substitute': 'suplentes'}	['suplente']
58	{'review': 'revisión'}	Set fuzzy match scores to decide when to place input records in the Matched and Review results categories.	Configure puntuaciones de coincidencia difusa para determinar cuándo colocar los registros introducidos en las categorías Resultados Coincidentes y Resultados Revisados.	['review']	{'review': 'Revisados'}	['revisados']
59	{'feature': 'característica'}	Find further information on the Extended Statistics feature in the product assistance.	Encontrará más información sobre la función Extended Statistics en la sección Ayuda del producto.	['feature']	{'feature': 'función'}	['función']
60	{'customer': 'deudor'}	As a search criterion for items in the customer/supplier account	Como criterio de búsqueda para partidas en la cuenta de cliente/proveedor	['customer']	{'customer': 'cliente'}	['cliente']
61	{'call': 'llamada', 'tab': 'etiqueta'}	The variables are different for the different data source called to for the charts of a tab.	Las variables son diferentes para cada fuente de datos llamada para los gráficos de una pestaña.	['call', 'tab']	{'call': 'llamada', 'tab': 'pestaña'}	['llamar', 'pestaña']
62	{'replication': 'reproducción'}	Required Permissions for Oracle Trigger-Based Replication in the SAP HANA Smart Data Integration and SAP HANA Smart Data Quality Installation and Configuration Guide	Permisos necesarios para la replicación basada en desencadenadores de Oracle en la Guía de instalación y configuración de integración de datos inteligente y calidad de datos inteligente de SAP HANA	['replication']	{'replication': 'replicación'}	['replicación']
63	{'set': 'definir'}	If you lock a release which is not the latest release, all releases which have been published after the release of the locked release are also set to locked.	Si se bloquea una versión que no sea la versión más reciente, todas las versiones que se hayan publicado después de la versión bloqueada también se bloquearán.	['set']	{'set': 'bloquearán'}	['bloquearán']
64	{'change': 'modificación'}	You need to re-deploy your intelligent lookup each time your make a change to it.	Necesitará volver a desplegar la función de búsqueda inteligente cada vez que realice un cambio.	['change']	{'change': 'cambio'}	['cambio']
65	{'delete': 'eliminar'}	Delete an Activation Key	Borrar una clave de activación	['delete']	{'delete': 'Borrar'}	['borrar']
66	{'add': 'añadir'}	Click the Edit button to add or delete buttons or change column names and data types.	Haz clic en el botón Editar para agregar o eliminar botones o cambiar los nombres de las columnas o los tipos de datos.	['add']	{'add': 'agregar'}	['agregar']
67	{'account assignment': 'imputación', 'partner': 'socio', 'default': 'predefinir'}	You specify a defaultable business partner for banks when using bank reconciliation accounts in G/L account assignment.	Puede predefinirse una empresa asociada para un banco al utilizar las cuentas de conciliación bancarias en la asignación de las cuentas de mayor.	['account assignment', 'partner', 'default']	{'account assignment': 'asignación cuentas', 'partner': '▔', 'default': 'predefinirse'}	['asignación cuenta', '▔', 'predefinir']
68	{'write off': 'ignorar'}	On the To Be Billed tab, select one or more items as required and choose Write Off.	En la pestaña Para Facturar, seleccione uno o más artículos según sea necesario y elija Liquidar Cuenta.	['write off']	{'write off': 'Liquidar Cuenta'}	['liquidar contar']
69	{'measure': 'indicador'}	Select a type of measure and define the properties.	Seleccione el tipo de medida y defina sus propiedades.	['measure']	{'measure': 'medida'}	['medida']
70	{'transaction': 'operación', 'customer': 'deudor'}	Transaction number under which a controversial transaction is managed at the customer/supplier	Número de transacción con el que se gestiona una transacción conflictiva a nivel de deudor/acreedor	['transaction', 'customer']	{'transaction': 'transacción', 'customer': 'deudor'}	['transacción', 'deudor']
71	{'record': 'registro'}	The RECORD COUNT type is a table-wide statistic.	El tipo RECORD COUNT es una estadística que abarca toda la tabla.	['record']	{'record': 'RECORD'}	['record']
72	{'header': 'cabecera'}	Click the column header in the table area.	Hacer clic en el encabezado de la columna en el área de la tabla.	['header']	{'header': 'encabezado'}	['encabezado']
73	{'performance': 'rendimiento'}	At the performance obligation level they are calculated as follows:	A nivel de la obligación de desempeño, se calculan de la siguiente forma:	['performance']	{'performance': 'desempeño'}	['desempeño']
74	{'worklist': 'lista de trabajo'}	Adds a selected settlement date with the settlement status Open, Due, Due Today, or Overdue to a scheduling worklist to schedule the settlement of the selected settlement date.	Agrega una fecha de liquidación seleccionada con el estado de liquidación Abierto, Pendiente, Pendiente hoy o Fecha límite, a una lista de trabajo de programación para programar el proceso de liquidación de la fecha de liquidación seleccionada.	['worklist']	{'worklist': 'lista de trabajo'}	['lista de trabajo']
75	{'type': 'tipo'}	If you want the automated reprocessing rule to post your bank statement items in only one step, select 001 (One-Step Posting) as the value of the Procedure Type field.	Si desea que la regla automática de reprocesamiento contabilice los elementos del extracto bancario en un solo paso, seleccione 001 (Contabilización en un paso) como valor del campo Tipo de procedimiento.	['type']	{'type': 'procedimiento'}	['procedimiento']
76	{'tab': 'pestaña'}	In the pane on the right, check the objects on the Business Builder and Data Builder tabs:	En el panel de la derecha, verifique los objetos en las pestañas Constructor de negocio y Constructor de datos:	['tab']	{'tab': 'pestañas'}	['pestaña']
77	{'schedule': 'programación'}	If the operation is included in one schedule, the schedule opens directly.	Si la operación está incluida en una agenda, se abre la agenda directamente.	['schedule']	{'schedule': 'agenda'}	['agenda']
78	{'worklist': 'lista de trabajo'}	The new Manage Fixed Assets card replaces the Asset Master Worklist card from previous versions.	La nueva ficha Manage Fixed Assets (Administrar activos fijos) sustituye a la ficha Asset Master Worklist (Lista de trabajo principal de activos) de versiones anteriores.	['worklist']	{'worklist': 'Lista de trabajo'}	['lista de trabajo']
79	{'add': 'añadir'}	Add or remove columns to the overview	Agregar o eliminar columnas del resumen	['add']	{'add': 'Agregar'}	['agregar']
80	{'allocation': 'imputación'}	Use this function to download a preformatted CSV file template that you can use to create new allocation cycles and segments or edit existing ones.	Use esta función para descargar una plantilla de CSV previamente formateada que puede usar para crear nuevos ciclos y segmentos de asignación o modificar los que ya existen.	['allocation']	{'allocation': 'asignación'}	['asignación']
81	{'profile page': 'página del perfil'}	The data provider profile page provides additional information about the data provider and other products or product groups.	En la página de perfil del proveedor de datos se ofrece más información sobre el proveedor de datos y sobre otros productos o grupos de productos.	['profile page']	{'profile page': 'página de perfil'}	['página de perfil']
82	{'allocation': 'imputación'}	You can only use it with the cost center and profit center allocation contexts.	Solo puede usarse en contextos de asignación de centro de gastos y centro de beneficios.	['allocation']	{'allocation': 'asignación'}	['asignación']
83	{'partner': 'socio'}	You can maintain Sales Area Details, Sales Taxes, and Partner Functions.	Se pueden mantener los detalles del área de ventas, impuestos sobre las ventas y funciones de los partners.	['partner']	{'partner': 'partners'}	['partners']
84	{'incident': 'incidencia'}	The incident ID is empty for SAP support user access with the Operations access category.	"El ID de incidencia está vacío para el acceso de usuarios de soporte de SAP con la categoría de acceso ""Operaciones""."	['incident']	{'incident': 'incidencia'}	['incidencia']
85	{'consumption': 'compensación', 'allocation': 'contingente'}	Displays data for allocation periods in which allocation consumption is below 20%.	Muestra datos para los periodos de asignación en los que el consumo de asignación es inferior al 20 %	['consumption', 'allocation']	{'consumption': 'consumo', 'allocation': 'asignación'}	['consumo', 'asignación']
86	{'assembly': 'conjunto', 'icon': 'icono'}	The Information icon appears if any or all of following exists for an assembly:	El icono Información aparece si se cumple alguna o todas de las condiciones siguientes para un ensamblaje:	['assembly', 'icon']	{'assembly': 'ensamblaje', 'icon': 'Información'}	['ensamblaje', 'información']
87	{'delete': 'eliminar'}	To delete a mapping, click the link and then click the Delete tool.	Para eliminar una asignación, haga clic en el enlace y seleccione la herramienta Eliminar.	['delete']	{'delete': 'Eliminar'}	['eliminar']
88	{'sorting': 'orden'}	Using filters, search, or sorting, you can quickly find the connection type.	Utilice filtros, búsqueda u ordenación para encontrar rápidamente el tipo de conexión.	['sorting']	{'sorting': 'ordenación'}	['ordenación']
89	{'job': 'job'}	The Number of Jobs and Package Size fields are deactivated and not relevant for this job.	Los campos Número de trabajos y Tamaño de paquete están desactivados y no son relevantes para este trabajo.	['job']	{'job': 'trabajo'}	['trabajo']
90	{'client': 'cliente'}	Enter the system client number.	Introduzca el número de cliente del sistema.	['client']	{'client': 'cliente'}	['cliente']
91	{'report': 'report'}	If you choose No, the system will exclude from the list report all billing elements with prepayment items.	Si se elige No, el sistema excluirá de la report list todos los elementos de facturación que incluyan elementos de prepago.	['report']	{'report': 'list'}	['list']
92	{'job': 'tarea'}	If you change the ID, a background job will be created.	Si cambias el ID se creará un job en background.	['job']	{'job': 'job'}	['job']
