	terms	src_raw	mt_raw	src_terms	alg_terms	norm_tgt_terms
332	{'data replication': 'репликация данных'}	The initial data replication is completed.	Первоначальная репликация данных завершена.	['data replication']	{'data replication': 'репликация данных'}	['репликация данные']
333	{'payment': 'платеж'}	Payment of A⁄P pro forma invoice	Оплата предварительной (проформа) счета-фактуры	['payment']	{'payment': 'Оплата'}	['оплата']
334	{'alert': 'сигнал'}	Alert type assigned to the alert:	Тип оповещения, присвоенный оповещению:	['alert']	{'alert': 'оповещения'}	['оповещение']
335	{'type': 'вид'}	Supported Contract Types	Поддерживаемые виды договоров	['type']	{'type': 'виды'}	['вид']
336	{'type': 'тип'}	Displays the defined filters for run types.	Показывает настроенные фильтры для типов запуска.	['type']	{'type': 'типов'}	['тип']
337	{'expiration': 'истечение срока', 'contract': 'контракт'}	Expiration of Contract	Истечение действия договора	['expiration', 'contract']	{'expiration': 'Истечение', 'contract': '▔'}	['истечение', '▔']
338	{'validity start date': 'начало срока действия'}	Validity Start Date	Дата начала действия 	['validity start date']	{'validity start date': 'Дата начала действия'}	['дата начало действие']
339	{'edit': 'редактировать'}	Choose Edit Parameters.	Выберите «Редактировать параметры».	['edit']	{'edit': 'Редактировать'}	['редактировать']
340	{'contract': 'контракт'}	Specifies the number of the contract item that provides the required service.	Указывает номер позиции договора, в рамках которой будет оказываться требуемая услуга.	['contract']	{'contract': 'договора'}	['договор']
341	{'type': 'тип'}	The available hierarchy types include the following:	Среди доступных типов иерархии есть следующие:	['type']	{'type': 'типов'}	['тип']
342	{'usage category': 'категория использования'}	Billing Plan Usage Category	Категория использования тарифного плана.	['usage category']	{'usage category': 'Категория использования'}	['категория использование']
343	{'Activities': 'Операции'}	Activities for Destinations	Деятельность по продвижению направлений туризма	['Activities']	{'Activities': 'Деятельность'}	['деятельность']
344	{'supplier ID': 'идентификатор поставщика'}	Indicates the supplier ID.	Указывает идентификатор поставщика.	['supplier ID']	{'supplier ID': 'идентификатор поставщика'}	['идентификатор поставщик']
345	{'type': 'вид'}	You can select the type of industry here.	Здесь можно выбрать отрасль.	['type']	{'type': 'отрасль'}	['отрасль']
346	{'type': 'тип'}	You can define rate elements of the following rating types:	Вы можете определить элементы оценки следующих типов:	['type']	{'type': 'типов'}	['тип']
347	{'service confirmation': 'подтверждение сервиса'}	Displays service order items and service confirmation items by release status for billing	Выводит заказы на услуги и подтверждения выполнения заказов по статусу исполнения для выставления счетов	['service confirmation']	{'service confirmation': 'подтверждения'}	['подтверждение']
348	{'allocation': 'распределение'}	Standalone Selling Price-Weighted Allocation	Привязка по цене продажи (Standalone Selling Price-Weighted Allocation)	['allocation']	{'allocation': 'Привязка'}	['привязка']
349	{'allocation': 'перерасчет'}	Allocation Cost Eelement	Элемент распределения затрат	['allocation']	{'allocation': 'распределения'}	['распределение']
350	{'get': 'получить'}	Select Get Values.	Выбрать Получить значения.	['get']	{'get': 'Получить'}	['получить']
351	{'action': 'операция'}	This is the main action.	Это главный сюжет.	['action']	{'action': 'сюжет'}	['сюжет']
352	{'input': 'вход'}	Input Parameters and Result Parameters	Вводные и выходные параметры	['input']	{'input': 'Вводные'}	['вводный']
353	{'copy': 'скопировать'}	Copy Return Items	Сделать копию возвращаемого товара	['copy']	{'copy': 'копию'}	['копия']
354	{'type': 'вид'}	Creating eDocument Types	Создание типов eDocument	['type']	{'type': 'типов'}	['тип']
355	{'Personal Information': 'личная информация'}	Personal Information tab	Вкладка «Личная информация»	['Personal Information']	{'Personal Information': 'Личная информация'}	['личный информация']
356	{'claim': 'страховой случай'}	Select the claim to view details.	Выберите иск для просмотра его подробностей.	['claim']	{'claim': 'иск'}	['иск']
357	{'contract': 'контракт'}	Manage Sales Contracts	Управление коммерческими контрактами	['contract']	{'contract': 'контрактами'}	['контракт']
358	{'edit': 'редактировать'}	Choose Edit Orders.	Выберите «Редактировать заказы».	['edit']	{'edit': 'Редактировать'}	['редактировать']
359	{'provider': 'провайдер'}	Name of the trusted identity provider	Название доверенного поставщика идентификационных данных	['provider']	{'provider': 'поставщика'}	['поставщик']
360	{'go to': 'переход'}	Accrual objects that have been review confirmed go to the Review Finished status.As the review process is not required, you can still post accrual objects directly that need reviewing but haven't been reviewed.	Объекты начислений, которые прошли проверку, переходят в статус «Проверка выполнена». Поскольку процесс проверки не требуется, можно напрямую размещать объекты начислений, которые нужно проверить, но которые не были проверены.	['go to']	{'go to': 'переходят'}	['переходить']
361	{'process': 'обработать'}	You can use the warehouse task link to navigate to warehouse tasks in the new Process Warehouse Tasks - Putaway app.	Для перехода к складским задачам в приложении «Process Warehouse Tasks — Putaway» можно воспользоваться ссылкой «Складские задачи».	['process']	{'process': 'Process'}	['process']
362	{'controller': 'оператор'}	You can assign multiple data controllers to the same business partner.	Вы можете назначить несколько обработчиков данных для одного и того же делового партнера.	['controller']	{'controller': 'обработчиков'}	['обработчик']
363	{'Activities': 'действия'}	You can perform the following activities on imported procurement schedules:	На импортированных графиках закупок можно выполнять следующие действия:	['Activities']	{'Activities': 'действия'}	['действие']
364	{'purpose': 'назначение'}	Specifies the purpose of a document that is assigned to a legal transaction.	Указывает назначение документа, прикреплённого к правовой транзакции.	['purpose']	{'purpose': 'назначение'}	['назначение']
365	{'change': 'изменение'}	Change the priority of an authorization characteristic	Изменение приоритета характеристики авторизации	['change']	{'change': 'Изменение'}	['изменение']
366	{'withholding tax': 'налог на источники дохода'}	Withholding Tax at Row Level	Подоходный налог на уровне ряда	['withholding tax']	{'withholding tax': 'Подоходный налог'}	['подоходный налог']
367	{'assignment': 'назначение'}	Pending PO Assignment	В ожидании назначения ОП	['assignment']	{'assignment': 'назначения'}	['назначение']
368	{'service': 'услуга'}	Service in Bank Statement	Сервис в банке (в выписке)	['service']	{'service': 'Сервис'}	['сервис']
369	{'space': 'пространство'}	Create and delete Spaces	Создание и удаление пространств	['space']	{'space': 'пространств'}	['пространство']
370	{'action': 'операция'}	Workflow Event Action	Акцию события рабочего процесса	['action']	{'action': 'Акцию'}	['акция']
371	{'attach': 'вложить'}	You can attach files or links to the object.	К объекту можно прикреплять файлы или ссылки.	['attach']	{'attach': 'прикреплять'}	['прикреплять']
372	{'payment': 'оплата'}	Indicates the address to which payment is sent.	Указывает адрес, на который направляется платеж.	['payment']	{'payment': '▔'}	['▔']
373	{'output': 'вывод'}	You can generate output using the following:	Для генерации результатов можно использовать следующее:	['output']	{'output': 'результатов'}	['результат']
374	{'activity': 'операция'}	The activity can invite both internal and external users.	К активности можно пригласить как внутренних, так и внешних пользователей.	['activity']	{'activity': 'активности'}	['активность']
375	{'input': 'ввод'}	Select your input entity:	Выберите источник данных:	['input']	{'input': 'данных'}	['данные']
376	{'input': 'ввод'}	Input data such as the following:	Введите данные, такие как следующие:	['input']	{'input': 'Введите'}	['ввести']
377	{'use': 'использование'}	Use Currency Conversion	Используйте конвертер валют	['use']	{'use': 'Используйте'}	['использовать']
378	{'change': 'изменение'}	These dates can't be changed.	Эти даты нельзя изменить.	['change']	{'change': 'изменить'}	['изменить']
379	{'type': 'тип'}	Displays the assigned actions for run types.	Отображает действия, назначенные для типов запуска.	['type']	{'type': 'типов'}	['тип']
380	{'type': 'вид'}	Filter by Document Type	Фильтр по типу документа	['type']	{'type': 'тип'}	['тип']
381	{'change': 'изменить'}	Change Material Substitution	Замена материала.	['change']	{'change': 'Замена'}	['замена']
382	{'transport': 'транспорт'}	Application Help for Transport	Помощь при использовании приложения для транспорта	['transport']	{'transport': 'транспорта'}	['транспорт']
383	{'carrier': 'перевозчик'}	Information for carriers:	Информация для перевозчиков:	['carrier']	{'carrier': 'перевозчиков'}	['перевозчик']
384	{'connection': 'подключение'}	As a prerequisite, you must have already set up the connection to the ERP using Connection Management app.	В качестве предварительного условия необходимо настроить подключение к ERP с помощью приложения Connection Management.	['connection']	{'connection': 'подключение'}	['подключение']
385	{'process': 'обработать'}	To process customer payments by credit card proceed as follows:	Для обработки оплаты клиента с помощью кредитной карты выполните следующие действия:	['process']	{'process': 'обработки'}	['обработка']
386	{'activate': 'активировать'}	Create and activate a business rule	Создайте и активируйте бизнес-правило	['activate']	{'activate': 'активируйте'}	['активировать']
387	{'provider': 'провайдер'}	The name of the data provider company.	Название компании, предоставляющей данные.	['provider']	{'provider': 'предоставляющей'}	['предоставлять']
388	{'total': 'сумма'}	Total Credit Line by Transaction Currency	Общая сумма кредитной линии по валюте транзакции	['total']	{'total': 'Общая'}	['общий']
389	{'controller': 'оператор'}	The data controller component is displayed.	Отображается компонент для управления данными.	['controller']	{'controller': 'управления'}	['управление']
390	{'confirmation control key': 'управляющий ключ подтверждения'}	Enables you to select the confirmation control key.	Позволяет выбрать клавишу подтверждения.	['confirmation control key']	{'confirmation control key': 'клавишу подтверждения'}	['клавиша подтверждение']
391	{'reconcile': 'выполнить выверку'}	With this app, you can manually reconcile intraday bank statement flows with forecasted cash flows.	С помощью этого приложения вы можете вручную провести сверку внутридневных банковских операций с прогнозируемыми движениями денежных средств.	['reconcile']	{'reconcile': 'провести сверку'}	['провести сверка']
392	{'type': 'тип'}	Choose Assessment Type	Выбрать тип оценки	['type']	{'type': 'тип'}	['тип']
393	{'provider': 'провайдер'}	The data provider's ZIP code.	Информация о поставщике данных (ZIP-код).	['provider']	{'provider': 'поставщике'}	['поставщик']
394	{'type': 'тип'}	Relevant Order Type	Релевантная форма заказа	['type']	{'type': 'форма'}	['форма']
395	{'consumption': 'расход'}	Consumption in Month	Месячный объем потребления	['consumption']	{'consumption': 'потребления'}	['потребление']
396	{'category': 'категория'}	Stamp Duty Category	Классификация гербового сбора	['category']	{'category': 'Классификация'}	['классификация']
397	{'pause': 'приостановка'}	Pause and Resume	Pause and Resume	['pause']	{'pause': 'Pause'}	['pause']
398	{'type': 'тип'}	Enter the type of document.	Указать тип документа.	['type']	{'type': 'тип'}	['тип']
399	{'transport': 'транспорт'}	Viewing Transport Requests	Просмотр запросов на перевозку	['transport']	{'transport': 'перевозку'}	['перевозка']
400	{'tab': 'вкладка'}	Work Agreement Tab	Раздел «Договор о работе»	['tab']	{'tab': 'Раздел'}	['раздел']
401	{'type': 'тип'}	There are six types of Constant expressions:	Существует шесть типов выражений с постоянными значениями:	['type']	{'type': 'типов'}	['тип']
402	{'workflow': 'рабочий процесс'}	The following example describes a possible workflow:	Приведенный ниже пример описывает возможный рабочий процесс:	['workflow']	{'workflow': 'рабочий процесс'}	['рабочий процесс']
403	{'collection agency': 'коллекторское агентство'}	Send Update to Collection Agency	Отправить уведомление в агентство по сбору задолженностей	['collection agency']	{'collection agency': 'агентство задолженностей'}	['агентство задолженность']
404	{'type': 'вид'}	This is the default attachment type.	Это тип прикрепляемого файла по умолчанию.	['type']	{'type': 'тип'}	['тип']
405	{'type': 'тип'}	Activity Type Description	Описание типа активности	['type']	{'type': 'типа'}	['тип']
406	{'client': 'клиент'}	Corresponding DataSource (for use in SAP Analytics Cloud and analytical clients)	Соответствующий источник данных (для использования в SAP Analytics Cloud и в аналитических клиентах)	['client']	{'client': 'клиентах'}	['клиент']
407	{'category': 'категория'}	Billing Plan Category - Text	Категория тарифного плана «Текст»	['category']	{'category': 'Категория'}	['категория']
408	{'edit': 'редактировать'}	You can also edit or download a virtual document.	Также вы можете отредактировать виртуальный документ или скачать его.	['edit']	{'edit': 'отредактировать'}	['отредактировать']
409	{'characteristic': 'характеристика'}	Creation, update, and deletion of characteristics	Создание, обновление и удаление свойств	['characteristic']	{'characteristic': 'свойств'}	['свойство']
410	{'release': 'деблокировать'}	Release (Document OK)	Release (Документ готов)	['release']	{'release': '▔'}	['▔']
411	{'analytics chart': 'аналитическая диаграмма'}	Analytics Chart 1	Диаграмма 1. Анализ данных	['analytics chart']	{'analytics chart': 'Диаграмма данных'}	['диаграмма данные']
412	{'provider': 'поставщик'}	Filter by Provider	Фильтр по провайдеру	['provider']	{'provider': 'провайдеру'}	['провайдер']
413	{'assigned': 'присвоенный'}	Semantic Tag Assigned	Выдан семантический тег	['assigned']	{'assigned': 'Выдан'}	['выдать']
414	{'run type': 'тип прогона'}	Displays whether a run type is enabled.	Показывает, разрешен ли данный тип запуска.	['run type']	{'run type': 'тип запуска'}	['тип запуск']
415	{'exit': 'выход'}	Add an exit condition.	Добавьте условие выхода из программы.	['exit']	{'exit': 'выхода'}	['выход']
416	{'data provider': 'провайдер данных'}	The country where the data provider is located.	Страна, в которой расположен поставщик данных.	['data provider']	{'data provider': 'поставщик данных'}	['поставщик данные']
417	{'account': 'счет'}	Search for account information	Поиск данных об аккаунте	['account']	{'account': 'аккаунте'}	['аккаунт']
418	{'check': 'проверка'}	Check Service Contract Actuals	Проверьте фактическое исполнение условий сервисного контракта	['check']	{'check': 'Проверьте'}	['проверить']
419	{'type': 'вид'}	You can view orders based on any of the following industry type:	Вы можете просматривать заказы, основываясь на любом из следующих типов отраслей:	['type']	{'type': 'типов'}	['тип']
420	{'maintain': 'выполнять ведение'}	Allows you to maintain the story details.	Позволяет сохранять детали сюжета.	['maintain']	{'maintain': 'сохранять'}	['сохранять']
421	{'location structure': 'структура местоположений'}	With this app, you can edit the location structure.	Приложение позволяет редактировать структуру местоположений.	['location structure']	{'location structure': 'структуру местоположений'}	['структура местоположение']
422	{'compliance': 'соответствие'}	For more information about integreting with contract compliance, see .	Более подробную информацию об интеграции с соблюдением условий договора смотрите по адресу .	['compliance']	{'compliance': 'соблюдением'}	['соблюдение']
423	{'topic': 'раздел'}	This topic describes the G/L account renumbering process.	В данном разделе описан процесс переименования учетных записей G/L.	['topic']	{'topic': 'разделе'}	['раздел']
424	{'compensation': 'возмещение'}	Specifies how customer compensation is to be processed.	Определяет порядок обработки компенсаций для клиентов.	['compensation']	{'compensation': 'компенсаций'}	['компенсация']
425	{'pricing procedure': 'схема калькуляции'}	Pricing Procedure PP1	Процедура ценообразования ПП1	['pricing procedure']	{'pricing procedure': 'Процедура ценообразования'}	['процедура ценообразование']
426	{'assembly': 'сборка'}	Assembly in Process	Сборка в процессе работы.	['assembly']	{'assembly': 'Сборка'}	['сборка']
427	{'tab': 'вкладка'}	Default values tab page:	"Страница вкладки ""Стандартные значения"":"	['tab']	{'tab': 'вкладки'}	['вкладка']
428	{'edit': 'обработать'}	Edit Safety Observation	Редактировать замечания по безопасности	['edit']	{'edit': 'Редактировать'}	['редактировать']
429	{'pattern': 'шаблон'}	Set when the recurrence pattern ends:	Установить время завершения шаблона повторения:	['pattern']	{'pattern': 'шаблона'}	['шаблон']
430	{'type': 'тип'}	External Document Type	Тип внешнего документа	['type']	{'type': 'Тип'}	['тип']
431	{'transaction': 'движение'}	Transaction in the past	Сделка, совершенная в прошлом.	['transaction']	{'transaction': 'Сделка'}	['сделка']
432	{'stop': 'остановка'}	Stop Manual Forecasting	Прекратить ручное прогнозирование	['stop']	{'stop': 'Прекратить'}	['прекратить']
433	{'tab': 'вкладка'}	Budget Adjustments Tab	Вкладка «Внесение корректировок в бюджет»	['tab']	{'tab': 'Вкладка'}	['вкладка']
434	{'activate': 'активировать'}	Activate a supplier list that is in preparation.	Активируйте список поставщиков, который находится на стадии подготовки.	['activate']	{'activate': 'Активируйте'}	['активировать']
435	{'contract': 'контракт'}	Contract for Limit determines the price per unit for each item in the service entry sheet.	В контракте по лимиту определяется цена за единицу для каждой позиции в листе учета оказанных услуг.	['contract']	{'contract': 'контракте'}	['контракт']
436	{'edit': 'редактировать'}	You can also edit these tasks with the following exceptions:	Вы также можете редактировать эти задания, но с некоторыми ограничениями:	['edit']	{'edit': 'редактировать'}	['редактировать']
437	{'wizard': 'мастер'}	New resource wizards	Новые мастера по управлению ресурсами	['wizard']	{'wizard': 'мастера'}	['мастер']
438	{'object category': 'тип объекта'}	Purchasing Object Category	Категория объекта закупки	['object category']	{'object category': 'Категория объекта'}	['категория объект']
