	terms	src_raw	mt_raw	src_terms	alg_terms	norm_tgt_terms
0	{'pane': 'область'}	To add notes, choose a template and open the Notes pane on the left side of the screen.	Чтобы добавить заметки, выберите шаблон и откройте панель заметок слева от экрана.	['pane']	{'pane': 'панель'}	['панель']
1	{'contract': 'контракт'}	Specifies the number of the contract from which you can select service items.	Указывает номер контракта, из которого можно выбрать элементы услуг.	['contract']	{'contract': 'контракта'}	['контракт']
2	{'type': 'вид'}	This field is defaulted to the current date and the Return by date field will be a default number of days, defined in customizing (e.g. 30 days for default document type e-bgs), after the handover date.	Это поле по умолчанию устанавливается в текущую дату, а поле Возврат по дате будет	['type']	{'type': '▔'}	['▔']
3	{'revenue': 'выручка'}	The behavior of this budgetary setting is however differently interpreted for accounts classified as 'Expense'’ or 'Revenue' types.	Поведение этого бюджетного положения тем не менее интерпретируется по-разному для счетов, отнесенных к типам 'Расходы' или 'Доходы'.	['revenue']	{'revenue': 'Доходы'}	['доход']
4	{'update': 'обновить'}	You can select which operations (Create, Update and/or Delete) are allowed for each subnode as well as the root node by ticking the corresponding boxes.	Вы можете выбрать, какие операции (Создать, Изменить и/или Удалить) разрешены для каждого подузла, а также для корневого узла, отметив соответствующие галочки.	['update']	{'update': 'Изменить'}	['изменить']
5	{'range': 'интервал'}	Within a time range	Временного диапазоне	['range']	{'range': 'диапазоне'}	['диапазон']
6	{'provider': 'провайдер'}	You can bookmarks your favorite data products or data providers.	Вы можете закладки свои любимые данные продукты или данные поставщиков.	['provider']	{'provider': 'поставщиков'}	['поставщик']
7	{'provider': 'провайдер'}	The Provider Name must be unique.	Имя поставщика должно быть уникальным.	['provider']	{'provider': 'поставщика'}	['поставщик']
8	{'branch': 'перейти'}	Branching directly to the object pages of the relevant business objects.	Прямое ветвление к страницам объектов соответствующих бизнес-объектов.	['branch']	{'branch': 'ветвление'}	['ветвление']
9	{'type': 'вид'}	Specifies the type of the items that you want to add to your sourcing project.	Указывает тип элементов, которые вы хотите добавить в ваш проект поставок.	['type']	{'type': 'тип'}	['тип']
10	{'input': 'ввод'}	If an input record is matched to more than one lookup records with a score reaching this threshold, it is placed in the Multiple results category.	Если входящая запись соответствует более чем одной записи поиска с оценкой, достигающей этого порога, она помещается в категорию нескольких результатов.	['input']	{'input': 'входящая'}	['входящий']
11	{'type': 'вид'}	If you want the automated reprocessing rule to post your bank statement items in only one step, select 001 (One-Step Posting) as the value of the Procedure Type field.	Если вы хотите, чтобы автоматическая реконструкция правила выставляла ваши банковские счета в только один шаг, выберите 001 (Одноступенчатое выставление) как значение поля Вид процедуры.	['type']	{'type': '▔'}	['▔']
12	{'type': 'вид'}	Depending on your scope, this app can check different types of source documents in your predictive accounting process.	В зависимости от вашего диапазона, это приложение может проверять различные типы исходных документов в вашем прогнозном учетном процессе.	['type']	{'type': 'типы'}	['тип']
13	{'purpose': 'цель'}	As a rule, the purpose references the relevant legal basis for the processing of personal data.	Обычно, цель указывает на соответствующую правовую основу для обработки персональных данных.	['purpose']	{'purpose': 'цель'}	['цель']
14	{'type': 'тип'}	Risk type of this obligation that denotes the risk of the legal document if this obligation is not fulfilled	Тип риска этого обязательства, который обозначает риск документа, если это обязательство не выполнено	['type']	{'type': 'Тип'}	['тип']
15	{'type': 'тип'}	Enter a meaningful code that will help you to identify the clause type.	Введи значимый код, который поможет тебе определить тип положения.	['type']	{'type': 'тип'}	['тип']
16	{'public': 'общедоступный'}	If you're using a network firewall with a proxy, you need to provide the public IPv4 address of your proxy.	Если вы используете сеть с брандмауэром с прокси, необходимо предоставить публичный IPv4-адрес вашего прокси.	['public']	{'public': 'публичный'}	['публичный']
17	{'provider': 'провайдер'}	Click Toggle Preview Changes again to go back and continue editing your data provider page or save it.	Нажмите снова Toggle предпросмотра изменений, чтобы вернуться и продолжить редактирование страницы поставщика данных или сохранить его.	['provider']	{'provider': 'поставщика'}	['поставщик']
18	{'input': 'ввод'}	Select the Projection operator from the toolbar and drop it in the canvas and then connect a sources or other node to it as input.	Выберите оператор проекции из панели инструментов и поместите его на холст, а затем подключите источник или другой узел к нему как вход .	['input']	{'input': 'вход'}	['вход']
19	{'type': 'тип'}	Depending on the contract type and the pricing model used for the data product, different information can be shown:	В зависимости от типа договора и используемого модели оплаты для данных продукта, может отображаться разная информация:	['type']	{'type': 'типа'}	['тип']
20	{'postponed': 'отсрочено'}	Unbilled | Postponed | Write Off	Несписано | Отложено | Списано	['postponed']	{'postponed': 'Отложено'}	['отложить']
21	{'provider': 'провайдер'}	To edit an existing data provider profile, click .	Чтобы отредактировать существующий профиль поставщика данных, нажмите .	['provider']	{'provider': 'поставщика'}	['поставщик']
22	{'regulation': 'предписание'}	If you enter a text and you want to print documents in different languages, select a regulation and navigate to the Classify Dangerous Good - Packaged Product app.	"Если вы вводите текст и хотите распечатать документы на разных языках, выберите регламент и перейдите к приложению ""Классификация опасного вещества - упакованный продукт""."	['regulation']	{'regulation': 'регламент'}	['регламент']
23	{'provider': 'провайдер'}	To set a data provider or data product as a bookmark, just click on the bookmark icon on the corresponding data provider or data product page.	Чтобы установить поставщика данных или продукт данных в закладки, просто нажмите на значок закладки на соответствующей странице поставщика данных или продукта данных.	['provider']	{'provider': 'поставщика'}	['поставщик']
24	{'input': 'ввод'}	The join operator requires two inputs and it generates a single output.	Оператор соединения требует двух входов и он генерирует один выход.	['input']	{'input': 'входов'}	['вход']
25	{'output': 'вывод'}	Adds an Unmatched Record column to the intelligent lookup output.	"Добавляет столбец ""Не совпадающая запись"" в выходные данные умного поиска."	['output']	{'output': 'данные'}	['дать']
26	{'billing': 'расчет'}	In work packages that are billed against a time and expense contract, only billable postings are considered for billing.	В проводках, относящихся к контрактам на оплату за время и расходы, учитываются только проводки, относящиеся к оплачиваемым проводкам.	['billing']	{'billing': 'оплачиваемым'}	['оплачивать']
27	{'explosion': 'разузлование'}	On choosing the Summarized Explosion tab, the table provides the following details:	При выборе вкладки Сводная детонация таблица предоставляет следующие данные:	['explosion']	{'explosion': 'детонация'}	['детонация']
28	{'association': 'связь'}	An association describes the relation between business entities.	Ассоциация описывает отношение между бизнес-сущностями.	['association']	{'association': 'Ассоциация'}	['ассоциация']
29	{'group': 'группировать'}	Select Group By criteria:	Выберите критерии Group By:	['group']	{'group': 'Group'}	['group']
30	{'type': 'вид'}	Some of the notification preferences that you set affect all types of notifications, while others are specific to a notification type.	Некоторые из настроек уведомлений, которые вы устанавливаете, применяются ко всем типам уведомлений, а другие — только к определённому типу уведомления.	['type']	{'type': 'типу'}	['тип']
31	{'contract': 'договор'}	A contract asset is your company’s right to consideration in exchange for goods or services that your company has transferred to a customer when that right is conditioned on something other than the passage of time (for example, your company’s future performance).	Актив контракта — это право вашей компании на получение вознаграждения в обмен на товары или услуги, которые ваша компания передала клиенту, при условии, что это право зависит от чего-либо, кроме прошествия времени (например, будущей производительности вашей компании).	['contract']	{'contract': 'контракта'}	['контракт']
32	{'scope': 'объем'}	The Custom Code Migration app allows you to add or remove request entry points to/from the scope manually.	Приложение Миграция пользовательского кода позволяет добавить или удалить точки входа запроса в/из области вручную.	['scope']	{'scope': 'области'}	['область']
33	{'add-on': 'дополнение'}	SAP Digital Payments Add-On processes the payments and makes them available for the payment advice notes.	СAP цифровых платежей Add-On обрабатывает платежи и делает их доступными для платежных рекомендаций.	['add-on']	{'add-on': 'Add-On'}	['add-on']
34	{'mapping': 'сопоставление'}	If switched on, it indicates that each data record of the currently opened business entity finds a match in the selected target business entity with the configured key mapping.	Если включено, оно указывает на то, что каждая запись данных открытого бизнес-сущности находит соответствие в выбранной целевой бизнес-сущности с настроенным ключевым отображением.	['mapping']	{'mapping': 'отображением'}	['отображение']
35	{'summary': 'сводка'}	Summary of rules and settings that enable allocations.	Краткое описание правил и настроек, обеспечивающих выделения.	['summary']	{'summary': 'описание'}	['описание']
36	{'global currency': 'валюта отчетности'}	Global Currency – The currency that has been configured for the controlling area.	Глобальная валюта – валюта, настроенная для контроллинговой области.	['global currency']	{'global currency': 'Глобальная валюта'}	['глобальный валюта']
37	{'space': 'пространство'}	You can delete audit logs when needed, which will free up disk space.	Вы можете удалить журналы аудита, когда это необходимо, что освободит место на диске.	['space']	{'space': 'место'}	['место']
38	{'edit': 'редактировать'}	Edit, Save and Activate	Редактировать, Сохранить и Активировать	['edit']	{'edit': 'Редактировать'}	['редактировать']
39	{'space': 'пространство'}	Spaces send queries or jobs to the database.	Пространства отправляют запросы или задания в базу данных.	['space']	{'space': 'Пространства'}	['пространство']
40	{'schedule': 'планирование'}	This is why SAP Data Warehouse Cloud has now a log deletion schedule activated by default.	Это поэтому SAP Data Warehouse Cloud теперь имеет активированную по умолчанию схему удаления журналов.	['schedule']	{'schedule': 'схему'}	['схема']
41	{'input': 'ввод'}	The inputs must match in number of the columns, names, data types, and order of corresponding columns.	Входные данные должны совпадать по количеству столбцов, названиям, типам данных и порядку соответствующих столбцов.	['input']	{'input': 'данные'}	['дать']
42	{'service entry sheet': 'ведомость учета услуг'}	Using the filter criterion Origin, you can decide which service entry sheets are to be displayed in the list.	С помощью критерия фильтра Происхождение вы можете определить, какие листы ввода данных о службах будут отображаться в списке.	['service entry sheet']	{'service entry sheet': 'листы ввода службах'}	['лист ввод служба']
43	{'provider': 'провайдер'}	Thanks to the product page created by the data provider you get detailed information on the data product and eventually access to sample data, if available.	Благодаря странице продукта, созданной поставщиком данных, вы получаете подробную информацию о продукте данных и, в случае наличия, доступ к образцам данных.	['provider']	{'provider': 'поставщиком'}	['поставщик']
44	{'provider': 'провайдер'}	You can search and browse for data products and data providers.	Вы можете искать и просматривать данные продукты и провайдеров.	['provider']	{'provider': 'провайдеров'}	['провайдер']
45	{'range': 'интервал'}	View material consumption or availability for a given time range.	Просмотр материала расхода или доступности для заданного периода времени.	['range']	{'range': '▔'}	['▔']
46	{'input': 'ввод'}	If an input record is matched to more than one lookup records with a score between this threshold and the Matched Records Score, it is placed in the Multiple results category.	Если входящая запись соответствует более чем одной записи поиска с оценкой между этим порогом и оценкой совпадающих записей, она помещается в категорию нескольких результатов.	['input']	{'input': 'входящая'}	['входящий']
47	{'type': 'вид'}	You can add items of different types to your sourcing projects.	Вы можете добавить элементы разных типов в свои проекты по поставке.	['type']	{'type': 'типов'}	['тип']
48	{'schedule': 'планирование'}	Select the relevant persisted view and create a simple or recurring schedule for your view.	Выберите соответствующий устойчивый вид и создайте простой или повторяющийся график для вашего вида.	['schedule']	{'schedule': 'график'}	['график']
49	{'data provider': 'провайдер данных'}	To be able to use the data product, the data provider will send an activation key via email that provides authorization to access one or multiple data products.	Чтобы использовать данные продукт, поставщик данных отправит по электронной почте ключ, который предоставляет полномочия на доступ к одному или нескольким данным продукт.	['data provider']	{'data provider': 'поставщик данных'}	['поставщик данные']
50	{'residence period': 'период активного хранения'}	At the end of the longest configured residence period, the data is blocked or deleted.	В конце активного срока пребывания данных блокируются или удаляются.	['residence period']	{'residence period': 'активного срока пребывания'}	['активный срок пребывание']
51	{'suspension': 'приостановление'}	Suspension of JVA Projects, Partners, and Equity Groups	Приостановка проектов JVA, партнеров и участий	['suspension']	{'suspension': 'Приостановка'}	['приостановка']
52	{'project type': 'тип проекта'}	Sourcing Project, Sourcing Project Name, Sourcing Project Type, Central Company Code, Central Purchasing Group, Central Purchasing Organization, Material Group, Currency, Purchasing Responsible, Status.	Сourcing Project, Sourcing Project Name, Sourcing Project Type, Балансовая единица, Central Purchasing Group, Central Purchasing Organization, Material Group, Валюта, Purchasing Responsible, Status.	['project type']	{'project type': 'Project Type'}	['project type']
53	{'wizard': 'ассистент'}	Click ImportImport Permissions to open the Import Permissions wizard and follow the instructions.	Нажмите Импорт полномочий, чтобы открыть мастер импорта полномочий и следуйте инструкциям.	['wizard']	{'wizard': 'мастер'}	['мастер']
54	{'flow': 'поток'}	By switching to the lineage view, you can trace the data provisioning and flow of a model.	Переключаясь на вид линии, вы можете отслеживать предоставление данных и поток модели.	['flow']	{'flow': 'поток'}	['поток']
55	{'mapping': 'сопоставление'}	Choose Define Mapping to assign the fields of your user data from the CSV file to the fields in user management.	"Выберите ""Определить отображение"", чтобы сопоставить поля данных пользователей из файла CSV с полями в управлении пользователями."	['mapping']	{'mapping': '▔'}	['▔']
56	{'due date': 'дата исполнения'}	The app displays all tasks (together with their attributes, such as title, type, status, due date, processor, etc.), and sorts them by due date so that all overdue and due tasks are displayed at a first place.	Приложение отображает все задачи (вместе с их атрибутами, например, заголовок, тип, статус, срок сдачи, исполнитель и т. д.), и сортирует их по сроку сдачи, чтобы все просроченные и сроковые задачи отображались в первую очередь.	['due date']	{'due date': 'сроку сдачи'}	['срок сдача']
57	{'tag': 'отметить'}	Select one or more entries to tag your products with related SAP applications.	Выберите один или несколько элементов для маркировки продуктов с помощью связанных приложений SAP.	['tag']	{'tag': 'маркировки'}	['маркировка']
58	{'provider': 'провайдер'}	The provider has removed the data product from the available data product list.	Поставщик удалил продукт данных из списка доступных продуктов данных.	['provider']	{'provider': 'Поставщик'}	['поставщик']
59	{'transaction': 'транзакция'}	Source Reference Transaction	Ссылка на источник Транзакция	['transaction']	{'transaction': 'Транзакция'}	['транзакция']
60	{'custom field': 'пользовательское поле'}	Publishing or deletion of at least one custom field failed.	Не удалось опубликовать или удалить хотя бы одно пользовательское поле.	['custom field']	{'custom field': 'пользовательское поле'}	['пользовательский поле']
61	{'pane': 'область'}	Additionally, the structure pane contains the options for template rules and text blocks rules.	Кроме того, вкладка структуры содержит параметры для правил шаблона и правил текстовых блоков.	['pane']	{'pane': 'вкладка'}	['вкладка']
62	{'residence period': 'период активного хранения'}	The residence period is part of the overall retention period.	Период пребывания является частью общего периода хранения.	['residence period']	{'residence period': 'Период пребывания'}	['период пребывание']
63	{'part': 'деталь'}	Adds the selected part or assembly to the Target (In Work) Panel.	Добавляет выбранный элемент или сборку в панель Цель (в работе).	['part']	{'part': 'элемент'}	['элемент']
64	{'range': 'интервал'}	If you select the time range, you get to the know the available quantity of the material.	Если вы делаете выбор по времени, вы получаете возможность узнать доступное количество материала.	['range']	{'range': '▔'}	['▔']
65	{'provider': 'поставщик'}	In the Manage Cash Pools app, the following service providers are supported:	"В приложении ""Управление денежными фондами"" поддерживаются следующие поставщики услуг:"	['provider']	{'provider': 'поставщики'}	['поставщик']
66	{'balance': 'баланс'}	Balance Transaction Currency – The currency of the G/L account where the journal entry was posted.	Балансовая валюта – Валюта основного счета, в котором была поставлена дебетовая ведомость.	['balance']	{'balance': 'Балансовая'}	['балансовый']
