	terms	src_raw	mt_raw	src_terms	alg_terms	norm_tgt_terms
67	{'copy': 'скопировать'}	The Copy and Remove buttons are active only when at least one alternative control is selected.	"Кнопки ""Копировать"" и ""Удалить"" активны только в том случае, если выбрано хотя бы одно альтернативное устройство."	['copy']	{'copy': 'Копировать'}	['копировать']
68	{'accrual': 'разграничение'}	Accruals that have been manually reviewed in the Review Purchase Order Accruals - My Inbox app	"разграничения, которые были проверены вручную в приложении ""Проверка разграничений - Мой ящик"""	['accrual']	{'accrual': 'разграничения'}	['разграничение']
69	{'type': 'вид'}	Select Work Pack Type from the drop-down list.	Выберите тип рабочей пакета из раскрывающемся списка.	['type']	{'type': 'тип'}	['тип']
70	{'use': 'использование'}	Use the File Repository	Используйте репозитария файла	['use']	{'use': 'Используйте'}	['использовать']
71	{'type': 'тип'}	Substitution Item Type	Тип замещения	['type']	{'type': 'Тип'}	['тип']
72	{'schedule': 'планирование'}	You can also modify the existing schedule of a data flow or delete it.	Вы также можете изменить существующий потока данных или удалить его.	['schedule']	{'schedule': '▔'}	['▔']
73	{'type': 'тип'}	Displays the available run types.	Показывает доступные типы прогонов.	['type']	{'type': '▔'}	['▔']
74	{'output': 'вывод', 'input': 'ввод'}	To manually map an input column to an output column, drag it from the left list and drop it onto the column in the right list.	Чтобы вручную сопоставить входной столбец с выходным столбцом, перетащите его из левой стороны и положите на столбец в правой стороне.	['output', 'input']	{'output': '▔', 'input': 'входной'}	['▔', 'входной']
75	{'type': 'вид'}	The RECORD COUNT type is a table-wide statistic.	ЗАПИСЕЙ COUNT - это статистика, относящаяся ко всей таблице.	['type']	{'type': 'статистика'}	['статистика']
76	{'allocation': 'перерасчет'}	This means that essential features are missing, such as the allocation to a business area.	Это означает, что отсутствуют важные функции, такие как распределение по бизнес-области.	['allocation']	{'allocation': 'распределение'}	['распределение']
77	{'contract': 'договор'}	The point in time when the primary processing purpose ends, for example, a contract is fulfilled.	Время, когда основной целевой процесс окончен, например, контракт исполнения.	['contract']	{'contract': 'контракт'}	['контракт']
78	{'edit': 'редактировать'}	Click the Edit Details link, to edit the technical details.	"Нажмите на ссылку ""Редактировать сведения"", чтобы изменить технические сведения."	['edit']	{'edit': 'Редактировать'}	['редактировать']
79	{'demand-driven': 'на основе потребности'}	Select the corresponding checkbox for demand-driven MRP components and/or top-level materials.	Отметьте соответствующий флажок для компонентов MRP, ориентированных на запрос, и / или верхнего уровня материалов.	['demand-driven']	{'demand-driven': 'ориентированных на запрос'}	['ориентировать на запрос']
80	{'input': 'ввод', 'join': 'соединение'}	Select the Join operator from the toolbar and drop it in the canvas and then connect two sources or other nodes to it as inputs.	Выберите оператор соединения из панели инструментов и положите его на холст, а затем подключите два источника или другие узлы к нему как входы.	['input', 'join']	{'input': 'входы', 'join': 'соединения'}	['вход', 'соединение']
81	{'space': 'пространство'}	Spaces are environments that bring data models, connections, compute and storage resources together for a specific line of business or use-case.	Пространства — это среды, в которых данные модели, соединения, ресурсы вычисления и хранения объединяются для конкретной линии бизнеса или сценария использования.	['space']	{'space': 'Среды'}	['среда']
82	{'accrual': 'разграничение'}	Accruals that have been manually reviewed in this app	Прибыли, проверенные в этом приложении вручную	['accrual']	{'accrual': 'Прибыли'}	['прибыль']
83	{'residence period': 'период активного хранения'}	The retention period is a combination of the residence period and the blocking period.	Период хранения объединяет период пребывания и период блокировки.	['residence period']	{'residence period': 'период пребывания'}	['период пребывание']
84	{'contract': 'контракт', 'assembly': 'сборка'}	Enterprise Contract Assembly integrates with SAP S/4HANA for enterprise contract management, in order to generate virtual documents based on the templates and text blocks available in Enterprise Contract Assembly.	Система сборки контрактов предприятия интегрируется с SAP S/4HANA для управления контрактами предприятия, чтобы сгенерировать виртуальные документы на основе шаблонов и текстовых блоков, доступных в Системе сборки контрактов предприятия.	['contract', 'assembly']	{'contract': 'контрактов', 'assembly': '▔'}	['контракт', '▔']
85	{'copy': 'копирование'}	Copy existing item to add new one	Скопировать существующий элемент для добавления нового	['copy']	{'copy': 'Скопировать'}	['скопировать']
86	{'schedule': 'планирование'}	Delete the schedule if required.	Удалите график, если это необходимо.	['schedule']	{'schedule': 'график'}	['график']
87	{'accrual': 'разграничение'}	Accruals that have been automatically reviewed because the amounts are between the threshold range.	Суммы, которые были автоматически проверены, потому что суммы находятся в диапазоне порога.	['accrual']	{'accrual': 'Суммы'}	['сумма']
88	{'provider': 'провайдер'}	Get information on the data provider and the products they sell	Получите информацию о поставщике данных и о продаваемых продуктах	['provider']	{'provider': 'поставщике'}	['поставщик']
89	{'service entry sheet': 'ведомость учета услуг'}	A service entry sheet can be created in one of the following ways:	Следующие способы создания листа ввода услуги:	['service entry sheet']	{'service entry sheet': 'листа ввода услуги'}	['лист ввод услуга']
90	{'type': 'тип'}	If you like to see only free data products, select the option Free from the filter Contract Type.	"Если вы хотите видеть только свободные продукты данных, выберите опцию ""Свободные"" в фильтре ""Тип контракта""."	['type']	{'type': 'Тип'}	['тип']
91	{'change': 'изменение'}	Change Connection Properties	Изменить свойства соединения	['change']	{'change': 'Изменить'}	['изменить']
92	{'schedule': 'планирование'}	Create a simple or recurring schedule for your data flow.	Создайте простое или повторяющееся расписание для вашего потока данных.	['schedule']	{'schedule': 'расписание'}	['расписание']
93	{'undo': 'отмена'}	Undo and Redo Transformations	Отмена и повтор преобразований	['undo']	{'undo': 'Отмена'}	['отмена']
94	{'pause': 'приостановка'}	Pause Real-Time Replication	Пауза тиражирования в реальном времени	['pause']	{'pause': 'Пауза'}	['пауза']
95	{'content': 'контент'}	If objects or data on your system will be overwritten by the import, a warning appears in the import window, and next to the relevant objects in the Content list.	Если объекты или данные на вашей системе будут перезаписаны при импорте, появится предупреждение в окне импорта, рядом с соответствующими объектами в списке Содержимое.	['content']	{'content': 'Содержимое'}	['содержимое']
96	{'set': 'определить'}	In the Manage Your Solution app under Configure Your Solution make system settings under FinanceContract AccountingPosting and DocumentsDefine Account Assignment Data Relevant to Transactions.	"В приложении ""Управление решением"" в разделе ""Настройка решения"" установите системные настройки в разделе ""Финансовые контракты"" ""Расчеты по счетам"" и ""Документы"" ""Определение данных присвоения счетов, связанных с операциями""."	['set']	{'set': 'установите'}	['установить']
97	{'thread': 'тред'}	You can enter a number of threads or a percentage.	Вы можете ввести количество потоков или процент.	['thread']	{'thread': 'потоков'}	['поток']
98	{'Personal Data': 'Личные данные', 'personal data': 'личные данные'}	The information retrieval feature supports you to comply with the relevant legal requirements for data protection by allowing you to search for and retrieve all personal data of a specified data subject.	Функция извлечения информации позволяет вам соблюдать соответствующие требования по защите данных, позволяя вам искать и извлекать все персональные данные определенного субъекта данных.	['Personal Data', 'personal data']	{'Personal Data': 'персональные данные', 'personal data': 'персональные данные'}	['персональный дать', 'персональный дать']
99	{'provider': 'поставщик'}	Data Provider Page	Страница поставщика данных	['provider']	{'provider': 'поставщика'}	['поставщик']
100	{'type': 'тип'}	This option deletes all of the monitored data belonging to this situation type.	Эта опция удаляет все мониторимые данные, относящиеся к этой ситуации.	['type']	{'type': 'ситуации'}	['ситуация']
101	{'attachment': 'вложение'}	If a payment advice was not entered into the system in advance, but was instead used for clearing the current bank statement item or lockbox item, it can be uploaded as an attachment for more complete record keeping.	Если рекомендация по оплате не была внесена в систему заранее, но использовалась для снятия счёта текущего банка или lockbox, она может быть загружена как приложение для более полного учёта.	['attachment']	{'attachment': 'приложение'}	['приложение']
102	{'activate': 'активация'}	Activate a supplier list or supplier list version	Активировать список поставщиков или версии списка поставщиков	['activate']	{'activate': 'Активировать'}	['активировать']
103	{'data provider': 'провайдер данных'}	It varies depending on how the data provider offers their products.	Оно зависит от того, как поставщик данных предлагает свои продукты.	['data provider']	{'data provider': 'поставщик данных'}	['поставщик данные']
104	{'reporting': 'отчеты'}	Registration for Indirect Taxation Abroad (RITA) enables indirect tax calculation and reporting for multiple countries within a single legal entity.	Регистрация по системе налогообложения по иностранным налогам (RITA) позволяет производить расчет и отчетность по косвенным налогам в нескольких странах в рамках одного юридического лица.	['reporting']	{'reporting': 'отчетность'}	['отчётность']
105	{'category': 'категория'}	For example, if a service technician works on a Public Holiday whereas the Overtime Category planned was Weekend, they can change the Overtime Category.	Например, если техник работает в выходной, а планировалось выходной, они могут изменить категорию переработки.	['category']	{'category': 'категорию'}	['категория']
106	{'type': 'тип'}	Deletes the entire monitored data belonging to this situation type.	Удаляет все наблюдаемые данные, относящиеся к этому типу ситуации.	['type']	{'type': 'типу'}	['тип']
107	{'client': 'клиент'}	Add Client to Allowlist	Добавить Клиент в список разрешенных	['client']	{'client': 'Клиент'}	['клиент']
108	{'type': 'тип'}	Licenses control access to your data products with contract type License Key (see ).	Лицензионный контроль доступа к вашим продуктам данных с типом контракта Лицензионный ключ (см. ).	['type']	{'type': 'типом'}	['тип']
109	{'change': 'изменить'}	Change or Delete Assignments	Изменить или удалить присвоения	['change']	{'change': 'Изменить'}	['изменить']
110	{'provider': 'поставщик'}	You as a user can search and purchase analytical data from data providers.	Вы как пользователь можете искать и покупать аналитические данные у поставщиков.	['provider']	{'provider': 'поставщиков'}	['поставщик']
111	{'schedule': 'планирование'}	If a schedule is set for the data flow, see by when the next run is scheduled.	Если задано расписание для потока данных, укажите, когда будет запущена следующая сессия.	['schedule']	{'schedule': 'расписание'}	['расписание']
112	{'provider': 'провайдер'}	The OData service provider URL needs to be publicly available.	URL-адрес поставщика OData должен быть доступен в интернете.	['provider']	{'provider': 'поставщика'}	['поставщик']
113	{'rate': 'курс'}	Consolidation Monthly Average Rate	Ежемесячный средний уровень объединения	['rate']	{'rate': 'уровень'}	['уровень']
114	{'wizard': 'ассистент'}	For several connection types that use a Data Provisioning agent to connect to the source, you can define advanced properties in another wizard step.	Для нескольких типов подключения, использующих агента предоставления данных для подключения к источнику, вы можете определить продвинутые свойства в другом шаге мастера.	['wizard']	{'wizard': 'мастера'}	['мастер']
115	{'pattern': 'шаблон'}	Define a recurrence pattern for the job.	Определите повторов для задания.	['pattern']	{'pattern': 'повторов'}	['повтор']
116	{'type': 'тип'}	The following product types are currently supported:	Типы продуктов, которые поддерживаются:	['type']	{'type': 'Типы'}	['тип']
117	{'provider': 'провайдер'}	OData service provider URL of SAP SuccessFactors.	URL сервисного поставщика OData SAP SuccessFactors.	['provider']	{'provider': 'поставщика'}	['поставщик']
118	{'inactive': 'неактивно', 'edit': 'редактировать'}	Click Edit and use the Yes/ No switch to change the version to active or inactive respectively.	"Нажмите ""Редактировать"" и используйте переключатель ""Да/Нет"", чтобы сделать версию активной или неактивной соответственно."	['inactive', 'edit']	{'inactive': 'неактивной', 'edit': 'Редактировать'}	['неактивный', 'редактировать']
119	{'provider': 'провайдер'}	Data Provider ID	Идентификатор поставщика данных	['provider']	{'provider': 'поставщика'}	['поставщик']
120	{'schedule': 'планирование'}	Define, edit or delete scheduling options for your persisted views under Schedule.	Укажите, отредактируйте или удалите параметры планирования для сохраненных представлений в разделе Планирование.	['schedule']	{'schedule': 'Планирование'}	['планирование']
121	{'copy': 'скопировать'}	Copy time entries	Скопировать время вводов	['copy']	{'copy': 'Скопировать'}	['скопировать']
122	{'edit': 'редактировать'}	You could also chooseEdit Chart PromptsC_FINANCIALPOSITIONQUERY1, if you only want to change the variables for a specific chart.	"Вы также могли бы выбрать ""Изменить подсказки диаграммы"" C_FINANCIALPOSITIONQUERY1, если хотите изменить только переменные для конкретной диаграммы."	['edit']	{'edit': 'Изменить'}	['изменить']
123	{'tab': 'вкладка'}	Process History tab	Вкладка История процесса	['tab']	{'tab': 'Вкладка'}	['вкладка']
124	{'provider': 'провайдер'}	As a data provider, your main objective is to offer valuable data products to the users of the Data Marketplace in SAP Data Warehouse Cloud.	В качестве поставщика данных, ваша основная цель - предоставить ценные продукты данных пользователям Data Marketplace в SAP Data Warehouse Cloud.	['provider']	{'provider': 'поставщика'}	['поставщик']
125	{'type': 'тип'}	Choose one of the following action types:	Выберите один из следующих типов операций:	['type']	{'type': 'типов'}	['тип']
126	{'schedule': 'планирование'}	How to Schedule Destruction Runs for Archiving Files	Как запланировать уничтожения для архивирования файлов	['schedule']	{'schedule': 'запланировать'}	['запланировать']
127	{'scope': 'объем'}	The Custom Code Migration app allows you to add or remove packages to/from the scope manually.	Приложение Миграция пользовательского кода позволяет добавлять или удалять пакеты вручную в/из области.	['scope']	{'scope': 'области'}	['область']
128	{'contract': 'договор'}	View and analyze expired or expiring service contracts	Просмотр и анализ просроченных или срок действия которых истекает контрактов	['contract']	{'contract': 'контрактов'}	['контракт']
129	{'retention period': 'срок хранения'}	The retention period consists of the residence period and blocking period.	Период хранения состоит из периода пребывания и блокировки.	['retention period']	{'retention period': 'Период хранения'}	['период хранение']
130	{'story': 'журнал'}	SAP Analytics Cloud Story	SAP Analytics Cloud Story	['story']	{'story': 'Story'}	['story']
131	{'space': 'пространство'}	To solve this problem, queries from certain spaces can be favored, meaning they will be processed faster than queries from other spaces.	Чтобы решить эту проблему, запросы из определенных пространств могут быть приоритетными, то есть они будут обрабатываться быстрее, чем запросы из других пространств.	['space']	{'space': 'пространств'}	['пространство']
132	{'rate': 'курс'}	Budget Consolidation Monthly Average Rate	Средний ежемесячный курс бюджета	['rate']	{'rate': 'курс'}	['курс']
133	{'tab': 'вкладка'}	Process Flow tab	Вкладка «Выполнение»	['tab']	{'tab': 'Вкладка'}	['вкладка']
134	{'type': 'вид'}	The following calculation types are supported:	Поддерживаются следующие типы расчета:	['type']	{'type': 'типы'}	['тип']
135	{'space': 'пространство'}	You can delete audit logs when needed in ConfigurationAudit, which will free up disk space.	Вы можете удалить журналы аудита в ConfigurationAudit, когда это необходимо, что освободит место на диске.	['space']	{'space': 'место'}	['место']
136	{'transfer': 'перевести'}	If you have selected an item type by mistake, you can either delete the item and add a new one or use the Change Item Type button to transfer the data of the selected item to a different item type.	Если вы случайно выбрали тип элемента, вы можете либо удалить элемент и добавить новый, либо использовать кнопку Изменить тип элемента, чтобы перенести данные выбранного элемента на другой тип элемента.	['transfer']	{'transfer': 'перенести'}	['перенести']
137	{'type': 'тип'}	Purchase order type	тип заказа	['type']	{'type': 'тип'}	['тип']
138	{'instance': 'инстанция', 'open': 'открыто'}	Instance Set to Open	Инстанс установлена на Открыто	['instance', 'open']	{'instance': 'Инстанс', 'open': 'Открыто'}	['инстанс', 'открыто']
139	{'type': 'тип'}	Business Partner Type	Тип партнера	['type']	{'type': 'Тип'}	['тип']
140	{'wizard': 'ассистент'}	Click New Export to open the wizard.	Нажмите Новый экспорт, чтобы открыть всплывающее окно.	['wizard']	{'wizard': 'окно'}	['окно']
141	{'type': 'вид'}	You can choose one of the following processing types:	Вы можете выбрать один из следующих типов обработки:	['type']	{'type': 'типов'}	['тип']
142	{'tab': 'вкладка'}	An additional filter is set and the Maintenance Order tab opens, showing the orders for the selected operations.	"Дополнительный фильтр устанавливается и открывается вкладка ""Заказы обслуживания"", показывающая заказы для выбранных операций."	['tab']	{'tab': 'вкладка'}	['вкладка']
143	{'type': 'вид'}	The following types of conditions are supported:	Поддерживаются следующие типы условий:	['type']	{'type': 'типы'}	['тип']
