	terms	src_raw	mt_raw	src_terms	alg_terms	norm_tgt_terms
144	{'schedule': 'планирование'}	How to Schedule Destruction Runs Using Data Destruction Objects	Как планировать удаление данных с использованием объектов удаления данных	['schedule']	{'schedule': 'планировать'}	['планировать']
145	{'wizard': 'ассистент'}	In the final wizard step, enter name and description for the connection and click Create Connection.	В последнем шаге мастера введите имя и описание соединения и нажмите Создать соединение.	['wizard']	{'wizard': 'мастера'}	['мастер']
146	{'request': 'заявка'}	Manage Resource Requests	Управление заявками на ресурсы	['request']	{'request': 'заявками'}	['заявка']
147	{'change': 'изменение'}	Change queue assignments.	Изменить присвоений очереди.	['change']	{'change': 'Изменить'}	['изменить']
148	{'tab': 'вкладка'}	Code List tab	Панель списка кодов	['tab']	{'tab': 'Панель'}	['панель']
149	{'restart': 'перезапуск', 'pause': 'приостановка'}	Pause and Restart Real-Time Replication	Пауза и возобновление реальном времени тиражирования	['restart', 'pause']	{'restart': 'возобновление', 'pause': 'Пауза'}	['возобновление', 'пауза']
150	{'relationship': 'связь'}	Once you remove the constraint for the successor operation, the operation is rescheduled automatically and the relationship is repaired.	После того как вы удаляете ограничение для операции-последователя, операция автоматически пересматривается и связь восстанавливается.	['relationship']	{'relationship': 'связь'}	['связь']
151	{'aggregate': 'агрегировать'}	Aggregate Notifications shows whether the notifications to be sent are aggregated (Yes) or separate for each situation instance (No).	Aggregate Notifications показывает, ли должны быть объединены уведомления (Да) или отдельные для каждого экземпляра ситуации (Нет).	['aggregate']	{'aggregate': 'объединены'}	['объединить']
152	{'contract': 'договор'}	Expiring service contracts	Истекшие сервисные контракты	['contract']	{'contract': '▔'}	['▔']
153	{'type': 'тип'}	New Order Type	Новый тип заказа	['type']	{'type': 'тип'}	['тип']
154	{'item': 'элемент'}	Select Add Item.	Выберите Добавить элемент.	['item']	{'item': 'элемент'}	['элемент']
155	{'design time': 'среда дизайна'}	For more information, see Design Time.	Для получения更多信息, см. Design Time.	['design time']	{'design time': 'Design Time'}	['design time']
156	{'type': 'вид'}	Define a description for the type.	Определите описание для типа.	['type']	{'type': 'типа'}	['тип']
157	{'schedule': 'расписание'}	Included in Schedule (Filter)	Включено в график (Фильтр)	['schedule']	{'schedule': 'график'}	['график']
158	{'type': 'вид'}	Specifies the type of the compliance requirement.	Указывает тип требования к соблюдению.	['type']	{'type': 'тип'}	['тип']
159	{'get': 'вызвать'}	Get Email Information	Получить электронном информацию	['get']	{'get': 'Получить'}	['получить']
160	{'update': 'обновление'}	Update Purchase Order	Обновить заказа	['update']	{'update': 'Обновить'}	['обновить']
161	{'download': 'выгружать'}	Download G/L mappings into a .csv file	Скачать G/L отображения в файл .csv	['download']	{'download': 'Скачать'}	['скачать']
162	{'check': 'проверить'}	Check Lot-Sizing Procedures	Проверьте процедуры размера партии	['check']	{'check': 'Проверьте'}	['проверить']
163	{'space': 'пространство'}	Under Spaces select the space you would like to work with.	Выберите пространство, с которым вы хотите работать.	['space']	{'space': 'пространство'}	['пространство']
164	{'type': 'вид'}	Descriptiion of Distinct Type	Описание отдельного типа	['type']	{'type': 'типа'}	['тип']
165	{'pause': 'приостановка'}	Pause Real-Time Replication for an Agent	Пауза реального времени репликации для агента	['pause']	{'pause': 'Пауза'}	['пауза']
166	{'transaction type': 'вид движения'}	Accrual Transaction Type	Тип операции разграничения	['transaction type']	{'transaction type': 'Тип разграничения'}	['тип разграничение']
167	{'provider': 'поставщик'}	You can edit the predefined email and then send it to the provider.	Вы можете отредактировать заранее определенный email и отправить его поставщику.	['provider']	{'provider': 'поставщику'}	['поставщик']
168	{'wizard': 'ассистент'}	In the next wizard step, enter connection properties to configure your connection.	В следующем шаге мастера введите свойства соединения для настройки вашего соединения.	['wizard']	{'wizard': 'мастера'}	['мастер']
169	{'type': 'тип'}	Description of Project Type	Описание типа проекта	['type']	{'type': 'типа'}	['тип']
170	{'type': 'тип'}	For more information, see Creating Action Types	Для получения дополнительной информации см. Создание типов операций	['type']	{'type': 'типов'}	['тип']
171	{'provider': 'провайдер'}	Purchase analytical data from data provider.	Покупать данные от поставщика данных.	['provider']	{'provider': 'поставщика'}	['поставщик']
172	{'edit': 'редактировать'}	Choose Edit Operations.	Выберите операции редактирования.	['edit']	{'edit': 'редактирования'}	['редактирование']
173	{'input': 'вход'}	Main input parameters	Основные параметры ввода	['input']	{'input': 'ввода'}	['ввод']
174	{'allocation': 'перерасчет'}	Overhead Allocation for CO-PA	Распределение расходов на CO-PA	['allocation']	{'allocation': 'Распределение'}	['распределение']
175	{'service confirmation': 'подтверждение сервиса'}	You cannot make changes to a service confirmation that has status Completed.	Вы не можете внести изменения в подтверждение услуги, у которого статус Завершено.	['service confirmation']	{'service confirmation': 'подтверждение услуги'}	['подтверждение услуга']
176	{'request': 'заявка'}	The top-level bars show information about the requests to which a resource is assigned in the specified time period.	Верхние панели показывают информацию о запросах, к которым привязан ресурс в указанном периоде времени.	['request']	{'request': 'запросах'}	['запрос']
177	{'use': 'использование'}	Please note that in some cases, certain country-specific functions may not be supported within Manage Global Accounting Hierarchies.This can occur because these two apps consume different data tables.	Обратите внимание, что в некоторых случаях определенные функции, специфичные для страны, могут не поддерживаться в Manage Global Accounting Hierarchies. Это может произойти потому, что эти два приложения используют разные таблицы данных.	['use']	{'use': 'используют'}	['использовать']
178	{'provider': 'провайдер'}	Manage Your Data Provider Profiles	Управление профилями поставщиков данных	['provider']	{'provider': 'поставщиков'}	['поставщик']
179	{'edit': 'редактировать'}	In the Edit menu, the following functions are available:	"В меню ""Редактировать"" доступны следующие функции:"	['edit']	{'edit': 'Редактировать'}	['редактировать']
180	{'space': 'пространство'}	On the Choose content page, expand the SPACE folder to show your spaces, select the objects you want to export, and then click Next.	На странице Выбор содержимого разверните папку SPACE, чтобы увидеть свои пространства, выберите объекты, которые хотите экспортировать, и нажмите Далее.	['space']	{'space': 'пространства'}	['пространство']
181	{'type': 'вид'}	Order Confirmation Type	Тип подтверждения заказа	['type']	{'type': 'Тип'}	['тип']
182	{'get': 'получить'}	Get mail information	Получить информацию по почте	['get']	{'get': 'Получить'}	['получить']
183	{'purchase order': 'заказ на закупку', 'Purchase Order': 'Заказ на закупку'}	Purchase order inbound	входящий заказ на поставку	['purchase order', 'Purchase Order']	{'purchase order': 'заказ на поставку', 'Purchase Order': 'заказ на поставку'}	['заказ на поставка', 'заказ на поставка']
184	{'sales order': 'заказ клиента'}	Enable Sales Order	Активировать Заказ продаж	['sales order']	{'sales order': 'Заказ продаж'}	['заказ продажа']
185	{'type': 'вид'}	Select the relevant source type	Выберите соответствующего типа источника	['type']	{'type': 'типа'}	['тип']
186	{'exception': 'исключение'}	There's only one exception:	Есть только одно исключение:	['exception']	{'exception': 'исключение'}	['исключение']
187	{'type': 'вид'}	Select one of the following work center group types:	Выберите один из следующих типов групп центров работы:	['type']	{'type': 'типов'}	['тип']
188	{'category': 'категория'}	The Name and Type fields are mandatory.Based on the team type, the team category is automatically populated.	"Поле ""Имя и тип"" является обязательным. На основе типа команды поле ""Категория команды"" автоматически заполняется."	['category']	{'category': '▔'}	['▔']
189	{'item': 'позиция'}	You can perform the following actions when working with items:	Вы можете выполнять следующие действия в работе с элементами:	['item']	{'item': 'элементами'}	['элемент']
190	{'update': 'обновить'}	Update user information	Обновить информацию пользователе	['update']	{'update': 'Обновить'}	['обновить']
191	{'type': 'тип'}	For more information on the learner types, see .	Для получения дополнительной информации о типах обучаемых, см. .	['type']	{'type': 'типах'}	['тип']
192	{'regulation': 'предписание'}	If you want to enter a different description of different modes of transport or if you want to enter the description in different languages, select a regulation and navigate to the Classify Dangerous Good - Packaged Product app.	"Если вы хотите ввести описание различных видов транспорта или ввести описание на других языках, выберите регламент и перейдите к приложению ""Классификация опасного вещества - упакованный продукт""."	['regulation']	{'regulation': 'регламент'}	['регламент']
193	{'source assignment': 'присвоение происхождения'}	Source Assignment 2	Присвоение источника 2	['source assignment']	{'source assignment': 'Присвоение источника'}	['присвоение источник']
194	{'term': 'оговорка'}	Organizational Assignment Term	Организационная назначение термин	['term']	{'term': 'термин'}	['термин']
195	{'wizard': 'ассистент'}	Changed creation wizard:	Изменен мастер создания:	['wizard']	{'wizard': 'мастер'}	['мастер']
196	{'provider': 'провайдер'}	Enter the OData service provider URL.	Укажите URL-адрес поставщика OData.	['provider']	{'provider': 'поставщика'}	['поставщик']
197	{'tab': 'вкладка'}	You can switch between the following tabs:	Вы можете переключаться между следующими вкладками:	['tab']	{'tab': 'вкладками'}	['вкладка']
198	{'tab': 'вкладка'}	Task Lists Tab	Вкладка Планы	['tab']	{'tab': 'Вкладка'}	['вкладка']
199	{'type': 'тип'}	You can delete all the monitored data for this situation type.	Вы можете удалить все данные мониторинга для этого типа ситуации.	['type']	{'type': 'типа'}	['тип']
200	{'type': 'тип'}	This option is available for the following order types:	Эта опция доступна для следующих типов заказов:	['type']	{'type': 'типов'}	['тип']
201	{'retention period': 'срок хранения'}	Retention Period for Users	Период хранения пользователей	['retention period']	{'retention period': 'Период хранения'}	['период хранение']
202	{'transaction type': 'вид сделки'}	Transaction Type (SFHAART)	Тип операции (SFHAART)	['transaction type']	{'transaction type': 'Тип операции'}	['тип операция']
203	{'type': 'вид'}	You can change this to one of the following types:	Вы можете изменить это на один из следующих типов:	['type']	{'type': 'типов'}	['тип']
204	{'service confirmation': 'подтверждение выполнения сервиса'}	You can cancel service confirmations with status completed.	Вы можете отменить подтверждения услуг с статусом завершен.	['service confirmation']	{'service confirmation': 'подтверждения услуг'}	['подтверждение услуга']
205	{'interest calculation': 'начисление процентов'}	The following types on interest calculation are available:	Следующие виды на расчет процентов доступны:	['interest calculation']	{'interest calculation': 'расчет процентов'}	['расчёт процент']
206	{'clearing item': 'перерасчетная позиция'}	Clearing Item Completed	Предмет завершена	['clearing item']	{'clearing item': 'Предмет'}	['предмет']
207	{'edit': 'редактировать'}	Select Create and Edit.	Выберите Создать и Редактировать.	['edit']	{'edit': 'Редактировать'}	['редактировать']
208	{'edit': 'редактировать'}	In the Edit Variant pane that appears, do the following:	"В появившемся окне ""Редактирование варианта"" выполните следующее:"	['edit']	{'edit': 'Редактирование'}	['редактирование']
209	{'purchase order': 'заказ на закупку', 'Purchase Order': 'Заказ на закупку'}	Purchase order outbound	исходящий заказ на поставку	['purchase order', 'Purchase Order']	{'purchase order': 'заказ на поставку', 'Purchase Order': 'заказ на поставку'}	['заказ на поставка', 'заказ на поставка']
210	{'merge': 'объединить'}	Merge Tax Items	Объединение налога	['merge']	{'merge': 'Объединение'}	['объединение']
211	{'work package': 'рабочий пакет'}	You can click on the work package to see its details.	Вы можете щелкнуть на работе пакета, чтобы просмотреть его детали.	['work package']	{'work package': 'работе пакета'}	['работа пакет']
212	{'type': 'вид'}	There are two types of service quotations:	есть два вида сметок на оказание услуг:	['type']	{'type': 'вида'}	['вид']
213	{'schedule': 'планирование'}	Schedule is created for the data flow.	Создан поток данных.	['schedule']	{'schedule': '▔'}	['▔']
214	{'pause': 'приостановка'}	Pause Real-Time Replication for a Connection	Пауза тиражирования для соединения	['pause']	{'pause': 'Пауза'}	['пауза']
215	{'association': 'связь'}	An association represents a relationship between two entities.	Ассоциация представляет отношение между двумя сущностями.	['association']	{'association': 'Ассоциация'}	['ассоциация']
216	{'type': 'вид'}	Document Type ID	Вид ID	['type']	{'type': 'Вид'}	['вид']
217	{'update': 'обновление'}	Update Existing PowerPoint	Обновить существующей PowerPoint	['update']	{'update': 'существующей'}	['существующий']
218	{'action': 'операция'}	It allows you to create an assignment exactly as requested by the project manager.This action is available if the project manager requested a specific resource and no resource has been assigned to the request yet.	Это позволяет создать задание точно так, как было указано в заявке. Эта операция доступна, если проектный менеджер указал конкретный ресурс, но еще не был назначен ресурс на заявку.	['action']	{'action': 'операция'}	['операция']
219	{'type': 'вид'}	For more information about restriction types, see .	Для получения дополнительных сведений о типах ограничений, см. .	['type']	{'type': 'типах'}	['тип']
220	{'where-used list': 'журнал использования'}	WIP Batch Where-Used List	WIP партий Where-Used List	['where-used list']	{'where-used list': 'Where-Used List'}	['where-used list']
221	{'record': 'запись'}	Record SAPUI5 Application	Запись SAPUI5 приложения	['record']	{'record': 'Запись'}	['запись']
222	{'repair': 'ремонт'}	Set the repair object to the status Completed.	"Установите объект ремонта в статуса ""Завершен""."	['repair']	{'repair': 'ремонта'}	['ремонт']
223	{'contract': 'контракт'}	To create a new contract:	Создать новый контракт:	['contract']	{'contract': 'контракт'}	['контракт']
224	{'Environment, Health and Safety': 'управление данными по охране здоровья и защите окружающей среды'}	A hyperlink name to the incident record in the Environment, Health, and Safety system.	Имя гиперссылки на запись события в системе Environment, Health, and Safety.	['Environment, Health and Safety']	{'Environment, Health and Safety': 'Environment, Health, and Safety'}	['environment , health , and safety']
225	{'type': 'вид'}	Start Date Type	Тип даты начала	['type']	{'type': 'Тип'}	['тип']
226	{'request': 'заявка'}	If a resource has been requested and the request has not yet been staffed, you'll see a Quick Assignment link in the Actions column.This allows you to create the assignment exactly as requested by the project manager.	"Если ресурс был запрошен, но еще не был выделен, вы увидите ссылку ""Быстрое назначение"" в колонке ""Действия"". Это позволяет создать назначение точно так, как его запросил проектный менеджер."	['request']	{'request': 'запрошен'}	['запросить']
227	{'agent': 'агент'}	Register New Agent	Зарегистрировать нового Агента	['agent']	{'agent': 'Агента'}	['агент']
228	{'request': 'заявка'}	Resource Request Skill Tag	Запрос на ресурс навык тег	['request']	{'request': 'Запрос'}	['запрос']
229	{'run': 'выполнить'}	Run Overhead Calculation	Калькуляцию расходов	['run']	{'run': 'Калькуляцию'}	['калькуляция']
230	{'service confirmation': 'подтверждение сервиса'}	Service Confirmation Item	Позиция подтверждения услуги	['service confirmation']	{'service confirmation': 'подтверждения услуги'}	['подтверждение услуга']
231	{'provider': 'поставщик'}	Deleting a Service Provider	Удаление поставщика услуг	['provider']	{'provider': 'поставщика'}	['поставщик']
232	{'characteristic': 'характеристика'}	Characteristic 1 Value	Признак 1 Значение	['characteristic']	{'characteristic': 'Признак'}	['признак']
233	{'retention period': 'период хранения'}	Retention period is expired	Период хранения истек	['retention period']	{'retention period': 'Период хранения'}	['период хранение']
234	{'carrier': 'перевозчик'}	Related Information for Carriers	Дополнительная информация для перевозчиков	['carrier']	{'carrier': 'перевозчиков'}	['перевозчик']
235	{'service confirmation': 'подтверждение сервиса'}	Service Confirmation (SVC1)	Подтверждение услуги (SVC1)	['service confirmation']	{'service confirmation': 'Подтверждение услуги'}	['подтверждение услуга']
236	{'use': 'использование'}	Use the planning panel	Используйте панели планирования	['use']	{'use': 'Используйте'}	['использовать']
237	{'transport type': 'вид транспортировки'}	Select the transport type you would like to modify.	Выберите тип транспорта, который вы хотите изменить.	['transport type']	{'transport type': 'тип транспорта'}	['тип транспорт']
238	{'type': 'тип'}	This match type groups the filtered data together and assigns the processing status Assigned.	"Этот тип сортировки объединяет отфильтрованные данные и присваивает статус обработки ""Задано""."	['type']	{'type': 'тип'}	['тип']
239	{'contract': 'договор'}	Search for contracts and filter for contracts.	Ищите договоров и фильтруйте договоров.	['contract']	{'contract': 'договоров'}	['договор']
240	{'sales order': 'заказ клиента'}	Sales Order - Query	Запрос - Заказ продаж	['sales order']	{'sales order': 'Заказ продаж'}	['заказ продажа']
241	{'release': 'деблокировать'}	Release and Create Activities	Отпуск и Создание операций	['release']	{'release': 'Отпуск'}	['отпуск']
242	{'clearing house': 'расчетный центр'}	Clearing House A	Организация по урегулированию споров	['clearing house']	{'clearing house': 'Организация'}	['организация']
243	{'clearing house': 'расчетный центр'}	Clearing House B	Организация B	['clearing house']	{'clearing house': 'Организация'}	['организация']
244	{'summary': 'сводка'}	Application Log Summary	Обзор журнала приложений	['summary']	{'summary': 'Обзор'}	['обзор']
245	{'change': 'изменение', 'open': 'открыто'}	You can change an open installment plan.	Вы можете изменить открытый план погашения.	['change', 'open']	{'change': 'изменить', 'open': 'открытый'}	['изменить', 'открытый']
