	terms	src_raw	mt_raw	src_terms	alg_terms	norm_tgt_terms
354	{'type': 'вид'}	Creating eDocument Types	Создание типов eDocument	['type']	{'type': 'типов'}	['тип']
355	{'Personal Information': 'личная информация'}	Personal Information tab	"вкладка ""Личная информация"""	['Personal Information']	{'Personal Information': 'Личная информация'}	['личный информация']
356	{'claim': 'страховой случай'}	Select the claim to view details.	Выберите претензию, чтобы посмотреть детали.	['claim']	{'claim': 'претензию'}	['претензия']
357	{'contract': 'контракт'}	Manage Sales Contracts	Управление договорами по продажам	['contract']	{'contract': 'договорами'}	['договор']
358	{'edit': 'редактировать'}	Choose Edit Orders.	Выберите Редактировать заказы.	['edit']	{'edit': 'Редактировать'}	['редактировать']
359	{'provider': 'провайдер'}	Name of the trusted identity provider	Имя доверенного поставщика идентичности	['provider']	{'provider': 'поставщика'}	['поставщик']
360	{'go to': 'переход'}	Accrual objects that have been review confirmed go to the Review Finished status.As the review process is not required, you can still post accrual objects directly that need reviewing but haven't been reviewed.	"Объекты разграничения, которые были проверены, поступают в статус ""Разграничения завершены"". Поскольку процесс проверки не требуется, вы можете по-прежнему постить объекты разграничения, которые требуют проверки, но не были проверены."	['go to']	{'go to': 'поступают'}	['поступать']
361	{'process': 'обработать'}	You can use the warehouse task link to navigate to warehouse tasks in the new Process Warehouse Tasks - Putaway app.	"Вы можете использовать ссылку на задачу склада, чтобы перейти к задачам склада в новом приложении ""Process Warehouse Tasks - Putaway""."	['process']	{'process': 'Process'}	['process']
362	{'controller': 'оператор'}	You can assign multiple data controllers to the same business partner.	Вы можете назначить несколько операторов на одного и того же бизнес-партнера.	['controller']	{'controller': 'операторов'}	['оператор']
363	{'Activities': 'действия'}	You can perform the following activities on imported procurement schedules:	Вы можете выполнять следующие действия с графиками импортированных закупок:	['Activities']	{'Activities': 'действия'}	['действие']
364	{'purpose': 'назначение'}	Specifies the purpose of a document that is assigned to a legal transaction.	Указывает назначение документа, присвоенного юридической сделке.	['purpose']	{'purpose': 'назначение'}	['назначение']
365	{'change': 'изменение'}	Change the priority of an authorization characteristic	Изменить приоритета характеристики авторизации	['change']	{'change': 'Изменить'}	['изменить']
366	{'withholding tax': 'налог на источники дохода'}	Withholding Tax at Row Level	Налог на доходы при уровне строк	['withholding tax']	{'withholding tax': 'налог на доходы'}	['налог на доход']
367	{'assignment': 'назначение'}	Pending PO Assignment	Ожидается PO Assignment	['assignment']	{'assignment': 'Assignment'}	['assignment']
368	{'service': 'услуга'}	Service in Bank Statement	Платеж в выписке банка	['service']	{'service': 'Платеж'}	['платёж']
369	{'space': 'пространство'}	Create and delete Spaces	Создание и удаление пространств	['space']	{'space': 'пространств'}	['пространство']
370	{'action': 'операция'}	Workflow Event Action	Событие рабочего потока	['action']	{'action': 'Событие'}	['событие']
371	{'attach': 'вложить'}	You can attach files or links to the object.	Вы можете прикрепить файлы или ссылки к объекту.	['attach']	{'attach': 'прикрепить'}	['прикрепить']
372	{'payment': 'оплата'}	Indicates the address to which payment is sent.	Указывает адрес, в который отправляется оплата.	['payment']	{'payment': 'оплата'}	['оплата']
373	{'output': 'вывод'}	You can generate output using the following:	Вы можете использовать следующее для генерации выходных данных:	['output']	{'output': 'данных'}	['данные']
374	{'activity': 'операция'}	The activity can invite both internal and external users.	Деятельность может привлекать как внутренних, так и внешних пользователей.	['activity']	{'activity': 'Деятельность'}	['деятельность']
375	{'input': 'ввод'}	Select your input entity:	Выберите вашу входную сущность:	['input']	{'input': 'входную'}	['входной']
376	{'input': 'ввод'}	Input data such as the following:	Входные данные, такие как:	['input']	{'input': 'Входные'}	['входной']
377	{'use': 'использование'}	Use Currency Conversion	Использовать пересчет валюты	['use']	{'use': 'Использовать'}	['использовать']
378	{'change': 'изменение'}	These dates can't be changed.	Эти даты невозможно изменить.	['change']	{'change': 'изменить'}	['изменить']
379	{'type': 'тип'}	Displays the assigned actions for run types.	Показывает привязанные действия для типов прогонов.	['type']	{'type': '▔'}	['▔']
380	{'type': 'вид'}	Filter by Document Type	Фильтрация по типу документа	['type']	{'type': 'тип'}	['тип']
381	{'change': 'изменить'}	Change Material Substitution	Изменение материала замену	['change']	{'change': 'Изменение'}	['изменение']
382	{'transport': 'транспорт'}	Application Help for Transport	Справка по транспорту	['transport']	{'transport': 'транспорту'}	['транспорт']
383	{'carrier': 'перевозчик'}	Information for carriers:	Информация для перевозчиков:	['carrier']	{'carrier': 'перевозчиков'}	['перевозчик']
384	{'connection': 'подключение'}	As a prerequisite, you must have already set up the connection to the ERP using Connection Management app.	В качестве предварительного условия вы должны уже установить соединение с ERP с помощью приложения Connection Management.	['connection']	{'connection': 'соединение'}	['соединение']
385	{'process': 'обработать'}	To process customer payments by credit card proceed as follows:	Чтобы обработать платежи клиентов по кредитной карте, выполните следующее:	['process']	{'process': 'обработать'}	['обработать']
386	{'activate': 'активировать'}	Create and activate a business rule	Создать и активировать правило бизнеса	['activate']	{'activate': 'активировать'}	['активировать']
387	{'provider': 'провайдер'}	The name of the data provider company.	Название компании-поставщика данных.	['provider']	{'provider': '▔'}	['▔']
388	{'total': 'сумма'}	Total Credit Line by Transaction Currency	Общая кредитная линия по транзакционной валюте	['total']	{'total': 'Общая'}	['общий']
389	{'controller': 'оператор'}	The data controller component is displayed.	Компонент контроллера данных отображается.	['controller']	{'controller': 'контроллера'}	['контроллер']
390	{'confirmation control key': 'управляющий ключ подтверждения'}	Enables you to select the confirmation control key.	Позволяет выбрать ключ подтверждения контроля.	['confirmation control key']	{'confirmation control key': 'ключ подтверждения контроля'}	['ключ подтверждение контроль']
391	{'reconcile': 'выполнить выверку'}	With this app, you can manually reconcile intraday bank statement flows with forecasted cash flows.	С помощью этого приложения вы можете вручную сопоставить потоки банковских операций по кассовым остаткам в течение дня с прогнозируемыми денежными потоками.	['reconcile']	{'reconcile': 'сопоставить'}	['сопоставить']
392	{'type': 'тип'}	Choose Assessment Type	Выбор типа оценки	['type']	{'type': 'типа'}	['тип']
393	{'provider': 'провайдер'}	The data provider's ZIP code.	Индекс поставщика данных.	['provider']	{'provider': 'поставщика'}	['поставщик']
394	{'type': 'тип'}	Relevant Order Type	Релевантный тип заказа	['type']	{'type': 'тип'}	['тип']
395	{'consumption': 'расход'}	Consumption in Month	потребление в месяц	['consumption']	{'consumption': 'потребление'}	['потребление']
396	{'category': 'категория'}	Stamp Duty Category	Категория гербового	['category']	{'category': 'Категория'}	['категория']
397	{'pause': 'приостановка'}	Pause and Resume	Пауза и возобновление	['pause']	{'pause': 'Пауза'}	['пауза']
398	{'type': 'тип'}	Enter the type of document.	Введите тип документа.	['type']	{'type': 'тип'}	['тип']
399	{'transport': 'транспорт'}	Viewing Transport Requests	Просмотр Транспортные заявки	['transport']	{'transport': 'Транспортные'}	['транспортный']
400	{'tab': 'вкладка'}	Work Agreement Tab	Табличка Договор Трудовой	['tab']	{'tab': 'Табличка'}	['табличка']
401	{'type': 'тип'}	There are six types of Constant expressions:	Всего существует шесть видов константных выражений:	['type']	{'type': 'видов'}	['вид']
402	{'workflow': 'рабочий процесс'}	The following example describes a possible workflow:	Вот пример, описывается возможный поток:	['workflow']	{'workflow': 'поток'}	['поток']
403	{'collection agency': 'коллекторское агентство'}	Send Update to Collection Agency	Отправить обновление в бюро по сбору долгов	['collection agency']	{'collection agency': 'бюро долгов'}	['бюро долг']
404	{'type': 'вид'}	This is the default attachment type.	Это по умолчанию тип приложения.	['type']	{'type': 'тип'}	['тип']
405	{'type': 'тип'}	Activity Type Description	Тип ситуации описание	['type']	{'type': 'Тип'}	['тип']
406	{'client': 'клиент'}	Corresponding DataSource (for use in SAP Analytics Cloud and analytical clients)	Соответствующий DataSource (для использования в SAP Analytics Cloud и аналитических клиентах)	['client']	{'client': 'клиентах'}	['клиент']
407	{'category': 'категория'}	Billing Plan Category - Text	Категория плана оплаты - текст	['category']	{'category': 'Категория'}	['категория']
408	{'edit': 'редактировать'}	You can also edit or download a virtual document.	Вы также можете редактировать или загружать виртуальный документ.	['edit']	{'edit': 'редактировать'}	['редактировать']
409	{'characteristic': 'характеристика'}	Creation, update, and deletion of characteristics	Создание, изменение и удаление характеристик	['characteristic']	{'characteristic': 'характеристик'}	['характеристика']
410	{'release': 'деблокировать'}	Release (Document OK)	Релиз (документ без ошибок)	['release']	{'release': 'Релиз'}	['релиз']
411	{'analytics chart': 'аналитическая диаграмма'}	Analytics Chart 1	Аналитический график 1	['analytics chart']	{'analytics chart': 'Аналитический график'}	['аналитический график']
412	{'provider': 'поставщик'}	Filter by Provider	Фильтрация по поставщику	['provider']	{'provider': 'поставщику'}	['поставщик']
413	{'assigned': 'присвоенный'}	Semantic Tag Assigned	семантический тег назначен	['assigned']	{'assigned': 'назначен'}	['назначить']
414	{'run type': 'тип прогона'}	Displays whether a run type is enabled.	Показывает, ли тип запуска включен.	['run type']	{'run type': 'тип запуска'}	['тип запуск']
415	{'exit': 'выход'}	Add an exit condition.	Добавьте условие выхода.	['exit']	{'exit': 'выхода'}	['выход']
416	{'data provider': 'провайдер данных'}	The country where the data provider is located.	Страна, где находится поставщик данных.	['data provider']	{'data provider': 'поставщик данных'}	['поставщик данные']
417	{'account': 'счет'}	Search for account information	Ищет информацию о счёте	['account']	{'account': 'счёте'}	['счёт']
418	{'check': 'проверка'}	Check Service Contract Actuals	Проверить факты сервисного контракта	['check']	{'check': 'Проверить'}	['проверить']
419	{'type': 'вид'}	You can view orders based on any of the following industry type:	Вы можете просматривать заказы по любому из следующих типов отрасли:	['type']	{'type': '▔'}	['▔']
420	{'maintain': 'выполнять ведение'}	Allows you to maintain the story details.	Позволяет сохранить подробных.	['maintain']	{'maintain': 'сохранить'}	['сохранить']
421	{'location structure': 'структура местоположений'}	With this app, you can edit the location structure.	С этой приложением вы можете редактировать структуру расположения.	['location structure']	{'location structure': 'структуру расположения'}	['структура расположение']
422	{'compliance': 'соответствие'}	For more information about integreting with contract compliance, see .	Для получения дополнительной информации о интеграции с соблюдением контракта, см. .	['compliance']	{'compliance': '▔'}	['▔']
423	{'topic': 'раздел'}	This topic describes the G/L account renumbering process.	Эта тема описывает процесс перенумерации счетов G/L.	['topic']	{'topic': 'тема'}	['тема']
424	{'compensation': 'возмещение'}	Specifies how customer compensation is to be processed.	Указывает, как должна быть обработана компенсация клиентов.	['compensation']	{'compensation': 'компенсация'}	['компенсация']
425	{'pricing procedure': 'схема калькуляции'}	Pricing Procedure PP1	Процедура установления цен PP1	['pricing procedure']	{'pricing procedure': 'Процедура установления'}	['процедура установление']
426	{'assembly': 'сборка'}	Assembly in Process	Обработке	['assembly']	{'assembly': 'Обработке'}	['обработка']
427	{'tab': 'вкладка'}	Default values tab page:	Вкладка Значения по умолчанию:	['tab']	{'tab': 'Вкладка'}	['вкладка']
428	{'edit': 'обработать'}	Edit Safety Observation	Редактировать наблюдение	['edit']	{'edit': 'Редактировать'}	['редактировать']
429	{'pattern': 'шаблон'}	Set when the recurrence pattern ends:	Установите дату завершения повторения:	['pattern']	{'pattern': 'повторения'}	['повторение']
430	{'type': 'тип'}	External Document Type	Внешний тип документа	['type']	{'type': 'тип'}	['тип']
431	{'transaction': 'движение'}	Transaction in the past	Транзакция в прошлом	['transaction']	{'transaction': 'Транзакция'}	['транзакция']
432	{'stop': 'остановка'}	Stop Manual Forecasting	Остановить вручную прогнозирование	['stop']	{'stop': 'Остановить'}	['остановить']
433	{'tab': 'вкладка'}	Budget Adjustments Tab	Корректировки бюджета	['tab']	{'tab': '▔'}	['▔']
434	{'activate': 'активировать'}	Activate a supplier list that is in preparation.	Активировать список поставщиков, который находится в подготовке.	['activate']	{'activate': 'Активировать'}	['активировать']
435	{'contract': 'контракт'}	Contract for Limit determines the price per unit for each item in the service entry sheet.	Соглашение о лимите определяет цену за единицу для каждого элемента в листе выполнения услуг.	['contract']	{'contract': 'Соглашение'}	['соглашение']
436	{'edit': 'редактировать'}	You can also edit these tasks with the following exceptions:	Вы также можете редактировать эти задачи с следующими исключениями:	['edit']	{'edit': 'редактировать'}	['редактировать']
437	{'wizard': 'мастер'}	New resource wizards	новые ресурсные мастера	['wizard']	{'wizard': 'мастера'}	['мастер']
438	{'object category': 'тип объекта'}	Purchasing Object Category	Категория объекта закупки	['object category']	{'object category': 'Категория объекта'}	['категория объект']
439	{'cancel': 'отменить'}	Create, Change, Cancel	Создать, изменить, Отменить	['cancel']	{'cancel': 'Отменить'}	['отменить']
440	{'restricted': 'с ограничением'}	Restricted reuse views	Ограничения повторного использования	['restricted']	{'restricted': 'Ограничения'}	['ограничение']
441	{'assets': 'активы'}	Assets or Liabilities	Активы или пассивы	['assets']	{'assets': 'Активы'}	['актив']
442	{'inspection': 'проверка'}	Inspection lot quantity	количества контрольной партии	['inspection']	{'inspection': 'контрольной'}	['контрольный']
443	{'use': 'использование'}	Use plan data integration	Используйте интеграцию данных по плану	['use']	{'use': 'Используйте'}	['использовать']
444	{'reporting': 'отчеты'}	Reporting and analytics	Отчетность и аналитика	['reporting']	{'reporting': 'Отчетность'}	['отчётность']
445	{'classification type': 'вид классификации'}	Expense Classification Type	Тип классификации расходов	['classification type']	{'classification type': 'Тип классификации'}	['тип классификация']
446	{'in review': 'в проверке'}	The account status will change from In review to Active.	Статус аккаунта изменится с In review на Активно.	['in review']	{'in review': 'In review'}	['in review']
447	{'provider': 'провайдер'}	Find out how to become a data provider and deliver valuable data products to the users of SAP Data Marketplace.	Узнайте, как стать поставщиком данных и предоставлять ценные продукты данных пользователям SAP Data Marketplace.	['provider']	{'provider': 'поставщиком'}	['поставщик']
448	{'type': 'вид'}	Select a compliance requirement type.	Выберите тип требований соответствия.	['type']	{'type': 'тип'}	['тип']
449	{'tab': 'вкладка'}	The Maintenance Orders tab opens and shows the material availability status for the relevant orders.	"Вкладка ""Заказы на обслуживание"" открывается и показывает статус наличия материала для соответствующих заказов."	['tab']	{'tab': 'Вкладка'}	['вкладка']
450	{'stop': 'остановить'}	Click Edit in the Monitor eventStop event.	Нажмите Изменить в событии остановки монитора.	['stop']	{'stop': 'остановки'}	['остановка']
451	{'update': 'обновление'}	Update Data Actions	Обновление данных операций	['update']	{'update': 'Обновление'}	['обновление']
452	{'order': 'порядок'}	Alternative Logon Order.	Альтернативный порядок входа.	['order']	{'order': 'порядок'}	['порядок']
453	{'schedule': 'планирование'}	Allows you to restart a schedule.	Позволяет перезапустить расписание.	['schedule']	{'schedule': 'расписание'}	['расписание']
454	{'tab': 'вкладка'}	On the tabs, use the following features:	На вкладках используйте следующие функции:	['tab']	{'tab': 'вкладках'}	['вкладка']
455	{'distribution': 'распространение'}	Distributing Cell Values	Распределение значений ячеек	['distribution']	{'distribution': 'Распределение'}	['распределение']
456	{'record': 'запись'}	The following events will be recorded:	Следующие события будут запись:	['record']	{'record': 'запись'}	['запись']
457	{'Resource': 'Ресурс'}	Choose Calculate Resources.	Выберите Расчеты ресурсов.	['Resource']	{'Resource': 'ресурсов'}	['ресурс']
458	{'grouping': 'группирование'}	Consolidation chart of accounts (COA) is a systematic grouping of financial statement (FS) items that belong together and are used for group reporting.	Консолидации (COA) - это систематическая группировка финансовых (FS) позиций, которые относятся к одному и тому же и используются для консолидации.	['grouping']	{'grouping': 'группировка'}	['группировка']
459	{'billing document': 'документ расчета'}	Choose the billing document from the list.	Выберите документ счёта из списка.	['billing document']	{'billing document': 'документ счёта'}	['документ счёт']
460	{'clarification account': 'промежуточный счет'}	Enter the clarification account.	Войдите в раздел уточнения.	['clarification account']	{'clarification account': 'уточнения'}	['уточнение']
461	{'edit': 'редактировать'}	To check and edit the settings of this configuration step, proceed as follows:	Чтобы проверить и изменить настройки этой конфигурации, выполните следующее:	['edit']	{'edit': 'изменить'}	['изменить']
462	{'use': 'использование'}	You can use the following apps to determine usage of PRTs in orders:	Вы можете использовать следующие приложения для определения использования PRTs в заказах:	['use']	{'use': 'использовать'}	['использовать']
463	{'type': 'вид'}	Text for Technical Object Type	Текст для типа технического объекта	['type']	{'type': 'типа'}	['тип']
