	terms	src_raw	mt_raw	src_terms	alg_terms	norm_tgt_terms
0	{'2008 global financial crisis': '2008年全球金融危機', 'mainland': '內地', 'mainland china': '中國內地', 'march banking turmoil': '3月份在美國及歐洲發生的銀行危機', 'middle east': '中東', 'russiaukraine war': '俄烏戰事', 'banking turmoil': '銀行危機', 'economic recovery': '經濟復甦', 'financial market': '金融市場', 'global economic growth': '全球經濟增長', 'inflationary path': '通脹走勢', 'interest rate outlook': '利率前景', 'market sentiment': '市場氣氛', 'monetary condition': '貨幣狀況', 'system - wide banking stress': '系統性銀行危機'}	Reverberations from slowing global economic growth amid a “high for longer” interest rate environment and intensifying geopolitical tensions — not just stemming from the RussiaUkraine war and China-US tensions but also the outbreak of conflict in the Middle East — were the key themes for the financial markets in 2023. The March banking turmoil in the US and Europe, the most significant system-wide banking stress since the 2008 Global Financial Crisis, weighed further on market sentiment. Major economies grappled with the harsh realities of tightened monetary conditions and greater uncertainty over the inflationary path and interest rate outlook. Adding to the uncertainty was the pace of Mainland China’s economic recovery, which was slower than general market expectations.	全球經濟增長放緩、利率維持高位更長時間以及地緣政治緊張局勢加劇——不僅源於俄烏戰事和中美緊張關係，更因中東爆發衝突——在2023年是金融市場的主要議題。3月份在美國及歐洲發生的銀行危機，是自2008年全球金融危機以來最嚴重的系統性銀行危機，進一步影響了市場氣氛。主要經濟體掙扎於貨幣狀況收緊的嚴峻現實，以及對通脹走勢和利率前景更大的不確定性。中國內地的經濟復甦速度，也為不確定性增添了變數，其速度慢於普遍市場預期。	['2008 global financial crisis', 'mainland', 'mainland china', 'march banking turmoil', 'middle east', 'russiaukraine war', 'banking turmoil', 'economic recovery', 'financial market', 'global economic growth', 'inflationary path', 'interest rate outlook', 'market sentiment', 'monetary condition', 'system - wide banking stress']	{'2008 global financial crisis': '2008年全球金融危機', 'mainland': '地', 'mainland china': '中國內地', 'march banking turmoil': '銀行危機', 'middle east': '中東', 'russiaukraine war': '俄烏戰事', 'banking turmoil': '銀行危機', 'economic recovery': '經濟復甦', 'financial market': '金融市場', 'global economic growth': '全球經濟增長', 'inflationary path': '通脹走勢', 'interest rate outlook': '利率前景', 'market sentiment': '市場氣氛', 'monetary condition': '貨幣狀況', 'system - wide banking stress': '系統性銀行危機'}	['2008年全球金融危機', '地', '中國內地', '銀行危機', '中東', '俄烏戰事', '銀行危機', '經濟復甦', '金融市場', '全球經濟增長', '通脹走勢', '利率前景', '市場氣氛', '貨幣狀況', '系統性銀行危機']
1	"{'bis': '國際結算銀行', 'bank for international settlement': '國際結算銀行', ""global financial leader 's investment summit"": '國際金融領袖投資峰會', 'hkma': '金管局', 'ifc': '國際金融中心', 'international financial centre': '國際金融中心', 'financial market': '金融市場', 'gross domestic product': '本地生產總值', 'inbound tourism': '入境旅遊業', 'labour market': '勞工市場', 'new normal': '新常態', 'private consumption': '私人消費', 'the government': '政府'}"	With volatility and unpredictability becoming the “new normal” in financial markets, Hong Kong has again demonstrated its well-known ability to adapt, showing remarkable resilience. Since the city’s full-fledged post-COVID reopening last year, much work has been done to attract people back to our dynamic city and reconnect them with Hong Kong. The HKMA has contributed by hosting a series of large-scale international events such as the Global Financial Leaders’ Investment Summit and conferences with the Bank for International Settlements (BIS), which showcased our vibrant city and helped send the message worldwide that Hong Kong, as a major international financial centre (IFC), is open for business and remains the centre of action and innovation. There are clear signs of gradual recovery, driven by an encouraging revival of inbound tourism and improved private consumption, also supported by a resilient labour market and the various support measures rolled out by the Government. For 2023 as a whole, Hong Kong’s gross domestic product growth bounced back to 3.2% from negative territory in 2022.	在金融市場的波動與不確定性日益成為「新常態」的背景下，香港再次展現其卓越的適應能力和韌性。自去年全面恢復正常運作以來，香港已積極吸引人才回流，並重新連結本地與國際社群。金管局透過舉辦一系列大型國際活動，例如國際金融領袖投資峰會以及與國際結算銀行（國際結算銀行）的會議，充分展示了香港的活力，並向全球傳達訊息，說明香港作為主要的國際金融中心（國際金融中心），持續開放且是行動與創新的中心。入境旅遊業的復甦和私人消費的改善，加上強韌的勞工市場以及政府推出的各項支援措施，都顯示出經濟正在逐步復甦。整體而言，香港在2023年的本地生產總值增長從2022年的負增長反彈至3.2%。	"['bis', 'bank for international settlement', ""global financial leader 's investment summit"", 'hkma', 'ifc', 'international financial centre', 'financial market', 'gross domestic product', 'inbound tourism', 'labour market', 'new normal', 'private consumption', 'the government']"	"{'bis': '國際結算銀行', 'bank for international settlement': '國際結算銀行', ""global financial leader 's investment summit"": '國際金融領袖投資峰會', 'hkma': '金管局', 'ifc': '國際金融中心', 'international financial centre': '國際金融中心', 'financial market': '金融市場', 'gross domestic product': '本地生產總值', 'inbound tourism': '入境旅遊業', 'labour market': '勞工市場', 'new normal': '新常態', 'private consumption': '私人消費', 'the government': '政府'}"	['國際結算銀行', '國際結算銀行', '國際金融領袖投資峰會', '金管局', '國際金融中心', '國際金融中心', '金融市場', '本地生產總值', '入境旅遊業', '勞工市場', '新常態', '私人消費', '政府']
2	{'hkma': '金管局', 'ifc': '國際金融中心', 'financial market': '金融市場', 'macroeconomic headwind': '宏觀經濟挑戰', 'monetary and banking stability': '貨幣與銀行體系穩定'}	The HKMA entered its fourth decade in 2023. The past 30 years have seen the dynamics of the economy and the financial markets change drastically, with technology driving advances beyond anyone’s wildest imagination. The invaluable experience and wisdom gained over the past three decades have enabled us to face the future with confidence. Despite macroeconomic headwinds and an uncertain external environment, the HKMA will continue to uphold its mandate of safeguarding monetary and banking stability in Hong Kong, and will actively pursue developmental opportunities to anchor that stability and cement the city’s status as a leading IFC.	金管局於2023年邁入第四十週年。過去三十年間，經濟與金融市場的動態發生了劇烈變化，科技所推動的進步遠超任何人所能想像的範疇。過去三十年累積的無價經驗與智慧，使我們有信心面對未來。儘管面對宏觀經濟挑戰及不確定的外部環境，金管局將繼續履行其保障香港貨幣與銀行體系穩定的職責，並積極把握發展機遇，鞏固這份穩定，進一步鞏固香港作為國際金融中心的地位。	['hkma', 'ifc', 'financial market', 'macroeconomic headwind', 'monetary and banking stability']	{'hkma': '金管局', 'ifc': '國際金融中心', 'financial market': '金融市場', 'macroeconomic headwind': '宏觀經濟挑戰', 'monetary and banking stability': '貨幣與銀行體系穩定'}	['金管局', '國際金融中心', '金融市場', '宏觀經濟挑戰', '貨幣與銀行體系穩定']
3	{'antony leung': '梁錦松', 'donald tsang': '曾蔭權', 'eddie yue': '余偉文', 'hkma': '金管局', 'henry tang': '唐英年', 'hong kong special administrative region': '香港特別行政區', 'john tsang': '曾俊華', 'joseph yam': '任志剛', 'norman chan': '陳德霖', 'paul chan': '陳茂波', 'the government of the hong kong special administrative region': '香港特别行政區政府', 'the government': '政府'}	Former and current Financial Secretaries of the Government of the Hong Kong Special Administrative Region and Chief Executives of HKMA at a gathering to celebrate the HKMA’s 30th anniversary: (from left) Mr Joseph Yam, Mr Henry Tang, Mr Donald Tsang, Mr Paul Chan, Mr Eddie Yue, Mr Antony Leung, Mr John Tsang, and Mr Norman Chan	香港特別行政區政府前後任財政司長與金管局歷任總裁在慶祝金管局成立三十週年的活動上合影：（從左至右）任志剛先生、唐英年先生、曾蔭權先生、陳茂波先生、余偉文先生、梁錦松先生、曾俊華先生與陳德霖先生。	['antony leung', 'donald tsang', 'eddie yue', 'hkma', 'henry tang', 'hong kong special administrative region', 'john tsang', 'joseph yam', 'norman chan', 'paul chan', 'the government of the hong kong special administrative region', 'the government']	{'antony leung': '梁錦松', 'donald tsang': '▔', 'eddie yue': '余偉文', 'hkma': '金管局', 'henry tang': '唐英年', 'hong kong special administrative region': '香港特別行政區', 'john tsang': '曾俊華', 'joseph yam': '▔', 'norman chan': '陳', 'paul chan': '茂波', 'the government of the hong kong special administrative region': '香港特別行政區政府', 'the government': '政府'}	['梁錦松', '▔', '余偉文', '金管局', '唐英年', '香港特別行政區', '曾俊華', '▔', '陳', '茂波', '香港特別行政區政府', '政府']
4	{'lers': '聯匯制度'}	# LERS — Weathering the storms	# 聯匯制度 — 抵禦風暴	['lers']	{'lers': '聯匯制度'}	['聯匯制度']
5	{'international monetary fund': '國際貨幣基金組織', 'lers': '聯匯制度', 'linked exchange rate system': '聯繫匯率制度', 'financial system': '金融體系', 'monetary and financial system': '貨幣及金融體系'}	Last year marked the 40th anniversary of the Linked Exchange Rate System (LERS), a staunch pillar supporting Hong Kong’s strong and stable monetary and financial systems. Four decades of transparent and effective operation have nurtured confidence in the LERS and its credibility in the market. Throughout the year, the Hong Kong dollar stayed within the Convertibility Zone and the Hong Kong dollar market operated smoothly, reflecting the strong market confidence in the LERS, a confidence also shared and expressed by the International Monetary Fund and global market players.	去年是聯繫匯率制度（聯匯制度）成立四十週年，這制度是支撐香港強勁穩健的貨幣及金融體系的重要支柱。四十年來，聯匯制度運作透明有效，培養了市場對聯匯制度的信心及其信譽。全年中，港元匯率維持在可兌換區間內，香港金融市場運作暢順，充分反映市場對聯匯制度的強烈信心，這種信心也得到國際貨幣基金組織和全球市場參與者的認同和表達。	['international monetary fund', 'lers', 'linked exchange rate system', 'financial system', 'monetary and financial system']	{'international monetary fund': '國際貨幣基金組織', 'lers': '▔', 'linked exchange rate system': '聯繫匯率制度', 'financial system': '金融 體系', 'monetary and financial system': '貨幣及金融體系'}	['國際貨幣基金組織', '▔', '聯繫匯率制度', '金融 體系', '貨幣及金融體系']
6	{'hkma': '金管局', 'lers': '聯匯制度', 'datum analytics': '數據分析法', 'financial stability': '金融穩定', 'granular datum': '微數據', 'monetary system': '貨幣體制', 'stakeholder': '持份者', 'trade repository': '交易資料儲存庫'}	Behind this confidence lie the HKMA’s proactive efforts in public and market engagements, along with effective surveillance. We spared no effort during the year in communicating with key stakeholders to foster a clear understanding of the functioning of the LERS, which is all the more important in times of volatility, be it stemming from economic stress or political uncertainties. We also strengthened surveillance of our monetary system, leveraging the use of datasets from the trade repository and expanded granular data from banks, as well as advanced data analytics and artificial intelligence, to enhance our capability, enabling more timely and comprehensive analysis of financial stability and macro-prudential surveillance.	背後支持這份信心，是金管局積極與公眾和市場溝通，以及有效的監察工作。我們在過去一年內，致力與主要持份者溝通，以增進他們對聯匯制度運作的理解，尤其在經濟壓力或政治不確定性導致市場波動時，這更顯重要。同時，我們亦加強了對貨幣體制的監察，善用交易資料儲存庫的數據集，以及銀行提供的微數據，並結合數據分析法和人工智慧，提升監察能力，從而能更及時、更全面地分析金融穩定及宏觀審慎監察。	['hkma', 'lers', 'datum analytics', 'financial stability', 'granular datum', 'monetary system', 'stakeholder', 'trade repository']	{'hkma': '金管局', 'lers': '聯匯制度', 'datum analytics': '數據分析法', 'financial stability': '金融穩定', 'granular datum': '微數據', 'monetary system': '貨幣體制', 'stakeholder': '持份者', 'trade repository': '交易資料儲存庫'}	['金管局', '聯匯制度', '數據分析法', '金融穩定', '微數據', '貨幣體制', '持份者', '交易資料儲存庫']
7	{'banking system': '銀行體系'}	# Banking system — A major source of stability	# 銀行體系——穩定性的重要來源	['banking system']	{'banking system': '銀行體系'}	['銀行體系']
8	{'banking system': '銀行體系', 'capital and liquidity buffer': '資本及流動性緩衝', 'credit landscape': '信貸環境', 'liquidity': '流動性', 'liquidity buffer': '流動性緩衝'}	Despite a multitude of challenges including the high-interestrate environment, persistent geopolitical tensions and a challenging credit landscape, Hong Kong’s banking system remained stable throughout the year, underpinned by strong capital and liquidity buffers.	儘管面臨諸多挑戰，包括高利率環境、持續的地緣政治緊張局勢以及嚴峻的信貸環境，香港的銀行體系在全年表現出穩定性，這得益於強勁的資本及流動性緩衝。	['banking system', 'capital and liquidity buffer', 'credit landscape', 'liquidity', 'liquidity buffer']	{'banking system': '銀行體系', 'capital and liquidity buffer': '資本及流動性緩衝', 'credit landscape': '信貸環境', 'liquidity': '流動性', 'liquidity buffer': '流動性緩衝'}	['銀行體系', '資本及流動性緩衝', '信貸環境', '流動性', '流動性緩衝']
9	{'liquidity coverage ratio': '流動性覆蓋比率', 'mainland': '內地', 'asset quality': '資產質素', 'banking sector': '銀行體系', 'classify loan ratio': '特定分類貸款比率', 'credit risk': '信用風險', 'liquidity': '流動性', 'long - term historical average': '長期平均水平', 'property developer': '房地產發展商', 'risk management': '風險管理', 'statutory minimum requirement': '法定最低要求'}	As at the end of 2023, the consolidated total capital ratio of local banks stood at 21.1%, well above the international minimum requirement of 8%. The Liquidity Coverage Ratio of large banks edged up to 178.6% as of the fourth quarter of 2023, likewise well above the statutory minimum requirement of 100%. While the classified loan ratio increased slightly from 1.40% at the end of 2022 to 1.56% at the end of 2023, it remained below the long-term historical average of 2.0%. The increase was mainly driven by exposures to Mainland privately-owned enterprise (POE) property developers; but such exposure levels were generally well-contained as a result of banks’ prudent credit risk management over the years, and the overall asset quality of the banking sector remained sound.	截至2023年底，本地銀行合併總資本充足率為21.1%，遠高於國際法定最低要求的8%。大型銀行的流動性覆蓋比率截至2023年第四季微升至178.6%，同樣遠高於法定最低要求的100%。雖然特定分類貸款比率從2022年底的1.40%略增至2023年底的1.56%，但仍低於2.0%的長期平均水平。增幅主要來自對內地民營房地產開發商的敞口，但由於銀行多年來審慎的信用風險管理，此類敞口水平總體上受到良好控制，而銀行體系的資產質素仍然穩健。	['liquidity coverage ratio', 'mainland', 'asset quality', 'banking sector', 'classify loan ratio', 'credit risk', 'liquidity', 'long - term historical average', 'property developer', 'risk management', 'statutory minimum requirement']	{'liquidity coverage ratio': '流動性覆蓋比率', 'mainland': '內地', 'asset quality': '資產質素', 'banking sector': '銀行體系', 'classify loan ratio': '特定分類貸款比率', 'credit risk': '信用風險', 'liquidity': '流動性', 'long - term historical average': '長期平均水平', 'property developer': '房地產開發商', 'risk management': '風險管理', 'statutory minimum requirement': '法定最低要求'}	['流動性覆蓋比率', '內地', '資產質素', '銀行體系', '特定分類貸款比率', '信用風險', '流動性', '長期平均水平', '房地產開發商', '風險管理', '法定最低要求']
10	{'2008 global financial crisis': '2008年全球金融危機', 'hkma': '金管局', 'banking sector': '銀行體系', 'banking turmoil': '銀行危機', 'capital and liquidity buffer': '資本及流動性緩衝', 'financial market': '金融市場', 'financial system': '金融體系', 'global financial market': '全球金融市場', 'internal review': '內部檢討', 'liquidity': '流動性', 'liquidity buffer': '流動性緩衝', 'spillover effect': '外溢效應', 'supervisory effectiveness': '監管成效', 'system - wide banking stress': '系統性銀行危機'}	What caught most market players by surprise in 2023 was unquestionably the banking turmoil in the US spilling over to Europe, which created a level of system-wide banking stress unseen since the 2008 Global Financial Crisis. The HKMA remained on high alert as the situation unfolded and took a number of precautionary actions to limit any potential adverse spillover effects on confidence in the local banking and financial systems. This, coupled with the strong capital and liquidity buffers maintained by banks in Hong Kong, meant that our banking sector was largely unaffected by the turmoil, remaining resilient even as the global financial markets were roiled. In the aftermath of this episode, the HKMA conducted a comprehensive internal review with a view to drawing out lessons for the local banking sector and strengthening the HKMA’s supervisory effectiveness and agility to handle a banking crisis should one occur.	二零二三年最讓市場參與者意想不到的，莫過於美國的銀行危機蔓延至歐洲，造成自二零零八年全球金融危機以來前所未見的系統性銀行危機。金管局在局勢演變過程中保持高度警惕，並採取了一系列預防措施，以限制對本地銀行和金融體系信心可能產生的不利外溢效應。 加上香港銀行所維持的強勁資本及流動性緩衝，我們的銀行體系在很大程度上未受此危機影響，即使全球金融市場動盪，仍保持韌性。 在這起事件過後，金管局進行了全面的內部檢討，旨在從中汲取經驗教訓，加強金管局的監管成效及應對銀行危機的敏捷性。	['2008 global financial crisis', 'hkma', 'banking sector', 'banking turmoil', 'capital and liquidity buffer', 'financial market', 'financial system', 'global financial market', 'internal review', 'liquidity', 'liquidity buffer', 'spillover effect', 'supervisory effectiveness', 'system - wide banking stress']	{'2008 global financial crisis': '二零零八年全球金融危機', 'hkma': '金管局', 'banking sector': '銀行體系', 'banking turmoil': '銀行危機', 'capital and liquidity buffer': '資本及流動性緩衝', 'financial market': '金融市場', 'financial system': '金融體系', 'global financial market': '全球金融市場', 'internal review': '內部檢討', 'liquidity': '流動性', 'liquidity buffer': '流動性緩衝', 'spillover effect': '外溢 效應', 'supervisory effectiveness': '監管成效', 'system - wide banking stress': '系統性銀行危機'}	['二零零八年全球金融危機', '金管局', '銀行體系', '銀行危機', '資本及流動性緩衝', '金融市場', '金融體系', '全球金融市場', '內部檢討', '流動性', '流動性緩衝', '外溢 效應', '監管成效', '系統性銀行危機']
11	{'hkma': '金管局', 'banking sector': '銀行體系', 'credit risk': '信用風險', 'risk management': '風險管理', 'small and medium - sized enterprise': '中小企'}	While prudent credit risk management is important, we have always reiterated our supervisory expectation for banks to be mindful of the need to support the real economy. As the orderly exit from the banking sector’s Pre-approved Principal Payment Holiday Scheme commenced in July 2023 with the economic effects of COVID-19 receding, the HKMA worked closely with banks to ensure a gradual and smooth transition to normal loan repayment with flexibility for those borrowers who continued to be under pressure. Earlier this year, recognising that some small and medium-sized enterprises are still facing challenges in their operations despite the end of the pandemic, nine new measures were rolled out to further assist them in obtaining financing from banks.	雖然謹慎的信貸風險管理至關重要，我們始終重申對銀行支持實體經濟的監管期望。自2023年7月新冠疫情經濟影響漸趨減退，銀行體系的「預先批核還息不還本計劃」有序退出以來，金管局與銀行緊密合作，確保貸款償還逐步順利過渡至正常模式，並為持續面臨壓力的借款人提供靈活性。今年早些時候，鑒於部分中小企在疫情結束後仍在營運上面臨挑戰，金管局推出九項新措施，進一步協助其從銀行取得融資。	['hkma', 'banking sector', 'credit risk', 'risk management', 'small and medium - sized enterprise']	{'hkma': '金管局', 'banking sector': '銀行體系', 'credit risk': '信貸風險', 'risk management': '風險管理', 'small and medium - sized enterprise': '中小企'}	['金管局', '銀行體系', '信貸風險', '風險管理', '中小企']
12	{'hkma': '金管局', 'property market': '物業市場', 'countercyclical macroprudential measure': '逆周期宏觀審慎監管措施', 'interest rate stress testing requirement': '利率壓力測試的監管要求', 'loan - to - value ratio cap': '按揭成數上限', 'property development and investment': '物業發展與投資'}	Having reviewed the risks associated with the local property market in the context of banks’ property lending, the HKMA announced in July 2023 the first relaxation of the countercyclical macroprudential measures for residential properties since their introduction in 2009. This relaxation increased the loan-to-value ratio cap for most residential mortgage loans as well as for financing for property development and investment. It was later followed by suspension of the interest rate stress testing requirement in early 2024.	在審視銀行物業貸款與本地物業市場的風險後，金管局於2023年7月宣布，自2009年推出以來，首次放寬住宅物業的逆周期宏觀審慎監管措施。此項放寬提高了大部分住宅按揭貸款以及物業發展與投資融資的按揭成數上限，並且於2024年初進一步暫停了利率壓力測試的監管要求。	['hkma', 'property market', 'countercyclical macroprudential measure', 'interest rate stress testing requirement', 'loan - to - value ratio cap', 'property development and investment']	{'hkma': '金管局', 'property market': '物業市場', 'countercyclical macroprudential measure': '逆周期宏觀審慎監管措施', 'interest rate stress testing requirement': '利率壓力測試的監管要求', 'loan - to - value ratio cap': '按揭成數上限', 'property development and investment': '物業發展與投資'}	['金管局', '物業市場', '逆周期宏觀審慎監管措施', '利率壓力測試的監管要求', '按揭成數上限', '物業發展與投資']
