	terms	src_raw	mt_raw	src_terms	alg_terms	norm_tgt_terms
0	{'總裁': 'Chief Executive'}	# 總裁報告	# Chairman's Report	['總裁']	{'總裁': 'Chairman'}	['chairman']
1	{'中美貿易摩擦': 'US-China trade tensions', '加息': 'interest rate hikes', '地緣政治': 'geopolitical environment', '年報': 'Annual Report', '恒生指數': 'Hang Seng Index', '熾熱的投資情緒': 'bullish sentiment', '環球金融危機': 'Global Financial Crisis', '美聯儲': 'US Federal Reserve', '股票': 'equity securities', '股票指數': 'stock indexes', '英國脫歐': 'Brexit', '英國脫歐談判': 'Brexit impasse', '金融市場': 'financial markets'}	2018年是全球金融危機發生十周年，十年間國際政經形勢經歷巨大轉變，當中不乏一幕幕超乎最佳編劇所能想像的場景。我在去年的年報指出，2017年金融市場表現是「喜出望外」，同時提到前景「潛藏隱憂」。回顧2018年，或許可形容為「先喜後悲」。環球多個股票指數在1月創出歷史新高後不久，熾熱的投資情緒旋即遇上中美貿易摩擦的冷鋒，加上英國脫歐談判一直拉鋸、地緣政治惡化、美聯儲四次加息等因素，市場樂觀氣氛急劇逆轉，資產價格在年內大幅下跌。MSCI全球指數從高點至低點曾下跌20.3%，全年累跌約一成，是2008年環球金融危機以來表現最差的一年。恒生指數從高點最多曾下跌26.7%，全年下挫13.6%，錄得七年來最大年度跌幅。	2018 marked the tenth anniversary of the global financial crisis. Over the past decade, the international political and economic landscape has undergone profound transformations, with events unfolding that even the most imaginative screenwriters could not have envisioned. In last year’s annual report, I noted that the 2017 financial market performance was “unexpectedly positive,” while also highlighting “underlying concerns” about the outlook. Looking back at 2018, it might be characterized as “initial optimism followed by sorrow.” Shortly after global stock indices hit record highs in January, the fervent investment sentiment was abruptly met with the cold front of U.S.-China trade tensions, compounded by prolonged Brexit negotiations, deteriorating geopolitical conditions, and four interest rate hikes by the Federal Reserve. This led to a sharp reversal of market optimism and a significant decline in asset prices throughout the year. The MSCI Global Index fell 20.3% from its peak to its trough, with a cumulative decline of about 10% for the year, marking the worst performance since the 2008 global financial crisis. The Hang Seng Index fell as much as 26.7% from its peak, declining 13.6% for the year, recording its largest annual drop in seven years.	['中美貿易摩擦', '加息', '地緣政治', '年報', '恒生指數', '熾熱的投資情緒', '環球金融危機', '美聯儲', '股票', '股票指數', '英國脫歐', '英國脫歐談判', '金融市場']	{'中美貿易摩擦': 'U.S.-China trade tensions', '加息': 'interest rate hikes', '地緣政治': 'geopolitical', '年報': 'annual report', '恒生指數': 'Hang Seng Index', '熾熱的投資情緒': 'fervent investment sentiment', '環球金融危機': 'global financial crisis', '美聯儲': 'Federal Reserve', '股票': 'stock', '股票指數': 'stock indices', '英國脫歐': 'Brexit', '英國脫歐談判': 'Brexit negotiations', '金融市場': '▔'}	['u.s. trade tension', 'interest rate hike', 'geopolitical', 'annual report', 'hang seng index', 'fervent investment sentiment', 'global financial crisis', 'federal reserve', 'stock', 'stock index', 'brexit', 'brexit negotiation', '▔']
2	{'利率正常化': 'interest rate normalisation', '加息': 'interest rate hikes', '匯率制度': 'exchange rate arrangement', '國際貨幣基金組織': 'International Monetary Fund', '基金組織': 'IMF', '基點': 'basis points', '最優惠利率': 'prime rates', '特區政府': 'HKSAR Government', '環球金融危機': 'Global Financial Crisis', '美國加息': 'US interest rate hikes', '美國息率': 'US interest rates', '聯匯制度': 'LERS', '金管局': 'HKMA', '金融體系': 'financial system', '香港銀行同業拆息': 'Hong Kong Interbank Offered Rates'}	儘管外圍形勢波動難測，香港金融體系仍然保持穩健，貨幣市場運作暢順無阻。實施三十五年的聯繫匯率制度成功應對了資金流出港元的考驗。自環球金融危機爆發以來，累積約10,000億港元等值的資金流入港元。去年，隨着美國息率上升，港美息差持續擴闊，「沽港元、買美元」套息活動增加，港元兌美元匯率在年初轉弱，2005年制訂的「弱方兌換保證」，自4月首度觸發後，年內再觸發26次。金管局按照既定機制，履行「買港元、沽美元」的弱方兌換保證，有序、透明地在市場承接1,035億港元的港元沽盤。隨着資金流走，一個月香港銀行同業拆息在2018年內累升了105基點，而銀行亦在去年9月美國加息後，上調了最優惠利率。金管局多次和適時通過不同渠道向公眾闡釋「弱方兌換保證」的運作機制，令公眾了解資金流出港元是香港利率正常化的必經過程，也是聯匯制度的正常運作。國際貨幣基金組織在去年年底重申支持香港聯匯制度的立場，特區政府也強調聯匯是香港貨幣穩定的基石。這都有助於穩定香港市民對聯繫匯率的信心。	"Despite uncertainties in the external environment, Hong Kong's financial system remains robust, and the currency market operates smoothly. The linked exchange rate system, implemented for 35 years, has successfully withstood tests of capital outflows from Hong Kong dollars. Since the onset of the global financial crisis, approximately HKD 10,000 billion worth of funds have flowed into Hong Kong dollars. Last year, as US interest rates rose, the Hong Kong-US interest rate differential continued to widen, leading to increased ""sell Hong Kong dollars, buy US dollars"" arbitrage activities. As a result, the Hong Kong dollar exchange rate against the US dollar weakened at the beginning of the year, and the ""assured convertibility arrangement"" established in 2005 was triggered 26 times throughout the year, after being triggered for the first time in April. The Hong Kong Monetary Authority, in accordance with established mechanisms, fulfilled the assured convertibility arrangement by buying Hong Kong dollars and selling US dollars, absorbing HKD 103.5 billion in Hong Kong dollar sell orders in an orderly and transparent manner. As funds flowed out, the one-month Hong Kong interbank offered rate (HIBOR) rose by 105 basis points within 2018, and banks also raised their prime lending rates following the US interest rate hike in September last year. The Hong Kong Monetary Authority has repeatedly and timely clarified the operation of the ""assured convertibility arrangement"" through various channels, helping the public understand that capital outflows from Hong Kong dollars are an inevitable process of interest rate normalization in Hong Kong and a normal operation of the linked exchange rate system. The International Monetary Fund reaffirmed its support for Hong Kong's linked exchange rate system at the end of last year, and the Special Administrative Region government has also emphasized that the linked exchange rate is the cornerstone of Hong Kong's currency stability. This has helped to bolster public confidence in the linked exchange rate system."	['利率正常化', '加息', '匯率制度', '國際貨幣基金組織', '基金組織', '基點', '最優惠利率', '特區政府', '環球金融危機', '美國加息', '美國息率', '聯匯制度', '金管局', '金融體系', '香港銀行同業拆息']	{'利率正常化': 'interest rate normalization', '加息': 'interest rate hike', '匯率制度': 'exchange rate system', '國際貨幣基金組織': 'International Monetary Fund', '基金組織': '▔', '基點': 'basis points', '最優惠利率': 'prime', '特區政府': 'Region government', '環球金融危機': 'global financial crisis', '美國加息': 'US interest rates', '美國息率': 'US interest rates', '聯匯制度': 'rate system', '金管局': 'Authority', '金融體系': 'financial system', '香港銀行同業拆息': 'interbank'}	['interest rate normalization', 'interest rate hike', 'exchange rate system', 'international monetary fund', '▔', 'basis point', 'prime', 'region government', 'global financial crisis', 'us interest rate', 'us interest rate', 'rate system', 'authority', 'financial system', 'interbank']
3	{'二十國集團': 'G20', '企業管治': 'corporate governance', '公帑': 'public money', '國際監管標準': 'international regulatory standards', '大得不能倒': 'Too Big To Fail', '審慎監管': 'prudential supervision', '巴塞爾銀行監管委員會': 'Basel Committee on Banking Supervision', '法定最低要求': 'statutory minimum requirement', '流動覆蓋比率': 'liquidity coverage ratio', '環球金融危機': 'Global Financial Crisis', '監管標準': 'regulatory standards', '處置機制': 'resolution regime', '處置機制辦公室': 'Resolution Office', '處置預案': 'resolution plans', '資本充足': 'capital adequacy', '資本充足率': 'capital adequacy ratio', '金管局': 'HKMA', '金融市場': 'financial markets', '銀行業': 'banking sector', '銀行監管': 'banking supervision', '風險管理': 'risk management'}	2008年環球金融危機暴露了全球金融系統潛藏的種種弊端及隱患，促使國際間在過去十年協調推出一系列針對金融市場、金融機構的改革，包括在銀行業監管方面，提升企業管治和風險管理。金管局的銀行監管工作重點針對兩方面：一是着眼於銀行資產負債風險的審慎監管，二是銀行的行為操守，二者不可偏廢。資產負債風險監管方面，金管局作為巴塞爾銀行監管委員會(Basel Committee on Banking Supervision)及二十國集團轄下金融穩定理事會(FinancialStability Board)成員，有責任全面落實國際監管標準，確保香港銀行業穩健審慎地經營業務。去年底香港銀行資本充足率達20.3%，不但遠高於國際最低標準要求的8%，也較環球金融危機時的14.7%水平顯著提升。大型銀行去年第四季平均流動覆蓋比率達167.6%，同樣遠高於法定最低要求的90%。與此同時，為避免重蹈環球金融危機時需動用公帑拯救「大得不能倒」金融機構的覆轍，金融穩定理事會制訂了關於金融機構處置機制的國際標準。香港是亞洲區內少數已經全面落實符合機制要求的地區之一，金管局下設的處置機制辦公室正落實該機制的操作細則，要求銀行推行結構性變動令處置預案在需要時能有效實施，去年亦推出了《吸收虧損能力規則》，未來還會陸續推出更多相關規則。	"The 2008 global financial crisis exposed numerous hidden flaws and risks within the global financial system, prompting international coordination over the past decade to implement a series of reforms targeting financial markets and financial institutions, including enhanced corporate governance and risk management in the banking sector. The Hong Kong Monetary Authority (HKMA) focuses its banking supervision on two key areas: first, prudent regulation of banks' balance sheet risks, and second, the conduct and ethics of banks. Both aspects are equally important and cannot be neglected. In terms of balance sheet risk regulation, as a member of the Basel Committee on Banking Supervision and the Financial Stability Board under the G20, the HKMA has a responsibility to fully implement international regulatory standards, ensuring that Hong Kong's banking sector operates in a stable and prudent manner. At the end of last year, Hong Kong's banking sector had a capital adequacy ratio of 20.3%, which is not only significantly higher than the international minimum requirement of 8%, but also a marked improvement from the 14.7% level during the global financial crisis. In the fourth quarter of last year, the average liquidity coverage ratio of major banks reached 167.6%, far exceeding the statutory minimum requirement of 90%. At the same time, to avoid repeating the mistakes of the global financial crisis, where public funds had to be used to rescue ""too big to fail"" financial institutions, the Financial Stability Board established international standards for the resolution mechanisms of financial institutions. Hong Kong is one of the few regions in Asia that has fully implemented mechanisms in line with these requirements. The HKMA's Resolution Mechanism Office is currently implementing the operational details of this mechanism, requiring banks to make structural changes to ensure that resolution plans can be effectively implemented when needed. Last year, the HKMA also introduced the ""Loss Absorption Capacity Rules,"" and more related rules will be introduced in the future."	['二十國集團', '企業管治', '公帑', '國際監管標準', '大得不能倒', '審慎監管', '巴塞爾銀行監管委員會', '法定最低要求', '流動覆蓋比率', '環球金融危機', '監管標準', '處置機制', '處置機制辦公室', '處置預案', '資本充足', '資本充足率', '金管局', '金融市場', '銀行業', '銀行監管', '風險管理']	{'二十國集團': 'G20', '企業管治': 'corporate governance', '公帑': 'public funds', '國際監管標準': 'international regulatory standards', '大得不能倒': 'too big to fail', '審慎監管': 'prudent regulation', '巴塞爾銀行監管委員會': 'Basel Committee on Banking Supervision', '法定最低要求': 'statutory minimum requirement', '流動覆蓋比率': 'liquidity coverage ratio', '環球金融危機': 'global financial crisis', '監管標準': 'regulatory standards', '處置機制': 'resolution mechanisms', '處置機制辦公室': 'Resolution Mechanism Office', '處置預案': 'resolution plans', '資本充足': 'capital adequacy', '資本充足率': 'capital adequacy ratio', '金管局': 'HKMA', '金融市場': 'financial markets', '銀行業': 'banking sector', '銀行監管': 'banking supervision', '風險管理': 'risk management'}	['g20', 'corporate governance', 'public fund', 'international regulatory standard', 'too big to fail', 'prudent regulation', 'basel committee on banking supervision', 'statutory minimum requirement', 'liquidity coverage ratio', 'global financial crisis', 'regulatory standard', 'resolution mechanism', 'resolution mechanism office', 'resolution plan', 'capital adequacy', 'capital adequacy ratio', 'hkma', 'financial market', 'banking sector', 'banking supervision', 'risk management']
4	{'不良貸款比率': 'classified loan ratio', '股東權益回報率': 'return on equity', '資產質素': 'asset quality', '逆周期措施': 'countercyclical measures', '金管局': 'HKMA', '銀行業': 'banking sector', '銀行集團': 'banking groups', '零售銀行': 'retail banks'}	鑑於樓價持續上升，金管局未雨綢繆，在2009至2017年間共推出八輪逆周期措施，確保一旦地產市況逆轉，本港銀行體系有足夠的抗震能力應對衝擊。這些措施成效顯著：新造住宅平均按揭成數由2009年的64%降至2018年底的46%；平均供款與入息比率亦由2010年的41%下調至2018年底的34%。年內銀行信貸錄得4.4%的溫和增長，整體資產質素維持良好，零售銀行不良貸款比率進一步降至0.5%，遠低於國際及本港歷史平均水平。去年銀行業盈利持續增長，整體股東權益回報率連升兩年至13%；多家國際性銀行集團在本港的業務交出了不俗的成績表，成為集團盈利的重要支柱。	Given the sustained rise in property prices, the Hong Kong Monetary Authority (HKMA) took proactive measures, implementing eight rounds of countercyclical policies between 2009 and 2017 to ensure the local banking system had sufficient resilience to withstand potential shocks should the property market reverse. These measures proved highly effective: the average loan-to-value ratio for new residential mortgages fell from 64% in 2009 to 46% by the end of 2018; the average debt-to-income ratio also decreased from 41% in 2010 to 34% by the end of 2018. During the year, bank credit grew modestly by 4.4%, with overall asset quality remaining strong. The non-performing loan ratio for retail banking further declined to 0.5%, far below both international and local historical averages. Banking sector profitability continued to grow last year, with the overall return on equity rising for two consecutive years to 13%. Several international banking groups achieved strong performance in their Hong Kong operations, becoming key contributors to their group profits.	['不良貸款比率', '股東權益回報率', '資產質素', '逆周期措施', '金管局', '銀行業', '銀行集團', '零售銀行']	{'不良貸款比率': 'non-performing loan ratio', '股東權益回報率': 'return on equity', '資產質素': 'asset quality', '逆周期措施': 'countercyclical policies', '金管局': 'HKMA', '銀行業': 'banking sector', '銀行集團': 'banking groups', '零售銀行': 'retail banking'}	['non-performing loan ratio', 'return on equity', 'asset quality', 'countercyclical policy', 'hkma', 'banking sector', 'banking group', 'retail banking']
5	{'企業文化': 'corporate culture', '改革銀行文化': 'bank culture reform', '獎勵制度': 'incentive systems', '監管要求': 'regulatory requirements', '自我評估': 'self-assessment', '評估與回饋機制': 'assessment and feedback mechanisms', '金管局': 'HKMA', '銀行操守部': 'Banking Conduct Department', '銀行文化': 'bank culture initiative', '銀行文化的監管措施': 'supervisory measures for bank culture'}	在監管銀行的行為操守方面，金管局在2010年增設銀行操守部，促進銀行公平待客，並加強保障消費者權益。要做到標本兼治，除了訂出各種針對銀行營運基本操守的監管要求外，我們近年來大力推動改革銀行文化，鼓勵銀行循管治、獎勵制度、評估與回饋機制三方面推動穩善文化，務求銀行內部做到上行下效，在根本上恢復、提升客戶對銀行的信任和尊重。繼2017年金管局向全港銀行提供具體的指引，金管局在2018年底進一步推出銀行文化的監管措施，包括要求銀行就企業文化和落實有關措施作出自我評估等，令穩善銀行文化的三大支柱能有效執行。	To enhance the ethical conduct of banks, the Hong Kong Monetary Authority (HKMA) established the Banking Conduct Division in 2010 to promote fair treatment of customers and strengthen consumer protection. To achieve both curative and preventative measures, in addition to setting regulatory requirements for fundamental banking operations, we have vigorously promoted cultural reform in recent years, encouraging banks to foster a culture of sound governance through three key areas: management, incentive systems, and evaluation and feedback mechanisms. This aims to ensure that such values permeate throughout the bank, fundamentally restoring and enhancing customer trust and respect. Following the HKMA’s provision of specific guidelines to all banks in Hong Kong in 2017, the HKMA further launched regulatory measures on bank culture at the end of 2018, including requiring banks to conduct self-assessments of their corporate culture and the implementation of related measures, ensuring the three pillars of sound banking culture are effectively implemented.	['企業文化', '改革銀行文化', '獎勵制度', '監管要求', '自我評估', '評估與回饋機制', '金管局', '銀行操守部', '銀行文化', '銀行文化的監管措施']	{'企業文化': 'corporate culture', '改革銀行文化': 'cultural reform', '獎勵制度': 'incentive systems', '監管要求': 'regulatory requirements', '自我評估': 'self-assessments', '評估與回饋機制': 'evaluation and feedback mechanisms', '金管局': 'HKMA', '銀行操守部': 'Banking Conduct Division', '銀行文化': 'banking culture', '銀行文化的監管措施': 'bank culture regulatory measures'}	['corporate culture', 'cultural reform', 'incentive system', 'regulatory requirement', 'self', 'evaluation and feedback mechanism', 'hkma', 'banking conduct division', 'banking culture', 'bank culture regulatory measure']
6	{'互聯網和移動金融': 'internet and mobile financial services', '便利店': 'convenience stores', '易辦事': 'Electronic Payment Services', '普及金融': 'financial inclusion', '無障礙設施': 'barrier-free facilities', '網絡': 'cyber space', '聲音導航的自動櫃員機': 'voice navigation ATMs', '金管局': 'HKMA', '銀行業': 'banking sector', '香港郵政': 'Hongkong Post'}	雖然互聯網和移動金融是全球趨勢，金管局去年仍繼續促進普及金融，照顧未能應用新科技的社群。例如我們連同香港銀行公會推動便利店推出長者透過「易辦事」免購物提款服務，有關便利店網絡已增至逾300家；我們並聯絡香港郵政在7家主要位於離島和新界的郵政局推出長者提款易服務。銀行業界響應金管局的建議，年內積極增加無障礙設施，提供傷健共融的銀行服務，例子之一是設有聲音導航的自動櫃員機數目一年內增加逾十倍至超過700部。另外，在金管局積極推動下，我們預期將會陸續有銀行在偏遠地區開設更多實體分行和增設流動銀行服務，便利市民。	Although the internet and mobile finance are global trends, the Hong Kong Monetary Authority (HKMA) continued to promote financial inclusion last year, ensuring that those unfamiliar with new technologies are not left behind. For example, in partnership with the Hong Kong Bankers' Association, we have expanded a convenient cash withdrawal service for seniors at over 300 local convenience stores, allowing them to access funds without making a purchase. We have also collaborated with Hong Kong Post to offer this service at seven post offices located on the outlying islands and in the New Territories. Responding to the HKMA’s recommendations, banks have significantly increased accessibility features, including more than tenfold the number of ATMs with voice navigation, now exceeding 700. Furthermore, the HKMA is encouraging banks to establish more physical branches and offer mobile banking services in remote areas, making banking more accessible to all citizens.	['互聯網和移動金融', '便利店', '易辦事', '普及金融', '無障礙設施', '網絡', '聲音導航的自動櫃員機', '金管局', '銀行業', '香港郵政']	{'互聯網和移動金融': 'internet and mobile finance', '便利店': 'convenience stores', '易辦事': '▔', '普及金融': 'financial inclusion', '無障礙設施': 'accessibility features', '網絡': 'internet', '聲音導航的自動櫃員機': 'voice navigation ATMs', '金管局': 'HKMA', '銀行業': '▔', '香港郵政': 'Kong'}	['internet and mobile finance', 'convenience store', '▔', 'financial inclusion', 'accessibility feature', 'internet', 'voice navigation atm', 'hkma', '▔', 'kong']
7	{'智慧銀行': 'Smart Banking'}	# 智慧銀行 嶄新體驗	# Smart Banking: A Revolutionary Experience	['智慧銀行']	{'智慧銀行': 'Smart Banking'}	['smart banking']
