	terms	src_raw	mt_raw	src_terms	alg_terms	norm_tgt_terms
320	{'exchange fund': '外匯基金', 'hkma': '金管局', 'the exchange fund': '外匯基金', 'asset class': '資產類別', 'external fund manager': '外聘投資經理', 'external manager': '外聘投資經理', 'insight': '匯思', 'list equity portfolios': '上市股票組合', 'portfolios': '資產組合'}	In addition to managing assets internally, the HKMA employs external fund managers to manage about 29% of the Exchange Fund’s assets, including all of its listed equity portfolios and other specialised asset classes.  The purpose of engaging external managers is to tap the best investment expertise available in the market to realise sustainable returns, draw on diverse and complementary investment styles, and gain market insights and technical expertise in investment.	此外管理內部資產，香港金融管理局僱用外部基金經理管理約29%的交換基金資產，包括其所有上市股權投資組合和其他特別資產類別。 參與外部經理的目的在於挖掘市場上可獲得的最佳投資專業知識，獲取可持續的回報，汲取多元且互補的投資方式，並獲得市場見解和技術專業知識。	['exchange fund', 'hkma', 'the exchange fund', 'asset class', 'external fund manager', 'external manager', 'insight', 'list equity portfolios', 'portfolios']	{'exchange fund': '交換基金', 'hkma': '香港金融管理局', 'the exchange fund': '交換基金', 'asset class': '資產類 別', 'external fund manager': '外部基金經理', 'external manager': '外部基金經理', 'insight': '見解', 'list equity portfolios': '上市 股權 組合', 'portfolios': '投資組合'}	['交換基金', '香港金融管理局', '交換基金', '資產類 別', '外部基金經理', '外部基金經理', '見解', '上市 股權 組合', '投資組合']
321	{'custodian fee': '託管費', 'external manager': '外聘投資經理', 'fund management': '基金管理', 'transaction cost': '交易費'}	Expenditure relating to the use of external managers includes fund management and custodian fees, transaction costs, and withholding and other taxes.  The expenditure is determined primarily by market factors and may fluctuate from year to year.	有關使用外部經理的管理支出包括基金管理費及保管費、交易成本，以及預扣及其他稅款。此項支出主要由市場因素制定，可能不同於年年。	['custodian fee', 'external manager', 'fund management', 'transaction cost']	{'custodian fee': '保管費', 'external manager': '外部經理', 'fund management': '基金管理', 'transaction cost': '交易成本'}	['保管費', '外部經理', '基金管理', '交易成本']
322	{'risk management and compliance': '風險管理及監察', 'risk management': '風險管理'}	# Risk management and compliance	# 風險管理與合規	['risk management and compliance', 'risk management']	{'risk management and compliance': '風險管理與合規', 'risk management': '風險管理'}	['風險管理與合規', '風險管理']
323	{'hkma': '金管局', 'three line of defence': '三重防線', 'investment environment': '投資環境', 'operational risk': '業務操作風險', 'portfolios': '資產組合', 'risk management': '風險管理', 'risk monitoring and compliance system': '風險監察及合規制度', 'strategic plan': '策略計劃'}	The growing complexity of the investment environment underlines the importance of risk management.  The HKMA sets stringent controls and investment guidelines for both internally and externally managed portfolios, and ensures a proper risk monitoring and compliance system is in place. Three lines of defence are in place to implement effective risk management and governance of investment-related activities.  Key risk categories (including credit, market, liquidity and operational risks) are regularly monitored, and the risk management process provides a robust framework to support strategic planning and investment diversification.	投資環境的複雜性越來越增加，突顯了風險管理的重要性。金管局組嚴格的控制和投資指引，適用於內部和外部管理的投資組合，並確保嚴謹的風險監察和合規系統得以推行。為有效實施風險管理和投資相關活動的治理，已推行三道防線。主要風險類別（包括信用、市場、流動性及營運風險）會定期監察，而風險管理過程提供良好框架以支持策略規劃和投資多元化。	['hkma', 'three line of defence', 'investment environment', 'operational risk', 'portfolios', 'risk management', 'risk monitoring and compliance system', 'strategic plan']	{'hkma': '金管局', 'three line of defence': '三道防線', 'investment environment': '投資環境', 'operational risk': '營運風險', 'portfolios': '投資組合', 'risk management': '風險管理', 'risk monitoring and compliance system': '風險監察和合規系統', 'strategic plan': '策略規劃'}	['金管局', '三道防線', '投資環境', '營運風險', '投資組合', '風險管理', '風險監察和合規系統', '策略規劃']
324	{'responsible investment': '負責任投資'}	# RESPONSIBLE INVESTMENT	# 負責任投資	['responsible investment']	{'responsible investment': '負責任投資'}	['負責任投資']
325	{'esg': '環境、社會及管治', 'esg factor': 'ESG因素', 'exchange fund': '外匯基金', 'hkma': '金管局', 'responsible investment': '負責任投資', 'sustainability': '可持續發展', 'the exchange fund': '外匯基金', 'associate': '聯營公司', 'long - term risk - adjust return': '經風險調整長期收益', 'private market investment': '私募市場投資', 'responsible investment framework': '負責任投資框架', 'risk - adjust return': '經風險調整長期收益', 'sustainable long - term economic performance': '可持續長期表現', 'environmental , social and governance': '環境、社會及管治(ESG)'}	The HKMA believes that, by putting an appropriate emphasis on responsible investment and sustainable long-term economic performance, it can better achieve the investment objectives of the Exchange Fund and reduce risks associated with environmental, social and governance (ESG)- related matters of its underlying investments.  The HKMA supports responsible investment by integrating ESG factors into the investment processes for both public and private market investments of the Exchange Fund, underpinned by the guiding principle that priority will generally be given to ESG investments if the long-term risk-adjusted return is comparable with other investments.  For more details about the HKMA’s responsible investment framework and implementation, see the Sustainability chapter on pages 184 to 191.	香港金融管理局（HKMA）認為，透過在投資過程中適當重視負責任的投資及可持續的長期經濟表現，可以更好地實現儲備基金的投資目標，並減低與其基礎投資相關的環境、社會及治理（ESG）事項所帶來的風險。香港金融管理局支持負責任的投資，方法是將ESG因素納入儲備基金的公眾及私人市場投資過程中，其指導原則是，若長期風險調整後的回報與其他投資相若，則一般會優先考慮ESG投資。如欲了解更多有關香港金融管理局負責任投資架構及實施細節，請參閱第184至191頁的可持續發展章節。	['esg', 'esg factor', 'exchange fund', 'hkma', 'responsible investment', 'sustainability', 'the exchange fund', 'associate', 'long - term risk - adjust return', 'private market investment', 'responsible investment framework', 'risk - adjust return', 'sustainable long - term economic performance', 'environmental , social and governance']	{'esg': 'ESG', 'esg factor': 'ESG因素', 'exchange fund': '儲備基金', 'hkma': '香港金融管理局', 'responsible investment': '負責任 投資', 'sustainability': '可持續發展', 'the exchange fund': '儲備基金', 'associate': '香港金融管理局', 'long - term risk - adjust return': '期風險 調整 回報', 'private market investment': '私人市場投資', 'responsible investment framework': '負責任投資架構', 'risk - adjust return': '風險 調整 回報', 'sustainable long - term economic performance': '期經濟表現', 'environmental , social and governance': '環境、社會及治理'}	['ESG', 'ESG因素', '儲備基金', '香港金融管理局', '負責任 投資', '可持續發展', '儲備基金', '香港金融管理局', '期風險 調整 回報', '私人市場投資', '負責任投資架構', '風險 調整 回報', '期經濟表現', '環境、社會及治理']
326	{'exchange fund': '外匯基金', 'performance of the exchange fund': '外匯基金的表現', 'the exchange fund': '外匯基金'}	# PERFORMANCE OF THE EXCHANGE FUND	# 外匯基金績效	['exchange fund', 'performance of the exchange fund', 'the exchange fund']	{'exchange fund': '外匯基金', 'performance of the exchange fund': '外匯基金績效', 'the exchange fund': '外匯基金'}	['外匯基金', '外匯基金績效', '外匯基金']
327	{'financial market': '金融市場'}	# The financial markets in 2021	# 2021年金融市場	['financial market']	{'financial market': '金融市場'}	['金融市場']
328	"{'hang seng index': '恒生指數', 'mainland': '內地', ""standard & poor 's 500 index"": '標準普爾500指數', 'financial market': '金融市場', 'fiscal measure': '財政措施', 'monetary policy': '貨幣政策', 'ultra - loose monetary policy': '超寬鬆的貨幣政策'}"	Global equity markets rose sharply and hit new record highs on the back of ultra-loose monetary policies and fiscal measures, driving an accelerated recovery of the global economy and financial markets.  However, Hong Kong and Mainland equity markets underperformed amid market reforms.  The Standard & Poor’s 500 Index in the US rose by 27%, while the Hang Seng Index in Hong Kong dropped by 14%.	全球股市上升急，在超寬鬆貨幣政策和財政措施下衝擊新紀錄高位，推動全球經濟和金融市場加速復甦。然而，香港和中國內地股市在改革隨着市場中遜色。美國標準普爾500指數上升了27%，而香港恆生指數則下跌了14%。	"['hang seng index', 'mainland', ""standard & poor 's 500 index"", 'financial market', 'fiscal measure', 'monetary policy', 'ultra - loose monetary policy']"	"{'hang seng index': '恆生指數', 'mainland': '地', ""standard & poor 's 500 index"": '標準普爾500指數', 'financial market': '金融市場', 'fiscal measure': '財政措施', 'monetary policy': '貨幣政策', 'ultra - loose monetary policy': '超寬鬆貨幣政策'}"	['恆生指數', '地', '標準普爾500指數', '金融市場', '財政措施', '貨幣政策', '超寬鬆貨幣政策']
329	{'fed': '美聯儲', 'us federal reserve': '美國聯邦儲備局', 'us treasury yield': '美國國債收益率', 'basis point': '基點', 'bond market': '債市'}	For the bond markets, rising inflation expectations and tapering of asset purchases by the US Federal Reserve (Fed) led to a rise in US Treasury yields and falling bond prices during 2021.  Ten-year US Treasury yields increased by about 60 basis points from 0.9% at the beginning of the year to 1.5% at the end of the year.	對於債券市場而言，2021年通貨膨脹預期上升，加上美國聯準會（Fed）縮減資產購買規模，導致美國國債收益率上漲、債券價格下跌。十年期美國國債收益率從年初的0.9%上升至年底的1.5%，增幅約為60個基點。	['fed', 'us federal reserve', 'us treasury yield', 'basis point', 'bond market']	{'fed': '▔', 'us federal reserve': '美國聯準會', 'us treasury yield': '美國國債收益率', 'basis point': '基點', 'bond market': '債券 市場'}	['▔', '美國聯準會', '美國國債收益率', '基點', '債券 市場']
330	{'fed': '美聯儲', 'currency market': '貨幣市場'}	In the currency markets, the US dollar strengthened against other major currencies, particularly towards the end of 2021, on the back of expectations about the Fed’s tapering pace. In particular, the euro and the yen depreciated by 7.1% and 10.3% against the US dollar respectively.	在貨幣市場上，美元對其他主要貨幣轉強，尤其接近年底，因市場預期聯邦儲備理事會縮減購債步伐。特別是，歐元和日圓分別貶值7.1%和10.3%對美元。	['fed', 'currency market']	{'fed': '▔', 'currency market': '貨幣市場'}	['▔', '貨幣市場']
331	{'bond and equity market': '債市及股市'}	The performance of major currency, bond and equity markets in 2021 is shown in Table 1.	2021年主要貨幣、債券及股權市場的表現如表1所示。	['bond and equity market']	{'bond and equity market': '債券及股權市場'}	['債券及股權市場']
332	{'exchange fund': '外匯基金', 'the exchange fund': '外匯基金'}	# The Exchange Fund’s performance	# 聯匯基金表現	['exchange fund', 'the exchange fund']	{'exchange fund': '聯匯基金', 'the exchange fund': '聯匯基金'}	['聯匯基金', '聯匯基金']
333	{'exchange fund': '外匯基金', 'hong kong equity': '港股', 'strategic portfolio': '策略性資產組合', 'the exchange fund': '外匯基金', 'investment income': '投資收入', 'investment - hold subsidiary': '投資控股附屬公司', 'subsidiary': '附屬公司', 'valuation gain': '估值收益'}	The Exchange Fund recorded an investment income of HK$191.9 billion in 2021.  This comprised gains on bonds of HK$12.6 billion, net gains on equities of HK$47.8 billion (with gains of HK$68.8 billion from foreign equities, and losses of HK$21.0 billion from Hong Kong equities), a positive currency translation effect of HK$16.8 billion on non-Hong Kong dollar assets and gains of HK$114.7 billion on other investments held by the investment-holding subsidiaries of the Fund. Separately, the Strategic Portfolio recorded a valuation gain of HK$3.1 billion.	貨幣儲備基金於2021年錄得投資收益港元1,919十億。這包括債券收益港元126十億，權益淨收益港元478十億（其中海外權益收益港元688億，香港權益虧損港元21十億），以港元計值非港元資產的正貨幣轉換效應港元168億，以及基金投資控股附屬公司持有的其他投資收益港元1,147十億。此外，策略投資組合錄得估值收益港元31億。	['exchange fund', 'hong kong equity', 'strategic portfolio', 'the exchange fund', 'investment income', 'investment - hold subsidiary', 'subsidiary', 'valuation gain']	{'exchange fund': '貨幣 基金', 'hong kong equity': '香港 權益', 'strategic portfolio': '策略投資組合', 'the exchange fund': '貨幣 基金', 'investment income': '投資收益', 'investment - hold subsidiary': '投資控股附屬公司', 'subsidiary': '附屬公司', 'valuation gain': '估值收益'}	['貨幣 基金', '香港 權益', '策略投資組合', '貨幣 基金', '投資收益', '投資控股附屬公司', '附屬公司', '估值收益']
334	{'exchange fund': '外匯基金', 'ltgp': '長期增長組合', 'the exchange fund': '外匯基金', 'investment commitment': '已承擔但尚未提取作投資的總額', 'private equity': '私募股權'}	Total assets of the Exchange Fund reached HK$4,570.2 billion at the end of the year.  The market value of investments under the LTGP totalled HK$515.3 billion, with private equity amounting to HK$392.5 billion and real estate HK$122.8 billion.  Outstanding investment commitments of the LTGP amounted to HK$225.7 billion.	聯邦基金總值達到 港元 45,702 十億元，年底。信託基金計劃 (LTGP) 投資的市場價值總值為 港元 5,153 十億元，其中私募股權總值為 港元 3,925 十億元，而房地產則為 港元 1,228 十億元。信託基金計劃 (LTGP) 的未償投資承諾總值為 港元 2,257 十億元。	['exchange fund', 'ltgp', 'the exchange fund', 'investment commitment', 'private equity']	{'exchange fund': '▔', 'ltgp': 'LTGP', 'the exchange fund': '▔', 'investment commitment': '未償投資承諾', 'private equity': '私募股權'}	['▔', 'LTGP', '▔', '未償投資承諾', '私募股權']
335	{'bp': '支持組合', 'exchange fund': '外匯基金', 'ip': '投資組合', 'ltgp': '長期增長組合', 'strategic portfolio': '策略性資產組合', 'the exchange fund': '外匯基金', 'annualised internal rate of return': '內部回報率年率', 'inception': '開展投資以來', 'internal rate of return': '內部回報率'}	The investment return of the Exchange Fund in 2021, excluding the Strategic Portfolio, was 4.1%.  Specifically, the IP achieved a rate of return of 3.7%, while the BP gained 0.4%.  The LTGP has recorded an annualised internal rate of return of 15.4% since its inception in 2009.	2021年，不包括戰略組合在內，滙豐基金的投資回報率為4.1%。具體而言，IP達致3.7%的回報率，而BP則錄得0.4%的回報。自2009年成立以來，LTGP錄得年化內部回報率為15.4%。	['bp', 'exchange fund', 'ip', 'ltgp', 'strategic portfolio', 'the exchange fund', 'annualised internal rate of return', 'inception', 'internal rate of return']	{'bp': 'BP', 'exchange fund': '滙 基金', 'ip': 'IP', 'ltgp': 'LTGP', 'strategic portfolio': '戰略組合', 'the exchange fund': '滙 基金', 'annualised internal rate of return': '年化內部回報率', 'inception': '成立', 'internal rate of return': '內部回報率'}	['BP', '滙 基金', 'IP', 'LTGP', '戰略組合', '滙 基金', '年化內部回報率', '成立', '內部回報率']
336	{'exchange fund': '外匯基金', 'the exchange fund': '外匯基金'}	The annual returns of the Exchange Fund from 1994 to 2021 are set out in Chart 1.  Table 2 shows the 2021 investment return and the average investment returns of the Fund over several different time horizons.  The average return was 5.3% during 2019–2021, 4.7% during 2017–2021, 3.3% during 2012–2021 and 4.8% since 1994.  Table 3 shows the currency mix of the Fund’s assets on 31 December 2021.	聯邦投資公司的年度回報，自 1994 年至 2021 年，載於圖 1。表 2 顯示 2021 年的投資回報以及該基金在若干不同時段的平均投資回報。2019 年至 2021 年的平均回報為 5.3%，2017 年至 2021 年為 4.7%，2012 至 2021 年為 3.3%，自 1994 年以來為 4.8%。表 3 顯示 2021 年 12 月 31 日該基金資產的貨幣構成。	['exchange fund', 'the exchange fund']	{'exchange fund': '▔', 'the exchange fund': '▔'}	['▔', '▔']
337	{'exchange fund': '外匯基金', 'the exchange fund': '外匯基金', 'financial statement': '財務報表'}	"See pages 211 to 319 for the audited 2021 financial statements of the Exchange Fund.
"	"見到 頁 211 至 319 為 Exchange Fund 的 2021 年經審計財務報表。
"	['exchange fund', 'the exchange fund', 'financial statement']	{'exchange fund': '▔', 'the exchange fund': 'Exchange Fund', 'financial statement': '財務報表'}	['▔', 'Exchange Fund', '財務報表']
338	{'corporate function': '機構職能', 'hkma': '金管局', 'information centre': '資訊中心', 'information technology': '資訊科技', 'information technology capability': '資訊科技能力', 'professionalism': '專業水準', 'transparency': '透明度'}	Corporate functions support the operation of the HKMA with a high level of transparency, accountability, efficiency and professionalism.  To facilitate public understanding about its policies and operations, the HKMA maintains effective communication with the community and the market through traditional and social media, its website, the Information Centre and other channels. Within the institution, the HKMA conscientiously builds an agile and sustainable workforce, institutes rigorous financial discipline and upgrades information technology capabilities to adapt to changes and ensure effective implementation of its policies and initiatives.	企業職能以高度的透明度、問責性、效率和專業精神支持香港金管局的運作。為促進公眾對其政策和運作的理解，香港金管局透過傳統媒體和社交媒體、其網站、資訊中心及其他渠道，保持與社會和市場的聯繫。對內，香港金管局認真建立靈活應變且可持續的員工隊伍，建立嚴格的財務紀律，並提升資訊科技能力，以應對變化，確保其政策和舉措的有效實施。	['corporate function', 'hkma', 'information centre', 'information technology', 'information technology capability', 'professionalism', 'transparency']	{'corporate function': '企業職能', 'hkma': '金管局', 'information centre': '資訊中心', 'information technology': '資訊科技', 'information technology capability': '資訊科技能力', 'professionalism': '專業精神', 'transparency': '透明度'}	['企業職能', '金管局', '資訊中心', '資訊科技', '資訊科技能力', '專業精神', '透明度']
339	{'transparency': '透明度'}	# TRANSPARENCY	# 透明度	['transparency']	{'transparency': '透明度'}	['透明度']
340	{'hkma': '金管局', 'transparency': '透明度'}	The HKMA works closely with the media to enhance transparency and promote public understanding of its policies and operations.  In 2021, the HKMA held or participated in 169 physical and virtual events, comprising eight press conferences, eight stand-up interviews and 153 other public functions. A further 27 media interviews were arranged.  A total of 632 bilingual press releases were issued over the course of the year and a large number of media enquiries were handled on a daily basis.	香港金融管理局與媒體緊密合作，以提升透明度並推動公眾對其政策及運作的了解。2021年，香港金融管理局舉辦或參與了169項實體及虛擬活動，包括八場記者會、八次即席訪問及153項其他公眾活動。另外安排了27次媒體訪問。全年共發佈了632份雙語新聞發佈稿，並每日處理大量媒體查詢。	['hkma', 'transparency']	{'hkma': '香港金融管理局', 'transparency': '透明度'}	['香港金融管理局', '透明度']
341	{'financial technology': '金融科技', 'fintech': '金融科技', 'hkma': '金管局', 'mainland': '內地', 'interest rate': '利率', 'interest rate benchmarks': '利率基準'}	To raise awareness of the HKMA’s key functions, press conferences and media briefings were organised for local, Mainland and foreign media.  Topics included the Connect schemes, financial technology (fintech) and the reform of interest rate benchmarks.	為提升香港金融管理局的主要主題 意識，我們為本地、內地及外地媒體 舉辦新聞發佈會及媒體簡報。 包括「聯繫」計劃、金融科技 (fintech) 以及利率指標改革。	['financial technology', 'fintech', 'hkma', 'mainland', 'interest rate', 'interest rate benchmarks']	{'financial technology': '金融科技', 'fintech': '金融科技', 'hkma': '香港金融管理局', 'mainland': '內地', 'interest rate': '利率', 'interest rate benchmarks': '利率指標'}	['金融科技', '金融科技', '香港金融管理局', '內地', '利率', '利率指標']
342	{'fintech': '金融科技', 'hkma': '金管局', 'green finance': '綠色金融', 'pandemic': '疫情', 'phishing scam': '網絡釣魚騙案'}	To engage and interact with the public in a timely manner, the HKMA maintains five social media channels (Facebook, Instagram, LinkedIn, Twitter and YouTube) with over 80,000 followers.  The HKMA utilises its social media channels to raise public awareness on a wide range of topics notably phishing scams, which increased significantly during the pandemic.  In addition, extensive promotion campaigns on green finance, fintech and the Connect schemes were conducted via social media to keep the public abreast of the latest development trends.	為及時與公眾保持聯繫，香港金融管理局保持五個社交媒體渠道（Facebook、Instagram、LinkedIn、Twitter 及 YouTube），擁有超過 80,000 名追蹤者。香港金融管理局利用其社交媒體渠道，提升公眾對廣泛主題的意識，特別是網絡釣魚詐騙，此類詐騙在疫情期間顯著上升。此外，透過社交媒體進行了廣泛的推廣活動，主題包括綠色金融、金融科技及聯繫計劃，以讓公眾掌握最新發展趨勢。	['fintech', 'hkma', 'green finance', 'pandemic', 'phishing scam']	{'fintech': '金融科技', 'hkma': '香港金融管理局', 'green finance': '綠色金融', 'pandemic': '疫情', 'phishing scam': '網絡釣魚詐騙'}	['金融科技', '香港金融管理局', '綠色金融', '疫情', '網絡釣魚詐騙']
343	{'eddie yue': '余偉文', 'fintech': '金融科技', 'hkma': '金管局', 'hong kong fintech week': '香港金融科技周', 'hong kong fintech week 2021': '香港金融科技周2021'}	Mr Eddie Yue, Chief Executive of HKMA, moderates a virtual panel discussion at the Hong Kong FinTech Week 2021	葉奕雄先生，香港金融管理局局長，於2021年香港金融科技週上主持虛擬小組討論。	['eddie yue', 'fintech', 'hkma', 'hong kong fintech week', 'hong kong fintech week 2021']	{'eddie yue': '葉奕雄', 'fintech': '金融科技', 'hkma': '香港金融管理局', 'hong kong fintech week': '香港金融科技週', 'hong kong fintech week 2021': '▔'}	['葉奕雄', '金融科技', '香港金融管理局', '香港金融科技週', '▔']
