	terms	src_raw	mt_raw	src_terms	alg_terms	norm_tgt_terms
0	{'balance sheet': '資產負債表', 'emerging market': '新興市場', 'hang seng index': '恒生指數', 'msci emerging market index': 'MSCI新興市場指數', 'capital outflow': '資金外流', 'emerge market economy': '新興經濟體', 'emerge market': '新興市場', 'real economy': '實體經濟', 'stock market': '股市'}	In 2017, the global economy and financial markets performed much better than expected: the real economy saw steady growth; inflation remained subdued; the three interest rate hikes and the reduction in the balance sheet by the US Federal Reserve during the year did not result in capital outflows from emerging market economies or a strengthening of the US dollar. Amid bullish sentiment, global stock markets, including the three major US stock indices, kept hitting new highs. The MSCI Emerging Markets Index surged by 34%. The Hang Seng Index gained nearly 8,000 points (or 36%) in 2017 and surpassed the 30,000-point level to reach an all-time high in January 2018.	二〇一七年，全球經濟和金融市場表現好於預期：實體經濟見穩健增長；通脹維持溫和；美國聯邦儲備局當年三次加息及縮減資產負債表並未導致新興經濟體資金外流或美元升值。在樂觀情緒的推動下，全球股市，包括美國三大股指，持續創下新高。MSCI新興市場指數上漲了34%。恒生指數在2017年上漲了近8,000點（或36%），並於2018年一月突破30,000點水平，創下歷史新高。	['balance sheet', 'emerging market', 'hang seng index', 'msci emerging market index', 'capital outflow', 'emerge market economy', 'emerge market', 'real economy', 'stock market']	{'balance sheet': '資產負債表', 'emerging market': '新興經濟體', 'hang seng index': '恒生指數', 'msci emerging market index': 'MSCI新興市場指數', 'capital outflow': '資金外流', 'emerge market economy': '新興經濟體', 'emerge market': '新興市場', 'real economy': '實體經濟', 'stock market': '股市'}	['資產負債表', '新興經濟體', '恒生指數', 'MSCI新興市場指數', '資金外流', '新興經濟體', '新興市場', '實體經濟', '股市']
1	{'10 - year us treasury yield': '美國十年期國庫債券收益率', 'dow jones index': '道指', 'hang seng index': '恒生指數', 'us treasury': '美國國庫券', 'asset market volatility': '資產市場波動', 'capital outflow': '資金外流', 'financial system': '金融體系', 'fund flow': '資金流向', 'market valuation': '市場估值', 'stock market': '股市'}	Many investors were filled with optimism, even exuberance, in such a favourable environment. However, this was until early February this year when the latest data showed a higher than expected wage increase in the US, prompting investors to reappraise inflation risks and triggering significant corrections to global stock markets. The Dow Jones Index fell more than 1,000 points in two days during the second week of February, and the Hang Seng Index dropped more than 3,000 points in the same week. The 10-year US Treasury yield surged to as high as 2.95%. The swift reversal of fund flows indicated that the record high market valuation was not built on a solid foundation. It also reminded us of the importance of a sound and robust financial system for Hong Kong to meet the challenges brought by asset market volatility and capital outflows.	許多投資者在如此有利的環境下充滿樂觀，甚至欣喜若狂。然而，直到今年二月初，最新的數據顯示美國的工資增長超出預期，促使投資者重新評估通膨風險，並引發全球股市的顯著調整。道指在二月初的第二週內下跌超過一千點，恒生指數也在同一週下跌超過三千點。10年期美國國庫券收益率飆升至高達2.95%。資金流向的迅速逆轉表明，創紀錄的市場估值並非建立在堅實的基礎之上。它也提醒我們，香港需要一個健全且穩健的金融體系，以應對資產市場波動和資金外流帶來的挑戰。	['10 - year us treasury yield', 'dow jones index', 'hang seng index', 'us treasury', 'asset market volatility', 'capital outflow', 'financial system', 'fund flow', 'market valuation', 'stock market']	{'10 - year us treasury yield': '10年期美國國庫券收益率', 'dow jones index': '道指', 'hang seng index': '恒生指數', 'us treasury': '美國國庫券', 'asset market volatility': '資產市場波動', 'capital outflow': '資金外流', 'financial system': '金融體系', 'fund flow': '資金流向', 'market valuation': '市場估值', 'stock market': '股市'}	['10年期美國國庫券收益率', '道指', '恒生指數', '美國國庫券', '資產市場波動', '資金外流', '金融體系', '資金流向', '市場估值', '股市']
2	{'banking system': '銀行體系', 'banking system resilience': '抗禦能力'}	# Banking system resilience boosted by precautionary measures	# 預防措施提升了銀行體系的抗禦能力。	['banking system', 'banking system resilience']	{'banking system': '銀行體系', 'banking system resilience': '銀行 體系 能力'}	['銀行體系', '銀行 體系 能力']
3	{'banking system': '銀行體系', 'hkma': '金管局', 'countercyclical measure': '逆周期措施', 'credit risk': '信用風險', 'debt servicing ratio': '供款與入息比率', 'financial system': '金融體系', 'loan - to - value ratio': '按揭成數', 'property market': '樓市', 'risk mitigation measure': '風險管控措施'}	As the saying goes, “prevention is better than cure”. The HKMA implemented further risk mitigation measures in 2017 to safeguard the stability of Hong Kong’s banking and financial systems. In May, we introduced the eighth round of countercyclical measures for banks’ mortgage loans and strengthened banks’ credit risk management on lending to property developers, with the aim of enhancing the banking system’s resilience to shocks arising from any downturn in the property market. With the several rounds of measures, the average loan-to-value ratio of new residential mortgage loans fell to 49% at the end of 2017 from 64% in September 2009, while the average debt servicing ratio also declined to 35% from 41% in August 2010.	防患未然總比治病已晚。金管局於2017年實施進一步的風險管控措施，以確保香港銀行及金融體系的穩定。五月，我們為銀行的按揭貸款推出第八輪逆周期措施，並加強銀行對樓市發展商貸款的信用風險管理，旨在提升銀行體系對樓市任何下行風險的抗風險能力。透過多輪措施，新住宅按揭貸款的平均按揭成數由2009年9月的64%降至2017年底的49%，而平均供款與入息比率亦由2010年8月的41%降至35%。	['banking system', 'hkma', 'countercyclical measure', 'credit risk', 'debt servicing ratio', 'financial system', 'loan - to - value ratio', 'property market', 'risk mitigation measure']	{'banking system': '銀行體系', 'hkma': '金管局', 'countercyclical measure': '逆周期措施', 'credit risk': '信用風險', 'debt servicing ratio': '供款與入息比率', 'financial system': '金融體系', 'loan - to - value ratio': '按揭成數', 'property market': '樓市', 'risk mitigation measure': '風險管控措施'}	['銀行體系', '金管局', '逆周期措施', '信用風險', '供款與入息比率', '金融體系', '按揭成數', '樓市', '風險管控措施']
4	{'resolution office': '處置機制辦公室', 'financial crisis': '金融危機', 'financial institution': '金融機構', 'financial system': '金融體系', 'global financial crisis': '環球金融危機', 'international standard': '國際訂立的標準'}	In 2017, we established the Resolution Office to implement international standards on the resolution of non-viable financial institutions that are considered “too big to fail”. This will help prevent a recurrence of a global financial crisis similar to the one in 2008 where public money was used to save failing financial institutions, and will minimise the impact of their closures on the financial system, the economy and the community at large.	二零一七年，我們成立了處置機制辦公室，以執行國際訂立的標準，處理那些被視為「大到不能倒」的不可行的金融機構。這將有助於防止類似二零零八年環球金融危機再次發生，當時公帑被用於拯救瀕臨破產的金融機構，並將其倒閉對金融體系、經濟及社會大眾的影響降至最低。	['resolution office', 'financial crisis', 'financial institution', 'financial system', 'global financial crisis', 'international standard']	{'resolution office': '處置機制辦公室', 'financial crisis': '金融危機', 'financial institution': '金融機構', 'financial system': '金融體系', 'global financial crisis': '環球金融危機', 'international standard': '國際訂立的標準'}	['處置機制辦公室', '金融危機', '金融機構', '金融體系', '環球金融危機', '國際訂立的標準']
5	{'banking system': '銀行體系', 'capital adequacy': '資本充足', 'international financial centre': '國際金融中心', 'asset quality': '資產質素', 'banking industry': '銀行業', 'capital adequacy ratio': '資本充足率', 'liquidity': '流動性', 'liquidity ratio': '流動性比率', 'retail bank': '零售銀行', 'return on equity': '股東權益回報率', 'statutory requirement': '法定要求', 'total loan': '貸款總額'}	Robust risk management is the cornerstone of steady and sustainable development of the banking sector. The liquidity ratio and capital adequacy ratio of Hong Kong’s banking system are well above the applicable statutory requirements and among the highest in the world. This undoubtedly reflects the high resilience of Hong Kong’s banking system. Indeed, the banking sector registered strong growth in 2017, with total loans increasing by 16%, while the asset quality also held up well. The classified loan ratio of retail banks fell to 0.54% from 0.72% in 2016, well below the long-term average of 2.2% since 2000. The banking industry’s overall return on equity (based on pre-tax operating profits) reached 11.74% in 2017, a very healthy level compared with other international financial centres.	穩健的風險管理是銀行業穩步可持續發展的基石。香港銀行體系的流動性比率及資本充足率遠高於適用的法定要求，並處於全球最高水平之一。這無疑反映了香港銀行體系的高韌性。事實上，銀行業在2017年實現強勁增長，貸款總額增加16%，同時資產質素也保持良好。零售銀行的分類貸款比率由2016年的0.72%降至0.54%，遠低於自2000年以來的長期平均值2.2%。銀行業整體股東權益回報率（以除稅前經營溢利計算）在2017年達到11.74%，相較其他國際金融中心而言，是一個非常健康的水平。	['banking system', 'capital adequacy', 'international financial centre', 'asset quality', 'banking industry', 'capital adequacy ratio', 'liquidity', 'liquidity ratio', 'retail bank', 'return on equity', 'statutory requirement', 'total loan']	{'banking system': '銀行體系', 'capital adequacy': '資本充足率', 'international financial centre': '國際金融中心', 'asset quality': '資產質素', 'banking industry': '銀行業', 'capital adequacy ratio': '資本充足率', 'liquidity': '流動性', 'liquidity ratio': '流動性比率', 'retail bank': '零售銀行', 'return on equity': '股東權益回報率', 'statutory requirement': '法定要求', 'total loan': '貸款總額'}	['銀行體系', '資本充足率', '國際金融中心', '資產質素', '銀行業', '資本充足率', '流動性', '流動性比率', '零售銀行', '股東權益回報率', '法定要求', '貸款總額']
6	{'sound banking': '穩善金融', 'financial stability': '金融穩定'}	# Sound banking the key to long-term financial stability	# 穩善金融是長期金融穩定的關鍵。	['sound banking', 'financial stability']	{'sound banking': '穩善金融', 'financial stability': '金融穩定'}	['穩善金融', '金融穩定']
7	{'annual conference for independent non-executive director': '獨立非執行董事研討會', 'hkma': '金管局', 'ineds': '獨立董事', 'independent non-executive director': '獨立非執行董事', 'sound banking': '穩善金融', 'corporate culture': '企業文化', 'financial crisis': '金融危機', 'global financial crisis': '環球金融危機', 'incentive system': '獎勵制度', 'profitability': '盈利', 'executive director': '助理總裁（銀行監理）'}	The 2008 global financial crisis revealed the limitations of relying solely on rules and regulations to restrain the financial industry from pursuing profitability without regard to their primary responsibilities. In light of this, the HKMA has stepped up the promotion of “sound banking” practices in recent years, encouraging banks to develop and pursue good corporate culture and values. In particular, to address the issue of bank staff pursuing short-term profits at the expense of the long-term interests of their customers or banks, we are encouraging banks to put in place appropriate incentive systems that are in line with their corporate culture and values. As part of this campaign, we arranged the inaugural Annual Conference for Independent Non-Executive Directors (INEDs) in March 2017 to highlight the importance of establishing a good banking culture and to empower the INEDs to perform their oversight and monitoring roles more effectively.	二零零八年的環球金融危機揭示了僅僅依靠規則和法規來約束金融業追求盈利，而忽略其主要職責的局限性。 鑒此，金管局近年來加強了「穩善金融」的做法宣傳，鼓勵銀行發展和實踐良好的企業文化和價值觀。 尤其為了應對銀行職員追求短期利潤，而犧牲客戶或銀行長期利益的問題，我們鼓勵銀行建立適當的獎勵制度，使其與企業文化和價值觀相符。 作為這項活動的一部分，我們於二零一七年三月舉辦了首屆獨立非執行董事研討會，以強調建立良好銀行文化的的重要性，並賦予獨立董事更有效地履行其監管和監察職能。	['annual conference for independent non-executive director', 'hkma', 'ineds', 'independent non-executive director', 'sound banking', 'corporate culture', 'financial crisis', 'global financial crisis', 'incentive system', 'profitability', 'executive director']	{'annual conference for independent non-executive director': '獨立非執行董事研討會', 'hkma': '金管局', 'ineds': '▔', 'independent non-executive director': '獨立非執行董事', 'sound banking': '穩善金融', 'corporate culture': '企業文化', 'financial crisis': '金融危機', 'global financial crisis': '環球金融危機', 'incentive system': '獎勵制度', 'profitability': '盈利', 'executive director': '獨立非執行董事'}	['獨立非執行董事研討會', '金管局', '▔', '獨立非執行董事', '穩善金融', '企業文化', '金融危機', '環球金融危機', '獎勵制度', '盈利', '獨立非執行董事']
8	{'eps': '易辦事', 'hkma': '金管局', 'hongkong post': '香港郵政', 'new territory': '新界', 'post office': '郵政局', 'bank branch': '實體分行', 'banking industry': '銀行業', 'dedicated team': '專責小組', 'financial inclusion': '普及金融', 'mobile branch': '流動銀行車', 'pilot scheme': '試點計劃', 'hong kong association of banks': '香港銀行公會'}	With the support of the banking industry, 2017 was a successful year for the HKMA in the advancement of financial inclusion. Six physical bank branches and three mobile branches began operating in remote areas. The Hong Kong Association of Banks worked out an arrangement with EPS and a convenience store chain to launch a pilot scheme allowing the elderly to withdraw cash from the stores in remote areas without the need to make purchases. Hongkong Post is also launching this year a cash withdrawal service for the elderly at seven Post Offices mainly on outlying islands and in the New Territories. Regarding account opening, the HKMA last year set up a webpage and an email account with a dedicated team to follow up public enquiries or complaints relating to the opening of bank accounts. Thanks to the concerted efforts of various stakeholders, there has been a significant improvement in customer experience in opening individual and corporate bank accounts.	得益於銀行業的支持，金管局在普及金融方面於2017年取得了顯著進展。六間實體分行和三輛流動銀行車已開始在偏遠地區營運。香港銀行公會與易辦事及一間便利店連鎖店合作，推出一項試點計劃，讓長者可以在偏遠地區的便利店提取現金，而無需購物。香港郵政今年也將在七間郵政局（主要位於離島和新界）推出長者現金提取服務。至於開戶方面，金管局去年設立了一個網頁和電子郵件帳戶，並組建了專責小組跟進公眾對開立銀行帳戶的查詢或投訴。 由於各方利益相關者的共同努力，在開立個人和公司銀行帳戶的客戶體驗方面有了顯著改善。	['eps', 'hkma', 'hongkong post', 'new territory', 'post office', 'bank branch', 'banking industry', 'dedicated team', 'financial inclusion', 'mobile branch', 'pilot scheme', 'hong kong association of banks']	{'eps': '易辦事', 'hkma': '金管局', 'hongkong post': '香港郵政', 'new territory': '新界', 'post office': '郵政局', 'bank branch': '分行', 'banking industry': '銀行業', 'dedicated team': '專責小組', 'financial inclusion': '普及金融', 'mobile branch': '流動銀行車', 'pilot scheme': '試點計劃', 'hong kong association of banks': '香港銀行公會'}	['易辦事', '金管局', '香港郵政', '新界', '郵政局', '分行', '銀行業', '專責小組', '普及金融', '流動銀行車', '試點計劃', '香港銀行公會']
9	{'fintech': '金融科技', 'banking industry': '銀行業'}	# Fintech a game changer for the banking industry	# 金融科技為銀行業帶來變革。	['fintech', 'banking industry']	{'fintech': '金融科技', 'banking industry': '銀行業'}	['金融科技', '銀行業']
10	{'fintech': '金融科技', 'hkma': '金管局', 'new era of smart banking': '智慧銀行新紀元', 'banking product and service': '銀行產品及服務', 'financial transaction': '金融交易', 'payment and banking service': '支付和銀行服務'}	In an era of rapid technological advancement, fintech has been gradually integrated into our daily lives. In this ever changing technological environment, banks must embrace new developments and pursue innovation in their application of fintech. With the new era of Smart Banking, the HKMA launched seven initiatives in September (see page 106 for details) promoting the adoption of fintech in banking to improve the quality of banking products and services for customers. While these initiatives are independent of one another, they are complementary and will be a game changer for the future landscape of payment and banking services in Hong Kong. Customers will not only enjoy more convenient, efficient and secure payment and banking services, they will also have more choices and greater control over their financial transactions. Fintech will be the key to banks’ future business success, and moving into the new era of Smart Banking will be a great opportunity for the banks to upgrade and transform themselves.	在科技快速發展的時代，金融科技已逐漸融入我們的日常生活。在瞬息萬變的科技環境下，銀行必須擁抱新發展，並致力於在金融科技的應用上追求創新。隨著智慧銀行新紀元到來，金管局於九月推出七項舉措（詳見第106頁），以促進金融科技在銀行業的應用，從而提升銀行產品及服務的質素。雖然這些舉措彼此獨立，但它們相輔相成，並將徹底改變香港支付和銀行服務的未來格局。客戶不僅可以享受更便捷、高效和安全的支付和銀行服務，他們還將擁有更多選擇和對其金融交易更大的控制權。金融科技將是銀行未來業務成功的關鍵，而進入智慧銀行新紀元將為銀行升級和轉型提供絕佳機會。	['fintech', 'hkma', 'new era of smart banking', 'banking product and service', 'financial transaction', 'payment and banking service']	{'fintech': '金融科技', 'hkma': '金管局', 'new era of smart banking': '智慧銀行新紀元', 'banking product and service': '銀行產品及服務', 'financial transaction': '金融交易', 'payment and banking service': '支付和銀行服務'}	['金融科技', '金管局', '智慧銀行新紀元', '銀行產品及服務', '金融交易', '支付和銀行服務']
11	{'bay area': '灣區', 'belt and road': '一帶一路'}	# Enormous opportunities created by the Belt and Road and the Bay Area Initiatives	# 一帶一路與灣區倡議帶來的巨大機遇	['bay area', 'belt and road']	{'bay area': '灣區', 'belt and road': '一帶一路'}	['灣區', '一帶一路']
12	{'bay area': '灣區', 'belt and road': '一帶一路', 'belt and road initiative': '一帶一路', 'belt and road bond': '一帶一路債券', 'china development bank': '國家開發銀行', 'guangdong - hong kong - macao bay area': '粵港澳大灣區', 'hkma': '金管局', 'infrastructure financing facilitation office': '基建融資促進辦公室', 'international financial centre': '國際金融中心', 'infrastructure financing': '基建投融資', 'infrastructure project': '基建項目', 'hkma infrastructure financing facilitation office': '基建融資促進辦公室(IFFO)'}	With competition among international financial centres becoming more intense, a diversified financial industry is of paramount importance to Hong Kong. In 2017, the HKMA stepped up its work on enhancing Hong Kong’s competitiveness as an international financial centre. Given Hong Kong’s unparalleled advantage of “having the Mainland as our hinterland while maintaining an international outlook”, the Belt and Road Initiative and the development of the Guangdong-Hong Kong-Macao Bay Area (Bay Area) will offer enormous opportunities for the financial and banking sectors and give new impetus to the economic growth of Hong Kong. The HKMA Infrastructure Financing Facilitation Office, which was established in response to the Belt and Road Initiative, saw the number of its partners grow to around 90 since launch, laying a solid foundation for promoting Hong Kong as a financing hub for infrastructure investments. The issuance of the first Belt and Road bond in Hong Kong by the China Development Bank in 2017 highlighted the pivotal role Hong Kong can play in facilitating the financing of these infrastructure projects.	隨著國際金融中心之間的競爭日趨激烈，多元化的金融產業對香港至關重要。二零一七年，金管局加強提升香港作為國際金融中心的競爭力。鑑於香港獨有的「背靠祖國、國際視野」的優勢，「一帶一路」倡議及粵港澳大灣區（灣區）的發展將為金融和銀行業帶來巨大機遇，並為香港經濟增長注入新動力。為響應「一帶一路」倡議而設立的基建融資促進辦公室(IFFO)，自啟動以來合作夥伴數量已增至約90家，為推動香港成為基建投資融資中心奠定了堅實基礎。國家開發銀行於二零一七年在香港發行首隻一帶一路債券，凸顯了香港在促進這些基建項目融資方面所發揮的重要作用。	['bay area', 'belt and road', 'belt and road initiative', 'belt and road bond', 'china development bank', 'guangdong - hong kong - macao bay area', 'hkma', 'infrastructure financing facilitation office', 'international financial centre', 'infrastructure financing', 'infrastructure project', 'hkma infrastructure financing facilitation office']	{'bay area': '灣區', 'belt and road': '一帶一路', 'belt and road initiative': '一帶一路', 'belt and road bond': '一帶一路債券', 'china development bank': '國家開發銀行', 'guangdong - hong kong - macao bay area': '粵港澳大灣區', 'hkma': '金管局', 'infrastructure financing facilitation office': '基建融資促進辦公室', 'international financial centre': '國際金融中心', 'infrastructure financing': '基建融資', 'infrastructure project': '基建項目', 'hkma infrastructure financing facilitation office': '基建融資促進辦公室'}	['灣區', '一帶一路', '一帶一路', '一帶一路債券', '國家開發銀行', '粵港澳大灣區', '金管局', '基建融資促進辦公室', '國際金融中心', '基建融資', '基建項目', '基建融資促進辦公室']
