	terms	src_raw	mt_raw	src_terms	alg_terms	norm_tgt_terms
231	{'climate risk management': '氣候風險管理', 'cross - boundary wealth management connect pilot scheme': '粵港澳大灣區跨境理財通業務試點', 'great bay area': '大灣區', 'guangdong - hong kong - macao great bay area': '粵港澳大灣區', 'hkma': '金管局', 'pilot scheme': '業務試點', 'regtech': '合規科技', 'regtech adoption': '合規科技的採用', 'sustainability': '可持續發展', 'wealth management': '財富管理', 'banking industry': '銀行業', 'capacity - building initiative': '措施培訓人才', 'climate risk': '氣候風險', 'customercentric corporate culture': '以客戶為本的企業文化', 'green and sustainable banking': '綠色及可持續銀行業', 'risk management': '風險管理', 'soft infrastructure': '軟實力', 'two - year roadmap': '兩年計劃'}	On the development front, the Cross-boundary Wealth Management Connect Pilot Scheme in the Guangdong–Hong Kong–Macao Greater Bay Area was launched smoothly in September.  During the year, the HKMA continued to execute its two-year roadmap for promoting Regtech adoption in Hong Kong.  Several initiatives were rolled out to lay the foundation for banks’ climate risk management and promote green and sustainable banking more broadly, as discussed in the Sustainability chapter. Further efforts were also made in the area of soft infrastructure, including promoting a customercentric corporate culture, as well as working with the banking industry to roll out capacity-building initiatives to facilitate talent development.	在發展方面，粵港澳大灣區跨境財富管理聯繫試點計劃於9月順利推出。在本年度內，香港金融管理局繼續執行其推動香港監管科技應用的兩年路線圖。推出若干措施，為銀行的氣候風險管理奠定基礎，並更廣泛地推動綠色及可持續銀行業務，如可持續發展章節所討論。在軟性基礎設施方面亦作出進一步努力，包括推動以客戶為中心的企業文化，以及與銀行業合作推出能力建設計劃，以促進人才發展。	['climate risk management', 'cross - boundary wealth management connect pilot scheme', 'great bay area', 'guangdong - hong kong - macao great bay area', 'hkma', 'pilot scheme', 'regtech', 'regtech adoption', 'sustainability', 'wealth management', 'banking industry', 'capacity - building initiative', 'climate risk', 'customercentric corporate culture', 'green and sustainable banking', 'risk management', 'soft infrastructure', 'two - year roadmap']	{'climate risk management': '氣候風險管理', 'cross - boundary wealth management connect pilot scheme': '跨境 財富 管理 繫 點 劃', 'great bay area': '大灣區', 'guangdong - hong kong - macao great bay area': '粵港澳大灣區', 'hkma': '香港金融管理局', 'pilot scheme': '試點計劃', 'regtech': '監管科技', 'regtech adoption': '監管科技應用', 'sustainability': '可持續銀行業務', 'wealth management': '財富管理', 'banking industry': '銀行業', 'capacity - building initiative': '能力建設計劃', 'climate risk': '氣候風險', 'customercentric corporate culture': '以客戶為中心的企業文化', 'green and sustainable banking': '綠色及可持續銀行業務', 'risk management': '風險管理', 'soft infrastructure': '軟性 設施', 'two - year roadmap': '兩年 圖'}	['氣候風險管理', '跨境 財富 管理 繫 點 劃', '大灣區', '粵港澳大灣區', '香港金融管理局', '試點計劃', '監管科技', '監管科技應用', '可持續銀行業務', '財富管理', '銀行業', '能力建設計劃', '氣候風險', '以客戶為中心的企業文化', '綠色及可持續銀行業務', '風險管理', '軟性 設施', '兩年 圖']
232	{'capital adequacy': '資本充足水平', 'hkma': '金管局', 'resolution': '處置機制', 'authorize institution': '認可機構', 'banking industry': '銀行業', 'international supervisory standard': '國際監管標準', 'loss - absorb capacity': '吸收虧損能力', 'resolution standard': '處置標準', 'resolvability': '處置可行性', 'supervisory policy': '監管政策', 'supervisory standard': '監管標準'}	Meanwhile, the HKMA has worked closely with the banking industry in optimising supervisory policies and processes. Good progress was made on implementing international supervisory standards locally, including those on capital adequacy and disclosure.  The HKMA continued to advance its work to ensure a credible resolution regime for authorized institutions, including developing new resolution standards and implementing rules on loss-absorbing capacity requirements to enhance authorized institutions’ resolvability.	另一方面，香港金融管理局與銀行業緊密合作，以優化監管政策和流程。在本地實施國際監管標準方面取得了良好進展，包括資本充足率和披露等。香港金融管理局繼續推進其工作，以確保授權機構具公信力的決議機制，包括發展新的決議標準及實施吸收損失能力要求的規則，以提升授權機構的可解決性。	['capital adequacy', 'hkma', 'resolution', 'authorize institution', 'banking industry', 'international supervisory standard', 'loss - absorb capacity', 'resolution standard', 'resolvability', 'supervisory policy', 'supervisory standard']	{'capital adequacy': '資本充足率', 'hkma': '香港金融管理局', 'resolution': '決議', 'authorize institution': '授權機構', 'banking industry': '銀行業', 'international supervisory standard': '國際監管標準', 'loss - absorb capacity': '吸收損失能力', 'resolution standard': '決議標準', 'resolvability': '可解決性', 'supervisory policy': '監管政策', 'supervisory standard': '監管標準'}	['資本充足率', '香港金融管理局', '決議', '授權機構', '銀行業', '國際監管標準', '吸收損失能力', '決議標準', '可解決性', '監管政策', '監管標準']
233	{'hkma': '金管局', 'hong kong economy': '香港經濟', 'banking system': '銀行體系', 'critical financial service': '關鍵金融服務', 'financial service': '金融服務', 'financial system': '金融體系'}	The HKMA has a general objective to promote the safety and stability of the banking system.  Achieving this objective is contingent upon a highly resilient financial system that is capable of providing the critical financial services the Hong Kong economy needs.	香港金融管理局的一般目標是推動銀行體系的安全和穩定。實現此目標當取決於一個高度具韌性的金融體系，該體系能夠提供香港經濟需要的關鍵金融服務。	['hkma', 'hong kong economy', 'banking system', 'critical financial service', 'financial service', 'financial system']	{'hkma': '香港金融管理局', 'hong kong economy': '香港經濟', 'banking system': '銀行體系', 'critical financial service': '關鍵金融服務', 'financial service': '金融服務', 'financial system': '金融體系'}	['香港金融管理局', '香港經濟', '銀行體系', '關鍵金融服務', '金融服務', '金融體系']
234	{'ais': '認可機構', 'monetary authority': '金融管理專員', 'authorize institution': '認可機構', 'deposit - take company': '接受存款公司', 'financial stability': '金融穩定', 'license bank': '持牌銀行', 'prudential supervision': '審慎監管', 'restrict licence bank': '有限制牌照銀行'}	Banks can affect the stability of the system through the way they carry out their businesses and, in extreme cases, by failing in a disorderly manner.  The Monetary Authority, as a supervisory authority, plays a key role in safeguarding financial stability by ensuring that banks are resilient to shocks and able to recover their positions in crises, ultimately helping to prevent failures.  The Monetary Authority is responsible for the prudential supervision of banks and is tasked with the authorization of licensed banks, restricted licence banks and deposit-taking companies in Hong Kong, which are collectively known as authorized institutions (AIs).	銀行透過其經營業務的方式，以及在極端個案中以失序方式倒閉，可能影響系統的穩定性。 作為監管機構，貨幣當局在確保銀行能恢復其在危機中的地位，並最終幫助防止倒閉，從而維護金融穩定方面發揮著關鍵作用。 貨幣當局負責對銀行進行審慎監理，並負責授權在香港的持牌銀行、受限制牌照銀行和接受存款公司，它們統稱為認可機構。	['ais', 'monetary authority', 'authorize institution', 'deposit - take company', 'financial stability', 'license bank', 'prudential supervision', 'restrict licence bank']	{'ais': '認可機構', 'monetary authority': '貨幣當局', 'authorize institution': '認可機構', 'deposit - take company': '接受存款公司', 'financial stability': '金融穩定', 'license bank': '持牌銀行', 'prudential supervision': '審慎監理', 'restrict licence bank': '受限制牌照銀行'}	['認可機構', '貨幣當局', '認可機構', '接受存款公司', '金融穩定', '持牌銀行', '審慎監理', '受限制牌照銀行']
235	{'ais': '認可機構', 'hkma': '金管局', 'monetary authority': '金融管理專員', 'resolution': '處置機制', 'financial institution': '金融機構', 'financial system': '金融體系', 'operational capability': '運作能力', 'policy standard': '政策標準', 'resolution authority': '處置機制當局', 'resolution plan': '處置規劃', 'resolution rule': '處置規則', 'resolvability': '處置可行性'}	However, the Monetary Authority cannot ensure, nor is the Hong Kong prudential regulatory framework designed to ensure, a zero-risk financial system.  Instead, the Monetary Authority, as a resolution authority, seeks to ensure that, in the event of an AI becoming non-viable, its failure can be managed in an orderly manner.  To this end, a resolution regime for financial institutions in Hong Kong has been established, under which the Monetary Authority is the resolution authority for AIs, among other types of institutions.  To operationalise the resolution regime in Hong Kong, it is important to lay down resolution rules and policy standards, undertake resolution planning to remove impediments to AIs’ resolvability and develop the HKMA’s operational capability to resolve a failing AI.  In order to carry out these tasks effectively, the HKMA adopts an internationally harmonised and co-ordinated approach.	然而，貨幣管理局無法確保，亦非香港審慎監管框架旨在確保零風險的金融體系。相反，貨幣管理局作為解決機構，旨在確保在認可機構變得不可行的事件中，其倒閉可以有序方式處理。為此，香港已設立針對金融機構的解決機制，該機制下，貨幣管理局為認可機構及其他類型機構的解決機構。為落實香港的解決機制，制訂解決規則及政策標準、進行解決規劃以消除對認可機構可解決性的障礙，並提升貨幣管理局處理失敗認可機構的運作能力至關重要。為有效執行這些工作，貨幣管理局採納國際協調一致的方法。	['ais', 'hkma', 'monetary authority', 'resolution', 'financial institution', 'financial system', 'operational capability', 'policy standard', 'resolution authority', 'resolution plan', 'resolution rule', 'resolvability']	{'ais': '認可機構', 'hkma': '管理局', 'monetary authority': '貨幣管理局', 'resolution': '解決', 'financial institution': '金融機構', 'financial system': '金融體系', 'operational capability': '運作能力', 'policy standard': '政策標準', 'resolution authority': '解決機構', 'resolution plan': '解決規劃', 'resolution rule': '解決規則', 'resolvability': '可解決性'}	['認可機構', '管理局', '貨幣管理局', '解決', '金融機構', '金融體系', '運作能力', '政策標準', '解決機構', '解決規劃', '解決規則', '可解決性']
236	{'fmis': '金融市場基建', 'hkma': '金管局', 'monetary authority': '金融管理專員', 'financial market infrastructure': '金融市場基建', 'financial market': '金融市場', 'financial system': '金融體系', 'monetary and financial system': '貨幣及金融體系', 'systemic risk': '系統性風險', 'transparency': '透明度'}	The Monetary Authority is also responsible for the designation and oversight of certain financial market infrastructures (FMIs). In overseeing FMIs, the HKMA aims to promote their general safety and efficiency, limit systemic risk and foster transparency.  Making FMIs more resilient to financial crises protects the monetary and financial systems in Hong Kong from possible destabilising effects arising from disruption to the FMIs.  Information regarding the HKMA’s oversight approach is available on the HKMA website.	貨幣管理局亦負責指定及監督某些金融市場基礎設施（金融市場基礎設施）。在監督金融市場基礎設施方面，香港金管局的目標是促進它們的一般安全和效率，限制系統性風險，並促進透明度。 提高金融市場基礎設施對金融危機的復原力，可保護香港的貨幣和金融系統免受金融市場基礎設施中斷所產生的可能破壞效應。 關於香港金管局的監督方法的信息可獲得於香港金管局網站。	['fmis', 'hkma', 'monetary authority', 'financial market infrastructure', 'financial market', 'financial system', 'monetary and financial system', 'systemic risk', 'transparency']	{'fmis': '基礎', 'hkma': '金管局', 'monetary authority': '貨幣管理局', 'financial market infrastructure': '市場 設施', 'financial market': '金融市場', 'financial system': '金融系統', 'monetary and financial system': '貨幣和金融系統', 'systemic risk': '系統性風險', 'transparency': '透明度'}	['基礎', '金管局', '貨幣管理局', '市場 設施', '金融市場', '金融系統', '貨幣和金融系統', '系統性風險', '透明度']
237	{'licensing': '發牌'}	# Licensing	# 授權	['licensing']	{'licensing': '授權'}	['授權']
238	{'hkma': '金管局', 'license bank': '持牌銀行', 'money broker': '貨幣經紀', 'platform operator': '平台營運機構', 'restrict licence bank': '有限制牌照銀行'}	During the year, the HKMA granted two banking licences and one restricted bank licence to three non-local banks. The HKMA also granted a money broker approval to a foreign trading platform operator.  The authorizations of three licensed banks and two restricted licence banks were revoked during the year.	年內，香港金融管理局授予三間非本地銀行兩項銀行牌照及一項受限銀行牌照。香港金融管理局亦授予一間外國交易平台營運商貨幣經紀批核。年內，三間持牌銀行及兩間受限牌照銀行的授權遭撤銷。	['hkma', 'license bank', 'money broker', 'platform operator', 'restrict licence bank']	{'hkma': '香港金融管理局', 'license bank': '持牌銀行', 'money broker': '貨幣經紀', 'platform operator': '外國交易平台營運商', 'restrict licence bank': '受限銀行牌照'}	['香港金融管理局', '持牌銀行', '貨幣經紀', '外國交易平台營運商', '受限銀行牌照']
239	{'ais': '認可機構', 'local representative office': '本地代表辦事處'}	More information about the AIs and local representative offices in Hong Kong can be found in the Annex and Tables D to F on pages 321 to 324, and 330 to 333 respectively.	更多關於人工智能及香港本地代表辦事處的資訊，載於附錄及表 D 至 F，頁 321 至 324 及 330 至 333 分別。	['ais', 'local representative office']	{'ais': '人工智能', 'local representative office': '本地代表辦事處'}	['人工智能', '本地代表辦事處']
240	{'ais': '認可機構', 'camel rating': 'CAMEL評估', 'executive director': '助理總裁', 'financial technology': '金融科技', 'fintech': '金融科技', 'hkma': '金管局', 'board of director': '董事局', 'corporate governance': '企業管治', 'external auditor': '外聘核數師', 'independent non-executive director': '獨立非執行董事', 'risk management': '風險管理'}	The HKMA conducted 189 off-site reviews covering a broad range of issues, including CAMEL rating assessment1, corporate governance, risk management and financial technology (fintech) strategies.  As part of the HKMA’s continued efforts to promote stronger risk governance, 40 meetings were held with the AIs’ boards of directors, independent non-executive directors or board-level committees.  A further 38 tripartite meetings were held among the HKMA, AIs and their external auditors.	金管局進行了涵蓋廣泛議題的189場非現場審查，包括CAMEL評級評估、企業管治、風險管理以及金融科技（fintech）策略。作為金管局繼續推動更強風險管治工作其中一章，與持牌機構的董事會、獨立非執行董事或委員會共舉辦了40場會議。此外，金管局、持牌機構及其外部審計師之間又舉辦了38場三方會議。	['ais', 'camel rating', 'executive director', 'financial technology', 'fintech', 'hkma', 'board of director', 'corporate governance', 'external auditor', 'independent non-executive director', 'risk management']	{'ais': '持牌機構', 'camel rating': 'CAMEL評級', 'executive director': '執行董事', 'financial technology': '金融科技', 'fintech': '金融科技', 'hkma': '金管局', 'board of director': '董事', 'corporate governance': '企業管治', 'external auditor': '外部審計師', 'independent non-executive director': '獨立非執行董事', 'risk management': '風險管理'}	['持牌機構', 'CAMEL評級', '執行董事', '金融科技', '金融科技', '金管局', '董事', '企業管治', '外部審計師', '獨立非執行董事', '風險管理']
241	{'ais': '認可機構', 'aml / cft': '打擊洗錢及恐怖分子資金籌集', 'credit risk': '信用風險', 'hkma': '金管局', 'liquidity and market risk': '流動性及市場風險', 'mpf': '強積金', 'mandatory provident fund': '強制性公積金（強積金）', 'market risk': '市場風險', 'credit risk management': '信用風險管理', 'investment product': '投資產品', 'market risk management': '市場風險管理', 'on - site examination': '現場審查', 'operational risk': '業務操作風險', 'provident fund': '公積金', 'risk management': '風險管理', 'specialist team': '專項審查小組', 'technology risk': '科技風險', 'thematic review': '專題評估'}	Apart from off-site activities, the HKMA conducted regular on-site examinations supplemented with thematic reviews on areas assessed to be of higher risk.  A total of 679 on-site examinations and thematic reviews were carried out during the year with credit risk management as a key focus. Amid growing adoption of technology by banks, management of operational risk and technology risk was another major area of attention.  The HKMA also increased the number of on-site examinations and thematic reviews targeting liquidity and market risk management.  In addition, specialist teams performed on-site examinations and thematic reviews of AIs’ activities in securities, investment products, insurance and mandatory provident fund (MPF)- related businesses, as well as their anti-money laundering and counter-financing of terrorism (AML/CFT) controls. Table 1 contains a summary of the HKMA’s supervisory activities in 2021.	除了非現場活動，香港金融管理局進行定期現場檢查，並輔以對評估風險較高範疇的重點審查。本年共進行了679次現場檢查和重點審查，信貸風險管理為主要重點。隨着銀行越來越廣泛地採用科技，營運風險和科技風險的管理是另一主要注意範疇。香港金融管理局亦上升了現場檢查和重點審查的數目，針對流動性及市場風險管理。此外，專門團隊對人工智能在證券、投資產品、保險及強積金（MPF）相關業務中的活動，以及它們的反洗錢及打擊恐怖融資（AML/CFT）控制進行了現場檢查和重點審查。表1載有香港金融管理局2021年監管活動的概要。	['ais', 'aml / cft', 'credit risk', 'hkma', 'liquidity and market risk', 'mpf', 'mandatory provident fund', 'market risk', 'credit risk management', 'investment product', 'market risk management', 'on - site examination', 'operational risk', 'provident fund', 'risk management', 'specialist team', 'technology risk', 'thematic review']	{'ais': '人工智能', 'aml / cft': 'CFT', 'credit risk': '信貸風險', 'hkma': '香港金融管理局', 'liquidity and market risk': '流動性及市場風險', 'mpf': '強積金', 'mandatory provident fund': '強積金', 'market risk': '市場風險', 'credit risk management': '信貸風險管理', 'investment product': '投資產品', 'market risk management': '市場風險管理', 'on - site examination': '現場檢查', 'operational risk': '營運風險', 'provident fund': '強積金', 'risk management': '風險管理', 'specialist team': '專門團隊', 'technology risk': '科技風險', 'thematic review': '重點審查'}	['人工智能', 'CFT', '信貸風險', '香港金融管理局', '流動性及市場風險', '強積金', '強積金', '市場風險', '信貸風險管理', '投資產品', '市場風險管理', '現場檢查', '營運風險', '強積金', '風險管理', '專門團隊', '科技風險', '重點審查']
242	{'credit risk': '信用風險'}	# Credit risk	# 信用風險	['credit risk']	{'credit risk': '信用風險'}	['信用風險']
243	{'asset quality': '資產質素'}	# Credit growth and asset quality	# 信用成長與資產品質	['asset quality']	{'asset quality': '資產品 質'}	['資產品 質']
244	{'total loan': '貸款總額'}	Total loans increased by 3.8% in 2021, compared with a growth of 1.2% in 2020.  Table 2 shows the breakdown of growth in loans and advances.	二零二一年總貸款上升了 3.8%，相比二零二零年的增長 1.2%。 表 2 顯示貸款和 推進 的 分類。	['total loan']	{'total loan': '總貸款'}	['總貸款']
245	{'mainland': '內地'}	Mainland-related lending increased by 3.6% to HK$4,725 billion in 2021 (Table 3).	內地相關貸款上升了 3.6%，至 2021 年的 47,250 港元。	['mainland']	{'mainland': '內地'}	['內地']
246	{'asset quality': '資產質素', 'mainland': '內地', 'classify loan ratio': '特定分類貸款比率', 'international standard': '國際標準', 'long - run historical average': '長期平均水平'}	The asset quality of the banking sector remained largely stable during the year and stayed at a healthy level by both historical and international standards.  The classified loan ratio of the industry was 0.88% at the end of 2021, down from 0.90% at the end of 2020, well below the long-run historical average of 1.8% since 2000.  The ratio for Mainland-related lending also decreased to 0.86% from 0.96% a year ago.	銀行業資產品質在該年仍然大致穩定，並在歷史和國際標準下維持在良好水準。 業內不良貸款比率在2021年底為0.88%，較2020年底的0.90%下降，遠低於自2000年以來的長期歷史平均值1.8%。與大陸相關的貸款比率亦下降至0.86%，較一年前的0.96%為低。	['asset quality', 'mainland', 'classify loan ratio', 'international standard', 'long - run historical average']	{'asset quality': '資產品 質', 'mainland': '大陸', 'classify loan ratio': '不良貸款比率', 'international standard': '國際標準', 'long - run historical average': '期 歷史 平均值'}	['資產品 質', '大陸', '不良貸款比率', '國際標準', '期 歷史 平均值']
