	terms	src_raw	mt_raw	src_terms	alg_terms	norm_tgt_terms
236	{'efbn programme': '外匯基金票據及債券計劃', 'exchange fund': '外匯基金', 'nominal amount': '名義總值'}	The EFBN Programme operated smoothly.  At the end of 2023, the nominal amount of outstanding Exchange Fund papers stood at around HK$1,255.4 billion (Table 2).	外匯基金票據及債券計劃運作順暢。截至2023年底，外匯基金票據的名義總值約為1,2554億港元（見表2）。	['efbn programme', 'exchange fund', 'nominal amount']	{'efbn programme': '外匯基金票據及債券計劃', 'exchange fund': '外匯基金', 'nominal amount': '名義總值'}	['外匯基金票據及債券計劃', '外匯基金', '名義總值']
237	{'efbns': '外匯基金票據及債券'}	Table 2 Outstanding issues of EFBNs	表 2 外匯基金票據及債券未償餘額	['efbns']	{'efbns': '▔'}	['▔']
238	{'research': '經濟研究'}	# Monetary research	# 貨幣經濟研究	['research']	{'research': '研究'}	['研究']
239	{'hkimr': '研究中心', 'hong kong academy of finance': '金融學院', 'hong kong institute for monetary and financial research': '香港貨幣及金融研究中心', 'ssrn': 'SSRN', 'social science research network': '社會科學研究網', 'insight': '匯思', 'research': '經濟研究', 'webinar': '研討會', 'work paper': '研究論文'}	The Hong Kong Institute for Monetary and Financial Research (HKIMR)3, the research arm of the Hong Kong Academy of Finance, published 20 working papers and held 17 seminars/ webinars on monetary and financial research topics that are of strategic importance to Hong Kong and the region. The HKIMR also published six eJournals on the Social Science Research Network (SSRN) to disseminate research outputs to SSRN’s global research community.  Moreover, to provide the public with a high-level, non-technical summary of the recently published working papers, the HKIMR published two issues of Insights from Monetary Research.	香港貨幣及金融研究中心（研究中心），香港金融學院的研究部門，已發布 20 篇研究論文，並舉辦 17 節研討會，探討了對香港及該地區具有戰略重要性的貨幣及金融經濟研究主題。研究中心還在社會科學研究網（SSRN）上發布了六本電子期刊，向 SSRN 的全球研究社群傳播經濟研究成果。此外，為向公眾提供最近發布的研究論文的高層次、非技術性摘要，研究中心發布了《貨幣研究洞見》的兩期。	['hkimr', 'hong kong academy of finance', 'hong kong institute for monetary and financial research', 'ssrn', 'social science research network', 'insight', 'research', 'webinar', 'work paper']	{'hkimr': '中心', 'hong kong academy of finance': '香港 學院', 'hong kong institute for monetary and financial research': '香港貨幣及金融研究中心', 'ssrn': 'SSRN', 'social science research network': '社會科學研究網', 'insight': '洞見', 'research': '研究', 'webinar': '▔', 'work paper': '研究論文'}	['中心', '香港 學院', '香港貨幣及金融研究中心', 'SSRN', '社會科學研究網', '洞見', '研究', '▔', '研究論文']
240	{'hkimr': '研究中心', 'financial institution': '金融機構', 'research': '經濟研究', 'roundtable': '圓桌會議', 'webinar': '研討會'}	Apart from its research activities, the HKIMR organised four international events, one roundtable and four seminars/ webinars with academia, global central banks and international financial institutions to promote dialogue and exchange on economic and financial issues:	除了進行經濟研究外，研究中心還舉辦了四項國際活動，包括一場圓桌會議及四場研討會，與學術界、全球中央銀行及國際金融機構進行對話與交流，以推動經濟與金融議題的探討。	['hkimr', 'financial institution', 'research', 'roundtable', 'webinar']	{'hkimr': '研究中心', 'financial institution': '金融 機構', 'research': '研究', 'roundtable': '圓桌會議', 'webinar': '研討會'}	['研究中心', '金融 機構', '研究', '圓桌會議', '研討會']
241	"{""china 's rebound : recent developments and outlook"": '中國經濟的復甦：最新發展及展望', 'hksar': '香港特區', 'hong kong special administrative region': '香港特別行政區', 'imf': '基金組織', ""person 's republic of china - hong kong special administrative region"": '香港特別行政區分處', 'senior resident representative in china': '駐華首席代表'}"	A seminar on China’s Rebound: Recent Developments and Outlook by Dr Steven Alan Barnett, Senior Resident Representative in China of the IMF, and Dr Phakawa Jeasakul, Resident Representative for People’s Republic of China – Hong Kong Special Administrative Region (HKSAR) of the IMF, was held. Dr Barnett shared his views on the latest developments in the Chinese economy, as well as short- and medium-term issues that need to be addressed. More than 100 participants attended the seminar.	由國際貨幣基金組織駐華首席代表史蒂文·艾倫·巴內特博士與國際貨幣基金組織香港特別行政區分處代表帕卡瓦·杰萨库尔博士主講的「中國經濟的復甦：最新發展及展望」研討會舉行。巴內特博士分享了他對中國經濟最新發展的看法，以及需要解決的短期和中期問題。逾100名與會者參加了此次研討會。	"[""china 's rebound : recent developments and outlook"", 'hksar', 'hong kong special administrative region', 'imf', ""person 's republic of china - hong kong special administrative region"", 'senior resident representative in china']"	"{""china 's rebound : recent developments and outlook"": '中國經濟的復甦：最新發展及展望', 'hksar': '▔', 'hong kong special administrative region': '香港特別行政區', 'imf': '基金', ""person 's republic of china - hong kong special administrative region"": '香港特別行政區', 'senior resident representative in china': '駐華首席代表'}"	['中國經濟的復甦：最新發展及展望', '▔', '香港特別行政區', '基金', '香港特別行政區', '駐華首席代表']
242	{'global financial stability report': '全球金融穩定報告', 'imf': '基金組織', 'navigating through a challenging world': '於具挑戰性的世界中航行', 'world economic outlook': '世界經濟展望', 'financial stability': '金融穩定'}	A seminar on Navigating Through a Challenging World was held. Four experts from the IMF shared their views on the analytical chapters of the most recent issues of World Economic Outlook and Global Financial Stability Report by the IMF. Over 50 participants attended the seminar.	舉行了一場名為「於具挑戰性的世界中航行」的研討會。四位來自基金組織的專家分享了對基金組織最新版本的《世界經濟展望》及《全球金融穩定報告》分析章節的觀點。超過50名與會者參與了該研討會。	['global financial stability report', 'imf', 'navigating through a challenging world', 'world economic outlook', 'financial stability']	{'global financial stability report': '全球金融穩定報告', 'imf': '基金組織', 'navigating through a challenging world': '於具挑戰性的世界中航行', 'world economic outlook': '世界經濟展望', 'financial stability': '金融穩定'}	['全球金融穩定報告', '基金組織', '於具挑戰性的世界中航行', '世界經濟展望', '金融穩定']
243	{'global financial stability report': '全球金融穩定報告', 'imf': '基金組織', 'monetary and capital market department': '貨幣與資本市場部', 'capital market': '資本市場', 'financial stability': '金融穩定'}	A seminar with the presentation of the IMF’s April 2023 Global Financial Stability Report titled Safeguarding Global Financial Stability amid High Inflation and Interest Rates by Dr Jason Wu, Assistant Director, and Mr Thomas Pointek, Senior Financial Sector Expert, of the IMF’s Monetary and Capital Markets Department was held. More than 80 participants attended the seminar.	由國際貨幣基金組織（基金組織）貨幣與資本市場部助理主任吳嘉申博士與基金組織高級金融部門專家湯馬斯·波因特克先生主講，並發表《全球金融穩定報告》之「在高通膨與利率環境下維護全球金融穩定」研討會已舉行。共有超過八十位與會者參與。	['global financial stability report', 'imf', 'monetary and capital market department', 'capital market', 'financial stability']	{'global financial stability report': '全球金融穩定報告', 'imf': '基金', 'monetary and capital market department': '貨幣與資本市場部', 'capital market': '資本市場', 'financial stability': '金融穩定'}	['全球金融穩定報告', '基金', '貨幣與資本市場部', '資本市場', '金融穩定']
244	{'asia and pacific department': '亞洲及太平洋部', 'chief executive of the hkma': '金管局總裁', 'eddie yue': '余偉文', 'hkma': '金管局', 'imf': '基金組織', 'international monetary system': '國際貨幣體系', 'monetary system': '貨幣體制'}	"A fireside chat on Asia in a Challenging World was hosted between Mr Krishna Srinivasan, Director of the Asia and Pacific Department of the IMF, and Mr Eddie Yue, Chief Executive of the HKMA. Mr Srinivasan outlined the key messages of the recent IMF Regional Economic Outlook report for Asia and shared his views on the key drivers and risks of the global and regional economy. In addition, the dialogue covered many important issues concerning the regional economy and the evolution of the international monetary system. Around 120 participants attended the event.
"	"一場名為「亞洲在充滿挑戰的世界中」的座談會由國際貨幣基金組織亞洲及太平洋部主管克里希納·辛格拉凡先生與金管局總裁余偉文先生主持。辛格拉凡先生概述了國際貨幣基金組織最新區域經濟展望報告中針對亞洲的主要信息，並分享了他對全球及區域經濟主要推動因素和風險的看法。此外，對話還涵蓋了許多與區域經濟及國際貨幣體系演進相關的重要議題。約有120位參與者出席了該活動。
"	['asia and pacific department', 'chief executive of the hkma', 'eddie yue', 'hkma', 'imf', 'international monetary system', 'monetary system']	{'asia and pacific department': '亞洲及太平洋部', 'chief executive of the hkma': '總裁', 'eddie yue': '余偉文', 'hkma': '金管局', 'imf': '組織', 'international monetary system': '國際貨幣體系', 'monetary system': '貨幣體系'}	['亞洲及太平洋部', '總裁', '余偉文', '金管局', '組織', '國際貨幣體系', '貨幣體系']
245	{'hkma': '金管局', 'march banking turmoil': '3月份在美國及歐洲發生的銀行危機', 'authorize institution': '認可機構', 'banking sector': '銀行體系', 'banking turmoil': '銀行危機', 'credit , liquidity and market risk management': '信用、流動性及市場風險管理', 'cyber threat': '網絡威脅', 'internal review': '內部檢討', 'liquidity': '流動性', 'liquidity and market risk management': '流動性及市場風險管理', 'market risk': '市場風險', 'ripple effect': '傳遞效應', 'risk management': '風險管理', 'technology service': '科技服務'}	The banking sector in Hong Kong remained strong and resilient in 2023 despite multiple headwinds, including the March banking turmoil in the US and Europe, a high interest rate environment and geopolitical tensions. The HKMA responded swiftly to the March banking turmoil — from managing the ripple effects to completing an internal review (covering such areas as the supervisory processes and resolution framework) drawing lessons for the local banking sector, while maintaining its focus on the credit, liquidity and market risk management of authorized institutions. In light of escalating cyber threats and the increasing use of technology services provided by third parties, the HKMA also worked closely with authorized institutions to enhance their operational and cyber resilience.	香港的銀行體系在2023年仍然保持強勁及具彈性，即使面對多重逆風，包括3月份在美國及歐洲發生的銀行危機、高利率環境及地緣政治緊張局勢。金管局對3月份在美國及歐洲發生的銀行危機迅速作出反應——從管理傳遞效應到完成內部檢討（涵蓋監管流程及決議框架等範疇），並為本地銀行體系吸取經驗教訓，同時繼續關注認可機構的信用、流動性及市場風險管理。鑑於網絡威脅日益嚴重，以及第三方提供的科技服務使用量不斷增加，金管局亦與認可機構緊密合作，以提升其營運及網絡安全能力。	['hkma', 'march banking turmoil', 'authorize institution', 'banking sector', 'banking turmoil', 'credit , liquidity and market risk management', 'cyber threat', 'internal review', 'liquidity', 'liquidity and market risk management', 'market risk', 'ripple effect', 'risk management', 'technology service']	{'hkma': '金管局', 'march banking turmoil': '銀行危機', 'authorize institution': '認可機構', 'banking sector': '銀行體系', 'banking turmoil': '銀行危機', 'credit , liquidity and market risk management': '信用、流動性及市場風險管理', 'cyber threat': '網絡威脅', 'internal review': '內部檢討', 'liquidity': '流動性', 'liquidity and market risk management': '流動性及市場風險管理', 'market risk': '市場風險', 'ripple effect': '傳遞效應', 'risk management': '風險管理', 'technology service': '科技服務'}	['金管局', '銀行危機', '認可機構', '銀行體系', '銀行危機', '信用、流動性及市場風險管理', '網絡威脅', '內部檢討', '流動性', '流動性及市場風險管理', '市場風險', '傳遞效應', '風險管理', '科技服務']
246	{'anti -scam consumer protection charter': '保障消費者防詐騙約章', 'code of banking practice': '銀行營運守則', 'credit data smart': '信資通', 'cross - boundary wealth management connect': '跨境理財通', 'cross - boundary wealth management connect pilot scheme': '「跨境理財通」業務試點', 'hkma': '金管局', 'consumer credit reference service': '個人信貸資料服務', 'payment card': '支付卡', 'professional investor': '高端專業投資者', 'regulator': '監管機構', 'regulatory regime': '監管制度', 'trust business': '信託業務', 'virtual asset': '虛擬資產', 'virtual asset - related activity': '虛擬資產相關活動', 'wealth management': '財富管理'}	The HKMA enhanced consumer protection in respect of payment cards, and through further revision of the Code of Banking Practice as well as the launch of the Anti-Scam Consumer Protection Charter. The HKMA worked with fellow regulators on a balanced regulatory regime for virtual asset-related activities, streamlined the selling process for sophisticated professional investors, introduced enhancements to the Cross-boundary Wealth Management Connect Pilot Scheme, and commenced supervision of trust business. A pilot programme was launched to prepare for provision of consumer credit reference services under “Credit Data Smart”.	金管局加強了對支付卡的消費者保護，並透過進一步修訂銀行營運守則及發起保障消費者防詐騙約章。金管局與其他監管機構合作，建立平衡的監管制度，規範虛擬資產相關活動，並優化了高端專業投資者的銷售流程。同時，金管局亦對「跨境理財通」業務試點進行優化，並開始監管信託業務。為準備提供信資通的個人信貸資料服務，金管局已啟動一項試點計劃。	['anti -scam consumer protection charter', 'code of banking practice', 'credit data smart', 'cross - boundary wealth management connect', 'cross - boundary wealth management connect pilot scheme', 'hkma', 'consumer credit reference service', 'payment card', 'professional investor', 'regulator', 'regulatory regime', 'trust business', 'virtual asset', 'virtual asset - related activity', 'wealth management']	{'anti -scam consumer protection charter': '保障消費者防詐騙約章', 'code of banking practice': '銀行營運守則', 'credit data smart': '信資通', 'cross - boundary wealth management connect': '跨境理財通', 'cross - boundary wealth management connect pilot scheme': '▔', 'hkma': '金管局', 'consumer credit reference service': '個人信貸資料服務', 'payment card': '支付卡', 'professional investor': '專業投資者', 'regulator': '監管機構', 'regulatory regime': '監管制度', 'trust business': '信託業務', 'virtual asset': '虛擬資產', 'virtual asset - related activity': '虛擬資產相關活動', 'wealth management': '理財'}	['保障消費者防詐騙約章', '銀行營運守則', '信資通', '跨境理財通', '▔', '金管局', '個人信貸資料服務', '支付卡', '專業投資者', '監管機構', '監管制度', '信託業務', '虛擬資產', '虛擬資產相關活動', '理財']
247	{'hkma': '金管局', 'macro analytics pilot scheme': '傀儡戶口網絡分析先導計劃', 'counter - financing of terrorism': '恐怖分子資金籌集', 'digital fraud': '數碼騙案', 'ecosystem collaboration': '生態圈各持份者的合作', 'money laundering': '洗錢', 'pre-transaction alert mechanism': '可疑識別代號警示機制', 'supervisory technology capability': '監管科技能力', 'aml': '反洗錢', 'fast payment system': '轉數快'}	The HKMA’s efforts in anti-money laundering and counter-financing of terrorism (AML/CFT) reflect a commitment to targeting the highest threats under a risk-based approach. To address increasing digital fraud, the HKMA has strengthened ecosystem collaboration through the launch of real-time fraud monitoring and expanding the scope of public-private information-sharing partnerships, including the Fraud and Money Laundering Intelligence Taskforce. The launch of a ground-breaking platform to facilitate bank-to-bank information sharing will help address the risk of mule account networks, while the HKMA also worked closely with the industry to take concerted action to handle increasing fraud-related banking complaints and raise public awareness about different scams, including a pre-transaction alert mechanism when using the Faster Payment System. In parallel, supervisory technology capabilities were also advanced through the Macro Analytics pilot scheme.	金管局在打擊洗錢及恐怖分子資金籌集（反洗錢/反恐資金融資）方面所做的努力，體現了以風險為本的方法，致力於打擊最高的威脅。為應對日益嚴峻的數碼騙案，金管局已透過推出即時詐騙監控，並擴大公私營資訊共享合作夥伴關係（包括打擊詐騙及洗錢情報專案組），加強生態圈各持份者的合作。推出一個開創性的平台，以促進銀行之間的資訊共享，將有助於解決傀儡戶口網絡的風險，同時金管局亦與業界緊密合作，共同採取行動處理不斷增加的與詐騙相關的銀行投訴，並提高公眾對不同詐騙的意識，包括在使用轉數快時的可疑識別代號警示機制。與此同時，監管科技能力亦透過傀儡戶口網絡分析先導計劃得到提升。	['hkma', 'macro analytics pilot scheme', 'counter - financing of terrorism', 'digital fraud', 'ecosystem collaboration', 'money laundering', 'pre-transaction alert mechanism', 'supervisory technology capability', 'aml', 'fast payment system']	{'hkma': '金管局', 'macro analytics pilot scheme': '傀儡戶口網絡分析先導計劃', 'counter - financing of terrorism': '▔', 'digital fraud': '數碼騙案', 'ecosystem collaboration': '生態圈各持份者的合作', 'money laundering': '洗錢', 'pre-transaction alert mechanism': '可疑識別代號警示機制', 'supervisory technology capability': '監管科技能力', 'aml': '▔', 'fast payment system': '轉數快'}	['金管局', '傀儡戶口網絡分析先導計劃', '▔', '數碼騙案', '生態圈各持份者的合作', '洗錢', '可疑識別代號警示機制', '監管科技能力', '▔', '轉數快']
248	{'capital adequacy': '資本充足水平', 'deposit protection scheme': '存款保障計劃', 'hong kong deposit protection board': '香港存款保障委員會', 'banking sector': '銀行體系', 'capacity building': '專業能力', 'capital adequacy and disclosure': '資本充足及披露標準', 'international supervisory standard': '國際監管標準', 'public consultation': '公眾諮詢'}	Good progress was made on implementing international supervisory standards locally, including those on capital adequacy and disclosure. Notable efforts were also made in enhancing capacity building in the banking sector, attracting and nurturing future talents and upskilling existing practitioners. In addition, the Hong Kong Deposit Protection Board completed a public consultation on proposed enhancements to the Deposit Protection Scheme.	在落實國際監管標準方面，包括資本充足及披露標準，已取得良好進展。銀行體系內的專業能力建設亦有所提升，並積極吸引和培養未來人才，以及提升現有從業員的技能。此外，香港存款保障委員會已完成對存款保障計劃建議修訂的公眾諮詢。	['capital adequacy', 'deposit protection scheme', 'hong kong deposit protection board', 'banking sector', 'capacity building', 'capital adequacy and disclosure', 'international supervisory standard', 'public consultation']	{'capital adequacy': '資本充足', 'deposit protection scheme': '存款保障計劃', 'hong kong deposit protection board': '香港存款保障委員會', 'banking sector': '銀行體系', 'capacity building': '能力 建設', 'capital adequacy and disclosure': '資本充足及披露標準', 'international supervisory standard': '國際監管標準', 'public consultation': '公眾諮詢'}	['資本充足', '存款保障計劃', '香港存款保障委員會', '銀行體系', '能力 建設', '資本充足及披露標準', '國際監管標準', '公眾諮詢']
249	{'hkma': '金管局', 'critical financial market infrastructure': '關鍵金融市場基建', 'financial market infrastructure': '金融市場基建', 'financial market': '金融市場', 'infrastructure': '基建', 'loss - absorb capacity policy standard': '吸收虧損能力政策標準', 'operational continuity': '運作持續性', 'resolution regime': '處置機制', 'resolution standard': '處置標準'}	The HKMA continued to advance its work to ensure a credible resolution regime. A new resolution standard related to accessing critical financial market infrastructures was developed and a review on experiences of implementing loss-absorbing capacity policy standards was completed. Significant progress was made in resolution planning with banks to address early termination risk and operational continuity in resolution. The HKMA also continued to be active in international policy initiatives and regional co-operation on resolution.	金管局持續推進工作，以確保可信的處置機制。制定了一項與存取關鍵金融市場基建相關的新處置標準，並已完成對實施吸收虧損能力政策標準經驗的回顧。與銀行進行處置規劃方面取得顯著進展，以應對早期終止風險及確保處置過程中的運作持續性。金管局亦持續積極參與國際政策倡議及區域處置合作。	['hkma', 'critical financial market infrastructure', 'financial market infrastructure', 'financial market', 'infrastructure', 'loss - absorb capacity policy standard', 'operational continuity', 'resolution regime', 'resolution standard']	{'hkma': '金管局', 'critical financial market infrastructure': '關鍵金融市場基建', 'financial market infrastructure': '金融市場基建', 'financial market': '金融市場', 'infrastructure': '基建', 'loss - absorb capacity policy standard': '吸收虧損能力政策標準', 'operational continuity': '運作持續性', 'resolution regime': '處置機制', 'resolution standard': '處置標準'}	['金管局', '關鍵金融市場基建', '金融市場基建', '金融市場', '基建', '吸收虧損能力政策標準', '運作持續性', '處置機制', '處置標準']
250	{'banking system': '銀行體系', 'hkma': '金管局', 'hong kong economy': '香港經濟', 'financial service': '金融服務', 'financial system': '金融體系'}	The HKMA has a general objective to promote the safety and stability of the banking system. Achieving this objective is contingent upon a highly resilient financial system that is capable of providing the critical financial services the Hong Kong economy needs.	金管局有一般目標是促進銀行體系的安全與穩定。達成此目標有賴於一個高度穩健的金融體系，該體系能夠提供香港經濟所需的關鍵金融服務。	['banking system', 'hkma', 'hong kong economy', 'financial service', 'financial system']	{'banking system': '銀行體系', 'hkma': '金管局', 'hong kong economy': '香港經濟', 'financial service': '金融服務', 'financial system': '金融體系'}	['銀行體系', '金管局', '香港經濟', '金融服務', '金融體系']
