	terms	src_raw	mt_raw	src_terms	alg_terms	norm_tgt_terms
190	{'we.trade': 'we.trade', '全球貿易連接網絡': 'Global Trade Connectivity Network', '新加坡金融管理局': 'Monetary Authority of Singapore', '網絡': 'cyber space', '貿易聯動': 'eTradeConnect', '貿易融資平台': 'trade finance platform', '金管局': 'HKMA', '銀行組成的聯盟': 'consortium of banks'}	建基於金管局主導的貿易融資概念驗證成果由香港多間銀行組成的聯盟於10月啟動以分布式分類帳技術(DLT)為基礎的貿易融資平台「貿易聯動」。該平台旨在透過數碼化貿易文件及自動化貿易融資流程，減低失誤及詐騙風險。截至2018年底，已有12間銀行加入成為該聯盟成員。「貿易聯動」與歐洲貿易融資平台「we.trade」於10月簽署《諒解備忘錄》，進行對接雙方平台的概念驗證。金管局亦同步探討「貿易聯動」與其他地區對接的機會，包括與新加坡金融管理局合作推出「全球貿易連接網絡」。	TradeLink, a trade finance platform built on distributed ledger technology (DLT), was launched in October by a consortium of Hong Kong banks, following a proof of concept led by the Hong Kong Monetary Authority (HKMA). The platform aims to reduce errors and fraud risks by digitizing trade documents and automating trade finance processes. As of the end of 2018, 12 banks had joined the consortium. In October, TradeLink signed a Memorandum of Understanding with the European trade finance platform we.trade to conduct a pilot program for connecting the two platforms. The HKMA is also exploring opportunities to connect TradeLink with other regions, including collaborating with the Monetary Authority of Singapore to launch the Global Trade Connectivity Network.	['we.trade', '全球貿易連接網絡', '新加坡金融管理局', '網絡', '貿易聯動', '貿易融資平台', '金管局', '銀行組成的聯盟']	{'we.trade': 'we.trade', '全球貿易連接網絡': 'Global Trade Connectivity Network', '新加坡金融管理局': 'Monetary Authority of Singapore', '網絡': 'Network', '貿易聯動': 'TradeLink', '貿易融資平台': 'trade finance platform', '金管局': 'HKMA', '銀行組成的聯盟': 'consortium banks'}	['we.trade', 'global trade connectivity network', 'monetary authority of singapore', 'network', 'tradelink', 'trade finance platform', 'hkma', 'consortium bank']
191	{'總裁': 'Chief Executive', '貿易聯動': 'eTradeConnect', '金管局': 'HKMA', '陳德霖': 'Norman Chan'}	金管局總裁陳德霖先生（左）於「貿易聯動」啟動儀式上。	"Mr. Chen Der-lin, Chairman of the Financial Supervisory Commission (left), at the launch ceremony of ""Trade Synergy."""	['總裁', '貿易聯動', '金管局', '陳德霖']	{'總裁': 'Chairman', '貿易聯動': 'Trade Synergy', '金管局': 'Commission', '陳德霖': 'Chen Der-lin'}	['chairman', 'trade synergy', 'commission', 'chen der']
192	{'金管局': 'HKMA', '金融科技': 'fintech', '金融科技專才': 'fintech talent pool', '香港應用科技研究院': 'Hong Kong Applied Science and Technology Research Institute'}	為培育更多金融科技專才，金管局於1月與香港應用科技研究院（應科院）合作推出「金融科技人才培育計劃」升級版(FCAS 2.0)。FCAS 2.0設有4個項目，適合處於不同職涯發展階段的年輕人才。計劃下有200多名學生受惠。	"To cultivate more fintech professionals, the Hong Kong Monetary Authority (HKMA) launched the upgraded ""Fintech Talent Development Program"" (FCAS 2.0) in January in collaboration with the Hong Kong Applied Science and Technology Research Institute (ASTRI). FCAS 2.0 consists of four programs suitable for young talents at different career development stages. Over 200 students have benefited from the program."	['金管局', '金融科技', '金融科技專才', '香港應用科技研究院']	{'金管局': 'HKMA', '金融科技': 'fintech', '金融科技專才': 'fintech professionals', '香港應用科技研究院': 'Hong Kong Applied Science and Technology Research Institute'}	['hkma', 'fintech', 'fintech professional', 'hong kong applied science and technology research institute']
193	{'數碼港': 'Cyberport', '總裁': 'Chief Executive', '金管局': 'HKMA', '陳德霖': 'Norman Chan'}	金管局總裁陳德霖先生（左二）與數碼港主席林家禮博士（左一）、香港應科院主席王明鑫先生（右二）及香港科技園公司行政總裁黃克強先生（右一）出席FCAS 2.0啟動儀式。	"Mr. Chen De-lin, Governor of the Hong Kong Monetary Authority (second from the left), Dr. Lam Ka-lei, Chairman of Cyberport (first from the left), Mr. Wang Ming-hin, Chairman of the Hong Kong Applied Science and Technology Research Institute (ASTRI) (second from the right), and Mr. Wong Hark-keung, Chief Executive of the Hong Kong Science and Technology Parks Corporation (first from the right), attended the FCAS 2.0 launch ceremony.  
Mr. Chen De-lin, Governor of the Hong Kong Monetary Authority (second from the left), Dr. Lam Ka-lei, Chairman of Cyberport (first from the left), Mr. Wang Ming-hin, Chairman of the Hong Kong Applied Science and Technology Research Institute (ASTRI) (second from the right), and Mr. Wong Hark-keung, Chief Executive of the Hong Kong Science and Technology Parks Corporation (first from the right), attended the FCAS 2.0 launch ceremony."	['數碼港', '總裁', '金管局', '陳德霖']	{'數碼港': 'Cyberport', '總裁': 'Governor', '金管局': 'Authority', '陳德霖': 'Chen De-lin'}	['cyberport', 'governor', 'authority', 'chen de-lin']
194	{'跨境合作': 'cross-border collaboration'}	# 跨境合作	# Cross-border Collaboration	['跨境合作']	{'跨境合作': 'Cross-border Collaboration'}	['cross collaboration']
195	{'實習計劃': 'internship programmes', '深圳市人民政府': 'People’s Government of Shenzhen Municipality', '深圳金融辦': 'OFDS', '深港金融科技創新獎': 'Shenzhen-Hong Kong Fintech Award', '金管局': 'HKMA', '金融科技': 'fintech', '金融科技合作': 'fintech collaboration'}	繼於2017年與深圳市人民政府金融發展服務辦公室（深圳金融辦）簽署《諒解備忘錄》後，金管局繼續加強與深圳的金融科技合作。當中包括金管局贊助「深圳金融科技暑期實習計劃」，讓50名學生到深圳多間著名公司進行為期6星期的實習，體驗當地的金融科技生態；另與深圳金融辦第二次合辦「深港金融科技創新獎」。	The Hong Kong Monetary Authority (HKMA) has continued to strengthen its financial technology collaboration with Shenzhen, following the signing of a Memorandum of Understanding (MOU) with the Shenzhen Municipal Government’s Financial Services Office in 2017. This includes sponsoring the “Shenzhen FinTech Summer Internship Program,” which provides 50 students with six-week internships at leading companies in Shenzhen, immersing them in the local fintech environment. The HKMA also co-organized the “Shenzhen-Hong Kong FinTech Innovation Awards” for a second time with the Shenzhen Financial Services Office.	['實習計劃', '深圳市人民政府', '深圳金融辦', '深港金融科技創新獎', '金管局', '金融科技', '金融科技合作']	{'實習計劃': 'internship program', '深圳市人民政府': 'Shenzhen Municipal Government', '深圳金融辦': 'Shenzhen Office', '深港金融科技創新獎': 'Kong FinTech Awards', '金管局': 'HKMA', '金融科技': 'fintech', '金融科技合作': 'collaboration'}	['internship program', 'shenzhen municipal government', 'shenzhen office', 'kong fintech award', 'hkma', 'fintech', 'collaboration']
196	{'副總裁': 'Deputy Chief Executives', '實習生': 'interns', '總裁': 'Chief Executive', '金管局': 'HKMA', '金融科技': 'fintech'}	金管局副總裁李達志先生（右二）與首批深圳金融科技暑期實習生交談。	Mr. Li Dazhi, Deputy Chief Executive of the Hong Kong Monetary Authority (second from the right), speaks with the first batch of Shenzhen Fintech summer interns.	['副總裁', '實習生', '總裁', '金管局', '金融科技']	{'副總裁': 'Deputy Chief Executive', '實習生': 'interns', '總裁': 'Executive', '金管局': 'Authority', '金融科技': 'Fintech'}	['deputy chief executive', 'intern', 'executive', 'authority', 'fintech']
197	{'巴西中央銀行': 'Central Bank of Brazil', '波蘭金融監管局': 'Polish Financial Supervision Authority', '金管局': 'HKMA', '金融市場': 'financial markets', '金融服務': 'Financial Services', '金融科技': 'fintech', '金融科技合作': 'fintech collaboration', '阿布扎比國際金融中心': 'Abu Dhabi Global Market'}	金管局亦於2018年與瑞士金融市場監督管理局、波蘭金融監管局、阿布扎比國際金融中心金融服務監管局及巴西中央銀行簽署金融科技合作協議，促進金融科技合作。	The HKMA also signed fintech cooperation agreements with the Swiss Financial Market Supervisory Authority, the Polish Financial Supervision Authority, the Financial Services Regulatory Authority of the Abu Dhabi Global Market, and the Central Bank of Brazil in 2018 to promote fintech cooperation.	['巴西中央銀行', '波蘭金融監管局', '金管局', '金融市場', '金融服務', '金融科技', '金融科技合作', '阿布扎比國際金融中心']	{'巴西中央銀行': 'Central Bank of Brazil', '波蘭金融監管局': 'Polish Financial Supervision Authority', '金管局': 'HKMA', '金融市場': 'financial market', '金融服務': 'financial services', '金融科技': 'fintech', '金融科技合作': 'fintech cooperation', '阿布扎比國際金融中心': 'Abu Dhabi Global Market'}	['central bank of brazil', 'polish financial supervision authority', 'hkma', 'financial market', 'financial service', 'fintech', 'fintech cooperation', 'abu dhabi global market']
198	{'全球金融創新網絡': 'Global Financial Innovation Network', '網絡': 'cyber space', '金管局': 'HKMA', '金融創新': 'financial innovation'}	在8月，金管局與11間金融監管當局和相關機構公布「全球金融創新網絡」計劃。該網絡旨在為創新型公司提供更有效方式與監管機構進行互動，並促進監管機構之間就創新相關議題的合作。	"In August, the Financial Services and Markets Authority, along with 11 other financial regulatory bodies and related organizations, announced the ""Global Financial Innovation Network"" initiative. The network aims to provide innovative companies with a more effective way to engage with regulators and to foster collaboration among regulators on innovation-related issues."	['全球金融創新網絡', '網絡', '金管局', '金融創新']	{'全球金融創新網絡': 'Global Financial Innovation Network', '網絡': 'network', '金管局': 'Authority', '金融創新': 'financial innovation'}	['global financial innovation network', 'network', 'authority', 'financial innovation']
199	{'數碼銀行': 'digital banking', '普及金融': 'financial inclusion', '金管局': 'HKMA', '金融科技': 'fintech'}	引入虛擬銀行將會為香港金融科技應用增添新動力，並為數碼銀行客戶帶來嶄新體驗。虛擬銀行以個人或中小企等零售客戶為對象，因此亦有助促進普及金融。經公眾諮詢，金管局於5月發出《虛擬銀行的認可》指引修訂本，並於8月底接獲約30宗申請。	"The introduction of virtual banks will inject new impetus into Hong Kong’s fintech applications and provide digital banking customers with a novel experience. By targeting retail customers such as individuals and small and medium-sized enterprises, virtual banks will also help advance financial inclusion. Following a public consultation, the Hong Kong Monetary Authority issued the revised ""Guidelines on the Recognition of Virtual Banks"" in May and received approximately 30 applications by the end of August."	['數碼銀行', '普及金融', '金管局', '金融科技']	{'數碼銀行': 'digital banking', '普及金融': 'financial inclusion', '金管局': 'Authority', '金融科技': 'fintech'}	['digital banking', 'financial inclusion', 'authority', 'fintech']
200	{'沙盒': 'FSS', '金融科技': 'fintech', '金融科技監管沙盒': 'Fintech Supervisory Sandbox'}	# 金融科技監管沙盒	# FinTech Regulatory Sandbox	['沙盒', '金融科技', '金融科技監管沙盒']	{'沙盒': 'Sandbox', '金融科技': 'FinTech', '金融科技監管沙盒': 'FinTech Regulatory Sandbox'}	['sandbox', 'fintech', 'fintech regulatory sandbox']
201	{'沙盒': 'FSS', '開放': 'liberalisation'}	年內沙盒的使用穩步上升。為協助建立金融合規科技的生態系統，沙盒於9月起開放予金融合規科技的項目。	Sandbox usage has steadily increased throughout the year. To help build a fintech compliance ecosystem, the sandbox has been open to fintech projects since September.	['沙盒', '開放']	{'沙盒': 'sandbox', '開放': 'sandbox'}	['sandbox', 'sandbox']
202	{'沙盒': 'FSS', '金管局': 'HKMA', '金融科技': 'fintech'}	"截至2018年底，共有42項金融科技或科技產品獲准使用沙盒進行測試，其中28項已完成試行，有關產品亦已於其後推出市場。金管局另接獲220項使用「金融科技監管聊天室」的個案，希望在金融科技項目構思初期取得監管反饋意見。其中有約70%的個案來自科技公司。
"	"As of the end of 2018, a total of 42 financial technology or technology products had been approved for testing in the regulatory sandbox, of which 28 had completed trials and their products had subsequently been released to the market. The HKMA also received 220 inquiries through the “Fintech Regulatory Chatroom,” seeking regulatory feedback during the early stages of fintech project development. Approximately 70% of these inquiries came from technology companies.
"	['沙盒', '金管局', '金融科技']	{'沙盒': 'sandbox', '金管局': 'HKMA', '金融科技': 'technology'}	['sandbox', 'hkma', 'technology']
203	{'儲備管理': 'Reserves Management'}	# 儲備管理	# Inventory Management	['儲備管理']	{'儲備管理': 'Inventory Management'}	['inventory management']
204	{'加息': 'interest rate hikes', '地緣政治': 'geopolitical environment', '地緣政治風險': 'geopolitical risks', '外匯基金': 'Exchange Fund', '投資收入': 'investment income', '新興市場': 'emerging market', '美國國庫券收益率': 'US Treasury yields', '金融狀況': 'financial conditions'}	2018年對投資者而言是困難的一年，投資環境備受多項風險因素困擾，包括美國利率持續正常化引發金融狀況收緊、主要經濟體之間的貿易摩擦升級，以及全球多處民粹主義抬頭及地緣政治風險加劇。環球股市普遍向下，美國國庫券收益率亦隨着美國聯邦儲備局4次加息而上升。在美息趨升下，美元轉強。部分新興市場面對國內嚴峻的政治及經濟壓力，其貨幣顯著下挫。儘管投資環境充滿挑戰，外匯基金在2018年仍錄得109億港元投資收入。	2018 was a challenging year for investors, with the investment environment beset by numerous risk factors, including the continued normalization of US interest rates leading to tighter financial conditions, escalating trade tensions between major economies, and the rise of populism and increased geopolitical risks in various parts of the world. Global stock markets generally declined, and US Treasury yields also rose as the US Federal Reserve raised interest rates four times. Amid rising US interest rates, the US dollar strengthened. Some emerging markets faced severe domestic political and economic pressures, causing their currencies to depreciate significantly. Despite the challenging investment environment, the foreign exchange fund still recorded investment income of HKD 10.9 billion in 2018.	['加息', '地緣政治', '地緣政治風險', '外匯基金', '投資收入', '新興市場', '美國國庫券收益率', '金融狀況']	{'加息': 'interest rates', '地緣政治': 'geopolitical risks', '地緣政治風險': 'geopolitical risks', '外匯基金': 'exchange fund', '投資收入': 'investment income', '新興市場': 'emerging markets', '美國國庫券收益率': 'US Treasury yields', '金融狀況': 'financial conditions'}	['interest rate', 'geopolitical risk', 'geopolitical risk', 'exchange fund', 'investment income', 'emerge market', 'us treasury yield', 'financial condition']
205	{'外匯基金': 'Exchange Fund'}	# 外匯基金	# Foreign Exchange Fund	['外匯基金']	{'外匯基金': 'Exchange Fund'}	['exchange fund']
206	{'外匯基金': 'Exchange Fund', '投資管理': 'investment management', '金管局': 'HKMA', '金融體系': 'financial system', '香港作為國際金融中心': 'Hong Kong as an international financial centre', '香港貨幣及金融體系': 'Hong Kong’s monetary and financial systems'}	根據《外匯基金條例》，外匯基金的首要目的是直接或間接影響港元匯價，亦可運用於保持香港貨幣及金融體系穩定健全，藉此保持香港作為國際金融中心的地位。金管局根據財政司司長轉授的權力及轉授權力的條款，就外匯基金的運用及投資管理向財政司司長負責。	According to the Exchange Fund Ordinance, the primary objective of the Exchange Fund is to influence the exchange rate of the Hong Kong dollar, directly or indirectly. It may also be used to maintain the stability and integrity of the monetary and financial system in Hong Kong, thereby preserving Hong Kong’s position as an international financial centre. The Hong Kong Monetary Authority is accountable to the Financial Secretary for the operation and investment management of the Exchange Fund, in accordance with the powers delegated to it and the provisions for further delegation by the Financial Secretary.	['外匯基金', '投資管理', '金管局', '金融體系', '香港作為國際金融中心', '香港貨幣及金融體系']	{'外匯基金': 'Exchange Fund', '投資管理': 'investment management', '金管局': 'Authority', '金融體系': 'financial system', '香港作為國際金融中心': 'Kong as international centre', '香港貨幣及金融體系': 'Hong Kong monetary and financial system'}	['exchange fund', 'investment management', 'authority', 'financial system', 'kong as international centre', 'hong kong monetary and financial system']
207	{'外匯基金': 'Exchange Fund'}	# 外匯基金的管理	# Management of Foreign Exchange Reserves	['外匯基金']	{'外匯基金': 'Exchange Reserves'}	['exchange reserve']
208	{'組合架構': 'portfolio structure'}	# 投資目標及組合架構	# Investment Objectives and Portfolio Structure	['組合架構']	{'組合架構': 'portfolio structure'}	['portfolio structure']
209	{'外匯基金': 'Exchange Fund'}	外匯基金諮詢委員會為外匯基金制定下列投資目標：	The Foreign Exchange Fund Advisory Committee formulates the following investment objectives for the Foreign Exchange Fund:	['外匯基金']	{'外匯基金': 'Exchange Fund'}	['exchange fund']
210	{'美元資產': 'US dollar-denominated assets', '貨幣及金融穩定': 'monetary and financial stability', '貨幣基礎': 'Monetary Base'}	"(a) 保障資本；
(b) 確保整體貨幣基礎在任何時候都由流通性極高的美元資產提供十足支持；
(c) 確保流動資金足以維持貨幣及金融穩定；以及
(d) 在符合上述(a)至(c)項的前提下盡量爭取投資回報，以保障基金的長期購買力。"	"(a) Ensuring capital preservation;  
(b) Ensuring that the entire monetary base is always fully supported by highly liquid U.S. dollar assets;  
(c) Ensuring sufficient liquidity to maintain monetary and financial stability; and  
(d) Striving to maximize investment returns, in accordance with the above (a) to (c), in order to safeguard the fund's long-term purchasing power."	['美元資產', '貨幣及金融穩定', '貨幣基礎']	{'美元資產': 'U.S. dollar assets', '貨幣及金融穩定': 'monetary and financial stability', '貨幣基礎': 'monetary base'}	['u.s dollar asset', 'monetary and financial stability', 'monetary base']
211	{'外匯基金': 'Exchange Fund', '目標資產配置': 'target asset mix'}	以上目標全面顧及外匯基金的法定目的，並已於外匯基金的組合結構及目標資產配置中反映。	The aforementioned objectives comprehensively take into account the statutory purposes of the foreign exchange fund and have been reflected in the fund's portfolio structure and target asset allocation.	['外匯基金', '目標資產配置']	{'外匯基金': 'fund', '目標資產配置': 'target asset allocation'}	['fund', 'target asset allocation']
212	{'債市': 'bond markets', '外匯基金': 'Exchange Fund', '經濟合作與發展組織': 'Organisation for Economic Co-operation and Development', '美元資產': 'US dollar-denominated assets', '貨幣基礎': 'Monetary Base', '貨幣發行局': 'Currency Board'}	外匯基金大致上分成兩個主要組合：支持組合及投資組合。支持組合持有流通性極高的美元資產，按照貨幣發行局制度的規定為貨幣基礎提供十足支持。投資組合主要投資於經濟合作與發展組織成員國的債市及股市，以保障資產的價值及長期購買力。	Foreign exchange funds are broadly divided into two main portfolios: support portfolio and investment portfolio. The support portfolio holds highly liquid U.S. dollar assets, providing ample backing for the currency base as stipulated by the monetary authority system. The investment portfolio primarily invests in debt and equity markets of member countries of the Organisation for Economic Co-operation and Development to safeguard asset value and long-term purchasing power.	['債市', '外匯基金', '經濟合作與發展組織', '美元資產', '貨幣基礎', '貨幣發行局']	{'債市': 'debt market', '外匯基金': 'exchange funds', '經濟合作與發展組織': 'Organisation for Economic Co-operation and Development', '美元資產': 'U.S. dollar assets', '貨幣基礎': 'currency base', '貨幣發行局': 'monetary authority'}	['debt market', 'exchange fund', 'organisation for economic co-operation and development', 'u.s dollar asset', 'currency base', 'monetary authority']
213	{'債券': 'debt securities', '內地': 'Mainland', '外匯基金': 'Exchange Fund', '房地產': 'real estate', '房地產投資': 'real estate investments', '未來基金': 'Future Fund', '私募股權': 'private equity', '累計盈餘': 'accumulated surplus', '股票': 'equity securities', '金管局': 'HKMA'}	為能更妥善管理風險及提高中長期回報，金管局以審慎及循序漸進方式將外匯基金的部分資產分散投資至較多元化的資產類別，包括新興巿場及內地債券與股票、私募股權（包括基建）及房地產。新興巿場及內地債券與股票由投資組合持有，私募股權及房地產投資則由長期增長組合持有。長期增長組合的市值上限為外匯基金累計盈餘的三分之一及未來基金與外匯基金附屬公司存款中與長期增長組合掛鈎部分的總和。	To better manage risks and enhance long-term returns, the Monetary Authority has prudently and incrementally diversified a portion of the Exchange Fund’s assets into a wider range of asset classes, including emerging market and mainland China bonds and equities, private equity (including infrastructure), and real estate. Emerging market and mainland China bonds and equities are held through investment portfolios, while private equity and real estate investments are held through a long-term growth portfolio. The market capitalization limit of the long-term growth portfolio is one-third of the Exchange Fund’s accumulated surpluses and the sum of future fund and Exchange Fund affiliated company deposits linked to the long-term growth portfolio.	['債券', '內地', '外匯基金', '房地產', '房地產投資', '未來基金', '私募股權', '累計盈餘', '股票', '金管局']	{'債券': 'bonds', '內地': 'China', '外匯基金': 'Exchange Fund', '房地產': 'real estate', '房地產投資': 'real estate investment', '未來基金': 'future fund', '私募股權': 'private equity', '累計盈餘': 'accumulated surpluses', '股票': 'equities', '金管局': 'Authority'}	['bond', 'china', 'exchange fund', 'real estate', 'real estate investment', 'future fund', 'private equity', 'accumulate surplus', 'equity', 'authority']
214	{'外匯基金': 'Exchange Fund', '策略性資產組合': 'Strategic Portfolio', '香港交易及結算所有限公司': 'Hong Kong Exchanges and Clearing Limited'}	策略性資產組合於2007年設立，以持有政府基於策略性目的而為外匯基金帳目購入的香港交易及結算所有限公司股份。由於這個組合性質獨特，因此外匯基金的投資表現評估並無將其包括在內。	The Strategic Asset Portfolio was established in 2007 to hold shares in Hong Kong Exchanges and Clearing Limited purchased by the government for strategic purposes through the Exchange Fund. Due to its unique nature, the portfolio’s investment performance is not included in the Exchange Fund’s assessment.	['外匯基金', '策略性資產組合', '香港交易及結算所有限公司']	{'外匯基金': 'Exchange Fund', '策略性資產組合': 'Strategic Asset Portfolio', '香港交易及結算所有限公司': 'Hong Kong Exchanges and Clearing Limited'}	['exchange fund', 'strategic asset portfolio', 'hong kong exchanges and clearing limited']
