	terms	src_raw	mt_raw	src_terms	alg_terms	norm_tgt_terms
82	{'國際貨幣基金組織': 'International Monetary Fund', '基金組織': 'IMF', '外匯基金': 'Exchange Fund', '外匯基金諮詢委員會轄下貨幣發行委員會': 'Currency Board Sub-Committee of the Exchange Fund Advisory Committee', '數據公布特殊標準': 'Special Data Dissemination Standard', '網站': 'official website', '貨幣發行局': 'Currency Board', '貨幣發行局制度運作': 'Currency Board operations', '金管局': 'HKMA', '金管局網站': 'HKMA website', '銀行業': 'banking sector', '銀行業監管政策及指引': 'supervisory policies and guidelines on banking'}	金管局公布外匯基金及貨幣發行局帳目資料的次數，一直逐步增加，內容亦越趨詳細。金管局於1999年開始參與國際貨幣基金組織的中央銀行「數據公布特殊標準」計劃。金管局亦公布外匯基金諮詢委員會轄下貨幣發行委員會的會議紀錄，以及貨幣發行局制度運作報告。自1996年起，金管局網站亦載有銀行業監管政策及指引。	The number of times the Hong Kong Monetary Authority (HKMA) publishes data on the Exchange Fund and Currency Board accounts has steadily increased, and the content has become more detailed. The HKMA began participating in the International Monetary Fund’s Special Data Dissemination Standard (SDDS) for central banks in 1999. The HKMA also publishes minutes of meetings of the Currency Board Committee under the Exchange Fund Advisory Committee, as well as reports on the operation of the Currency Board system. Since 1996, the HKMA website has also featured banking sector regulatory policies and guidelines.	['國際貨幣基金組織', '基金組織', '外匯基金', '外匯基金諮詢委員會轄下貨幣發行委員會', '數據公布特殊標準', '網站', '貨幣發行局', '貨幣發行局制度運作', '金管局', '金管局網站', '銀行業', '銀行業監管政策及指引']	{'國際貨幣基金組織': 'International Monetary Fund', '基金組織': '▔', '外匯基金': 'Exchange Fund', '外匯基金諮詢委員會轄下貨幣發行委員會': 'Currency Board Committee under the Exchange Fund Advisory Committee', '數據公布特殊標準': 'Special Data Dissemination Standard', '網站': 'website', '貨幣發行局': 'Currency Board', '貨幣發行局制度運作': 'Currency Board system', '金管局': 'HKMA', '金管局網站': 'HKMA website', '銀行業': 'banking sector', '銀行業監管政策及指引': 'banking sector regulatory policies and guidelines'}	['international monetary fund', '▔', 'exchange fund', 'currency board committee under the exchange fund advisory committee', 'special data dissemination standard', 'website', 'currency board', 'currency board system', 'hkma', 'hkma website', 'banking sector', 'banking sector regulatory policy and guideline']
83	{'委員會及法案委員會會議': 'panel and committee meetings', '立法會': 'Legislative Council', '總裁': 'Chief Executive', '財經事務委員會': 'Panel on Financial Affairs', '金管局': 'HKMA'}	金管局與立法會的關係對提高問責性及透明度非常重要。金管局總裁承諾每年3次向立法會財經事務委員會簡報金管局各項工作及政策，並回答有關查詢。此外，金管局代表亦會不時出席立法會財經事務委員會及法案委員會會議，闡釋及商討特別事項，以及協助議員審閱條例草案。	The relationship between the Hong Kong Monetary Authority (HKMA) and the Legislative Council is crucial for enhancing accountability and transparency. The HKMA Chief Executive has pledged to brief the Legislative Council’s Finance Committee three times a year on the HKMA’s work and policies, and to answer related inquiries. Furthermore, representatives of the HKMA will also attend meetings of the Legislative Council’s Finance Committee and Bills Committee from time to time to explain and discuss specific matters, and to assist legislators in reviewing draft legislation.	['委員會及法案委員會會議', '立法會', '總裁', '財經事務委員會', '金管局']	{'委員會及法案委員會會議': 'Bills Committee', '立法會': 'Legislative Council', '總裁': 'Chief Executive', '財經事務委員會': 'Finance Committee', '金管局': 'HKMA'}	['bills committee', 'legislative council', 'chief executive', 'finance committee', 'hkma']
84	{'外匯基金': 'Exchange Fund'}	# 外匯基金諮詢委員會	# Foreign Exchange Fund Advisory Committee	['外匯基金']	{'外匯基金': 'Exchange Fund'}	['exchange fund']
85	{'外匯基金': 'Exchange Fund', '控制權': 'control', '行政長官': 'Chief Executive', '香港特別行政區': 'Hong Kong Special Administrative Region'}	財政司司長行使外匯基金的控制權時，會聽取外匯基金諮詢委員會的意見。外匯基金諮詢委員會根據《外匯基金條例》第3(1)條成立。該項條文訂明財政司司長行使對外匯基金的控制權時，須諮詢外匯基金諮詢委員會的意見。財政司司長為外匯基金諮詢委員會的當然主席，其他委員（包括金融管理專員）則以個人身分，由財政司司長根據香港特別行政區行政長官的授權委任。委員因各具專業知識及經驗而獲委任，他們的加入讓外匯基金諮詢委員會廣受裨益。委員的專業知識及經驗涵蓋貨幣、金融、經濟、投資、會計、管理、商業及法律等範疇。	The Financial Secretary exercises control over the Exchange Fund in consultation with the Exchange Fund Advisory Committee. The Exchange Fund Advisory Committee was established under section 3(1) of the Exchange Fund Ordinance. This provision stipulates that the Financial Secretary must consult the Exchange Fund Advisory Committee when exercising control over the Exchange Fund. The Financial Secretary serves as the ex officio chairman of the Exchange Fund Advisory Committee, while other members, including the Commissioner for Financial Management, are appointed individually by the Financial Secretary with the authorization of the Chief Executive of the Hong Kong Special Administrative Region. Members are appointed for their professional expertise and experience, which enhances the effectiveness of the Exchange Fund Advisory Committee. Their expertise covers areas such as currency, finance, economics, investment, accounting, management, commerce, and law.	['外匯基金', '控制權', '行政長官', '香港特別行政區']	{'外匯基金': 'Exchange Fund', '控制權': 'control', '行政長官': 'Chief Executive', '香港特別行政區': 'Hong Kong Special Administrative Region'}	['exchange fund', 'control', 'chief executive', 'hong kong special administrative region']
86	{'外匯基金': 'Exchange Fund', '專責委員會': 'Sub-Committee', '金管局': 'HKMA'}	外匯基金諮詢委員會下設5個專責委員會，負責監察金管局特定環節的工作，並透過外匯基金諮詢委員會向財政司司長報告及提出建議。外匯基金諮詢委員會在2018年共舉行5次會議，討論各項與金管局工作有關的事宜，其中大部分事項均由有關的專責委員會事先進行討論。	The Foreign Exchange Fund Advisory Committee has established five specialized committees, which are responsible for overseeing specific aspects of the Hong Kong Monetary Authority's operations and reporting to and making recommendations to the Financial Secretary through the Foreign Exchange Fund Advisory Committee. In 2018, the Foreign Exchange Fund Advisory Committee held five meetings to discuss various matters related to the Hong Kong Monetary Authority's work, with most of these matters having been discussed in advance by the relevant specialized committees.	['外匯基金', '專責委員會', '金管局']	{'外匯基金': 'Exchange Fund', '專責委員會': 'committees', '金管局': 'Authority'}	['exchange fund', 'committee', 'authority']
87	{'外匯基金': 'Exchange Fund', '年度薪酬檢討': 'annual pay review', '策略性規劃事宜': 'strategic planning matters', '薪酬': 'remuneration', '薪酬與服務條件、人力資源政策': 'remuneration and human resources policies', '金管局': 'HKMA'}	管治委員會監察金管局的表現，以及就金管局薪酬與服務條件、人力資源政策、財政預算、行政及管治事務，向外匯基金諮詢委員會提出建議。該委員會在2018年共召開5次會議，內容涵蓋金管局的開支預算、表現評估、年度薪酬檢討及策略性規劃事宜。該委員會亦審議金管局定期提交的工作報告。	The Governance Committee oversees the performance of the Hong Kong Monetary Authority (HKMA) and provides recommendations to the Exchange Fund Advisory Committee on matters relating to the HKMA’s remuneration and service conditions, human resources policies, financial budget, and administrative and governance affairs. In 2018, the Committee held five meetings, covering topics including the HKMA’s expenditure budget, performance evaluation, annual remuneration review, and strategic planning. The Committee also reviewed the HKMA’s regularly submitted work reports.	['外匯基金', '年度薪酬檢討', '策略性規劃事宜', '薪酬', '薪酬與服務條件、人力資源政策', '金管局']	{'外匯基金': 'Exchange Fund', '年度薪酬檢討': 'annual remuneration review', '策略性規劃事宜': 'strategic planning', '薪酬': 'remuneration', '薪酬與服務條件、人力資源政策': 'remuneration service conditions human resources policies', '金管局': 'HKMA'}	['exchange fund', 'annual remuneration review', 'strategic plan', 'remuneration', 'remuneration service condition human resource policy', 'hkma']
88	{'內部審核': 'INTERNAL AUDIT', '內部審核處': 'Internal Audit Division', '內部管控制度': 'internal control systems', '外部及內部審計師': 'external and internal auditors', '審核委員會': 'Audit Sub-Committee', '會計原則': 'accounting principles', '財務報表': 'financial statements', '金管局': 'HKMA', '風險委員會': 'Risk Committee'}	審核委員會檢討金管局的財政匯報程序，並評核其內部管控制度是否足夠和有效，以及提交報告。審核委員會負責檢視金管局的財務報表，編製該等報表的組成項目與會計原則，並聯同外部及內部審計師查核其審計範疇與結果。審核委員會各委員在金管局並沒有任何行政職能。該委員會在2018年共召開2次會議，並審議風險委員會及內部審核處的工作報告。	The Audit Committee reviews the Hong Kong Monetary Authority's (HKMA) financial reporting procedures and evaluates the adequacy and effectiveness of its internal control systems, submitting reports as required. It is responsible for examining the HKMA's financial statements, the components of those statements, and the accounting principles used in their preparation, and for reviewing the audit scope and results in collaboration with external and internal auditors. Members of the Audit Committee do not hold any administrative positions within the HKMA. In 2018, the Committee held two meetings and reviewed the work reports of the Risk Committee and the Internal Audit Department.	['內部審核', '內部審核處', '內部管控制度', '外部及內部審計師', '審核委員會', '會計原則', '財務報表', '金管局', '風險委員會']	{'內部審核': 'Internal Audit', '內部審核處': 'Internal Audit Department', '內部管控制度': 'internal control systems', '外部及內部審計師': 'external and internal auditors', '審核委員會': 'Audit Committee', '會計原則': 'accounting principles', '財務報表': 'financial statements', '金管局': 'HKMA', '風險委員會': 'Risk Committee'}	['internal audit', 'internal audit department', 'internal control system', 'external and internal auditor', 'audit committee', 'accounting principle', 'financial statement', 'hkma', 'risk committee']
89	{'匯率制度': 'exchange rate arrangement', '貨幣發行局': 'Currency Board', '貨幣發行局制度運作': 'Currency Board operations', '金管局': 'HKMA'}	"貨幣發行委員會監察貨幣發行局制度的運作，並匯報這個作為香港聯繫匯率制度支柱的情況。該委員會負責確保貨幣發行局制度按照既定政策運作、提出改進該制度的建議，以及確保該制度的運作維持高透明度。金管局定期公布貨幣發行委員會的會議紀錄及提交該委員會的貨幣發行局制度運作報告。該委員會在2018年共召開4次會議。
"	"The Currency Issuance Committee oversees the operation of the Currency Issuance System and reports on its role as a pillar of Hong Kong’s linked exchange rate system. The Committee is responsible for ensuring the System operates in accordance with established policies, proposing improvements to the System, and ensuring its operation maintains a high degree of transparency. The Hong Kong Monetary Authority regularly publishes the minutes of the Currency Issuance Committee meetings and the reports on the operation of the Currency Issuance System submitted to the Committee. The Committee held four meetings in 2018.
"	['匯率制度', '貨幣發行局', '貨幣發行局制度運作', '金管局']	{'匯率制度': 'system', '貨幣發行局': 'Issuance', '貨幣發行局制度運作': 'Currency Issuance System', '金管局': 'Authority'}	['system', 'issuance', 'currency issuance system', 'authority']
90	{'保護主義': 'protectionism', '全球經濟增長': 'global economic expansion', '貿易保護主義': 'trade protectionism', '金融狀況': 'financial conditions', '香港經濟': 'domestic economy'}	2018年香港經濟持續擴張，不過隨着金融狀況收緊及貿易保護主義升溫令不明朗因素增加，增長動力於年內有所減弱。隨着全球經濟增長轉弱，預期2019年香港經濟增長亦會減慢。	The Hong Kong economy continued to expand in 2018, but growth momentum weakened during the year due to increased uncertainty caused by tighter financial conditions and rising trade protectionism. With the global economic growth slowing, it is expected that Hong Kong's economic growth will also decelerate in 2019.	['保護主義', '全球經濟增長', '貿易保護主義', '金融狀況', '香港經濟']	{'保護主義': 'protectionism', '全球經濟增長': 'global economic growth', '貿易保護主義': 'trade protectionism', '金融狀況': 'financial conditions', '香港經濟': 'Kong'}	['protectionism', 'global economic growth', 'trade protectionism', 'financial condition', 'kong']
91	{'實體經濟活動': 'Real activities'}	# 實體經濟活動	# Real Economic Activities	['實體經濟活動']	{'實體經濟活動': 'Real Economic Activities'}	['real economic activity']
92	{'中美貿易摩擦': 'US-China trade tensions', '保護主義': 'protectionism', '商業及其他服務': 'business and other services', '投資支出': 'investment spending', '服務輸入': 'imports of services', '服務輸出': 'exports of services', '本地需求': 'domestic demand', '淨出口': 'net exports', '營商信心': 'business confidence', '私人消費': 'private consumption', '經濟擴張': 'economic expansion', '訪港旅遊業': 'inbound tourism', '財富減值效應': 'wealth effects', '貨品出口': 'exports of goods', '貨品進口': 'imports of goods', '貿易保護主義': 'trade protectionism', '貿易差額': 'net trade', '資產價格調整': 'asset price corrections', '香港經濟': 'domestic economy'}	2018年香港經濟進一步擴張，不過按年增長速度由第1季的4.6%，逐步減慢至第4季的1.3%（表1），並拖累全年增長率由2017年的3.8%下降至3.0%。經濟擴張轉弱，反映本地需求增長減慢以及經濟持續受淨出口所拖累（圖1）。本地方面，私人消費在第1季強勁增長，但其後增長動力減弱，部分反映貿易保護主義升溫令不明朗因素增加，以及本地資產價格調整帶來的財富減值效應。由於營商信心脆弱，整體投資支出的增長速度亦放緩。外圍方面，貨品出口於首3季大致保持平穩，但在第4季隨着中美貿易摩擦加劇而顯著轉差。貨品進口亦因為出口帶動的需求轉弱而放緩。相比之下，服務輸出錄得較快的全年增長，部分是受惠於訪港旅遊業表現蓬勃，而服務輸入則由於運輸、商業及其他服務增長而得以大致維持增長動力。按淨額計，貿易差額由2017年的順差轉為2018年的小幅逆差，並拖累本地經濟增長。	Hong Kong’s economy continued to expand in 2018, although the year-on-year growth rate eased from 4.6% in the first quarter to 1.3% in the fourth quarter (Table 1), resulting in a decline in the full-year growth rate from 3.8% in 2017 to 3.0%. The weakening economic expansion reflected slower growth in domestic demand and the continuing drag from net exports (Figure 1). Domestically, private consumption grew strongly in the first quarter but subsequently lost steam, partly due to rising uncertainty stemming from increasing trade protectionism and the impact of local asset price adjustments on wealth. Overall investment expenditure also moderated as business confidence remained weak. Externally, merchandise exports remained relatively stable in the first three quarters but deteriorated significantly in the fourth quarter as US-China trade tensions escalated. Merchandise imports also slowed, reflecting weaker export-driven demand. In contrast, service exports recorded faster annual growth, benefiting in part from a thriving inbound tourism sector, while service imports maintained growth largely due to increases in transport, commercial, and other services. In net terms, the trade balance shifted from a surplus in 2017 to a small deficit in 2018, dampening local economic growth.	['中美貿易摩擦', '保護主義', '商業及其他服務', '投資支出', '服務輸入', '服務輸出', '本地需求', '淨出口', '營商信心', '私人消費', '經濟擴張', '訪港旅遊業', '財富減值效應', '貨品出口', '貨品進口', '貿易保護主義', '貿易差額', '資產價格調整', '香港經濟']	{'中美貿易摩擦': 'US-China trade tensions', '保護主義': '▔', '商業及其他服務': 'commercial and other services', '投資支出': 'investment expenditure', '服務輸入': 'service imports', '服務輸出': 'service exports', '本地需求': 'domestic demand', '淨出口': 'net exports', '營商信心': 'business confidence', '私人消費': 'private consumption', '經濟擴張': 'economic expansion', '訪港旅遊業': 'sector', '財富減值效應': 'wealth', '貨品出口': 'merchandise exports', '貨品進口': 'merchandise imports', '貿易保護主義': 'trade protectionism', '貿易差額': 'trade balance', '資產價格調整': 'asset price adjustments', '香港經濟': 'Kong'}	['us trade tension', '▔', 'commercial and other service', 'investment expenditure', 'service import', 'service export', 'domestic demand', 'net export', 'business confidence', 'private consumption', 'economic expansion', 'sector', 'wealth', 'merchandise export', 'merchandise import', 'trade protectionism', 'trade balance', 'asset price adjustment', 'kong']
93	{'固定資本形成': 'fixed capital formation', '政府統計處': 'Census and Statistics Department'}	"註：本地固定資本形成總額經季節因素調整的按季增減幅度不詳。
資料來源：政府統計處。"	"Note: The magnitude of quarterly increases or decreases in the total fixed capital formation in this region, after seasonal adjustments, is not specified.
Data source: Census and Statistics Department."	['固定資本形成', '政府統計處']	{'固定資本形成': 'fixed capital formation', '政府統計處': 'Census and Statistics Department'}	['fix capital formation', 'census and statistics department']
94	{'政府統計處': 'Census and Statistics Department'}	"圖1 組成部分對實質本地生產總值增長的貢獻
資料來源：政府統計處。"	"Figure 1 shows the contribution of various components to real gross domestic product growth.
Source: Government Statistics Department."	['政府統計處']	{'政府統計處': 'Government Statistics Department'}	['government statistics department']
95	{'加息': 'interest rate hikes', '匯率制度': 'exchange rate arrangement', '同業流動性': 'interbank liquidity', '基點': 'basis points', '最優惠貸款利率': 'Best Lending Rates', '美國加息': 'US interest rate hikes', '美國聯邦基金利率': 'US Federal Funds Rate', '聯匯制度': 'LERS', '聯邦基金利率': 'federal funds rate', '貨幣基礎': 'Monetary Base', '金管局': 'HKMA', '銀行同業流動性': 'interbank liquidity', '銀行貸款': 'bank loans'}	主要受到港元與美元負息差下的套息活動所影響，港元兌美元匯率在2018年大致回軟。尤其弱方兌換保證在4月、5月及8月被觸發，促使金管局按照聯繫匯率制度（聯匯制度）所定，在7.85港元兌1美元的水平，向銀行購入港元及沽出美元。按照聯匯制度的設計，港元貨幣基礎因而收縮，表示銀行同業流動性減少，再加上市場預期美國加息，導致港元銀行同業拆息整體上升。由於銀行體系資金成本上升，銀行於9月下旬在美國聯邦基金利率目標區間上調後，調高最優惠貸款利率12.5至25基點。信貸增長方面，部分由於本地經濟增長放緩以及對外貿易表現轉弱，整體銀行貸款的增幅由2017年的16.1%，顯著減慢至2018年的4.4%。	The Hong Kong dollar exchange rate against the US dollar depreciated throughout 2018, largely due to arbitrage activity stemming from the negative interest rate differential between the two currencies. The Hong Kong Monetary Authority (HKMA) was prompted to intervene in the market in April, May, and August, triggered by the lower limit of the linked exchange rate system.  The HKMA purchased Hong Kong dollars and sold US dollars at the rate of 7.85 HKD per 1 USD, as stipulated by the system. This intervention contracted the Hong Kong dollar monetary base, reducing interbank liquidity.  Combined with expectations of US interest rate increases, this led to a rise in Hong Kong dollar interbank offered rates (HIBOR).  As funding costs for banks increased, they raised their prime lending rates by 12.5 to 25 basis points in late September following the increase in the US federal funds rate target range.  Regarding credit growth, the overall growth rate of bank loans slowed significantly from 16.1% in 2017 to 4.4% in 2018, partly attributable to slower local economic growth and weaker external trade performance.	['加息', '匯率制度', '同業流動性', '基點', '最優惠貸款利率', '美國加息', '美國聯邦基金利率', '聯匯制度', '聯邦基金利率', '貨幣基礎', '金管局', '銀行同業流動性', '銀行貸款']	{'加息': 'interest rate increase', '匯率制度': 'exchange rate system', '同業流動性': 'interbank liquidity', '基點': 'basis points', '最優惠貸款利率': 'prime lending rate', '美國加息': 'US interest rate increase', '美國聯邦基金利率': 'US federal funds rate', '聯匯制度': 'system', '聯邦基金利率': 'federal funds rate', '貨幣基礎': 'monetary base', '金管局': 'HKMA', '銀行同業流動性': 'interbank liquidity', '銀行貸款': 'bank loans'}	['interest rate increase', 'exchange rate system', 'interbank liquidity', 'basis point', 'prime lending rate', 'us interest rate increase', 'us federal fund rate', 'system', 'federal fund rate', 'monetary base', 'hkma', 'interbank liquidity', 'bank loan']
