	terms	src_raw	mt_raw	src_terms	alg_terms	norm_tgt_terms
127	{'hkma': '金管局', 'hong kong money laundering and terrorist financing risk assessment': '香港洗錢及恐怖分子資金籌集風險評估', 'svf': '儲值支付工具', 'emerge risk': '前路的風險', 'international standard setter': '國際標準制定組織', 'international standard': '國際標準', 'money laundering and terrorist financing': '洗錢及恐怖分子資金籌集', 'regulator': '監管機構', 'store value facility': '儲值支付工具'}	The HKMA will also keep working closely with the Government, the banking and stored value facility (SVF) sectors to publish an updated Hong Kong money laundering and terrorist financing risk assessment, and assist the industry in combatting new and emerging risks.  Work will also continue on understanding evolving money laundering and terrorist financing risks, implementing changes to AML law and related guidance to align with international standards, and maintaining proactive engagement with other regulators and international standard setters.	香港金融管理局亦會繼續與政府、銀行業及儲值支付工具發牌機構緊密合作，新增一份更新的香港洗錢及恐怖主義融資風險評估報告，並協助業界應對新興風險。有關工作亦會繼續進行，以了解反覆出現的洗錢及恐怖主義融資風險，實施反洗錢法律及相關指引的變更，以配合國際標準，並維持與其他監管機構及國際標準制定機構的主動交流。	['hkma', 'hong kong money laundering and terrorist financing risk assessment', 'svf', 'emerge risk', 'international standard setter', 'international standard', 'money laundering and terrorist financing', 'regulator', 'store value facility']	{'hkma': '香港金融管理局', 'hong kong money laundering and terrorist financing risk assessment': '香港 及 恐怖 資風險 評估', 'svf': '儲值支付工具', 'emerge risk': '新興風險', 'international standard setter': '國際標準制定機構', 'international standard': '國際標準', 'money laundering and terrorist financing': '洗錢及恐怖主義融資', 'regulator': '監管機構', 'store value facility': '儲值支付工具'}	['香港金融管理局', '香港 及 恐怖 資風險 評估', '儲值支付工具', '新興風險', '國際標準制定機構', '國際標準', '洗錢及恐怖主義融資', '監管機構', '儲值支付工具']
128	{'mandatory provident fund': '強制性公積金（強積金）', 'wealth management': '財富管理', 'provident fund': '公積金'}	# Wealth management and mandatory provident fund-related businesses	# 財富管理及強制性退休金相關業務	['mandatory provident fund', 'wealth management', 'provident fund']	{'mandatory provident fund': '強制性退休金', 'wealth management': '財富管理', 'provident fund': '強制性退休金'}	['強制性退休金', '財富管理', '強制性退休金']
129	{'ais': '認可機構', 'great bay area': '大灣區', 'guangdong - hong kong - macao great bay area': '粵港澳大灣區', 'hkma': '金管局', 'mpf': '強積金', 'mandatory provident fund': '強制性公積金（強積金）', 'wealth management': '財富管理', 'complex product': '複雜產品', 'digital advisory platform': '數碼顧問平台', 'insurance product': '保險產品', 'investment and insurance product': '投資及保險產品', 'non-investment - link long term insurance product': '非投資相連長期保險產品', 'on - site examination': '現場審查', 'provident fund': '公積金', 'surveillance': '監察', 'virtual asset': '虛擬資產'}	In 2022, the HKMA will carry out on-site examinations and off-site surveillance of AIs’ conduct in relation to wealth management and the selling of securities, mandatory provident fund (MPF) and other investment and insurance products, with a focus on the Cross-boundary Wealth Management Connect (Cross-boundary WMC) Scheme in the Guangdong–Hong Kong–Macao Greater Bay Area, digital advisory platforms, complex products, virtual assets and non-investment-linked long term insurance products.	2022年，香港金融管理局將對與財富管理及證券發售、強制性公積金（MPF）及其他投資及保險產品有關的AI行為進行現場審查及非現場監察，重點關注廣東–香港–澳門大灣區的跨境財富管理通關（跨境WMC）計劃、數字建議平台、複雜產品、虛擬資產及非投資連結長期人壽保險產品。	['ais', 'great bay area', 'guangdong - hong kong - macao great bay area', 'hkma', 'mpf', 'mandatory provident fund', 'wealth management', 'complex product', 'digital advisory platform', 'insurance product', 'investment and insurance product', 'non-investment - link long term insurance product', 'on - site examination', 'provident fund', 'surveillance', 'virtual asset']	{'ais': 'AI', 'great bay area': '大灣區', 'guangdong - hong kong - macao great bay area': '香港 澳門 大灣區', 'hkma': '香港金融管理局', 'mpf': '▔', 'mandatory provident fund': '強制性公積金', 'wealth management': '財富管理', 'complex product': '複雜產品', 'digital advisory platform': '數字建議平台', 'insurance product': '保險產品', 'investment and insurance product': '投資及保險產品', 'non-investment - link long term insurance product': '結長 期人壽 保險 產品', 'on - site examination': '現場審查', 'provident fund': '性公積 金', 'surveillance': '監察', 'virtual asset': '虛擬資產'}	['AI', '大灣區', '香港 澳門 大灣區', '香港金融管理局', '▔', '強制性公積金', '財富管理', '複雜產品', '數字建議平台', '保險產品', '投資及保險產品', '結長 期人壽 保險 產品', '現場審查', '性公積 金', '監察', '虛擬資產']
130	{'hkma': '金管局', 'insurance authority': '保險業監管局', 'mpf': '強積金', 'mandatory provident fund': '強制性公積金（強積金）', 'mandatory provident fund schemes authority': '強制性公積金計劃管理局', 'protection linked plan': '保障型投資相連壽險', 'qualifying deferred annuity policies': '合資格延期年金保單', 'tax - deductible voluntary contribution': '可扣稅自願性供款', 'banking industry': '銀行業', 'investment - link assurance scheme product': '投資相連壽險產品', 'mystery shopping programme': '喬裝客戶檢查計劃', 'provident fund': '公積金', 'regulator': '監管機構', 'virtual asset': '虛擬資產'}	While maintaining close communication with other regulators and the banking industry, the HKMA will provide further guidance on regulatory standards in relation to the sale of investment, insurance and MPF products.  This will cover, among other things, investment services related to virtual assets and the selling of Protection Linked Plans, a new subset of investment-linked assurance scheme products with high level of insurance protection.  The HKMA, the Insurance Authority and the Mandatory Provident Fund Schemes Authority will jointly launch a mystery shopping programme on the selling practices of intermediaries in respect of Qualifying Deferred Annuity Policies and Tax-deductible Voluntary Contributions.	在維持與其他監管機構及銀行業緊密聯繫的同時，香港金融管理局將就投資、保險及強積金產品出售相關的監管標準提供進一步指引。此指引將涵蓋在...之間的事項，包括與虛擬資產相關的投資服務，以及銷售保護掛鉤計劃，這是一種具有高水平保險保障的新類別投資掛鉤保險計劃產品。香港金融管理局、保險業監管局及強積金計劃管理局將聯同推出神秘購物計劃，以檢查中介機構在銷售合資格延遲年金保險計劃及可扣稅自願供款方面的銷售實踐。	['hkma', 'insurance authority', 'mpf', 'mandatory provident fund', 'mandatory provident fund schemes authority', 'protection linked plan', 'qualifying deferred annuity policies', 'tax - deductible voluntary contribution', 'banking industry', 'investment - link assurance scheme product', 'mystery shopping programme', 'provident fund', 'regulator', 'virtual asset']	{'hkma': '香港金融管理局', 'insurance authority': '保險業監管局', 'mpf': '強積金', 'mandatory provident fund': '強積金', 'mandatory provident fund schemes authority': '強積金計劃管理局', 'protection linked plan': '保護掛鉤計劃', 'qualifying deferred annuity policies': '延遲 金保險', 'tax - deductible voluntary contribution': '可扣稅自願供款', 'banking industry': '銀行業', 'investment - link assurance scheme product': '保護掛鉤計劃', 'mystery shopping programme': '神秘購物計劃', 'provident fund': '強積金', 'regulator': '監管機構', 'virtual asset': '虛擬資產'}	['香港金融管理局', '保險業監管局', '強積金', '強積金', '強積金計劃管理局', '保護掛鉤計劃', '延遲 金保險', '可扣稅自願供款', '銀行業', '保護掛鉤計劃', '神秘購物計劃', '強積金', '監管機構', '虛擬資產']
131	{'cross - boundary wmc': '跨境理財通', 'hkma': '金管局'}	Following the smooth launch of the Cross-boundary WMC, the HKMA will continue engaging the industry and relevant regulatory authorities to enhance the scheme.	以下，經跨境 WMC 暢順推出後，香港金管局將繼續參與業界及相關監管機構，以提升此計劃。	['cross - boundary wmc', 'hkma']	{'cross - boundary wmc': '跨境 WMC', 'hkma': '金管局'}	['跨境 WMC', '金管局']
132	{'ais': '認可機構', 'code of practice': '營運守則', 'hkma': '金管局', 'spm': '監管政策手冊', 'trust business': '信託業務'}	Moreover, the HKMA will embark on preparation work for supervising AIs’ trust business under a new SPM module and a new Code of Practice.	此外，香港金融管理局將展開準備工作，以監管人工智能的信託業務，並採用新的SPM模組及新的行為守則。	['ais', 'code of practice', 'hkma', 'spm', 'trust business']	{'ais': '人工智能', 'code of practice': '行為 守則', 'hkma': '香港金融管理局', 'spm': 'SPM', 'trust business': '信託業務'}	['人工智能', '行為 守則', '香港金融管理局', 'SPM', '信託業務']
133	{'financial market infrastructure': '金融市場基建', 'financial market': '金融市場'}	# Oversight of financial market infrastructures	# 金融市場基礎設施的監管	['financial market infrastructure', 'financial market']	{'financial market infrastructure': '金融 市場 設施', 'financial market': '金融市場'}	['金融 市場 設施', '金融市場']
134	{'cpmi': '支付及金融基建委員會', 'committee on payment and market infrastructures': '支付及金融基建委員會', 'fmi oversight framework': '金融市場基建的監察架構', 'fmis': '金融市場基建', 'hkma': '金管局', 'pfmi': '基建原則', 'pssvfo': '支付條例', 'principle for financial market infrastructures': '金融市場基建的原則', 'financial market infrastructure': '金融市場基建', 'financial market': '金融市場', 'payment system and stored value facility ordinance': '支付系統及儲值支付工具條例'}	The HKMA will continue to promote the safety and efficiency of the financial market infrastructures (FMIs) under its oversight, in accordance with the Payment Systems and Stored Value Facilities Ordinance (PSSVFO), the Principles for Financial Market Infrastructures (PFMI)1, and the various guidances issued by the Committee on Payments and Market Infrastructures (CPMI).  It will fine-tune the FMI oversight framework taking into account the latest technological and market developments.	香港金融管理局將繼續推動其監管下的金融市場基礎設施（FMIs）的安全性及效率，根據《支付系統及儲值設施條例》（PSSVFO）、金融市場基礎設施原則（PFMI）1，以及支付與市場基礎設施委員會（CPMI）發出的各種指引。它將會因應最新科技及市場發展，對金融市場基礎設施的監管框架作精細調整。	['cpmi', 'committee on payment and market infrastructures', 'fmi oversight framework', 'fmis', 'hkma', 'pfmi', 'pssvfo', 'principle for financial market infrastructures', 'financial market infrastructure', 'financial market', 'payment system and stored value facility ordinance']	{'cpmi': '▔', 'committee on payment and market infrastructures': '支付 委員會', 'fmi oversight framework': '市場 監管 框架', 'fmis': '▔', 'hkma': '香港金融管理局', 'pfmi': 'PFMI', 'pssvfo': 'PSSVFO', 'principle for financial market infrastructures': '金融市場基礎設施原則', 'financial market infrastructure': '金融', 'financial market': '金融市場', 'payment system and stored value facility ordinance': '支付系統及儲值設施條例'}	['▔', '支付 委員會', '市場 監管 框架', '▔', '香港金融管理局', 'PFMI', 'PSSVFO', '金融市場基礎設施原則', '金融', '金融市場', '支付系統及儲值設施條例']
135	{'cpmi': '支付及金融基建委員會', 'cpmi - iosco': '支付及金融基建委員會與國際證監會組織', 'fmis': '金融市場基建', 'hkma': '金管局', 'pfmi': '基建原則', 'international standard set body': '國際標準制定組織', 'international standard': '國際標準', 'iosco': '國際證監會組織'}	The HKMA will work with the FMIs on their observance of the PFMI, conducting and updating assessments as appropriate. In addition, the HKMA will continue to participate in the CPMI-IOSCO PFMI implementation monitoring and assessment exercise.  The HKMA will also participate in the work of international standard setting bodies and strengthen its oversight requirements in response to market and technology developments and in line with international practices.  The HKMA will work with relevant authorities to further strengthen co-operative oversight arrangements where appropriate.	金管局將與支付系統重要參與者合作，就其遵守《金融市場基礎設施原則》進行及更新評估，並在合適時作出調整。此外，金管局將繼續參與國際支付清算系統委員會-國際證監會組織《金融市場基礎設施原則》實施監察及評估試驗。金管局亦將參與國際標準制定機構的工作，並因應市場及科技發展，並在方針上符合國際慣例，加強其監察要求。金管局將與相關權威合作，在合適時進一步加強合作監察安排。	['cpmi', 'cpmi - iosco', 'fmis', 'hkma', 'pfmi', 'international standard set body', 'international standard', 'iosco']	{'cpmi': '▔', 'cpmi - iosco': '國際支付清算系統委員會-國際證監會組織', 'fmis': '▔', 'hkma': '金管局', 'pfmi': '設施', 'international standard set body': '國際標準制定機構', 'international standard': '國際標準', 'iosco': '國際證監會組織'}	['▔', '國際支付清算系統委員會-國際證監會組織', '▔', '金管局', '設施', '國際標準制定機構', '國際標準', '國際證監會組織']
136	{'hkma': '金管局', 'banking supervisory and regulatory frameworks': '銀行監管架構與政策', 'good practice': '最佳做法', 'international standard': '國際標準'}	The HKMA will continue to enhance and refine its banking supervisory and regulatory frameworks and policies, taking into account international standards and best practices.	香港金管局將繼續提升和完善其銀行監理及規管框架和政策，並採取國際標準和最佳實務。	['hkma', 'banking supervisory and regulatory frameworks', 'good practice', 'international standard']	{'hkma': '金管局', 'banking supervisory and regulatory frameworks': '銀行監理及規管框架', 'good practice': '最佳實務', 'international standard': '國際標準'}	['金管局', '銀行監理及規管框架', '最佳實務', '國際標準']
137	{'basel standard': '巴塞爾標準'}	# Implementation of Basel standards in Hong Kong	# 香港實施巴塞爾標準	['basel standard']	{'basel standard': '巴塞爾標準'}	['巴塞爾標準']
138	{'basel committee': '巴塞爾委員會', 'basel committee on banking supervision': '巴塞爾銀行監管委員會', 'hkma': '金管局'}	The HKMA will continue to enhance the capital framework with the implementation of the standards published by the Basel Committee on Banking Supervision (Basel Committee) in recent years, which include the following:	香港金融管理局將繼續提升資本架構，以落實近年由巴塞爾銀行監理委員會（巴塞爾委員會）發出的標準，其中包括以下內容：	['basel committee', 'basel committee on banking supervision', 'hkma']	{'basel committee': '▔', 'basel committee on banking supervision': '巴塞爾銀行監理委員會', 'hkma': '▔'}	['▔', '巴塞爾銀行監理委員會', '▔']
139	"{""capital requirement for banks 's equity investment in funds"": '銀行於基金的股權投資的資本要求', 'equity investment in funds': '於基金的股權投資', 'legislative council': '立法會'}"	The Capital Requirements for Banks’ Equity Investments in Funds of December 2013 (EIF standard), which will come into effect on 1 July 2022 with the Banking (Capital) (Amendment) Rules 2022 commencing operation after negative vetting by the Legislative Council.	銀行對基金股本投資的資本要求（2013年12月發布的EIF標準），將於2022年7月1日透過《銀行（資本）（修訂）規則》（2022年）生效，並經立法會負面審核後運作。	"[""capital requirement for banks 's equity investment in funds"", 'equity investment in funds', 'legislative council']"	"{""capital requirement for banks 's equity investment in funds"": '銀行對基金股本投資的資本要求', 'equity investment in funds': '股本 投資', 'legislative council': '立法會'}"	['銀行對基金股本投資的資本要求', '股本 投資', '立法會']
140	{'bcr': '銀行業（資本）規則', 'basel iii finalising post - crisis reforms': '巴塞爾協定三：危機後改革的最終方案', 'basel iii final reform package': '《巴塞爾協定三》最終改革方案', 'credit valuation adjustment risk framework': '信用估值調整風險架構', 'credit risk': '信用風險', 'market risk': '市場風險', 'minimum capital requirement for market risk': '市場風險最低資本規定', 'credit valuation adjustment risk': '信用估值調整風險', 'leverage ratio framework': '槓桿比率框架', 'operational risk': '業務操作風險', 'output floor requirement': '出項下限規定'}	The revised capital standards set out in the Basel III Finalising Post-crisis Reforms of December 2017, the Minimum Capital Requirements for Market Risk of January 2019 (revised in February 2019), and the Targeted Revisions to the Credit Valuation Adjustment Risk Framework of July 2020, which are collectively referred to as the “Basel III final reform package”.  These revised capital standards set out the revised capital treatment of credit risk, market risk, credit valuation adjustment (CVA) risk and operational risk, introduce an output floor requirement, and enhance the leverage ratio framework.  Amendments to the Banking (Capital) Rules (BCR) are being prepared in consultation with the industry with a view to them taking effect from 1 July 2023 as minimum requirements (except for those on market risk and CVA risk2).	經鑑於 2017 年 12 月的巴塞爾 III 後危機改革的修訂資本標準、2019 年 1 月的市場風險最低資本要求（2019 年 2 月修訂），以及 2020 年 7 月的專項信用評值調整風險框架修訂(條文)，這些統稱為「巴塞爾 III 最終改革方案」。 這些修訂的資本標準闡述了對信用風險、市場風險、信用評值調整 (CVA) 風險和操作風險的修訂處理，引入了產出下限要求，並提升了槓桿率框架。 為了使這些規定於 2023年7月1日生效作為最低要求（除了市場風險和 CVA 風險2 方面的規定外），正在與業界進行諮詢以準備對銀行（資本）規則 (BCR) 的修訂(條文)。	['bcr', 'basel iii finalising post - crisis reforms', 'basel iii final reform package', 'credit valuation adjustment risk framework', 'credit risk', 'market risk', 'minimum capital requirement for market risk', 'credit valuation adjustment risk', 'leverage ratio framework', 'operational risk', 'output floor requirement']	{'bcr': 'BCR', 'basel iii finalising post - crisis reforms': '巴塞爾 III 最終改革方案', 'basel iii final reform package': '巴塞爾 III 最終改革方案', 'credit valuation adjustment risk framework': '信用評值調整風險框架', 'credit risk': '信用風險', 'market risk': '市場風險', 'minimum capital requirement for market risk': '市場風險最低資本要求', 'credit valuation adjustment risk': '信用評值調整風險', 'leverage ratio framework': '槓桿率框架', 'operational risk': '操作風險', 'output floor requirement': '產出下限要求'}	['BCR', '巴塞爾 III 最終改革方案', '巴塞爾 III 最終改革方案', '信用評值調整風險框架', '信用風險', '市場風險', '市場風險最低資本要求', '信用評值調整風險', '槓桿率框架', '操作風險', '產出下限要求']
141	{'bcr': '銀行業（資本）規則', 'basel committee': '巴塞爾委員會', 'exposure limit': '風險承擔限度', 'hkma': '金管局', 'large exposure framework': '大額風險承擔框架', 'sovereign concentration risk': '官方實體集中風險'}	Given that the capital treatment for sovereign concentration risk under the BCR was designed to complement the Basel Committee’s large exposure framework as implemented by the Banking (Exposure Limits) Rules, the HKMA will propose amendments to the capital rules in parallel with relevant changes to the Banking (Exposure Limits) Rules.	鑑於資本處理方案旨在補充巴塞爾委員會大型風險框架，而該框架已根據《銀行（風險限額）規則》實施，金管局將提出修訂(條文)，並與《銀行（風險限額）規則》的相關變動同時進行。	['bcr', 'basel committee', 'exposure limit', 'hkma', 'large exposure framework', 'sovereign concentration risk']	{'bcr': '▔', 'basel committee': '巴塞爾委員會', 'exposure limit': '風險限額', 'hkma': '金管局', 'large exposure framework': '大型風險框架', 'sovereign concentration risk': '▔'}	['▔', '巴塞爾委員會', '風險限額', '金管局', '大型風險框架', '▔']
142	{'exposure limit': '風險承擔限度'}	# Exposure limits	# 暴露限值	['exposure limit']	{'exposure limit': '暴露限值'}	['暴露限值']
143	{'basel iii final reform package': '《巴塞爾協定三》最終改革方案', 'department of justice': '律政司', 'exposure limit': '風險承擔限度', 'hkma': '金管局'}	The HKMA will continue its work on the proposed amendments to the Banking (Exposure Limits) Rules in consultation with the industry and the Department of Justice with a target implementation date aligned with the one for the Basel III final reform package, i.e. 1 July 2023.	金管局將繼續就《銀行（風險限額）規則》的建議修訂(條文)進行諮詢，並與業界及司法署合作，目標實施日期將符合巴塞爾三項最終改革方案的日期，即2023年7月1日。	['basel iii final reform package', 'department of justice', 'exposure limit', 'hkma']	{'basel iii final reform package': '巴塞爾三項最終改革方案', 'department of justice': '司法 署', 'exposure limit': '風險限額', 'hkma': '金管局'}	['巴塞爾三項最終改革方案', '司法 署', '風險限額', '金管局']
144	{'disclosure standard': '披露標準'}	# Disclosure standards	# 披露標準	['disclosure standard']	{'disclosure standard': '披露標準'}	['披露標準']
