	terms	src_raw	mt_raw	src_terms	alg_terms	norm_tgt_terms
226	{'efac': '外匯基金諮詢委員會', 'exchange fund': '外匯基金', 'financial secretary': '財政司司長', 'hkma': '金管局', 'investment objective': '投資目標', 'the exchange fund': '外匯基金', 'delegated authority': '授權', 'investment benchmark': '投資基準', 'investment process': '投資程序', 'portfolio manager': '投資組合經理', 'strategic asset allocation': '策略性資產分布', 'tactical asset allocation': '戰略性資產分布', 'tracking error': '循跡誤差', 'tracking error limit': '循跡誤差限額'}	The investment process of the Exchange Fund is underpinned by decisions on two types of asset allocation: the strategic asset allocation and the tactical asset allocation. The strategic asset allocation, reflected in the investment benchmark, represents the long-term optimal asset allocation given the investment objectives of the Exchange Fund. Guided by the strategic allocation, assets are tactically allocated in an attempt to achieve an excess return over the benchmark. This means the actual allocation is often different from the benchmark, or strategic allocation. The differences between the actual and benchmark allocations are known as “tactical deviations”. While the benchmark and tracking error limit are determined by the Financial Secretary in consultation with EFAC, tactical decisions and allowable ranges for tactical deviations are made and set by the HKMA under delegated authority. Within the ranges allowed for tactical deviations, portfolio managers may take positions to take advantage of short-term market movements.	外匯基金的投資程序以兩種資產配置的決策為基礎：策略性資產分布和戰略性資產分布。策略性資產分布反映在投資基準中，代表根據外匯基金的投資目標所設定的長期最佳資產分布。在策略性配置的指導下，資產會戰略性地配置，以試圖在基準之上取得超額回報。這意味著實際的配置通常與基準或策略性配置有所不同。實際配置與基準配置之間的差異稱為「戰略性偏離」。雖然基準和循跡誤差限額是由財政司司長與外匯基金諮詢委員會磋商後決定，但戰略性決策和戰略性偏離的允許範圍則是由金管局根據授權來制定。在戰略性偏離允許的範圍內，投資組合經理可以根據短期市場走勢進行投資操作。	['efac', 'exchange fund', 'financial secretary', 'hkma', 'investment objective', 'the exchange fund', 'delegated authority', 'investment benchmark', 'investment process', 'portfolio manager', 'strategic asset allocation', 'tactical asset allocation', 'tracking error', 'tracking error limit']	{'efac': '外匯基金諮詢委員會', 'exchange fund': '外匯基金', 'financial secretary': '財政司司長', 'hkma': '金管局', 'investment objective': '投資目標', 'the exchange fund': '外匯基金', 'delegated authority': '授權', 'investment benchmark': '投資基準', 'investment process': '投資程序', 'portfolio manager': '投資組合經理', 'strategic asset allocation': '策略性資產分布', 'tactical asset allocation': '戰略性資產分布', 'tracking error': '循跡誤差', 'tracking error limit': '循跡誤差限額'}	['外匯基金諮詢委員會', '外匯基金', '財政司司長', '金管局', '投資目標', '外匯基金', '授權', '投資基準', '投資程序', '投資組合經理', '策略性資產分布', '戰略性資產分布', '循跡誤差', '循跡誤差限額']
227	{'bp': '支持組合', 'exchange fund': '外匯基金', 'hkma': '金管局', 'ip': '投資組合', 'reserve management': '儲備管理', 'reserve management department': '儲備管理部', 'the exchange fund': '外匯基金', 'derivative overlay portfolios': '衍生工具', 'fix - income market': '定息市場', 'macro risk management strategy': '宏觀風險管理策略'}	HKMA staff in the Reserves Management Department directly manage about 73% of the investments of the Exchange Fund, which includes the entire BP and part of the IP. This part of the IP includes a set of portfolios invested in global fixed-income markets and various derivative overlay portfolios implementing macro risk management strategies for the Fund.	金管局儲備管理部直接管理外匯基金約73%的投資，其中包括整個支持組合及部分投資組合。該部分投資組合包括投資於全球定息市場的一系列投資組合，以及實施宏觀風險管理策略的衍生工具組合。	['bp', 'exchange fund', 'hkma', 'ip', 'reserve management', 'reserve management department', 'the exchange fund', 'derivative overlay portfolios', 'fix - income market', 'macro risk management strategy']	{'bp': '支持組合', 'exchange fund': '外匯基金', 'hkma': '金管局', 'ip': '投資組合', 'reserve management': '儲備管理', 'reserve management department': '儲備管理部', 'the exchange fund': '外匯基金', 'derivative overlay portfolios': '衍生 組合', 'fix - income market': '定息市場', 'macro risk management strategy': '宏觀風險管理策略'}	['支持組合', '外匯基金', '金管局', '投資組合', '儲備管理', '儲備管理部', '外匯基金', '衍生 組合', '定息市場', '宏觀風險管理策略']
228	{'external manager': '外聘投資經理'}	# Use of external managers	# 使用外聘投資經理	['external manager']	{'external manager': '外聘投資經理'}	['外聘投資經理']
229	{'exchange fund': '外匯基金', 'hkma': '金管局', 'the exchange fund': '外匯基金', 'asset class': '資產類別', 'external fund manager': '外聘基金經理', 'external manager': '外聘投資經理', 'investment expertise': '專業投資技術', 'list equity portfolios': '上市股票組合', 'specialised asset class': '特別資產'}	In addition to managing assets internally, the HKMA employs external fund managers to manage about 27% of the Exchange Fund’s assets, including all of its listed equity portfolios and other specialised asset classes. The purpose of engaging external managers is to tap the best investment expertise available in the market to capture sustainable returns, to benefit from diverse and complementary investment styles and to share market insights and technical expertise with the Exchange Fund.	除內部管理資產外，金管局聘用外聘基金經理管理約27%的外匯基金資產，包括其所有上市股票組合及其他特別資產。聘用外聘投資經理的目的是善用市場上最佳的專業投資技術，以獲取可持續的回報，並從多元且互補的投資風格中受益，同時與外匯基金分享市場洞察及技術專業知識。	['exchange fund', 'hkma', 'the exchange fund', 'asset class', 'external fund manager', 'external manager', 'investment expertise', 'list equity portfolios', 'specialised asset class']	{'exchange fund': '外匯基金', 'hkma': '金管局', 'the exchange fund': '外匯基金', 'asset class': '特別資產', 'external fund manager': '外聘基金經理', 'external manager': '外聘基金經理', 'investment expertise': '專業投資技術', 'list equity portfolios': '上市股票組合', 'specialised asset class': '特別資產'}	['外匯基金', '金管局', '外匯基金', '特別資產', '外聘基金經理', '外聘基金經理', '專業投資技術', '上市股票組合', '特別資產']
230	{'custodian fee': '託管費', 'external manager': '外聘投資經理', 'transaction cost': '交易費'}	Expenditure relating to the use of external managers includes fund management and custodian fees, transaction costs, and withholding and other taxes. The expenditure is primarily determined by market factors and may fluctuate from year to year.	與外聘投資經理相關的支出包括基金管理和託管費、交易費，以及預扣和其他稅款。這些支出主要由市場因素決定，並可能逐年波動。	['custodian fee', 'external manager', 'transaction cost']	{'custodian fee': '託管費', 'external manager': '外聘投資經理', 'transaction cost': '交易費'}	['託管費', '外聘投資經理', '交易費']
231	{'2008/09 global financial crisis': '2008至2009年全球金融危機', 'exchange fund': '外匯基金', 'hkma': '金管局', 'the exchange fund': '外匯基金', 'external manager': '外聘投資經理', 'financial crisis': '金融危機', 'global financial crisis': '環球金融危機', 'investment diversification': '多元化投資', 'investment guideline': '投資指引', 'market risk': '市場風險', 'performance attribution analysis': '投資表現因素分析', 'risk assessment': '風險評估', 'risk - control tool': '風險管控工具'}	The high volatility of the financial markets subsequent to the 2008/09 global financial crisis has highlighted the importance of risk management. Stringent controls and investment guidelines have been established for both internally and externally managed portfolios, and compliance with guidelines and regulations is closely monitored. Risk assessment has been strengthened to support the Exchange Fund’s increased pace of investment diversification. Risk-control tools are deployed to assess market risks under both normal and adverse market conditions. Detailed performance attribution analyses are also conducted to identify sources of performance, allowing the HKMA to make the best use of the investment skills of internal and external managers.	2008至2009年全球金融危機後金融市場的高波動性凸顯了風險管理的重要性。已為內部及外聘投資經理管理的投資組合制定嚴格的控制措施和投資指引，並嚴格監督對指引和法規的遵循情況。為支持外匯基金加快多元化投資的步伐，已加強風險評估。風險管控工具亦用於在正常及不利市場情況下評估市場風險。同時亦進行詳細的投資表現因素分析，以識別表現來源，使金管局能充分發揮內外聘投資經理的投資技能。	['2008/09 global financial crisis', 'exchange fund', 'hkma', 'the exchange fund', 'external manager', 'financial crisis', 'global financial crisis', 'investment diversification', 'investment guideline', 'market risk', 'performance attribution analysis', 'risk assessment', 'risk - control tool']	{'2008/09 global financial crisis': '2008至2009年全球金融危機', 'exchange fund': '外匯基金', 'hkma': '金管局', 'the exchange fund': '外匯基金', 'external manager': '外聘投資經理', 'financial crisis': '金融危機', 'global financial crisis': '全球金融危機', 'investment diversification': '多元化投資', 'investment guideline': '投資指引', 'market risk': '市場風險', 'performance attribution analysis': '投資表現因素分析', 'risk assessment': '風險評估', 'risk - control tool': '風險管控工具'}	['2008至2009年全球金融危機', '外匯基金', '金管局', '外匯基金', '外聘投資經理', '金融危機', '全球金融危機', '多元化投資', '投資指引', '市場風險', '投資表現因素分析', '風險評估', '風險管控工具']
232	{'responsible investment': '負責任投資'}	# Responsible investment	# 負責任投資	['responsible investment']	{'responsible investment': '負責任投資'}	['負責任投資']
233	{'esg standard': '這些因素的相關標準', 'exchange fund': '外匯基金', 'hkma': '金管局', 'hong kong - list company': '香港上市公司', 'management of the exchange fund': '外匯基金的管理', 'principle of responsible ownership': '《負責任的擁有權原則》', 'responsible investment': '負責任投資', 'risk management and compliance division': '風險管理及監察處', 'security and futures commission': '證券及期貨事務監察委員會', 'the exchange fund': '外匯基金', 'equity portfolio': '股票組合', 'external fund manager': '外聘基金經理', 'front office': '前線投資部門', 'investment process': '投資程序'}	The HKMA is supportive of responsible investment. For instance, the HKMA supports the Principles of Responsible Ownership issued by the Securities and Futures Commission on 7 March 2016, which are voluntary and help investors determine how best to meet their ownership responsibilities in relation to their investments in Hong Kong-listed companies. For the management of the Exchange Fund, the HKMA has encouraged the appointed external fund managers for its Hong Kong equity portfolio to adopt the Principles of Responsible Ownership in managing the investments. Furthermore, the front offices and the Risk Management and Compliance Division have incorporated environmental, social and governance (ESG) factors into various internal procedures for making and monitoring investment activities. The HKMA will closely monitor the development of ESG standards and assess how these standards can be further integrated into the investment process.	金管局支持負責任投資。例如，金管局支持證券及期貨事務監察委員會於2016年3月7日發佈的《負責任的擁有權原則》，這些原則屬自願性，並協助投資者確定在對香港上市公司進行投資時，如何最好地履行其擁有權責任。在外匯基金的管理方面，金管局已鼓勵其委任的外聘基金經理在管理其香港股票組合時採用《負責任的擁有權原則》。此外，前線投資部門和風險管理及監察處已將環境、社會及管治因素納入各項內部程序，以制定和監控投資活動。金管局將密切監察這些因素的相關標準的發展，並評估如何將這些標準進一步融入投資程序。	['esg standard', 'exchange fund', 'hkma', 'hong kong - list company', 'management of the exchange fund', 'principle of responsible ownership', 'responsible investment', 'risk management and compliance division', 'security and futures commission', 'the exchange fund', 'equity portfolio', 'external fund manager', 'front office', 'investment process']	{'esg standard': '▔', 'exchange fund': '外匯基金', 'hkma': '金管局', 'hong kong - list company': '香港上市公司', 'management of the exchange fund': '外匯基金的管理', 'principle of responsible ownership': '負責任的擁有權原則', 'responsible investment': '負責任投資', 'risk management and compliance division': '風險管理及監察處', 'security and futures commission': '證券及期貨事務監察委員會', 'the exchange fund': '外匯基金', 'equity portfolio': '股票組合', 'external fund manager': '外聘基金經理', 'front office': '前線投資部門', 'investment process': '投資程序'}	['▔', '外匯基金', '金管局', '香港上市公司', '外匯基金的管理', '負責任的擁有權原則', '負責任投資', '風險管理及監察處', '證券及期貨事務監察委員會', '外匯基金', '股票組合', '外聘基金經理', '前線投資部門', '投資程序']
234	{'exchange fund': '外匯基金', 'performance of the exchange fund': '外匯基金的表現', 'the exchange fund': '外匯基金'}	# PERFORMANCE OF THE EXCHANGE FUND	# 外匯基金的表現	['exchange fund', 'performance of the exchange fund', 'the exchange fund']	{'exchange fund': '外匯基金', 'performance of the exchange fund': '外匯基金的表現', 'the exchange fund': '外匯基金'}	['外匯基金', '外匯基金的表現', '外匯基金']
235	{'global equity market': '環球股市', 'monetary policy': '貨幣政策', 'corporate earnings': '企業盈利', 'emerge market economy': '新興經濟體', 'emerge market': '新興市場', 'major develop and emerge market economy': '主要先進及新興市場經濟體', 'synchronised economic growth': '同步經濟增長'}	The global economy and financial markets in 2017 performed better than expected. On the back of synchronised economic growth in major developed and emerging market economies, strong corporate earnings, and market expectation of slow and gradual tightening of monetary policies by major central banks, the global equity markets performed well. In particular, the Hong Kong equity market rose by 36%, outperforming other major equity markets.	2017年全球經濟和金融市場表現好過預期。在主要先進及新興市場經濟體實現同步經濟增長、企業盈利強勁，以及市場預期主要央行將逐步緩慢收緊貨幣政策等因素推動下，環球股市表現良好。其中，香港股市上漲36%，表現優於其他主要股市。	['global equity market', 'monetary policy', 'corporate earnings', 'emerge market economy', 'emerge market', 'major develop and emerge market economy', 'synchronised economic growth']	{'global equity market': '環球股市', 'monetary policy': '貨幣政策', 'corporate earnings': '企業盈利', 'emerge market economy': '新興 經濟體', 'emerge market': '新興市場', 'major develop and emerge market economy': '主要先進及新興市場經濟體', 'synchronised economic growth': '同步經濟增長'}	['環球股市', '貨幣政策', '企業盈利', '新興 經濟體', '新興市場', '主要先進及新興市場經濟體', '同步經濟增長']
236	{'10 - year us treasury yield': '美國十年期國庫債券收益率', 'balance sheet': '資產負債表', 'european central bank': '歐洲中央銀行', 'german bund': '德國政府債券', 'government bond': '政府債券', 'us treasury': '美國國庫券', 'short - date': '短期／短香港銀行同業拆息'}	In the bond markets, short-dated US Treasury yields shot up as the US Federal Reserve raised interest rates three times as expected, and began to reduce its balance sheet in October. Nevertheless, the 10-year US Treasury yield remained stable at about 2.4% over the year. Other major 10-Year government bond yields also ended the year little changed, with the exception of German Bunds which rose on the euro area’s solid economic growth and market expectation of the European Central Bank’s policy tightening.	在債券市場中，短期／短香港銀行同業拆息美國國庫券收益率隨著美國聯邦儲備銀行如預期般三次升息，並於十月開始縮減其資產負債表而大幅上漲。儘管如此，10年期美國國庫券收益率在一年內仍維持在約2.4%的水平。其他主要政府債券的10年期收益率也幾乎沒有變化，但德國政府債券因歐元區強勁的經濟增長以及市場預期歐洲中央銀行將收緊政策而上漲。	['10 - year us treasury yield', 'balance sheet', 'european central bank', 'german bund', 'government bond', 'us treasury', 'short - date']	{'10 - year us treasury yield': '10年期美國國庫券收益率', 'balance sheet': '資產負債表', 'european central bank': '歐洲中央銀行', 'german bund': '德國政府債券', 'government bond': '政府債券', 'us treasury': '美國國庫券', 'short - date': '短期'}	['10年期美國國庫券收益率', '資產負債表', '歐洲中央銀行', '德國政府債券', '政府債券', '美國國庫券', '短期']
237	{'balance sheet': '資產負債表', 'monetary policy': '貨幣政策', 'currency market': '貨幣市場', 'monetary policy divergence': '貨幣政策差距'}	In the currency markets, the US dollar weakened against other major currencies, despite the US Federal Reserve’s interest rate hikes and the beginning of its balance sheet reduction. The depreciation of the US dollar was a result of the reviving economic growth in Europe and Japan, and market expectation of diminishing monetary policy divergence between the US and other major economies. The euro and yen appreciated by around 14% and 4% respectively against the US dollar in 2017.	在貨幣市場中，儘管美國聯準會升息並開始縮減資產負債表，美元對其他主要貨幣仍走弱。美元貶值是歐洲和日本經濟復甦，以及市場預期美國與其他主要經濟體之間貨幣政策差距縮小的結果。2017年，歐元和日元對美元分別升值約14%和4%。	['balance sheet', 'monetary policy', 'currency market', 'monetary policy divergence']	{'balance sheet': '資產負債表', 'monetary policy': '貨幣政策', 'currency market': '貨幣市場', 'monetary policy divergence': '貨幣政策差距'}	['資產負債表', '貨幣政策', '貨幣市場', '貨幣政策差距']
238	{'exchange fund': '外匯基金', 'the exchange fund': '外匯基金'}	# The Exchange Fund’s performance	# 外匯基金的表現	['exchange fund', 'the exchange fund']	{'exchange fund': '外匯基金', 'the exchange fund': '外匯基金'}	['外匯基金', '外匯基金']
239	{'exchange fund': '外匯基金', 'strategic portfolio': '策略性資產組合', 'the exchange fund': '外匯基金', 'investment hold subsidiary': '投資控股附屬公司', 'valuation gain': '估值收益'}	The Exchange Fund recorded an investment income of HK$264 billion in 2017. This comprised gains of HK$80.4 billion on overseas equities, gains of HK$58.3 billion on Hong Kong equities, gains of HK$34.4 billion on bonds, a positive currency translation effect of HK$53.5 billion on non-Hong Kong dollar assets and gains of HK$37.4 billion on other investments held by the investment holding subsidiaries of the Exchange Fund. Separately, the Strategic Portfolio recorded a valuation gain of HK$4.5 billion.	外匯基金於2017年錄得2640億港元的投資收益。其中包括海外股票的804億港元收益、香港股票的583億港元收益、債券的344億港元收益、非港元資產的正貨幣匯率變動效益535億港元，以及由外匯基金投資控股附屬公司持有的其他投資的374億港元收益。另外，策略性資產組合錄得45億港元的估值收益。	['exchange fund', 'strategic portfolio', 'the exchange fund', 'investment hold subsidiary', 'valuation gain']	{'exchange fund': '外匯基金', 'strategic portfolio': '策略性資產組合', 'the exchange fund': '外匯基金', 'investment hold subsidiary': '投資控股附屬公司', 'valuation gain': '估值收益'}	['外匯基金', '策略性資產組合', '外匯基金', '投資控股附屬公司', '估值收益']
240	{'exchange fund': '外匯基金', 'the exchange fund': '外匯基金'}	The investment income of HK$264 billion last year is a record high for the Exchange Fund, surpassing the previous record in 2007 (HK$142.2 billion) by HK$121.8 billion.	去年達 HK$264 億的投資收益是外匯基金的歷史新高，超越了 2007 年 (HK$142.2 億) 的舊紀錄，高出 HK$121.8 億。	['exchange fund', 'the exchange fund']	{'exchange fund': '外匯基金', 'the exchange fund': '外匯基金'}	['外匯基金', '外匯基金']
241	{'exchange fund': '外匯基金', 'ltgp': '長期增長組合', 'the exchange fund': '外匯基金', 'investment under the ltgp': '長期增長組合的投資', 'market value': '市值', 'outstanding investment commitment': '已承擔但尚未提取作投資的總額', 'private equity': '私募股權', 'real estate': '房地產', 'total asset': '資產總值'}	The total assets of the Exchange Fund reached HK$4,015.3 billion at year end. The market value of investments under the LTGP totalled HK$235.6 billion, with private equity amounting to HK$157.2 billion and real estate at HK$78.4 billion. Outstanding investment commitments amounted to HK$162.4 billion.	外匯基金的資產總值在年末達到四千零一十五點三億港元。長期增長組合的投資市值總計二百三十五點六億港元，其中私募股權為一千五百七十二億港元，房地產為七十八點四億港元。已承擔但尚未提取作投資的總額為一千六百二十四億港元。	['exchange fund', 'ltgp', 'the exchange fund', 'investment under the ltgp', 'market value', 'outstanding investment commitment', 'private equity', 'real estate', 'total asset']	{'exchange fund': '外匯基金', 'ltgp': '長期增長組合', 'the exchange fund': '外匯基金', 'investment under the ltgp': '長期增長組合的投資', 'market value': '市值', 'outstanding investment commitment': '尚未提取作投資的總額', 'private equity': '私募股權', 'real estate': '房地產', 'total asset': '資產總值'}	['外匯基金', '長期增長組合', '外匯基金', '長期增長組合的投資', '市值', '尚未提取作投資的總額', '私募股權', '房地產', '資產總值']
242	{'bp': '支持組合', 'exchange fund': '外匯基金', 'ip': '投資組合', 'ltgp': '長期增長組合', 'strategic portfolio': '策略性資產組合', 'the exchange fund': '外匯基金', 'annualised internal rate of return': '內部回報率年率', 'inception': '開展投資以來', 'investment return': '投資回報率'}	The investment return of the Exchange Fund (excluding the Strategic Portfolio) in 2017 was 7.4%. Specifically, the IP achieved a rate of return of 12.1%, while the BP gained 1.8%. The LTGP recorded an annualised internal rate of return of 13.7% since its inception in 2009.	外匯基金（除外匯基金策略性資產組合外）於2017年的投資回報率為7.4%。具體而言，投資組合實現了12.1%的回報率，而支持組合則獲得了1.8%的回報。長期增長組合自2009年開展投資以來，其年率內部回報率為13.7%。	['bp', 'exchange fund', 'ip', 'ltgp', 'strategic portfolio', 'the exchange fund', 'annualised internal rate of return', 'inception', 'investment return']	{'bp': '支持組合', 'exchange fund': '外匯基金', 'ip': '投資組合', 'ltgp': '長期增長組合', 'strategic portfolio': '策略性資產組合', 'the exchange fund': '外匯基金', 'annualised internal rate of return': '年率內部回報率', 'inception': '開展投資', 'investment return': '投資回報率'}	['支持組合', '外匯基金', '投資組合', '長期增長組合', '策略性資產組合', '外匯基金', '年率內部回報率', '開展投資', '投資回報率']
