	terms	src_raw	mt_raw	src_terms	alg_terms	norm_tgt_terms
0	"{""chief executive 's statement"": '總裁報告'}"	# Chief Executive’s Statement	# 行政長官講話	"[""chief executive 's statement""]"	"{""chief executive 's statement"": '長 官 講話'}"	['長 官 講話']
1	{'covid - 19': '新冠病毒', 'operational resilience': '運作穩健性', 'financial stability': '金融穩定', 'geopolitical tension': '地緣政治緊張局勢', 'global financial condition': '全球金融狀況', 'global supply chain': '全球供應鏈', 'inflation pressure': '通脹壓力', 'mutant variant': '變異株', 'pandemic': '疫情', 'resilience': '抗震能力'}	In 2021, the pandemic entered its second year unabated: global supply chains were disrupted, inflation pressures were on the rise, risk of premature tightening of global financial conditions increased.  Adding to the unpredictability were the emergence of mutant variants of COVID-19 and the intensification of geopolitical tensions.  Despite such a macro environment filled with uncertainties, we continued to safeguard monetary and financial stability and maintain operational resilience.	2021年，疫情踏入第二年，情況未見緩和：全球供應鏈受干擾，通貨膨脹壓力上升，全球金融條件過早收緊的風險增加。加上新型冠狀病毒變異株的出現與地緣政治緊張局勢的升溫，不確定性進一步增加。儘管如此充滿不確定性的宏觀環境，我們仍持續保障貨幣與金融穩定，並維持營運韌性。	['covid - 19', 'operational resilience', 'financial stability', 'geopolitical tension', 'global financial condition', 'global supply chain', 'inflation pressure', 'mutant variant', 'pandemic', 'resilience']	{'covid - 19': '▔', 'operational resilience': '營運韌性', 'financial stability': '金融穩定', 'geopolitical tension': '地緣政治緊張局勢', 'global financial condition': '全球金融條件', 'global supply chain': '全球供應鏈', 'inflation pressure': '通貨膨脹壓力', 'mutant variant': '變異株', 'pandemic': '疫情', 'resilience': '營運韌性'}	['▔', '營運韌性', '金融穩定', '地緣政治緊張局勢', '全球金融條件', '全球供應鏈', '通貨膨脹壓力', '變異株', '疫情', '營運韌性']
2	"{'covid - 19': '新冠病毒', 'covid - 19 vaccine': '新冠疫苗', ""government 's pandemic relief measure"": '抗疫支援措施', 'hong kong economy': '香港經濟', 'monetary and fiscal policy': '貨幣及財政政策', 'pandemic': '疫情', 'relief measure': '紓困措施', 'vaccination programme': '疫苗接種計劃'}"	2021 also brought hope for recovery with the successful rollout of COVID-19 vaccines together with the accommodative monetary and fiscal policies introduced in multiple economies.  The global economy began to recover from the severe contraction in 2020.  Locally, after having endured economic contraction in 2019 and 2020, the Hong Kong economy grew by 6.3% in 2021, thanks to the rollout of the vaccination programme and the Government’s pandemic relief measures which have lent crucial support to our economic recovery.	2021年亦帶來了復甦的希望，這得益於 COVID-19 疫苗的成功推出，以及在多個經濟體推出的寬鬆貨幣和財政政策。全球經濟開始從 2020 年的嚴重收縮中恢復。本地方面，在經歷了 2019 年和 2020 年的經濟收縮後，香港經濟在 2021 年增長了 6.3%，受惠於疫苗接種計劃的推出以及政府的疫情援助措施，這些措施為我們的經濟復甦提供了至關重要的支持。	"['covid - 19', 'covid - 19 vaccine', ""government 's pandemic relief measure"", 'hong kong economy', 'monetary and fiscal policy', 'pandemic', 'relief measure', 'vaccination programme']"	"{'covid - 19': '19', 'covid - 19 vaccine': '19', ""government 's pandemic relief measure"": '疫情援助措施', 'hong kong economy': '香港經濟', 'monetary and fiscal policy': '貨幣和財政政策', 'pandemic': '疫情', 'relief measure': '疫情援助措施', 'vaccination programme': '疫苗接種計劃'}"	['19', '19', '疫情援助措施', '香港經濟', '貨幣和財政政策', '疫情', '疫情援助措施', '疫苗接種計劃']
3	"{'fintech': '金融科技', ""hong kong 's gateway role"": '香港作為通往內地的門戶', 'mainland': '內地', 'mainland market opportunity': '內地市場機遇', 'monetary stability': '貨幣穩定', 'financial and monetary stability': '金融及貨幣穩定', 'green finance': '綠色金融', 'strategic priority': '重點策略範疇'}"	With financial and monetary stability maintained, as well as a steadying macro environment, 2021 gave us some room to pursue more development work.  We seized the opportunity and pressed ahead with developmental initiatives that will help our financial sector remain highly competitive. Significant progress has been made across our three strategic priorities, namely fintech, green finance and Mainland market opportunities arising from Hong Kong’s gateway role.	在金融和貨幣穩定維持，以及宏觀環境穩定的情況下，2021年為我們提供了發展工作的空間。我們把握機會，積極推進發展的舉措，以協助我們的金融界維持高度的競爭力。在三大戰略重點領域，即金融科技、綠色金融以及香港作為橋樑所產生的內地市場機會方面，已作出顯著進展。	"['fintech', ""hong kong 's gateway role"", 'mainland', 'mainland market opportunity', 'monetary stability', 'financial and monetary stability', 'green finance', 'strategic priority']"	"{'fintech': '金融科技', ""hong kong 's gateway role"": '香港 樑 的', 'mainland': '內地', 'mainland market opportunity': '內地市場機會', 'monetary stability': '貨幣穩定', 'financial and monetary stability': '金融和貨幣穩定', 'green finance': '綠色金融', 'strategic priority': '戰略重點'}"	['金融科技', '香港 樑 的', '內地', '內地市場機會', '貨幣穩定', '金融和貨幣穩定', '綠色金融', '戰略重點']
4	{'international financial centre': '國際金融中心', 'financial system': '金融體系', 'monetary and financial system': '貨幣及金融體系'}	As we entered 2022, the global environment took a turn for the worse.  But as the saying goes, when the going gets tough, the tough get going.  We will continue to be proactive and pursue our developmental goals and priorities to be better prepared for the next challenge and to cement our status as an international financial centre.  We will also remain steadfast in our commitment to ensure the soundness of Hong Kong monetary and financial systems, as we have risen to the many challenges time and again as in the past.	踏入2022年，全球環境變得更加惡化。但有云，當處境艱難時，堅強的人會迎難而上。我們將繼續主動，追求發展的目標與優先事項，以更好地準備應對下一步的挑戰，並鞏固我們作為國際金融中心的地位。我們亦將堅定不移地確保香港貨幣與金融體系的穩健，正如我們在過去多次應對很多挑戰一樣。	['international financial centre', 'financial system', 'monetary and financial system']	{'international financial centre': '國際金融中心', 'financial system': '金融體系', 'monetary and financial system': '貨幣與金融體系'}	['國際金融中心', '金融體系', '貨幣與金融體系']
5	{'international financial centre': '國際金融中心', 'financial stability': '金融穩定'}	# Monetary and financial stability: foundation of an international financial centre	# 貨幣及金融穩定：國際金融中心之基礎	['international financial centre', 'financial stability']	{'international financial centre': '國際金融中心', 'financial stability': '金融穩定'}	['國際金融中心', '金融穩定']
6	"{'covid - 19': '新冠病毒', 'covid - 19 pandemic': '新冠病毒疫情', ""hong kong 's financial system"": '香港金融體系', 'lers': '聯匯制度', 'linked exchange rate system': '聯繫匯率制度', 'us monetary tightening': '美國收緊貨幣政策', 'exchange and money market': '外匯及貨幣市場', 'financial system': '金融體系', 'money market': '貨幣市場', 'pandemic': '疫情'}"	Since its establishment in 1983, the Linked Exchange Rate System (LERS) has been a strong anchor of Hong Kong’s financial system and has helped Hong Kong withstand numerous shocks and challenges.  Despite the lingering uncertainties surrounding the COVID-19 pandemic and market concerns about the pace of US monetary tightening, the Hong Kong dollar exchange and money markets continued to function in an orderly manner throughout the year, reflecting the robustness of the LERS.	自1983年設立以來，聯繫匯率制度（LERS）一直是香港金融體系的強大支柱，有助香港抵禦無數衝擊和挑戰。儘管新型冠狀病毒肺炎造成的持續不確定性以及市場對美國貨幣緊縮步伐的憂慮，香港美元匯率及貨幣市場全年繼續以有序方式運作，反映LERS的穩健性。	"['covid - 19', 'covid - 19 pandemic', ""hong kong 's financial system"", 'lers', 'linked exchange rate system', 'us monetary tightening', 'exchange and money market', 'financial system', 'money market', 'pandemic']"	"{'covid - 19': '冠狀', 'covid - 19 pandemic': '冠狀 肺炎', ""hong kong 's financial system"": '香港金融體系', 'lers': 'LERS', 'linked exchange rate system': '聯繫匯率制度', 'us monetary tightening': '美國貨幣緊縮', 'exchange and money market': '匯率及貨幣市場', 'financial system': '金融體系', 'money market': '貨幣市場', 'pandemic': '肺炎'}"	['冠狀', '冠狀 肺炎', '香港金融體系', 'LERS', '聯繫匯率制度', '美國貨幣緊縮', '匯率及貨幣市場', '金融體系', '貨幣市場', '肺炎']
7	{'external sector report': '對外部門報告', 'international monetary fund': '國際貨幣基金組織', 'lers': '聯匯制度', 'fiscal and foreign reserve': '財政及外匯儲備', 'fiscal framework': '財政制度', 'prudent fiscal framework': '審慎的財政架構'}	This confidence in our systems did not happen overnight, but is based on the solid foundation which has been built up over the years.  In its 2021 External Sector Report, the International Monetary Fund once again reiterated that the credibility of the LERS has been assured by a transparent set of rules, ample fiscal and foreign reserves, strong financial regulation and supervision, a flexible economy, and a prudent fiscal framework.	我們對體系的信心並非一朝一夕就能建立起來，而是以多年來穩健的基礎為基礎。國際貨幣基金組織在其2021年外匯部門報告中再次重申，LERS的可信度已透過透明的規則體系、充裕的財政和外匯儲備、強化的金融監管、靈活的經濟以及謹慎的財政框架得到保障。	['external sector report', 'international monetary fund', 'lers', 'fiscal and foreign reserve', 'fiscal framework', 'prudent fiscal framework']	{'external sector report': '外匯部門報告', 'international monetary fund': '國際貨幣基金組織', 'lers': 'LERS', 'fiscal and foreign reserve': '外匯 儲備', 'fiscal framework': '財政框架', 'prudent fiscal framework': '謹慎 財政 框架'}	['外匯部門報告', '國際貨幣基金組織', 'LERS', '外匯 儲備', '財政框架', '謹慎 財政 框架']
8	{'comprehensive analysis': '全面的監察及分析', 'datum analytics': '數據分析', 'financial stability': '金融穩定', 'macroprudential surveillance': '宏觀審慎監察', 'public and market engagement': '公眾及市場溝通', 'surveillance': '監察', 'technology and datum analytics': '科技及數據分析技術'}	The confidence is also a result of our efforts in public and market engagement, as well as effective surveillance.  On the latter, we have leveraged technology and data analytics to strengthen our capability for more timely and comprehensive analysis on financial stability and macroprudential surveillance.	信心亦來自我們在公眾及市場溝通方面的努力，以及有效的監測。在後者方面，我們借助科技與數據分析，加強了我們對金融穩定及宏觀審慎監測進行更及時且全面分析的能力。	['comprehensive analysis', 'datum analytics', 'financial stability', 'macroprudential surveillance', 'public and market engagement', 'surveillance', 'technology and datum analytics']	{'comprehensive analysis': '全面分析', 'datum analytics': '數據分析', 'financial stability': '金融穩定', 'macroprudential surveillance': '宏觀審慎監測', 'public and market engagement': '公眾及市場溝通', 'surveillance': '監測', 'technology and datum analytics': '科技與數據分析'}	['全面分析', '數據分析', '金融穩定', '宏觀審慎監測', '公眾及市場溝通', '監測', '科技與數據分析']
9	{'asset quality': '資產質素', 'covid - 19': '新冠病毒', 'covid - 19 pandemic': '新冠病毒疫情', 'capital adequacy': '資本充足水平', 'liquidity coverage ratio': '流動性覆蓋比率', 'banking system': '銀行體系', 'capital adequacy ratio': '資本充足比率', 'classify loan ratio': '特定分類貸款比率', 'credit landscape': '信貸環境', 'financial stability': '金融穩定', 'international standard': '國際標準', 'liquidity position': '流動性水平', 'long - run historical average': '長期平均水平', 'pandemic': '疫情', 'statutory minimum requirement': '法定最低要求'}	The robustness of the banking system is of paramount importance to financial stability in Hong Kong.  Two years into the COVID-19 pandemic, our banks remained resilient with liquidity positions and capitalisation faring very well by international standards.  As at end-2021, the capital adequacy ratio of local banks stood at 20.2%, well above the minimum requirement of 8%, while the average Liquidity Coverage Ratio of large banks was 151.9% in the fourth quarter of 2021, also well above the statutory minimum requirement of 100%.  Despite a challenging credit landscape amid the pandemic, the asset quality of the banking sector remained largely stable during the year. The classified loan ratio of the industry was 0.88% at the end of 2021, down from 0.90% at the end of 2020, well below the long-run historical average of 1.8% since 2000.	銀行體系的穩健性對香港的金融穩定至關重要。在新型冠狀病毒疫情爆發後的兩年間，本港銀行仍然具備足夠的流動性及資本充足率，表現良好，符合國際標準。截至2021年底，本地銀行的資本充足率高達20.2%，遠高於最低要求的8%；而大型銀行在2021年第四季度的平均流動性覆蓋比率為151.9%，亦遠高於法定最低要求的100%。儘管疫情期間信貸環境充滿挑戰，銀行業的資產質量在當年大致保持穩定。行業的分類貸款比率在2021年底為0.88%，較2020年底的0.90%下降，遠低於自2000年以來的長期歷史平均值1.8%。	['asset quality', 'covid - 19', 'covid - 19 pandemic', 'capital adequacy', 'liquidity coverage ratio', 'banking system', 'capital adequacy ratio', 'classify loan ratio', 'credit landscape', 'financial stability', 'international standard', 'liquidity position', 'long - run historical average', 'pandemic', 'statutory minimum requirement']	{'asset quality': '資產質量', 'covid - 19': '冠狀', 'covid - 19 pandemic': '冠狀 疫情', 'capital adequacy': '資本充足率', 'liquidity coverage ratio': '流動性覆蓋比率', 'banking system': '銀行體系', 'capital adequacy ratio': '資本充足率', 'classify loan ratio': '分類貸款比率', 'credit landscape': '信貸環境', 'financial stability': '金融穩定', 'international standard': '國際標準', 'liquidity position': '流動性', 'long - run historical average': '期 歷史 平均值', 'pandemic': '疫情', 'statutory minimum requirement': '法定最低要求'}	['資產質量', '冠狀', '冠狀 疫情', '資本充足率', '流動性覆蓋比率', '銀行體系', '資本充足率', '分類貸款比率', '信貸環境', '金融穩定', '國際標準', '流動性', '期 歷史 平均值', '疫情', '法定最低要求']
10	{'pillar of support': '經濟支柱'}	# Banking sector: a pillar of support to the economy	# 銀行業：經濟的重要支柱	['pillar of support']	{'pillar of support': '重要支柱'}	['重要支柱']
11	{'covid - 19': '新冠病毒', 'credit risk': '信用風險', 'hkma': '金管局', 'ppphs': '預先批核還息不還本計劃', 'corporate customer': '企業客戶', 'economic sector': '行業', 'individual borrower': '個人客戶', 'loan principal payment': '貸款本金', 'pandemic': '疫情', 'pillar of support': '經濟支柱', 'real economy': '實體經濟', 'relief measure': '紓困措施', 'supervisory work': '監管工作'}	As always, the banking sector is an important pillar of support to economic activity.  This is ever more crucial in the face of economic fallout from the COVID-19 outbreak.  In the past year, a main challenge was to strike a balance between managing credit risk in the banking sector and maintaining the sector’s support for the real economy.  With our supervisory work over the years, banks continued to manage credit risks effectively.  At the same time, we worked closely with banks to provide the much needed relief to corporate and personal customers through the Pre-approved Principal Payment Holiday Scheme (PPPHS) and other relief measures.  The PPPHS, launched together with the Banking Sector Small and Medium-sized Enterprise (SME) Lending Coordination Mechanism in 2020 allowing eligible corporate customers to defer loan principal payments by six months on a pre-approval basis, was again further extended twice during 2021 until April 2022 recognising that some economic sectors were still hard-pressed by the lingering pandemic and were in need of continued credit relief.  Subsequently, in light of a resurgence of local coronavirus infections, in February 2022, the PPPHS was further extended until the end of October 2022.  It is encouraging to see that the banking sector has joined forces with the HKMA to help relieve cash-flow pressures on corporate and individual borrowers, even whilst the sector itself is experiencing its own difficult operating conditions due to the outbreak of the pandemic.	一如既往，銀行業是支持經濟活動的重要支柱。鑑於新冠肺炎爆發所帶來的經濟後果，這更是至關重要。過去一年，主要挑戰是於管理銀行業的信貸風險與維持該行業對實體經濟的支持之間取得平衡。憑藉多年來的監管工作，銀行持續有效管理信貸風險。與此同時，我們與銀行緊密合作，透過預批本金償還寬限計劃（PPPHS）及其他寬限措施，向企業及個人客戶提供所需的支持。PPPHS於2020年與銀行業中小企業貸款協調機制一同推出，讓合資格的企業客戶可在批核的前提下延後貸款本金償還6個月，並於2021年兩度延長至2022年4月，鑑於部分經濟領域仍經營環境艱難，需要持續的信貸寬限。其後，鑑於本地冠狀病毒感染反彈，於2022年2月，PPPHS進一步延長至2022年10月底。令人鼓勵的是，銀行業已攜手香港金融管理局協助減輕企業及個人借款人的資金周轉壓力，即使該行業本身正因疫情爆發而面臨自身的艱難營運狀況。	['covid - 19', 'credit risk', 'hkma', 'ppphs', 'corporate customer', 'economic sector', 'individual borrower', 'loan principal payment', 'pandemic', 'pillar of support', 'real economy', 'relief measure', 'supervisory work']	{'covid - 19': '新冠肺炎', 'credit risk': '信貸風險', 'hkma': '香港金融管理局', 'ppphs': '預批本金償還寬限計劃', 'corporate customer': '企業客戶', 'economic sector': '▔', 'individual borrower': '個人借款人', 'loan principal payment': '本金償還', 'pandemic': '疫情', 'pillar of support': '支柱', 'real economy': '實體經濟', 'relief measure': '寬限措施', 'supervisory work': '監管工作'}	['新冠肺炎', '信貸風險', '香港金融管理局', '預批本金償還寬限計劃', '企業客戶', '▔', '個人借款人', '本金償還', '疫情', '支柱', '實體經濟', '寬限措施', '監管工作']
12	{'consumer protection': '消費者保障', 'step': 'STEPS', 'consumer and investor protection': '消費者及投資者保障', 'credit landscape': '信貸環境', 'cyber resilience': '網絡防衛能力', 'cyber threat': '網絡威脅', 'digital financial service': '數碼金融服務', 'digital landscape': '數碼環境', 'digitalisation': '數碼化', 'financial service': '金融服務', 'investor protection': '投資者的保障', 'operate environment': '經營環境', 'operational and cyber resilience': '運作穩健性及網絡防衛能力', 'pandemic': '疫情', 'phishing scam': '網絡釣魚騙案', 'resilience': '抗震能力'}	Apart from the challenging credit landscape, the pandemic also brought about a more difficult operating environment and a digital landscape with escalating cyber threat. We have stepped up our efforts to enhance operational and cyber resilience of the banking sector, as well as consumer and investor protection amid increasing digitalisation and a surge in phishing scams.  In particular, the Code of Banking Practice was revised to enhance consumer protection in digital financial services.	除了充滿挑戰的信貸環境，疫情亦帶來更困難的營運環境，以及持續增加的網路威脅所構成的數位環境。我們已加強提升銀行業營運及網路韌性，隨着數位化增加和釣魚詐騙急升，亦提升消費者及投資者保障。特別是，銀行業做法守則已修訂，以提升數位金融服務中的消費者保護。	['consumer protection', 'step', 'consumer and investor protection', 'credit landscape', 'cyber resilience', 'cyber threat', 'digital financial service', 'digital landscape', 'digitalisation', 'financial service', 'investor protection', 'operate environment', 'operational and cyber resilience', 'pandemic', 'phishing scam', 'resilience']	{'consumer protection': '▔', 'step': '加強', 'consumer and investor protection': '消費者及投資者保障', 'credit landscape': '信貸環境', 'cyber resilience': '網路韌性', 'cyber threat': '網路威脅', 'digital financial service': '數位金融服務', 'digital landscape': '數位環境', 'digitalisation': '數位化', 'financial service': '金融', 'investor protection': '投資者保障', 'operate environment': '營運環境', 'operational and cyber resilience': '營運及網路韌性', 'pandemic': '疫情', 'phishing scam': '釣魚詐騙', 'resilience': '韌性'}	['▔', '加強', '消費者及投資者保障', '信貸環境', '網路韌性', '網路威脅', '數位金融服務', '數位環境', '數位化', '金融', '投資者保障', '營運環境', '營運及網路韌性', '疫情', '釣魚詐騙', '韌性']
13	{'hkma': '金管局', 'banking industry': '銀行業', 'banking service for person with intellectual disability': '為智障人士提供銀行服務', 'barrier - free banking service': '無障礙銀行服務', 'good practice': '最佳做法', 'customer - centric culture': '以客為本的文化', 'financial inclusion': '普及金融', 'industry guideline': '行業指引', 'person with dementia': '認知障礙症患者', 'supervisory work': '監管工作'}	Besides supervisory work, we are dedicated to promoting financial inclusion and customer-centric culture in the banking sector.  Enhancing accessibility to banking services by customers in need has been one of our priority areas and we have been working closely with the industry to develop industry guidelines.  Further to the guidance on barrier-free banking services and provision of banking services for persons with intellectual disabilities, the industry, with the support of the HKMA, published in December 2021 a guideline to set out the principles and good practices for the banking industry in providing banking services to persons with dementia and customers in need.	此外，我們致力於推動銀行業的金融普及和以客戶為中心的文化。增強客戶方便使用銀行服務，特別是那些有需要的人，一直是我們的工作重點之一，並且我們一直與業界緊密合作以制訂行業指引。除了關於無障礙銀行服務和為智力障礙人士提供銀行服務的指引外，業界在香港金融管理局的支持下，於12月2021年發出了一份指引，以建立有關銀行業為患有認知障礙症人士和有需要的客戶提供銀行服務的原則和良好做法。	['hkma', 'banking industry', 'banking service for person with intellectual disability', 'barrier - free banking service', 'good practice', 'customer - centric culture', 'financial inclusion', 'industry guideline', 'person with dementia', 'supervisory work']	{'hkma': '香港金融管理局', 'banking industry': '銀行業', 'banking service for person with intellectual disability': '為 智力 人士 銀行 服務', 'barrier - free banking service': '無障礙銀行服務', 'good practice': '良好做法', 'customer - centric culture': '客戶 中心 文化', 'financial inclusion': '金融普及', 'industry guideline': '行業指引', 'person with dementia': '患有 障礙症 人士', 'supervisory work': '▔'}	['香港金融管理局', '銀行業', '為 智力 人士 銀行 服務', '無障礙銀行服務', '良好做法', '客戶 中心 文化', '金融普及', '行業指引', '患有 障礙症 人士', '▔']
