	terms	src_raw	mt_raw	src_terms	alg_terms	norm_tgt_terms
110	{'ais': '認可機構', 'banking system': '銀行體系', 'cyber resilience assessment framework 2.0': '網絡防衛評估框架2.0', 'hkma': '金管局', 'operational resilience': '運作穩健性', 'spm': '監管政策手冊', 'supervisory policy manual': '監管政策手冊', 'tertiary datum backup': '三重數據備份'}	The HKMA will continue to monitor AIs’ progress towards achieving full compliance with the HKMA Supervisory Policy Manual (SPM) module OR-2 on “Operational Resilience”, and assess and benchmark banks’ tolerance limits for plausible disruptions, with a view to enhancing the overall resilience of the banking system. With respect to cyber risk, we will oversee a new round of self-assessments by AIs under the Cyber Resilience Assessment Framework 2.0 and monitor AIs’ implementation of a secure tertiary data backup to enhance their data recovery capabilities if faced with destructive cyber attacks.	金管局將繼續監控 認可機構 在達成完全符合《監管政策手冊》 (SPM) OR-2 模組「運作穩健性」方面的進展，並評估和基準銀行對可信擾流的容忍限度，以增強 銀行體系 的整體穩健性。 關於網絡風險，我們將監督 認可機構 根據《網絡防衛評估框架2.0》進行新一輪的自我評估，並監控 認可機構 實施三重數據備份，以提升其在面臨破壞性網絡攻擊時的數據恢復能力。	['ais', 'banking system', 'cyber resilience assessment framework 2.0', 'hkma', 'operational resilience', 'spm', 'supervisory policy manual', 'tertiary datum backup']	{'ais': '認可機構', 'banking system': '銀行體系', 'cyber resilience assessment framework 2.0': '網絡防衛評估框架2.0', 'hkma': '金管局', 'operational resilience': '運作穩健性', 'spm': '監管政策手冊', 'supervisory policy manual': '監管政策手冊', 'tertiary datum backup': '三重數據備份'}	['認可機構', '銀行體系', '網絡防衛評估框架2.0', '金管局', '運作穩健性', '監管政策手冊', '監管政策手冊', '三重數據備份']
111	{'hkma': '金管局', 'digital fraud': '數碼騙案', 'generative artificial intelligence': '生成式人工智能', 'stakeholder': '持份者'}	Given the accelerating pace of digitalisation in banking operations, the HKMA will keep a close watch on emerging risks arising from the use of advanced technologies such as generative artificial intelligence and distributed ledger technology. We will also collaborate with banks and other relevant stakeholders in operating an agile and pre-emptive mechanism to counter the growing trend of digital fraud.	鑒於銀行營運數字化進程加速，金管局將密切關注生成式人工智能及分布式賬本技術等先進技術應用所衍生的新風險。我們亦將與銀行及其他相關持份者合作，建立一個靈活且預防性的機制，以應對數碼騙案日益增多的趨勢。	['hkma', 'digital fraud', 'generative artificial intelligence', 'stakeholder']	{'hkma': '金管局', 'digital fraud': '數碼騙案', 'generative artificial intelligence': '生成式人工智能', 'stakeholder': '持份者'}	['金管局', '數碼騙案', '生成式人工智能', '持份者']
112	{'money laundering': '洗錢', 'terrorist financing': '恐怖分子資金籌集'}	# Combatting money laundering and terrorist financing	# 打擊洗錢及恐怖分子資金籌集	['money laundering', 'terrorist financing']	{'money laundering': '洗錢', 'terrorist financing': '恐怖分子資金籌集'}	['洗錢', '恐怖分子資金籌集']
113	{'ais': '認可機構', 'banking system': '銀行體系', 'hkma': '金管局', 'macro analytics 3.0': '傀儡戶口網絡分析3.0', 'corporate account': '企業戶口', 'counter - financing of terrorism': '恐怖分子資金籌集', 'digital fraud': '數碼騙案', 'money laundering': '洗錢', 'politically expose person': '政治人物', 'regulatory regime': '監管制度', 'regulatory regime for stablecoin issuer': '穩定幣發行人監管制度', 'stablecoin': '穩定幣', 'stablecoin issuer': '穩定幣發行人', 'terrorist financing': '恐怖分子資金籌集'}	In 2024, to uphold the integrity of the banking system and build customer confidence, the HKMA will target high-risk areas and prioritise risk-based regulatory updates, including issuing guidance to support an effective, risk-based implementation of changes to requirements for politically exposed persons, and supporting the implementation of the regulatory regime for stablecoin issuers. We will also issue guidance to help AIs optimise their transaction monitoring systems and to promote the responsible use of artificial intelligence, and focus on controls targeting high-end money laundering through our thematic work. To strengthen the ecosystem response to digital fraud and reduce losses to victims, we will further consult the public and the industry on a proposal to expand the scope of bank-to-bank information sharing from corporate accounts to personal accounts and, based on the feedback received, pursue necessary legislative amendments. We will move to a full build of Macro Analytics 3.0 by pooling data relevant to anti-money laundering across multiple banks and interfacing this with existing ecosystem fraud analysis. This will deliver more rapid cross-bank responses and further enhance our datadriven anti-money laundering and counter-financing of terrorism supervision, enabling us to take quicker, more decisive action against systemic money laundering and terrorist financing risks.	為維護銀行體系的完整性並建立客戶信心，金管局將於2024年針對高風險領域，優先進行風險為本的監管更新，包括發出指引，支持對政治人物相關要求的變更的有效風險為本落實，以及支持穩定幣發行人監管制度的實施。我們亦將發出指引，協助認可機構優化其交易監控系統，並促進人工智慧的負責任使用，同時透過主題性工作加強對高端洗錢的控制。為強化生態系統對數碼騙案的應對能力，並減少對受害者的損失，我們將進一步諮詢公眾及業界，就擴展銀行間資訊共享範圍的建議進行磋商，從企業戶口擴展至個人戶口，並根據收到的意見，推動必要的立法修訂。我們將透過整合多家銀行與打擊洗錢相關的數據，並與現有生態系統詐騙分析系統接介，全面建設傀儡戶口網絡分析3.0。此舉將帶來更快速的跨銀行應對措施，進一步提升我們以數據為基礎的打擊洗錢及恐怖分子資金籌集監管，使我們能夠對系統性洗錢及恐怖分子資金籌集風險採取更迅速、更果斷的行動。	['ais', 'banking system', 'hkma', 'macro analytics 3.0', 'corporate account', 'counter - financing of terrorism', 'digital fraud', 'money laundering', 'politically expose person', 'regulatory regime', 'regulatory regime for stablecoin issuer', 'stablecoin', 'stablecoin issuer', 'terrorist financing']	{'ais': '認可機構', 'banking system': '銀行體系', 'hkma': '金管局', 'macro analytics 3.0': '傀儡戶口網絡分析3.0', 'corporate account': '企業戶口', 'counter - financing of terrorism': '籌集', 'digital fraud': '數碼騙案', 'money laundering': '洗錢', 'politically expose person': '政治 人物', 'regulatory regime': '監管制度', 'regulatory regime for stablecoin issuer': '穩定幣發行人監管制度', 'stablecoin': '穩定幣', 'stablecoin issuer': '穩定幣發行人', 'terrorist financing': '恐怖分子資金籌集'}	['認可機構', '銀行體系', '金管局', '傀儡戶口網絡分析3.0', '企業戶口', '籌集', '數碼騙案', '洗錢', '政治 人物', '監管制度', '穩定幣發行人監管制度', '穩定幣', '穩定幣發行人', '恐怖分子資金籌集']
114	{'wealth management': '財富管理'}	# Wealth management and Mandatory Provident Fundrelated businesses	# 財富管理及公積金相關業務	['wealth management']	{'wealth management': '財富管理'}	['財富管理']
115	{'ais': '認可機構', 'cross - boundary wmc': '跨境理財通', 'cross - boundary wealth management connect': '跨境理財通', 'hkma': '金管局', 'mpf': '強積金', 'mandatory provident fund': '強制性公積金', 'digital distribution and advisory platform': '數碼分銷及諮詢平台', 'premium financing activity': '保費融資業務', 'virtual asset': '虛擬資產', 'wealth management': '財富管理'}	In 2024, the HKMA will step up both its on-site examinations and off-site surveillance of AIs’ conduct in relation to wealth management and the selling of securities, investment products, and insurance and Mandatory Provident Fund (MPF)-related businesses. More specifically, we will focus on Cross-boundary Wealth Management Connect (Cross-boundary WMC) business, digital distribution and advisory platforms, virtual asset (VA)-related products, long term insurance products and premium financing activities, taking into account the latest market developments as well as evolving international standards.	2024年，金管局將加強對認可機構在財富管理及銷售證券、投資產品、保險及強積金相關業務方面的現場審查及非現場監察。更為具體而言，我們將重點關注跨境理財通業務、數碼分銷及諮詢平台、虛擬資產相關產品、長期保險產品及保費融資業務，並考慮最新市場發展及不斷演進的國際標準。	['ais', 'cross - boundary wmc', 'cross - boundary wealth management connect', 'hkma', 'mpf', 'mandatory provident fund', 'digital distribution and advisory platform', 'premium financing activity', 'virtual asset', 'wealth management']	{'ais': '認可機構', 'cross - boundary wmc': '跨境理財通', 'cross - boundary wealth management connect': '跨境理財通', 'hkma': '金管局', 'mpf': '強積金', 'mandatory provident fund': '強積金', 'digital distribution and advisory platform': '數碼分銷及諮詢平台', 'premium financing activity': '保費融資業務', 'virtual asset': '虛擬資產', 'wealth management': '財富管理'}	['認可機構', '跨境理財通', '跨境理財通', '金管局', '強積金', '強積金', '數碼分銷及諮詢平台', '保費融資業務', '虛擬資產', '財富管理']
116	{'hkma': '金管局', 'mpf': '強積金', 'regulator': '監管機構', 'regulatory regime': '監管制度', 'the government': '政府'}	The HKMA will communicate closely with fellow regulators and the banking industry to provide guidance on regulatory standards in relation to the sale of investment, insurance and MPF products as appropriate. In particular, to support the sustainable and responsible development of the VA sector, we will continue to work with the Government and fellow regulators to ensure that the regulatory regime in place for the VA sector is robust, comprehensive and well-balanced.	金管局將與其他監管機構及銀行業密切溝通，就投資、保險及強積金產品的銷售提供適當的監管標準指引。特別是為支持壽險行業的可持續及負責任發展，我們將繼續與政府及其他監管機構合作，確保現行針對壽險行業的監管制度具備強健、全面及平衡的特質。	['hkma', 'mpf', 'regulator', 'regulatory regime', 'the government']	{'hkma': '金管局', 'mpf': '強積金', 'regulator': '監管機構', 'regulatory regime': '監管制度', 'the government': '政府'}	['金管局', '強積金', '監管機構', '監管制度', '政府']
117	{'ais': '認可機構', 'cross - boundary wmc': '跨境理財通', 'hkma': '金管局', 'sfc': '證監會', 'security and futures commission': '證券及期貨事務監察委員會', 'type 13 regulate activity': '第13類受規管活動', 'collective investment scheme': '集體投資計劃', 'regulator': '監管機構', 'regulatory authority': '監管機構', 'trust business': '信託業務'}	The HKMA will facilitate and monitor the industry’s implementation of enhancements to Cross-boundary WMC, and continue to engage with the industry and relevant regulatory authorities in order to further enhance the scheme. We will also continue to work with fellow regulators and the industry to streamline the selling process for investment products, and will consolidate and clarify guidance, as appropriate, to facilitate industry compliance. In addition to trust business, we will also commence the supervision of new Type 13 regulated activity under the Securities and Futures Ordinance for AIs providing depositary services for collective investment schemes authorised by the Securities and Futures Commission (SFC), which will come into operation on 2 October 2024.	金管局將促進並監督業界落實跨境理財通的改進措施，並繼續與業界及相關監管機構溝通，以進一步完善該計劃。我們亦會繼續與其他監管機構及業界合作，簡化投資產品的銷售流程，並適時整合及澄清指引，以促進業界合規。除信託業務外，我們亦將開始根據《證券及期貨條例》，對為證券及期貨事務監察委員會（證監會）授權的集體投資計劃提供保管服務的認可機構所涉及的第13類受規管活動進行監督，有關監督安排將於2024年10月2日開始實施。	['ais', 'cross - boundary wmc', 'hkma', 'sfc', 'security and futures commission', 'type 13 regulate activity', 'collective investment scheme', 'regulator', 'regulatory authority', 'trust business']	{'ais': '認可機構', 'cross - boundary wmc': '跨境理財通', 'hkma': '金管局', 'sfc': '證監會', 'security and futures commission': '證券及期貨事務監察委員會', 'type 13 regulate activity': '第13類受規管活動', 'collective investment scheme': '集體投資計劃', 'regulator': '監管機構', 'regulatory authority': '監管機構', 'trust business': '信託業務'}	['認可機構', '跨境理財通', '金管局', '證監會', '證券及期貨事務監察委員會', '第13類受規管活動', '集體投資計劃', '監管機構', '監管機構', '信託業務']
118	{'oversight of financial market infrastructure': '監察金融市場基建', 'financial market infrastructure': '金融市場基建', 'financial market': '金融市場', 'infrastructure': '基建'}	# Oversight of financial market infrastructures	# 監察金融市場基建	['oversight of financial market infrastructure', 'financial market infrastructure', 'financial market', 'infrastructure']	{'oversight of financial market infrastructure': '監察金融市場基建', 'financial market infrastructure': '金融市場基建', 'financial market': '金融市場', 'infrastructure': '基建'}	['監察金融市場基建', '金融市場基建', '金融市場', '基建']
119	{'cpmi': '支付及金融基建委員會', 'committee on payment and market infrastructures': '支付及金融基建委員會', 'fmis': '金融市場基建', 'hkma': '金管局', 'pfmi': '基建原則', 'pssvfo': '支付條例', 'principle for financial market infrastructures': '金融市場基建的原則', 'stored value facility ordinance': '儲值支付工具條例', 'stored value facility': '儲值支付工具', 'financial market infrastructure': '金融市場基建', 'financial market': '金融市場', 'infrastructure': '基建', 'standard - set body': '標準制定組織'}	The HKMA aims to promote the safety and efficiency of the financial market infrastructures (FMIs) under its oversight in accordance with the Payment Systems and Stored Value Facilities Ordinance (PSSVFO), the Principles for Financial Market Infrastructures (PFMI) and the various guidance issued by the Committee on Payments and Market Infrastructures (CPMI). We will continue to participate in the CPMI-IOSCO1 PFMI implementation monitoring and assessment exercise, and in other international working groups to discuss the implementation of new and innovative FMI-related initiatives. We will also participate in the work of international standard-setting bodies, and will review and strengthen our oversight requirements as appropriate to reflect the latest international practices as well as market and technology developments.	金管局旨在根據《支付條例》、金融市場基建的原則及支付及金融基建委員會發出的各項指引，促進其監管下的金融市場基建的安全性及效率。我們將繼續參與支付及金融基建委員會-國際證券事務委員會1基建原則的實施監察及評估工作，並參與其他國際工作小組，討論實施新的創新金融市場基建相關舉措。我們亦會參與國際標準制定組織的工作，並會根據最新的國際慣例以及市場和科技發展，適時檢討和加強我們的監管要求。	['cpmi', 'committee on payment and market infrastructures', 'fmis', 'hkma', 'pfmi', 'pssvfo', 'principle for financial market infrastructures', 'stored value facility ordinance', 'stored value facility', 'financial market infrastructure', 'financial market', 'infrastructure', 'standard - set body']	{'cpmi': '支付及金融基建委員會', 'committee on payment and market infrastructures': '支付及金融基建委員會', 'fmis': '金融市場基建', 'hkma': '金管局', 'pfmi': '基建', 'pssvfo': '支付條例', 'principle for financial market infrastructures': '金融市場基建的原則', 'stored value facility ordinance': '支付條例', 'stored value facility': '▔', 'financial market infrastructure': '金融市場基建', 'financial market': '金融市場', 'infrastructure': '▔', 'standard - set body': '標準制定組織'}	['支付及金融基建委員會', '支付及金融基建委員會', '金融市場基建', '金管局', '基建', '支付條例', '金融市場基建的原則', '支付條例', '▔', '金融市場基建', '金融市場', '▔', '標準制定組織']
120	{'hkma': '金管局'}	The HKMA will continue to strengthen and refine its banking supervisory and regulatory frameworks and policies, taking into account international standards and best practices.	金管局將繼續加強和完善其銀行監管及政策框架，並考慮國際標準及最佳實踐。	['hkma']	{'hkma': '金管局'}	['金管局']
121	{'basel standard': '巴塞爾標準'}	# Implementation of Basel standards in Hong Kong	# 香港推行巴塞爾標準	['basel standard']	{'basel standard': '巴塞爾標準'}	['巴塞爾標準']
122	{'bcr': '資本規則', 'bdr': '披露規則', 'basel iii final reform package': '巴塞爾協定三最終改革方案', 'ccyb': '逆周期緩衝資本', 'countercyclical capital buffer': '逆周期緩衝資本', 'final package': '最終方案', 'hkma': '金管局', 'international banking statistics': '國際銀行業務統計資料', 'legislative council': '立法會', 'spm': '監管政策手冊', 'spm module ca - b - 3': '監管政策手冊單元CA-B-3', 'banking return': '銀行業申報表', 'capital buffer': '資本緩衝'}	"The proposed amendments to the Banking (Capital) Rules (BCR) and the Banking (Disclosure) Rules (BDR) for implementing the Basel III final reform package (Final Package) are expected to take effect on 1 January 2025 following the passage of the amended Rules in the Legislative Council. In 2024, the HKMA will continue to prepare the supporting guidance, banking returns and standard disclosure templates and tables needed to facilitate the application of the Rules. In particular, we plan to:
- consult the industry in the second quarter of 2024 on the revisions to the SPM module CA-B-3 on “Countercyclical Capital Buffer (CCyB)–Geographic Allocation of Private Sector Credit Exposures” and Return MA(BS)25 “Quarterly reporting on the Countercyclical Capital Buffer”, reflecting the consequential changes arising from the implementation of the Final Package and the revised Return of International Banking Statistics; and
- finalise the package for effecting the reporting-only requirement for the new standards on market and credit valuation adjustment risks, which starts on 1 July 2024."	"為實施《巴塞爾協定三最終改革方案》（最終方案），擬對《銀行業（資本）規則》（資本規則）及《銀行業（披露）規則》（披露規則）進行修訂，預計將於2025年1月1日生效，待《立法會》通過修訂後的規則。2024年，金管局將繼續準備支援指引、銀行業申報表及標準披露範本和表格，以協助應用相關規定。特別是，我們計劃：
- 於2024年第二季就《監管政策手冊單元CA-B-3》關於「逆周期緩衝資本」（逆周期緩衝資本）– 私人部門信貸風險的地域分配，以及《申報表MA(BS) 25》關於「逆周期緩衝資本的季度報告」的修訂，諮詢業界；此舉旨在反映《最終方案》實施及《國際銀行業務統計資料》修訂所帶來的變動；以及
- 最終確定一套方案，以實施針對市場及信用價值調整風險的新準則的僅申報要求，該要求將於2024年7月1日開始生效。"	['bcr', 'bdr', 'basel iii final reform package', 'ccyb', 'countercyclical capital buffer', 'final package', 'hkma', 'international banking statistics', 'legislative council', 'spm', 'spm module ca - b - 3', 'banking return', 'capital buffer']	{'bcr': '資本規則', 'bdr': '披露規則', 'basel iii final reform package': '巴塞爾協定三最終改革方案', 'ccyb': '逆周期緩衝資本', 'countercyclical capital buffer': '逆周期緩衝資本', 'final package': '最終方案', 'hkma': '金管局', 'international banking statistics': '國際銀行業務統計資料', 'legislative council': '立法會', 'spm': '監管政策手冊', 'spm module ca - b - 3': '監管政策手冊單元CA-B-3', 'banking return': '銀行業申報表', 'capital buffer': '▔'}	['資本規則', '披露規則', '巴塞爾協定三最終改革方案', '逆周期緩衝資本', '逆周期緩衝資本', '最終方案', '金管局', '國際銀行業務統計資料', '立法會', '監管政策手冊', '監管政策手冊單元CA-B-3', '銀行業申報表', '▔']
123	{'bcr': '資本規則', 'belr': '風險承擔限度規則', 'blr': '流動性規則', 'final package': '最終方案', 'hkma': '金管局', 'liquidity': '流動性'}	Those parts of the proposed amendments to the Banking (Exposure Limits) Rules (BELR) and the Banking (Liquidity) Rules (BLR) that are largely consequential to the implementation of the Final Package under the amended BCR are also targeted to take effect on 1 January 2025. The HKMA plans to finalise the proposed consequential amendments to the related regulatory returns in 2024.	那些針對《銀行業（風險承擔限度）規則》（風險承擔限度規則）及《銀行業（流動性）規則》（流動性規則）的建議修正案，其中大部分與修訂後的資本規則（BCR）下《最終方案》的實施有關，也計劃於2025年1月1日生效。金管局計劃於2024年完成相關監管報告的建議後續修正。	['bcr', 'belr', 'blr', 'final package', 'hkma', 'liquidity']	{'bcr': '資本規則', 'belr': '風險承擔限度規則', 'blr': '流動性規則', 'final package': '最終方案', 'hkma': '金管局', 'liquidity': '流動性'}	['資本規則', '風險承擔限度規則', '流動性規則', '最終方案', '金管局', '流動性']
124	{'bcr': '資本規則', 'bdr': '披露規則', 'belr': '風險承擔限度規則', 'blr': '流動性規則', 'basel committee': '巴塞爾委員會', 'basel committee on banking supervision': '巴塞爾銀行監管委員會', 'hkma': '金管局', 'banking supervision': '銀行監理', 'crypto - asset': '加密資產', 'crypto - asset exposure': '加密資產風險承擔', 'statutory consultation': '法定諮詢'}	Meanwhile, with a new standard on the prudential treatment of banks’ crypto-asset exposures and subsequent targeted revisions to the standard having been issued by the Basel Committee on Banking Supervision in December 2022 and December 2023 respectively, local implementation of the standard is planned for 2025. The HKMA will examine the need for potential legislative amendments to various sets of rules, including the BCR, the BDR, the BELR and the BLR, and conduct the statutory consultation on the necessary rule amendments in the first half of 2025.	與此同時，鑑於巴塞爾銀行監管委員會於2022年12月及2023年12月分別發佈了關於銀行加密資產風險承擔的審慎處理新標準及後續的針對性修訂，本地計劃於2025年實施該標準。金管局將會檢視修訂多套規則（包括資本規則、披露規則、風險承擔限度規則及流動性規則）所需的潛在立法修訂，並於2025年上半年就必要的規則修訂展開法定諮詢。	['bcr', 'bdr', 'belr', 'blr', 'basel committee', 'basel committee on banking supervision', 'hkma', 'banking supervision', 'crypto - asset', 'crypto - asset exposure', 'statutory consultation']	{'bcr': '資本規則', 'bdr': '披露規則', 'belr': '流動性規則', 'blr': '流動性規則', 'basel committee': '巴塞 管委', 'basel committee on banking supervision': '巴塞爾銀行監管委員會', 'hkma': '金管局', 'banking supervision': '銀行監管', 'crypto - asset': '加密資產', 'crypto - asset exposure': '加密資產風險承擔', 'statutory consultation': '法定諮詢'}	['資本規則', '披露規則', '流動性規則', '流動性規則', '巴塞 管委', '巴塞爾銀行監管委員會', '金管局', '銀行監管', '加密資產', '加密資產風險承擔', '法定諮詢']
125	{'guideline': '指引', 'risk management': '風險管理'}	# Other supervisory policies and risk management guidelines	# 其他監管政策和風險管理指引	['guideline', 'risk management']	{'guideline': '指引', 'risk management': '風險管理'}	['指引', '風險管理']
