	terms	src_raw	mt_raw	src_terms	alg_terms	norm_tgt_terms
64	{'range': 'интервал'}	If you select the time range, you get to the know the available quantity of the material.	При выборе временного диапазона вы узнаёте доступное количество материала.	['range']	{'range': 'диапазона'}	['диапазон']
65	{'provider': 'поставщик'}	In the Manage Cash Pools app, the following service providers are supported:	В приложении Manage Cash Pools поддерживаются следующие поставщики услуг:	['provider']	{'provider': 'поставщики'}	['поставщик']
66	{'balance': 'баланс'}	Balance Transaction Currency – The currency of the G/L account where the journal entry was posted.	Валюта балансовой транзакции – валюта основного счёта, по которому была зарегистрирована бухгалтерская проводка.	['balance']	{'balance': 'балансовой'}	['балансовый']
67	{'copy': 'скопировать'}	The Copy and Remove buttons are active only when at least one alternative control is selected.	Кнопки «Копировать» и «Удалить» активны только когда выбран хотя бы один альтернативный элемент управления.	['copy']	{'copy': 'Копировать'}	['копировать']
68	{'accrual': 'разграничение'}	Accruals that have been manually reviewed in the Review Purchase Order Accruals - My Inbox app	Разграничения, которые были вручную проверены в приложении Review Purchase Order Accruals - My Inbox	['accrual']	{'accrual': 'Разграничения'}	['разграничение']
69	{'type': 'вид'}	Select Work Pack Type from the drop-down list.	Выберите тип пакета работ из раскрывающемся списка.	['type']	{'type': 'тип'}	['тип']
70	{'use': 'использование'}	Use the File Repository	Используйте файловый репозитария	['use']	{'use': 'Используйте'}	['использовать']
71	{'type': 'тип'}	Substitution Item Type	Тип элемента замещения	['type']	{'type': 'Тип'}	['тип']
72	{'schedule': 'планирование'}	You can also modify the existing schedule of a data flow or delete it.	Вы также можете изменить существующее расписание потока данных или удалить его.	['schedule']	{'schedule': 'расписание'}	['расписание']
73	{'type': 'тип'}	Displays the available run types.	Отображает доступные типы прогонов.	['type']	{'type': 'типы'}	['тип']
74	{'output': 'вывод', 'input': 'ввод'}	To manually map an input column to an output column, drag it from the left list and drop it onto the column in the right list.	Чтобы вручную сопоставить входной столбец с выходным столбцом, перетащите его из левого списка и отпустите на столбец в правом списке.	['output', 'input']	{'output': '▔', 'input': 'входной'}	['▔', 'входной']
75	{'type': 'вид'}	The RECORD COUNT type is a table-wide statistic.	Тип COUNT ЗАПИСЕЙ является статистикой по всей таблице.	['type']	{'type': 'Тип'}	['тип']
76	{'allocation': 'перерасчет'}	This means that essential features are missing, such as the allocation to a business area.	Это означает, что отсутствуют важные характеристики, такие как распределение по области бизнеса.	['allocation']	{'allocation': 'распределение'}	['распределение']
77	{'contract': 'договор'}	The point in time when the primary processing purpose ends, for example, a contract is fulfilled.	Момент времени, когда заканчивается основная цель обработки, например, договор достиг стадии исполнения.	['contract']	{'contract': 'договор'}	['договор']
78	{'edit': 'редактировать'}	Click the Edit Details link, to edit the technical details.	Нажмите ссылку «Изменить сведения», чтобы отредактировать технические сведения.	['edit']	{'edit': 'Изменить'}	['изменить']
79	{'demand-driven': 'на основе потребности'}	Select the corresponding checkbox for demand-driven MRP components and/or top-level materials.	Выберите соответствующий флажок для компонентов MRP, управляемых спросом, и/или материалов верхнего уровня.	['demand-driven']	{'demand-driven': 'управляемых спросом'}	['управляемый спрос']
80	{'input': 'ввод', 'join': 'соединение'}	Select the Join operator from the toolbar and drop it in the canvas and then connect two sources or other nodes to it as inputs.	Выберите оператор Join из панели инструментов, перетащите его на полотно, затем подключите к нему два источника или другие узлы в качестве входов.	['input', 'join']	{'input': 'входов', 'join': 'Join'}	['вход', 'join']
81	{'space': 'пространство'}	Spaces are environments that bring data models, connections, compute and storage resources together for a specific line of business or use-case.	Spaces — это среды, которые объединяют модели данных, подключения, вычислительные и ресурсы хранения для конкретного направления бизнеса или сценария использования.	['space']	{'space': 'среды'}	['среда']
82	{'accrual': 'разграничение'}	Accruals that have been manually reviewed in this app	Начисления, которые были вручную проверенные в этом приложении	['accrual']	{'accrual': 'Начисления'}	['начисление']
83	{'residence period': 'период активного хранения'}	The retention period is a combination of the residence period and the blocking period.	Период хранения объединяет период проживания и период блокировки.	['residence period']	{'residence period': 'период проживания'}	['период проживание']
84	{'contract': 'контракт', 'assembly': 'сборка'}	Enterprise Contract Assembly integrates with SAP S/4HANA for enterprise contract management, in order to generate virtual documents based on the templates and text blocks available in Enterprise Contract Assembly.	Enterprise Contract Assembly интегрируется с SAP S/4HANA для управления корпоративными контрактами, чтобы создавать виртуальные документы на основе шаблонов и текстовых блоков, доступных в Enterprise Contract Assembly.	['contract', 'assembly']	{'contract': 'контрактами', 'assembly': 'Assembly'}	['контракт', 'assembly']
85	{'copy': 'копирование'}	Copy existing item to add new one	Скопируйте существующий элемент для добавления нового.	['copy']	{'copy': 'Скопируйте'}	['скопировать']
86	{'schedule': 'планирование'}	Delete the schedule if required.	Удалите расписание при необходимости.	['schedule']	{'schedule': 'расписание'}	['расписание']
87	{'accrual': 'разграничение'}	Accruals that have been automatically reviewed because the amounts are between the threshold range.	Начисления, которые были автоматически проверены, поскольку суммы находятся в пределах порогового диапазона.	['accrual']	{'accrual': 'начисления'}	['начисление']
88	{'provider': 'провайдер'}	Get information on the data provider and the products they sell	Получите информацию о поставщике данных и продаваемых им продуктах.	['provider']	{'provider': 'поставщике'}	['поставщик']
89	{'service entry sheet': 'ведомость учета услуг'}	A service entry sheet can be created in one of the following ways:	Лист ввода услуг можно создать одним из следующих способов:	['service entry sheet']	{'service entry sheet': 'Лист ввода услуг'}	['лист ввод услуга']
90	{'type': 'тип'}	If you like to see only free data products, select the option Free from the filter Contract Type.	Если вам требуется видеть только бесплатные продукты данных, выберите параметр «Free» в фильтре «Тип контракта».	['type']	{'type': 'Тип'}	['тип']
91	{'change': 'изменение'}	Change Connection Properties	Изменить свойства соединения	['change']	{'change': 'Изменить'}	['изменить']
92	{'schedule': 'планирование'}	Create a simple or recurring schedule for your data flow.	Создайте простое или повторяющееся расписание для вашего потока данных.	['schedule']	{'schedule': 'расписание'}	['расписание']
93	{'undo': 'отмена'}	Undo and Redo Transformations	Отмена и повтор преобразований	['undo']	{'undo': 'Отмена'}	['отмена']
94	{'pause': 'приостановка'}	Pause Real-Time Replication	Приостановить тиражирование в реальном времени	['pause']	{'pause': 'Приостановить'}	['приостановить']
95	{'content': 'контент'}	If objects or data on your system will be overwritten by the import, a warning appears in the import window, and next to the relevant objects in the Content list.	Если объекты или данные в вашей системе будут перезаписаны при импорте, в окне импорта появится предупреждение, а рядом с соответствующими объектами в списке содержимого.	['content']	{'content': 'содержимого'}	['содержимое']
96	{'set': 'определить'}	In the Manage Your Solution app under Configure Your Solution make system settings under FinanceContract AccountingPosting and DocumentsDefine Account Assignment Data Relevant to Transactions.	В приложении Manage Your Solution в разделе Configure Your Solution установите системные настройки в FinanceContract AccountingPosting and DocumentsDefine Account Assignment Data Relevant to Transactions.	['set']	{'set': 'установите'}	['установить']
97	{'thread': 'тред'}	You can enter a number of threads or a percentage.	Вы можете ввести количество потоков или процент.	['thread']	{'thread': 'потоков'}	['поток']
98	{'Personal Data': 'Личные данные', 'personal data': 'личные данные'}	The information retrieval feature supports you to comply with the relevant legal requirements for data protection by allowing you to search for and retrieve all personal data of a specified data subject.	Функция извлечения информации помогает вам соблюдать соответствующие правовые требования по защите данных, позволяя выполнять поиск и извлекать все персональные данные указанного субъекта данных.	['Personal Data', 'personal data']	{'Personal Data': 'персональные данные', 'personal data': 'персональные данные'}	['персональный дать', 'персональный дать']
99	{'provider': 'поставщик'}	Data Provider Page	Страница поставщика данных	['provider']	{'provider': 'поставщика'}	['поставщик']
100	{'type': 'тип'}	This option deletes all of the monitored data belonging to this situation type.	Эта опция удаляет все отслеживаемые данные, относящиеся к этому типу ситуаций.	['type']	{'type': 'типу'}	['тип']
101	{'attachment': 'вложение'}	If a payment advice was not entered into the system in advance, but was instead used for clearing the current bank statement item or lockbox item, it can be uploaded as an attachment for more complete record keeping.	Если платежное извещение не было введено в систему заранее, а вместо этого использовалось для урегулирования текущего пункта банковской выписки или пункта lockbox, его можно загрузить в качестве вложения для более полного ведения учета.	['attachment']	{'attachment': 'вложения'}	['вложение']
102	{'activate': 'активация'}	Activate a supplier list or supplier list version	Активируйте список поставщиков или версии списка поставщиков	['activate']	{'activate': 'Активируйте'}	['активировать']
103	{'data provider': 'провайдер данных'}	It varies depending on how the data provider offers their products.	Это варьируется в зависимости от того, как поставщик данных предлагает свои продукты.	['data provider']	{'data provider': 'поставщик данных'}	['поставщик данные']
104	{'reporting': 'отчеты'}	Registration for Indirect Taxation Abroad (RITA) enables indirect tax calculation and reporting for multiple countries within a single legal entity.	Регистрация для косвенного налогообложения за рубежом (RITA) позволяет рассчитывать и отчитываться по косвенным налогам для нескольких стран в рамках одного юридического лица.	['reporting']	{'reporting': 'отчитываться'}	['отчитываться']
105	{'category': 'категория'}	For example, if a service technician works on a Public Holiday whereas the Overtime Category planned was Weekend, they can change the Overtime Category.	Например, если сервисный техник работает в государственный праздник, а запланированная категория сверхурочных была «Выходной», он может изменить категорию сверхурочных.	['category']	{'category': 'категорию'}	['категория']
106	{'type': 'тип'}	Deletes the entire monitored data belonging to this situation type.	Удаляет все отслеживаемые данные, относящиеся к этому типу ситуации.	['type']	{'type': 'типу'}	['тип']
107	{'client': 'клиент'}	Add Client to Allowlist	Добавление клиента в список разрешённых	['client']	{'client': 'клиента'}	['клиент']
108	{'type': 'тип'}	Licenses control access to your data products with contract type License Key (see ).	Лицензионные соглашения контролируют доступ к вашим продуктам данных с типом контракта «License Key» (см. ).	['type']	{'type': 'типом'}	['тип']
109	{'change': 'изменить'}	Change or Delete Assignments	Изменить или удалить присвоения	['change']	{'change': 'Изменить'}	['изменить']
110	{'provider': 'поставщик'}	You as a user can search and purchase analytical data from data providers.	Вы, как пользователь, можете искать и покупать аналитические данные у поставщиков данных.	['provider']	{'provider': 'поставщиков'}	['поставщик']
111	{'schedule': 'планирование'}	If a schedule is set for the data flow, see by when the next run is scheduled.	Если для потока данных задано расписание, посмотрите, на какое время запланировано следующее выполнение.	['schedule']	{'schedule': 'расписание'}	['расписание']
112	{'provider': 'провайдер'}	The OData service provider URL needs to be publicly available.	URL поставщика службы OData должен быть публично доступен.	['provider']	{'provider': 'поставщика'}	['поставщик']
113	{'rate': 'курс'}	Consolidation Monthly Average Rate	Консолидационный Ежемесячный Средний Тариф	['rate']	{'rate': 'Тариф'}	['тариф']
114	{'wizard': 'ассистент'}	For several connection types that use a Data Provisioning agent to connect to the source, you can define advanced properties in another wizard step.	Для нескольких типов подключений, которые используют агент Data Provisioning для подключения к источником, вы можете задать расширенные свойства на другом шаге мастера.	['wizard']	{'wizard': 'мастера'}	['мастер']
115	{'pattern': 'шаблон'}	Define a recurrence pattern for the job.	Определите шаблон повторов для задания.	['pattern']	{'pattern': 'шаблон'}	['шаблон']
116	{'type': 'тип'}	The following product types are currently supported:	В настоящее время поддерживаются следующие типы продуктов:	['type']	{'type': 'типы'}	['тип']
117	{'provider': 'провайдер'}	OData service provider URL of SAP SuccessFactors.	URL OData сервисного поставщика SAP SuccessFactors.	['provider']	{'provider': 'поставщика'}	['поставщик']
118	{'inactive': 'неактивно', 'edit': 'редактировать'}	Click Edit and use the Yes/ No switch to change the version to active or inactive respectively.	Нажмите «Изменить» и используйте переключатель «Да/Нет», чтобы сделать версию активной или неактивной соответственно.	['inactive', 'edit']	{'inactive': 'неактивной', 'edit': 'Изменить'}	['неактивный', 'изменить']
119	{'provider': 'провайдер'}	Data Provider ID	Идентификатор поставщика данных	['provider']	{'provider': 'поставщика'}	['поставщик']
120	{'schedule': 'планирование'}	Define, edit or delete scheduling options for your persisted views under Schedule.	Определите, отредактируйте или удалите параметры планирования для ваших сохранённых представлений в разделе «Расписание».	['schedule']	{'schedule': 'Расписание'}	['расписание']
121	{'copy': 'скопировать'}	Copy time entries	Копировать записи времени	['copy']	{'copy': 'Копировать'}	['копировать']
122	{'edit': 'редактировать'}	You could also chooseEdit Chart PromptsC_FINANCIALPOSITIONQUERY1, if you only want to change the variables for a specific chart.	Вы также можете выбрать Edit Chart Prompts C_FINANCIALPOSITIONQUERY1, если вы хотите изменить переменные только для конкретной диаграммы.	['edit']	{'edit': '▔'}	['▔']
123	{'tab': 'вкладка'}	Process History tab	Вкладка «История процесса»	['tab']	{'tab': 'Вкладка'}	['вкладка']
124	{'provider': 'провайдер'}	As a data provider, your main objective is to offer valuable data products to the users of the Data Marketplace in SAP Data Warehouse Cloud.	Как поставщик данных, ваша основная задача — предлагать ценные продукты данных пользователям Маркетплейса данных в SAP Data Warehouse Cloud.	['provider']	{'provider': 'поставщик'}	['поставщик']
125	{'type': 'тип'}	Choose one of the following action types:	Выберите один из следующих типов операций:	['type']	{'type': 'типов'}	['тип']
126	{'schedule': 'планирование'}	How to Schedule Destruction Runs for Archiving Files	Как запланировать запуски уничтожения для архивирования файлов	['schedule']	{'schedule': 'запланировать'}	['запланировать']
127	{'scope': 'объем'}	The Custom Code Migration app allows you to add or remove packages to/from the scope manually.	Приложение переноса пользовательского кода позволяет вручную добавлять пакеты в область охвата или удалять их из неё.	['scope']	{'scope': 'область'}	['область']
128	{'contract': 'договор'}	View and analyze expired or expiring service contracts	Просмотр и анализ истекших или истекающих сервисных контрактов	['contract']	{'contract': 'контрактов'}	['контракт']
129	{'retention period': 'срок хранения'}	The retention period consists of the residence period and blocking period.	Срок хранения состоит из срока пребывания и срока блокировки.	['retention period']	{'retention period': 'Срок хранения'}	['срок хранение']
130	{'story': 'журнал'}	SAP Analytics Cloud Story	История SAP Analytics Cloud	['story']	{'story': 'История'}	['история']
131	{'space': 'пространство'}	To solve this problem, queries from certain spaces can be favored, meaning they will be processed faster than queries from other spaces.	Для решения этой проблемы запросы из определённых пространств могут иметь преимущество, то есть они будут обрабатываться быстрее, чем запросы из других пространств.	['space']	{'space': 'пространств'}	['пространство']
132	{'rate': 'курс'}	Budget Consolidation Monthly Average Rate	Среднемесячный темп консолидации бюджета	['rate']	{'rate': 'темп'}	['темп']
133	{'tab': 'вкладка'}	Process Flow tab	Вкладка «Выполнение потока»	['tab']	{'tab': 'Вкладка'}	['вкладка']
134	{'type': 'вид'}	The following calculation types are supported:	Поддерживаются следующие типы расчета:	['type']	{'type': 'типы'}	['тип']
135	{'space': 'пространство'}	You can delete audit logs when needed in ConfigurationAudit, which will free up disk space.	Вы можете удалять журналы аудита при необходимости в ConfigurationAudit, что освободит место на диске.	['space']	{'space': 'место'}	['место']
136	{'transfer': 'перевести'}	If you have selected an item type by mistake, you can either delete the item and add a new one or use the Change Item Type button to transfer the data of the selected item to a different item type.	Если вы по ошибке выбрали тип элемента, вы можете либо удалить элемент и добавить новый, либо воспользоваться кнопкой «Изменить тип элемента», чтобы перенести данные выбранного элемента в другой тип элемента.	['transfer']	{'transfer': 'перенести'}	['перенести']
137	{'type': 'тип'}	Purchase order type	Тип заказа на закупку	['type']	{'type': 'Тип'}	['тип']
138	{'instance': 'инстанция', 'open': 'открыто'}	Instance Set to Open	Экземпляр установлена на открытие	['instance', 'open']	{'instance': 'Экземпляр', 'open': 'открытие'}	['экземпляр', 'открытие']
139	{'type': 'тип'}	Business Partner Type	Тип бизнес-партнера	['type']	{'type': 'Тип'}	['тип']
