	terms	src_raw	mt_raw	src_terms	alg_terms	norm_tgt_terms
140	{'wizard': 'ассистент'}	Click New Export to open the wizard.	Нажмите «Новый экспорт», чтобы открыть мастер.	['wizard']	{'wizard': 'мастер'}	['мастер']
141	{'type': 'вид'}	You can choose one of the following processing types:	Вы можете выбрать один из следующих типов обработки:	['type']	{'type': 'типов'}	['тип']
142	{'tab': 'вкладка'}	An additional filter is set and the Maintenance Order tab opens, showing the orders for the selected operations.	Устанавливается дополнительный фильтр, и открывается вкладка «Заказ на обслуживание», отображающая заказы для выбранных операций.	['tab']	{'tab': 'вкладка'}	['вкладка']
143	{'type': 'вид'}	The following types of conditions are supported:	Поддерживаются следующие типы условий:	['type']	{'type': '▔'}	['▔']
144	{'schedule': 'планирование'}	How to Schedule Destruction Runs Using Data Destruction Objects	Как запланировать операции уничтожения с использованием объектов уничтожения данных	['schedule']	{'schedule': 'запланировать'}	['запланировать']
145	{'wizard': 'ассистент'}	In the final wizard step, enter name and description for the connection and click Create Connection.	На заключительном шаге мастера введите имя и описание соединения и нажмите «Создать соединение».	['wizard']	{'wizard': 'мастера'}	['мастер']
146	{'request': 'заявка'}	Manage Resource Requests	Управление заявками на ресурсы	['request']	{'request': 'заявками'}	['заявка']
147	{'change': 'изменение'}	Change queue assignments.	Измените присвоений очереди.	['change']	{'change': 'Измените'}	['изменить']
148	{'tab': 'вкладка'}	Code List tab	Вкладка «Список кодов»	['tab']	{'tab': 'Вкладка'}	['вкладка']
149	{'restart': 'перезапуск', 'pause': 'приостановка'}	Pause and Restart Real-Time Replication	Приостановка и перезапуск тиражирования в реальном времени	['restart', 'pause']	{'restart': 'перезапуск', 'pause': 'Приостановка'}	['перезапуск', 'приостановка']
150	{'relationship': 'связь'}	Once you remove the constraint for the successor operation, the operation is rescheduled automatically and the relationship is repaired.	Как только вы удалите ограничение для последующей операции, операция будет перепланирована автоматически, и связь будет восстановлена.	['relationship']	{'relationship': 'связь'}	['связь']
151	{'aggregate': 'агрегировать'}	Aggregate Notifications shows whether the notifications to be sent are aggregated (Yes) or separate for each situation instance (No).	Параметр «Aggregate Notifications» показывает, агрегированы ли уведомления, подлежащие отправке (Да) или они отправляются отдельно для каждого экземпляра ситуации (Нет).	['aggregate']	{'aggregate': 'агрегированы'}	['агрегировать']
152	{'contract': 'договор'}	Expiring service contracts	Истекающие сервисные контракты	['contract']	{'contract': '▔'}	['▔']
153	{'type': 'тип'}	New Order Type	Новый тип заказа	['type']	{'type': 'тип'}	['тип']
154	{'item': 'элемент'}	Select Add Item.	Выберите «Добавить элемент».	['item']	{'item': 'элемент'}	['элемент']
155	{'design time': 'среда дизайна'}	For more information, see Design Time.	Дополнительную информацию см. в разделе Design Time.	['design time']	{'design time': 'Design Time'}	['design time']
156	{'type': 'вид'}	Define a description for the type.	Определите описание для типа.	['type']	{'type': 'типа'}	['тип']
157	{'schedule': 'расписание'}	Included in Schedule (Filter)	Включено в расписание (фильтр)	['schedule']	{'schedule': 'расписание'}	['расписание']
158	{'type': 'вид'}	Specifies the type of the compliance requirement.	Определяет тип требования соответствия.	['type']	{'type': 'тип'}	['тип']
159	{'get': 'вызвать'}	Get Email Information	Получить информацию об электронном	['get']	{'get': 'Получить'}	['получить']
160	{'update': 'обновление'}	Update Purchase Order	Обновить заказа	['update']	{'update': 'Обновить'}	['обновить']
161	{'download': 'выгружать'}	Download G/L mappings into a .csv file	Выгрузите сопоставления G/L в файл .csv	['download']	{'download': 'Выгрузите'}	['выгрузить']
162	{'check': 'проверить'}	Check Lot-Sizing Procedures	Проверка процедур определения размера партии	['check']	{'check': 'Проверка'}	['проверка']
163	{'space': 'пространство'}	Under Spaces select the space you would like to work with.	В разделе Spaces выберите пространство, с которым вы хотите работать.	['space']	{'space': 'пространство'}	['пространство']
164	{'type': 'вид'}	Descriptiion of Distinct Type	Описание отдельного типа	['type']	{'type': 'типа'}	['тип']
165	{'pause': 'приостановка'}	Pause Real-Time Replication for an Agent	Приостановить репликацию в реальном времени для агента	['pause']	{'pause': 'Приостановить'}	['приостановить']
166	{'transaction type': 'вид движения'}	Accrual Transaction Type	Тип транзакции разграничения	['transaction type']	{'transaction type': 'Тип разграничения'}	['тип разграничение']
167	{'provider': 'поставщик'}	You can edit the predefined email and then send it to the provider.	Вы можете отредактировать заранее подготовленное письмо, а затем отправить его поставщику.	['provider']	{'provider': 'поставщику'}	['поставщик']
168	{'wizard': 'ассистент'}	In the next wizard step, enter connection properties to configure your connection.	На следующем шаге мастера введите свойства соединения, чтобы настроить соединения.	['wizard']	{'wizard': 'мастера'}	['мастер']
169	{'type': 'тип'}	Description of Project Type	Описание типа проекта	['type']	{'type': 'типа'}	['тип']
170	{'type': 'тип'}	For more information, see Creating Action Types	Дополнительную информацию см. в разделе «Создание типов операций».	['type']	{'type': 'типов'}	['тип']
171	{'provider': 'провайдер'}	Purchase analytical data from data provider.	Приобретение аналитических данных у поставщика данных.	['provider']	{'provider': 'поставщика'}	['поставщик']
172	{'edit': 'редактировать'}	Choose Edit Operations.	Выберите операции редактирования.	['edit']	{'edit': 'редактирования'}	['редактирование']
173	{'input': 'вход'}	Main input parameters	Основные входные параметры	['input']	{'input': 'входные'}	['входной']
174	{'allocation': 'перерасчет'}	Overhead Allocation for CO-PA	Распределение накладных расходов для CO-PA	['allocation']	{'allocation': 'Распределение'}	['распределение']
175	{'service confirmation': 'подтверждение сервиса'}	You cannot make changes to a service confirmation that has status Completed.	Вы не можете внести изменения в подтверждение услуги, имеющее статус Завершено.	['service confirmation']	{'service confirmation': 'подтверждение услуги'}	['подтверждение услуга']
176	{'request': 'заявка'}	The top-level bars show information about the requests to which a resource is assigned in the specified time period.	Полосы верхнего уровня показывают информацию о запросах, на которые назначен ресурс в указанный период времени.	['request']	{'request': 'запросах'}	['запрос']
177	{'use': 'использование'}	Please note that in some cases, certain country-specific functions may not be supported within Manage Global Accounting Hierarchies.This can occur because these two apps consume different data tables.	Обратите внимание, что в некоторых случаях определённые функции, специфичные для отдельных стран, могут не поддерживаться в «Управлении глобальными иерархиями учёта». Это может происходить потому, что эти два приложения используют разные данные из таблиц.	['use']	{'use': 'используют'}	['использовать']
178	{'provider': 'провайдер'}	Manage Your Data Provider Profiles	Управление вашими профилями поставщиков данных	['provider']	{'provider': 'поставщиков'}	['поставщик']
179	{'edit': 'редактировать'}	In the Edit menu, the following functions are available:	В меню «Правка» доступны следующие функции:	['edit']	{'edit': 'Правка'}	['правка']
180	{'space': 'пространство'}	On the Choose content page, expand the SPACE folder to show your spaces, select the objects you want to export, and then click Next.	На странице Выбор содержимого разверните папку SPACE, чтобы отобразить свои пространства, выберите объекты для экспорта и нажмите Далее.	['space']	{'space': 'пространства'}	['пространство']
181	{'type': 'вид'}	Order Confirmation Type	Тип подтверждения заказа	['type']	{'type': 'Тип'}	['тип']
182	{'get': 'получить'}	Get mail information	Получить информацию о почте	['get']	{'get': 'Получить'}	['получить']
183	{'purchase order': 'заказ на закупку', 'Purchase Order': 'Заказ на закупку'}	Purchase order inbound	Входящий заказ на закупку	['purchase order', 'Purchase Order']	{'purchase order': 'заказ на закупку', 'Purchase Order': 'заказ на закупку'}	['заказ на закупка', 'заказ на закупка']
184	{'sales order': 'заказ клиента'}	Enable Sales Order	Активировать заказ на продажу	['sales order']	{'sales order': 'заказ продажу'}	['заказ продажа']
185	{'type': 'вид'}	Select the relevant source type	Выберите соответствующий тип источника	['type']	{'type': 'тип'}	['тип']
186	{'exception': 'исключение'}	There's only one exception:	Есть только одно исключение:	['exception']	{'exception': 'исключение'}	['исключение']
187	{'type': 'вид'}	Select one of the following work center group types:	Выберите один из следующих типов групп рабочих центров:	['type']	{'type': 'типов'}	['тип']
188	{'category': 'категория'}	The Name and Type fields are mandatory.Based on the team type, the team category is automatically populated.	Поля «Название» и «Тип» обязательны. На основе типа команды категория команды заполняется автоматически.	['category']	{'category': 'категория'}	['категория']
189	{'item': 'позиция'}	You can perform the following actions when working with items:	Вы можете выполнять следующие действия при работе с элементами:	['item']	{'item': 'элементами'}	['элемент']
190	{'update': 'обновить'}	Update user information	Обновите информацию пользователе	['update']	{'update': 'Обновите'}	['обновить']
191	{'type': 'тип'}	For more information on the learner types, see .	Для получения дополнительной информации о типах обучающихся см. .	['type']	{'type': 'типах'}	['тип']
192	{'regulation': 'предписание'}	If you want to enter a different description of different modes of transport or if you want to enter the description in different languages, select a regulation and navigate to the Classify Dangerous Good - Packaged Product app.	Если вы хотите ввести другое описание различных видов транспорта или описание на разных языках, выберите нормативный документ и перейдите к приложению Classify Dangerous Good - Packaged Product.	['regulation']	{'regulation': 'документ'}	['документ']
193	{'source assignment': 'присвоение происхождения'}	Source Assignment 2	Источник задания 2	['source assignment']	{'source assignment': 'источник задания'}	['источник задание']
194	{'term': 'оговорка'}	Organizational Assignment Term	Срок Организационной Назначения	['term']	{'term': 'Срок'}	['срок']
195	{'wizard': 'ассистент'}	Changed creation wizard:	Изменен мастер создания:	['wizard']	{'wizard': 'мастер'}	['мастер']
196	{'provider': 'провайдер'}	Enter the OData service provider URL.	Введите URL-адрес поставщика службы OData.	['provider']	{'provider': 'поставщика'}	['поставщик']
197	{'tab': 'вкладка'}	You can switch between the following tabs:	Вы можете переключаться между следующими вкладками:	['tab']	{'tab': 'вкладками'}	['вкладка']
198	{'tab': 'вкладка'}	Task Lists Tab	Вкладка планов задач	['tab']	{'tab': 'Вкладка'}	['вкладка']
199	{'type': 'тип'}	You can delete all the monitored data for this situation type.	Вы можете удалить все данные мониторинга для этого типа ситуации.	['type']	{'type': 'типа'}	['тип']
200	{'type': 'тип'}	This option is available for the following order types:	Эта опция доступна для следующих типов заказов:	['type']	{'type': 'типов'}	['тип']
201	{'retention period': 'срок хранения'}	Retention Period for Users	Срок хранения для пользователей	['retention period']	{'retention period': 'Срок хранения'}	['срок хранение']
202	{'transaction type': 'вид сделки'}	Transaction Type (SFHAART)	Тип транзакции (SFHAART)	['transaction type']	{'transaction type': 'Тип транзакции'}	['тип транзакция']
203	{'type': 'вид'}	You can change this to one of the following types:	Вы можете изменить это на один из следующих типов:	['type']	{'type': 'типов'}	['тип']
204	{'service confirmation': 'подтверждение выполнения сервиса'}	You can cancel service confirmations with status completed.	Вы можете отменить подтверждения сервиса со статусом «Завершено».	['service confirmation']	{'service confirmation': 'подтверждения сервиса'}	['подтверждение сервис']
205	{'interest calculation': 'начисление процентов'}	The following types on interest calculation are available:	Доступны следующие виды расчёта процентов:	['interest calculation']	{'interest calculation': 'расчёта процентов'}	['расчёт процент']
206	{'clearing item': 'перерасчетная позиция'}	Clearing Item Completed	Очистка элемента завершена	['clearing item']	{'clearing item': 'элемента'}	['элемент']
207	{'edit': 'редактировать'}	Select Create and Edit.	Выберите Создать и Редактировать.	['edit']	{'edit': 'Редактировать'}	['редактировать']
208	{'edit': 'редактировать'}	In the Edit Variant pane that appears, do the following:	В появившейся панели «Редактирование варианта» выполните следующие действия:	['edit']	{'edit': 'Редактирование'}	['редактирование']
209	{'purchase order': 'заказ на закупку', 'Purchase Order': 'Заказ на закупку'}	Purchase order outbound	Исходящий заказ на покупку	['purchase order', 'Purchase Order']	{'purchase order': 'заказ на покупку', 'Purchase Order': 'заказ на покупку'}	['заказ на покупка', 'заказ на покупка']
210	{'merge': 'объединить'}	Merge Tax Items	Объединить элементы налога	['merge']	{'merge': 'Объединить'}	['объединить']
211	{'work package': 'рабочий пакет'}	You can click on the work package to see its details.	Вы можете щелкнуть по рабочему пакету, чтобы просмотреть его детали.	['work package']	{'work package': 'рабочему пакету'}	['рабочий пакет']
212	{'type': 'вид'}	There are two types of service quotations:	Существует два типа коммерческих предложений на услуги:	['type']	{'type': 'типа'}	['тип']
213	{'schedule': 'планирование'}	Schedule is created for the data flow.	Расписание создано для потока данных.	['schedule']	{'schedule': 'расписание'}	['расписание']
214	{'pause': 'приостановка'}	Pause Real-Time Replication for a Connection	Приостановка тиражирования в реальном времени для подключения	['pause']	{'pause': 'Приостановка'}	['приостановка']
215	{'association': 'связь'}	An association represents a relationship between two entities.	Ассоциация представляет собой отношение между двумя сущностями.	['association']	{'association': 'Ассоциация'}	['ассоциация']
216	{'type': 'вид'}	Document Type ID	идентификатор типа вида	['type']	{'type': 'типа'}	['тип']
217	{'update': 'обновление'}	Update Existing PowerPoint	Обновить существующую презентацию PowerPoint	['update']	{'update': 'Обновить'}	['обновить']
218	{'action': 'операция'}	It allows you to create an assignment exactly as requested by the project manager.This action is available if the project manager requested a specific resource and no resource has been assigned to the request yet.	Это позволяет создать назначение точно так, как указано в заявке руководителя проекта. Это действие доступно, если руководитель проекта в заявке указал конкретный ресурс и к запросу ещё не назначен ни один ресурс.	['action']	{'action': 'действие'}	['действие']
219	{'type': 'вид'}	For more information about restriction types, see .	Дополнительные сведения о типах ограничений см. .	['type']	{'type': 'типах'}	['тип']
220	{'where-used list': 'журнал использования'}	WIP Batch Where-Used List	Список использования партий WIP	['where-used list']	{'where-used list': 'Список'}	['список']
221	{'record': 'запись'}	Record SAPUI5 Application	Запись приложения SAPUI5	['record']	{'record': 'Запись'}	['запись']
222	{'repair': 'ремонт'}	Set the repair object to the status Completed.	Установите объект ремонта в статуса «Завершено».	['repair']	{'repair': 'ремонта'}	['ремонт']
223	{'contract': 'контракт'}	To create a new contract:	Чтобы создать новый контракт:	['contract']	{'contract': 'контракт'}	['контракт']
224	{'Environment, Health and Safety': 'управление данными по охране здоровья и защите окружающей среды'}	A hyperlink name to the incident record in the Environment, Health, and Safety system.	Имя гиперссылки на запись события в системе охраны окружающей среды, здоровья и безопасности.	['Environment, Health and Safety']	{'Environment, Health and Safety': 'системе охраны окружающей среды, здоровья и безопасности'}	['система охрана окружающий среда , здоровье и безопасность']
225	{'type': 'вид'}	Start Date Type	Тип начальной даты	['type']	{'type': 'Тип'}	['тип']
226	{'request': 'заявка'}	If a resource has been requested and the request has not yet been staffed, you'll see a Quick Assignment link in the Actions column.This allows you to create the assignment exactly as requested by the project manager.	Если ресурс был запрошен, но запрос ещё не укомплектован, в столбце «Действия» будет отображаться ссылка «Быстрого назначения». Это позволяет создать назначение в точности так, как его запросил менеджер проекта.	['request']	{'request': 'запрос'}	['запрос']
227	{'agent': 'агент'}	Register New Agent	Зарегистрировать нового агента	['agent']	{'agent': 'агента'}	['агент']
228	{'request': 'заявка'}	Resource Request Skill Tag	Тег навыка запроса ресурсов	['request']	{'request': 'запроса'}	['запрос']
229	{'run': 'выполнить'}	Run Overhead Calculation	Запустить калькуляцию накладных расходов	['run']	{'run': 'Запустить'}	['запустить']
230	{'service confirmation': 'подтверждение сервиса'}	Service Confirmation Item	Позиция подтверждения услуги	['service confirmation']	{'service confirmation': 'подтверждения услуги'}	['подтверждение услуга']
231	{'provider': 'поставщик'}	Deleting a Service Provider	Удаление поставщика услуг	['provider']	{'provider': 'поставщика'}	['поставщик']
232	{'characteristic': 'характеристика'}	Characteristic 1 Value	Значение характеристики 1	['characteristic']	{'characteristic': 'характеристики'}	['характеристика']
233	{'retention period': 'период хранения'}	Retention period is expired	Срок хранения истек	['retention period']	{'retention period': 'Срок хранения'}	['срок хранение']
234	{'carrier': 'перевозчик'}	Related Information for Carriers	Связанная информация для перевозчиков	['carrier']	{'carrier': 'перевозчиков'}	['перевозчик']
235	{'service confirmation': 'подтверждение сервиса'}	Service Confirmation (SVC1)	Подтверждение услуги (SVC1)	['service confirmation']	{'service confirmation': 'Подтверждение услуги'}	['подтверждение услуга']
236	{'use': 'использование'}	Use the planning panel	Используйте панели планирования	['use']	{'use': 'Используйте'}	['использовать']
