	terms	src_raw	mt_raw	src_terms	alg_terms	norm_tgt_terms
87	{'minimum score': 'Mindest-Score'}	Set the minimum score needed to match an input record with a lookup record and place it in the Review results category.	Legen Sie die Mindestpunktzahl fest, die erforderlich ist, damit ein Eingabedatensatz mit einem Nachschlagedatensatz übereinstimmt, und ordnen Sie ihn der Kategorie „Überprüfungsergebnisse“ zu.	['minimum score']	{'minimum score': 'Mindestpunktzahl'}	['mindestpunktzahl']
88	{'side panel': 'Seitenbereich'}	Control your join in the Mappings section of its side panel:	Steuern Sie Ihre Verknüpfung im Abschnitt „Mappings“ des Seitenbereichs:	['side panel']	{'side panel': 'Seitenbereich'}	['seitenbereich']
89	{'space': 'Space'}	data related to spaces,	Daten im Zusammenhang mit Räumen,	['space']	{'space': 'Räumen'}	['raum|räumen']
90	{'space': 'Space', 'allow': 'erlauben'}	You could also allow your space data to be consumed in your HDI containers.	Sie könnten auch zulassen, dass Ihre Space-Daten in Ihren HDI-Containern genutzt werden.	['space', 'allow']	{'space': 'Space-Daten', 'allow': 'zulassen'}	['space', 'zulassen']
91	{'minimum score': 'Mindest-Score'}	Set the minimum score needed to match an input record with a lookup record and place it in the Matched results category.	Legen Sie die Mindestpunktzahl fest, die erforderlich ist, um einen Eingabedatensatz mit einem Nachschlagedatensatz abzugleichen und ihn in die Kategorie „Übereinstimmende Ergebnisse“ einzuordnen.	['minimum score']	{'minimum score': 'Mindestpunktzahl'}	['mindestpunktzahl']
92	{'action': 'Aktion', 'Action': 'Aktion'}	Possible quick actions are:	Mögliche Schnellaktionen sind:	['action', 'Action']	{'action': 'Schnellaktionen', 'Action': 'Schnellaktionen'}	['schnellaktion', 'schnellaktion']
93	{'condition': 'Bedingung'}	The advantage of this attribute is that you can refer to certain business partners in one condition by using the correct payment clearing group.	Der Vorteil dieses Attributs besteht darin, dass Sie mithilfe der richtigen Zahlungsclearing-Gruppe bestimmte Geschäftspartner in einer Kondition referenzieren können.	['condition']	{'condition': 'Kondition'}	['kondition']
94	{'compliance requirement': 'Compliance-Anforderung'}	Specifies the Valid To date for compliance requirements.	Gibt das Gültig-bis-Datum für Compliance-Anforderungen an.	['compliance requirement']	{'compliance requirement': 'Compliance-Anforderungen'}	['compliance']
95	{'data provider': 'Datenprovider'}	The data provider has entered some details about the product:	Der Datenanbieter hat einige Details zum Produkt eingegeben:	['data provider']	{'data provider': 'Datenanbieter'}	['datenanbieter']
96	{'release': 'Release', 'create': 'erstellen'}	Information on the contained data, which is entered in the Create Release wizard.	Informationen zu den enthaltenen Daten, die im Assistenten zum Erstellen einer Veröffentlichung eingegeben werden.	['release', 'create']	{'release': 'Veröffentlichung', 'create': 'Erstellen'}	['veröffentlichung', 'erstellen']
97	{'type': 'Typ'}	In the Permissions page individual permissions assigned to privilege types are displayed	Auf der Seite „Berechtigungen“ werden die einzelnen Berechtigungen angezeigt, die den Berechtigungstypen zugewiesen sind.	['type']	{'type': 'Berechtigungstypen'}	['berechtigungstypen']
98	{'connector': 'Connector'}	Note that Cloud Connectors that you want to use for data flows only don't require an entry in this list.	Beachten Sie, dass Cloud Connectors, die Sie ausschließlich für Datenflüsse verwenden möchten, keinen Eintrag in dieser Liste benötigen.	['connector']	{'connector': '▔'}	['▔ertrat<sos>']
99	{'space': 'Space'}	The space that was selected to store the data product.	Der Speicherplatz, der ausgewählt wurde, um das Datenprodukt zu speichern.	['space']	{'space': 'Speicherplatz'}	['speicherplatz']
100	{'schedule': 'Zeitplan', 'change': 'Änderung'}	This means that the work center change is only visible in your schedule and is not yet saved in the maintenance order.	Dies bedeutet, dass die Änderung des Arbeitsplatzes nur in Ihrem Zeitplan sichtbar ist und noch nicht im Instandhaltungsauftrag gespeichert wurde.	['schedule', 'change']	{'schedule': 'Zeitplan', 'change': 'Änderung'}	['zeitplan', 'änderung']
101	{'category': 'Kategorie'}	New records that have the same pairing column value as an existing pairing group are automatically placed in the appropriate results category for that pairing group.	Neue Datensätze, die denselben Wert in der Zuordnungsspalte wie eine bestehende Zuordnungsgruppe haben, werden automatisch der entsprechenden Ergebniskategorie dieser Zuordnungsgruppe zugeordnet.	['category']	{'category': 'Ergebniskategorie'}	['ergebniskategorie']
102	{'service': 'Service'}	SAP and other SAP products and services mentioned herein as well as their respective logos are trademarks or registered trademarks of SAP SE (or an SAP affiliate company) in Germany and other countries.	SAP und andere hier erwähnte SAP-Produkte und ‑Dienstleistungen sowie deren jeweilige Logos sind Marken oder eingetragene Marken der SAP SE (oder eines SAP-Konzernunternehmens) in Deutschland und anderen Ländern.	['service']	{'service': 'Dienstleistungen'}	['dienstleistung']
103	{'data provider': 'Datenprovider'}	To be able to use the data product, the data provider will send an activation key via email that provides authorization to access one or multiple data products.	Um das Datenprodukt nutzen zu können, sendet der Datenanbieter per E-Mail einen Aktivierungsschlüssel, der die Berechtigung zum Zugriff auf ein oder mehrere Datenprodukte erteilt.	['data provider']	{'data provider': 'Datenanbieter'}	['datenanbieter']
104	{'assigned': 'zugewiesen', 'space': 'Platz'}	It might make sense to delete unnecessary data in your space or to extend the assigned storage.	Es könnte sinnvoll sein, unnötige Daten in Ihrem Speicher zu löschen oder den zugewiesenen Speicherplatz zu erweitern.	['assigned', 'space']	{'assigned': 'zugewiesenen', 'space': 'Speicher'}	['zuwiesen', 'speicher']
105	{'insight': 'Analysen'}	There are many ways to collect and combine data to create business insights:	Es gibt viele Möglichkeiten, Daten zu sammeln und zu kombinieren, um geschäftliche Erkenntnisse zu gewinnen:	['insight']	{'insight': 'Erkenntnisse'}	['erkenntnis']
106	{'create': 'anlegen'}	You can create a text block inside the text block library.	Sie können einen Textblock in der Textblockbibliothek erstellen.	['create']	{'create': 'erstellen'}	['erstellen']
107	{'space': 'Space'}	This space is no longer active.	Dieser Bereich ist nicht mehr aktiv.	['space']	{'space': 'Bereich'}	['bereich']
108	{'storage': 'Speicher'}	Allocate your capacity units to compute and storage resources.	Weisen Sie Ihre Kapazitätseinheiten den Rechen- und Speicherressourcen zu.	['storage']	{'storage': 'Speicherressourcen'}	['speicherressourcen']
109	{'share': 'freigeben'}	Generate keys that you can share with consumers to allow them to use the licensed scope of data products.	Generieren Sie Schlüssel, die Sie mit Kunden teilen können, damit sie den lizenzierten Umfang Ihrer Datenprodukte nutzen können.	['share']	{'share': 'teilen'}	['teilen']
110	{'release': 'Release'}	The release is highlighted on the landing page with the flag “Not published yet”.	Die Veröffentlichung wird auf der Landingpage mit der Kennzeichnung „Noch nicht veröffentlicht“ hervorgehoben.	['release']	{'release': 'Veröffentlichung'}	['veröffentlichung']
111	{'access control': 'Zugriffskontrolle', 'restriction': 'Beschränkung'}	For each business entity used as data restriction, you need to map each key member to the data access control's output column.	Für jede als Datenbeschränkung verwendete Geschäftseinheit müssen Sie jedes Schlüsselattribut der Ausgabespalte der Datenzugriffskontrolle zuordnen.	['access control', 'restriction']	{'access control': 'Datenzugriffskontrolle', 'restriction': 'Datenbeschränkung'}	['datenzugriffskontrollen', 'datenbeschränkung']
112	{'snapshot': 'Snapshot'}	Create a schedule to load new snapshot of data asynchronously and recurrently in the background according to the defined settings.	Erstelle einen Zeitplan, um neue Datensnapshots entsprechend den definierten Einstellungen asynchron und wiederkehrend im Hintergrund zu laden.	['snapshot']	{'snapshot': 'Datensnapshots'}	['datensnapshot']
113	{'interface': 'Schnittstelle', 'message': 'Nachricht'}	The interfaces you have subscribed to for monitoring, including the status of the individual messages.	Die Schnittstellen, die Sie zum Monitoring abonniert haben, einschließlich des Status der einzelnen Nachrichten.	['interface', 'message']	{'interface': 'Schnittstellen', 'message': 'Nachrichten'}	['schnittstelle', 'nachricht']
114	{'deployment': 'Implementierung'}	A pop up informs you about the source updates before you can go with deployment.	Ein Pop-up informiert Sie über die Quellaktualisierungen, bevor Sie mit der Bereitstellung fortfahren können.	['deployment']	{'deployment': 'Bereitstellung'}	['bereitstellung']
115	{'data provider': 'Datenprovider'}	To edit an existing data provider profile, click .	Um ein bestehendes Datenanbieterprofil zu bearbeiten, klicken Sie auf .	['data provider']	{'data provider': 'Datenanbieter'}	['datenanbieter']
116	{'reference': 'Referenz'}	In this app, you can create the reference data that are used for the simulations.	In dieser App können Sie die Referenzdaten erstellen, die für die Simulationen verwendet werden.	['reference']	{'reference': 'Referenzdaten'}	['referenzdaten']
117	{'deployment': 'Implementierung'}	Note that after a redeployment, the persistency is deleted and the data access is changed back to virtual.	Beachten Sie, dass nach einer erneuten Bereitstellung die Persistenz gelöscht wird und der Datenzugriff wieder auf virtuell umgestellt wird.	['deployment']	{'deployment': 'Bereitstellung'}	['bereitstellung']
118	{'release': 'Release'}	Specify date and text information for the release.	Geben Sie Datum und Textinformationen für die Veröffentlichung an.	['release']	{'release': 'Veröffentlichung'}	['veröffentlichung']
119	{'data provider': 'Datenprovider'}	You can search and browse for data products and data providers.	Sie können nach Datenprodukten und Datenanbietern suchen und stöbern.	['data provider']	{'data provider': 'Datenanbietern'}	['datenanbieter']
120	{'deployment': 'Implementierung'}	saving is available but deployment is blocked	Speichern ist möglich, aber die Bereitstellung ist blockiert.	['deployment']	{'deployment': 'Bereitstellung'}	['bereitstellung']
121	{'update': 'aktualisieren'}	You can donwload it to get a data update.	Sie können es herunterladen, um ein Datenupdate zu erhalten.	['update']	{'update': 'Datenupdate'}	['datenupdat']
122	{'skill': 'Qualifikation'}	Skills with a check mark are provided by the resource.	Fähigkeiten, die mit einem Häkchen versehen sind, werden von der Ressource bereitgestellt.	['skill']	{'skill': 'Fähigkeiten'}	['fähigkeit']
123	{'feedback': 'Feedback'}	This provides you feedback on how many entries within the current business entity there are and how many of them match to entries of the target business entity.	Dies gibt Ihnen Feedback darüber, wie viele Einträge in der aktuellen Geschäftseinheit vorhanden sind und wie viele davon mit Einträgen der Zielgeschäftseinheit übereinstimmen.	['feedback']	{'feedback': 'Feedback'}	['feedback']
124	{'data provider': 'Datenprovider'}	The data provider profile page provides additional information about the data provider and other products or product groups.	Die Profilseite des Datenanbieters liefert zusätzliche Informationen über den Datenanbieter sowie über andere Produkte oder Produktgruppen.	['data provider']	{'data provider': 'Datenanbieter'}	['datenanbieter']
125	{'insert': 'einfügen'}	insert privilege is removed from the Space Manager	Die Insert-Berechtigung wurde dem Space Manager entzogen.	['insert']	{'insert': 'Insert-Berechtigung'}	['insert']
126	{'Table': 'Tabelle'}	Remote Table Monitor - short descriptions	Remote-Tabellenmonitor – kurze Beschreibungen	['Table']	{'Table': 'Tabellenmonitor'}	['tabellenmonitor']
127	{'insight': 'Analysen'}	First Steps to Create Insights	Erste Schritte zur Gewinnung von Erkenntnissen	['insight']	{'insight': 'Erkenntnissen'}	['erkenntnis']
128	{'deployment': 'Implementierung'}	[read-only] Displays the deployment and error status of the object.	[Schreibgeschützt] Zeigt den Bereitstellungs- und Fehlerstatus des Objekts an.	['deployment']	{'deployment': 'Bereitstellungs-'}	['bereitstellungsen']
129	{'space': 'Space'}	Keeping an overloaded space active can impact running jobs.	Das Beibehalten eines überlasteten Bereichs kann laufende Jobs beeinträchtigen.	['space']	{'space': 'Bereich'}	['bereich']
130	{'personal data': 'personenbezogene Daten'}	Personal data concerning insurances and bank or credit card accounts	Personenbezogene Daten zu Versicherungen und Bank- oder Kreditkartenkonten	['personal data']	{'personal data': 'Personenbezogene Daten'}	['personenbezogen datum']
131	{'work center': 'Arbeitsplatz'}	Reviewers do not require any work center assignment.	Reviewer benötigen keine Zuordnung zu einem Arbeitsplatz.	['work center']	{'work center': 'Arbeitsplatz'}	['arbeitsplatz']
132	{'create': 'anlegen'}	You can create clauses and signature blocks with this option.	Mit dieser Option können Sie Klauseln und Signaturblöcke erstellen.	['create']	{'create': 'erstellen'}	['erstellen']
133	{'release': 'Release'}	Enter a text briefly describing the data contained in the release, and enter a comment.	Geben Sie einen kurzen Text ein, der die im Release enthaltenen Daten beschreibt, und geben Sie einen Kommentar ein.	['release']	{'release': 'Release'}	['release']
134	{'space': 'Space'}	Create users so you can assign them to a space.	Erstellen Sie Benutzer, damit Sie sie einem Bereich zuordnen können.	['space']	{'space': 'Bereich'}	['bereich']
135	{'business': 'geschäftlich'}	This allows for multiple associations between the same business entities (in different contexts) and provides additional business meaning to the association.	Dies ermöglicht mehrere Beziehungen zwischen denselben Geschäftseinheiten (in unterschiedlichen Kontexten) und verleiht der Beziehung zusätzlichen geschäftlichen Bedeutungsgehalt.	['business']	{'business': 'geschäftlichen'}	['schäftlichen']
136	{'consumption model': 'Verbrauchsmodell'}	The associated business entities will be available as dimensions when you create a consumption model.	Die zugehörigen Geschäftsentitäten stehen beim Erstellen eines Verbrauchsmodells als Dimensionen zur Verfügung.	['consumption model']	{'consumption model': 'Verbrauchsmodell'}	['verbrauchsmodell']
137	{'issue': 'Problem'}	Click an issue.	Klicken Sie auf ein Problem.	['issue']	{'issue': 'Problem'}	['problem']
138	{'consumption model': 'Verbrauchsmodell'}	They allow data to flow into the Business Builder and are combined together to produce fact models and consumption models.	Sie ermöglichen den Datenfluss in den Business Builder und werden kombiniert, um Faktenmodelle und Verbrauchsmodelle zu erstellen.	['consumption model']	{'consumption model': 'Verbrauchsmodelle'}	['verbrauchsmodell']
139	{'start': 'Start'}	Plant stock at start date of reference	Werksbestand zum Referenzstartdatum	['start']	{'start': 'Referenzstartdatum'}	['referenzstartdatum']
140	{'namespace': 'Namespace'}	Enable ABAP Manageable Trigger Namespace	Namespace für ABAP-verwaltbare Trigger aktivieren	['namespace']	{'namespace': '▔'}	['▔ertrat<sos>']
141	{'deployment': 'Implementierung'}	If the view uses other views that were not changed, these views are not touched by the deployment and therefore the persistency is still available.	Wenn eine View andere Views verwendet, die nicht geändert wurden, werden diese Views vom Deployment nicht berührt, und die Persistenz bleibt daher erhalten.	['deployment']	{'deployment': 'Deployment'}	['deployment']
142	{'job': 'Job'}	Using the Time From and Time To fields, you can filter for jobs that have been created between these two points in time.	Mit den Feldern „Zeit von“ und „Zeit bis“ können Sie nach Jobs filtern, die innerhalb dieses Zeitraums erstellt wurden.	['job']	{'job': 'Jobs'}	['job']
143	{'space': 'Space'}	Select a space from the drop-down menu.	Wählen Sie einen Bereich aus dem Dropdown-Menü aus.	['space']	{'space': 'Bereich'}	['bereich']
144	{'space': 'Space'}	A database user lets you ingest data from third-party SQL tools and also allows you to expose your space data to third-party SQL tools.	Ein Datenbankbenutzer ermöglicht es Ihnen, Daten aus SQL-Tools von Drittanbietern zu importieren und Ihre Space-Daten für SQL-Tools von Drittanbietern bereitzustellen.	['space']	{'space': 'Space-Daten'}	['space']
145	{'available capacity': 'Kapazitätsangebot'}	In this popup you can select different periods and change the available capacity of the work center.	In diesem Popup können Sie verschiedene Zeiträume auswählen und die verfügbare Kapazität des Arbeitsplatzes ändern.	['available capacity']	{'available capacity': 'verfügbare Kapazität'}	['verfügbaren kapazität']
146	{'contract': 'Kontrakt'}	For example, while creating a contract, if you need to exit the contract creation process to double-check and clarify certain details, you can select Contract in Preparation.	Zum Beispiel können Sie während der Vertragserstellung, falls Sie den Prozess unterbrechen müssen, um bestimmte Details zu überprüfen und zu klären, die Option „Vertrag in Vorbereitung“ wählen.	['contract']	{'contract': 'Vertrag'}	['vertrag']
147	{'renewal': 'Erneuerung'}	All Dates:You can see all the dates that are auto-generated when the renewal and termination clauses are either defined in the legal transaction or predefined in the context.	Alle Termine: Sie können alle Termine sehen, die automatisch generiert werden, wenn die Verlängerungs- und Kündigungsklauseln entweder in der rechtlichen Transaktion definiert oder im Kontext vordefiniert sind.	['renewal']	{'renewal': 'Verlängerungs-'}	['verlängerungsen']
148	{'data provider': 'Datenprovider'}	The Data Sharing Cockpit is the tool you use as a the data provider.	Das Data Sharing Cockpit ist das Tool, das Sie als Datenanbieter verwenden.	['data provider']	{'data provider': 'Datenanbieter'}	['datenanbieter']
149	{'space': 'Space'}	The business catalog gives you an overview of all the models you can use, across all the Spaces you are authorized for.	Der Geschäftskatalog verschafft Ihnen einen Überblick über alle Modelle, die Sie in allen Spaces, für die Sie autorisiert sind, verwenden können.	['space']	{'space': 'Spaces'}	['space']
150	{'space': 'Platz'}	Check how much spaces the task logs are using on a tenant, and define criteria to manually or automatically delete them.	Überprüfen Sie, wie viel Speicherplatz die Aufgabenprotokolle in einem Mandanten belegen, und definieren Sie Kriterien, um sie manuell oder automatisch zu löschen.	['space']	{'space': 'Speicherplatz'}	['speicherplatz']
151	{'create': 'erstellen'}	With connection type Open Connectors you can now create connections to the third-party data sources available as connector instances with your  account.	Mit dem Verbindungstyp Open Connectors können Sie jetzt Verbindungen zu den in Ihrem Konto als Connector-Instanzen verfügbaren Drittanbieter-Datenquellen herstellen.	['create']	{'create': 'herstellen'}	['herstellen']
152	{'restriction': 'Beschränkung'}	Based on implicit data restrictions, every user has access to the relevant data according to his or her role.	Aufgrund impliziter Datenbeschränkungen hat jeder Benutzer entsprechend seiner oder ihrer Rolle Zugriff auf die relevanten Daten.	['restriction']	{'restriction': 'Datenbeschränkungen'}	['datenbeschränken']
153	{'transfer': 'übertragen'}	Transfer staffing assignments according to your selection criteria.	Übertragen Sie Personalzuweisungen gemäß Ihren Auswahlkriterien.	['transfer']	{'transfer': 'Übertragen'}	['übertragen']
154	{'renewal': 'Erneuerung'}	All Dates:You can see all the dates that are auto-generated when renewal and termination clauses are predefined.	Alle Termine: Sie können alle Termine sehen, die automatisch generiert werden, wenn Verlängerungs- und Kündigungsklauseln vordefiniert sind.	['renewal']	{'renewal': 'Verlängerungs-'}	['verlängerungsen']
155	{'consumption model': 'Verbrauchsmodell'}	Create a fact model to group associated analytical data sets and dimensions together for use in multiple consumption models.	Erstellen Sie ein Faktenmodell, um zugehörige analytische Datensätze und Dimensionen für die Verwendung in mehreren Verbrauchsmodellen zu gruppieren.	['consumption model']	{'consumption model': 'Verbrauchsmodellen'}	['verbrauchsmodellen']
156	{'space': 'Space'}	This is done to prevent over usage of the space.	Dies wird getan, um eine Überbeanspruchung des Raums zu verhindern.	['space']	{'space': 'Raums'}	['raum']
157	{'Services': 'Dienste', 'service': 'Dienst'}	Table Services - Enable the In-Memory Storage option to store the table data directly in memory (see ).	Tabellendienste – Aktivieren Sie die Option „In-Memory-Speicherung“, um die Tabellendaten direkt im Speicher zu speichern (siehe ).	['Services', 'service']	{'Services': 'Dienste', 'service': 'Tabellendienste'}	['dienst', 'tabellendienst']
158	{'reference': 'Verweis'}	Attributes in consumption models can either reference attributes from the included fact or dimension sources or be calculated from other attributes of the current consumption model.	Attribute in Verbrauchsmodellen können entweder auf Attribute aus den enthaltenen Fakt- oder Dimensionsquellen verweisen oder aus anderen Attributen des aktuellen Verbrauchsmodells berechnet werden.	['reference']	{'reference': 'verweisen'}	['verweisen']
159	{'item': 'Element'}	A configuration (or implementation) item may contain implementation steps which are executed in end user apps.	Ein Konfigurations- (oder Implementierungs-)element kann Implementierungsschritte enthalten, die in Endnutzer-Apps ausgeführt werden.	['item']	{'item': 'Element'}	['element']
160	{'space': 'Space'}	Access SAP HANA Deployment Infrastructure containers through  and use your data in the Data Builder or gain access to your space data from your HDI container.	Greifen Sie über … auf SAP HANA Deployment Infrastructure-Container zu und nutzen Sie Ihre Daten im Data Builder, oder greifen Sie aus Ihrem HDI-Container auf die Daten Ihres Spaces zu.	['space']	{'space': 'Spaces'}	['space']
161	{'end user': 'Endbenutzer'}	Because the implementation step is executed in an end user app, the changes are not transportable from the Q system to P system.	Da der Implementierungsschritt in einer Endbenutzer-App ausgeführt wird, können die Änderungen nicht vom Q-System ins P-System transportiert werden.	['end user']	{'end user': 'Endbenutzer-App'}	['endbenutzer']
162	{'creator': 'Creator'}	The BI Content Creator creates and changes stories.	Der BI Content Creator erstellt und ändert Stories.	['creator']	{'creator': 'Creator'}	['creator']
163	{'graphical view': 'grafischer View'}	Click the New Graphical View tile to enter the builder.	Klicken Sie auf die Kachel „Neue grafische Ansicht“, um den Builder zu öffnen.	['graphical view']	{'graphical view': 'grafische Ansicht'}	['grafischen ansicht']
164	{'issue': 'Problem', 'panel': 'Fenster'}	Click a colored cell or the entire row to view more details about the issues and their category in the Issues panel.	Klicken Sie auf eine farbige Zelle oder die gesamte Zeile, um im Bereich „Probleme“ weitere Details zu den Problemen und deren Kategorie anzuzeigen.	['issue', 'panel']	{'issue': 'Probleme', 'panel': 'Bereich'}	['problem', 'bereich']
165	{'bucket': 'Periode'}	The quantities are displayed per month or week (bucket).	Die Mengen werden pro Monat oder Woche (Bucket) angezeigt.	['bucket']	{'bucket': 'Bucket'}	['bucket']
166	{'script': 'Skript'}	SQLScript (Table Function) - Use SQL Script with support for  statements, loops, and other more complex structures.	SQLScript (Tabellenfunktion) – Verwenden Sie SQLScript mit Unterstützung für Anweisungen, Schleifen und andere komplexere Strukturen.	['script']	{'script': 'SQLScript'}	['sqlscript']
167	{'update': 'Aktualisierung'}	No updates are made on your system.	Auf Ihrem System werden keine Updates durchgeführt.	['update']	{'update': 'Updates'}	['update']
168	{'message': 'Nachricht'}	There are six types of messages:	Es gibt sechs Arten von Nachrichten:	['message']	{'message': 'Nachrichten'}	['nachricht']
169	{'space': 'Space'}	The Business Catalog gives an overview of all the models the business user can use, across all the Spaces they are authorized for.	Der Business Catalog bietet einen Überblick über alle Modelle, die der Business-Anwender in allen Spaces, für die er autorisiert ist, verwenden kann.	['space']	{'space': 'Spaces'}	['space']
170	{'trigger': 'Auslöser'}	For more information, see Oracle Trigger-Based Replication in the SAP HANA Smart Data Integration and SAP HANA Smart Data Quality Installation and Configuration Guide.	Weitere Informationen finden Sie unter Oracle-Trigger-basierte Replikation im Installations- und Konfigurationsleitfaden für SAP HANA Smart Data Integration und SAP HANA Smart Data Quality.	['trigger']	{'trigger': 'Trigger-basierte'}	['trigger']
171	{'side panel': 'Seitenbereich'}	Complete or consult other side panel sections as appropriate:	Vervollständigen oder konsultieren Sie bei Bedarf weitere Abschnitte der Seitenleiste:	['side panel']	{'side panel': 'Seitenleiste'}	['seitenleisten']
