	terms	src_raw	mt_raw	src_terms	alg_terms	norm_tgt_terms
94	{'type': 'tipo'}	For Process industry type:	Para el tipo de sector de procesos:	['type']	{'type': 'sector'}	['sector']
95	{'partner': 'socio'}	The advantage of this attribute is that you can refer to certain business partners in one condition by using the correct payment clearing group.	La ventaja de este atributo es que se puede hacer referencia a determinados socios comerciales en una misma condición utilizando el grupo de compensación de pagos adecuado.	['partner']	{'partner': 'socios'}	['socio']
96	{'default': 'estándar'}	The default value is true.	El valor predeterminado es true.	['default']	{'default': 'predeterminado'}	['predeterminado']
97	{'use': 'utilizar'}	In the table you can use the inspector to solve the capacity issues.	En la tabla puedes usar el inspector para resolver los problemas de capacidad.	['use']	{'use': 'usar'}	['usar']
98	{'fee': 'tarifa'}	Every month, you pay the defined monthly fee.	Cada mes, pagas la cuota mensual definida.	['fee']	{'fee': 'cuota'}	['cuota']
99	{'service confirmation': 'notificación de servicio'}	Cancel a service confirmation.	Cancelar la confirmación de un servicio.	['service confirmation']	{'service confirmation': '▔'}	['▔']
100	{'allocation': 'imputación'}	On the Description sheet within the file, you can only use those values which are relevant to the context and universal allocation.	En la hoja Descripción dentro del archivo, solo puedes usar aquellos valores que sean relevantes para el contexto y la asignación universal.	['allocation']	{'allocation': 'asignación'}	['asignación']
101	{'customer': 'deudor'}	Enter the customer/supplier details which you need for subsequent processing according to your individual company's regulations.	Introduzca los detalles del cliente/proveedor que necesita para el procesamiento posterior según las normativas individuales de su empresa.	['customer']	{'customer': 'cliente'}	['cliente']
102	{'item': 'posición'}	Indicates if an item or a step is specific to a localized version	Indica si un elemento o un paso es específico de una versión localizada	['item']	{'item': 'elemento'}	['elemento']
103	{'incident': 'incidencia'}	For the Heath Check Support  access category, the incident ID references SAP internal incidents raised by automatic health checks.	Para la categoría de acceso de Soporte de Comprobación de Salud, el ID de incidente hace referencia a los incidentes internos de SAP generados por las comprobaciones automáticas de salud.	['incident']	{'incident': 'incidente'}	['incidente']
104	{'partner': 'interlocutor'}	In the value help of the new filter, all search results are restricted to the employees responsible for service contracts, excluding those with the business partner role Employment.	En la ayuda de valores del nuevo filtro, todos los resultados de búsqueda se restringen a los empleados responsables de los contratos de servicio, excluyendo a aquellos con el rol de socio comercial Empleo.	['partner']	{'partner': 'socio'}	['socio']
105	{'product type group': 'grupo de clases de producto'}	In the purchase order item, you create a limit item with product type group Service.	En la posición del pedido, se crea una posición de límite con el grupo de tipo de producto Servicio.	['product type group']	{'product type group': 'grupo de tipo de producto'}	['grupo de tipo de producto']
106	{'tab': 'pestaña'}	You can find all shared rules on the Shared Rules tab.	Puedes encontrar todas las Reglas compartidas en la pestaña Reglas compartidas.	['tab']	{'tab': '▔'}	['▔']
107	{'transaction type': 'clase de transacción'}	Please note that for manual bank statements, the system uses the transaction type entered in the manual bank statement.	Por favor, tenga en cuenta que para los extractos bancarios manuales, el sistema utiliza el tipo de transacción ingresado en el extracto bancario manual.	['transaction type']	{'transaction type': 'tipo de transacción'}	['tipo de transacción']
108	{'bill': 'facturar'}	Choose Restrict and verify that the selected items have moved from the To Be Billed tab to the To Be Postponed tab.	Elija Restrict y verifique que las posiciones seleccionadas se hayan movido de la pestaña Por facturar a la pestaña Por posponer.	['bill']	{'bill': '▔'}	['▔']
109	{'issue': 'problema'}	Check, if this mitigates the capacity issue and click Shift Top-Level Demand.	Comprueba si esto mitiga el problema de capacidad y haz clic en Desplazar demanda de nivel superior.	['issue']	{'issue': 'problema'}	['problema']
110	{'output': 'resultado'}	This function enables you to get required output from the left or right formula.	Esta función permite obtener el resultado requerido de la fórmula izquierda o derecha.	['output']	{'output': 'resultado'}	['resultado']
111	{'save': 'guardar'}	You can save a text block as a new variant, to reuse it in different business scenarios.	Puedes guardar un bloque de texto como una nueva variante para reutilizarlo en diferentes escenarios empresariales.	['save']	{'save': 'guardar'}	['guardar']
112	{'use': 'utilizar'}	For a bank account that has been marked as deleted, you can choose the Unmark as Deleted button to reactivate it for use.	Para una cuenta bancaria que se haya marcado como eliminada, puede seleccionar el botón Desmarcar como eliminada para reactivarla y volver a usarla.	['use']	{'use': '▔'}	['▔']
113	{'tab': 'etiqueta'}	To get data on a tab, you need to define the variables for the tabs.	Para obtener datos en una pestaña, debe definir las variables para las pestañas.	['tab']	{'tab': 'pestaña'}	['pestaña']
114	{'check': 'verificación'}	Request a checkup to perform a health diagnostic and better analyze what was wrong with your data flow.	Solicita un chequeo para realizar un diagnóstico de salud y analizar mejor qué estaba mal con tu flujo de datos.	['check']	{'check': 'chequeo'}	['chequeo']
115	{'central contract': 'pedido abierto central'}	That way, if one subsidiary only creates purchase orders for 20% of the total value or quantity agreed in the central contract, the other subsidiary would have the flexibility to order up to 80% if they need to.	De esta manera, si una subsidiaria solo crea órdenes de compra por el 20 % del valor o la cantidad total acordados en el contrato central, la otra subsidiaria tendría la flexibilidad de ordenar hasta el 80 % si lo necesita.	['central contract']	{'central contract': 'contrato central'}	['contrato central']
116	{'work center': 'puesto de trabajo'}	Capacity consumed by the work center to dispatch the order	Capacidad consumida por el centro de trabajo para planificar la orden	['work center']	{'work center': 'centro de trabajo'}	['centro de trabajo']
117	{'inbound': 'entrada'}	Custom communication users are created in the Maintain Communication Users app and are assigned to systems for inbound and outbound communication.	Los usuarios de Comunicación personalizados se crean en la aplicación Mantener Usuarios de Comunicación y se asignan a sistemas para la Comunicación entrante y saliente.	['inbound']	{'inbound': 'entrante'}	['entrante']
118	{'scope': 'alcance', 'use': 'usar'}	Although you can activate individual features, you can use them only if the corresponding parent scope items are also enabled.	Aunque puedes activar funciones individuales, solo puedes usarlas si los elementos del ámbito principal correspondientes están también habilitados.	['scope', 'use']	{'scope': 'ámbito', 'use': 'usarlas'}	['ámbito', 'usar']
119	{'tab': 'pestaña'}	On the To Be Billed tab, select one or more items as required and choose Restrict Date.	En la pestaña Por facturar, seleccione uno o más elementos según sea necesario y elija Restringir fecha.	['tab']	{'tab': 'pestaña'}	['pestaña']
120	{'type': 'clase'}	You can select an allocation type when creating an allocation cycle in the Manage Allocations app.	Puedes seleccionar un tipo de asignación al crear un ciclo de asignación en la aplicación Gestionar asignaciones.	['type']	{'type': 'asignación'}	['asignación']
121	{'sharing': 'compartición'}	Provide and Sell Data Products with the Data Sharing Cockpit	Proporciona y vende productos de datos con el Data Sharing Cockpit	['sharing']	{'sharing': '▔'}	['▔']
122	{'requirement': 'requisitos'}	The projected plant stock can be calculated from the current stock- or requirements situation for the start date of the reference object.	El stock de planta proyectado puede calcularse a partir de la situación actual de existencias o de requisitos para la fecha de inicio del objeto de referencia.	['requirement']	{'requirement': 'requisitos'}	['requisito']
123	{'template': 'plantilla'}	Specifies the level on which you want to share the template.	Especifica el nivel en el que desea compartir la plantilla.	['template']	{'template': 'plantilla'}	['plantilla']
124	{'button': 'pulsador'}	Choose this button if you want to download G/L account mappings into a spreadsheet.	Seleccione este botón si desea descargar las asignaciones de cuentas G/L en una hoja de cálculo.	['button']	{'button': 'botón'}	['botón']
125	{'time': 'tiempo'}	Yes, to allow resources to post time only if they are staffed or assigned to a project.	Sí, para permitir que los recursos reporten tiempo solo si están asignados o adscritos a un proyecto.	['time']	{'time': 'tiempo'}	['tiempo']
126	{'schedule': 'programación'}	To unshare the schedule, just remove the name of the person whose access you want to revoke.	Para dejar de compartir el calendario, simplemente elimina el nombre de la persona a la que deseas revocar el acceso.	['schedule']	{'schedule': 'calendario'}	['calendario']
127	{'source': 'fuente'}	If the panel is not visible, click the Source Browser button in the toolbar to show it.	Si el panel no está visible, haz clic en el botón Navegador de origen en la barra de herramientas para mostrarlo.	['source']	{'source': 'origen'}	['origen']
128	{'usage': 'utilización'}	The system enables the Usage and Availability button only if there's plant information.	El sistema habilita el botón de Uso y Disponibilidad solo si hay información de planta.	['usage']	{'usage': 'Uso'}	['uso']
129	{'measure': 'indicador'}	Based on the Semantic Usage of your entity, review and modify its Columns, Attributes, and/or Measures:	Basado en el uso semántico de su entidad, revise y modifique sus columnas, atributos y/o indicadores:	['measure']	{'measure': 'indicadores'}	['indicador']
130	{'work center': 'puesto de trabajo'}	You can change the work center for order operations that have the processing status Due.	Puedes cambiar el centro de trabajo para las operaciones de orden que tengan el estado de procesamiento vencido.	['work center']	{'work center': 'centro de trabajo'}	['centro de trabajo']
131	{'type': 'clase'}	You can even set the corresponding value for these file types while using the Assembly Automation Levels during the creation of virtual documents.	Incluso puede establecer el valor correspondiente para estos tipos de archivos mientras utiliza los Niveles de Automatización de Ensamblaje durante la creación de documentos virtuales.	['type']	{'type': 'tipos'}	['tipo']
132	{'measure': 'indicador'}	Specify measures, if appropriate, and other aspects of your output structure in the output node.	Especifique medidas, si corresponde, y otros aspectos de la estructura de salida en el nodo de salida.	['measure']	{'measure': 'medidas'}	['medida']
133	{'template': 'plantilla'}	Displays the conditions-related information for a template.	Muestra la información relacionada con las condiciones para una plantilla.	['template']	{'template': 'plantilla'}	['plantilla']
134	{'complete': 'completo', 'save': 'guardar'}	You can then save your current progress even if there are errors due to incomplete entry fields.	Puedes entonces guardar tu progreso actual incluso si hay errores debido a campos de entrada incompletos.	['complete', 'save']	{'complete': 'incompletos', 'save': 'guardar'}	['incompleto', 'guardar']
135	{'business name': 'nombre empresarial'}	By default, you see your object’s business name.	Por defecto, ves el nombre comercial de tu objeto.	['business name']	{'business name': 'nombre comercial'}	['nombre comercial']
136	{'prepayment': 'pago adelantado'}	You can check the amount of planned prepayments by choosing the Prepayment Details in the billing element column.	Puede comprobar el importe de los prepagos planificados seleccionando los Detalles de Prepago en la columna del elemento de facturación.	['prepayment']	{'prepayment': 'Prepago'}	['prepago']
137	{'process step': 'paso de proceso'}	Replace an existing process step	Reemplazar un paso del proceso existente	['process step']	{'process step': 'paso del proceso'}	['paso de proceso']
138	{'schedule': 'programación'}	Reviewers have read-only access to the schedule and cannot see the utilization forecast shown when the schedule is in Scoping or Refinement.	Los revisores tienen acceso de solo lectura al cronograma y no pueden ver el pronóstico de utilización que se muestra cuando el cronograma está en Scoping o Refinement.	['schedule']	{'schedule': 'cronograma'}	['cronograma']
139	{'requirement': 'requisitos'}	The selection criteria is configured using a condition statement defined in the Requirement Filter.	Los criterios de selección se configuran mediante una sentencia de condición definida en el Filtro de Requisitos.	['requirement']	{'requirement': 'Requisitos'}	['requisitos']
140	{'measure': 'indicador'}	You can assign a currency or unit to your measure.	Puedes asignar una moneda o una unidad a tu medida.	['measure']	{'measure': 'medida'}	['medida']
141	{'check': 'Verificar'}	Checking Delivery Details	Verificar Detalles de Entrega	['check']	{'check': 'Verificar'}	['verificar']
142	{'supplement': 'postimputar'}	In general, you should consider whether it is useful to select the Supplement auto. posting option in the master record of the G/L account at all.	En general, debería considerar si resulta útil seleccionar la opción de contabilización automática suplementaria en el registro maestro de la cuenta de mayor.	['supplement']	{'supplement': 'suplementaria'}	['suplementario']
143	{'parallel processing': 'procesamiento paralelo', 'partner': 'socio'}	You can use parallel processing if you want to make changes to a large number of Business partners.	Puede utilizar el procesamiento en paralelo si desea realizar cambios en una gran cantidad de socios comerciales.	['parallel processing', 'partner']	{'parallel processing': 'procesamiento paralelo', 'partner': 'socios'}	['procesamiento paralelo', 'socio']
144	{'performance': 'rendimiento'}	The amounts displayed are calculated at the revenue contract level and are the sum of the amounts of all performance obligations.	Los importes mostrados se calculan a nivel de contrato de ingresos y son la suma de los importes de todas las obligaciones de desempeño.	['performance']	{'performance': 'desempeño'}	['desempeño']
145	{'run': 'ejecutar'}	You run allocation cycles in the Run Allocations app.	Ejecutas ciclos de imputaciones en la aplicación Run Allocations.	['run']	{'run': 'Ejecutas'}	['ejecutas']
146	{'add': 'añadir'}	Select one or multiple purchase requisition items and from the Add to Document drop-down list choose Add to Sourcing Project.	Seleccione uno o varios elementos de la requisición de compra y, en la lista desplegable Agregar al documento, elija Agregar al proyecto de abastecimiento.	['add']	{'add': 'Agregar'}	['agregar']
147	{'button': 'pulsador'}	Check the syntax of the system variable for validity by using the Check syntax of system variable for validity button next to the Value field.	Compruebe la sintaxis de la variable del sistema para verificar su validez utilizando el botón «Comprobar sintaxis de la variable del sistema para verificar la validez» junto al campo Valor.	['button']	{'button': 'botón'}	['botón']
148	{'check': 'Verificar'}	You do not have to actively check the data before importing it.	No tienes que verificar los datos de forma activa antes de importarlos.	['check']	{'check': 'verificar'}	['verificar']
149	{'worklist': 'lista de trabajo'}	Add to Scheduling Worklist	Añadir a la lista de trabajo de programación	['worklist']	{'worklist': 'lista de trabajo'}	['lista de trabajo']
150	{'partner': 'socio'}	Joint Venture Partner	Socio de la venture conjunta	['partner']	{'partner': 'socio'}	['socio']
151	{'site': 'sitio'}	Furthermore, any advertisements or other content hosted on these platforms (for example, suggested videos or by navigating to other videos hosted on the same site), are not within the control or responsibility of SAP.	Además, los anuncios u otros contenidos alojados en estas plataformas (p. ej., videos sugeridos o al navegar hacia otros videos alojados en el mismo sitio) no están bajo el control ni la responsabilidad de SAP.	['site']	{'site': 'sitio'}	['sitio']
152	{'demand-driven': 'orientado a necesidad'}	Select the corresponding checkbox for demand-driven MRP components and/or top-level materials.	Seleccione la casilla correspondiente para los componentes de MRP orientado a la demanda y/o los materiales de nivel superior.	['demand-driven']	{'demand-driven': 'orientado'}	['orientar']
153	{'process step': 'paso del proceso'}	If the action is optional, its execution status does not affect the process step status.	Si la acción es opcional, su estado de ejecución no afecta al estado del paso del proceso.	['process step']	{'process step': 'paso del proceso'}	['paso de proceso']
154	{'SAP affiliate': 'filial de SAP'}	SAP and other SAP products and services mentioned herein as well as their respective logos are trademarks or registered trademarks of SAP SE (or an SAP affiliate company) in Germany and other countries.	Los productos y servicios de SAP y otros productos y servicios de SAP mencionados en el presente, así como sus respectivos logotipos, son marcas comerciales o marcas comerciales registradas de SAP SE (o de una empresa afiliada a SAP) en Alemania y en otros países.	['SAP affiliate']	{'SAP affiliate': 'afiliada SAP'}	['afiliado sap']
155	{'popup': 'popup'}	Click to open the Columns popup in which you can do the following:	Haz clic para abrir la ventana emergente Columnas en la cual puedes hacer lo siguiente:	['popup']	{'popup': 'ventana'}	['ventana']
156	{'partner': 'socio'}	Use the Search field in the popup to search for all business partners or you can use the list available.	Utilice el campo de búsqueda en la ventana emergente para buscar a todos los socios comerciales o puede usar la lista disponible.	['partner']	{'partner': 'socios'}	['socio']
157	{'add': 'añadir'}	You can add items of different types to your sourcing projects.	Puede agregar elementos de diferentes tipos a sus proyectos de licitación.	['add']	{'add': 'agregar'}	['agregar']
158	{'delete': 'eliminar'}	To delete a relationship or to add, edit, or delete an offset for a relationship, right-click the relationship in the chart and select the relevant entry from the context menu.	Para eliminar una relación o agregar, editar o eliminar un desplazamiento de una relación, haga clic con el botón derecho en la relación en el gráfico y seleccione la entrada correspondiente en el menú contextual.	['delete']	{'delete': 'eliminar'}	['eliminar']
159	{'partner': 'socio'}	If you choose a business partner in the Issuing Authority field, this value will be copied into the Issuing Organization field.	Si seleccionas un socio comercial en el campo Autoridad emisora, este valor se copiará en el campo Organización emisora.	['partner']	{'partner': 'socio'}	['socio']
160	{'lock': 'bloquear'}	Before blocking or deleting of personal data, you must define the residence time and retention periods in SAP Information Lifecycle Management (ILM) for the corresponding ILM objects.	Antes de bloquear o eliminar datos personales, debe definir el tiempo de residencia y los períodos de retención en SAP Information Lifecycle Management (ILM) para los objetos ILM correspondientes.	['lock']	{'lock': 'bloquear'}	['bloquear']
161	{'template': 'plantilla'}	Download and upload template for cycle and segment definitions.	Descargar y subir plantilla para definiciones de ciclos y segmentos.	['template']	{'template': 'plantilla'}	['plantilla']
162	{'allocation': 'imputación'}	Cycle ID, Allocation Context, Ledger, Valid From.	ID de ciclo, Contexto de asignación, Libro mayor, Válido desde.	['allocation']	{'allocation': 'asignación'}	['asignación']
163	{'allocation': 'imputación'}	Allocation types are a summary of the processes that can take place during allocation.	Los tipos de asignación son un resumen de los procesos que pueden tener lugar durante la asignación.	['allocation']	{'allocation': 'asignación'}	['asignación']
164	{'termination': 'rescisión'}	You can predefine the renewal and termination clauses for legal transactions at the context level.	Puede predefinir las cláusulas de renovación y terminación para las transacciones legales a nivel de contexto.	['termination']	{'termination': 'terminación'}	['terminación']
165	{'use case': 'caso de utilización'}	Spaces are environments that bring data models, connections, compute and storage resources together for a specific line of business or use-case.	Los espacios son entornos que reúnen modelos de datos, conexiones y recursos de cómputo y almacenamiento para una línea de negocio o caso de uso específica.	['use case']	{'use case': 'caso de uso'}	['caso de uso']
166	{'delete': 'eliminar'}	Then you can simply delete it from this menu.	Entonces simplemente puedes eliminarlo desde este menú.	['delete']	{'delete': 'eliminarlo'}	['eliminar']
167	{'source': 'fuente'}	In the Import Users dialog, choose Select Source File to upload your CSV file.	En el cuadro de diálogo Importar usuarios, elija Seleccionar archivo de origen para cargar su archivo CSV.	['source']	{'source': 'origen'}	['origen']
168	{'range': 'intervalo'}	Specify a data range, which is the time period for the data.	Especifique un rango de datos, que es el período de tiempo para los datos.	['range']	{'range': 'rango'}	['rango']
169	{'process step': 'paso del proceso'}	After verifying the business process step execution manually and finding it compatible, you can set the status to Verified by User.	Una vez verificada manualmente la ejecución del paso del proceso empresarial y comprobada su compatibilidad, puedes establecer el estado en Verificado por el Usuario.	['process step']	{'process step': 'paso del proceso'}	['paso de proceso']
170	{'default': 'estándar'}	By default, Yes is selected for this field, which means that cash flows whose actual liquidity item are different from the ones proposed by the machine learning service are displayed.	De forma predeterminada, Sí está seleccionado para este campo, lo que significa que se muestran los flujos de efectivo cuyo elemento de liquidez real es diferente de los propuestos por el servicio de aprendizaje automático.	['default']	{'default': '▔'}	['▔']
171	{'item set': 'conjunto de posiciones'}	If you copy an item set, all subordinate items are copied as well.	Si haces una copia de un conjunto de posiciones, todas las posiciones subordinadas también se copian.	['item set']	{'item set': 'conjunto de posiciones'}	['conjunto de posición']
172	{'explosion': 'desglose', 'tab': 'pestaña'}	On choosing the Summarized Explosion tab, the table provides the following details:	Al elegir la pestaña de Explosión Resumida, la tabla proporciona los siguientes detalles:	['explosion', 'tab']	{'explosion': 'Explosión', 'tab': 'pestaña'}	['explosión', 'pestaña']
173	{'worklist': 'lista de trabajo'}	Choose Add to Scheduling Worklist to add a settlement date to a scheduling worklist.	Elija Agregar a la lista de trabajo de programación para agregar una fecha de liquidación a una lista de trabajo de programación.	['worklist']	{'worklist': 'lista de trabajo'}	['lista de trabajo']
174	{'worklist': 'lista de trabajo'}	You can then decide to choose an existing scheduling worklist or create a new one.	Luego puedes decidir elegir una lista de trabajo de programación existente o crear una nueva.	['worklist']	{'worklist': 'lista de trabajo'}	['lista de trabajo']
175	{'data controller': 'responsable del tratamiento'}	The personal data used to complete the process is predefined in a purpose, which is defined by the data controller.	Los datos personales utilizados para completar el proceso están predefinidos en un objetivo, que es definido por el responsable del tratamiento de datos.	['data controller']	{'data controller': 'responsable datos'}	['responsable dato']
176	{'client application': 'aplicación cliente'}	If you are using OAuth 2.0 you must provide the following information to your client application:	Si está utilizando OAuth 2.0, debe proporcionar la siguiente información a su aplicación cliente:	['client application']	{'client application': 'aplicación cliente'}	['aplicación cliente']
177	{'view type': 'clase de vista'}	The lower-level bars visible in expanded view always show assignment information, regardless of the view type you set for the top-level bars.	Las barras de nivel inferior visibles en la vista expandida siempre muestran información de asignación, independientemente del tipo de vista que establezcas para las barras de nivel superior.	['view type']	{'view type': 'tipo de vista'}	['tipo de vista']
178	{'save': 'guardar'}	If needed, you can change a team's global ID before you save a team's definition.	Si es necesario, puede cambiar el ID global de un equipo antes de guardar la definición del equipo.	['save']	{'save': 'guardar'}	['guardar']
179	{'job': 'job'}	Activate this field to run this job in online mode.	Active este campo para ejecutar este trabajo en modo en línea.	['job']	{'job': 'trabajo'}	['trabajo']
