	terms	src_raw	mt_raw	src_terms	alg_terms	norm_tgt_terms
284	{'flow': 'flow'}	The package contains the following iFlows:	El paquete contiene los siguientes iFlows:	['flow']	{'flow': 'iFlows'}	['iflows']
285	{'aggregate': 'agregar'}	Aggregate Notifications shows whether the notifications to be sent are aggregated (Yes) or separate for each situation instance (No).	Notificaciones agregadas muestra si las notificaciones que se enviarán están agregadas (Sí) o son individuales para cada instancia de situación (No).	['aggregate']	{'aggregate': 'agregadas'}	['agregar']
286	{'add': 'añadir'}	In the Data Access Controls section, you can add one or more data access controls to apply row-based security and control access to individual rows based on various criteria.	En la sección Controles de Acceso a Datos, puede añadir uno o más controles de acceso a datos para aplicar seguridad basada en filas y controlar el acceso a filas individuales según distintos criterios.	['add']	{'add': 'añadir'}	['añadir']
287	{'transaction type': 'tipo de transacción'}	Billed Transaction Type	Tipo de transacción facturada	['transaction type']	{'transaction type': 'transacción'}	['transacción']
288	{'save': 'guardar'}	Click Save and Publish.	Haga clic en Guardar y Publicar.	['save']	{'save': 'Guardar'}	['guardar']
289	{'layout': 'disposición', 'save': 'guardar'}	Together with other layout settings, you can save board settings as variants by using the My Views dropdown at the top left of the Kanban Board.	Junto con otras opciones de diseño, puedes guardar las opciones del tablero como variantes usando el menú desplegable Mis vistas en la parte superior izquierda del Kanban Board.	['layout', 'save']	{'layout': 'diseño', 'save': 'guardar'}	['diseño', 'guardar']
290	{'shipment': 'envío'}	Select one of the following the shipment types:	Seleccione uno de los siguientes tipos de envío:	['shipment']	{'shipment': 'envío'}	['envío']
291	{'role': 'rol'}	Choose Add Role.	Elija Añadir rol.	['role']	{'role': 'rol'}	['rol']
292	{'type': 'tipo'}	New Order Type	Nuevo tipo de orden	['type']	{'type': 'tipo'}	['tipo']
293	{'item': 'artículo'}	Remove an Item	Eliminación de un elemento	['item']	{'item': 'elemento'}	['elemento']
294	{'template': 'plantilla'}	There are two templates:	Hay dos plantillas:	['template']	{'template': 'plantillas'}	['plantilla']
295	{'template': 'plantilla'}	Choose Template Structure.	Seleccione la estructura de plantilla.	['template']	{'template': 'plantilla'}	['plantilla']
296	{'endpoint': 'punto de acceso'}	This endpoint is optional.	Este endpoint es opcional.	['endpoint']	{'endpoint': 'endpoint'}	['endpoint']
297	{'schedule': 'programación'}	Sharing a Schedule	Compartir un horario	['schedule']	{'schedule': 'horario'}	['horario']
298	{'grid': 'cuadrícula'}	Number of Grids	Cantidad de Cuadrículas	['grid']	{'grid': 'Cuadrículas'}	['cuadrículas']
299	{'add': 'agregar'}	Adding these roles has the following effects:	Agregar estos roles tiene los siguientes efectos:	['add']	{'add': 'Agregar'}	['agregar']
300	{'goods receipt processing time': 'tiempo de procesamiento de entradas de mercancías'}	The goods receipt processing time is two days.	El tiempo de procesamiento de la recepción de mercancías es de dos días.	['goods receipt processing time']	{'goods receipt processing time': 'recepción de mercancías'}	['recepción de mercancía']
301	{'step': 'paso'}	Choose Connect Step.	Seleccione Connect Step.	['step']	{'step': 'Step'}	['step']
302	{'shipment': 'envío', 'type': 'tipo'}	Select one of the following shipment types:	Seleccione uno de los siguientes tipos de envío:	['shipment', 'type']	{'shipment': 'envío', 'type': 'tipos'}	['envío', 'tipo']
303	{'type': 'clase'}	Configure Condition Type	Configurar tipo de condición	['type']	{'type': 'tipo'}	['tipo']
304	{'schedule': 'programa'}	Choose Realign Schedules.	Selecciona Realinear programaciones.	['schedule']	{'schedule': 'programaciones'}	['programación']
305	{'tab': 'pestaña'}	Select the Keys tab.	Seleccione la pestaña Keys.	['tab']	{'tab': 'pestaña'}	['pestaña']
306	{'partner': 'socio', 'rating': 'calificación'}	Business Partner Rating	Calificación de socio comercial	['partner', 'rating']	{'partner': 'socio', 'rating': 'Calificación'}	['socio', 'calificación']
307	{'partner': 'socio'}	A recovery indicator (RI) is assigned to the cost object to indicate whether expenses posted using the cost object are billable to Joint Venture partners.	Se asigna un indicador de recuperación (RI) al objeto de costos para indicar si los gastos contabilizados utilizando el objeto de costos son facturables a los socios de la empresa conjunta.	['partner']	{'partner': 'socios'}	['socio']
308	{'drawing': 'sorteo'}	The utilization of a facility is called a drawing.	La utilización de una instalación se llama dibujo.	['drawing']	{'drawing': 'dibujo'}	['dibujo']
309	{'delete': 'eliminar'}	Delete a user	Eliminar un usuario	['delete']	{'delete': 'Eliminar'}	['eliminar']
310	{'partner': 'socio'}	Central Business Partner	Socio comercial central	['partner']	{'partner': 'Socio'}	['socio']
311	{'bill': 'cuenta'}	For more information, see Deletion of Bill Items.	Para más información, consulte Eliminación de partidas de factura.	['bill']	{'bill': 'factura'}	['factura']
312	{'work center': 'puesto de trabajo'}	Check the forecasted work center utilization at week level	Verificar la utilización prevista del centro de trabajo a nivel semanal	['work center']	{'work center': 'centro de trabajo'}	['centro de trabajo']
313	{'tab': 'pestaña'}	The Service Margins tab contains the following detail tabs where you can review the data:	La pestaña Márgenes de Servicio contiene las siguientes pestañas de detalle donde puedes revisar los datos:	['tab']	{'tab': 'pestañas'}	['pestaña']
314	{'report': 'informe'}	Report Contact Person	Persona de contacto del informe	['report']	{'report': 'informe'}	['informe']
315	{'tab': 'pestaña'}	The tool includes the following tabs:	La herramienta incluye las siguientes pestañas:	['tab']	{'tab': 'pestañas'}	['pestaña']
316	{'edit': 'editar'}	Edit an application	Editar una aplicación	['edit']	{'edit': 'Editar'}	['editar']
317	{'partner': 'socio'}	Business partner name	Nombre del socio	['partner']	{'partner': 'socio'}	['socio']
318	{'partner': 'socio'}	Contract Account Partner	Socio de cuenta de contrato	['partner']	{'partner': 'Socio'}	['socio']
319	{'partner': 'socio'}	Bank Business Partner	Socio comercial de banco	['partner']	{'partner': 'Socio'}	['socio']
320	{'display': 'visualización'}	Display Contract Account	Mostrar cuenta de contrato	['display']	{'display': 'cuenta'}	['cuenta']
321	{'partner': 'socio'}	Business partner item	Posición de socio comercial	['partner']	{'partner': 'socio'}	['socio']
322	{'goods receipt processing time': 'tiempo de procesamiento de entradas de mercancías'}	The goods receipt processing time is one day.	El tiempo de procesamiento del recibo de bienes es un día.	['goods receipt processing time']	{'goods receipt processing time': 'recibo de bienes'}	['recibo de bien']
323	{'tab': 'pestaña'}	Situation Monitoring - MST Tab	Supervisión de la situación - Pestaña MST	['tab']	{'tab': 'pestaña'}	['pestaña']
324	{'flow': 'flujo'}	The following flow logic applies:	Se aplica la siguiente lógica de flujo:	['flow']	{'flow': 'flujo'}	['flujo']
325	{'deselect': 'anular la selección'}	You can select and deselect individual objects, or types of objects (for example, Models or Stories).	Puede seleccionar y deseleccionar objetos individuales, o tipos de objetos (por ejemplo, Modelos o Historias).	['deselect']	{'deselect': 'deseleccionar'}	['deseleccionar']
326	{'delete': 'eliminar'}	If you update and redeploy an existing persistent view, the persistency is deleted and the data access is changed back to virtual.	Si actualizas y vuelves a implementar una vista persistente existente, la persistencia se eliminará y el acceso a los datos volverá a ser virtual.	['delete']	{'delete': 'eliminará'}	['eliminará']
327	{'tab': 'pestaña'}	Icon on the tab indicates the following:	El ícono en la pestaña indica lo siguiente:	['tab']	{'tab': 'pestaña'}	['pestaña']
328	{'requirement': 'necesidad'}	Characteristic Value Combination per Requirement	Combinación de valores de características por requisito	['requirement']	{'requirement': 'requisito'}	['requisito']
329	{'quota': 'cuota'}	Lists all quotas that match your filter criteria.	Enumera todas las cuotas que coinciden con tus criterios de filtro.	['quota']	{'quota': 'cuotas'}	['cuota']
330	{'add': 'añadir'}	Click to add a constraint.	Haga clic para añadir una restricción.	['add']	{'add': 'añadir'}	['añadir']
331	{'measure': 'medida'}	The query provides the following measures:	La consulta proporciona las siguientes medidas:	['measure']	{'measure': 'medidas'}	['medida']
332	{'tab': 'pestaña'}	Error Logs Tab	Pestaña de registros de errores	['tab']	{'tab': 'Pestaña'}	['pestaña']
333	{'delete': 'borrar'}	Delete a Story	Eliminar una historia	['delete']	{'delete': 'Eliminar'}	['eliminar']
334	{'partner': 'socio'}	Business Partner Address	Dirección del socio comercial	['partner']	{'partner': 'socio'}	['socio']
335	{'edit': 'tratar'}	Editing a Card	Tratar una tarjeta	['edit']	{'edit': 'tarjeta'}	['tarjeta']
336	{'add': 'añadir'}	Click Add Condition.	Haga clic en Agregar condición.	['add']	{'add': 'Agregar'}	['agregar']
337	{'type': 'clase'}	Cash Pool Type	Tipo de cash pool	['type']	{'type': 'tipo'}	['tipo']
338	{'button': 'botón'}	Create a group using the Add button	Crea un grupo usando el botón Añadir	['button']	{'button': 'Añadir'}	['añadir']
339	{'partner': 'socio'}	Business Partner, Trader	Socio comercial, Comerciante	['partner']	{'partner': 'Socio'}	['socio']
340	{'reporting': 'reporting'}	Predefined Reporting Activities	Actividades de informes predefinidas	['reporting']	{'reporting': 'informes'}	['informe']
341	{'report': 'report'}	To use this report, proceed as follows:	Para utilizar este informe, proceda de la siguiente manera:	['report']	{'report': 'informe'}	['informe']
342	{'extension': 'extensión'}	For more information, see Key User Extension.	Para más información, consulte Key User Extension.	['extension']	{'extension': 'Extension'}	['extension']
343	{'display': 'visualización'}	Display User Operations	Mostrar operaciones de usuario	['display']	{'display': 'Mostrar'}	['mostrar']
344	{'delete': 'eliminar'}	Delete a Scope	Eliminar un alcance	['delete']	{'delete': 'eliminar'}	['eliminar']
345	{'mass processing': 'procesamiento en masa'}	Mass Processing - Start	Procesamiento masivo - Inicio	['mass processing']	{'mass processing': 'Procesamiento masivo'}	['procesamiento masivo']
346	{'business unit': 'unidad empresarial'}	Business Unit Key.	Clave de Unidad de Negocio.	['business unit']	{'business unit': 'Unidad Negocio'}	['unidad negocio']
347	{'measure': 'indicador'}	To define additional measures:	Para definir medidas adicionales:	['measure']	{'measure': 'medidas'}	['medida']
348	{'tab': 'pestaña'}	The Maintenance Order Operations tab shows operations and suboperations that are included in the filtered orders, even if the performing work centers is a different one.	La pestaña Operaciones de la Orden de Mantenimiento muestra las operaciones y suboperaciones incluidas en las órdenes filtradas, incluso si el centro de trabajo que las ejecuta es diferente.	['tab']	{'tab': 'pestaña'}	['pestaña']
349	{'reset': 'Anulación'}	You can use the Reset Cleared Items app to do the following:	Puede utilizar la aplicación Reset Cleared Items para hacer lo siguiente:	['reset']	{'reset': 'Reset'}	['reset']
350	{'completed': 'concluido'}	It is not possible to change a completed business document that contains a blocked business partner.	No es posible cambiar un documento comercial completado que contenga un socio comercial bloqueado.	['completed']	{'completed': 'completado'}	['completar']
351	{'expiration': 'vencimiento', 'contract': 'pedido abierto'}	Expiration of Central Purchase Contract	Expiración del contrato de pedido central	['expiration', 'contract']	{'expiration': 'Expiración', 'contract': 'contrato'}	['expiración', 'contrato']
352	{'usage': 'uso'}	Provides additional information about the metering of usage.	Proporciona información adicional sobre la medición del uso.	['usage']	{'usage': 'uso'}	['uso']
353	{'move': 'mover'}	Move an order operation to another date	Mover una operación de pedido a otra fecha	['move']	{'move': 'mover'}	['mover']
354	{'supply': 'suministrar'}	Use this for supplying materials in the production area itself.	Utilice esto para suministrar materiales en la propia área de producción.	['supply']	{'supply': 'suministrar'}	['suministrar']
355	{'step': 'etapa'}	Transfer Step Description	Descripción del paso de transferencia	['step']	{'step': 'paso'}	['paso']
356	{'approval': 'autorización', 'Approval': 'Autorización'}	Supplier Approval Process	Proceso de aprobación de proveedores	['approval', 'Approval']	{'approval': 'aprobación', 'Approval': 'aprobación'}	['aprobación', 'aprobación']
357	{'use': 'utilización'}	Use of Payment Advices	Uso de avisos de pago	['use']	{'use': 'uso'}	['uso']
358	{'delete': 'eliminar'}	Then choose Delete.	Luego seleccione Eliminar.	['delete']	{'delete': 'Eliminar'}	['eliminar']
359	{'business location': 'ubicación'}	ID Business location	ID de la ubicación del negocio	['business location']	{'business location': 'ubicación negocio'}	['ubicación negocio']
360	{'about': 'info'}	About Journal Entries	Acerca de los asientos	['about']	{'about': 'Acerca'}	['acerca']
361	{'tab': 'pestaña'}	On this tab you can check the status of your data deliveries.	En esta pestaña puedes verificar el estado de tus entregas de datos.	['tab']	{'tab': 'pestaña'}	['pestaña']
362	{'report': 'informe'}	Run the report.	Ejecute el informe.	['report']	{'report': 'informe'}	['informe']
363	{'default': 'valor predeterminado'}	Default value for	Valor predeterminado para	['default']	{'default': 'predeterminado'}	['predeterminado']
364	{'job': 'trabajo'}	Creating the Job	Crear el trabajo	['job']	{'job': 'trabajo'}	['trabajo']
365	{'scope': 'alcance'}	Creating a Scope	Creación de un alcance	['scope']	{'scope': 'alcance'}	['alcance']
366	{'save': 'guardar'}	Edit the business and/or technical names as appropriate and click Save.	Edite los nombres comerciales y/o técnicos según corresponda y haga clic en Guardar.	['save']	{'save': 'Guardar'}	['guardar']
367	{'report': 'report'}	You can use this report for the following purposes:	Puede usar este informe para los siguientes propósitos:	['report']	{'report': 'informe'}	['informe']
368	{'save': 'guardar', 'add': 'agregar'}	Click Add to save your comments.	Haga clic en Agregar para guardar sus comentarios.	['save', 'add']	{'save': 'guardar', 'add': 'Agregar'}	['guardar', 'agregar']
369	{'job': 'tarea'}	You can also choose to run the job immediately.	También puedes optar por ejecutar el trabajo inmediatamente.	['job']	{'job': 'trabajo'}	['trabajo']
370	{'show': 'mostrar'}	Show configuration steps	Mostrar los pasos de configuración	['show']	{'show': 'Mostrar'}	['mostrar']
371	{'use': 'utilizar'}	Reuse Data Model	Reutilizar modelo de datos	['use']	{'use': 'modelo'}	['modelo']
372	{'save': 'guardar'}	Choose Save to save the edited chart.	Seleccione Guardar para guardar el gráfico editado.	['save']	{'save': 'guardar'}	['guardar']
373	{'save': 'guardar'}	If you want to save for future subscriptions you can use the bookmark feature contained in Data Marketplace.	Si deseas guardar para futuras suscripciones, puedes usar la función de marcador que se encuentra en Data Marketplace.	['save']	{'save': 'guardar'}	['guardar']
374	{'item': 'artículo'}	Enter a name and description for the line item.	Introduzca un nombre y una descripción para el artículo de línea.	['item']	{'item': 'artículo'}	['artículo']
375	{'deployment': 'implementación'}	Deployment and Activation	Despliegue y activación	['deployment']	{'deployment': 'Despliegue'}	['despliegue']
376	{'measure': 'indicador'}	Facts need least one measure.	Los hechos necesitan al menos una medida.	['measure']	{'measure': 'medida'}	['medida']
377	{'administration': 'administración'}	Administration in Spaces	Administración en espacios	['administration']	{'administration': 'Administración'}	['administración']
378	{'partner': 'socio'}	Business Partner Approach	Enfoque de Socio Comercial	['partner']	{'partner': 'Socio'}	['socio']
379	{'partner': 'socio'}	Business Partner Position	Posición de Socio Comercial	['partner']	{'partner': 'Socio'}	['socio']
380	{'partner': 'socio'}	Business Partner Overview	Resumen del socio asociado	['partner']	{'partner': 'socio'}	['socio']
381	{'average': 'media'}	ADU = Average daily usage	ADU = Utilización diaria promedio	['average']	{'average': 'promedio'}	['promedio']
382	{'partner': 'socio'}	Business Partner Category	Tipo de socio de negocios	['partner']	{'partner': 'socio'}	['socio']
383	{'measure': 'indicador'}	For measures, proceed as follows:	Para las medidas, proceda de la siguiente manera:	['measure']	{'measure': 'medidas'}	['medida']
384	{'data warehouse': 'data warehouse'}	Data Warehouse Data Access Control	Control de acceso a los datos del Almacén de Datos	['data warehouse']	{'data warehouse': 'Almacén'}	['almacén']
385	{'collection': 'recopilación'}	Data Collection Status	Estado de la recopilación de datos	['collection']	{'collection': 'recopilación'}	['recopilación']
386	{'item': 'artículo'}	Duplicate an Item	Duplicar un elemento	['item']	{'item': 'elemento'}	['elemento']
387	{'remove': 'quitar'}	Remove an Account	Eliminar una cuenta	['remove']	{'remove': 'Eliminar'}	['eliminar']
388	{'rating': 'valoración'}	Choose the Rating.	Haga clic en la calificación.	['rating']	{'rating': 'calificación'}	['calificación']
389	{'tile': 'mosaico'}	Choose (Remove) at the top right corner of the tile.	Selecciona (Quitar) en la esquina superior derecha de la ficha.	['tile']	{'tile': 'ficha'}	['ficha']
390	{'default': 'valor predeterminado'}	The default value here is DEFAULT.	El valor predeterminado aquí es DEFAULT.	['default']	{'default': 'predeterminado'}	['predeterminado']
391	{'qualifier': 'cualificador'}	What are the event qualifiers?	¿Cuáles son los calificadores del evento?	['qualifier']	{'qualifier': 'calificadores'}	['calificador']
392	{'delete': 'eliminar'}	Select the key and click on Delete.	Seleccione la clave y haga clic en Eliminar.	['delete']	{'delete': 'Eliminar'}	['eliminar']
393	{'tab': 'pestaña'}	The following options are available on the Advanced tab :	Las siguientes opciones están disponibles en la pestaña Avanzado:	['tab']	{'tab': 'pestaña'}	['pestaña']
394	{'role': 'rol'}	You need the DW Administrator role to create a database user group.	Se necesita el rol DW Administrator para crear un grupo de usuarios de base de datos.	['role']	{'role': 'rol'}	['rol']
395	{'partner': 'socio'}	Total Business Partners:	Total de socios comerciales:	['partner']	{'partner': 'socios'}	['socio']
396	{'edit': 'editar'}	Edit purchase orders	Editar órdenes de compra	['edit']	{'edit': 'Editar'}	['editar']
397	{'tab': 'pestaña'}	You use the UI Section tab to do the following:	Utilizas la pestaña Sección de la IU para hacer lo siguiente:	['tab']	{'tab': 'pestaña'}	['pestaña']
398	{'link': 'enlace'}	For more information, refer to the related links.	Para obtener más información, consulte los enlaces relacionados.	['link']	{'link': 'enlaces'}	['enlace']
399	{'source': 'fuente'}	Mapping Source Value	Valor de origen del mapeo	['source']	{'source': 'origen'}	['origen']
400	{'type': 'tipo'}	The following document types are currently not supported in version 2:	Los siguientes tipos de documentos no son compatibles actualmente en la versión 2:	['type']	{'type': 'tipos'}	['tipo']
401	{'elimination': 'compensación'}	Which fields are required for using the FS item in performing consolidation tasks, for example, the field Partner Unit is required for receivable and payable items to perform the elimination of interunit payables and receivables.	¿Qué campos se requieren para la utilización del ítem FS al realizar tareas de consolidación? Por ejemplo, el campo Unidad de la contraparte (Partner Unit) es obligatorio para las partidas de cuentas por cobrar y por pagar con el fin de llevar a cabo la eliminación de cuentas por cobrar y por pagar entre unidades.	['elimination']	{'elimination': 'eliminación'}	['eliminación']
402	{'link': 'vínculo'}	The system creates these links automatically.	El sistema crea estos enlaces automáticamente.	['link']	{'link': 'enlaces'}	['enlace']
403	{'dashboard': 'dashboard', 'tab': 'pestaña'}	Input Parameters for the Data Sources of the Dashboard Tabs	Parámetros de entrada para las fuentes de datos de las pestañas del panel	['dashboard', 'tab']	{'dashboard': 'panel', 'tab': 'pestañas'}	['panel', 'pestaña']
404	{'partner': 'socio'}	Business Partner Integration	Integración de socios partner	['partner']	{'partner': 'socio'}	['socio']
405	{'set': 'definir'}	You can then set the following parameters:	Luego puedes configurar los siguientes parámetros:	['set']	{'set': 'configurar'}	['configurar']
406	{'report': 'informe'}	You can executed the report manually.	Puedes ejecutar el informe manualmente.	['report']	{'report': 'informe'}	['informe']
407	{'benefits': 'ventajas'}	This provides the following benefits:	Esto proporciona los siguientes beneficios:	['benefits']	{'benefits': 'beneficios'}	['beneficio']
408	{'business rule': 'regla empresarial'}	Creation of data controller - Using the self-service configuration app -The business Rule ID should be unique.	Creación del controlador de datos - Utilizando la aplicación de configuración de autoservicio -El ID de la regla de negocio debe ser único.	['business rule']	{'business rule': 'regla negocio'}	['regla negocio']
409	{'partner': 'socio'}	You can restrict the selection by entering specific business partners.	Puede restringir la selección introduciendo socios comerciales específicos.	['partner']	{'partner': 'socios'}	['socio']
410	{'tab': 'pestaña'}	The worklist area contains the following tabs:	El área de lista de trabajo contiene las siguientes pestañas:	['tab']	{'tab': 'pestañas'}	['pestaña']
411	{'add': 'agregar'}	Choose Add Inside.	Seleccione Agregar Dentro.	['add']	{'add': 'Agregar'}	['agregar']
412	{'partner': 'socio'}	Partner End Point	Punto final del socio	['partner']	{'partner': 'socio'}	['socio']
413	{'issue': 'emisión'}	Ready for Issue:	Listo para emisión:	['issue']	{'issue': 'emisión'}	['emisión']
414	{'partner': 'socio', 'type': 'tipo'}	Identifies the type of the business partner.	Identifica el tipo de socio comercial.	['partner', 'type']	{'partner': 'socio', 'type': 'socio'}	['socio', 'socio']
415	{'tab': 'pestaña'}	These tabs are described in the the following table.	Estas pestañas se describen en la siguiente tabla.	['tab']	{'tab': 'pestañas'}	['pestaña']
416	{'partner': 'socio'}	Business partner number	Número de socio comercial	['partner']	{'partner': 'socio'}	['socio']
417	{'partner': 'socio'}	Business partner master	Maestro de socios comerciales	['partner']	{'partner': 'socios'}	['socio']
418	{'explosion': 'desglose'}	BOM explosion rule	Regla de explosión de LMat	['explosion']	{'explosion': 'explosión'}	['explosión']
419	{'completed': 'completado', 'purpose': 'propósito'}	Business Purpose Completed	Propósito comercial cumplido	['completed', 'purpose']	{'completed': 'cumplido', 'purpose': 'cumplido'}	['cumplir', 'cumplir']
420	{'company role': 'rol de empresa'}	Enter company role.	Introduzca el rol en la empresa.	['company role']	{'company role': 'rol empresa'}	['rol empresa']
421	{'partner': 'socio'}	Selected Business Partners:	Socios comerciales seleccionados:	['partner']	{'partner': 'Socios'}	['socios']
422	{'usage': 'utilización'}	Address Communication Usage	Dirección Comunicación Uso	['usage']	{'usage': 'Uso'}	['uso']
423	{'template': 'plantilla'}	Create a new transaction template	Crear una nueva plantilla de transacción	['template']	{'template': 'plantilla'}	['plantilla']
424	{'enhancement': 'mejora'}	The new enhancements include the following:	Las nuevas mejoras incluyen lo siguiente:	['enhancement']	{'enhancement': 'mejoras'}	['mejora']
425	{'target': 'objetivo'}	It represents the difference between actual cost and target cost.	Representa la diferencia entre el costo real y el costo objetivo.	['target']	{'target': 'objetivo'}	['objetivo']
426	{'range': 'intervalo'}	By default, the start date of the Period Range selection takes the current date.	Por defecto, la fecha de inicio de la selección del rango de período adopta la fecha actual.	['range']	{'range': 'rango'}	['rango']
427	{'flow': 'flow'}	It is the name of the workflow.	Es el nombre del flujo de trabajo.	['flow']	{'flow': 'flujo'}	['flujo']
428	{'process template': 'modelo de proceso'}	Select a process template	Seleccione una plantilla de proceso	['process template']	{'process template': 'plantilla de proceso'}	['plantilla de proceso']
429	{'benefits': 'ventajas'}	Benefits of SAP Analytics Cloud	Beneficios de SAP Analytics Cloud	['benefits']	{'benefits': 'Beneficios'}	['beneficios']
430	{'rate': 'tarifa'}	Create rate tables	Crear tablas de tarifas	['rate']	{'rate': 'tarifas'}	['tarifa']
431	{'schedule': 'programación'}	Review the schedule.	Revise el horario.	['schedule']	{'schedule': 'horario'}	['horario']
432	{'delete': 'eliminar'}	Delete a Term	Borrar un término	['delete']	{'delete': 'Borrar'}	['borrar']
433	{'business entity': 'entidad empresarial', 'site': 'sitio'}	Business entity (site)	Entidad empresarial (sitio)	['business entity', 'site']	{'business entity': 'Entidad empresarial', 'site': 'sitio'}	['entidad empresarial', 'sitio']
