	terms	src_raw	mt_raw	src_terms	alg_terms	norm_tgt_terms
0	{'pane': 'область'}	To add notes, choose a template and open the Notes pane on the left side of the screen.	Чтобы добавить заметки, выберите шаблон и откройте область заметок на левой стороне экрана.	['pane']	{'pane': 'область'}	['область']
1	{'contract': 'контракт'}	Specifies the number of the contract from which you can select service items.	Указывает номер договора, из которого можно выбрать позиции услуг.	['contract']	{'contract': 'договора'}	['договор']
2	{'type': 'вид'}	This field is defaulted to the current date and the Return by date field will be a default number of days, defined in customizing (e.g. 30 days for default document type e-bgs), after the handover date.	Это поле по умолчанию заполняется текущей датой, а поле «Возврат до» будет рассчитываться как стандартное количество дней, определённое в настройках (например, 30 дней для стандартного типа документа e-bgs), от даты передачи.	['type']	{'type': 'типа'}	['тип']
3	{'revenue': 'выручка'}	The behavior of this budgetary setting is however differently interpreted for accounts classified as 'Expense'’ or 'Revenue' types.	Поведение этой бюджетной настройки, тем не менее, трактуется по-разному для счетов, классифицированных как типы «Расходы» или «Доходы».	['revenue']	{'revenue': '▔'}	['▔']
4	{'update': 'обновить'}	You can select which operations (Create, Update and/or Delete) are allowed for each subnode as well as the root node by ticking the corresponding boxes.	Вы можете выбрать, какие операции (Создать, Обновить и/или Удалить) разрешены для каждого подузла, а также для корневого узла, установив соответствующие флажки.	['update']	{'update': 'Обновить'}	['обновить']
5	{'range': 'интервал'}	Within a time range	В пределах временного диапазона	['range']	{'range': 'диапазона'}	['диапазон']
6	{'provider': 'провайдер'}	You can bookmarks your favorite data products or data providers.	Вы можете добавлять в закладки ваши любимые продукты данных или поставщиков данных.	['provider']	{'provider': 'поставщиков'}	['поставщик']
7	{'provider': 'провайдер'}	The Provider Name must be unique.	Имя поставщика должно быть уникальным.	['provider']	{'provider': 'поставщика'}	['поставщик']
8	{'branch': 'перейти'}	Branching directly to the object pages of the relevant business objects.	Переход соответствующих к страницам объектов нужных бизнес-объектов.	['branch']	{'branch': 'Переход'}	['переход']
9	{'type': 'вид'}	Specifies the type of the items that you want to add to your sourcing project.	Определяет тип элементов, которые вы хотите добавить в ваш проект закупок.	['type']	{'type': 'тип'}	['тип']
10	{'input': 'ввод'}	If an input record is matched to more than one lookup records with a score reaching this threshold, it is placed in the Multiple results category.	Если входная запись сопоставляется более чем с одной поисковой записью с оценкой, достигающей этого порога, она помещается в категорию «Несколько результатов».	['input']	{'input': 'входная'}	['входной']
11	{'type': 'вид'}	If you want the automated reprocessing rule to post your bank statement items in only one step, select 001 (One-Step Posting) as the value of the Procedure Type field.	Если вы хотите, чтобы правило автоматической обработки проводило позиции банковской выписки всего в один этап, выберите значение 001 (Одноэтапное проведение) в поле «Тип процедуры».	['type']	{'type': 'Тип'}	['тип']
12	{'type': 'вид'}	Depending on your scope, this app can check different types of source documents in your predictive accounting process.	В зависимости от объёма охвата это приложение может проверять различные типы исходных документов в процессе прогнозного учёта.	['type']	{'type': 'типы'}	['тип']
13	{'purpose': 'цель'}	As a rule, the purpose references the relevant legal basis for the processing of personal data.	Как правило, цель ссылается на соответствующее правовое основание для обработки персональных данных.	['purpose']	{'purpose': 'цель'}	['цель']
14	{'type': 'тип'}	Risk type of this obligation that denotes the risk of the legal document if this obligation is not fulfilled	Тип риска этого обязательства, который обозначает риск юридического документа, если это обязательство не будет выполнено	['type']	{'type': 'Тип'}	['тип']
15	{'type': 'тип'}	Enter a meaningful code that will help you to identify the clause type.	Введите осмысленный код, который поможет вам определить тип клаузы.	['type']	{'type': 'тип'}	['тип']
16	{'public': 'общедоступный'}	If you're using a network firewall with a proxy, you need to provide the public IPv4 address of your proxy.	Если вы используете сетевой брандмауэр с прокси, вам необходимо указать публичный IPv4-адрес вашего прокси.	['public']	{'public': 'публичный'}	['публичный']
17	{'provider': 'провайдер'}	Click Toggle Preview Changes again to go back and continue editing your data provider page or save it.	Нажмите «Переключить режим предпросмотра изменений» ещё раз, чтобы вернуться и продолжить редактирование страницы вашего поставщика данных или сохранить её.	['provider']	{'provider': 'поставщика'}	['поставщик']
18	{'input': 'ввод'}	Select the Projection operator from the toolbar and drop it in the canvas and then connect a sources or other node to it as input.	Выберите оператор Projection на панели инструментов, перетащите его на рабочее поле и затем подключите к нему источники или другой узел в качестве входа.	['input']	{'input': 'входа'}	['вход']
19	{'type': 'тип'}	Depending on the contract type and the pricing model used for the data product, different information can be shown:	В зависимости от типа контракта и используемой модели ценообразования для продукта данных может отображаться различная информация:	['type']	{'type': 'типа'}	['тип']
20	{'postponed': 'отсрочено'}	Unbilled | Postponed | Write Off	Не выставлено | Отложено | Списано	['postponed']	{'postponed': 'Отложено'}	['отложить']
21	{'provider': 'провайдер'}	To edit an existing data provider profile, click .	Чтобы отредактировать существующий профиль поставщика данных, нажмите .	['provider']	{'provider': 'поставщика'}	['поставщик']
22	{'regulation': 'предписание'}	If you enter a text and you want to print documents in different languages, select a regulation and navigate to the Classify Dangerous Good - Packaged Product app.	Если вы вводите текст и хотите распечатать документы на разных языках, выберите регламент и перейдите в приложение «Классификация опасного груза — упакованный продукт».	['regulation']	{'regulation': 'регламент'}	['регламент']
23	{'provider': 'провайдер'}	To set a data provider or data product as a bookmark, just click on the bookmark icon on the corresponding data provider or data product page.	Чтобы добавить поставщика данных или продукт данных в закладки, просто нажмите на значок закладки на соответствующей странице поставщика данных или продукта данных.	['provider']	{'provider': 'поставщика'}	['поставщик']
24	{'input': 'ввод'}	The join operator requires two inputs and it generates a single output.	Оператор соединения требует два входа и генерирует один выход.	['input']	{'input': 'входа'}	['вход']
25	{'output': 'вывод'}	Adds an Unmatched Record column to the intelligent lookup output.	Добавляет столбца несопоставленных записей в вывод интеллектуального поиска.	['output']	{'output': 'вывод'}	['вывод']
26	{'billing': 'расчет'}	In work packages that are billed against a time and expense contract, only billable postings are considered for billing.	В рабочих пакетах, выставляемых по договору типа «время и расходы», для выставления счёта учитываются только подлежащие оплате проводки.	['billing']	{'billing': '▔'}	['▔']
27	{'explosion': 'разузлование'}	On choosing the Summarized Explosion tab, the table provides the following details:	При выборе вкладки «Сводный взрыв» таблица предоставляет следующие данные:	['explosion']	{'explosion': 'взрыв'}	['взрыв']
28	{'association': 'связь'}	An association describes the relation between business entities.	Ассоциация описывает отношение между бизнес-сущностями.	['association']	{'association': 'Ассоциация'}	['ассоциация']
29	{'group': 'группировать'}	Select Group By criteria:	Выберите критерия группировки:	['group']	{'group': 'группировки'}	['группировка']
30	{'type': 'вид'}	Some of the notification preferences that you set affect all types of notifications, while others are specific to a notification type.	Некоторые из настроек уведомлений, которые вы устанавливаете, влияют на все типы уведомлений, тогда как другие применяются только к определённому типу уведомления.	['type']	{'type': 'типу'}	['тип']
31	{'contract': 'договор'}	A contract asset is your company’s right to consideration in exchange for goods or services that your company has transferred to a customer when that right is conditioned on something other than the passage of time (for example, your company’s future performance).	Актив по договору — это право вашей компании на возмещение в обмен на товары или услуги, которые ваша компания передала клиенту, когда это право обусловлено чем-то, кроме течения времени (например, будущим выполнением вашей компанией своих обязательств).	['contract']	{'contract': 'договору'}	['договор']
32	{'scope': 'объем'}	The Custom Code Migration app allows you to add or remove request entry points to/from the scope manually.	Приложение Custom Code Migration позволяет вручную добавлять или удалять точки входа запросов из области действия.	['scope']	{'scope': 'области'}	['область']
33	{'add-on': 'дополнение'}	SAP Digital Payments Add-On processes the payments and makes them available for the payment advice notes.	Дополнение SAP для цифровых платежей обрабатывает платежи и делает их доступными для платёжных уведомлений.	['add-on']	{'add-on': 'Дополнение'}	['дополнение']
34	{'mapping': 'сопоставление'}	If switched on, it indicates that each data record of the currently opened business entity finds a match in the selected target business entity with the configured key mapping.	При включении это указывает, что каждая запись данных текущей открытой бизнес-сущности находит соответствие в выбранной целевой бизнес-сущности в соответствии с настроенным сопоставлением ключей.	['mapping']	{'mapping': '▔'}	['▔']
35	{'summary': 'сводка'}	Summary of rules and settings that enable allocations.	Краткое изложение правил и настроек, позволяющих производить распределения.	['summary']	{'summary': 'изложение'}	['изложение']
36	{'global currency': 'валюта отчетности'}	Global Currency – The currency that has been configured for the controlling area.	Глобальная валюта - валюта, настроенная для контроллинговой области.	['global currency']	{'global currency': 'Глобальная валюта'}	['глобальный валюта']
37	{'space': 'пространство'}	You can delete audit logs when needed, which will free up disk space.	Вы можете удалить журналы аудита при необходимости, что освободит место на диске.	['space']	{'space': 'место'}	['место']
38	{'edit': 'редактировать'}	Edit, Save and Activate	Редактировать, Сохранить и Активировать	['edit']	{'edit': 'Редактировать'}	['редактировать']
39	{'space': 'пространство'}	Spaces send queries or jobs to the database.	Пространства отправляют запросы или задания в базу данных.	['space']	{'space': 'Пространства'}	['пространство']
40	{'schedule': 'планирование'}	This is why SAP Data Warehouse Cloud has now a log deletion schedule activated by default.	Именно поэтому в SAP Data Warehouse Cloud теперь по умолчанию активировано расписание удаления журналов.	['schedule']	{'schedule': 'расписание'}	['расписание']
41	{'input': 'ввод'}	The inputs must match in number of the columns, names, data types, and order of corresponding columns.	Входные данные должны совпадать по количеству столбцов, названиям, типам данных и порядку соответствующих столбцов.	['input']	{'input': 'данные'}	['дать']
42	{'service entry sheet': 'ведомость учета услуг'}	Using the filter criterion Origin, you can decide which service entry sheets are to be displayed in the list.	С помощью критерия фильтра «Происхождение» вы можете определить, какие листы ввода услуг будут отображаться в списке.	['service entry sheet']	{'service entry sheet': 'листы ввода услуг'}	['лист ввод услуга']
43	{'provider': 'провайдер'}	Thanks to the product page created by the data provider you get detailed information on the data product and eventually access to sample data, if available.	Благодаря странице продукта, созданной поставщиком данных, вы можете получить подробную информацию о продукте данных и, при наличии, доступ к образцам данных.	['provider']	{'provider': 'поставщиком'}	['поставщик']
44	{'provider': 'провайдер'}	You can search and browse for data products and data providers.	Вы можете искать и просматривать продукты данных и провайдеров данных.	['provider']	{'provider': 'провайдеров'}	['провайдер']
45	{'range': 'интервал'}	View material consumption or availability for a given time range.	Просматривайте потребление материала или его доступность за заданный период времени.	['range']	{'range': '▔'}	['▔']
46	{'input': 'ввод'}	If an input record is matched to more than one lookup records with a score between this threshold and the Matched Records Score, it is placed in the Multiple results category.	Если входная запись соответствует более чем одной записи поиска с оценкой, находящейся между этим пороговым значением и оценкой совпавших записей, она помещается в категорию «Несколько результатов».	['input']	{'input': 'входная'}	['входной']
47	{'type': 'вид'}	You can add items of different types to your sourcing projects.	Вы можете добавлять элементы разных типов в свои проекты закупок.	['type']	{'type': 'типов'}	['тип']
48	{'schedule': 'планирование'}	Select the relevant persisted view and create a simple or recurring schedule for your view.	Выберите соответствующее устойчивое представление и создайте для вашего представления простое или регулярное расписание.	['schedule']	{'schedule': 'расписание'}	['расписание']
49	{'data provider': 'провайдер данных'}	To be able to use the data product, the data provider will send an activation key via email that provides authorization to access one or multiple data products.	Чтобы иметь возможность использовать продукт данных, поставщик данных отправит по электронной почте активационный ключ, который предоставляет полномочия для доступа к одному или нескольким продуктам данных.	['data provider']	{'data provider': 'поставщик данных'}	['поставщик данные']
50	{'residence period': 'период активного хранения'}	At the end of the longest configured residence period, the data is blocked or deleted.	По окончании самого длительного активного периода хранения данные блокируются или удаляются.	['residence period']	{'residence period': 'активного периода хранения'}	['активный период хранение']
51	{'suspension': 'приостановление'}	Suspension of JVA Projects, Partners, and Equity Groups	Приостановка проектов JVA, партнеров и групп участия	['suspension']	{'suspension': 'Приостановка'}	['приостановка']
52	{'project type': 'тип проекта'}	Sourcing Project, Sourcing Project Name, Sourcing Project Type, Central Company Code, Central Purchasing Group, Central Purchasing Organization, Material Group, Currency, Purchasing Responsible, Status.	Проект закупки, Наименование проекта закупки, Тип проекта закупки, Центральный код балансовой единицы, Центральная закупочная группа, Центральная закупочная организация, Группа материалов, валюта, Ответственный за закупку, Статус	['project type']	{'project type': 'Тип проекта'}	['тип проект']
53	{'wizard': 'ассистент'}	Click ImportImport Permissions to open the Import Permissions wizard and follow the instructions.	Нажмите ImportImport полномочий, чтобы открыть мастер импорта полномочий и следуйте инструкциям.	['wizard']	{'wizard': 'мастер'}	['мастер']
54	{'flow': 'поток'}	By switching to the lineage view, you can trace the data provisioning and flow of a model.	Перейдя к просмотру lineage, вы сможете проследить предоставление данных и поток модели.	['flow']	{'flow': 'поток'}	['поток']
55	{'mapping': 'сопоставление'}	Choose Define Mapping to assign the fields of your user data from the CSV file to the fields in user management.	Выберите «Определить сопоставление», чтобы сопоставить поля ваших данных пользователей из CSV файла с полями в управлении пользователями.	['mapping']	{'mapping': 'сопоставление'}	['сопоставление']
56	{'due date': 'дата исполнения'}	The app displays all tasks (together with their attributes, such as title, type, status, due date, processor, etc.), and sorts them by due date so that all overdue and due tasks are displayed at a first place.	Приложение отображает все задачи (вместе с их атрибутами, такими как название, тип, статус, срок исполнения, исполнитель и т.д.) и сортирует их по сроку исполнения так, что все просроченные и задачи со сроком отображаются в первую очередь.	['due date']	{'due date': 'сроку исполнения'}	['срок исполнение']
57	{'tag': 'отметить'}	Select one or more entries to tag your products with related SAP applications.	Выберите одну или несколько записей, чтобы пометить ваши продукты связанными приложениями SAP.	['tag']	{'tag': 'пометить'}	['пометить']
58	{'provider': 'провайдер'}	The provider has removed the data product from the available data product list.	Поставщик удалил продукт данных из списка доступных продуктов.	['provider']	{'provider': 'Поставщик'}	['поставщик']
59	{'transaction': 'транзакция'}	Source Reference Transaction	Исходная ссылочная транзакция	['transaction']	{'transaction': 'транзакция'}	['транзакция']
60	{'custom field': 'пользовательское поле'}	Publishing or deletion of at least one custom field failed.	Не удалось опубликовать или удалить как минимум одно пользовательское поле.	['custom field']	{'custom field': 'пользовательское поле'}	['пользовательский поле']
61	{'pane': 'область'}	Additionally, the structure pane contains the options for template rules and text blocks rules.	Кроме того, панель структуры содержит параметры правил шаблонов и правил текстовых блоков.	['pane']	{'pane': 'панель'}	['панель']
62	{'residence period': 'период активного хранения'}	The residence period is part of the overall retention period.	Период проживания является частью общего периода хранения.	['residence period']	{'residence period': 'Период проживания'}	['период проживание']
63	{'part': 'деталь'}	Adds the selected part or assembly to the Target (In Work) Panel.	Добавляет выбранную деталь или сборку в панель назначения (в работе).	['part']	{'part': 'деталь'}	['деталь']
