	terms	src_raw	mt_raw	src_terms	alg_terms	norm_tgt_terms
287	{'access control': 'Zugriffskontrolle'}	The column containing users ids must be selected as the Principal Name Column in your data access control.	Die Spalte, die die Benutzer-IDs enthält, muss in Ihrer Datenzugangskontrolle als Principal-Name-Spalte ausgewählt werden.	['access control']	{'access control': 'Datenzugangskontrolle'}	['datenzugangskontrolle']
288	{'notification': 'Benachrichtigung'}	List of Notifications	Liste der Benachrichtigungen	['notification']	{'notification': 'Benachrichtigungen'}	['benachrichtigung']
289	{'create': 'anlegen'}	Click AddCreate User.	Klicken Sie auf „AddCreate User“.	['create']	{'create': 'Create'}	['create']
290	{'space': 'Space'}	Save your space.	Sparen Sie Platz.	['space']	{'space': 'Platz'}	['platz']
291	{'document': 'Beleg'}	Documents - Communication Status	Dokumente – Kommunikationsstatus	['document']	{'document': 'Dokumente'}	['dokument']
292	{'request': 'Antrag'}	Click Submit Request.	Klicken Sie auf „Anfrage einreichen“.	['request']	{'request': 'Anfrage'}	['anfrage']
293	{'grouping rule': 'Gruppierungsregel'}	You can trigger the creation of new grouping rules, search for existing grouping rules, and delete grouping rules that are no longer required.	Sie können die Erstellung neuer Gruppierungsregeln auslösen, nach bestehenden Gruppierungsregeln suchen und Gruppierungsregeln löschen, die nicht mehr benötigt werden.	['grouping rule']	{'grouping rule': 'Gruppierungsregeln'}	['grupperungsregeln']
294	{'execute': 'ausführen'}	Check the status before you execute changes.	Überprüfen Sie den Status, bevor Sie Änderungen ausführen.	['execute']	{'execute': 'ausführen'}	['ausführen']
295	{'asset': 'Anlage'}	Navigate from Asset Depreciation Values.	Von Anlagenabschreibungswerten aus navigieren.	['asset']	{'asset': 'Anlagen'}	['anlage']
296	{'assignment': 'Einsatz'}	You have the following options to show assignment changes:	Sie haben folgende Optionen, um Zuweisungsänderungen anzuzeigen:	['assignment']	{'assignment': 'Zuweisungsänderungen'}	['zuweisunänderungen']
297	{'requirement': 'Bedarf'}	Create a Custom Requirement	Erstellen Sie eine benutzerdefinierte Anforderung	['requirement']	{'requirement': 'Anforderung'}	['anforderung']
298	{'comment': 'Comment'}	Click to add file comment	Klicken Sie, um einen Kommentar zur Datei hinzuzufügen	['comment']	{'comment': 'Kommentar'}	['kommentar']
299	{'Procedure': 'Verfahren', 'create': 'erstellen'}	This procedure provides the option to create SAP HANA virtual tables in the open SQL schema that refer to objects in data lake.	Dieses Verfahren bietet die Möglichkeit, virtuelle SAP HANA-Tabellen im Open-SQL-Schema zu erstellen, die auf Objekte im Data Lake verweisen.	['Procedure', 'create']	{'Procedure': 'Verfahren', 'create': 'erstellen'}	['verfahren', 'erstellen']
300	{'cost component': 'Kostenkomponente'}	Enter the name of the cost component in the Name field.	Geben Sie den Namen der Kostenkomponente im Feld „Name“ ein.	['cost component']	{'cost component': 'Kostenkomponente'}	['kostenkomponenten']
301	{'issue': 'Issue'}	Create an issue:	Ein Issue erstellen:	['issue']	{'issue': 'Issue'}	['yssuen']
302	{'query': 'Abfrage'}	Save the query.	Speichern Sie die Abfrage.	['query']	{'query': 'Abfrage'}	['abfrage']
303	{'workflow': 'Workflow', 'create': 'anlegen'}	Create Workflow for Sourcing Projects	Erstellen Sie einen Workflow für Beschaffungsprojekte.	['workflow', 'create']	{'workflow': 'Workflow', 'create': 'Erstellen'}	['workflow', 'erstellen']
304	{'scope': 'Umfang'}	Delete a scope.	Einen Geltungsbereich löschen.	['scope']	{'scope': 'Geltungsbereich'}	['geltungsbereich']
305	{'space': 'Space'}	Save the space.	Halte den Platz frei.	['space']	{'space': 'Platz'}	['platz']
306	{'tenant': 'Mandant'}	URL of the SuccessFactors Employee Central tenant	URL des SuccessFactors Employee Central-Mandanten	['tenant']	{'tenant': 'Mandanten'}	['mandant']
307	{'status': 'Status'}	Indicates the current status of a master data record.	Gibt den aktuellen Status eines Stammdatensatzes an.	['status']	{'status': 'Status'}	['status']
308	{'stage': 'Abschnitt'}	Navigate to Stages.	Navigieren Sie zu Stages.	['stage']	{'stage': 'Stages'}	['stages']
309	{'source': 'Source'}	Activation of Data Source:	Aktivierung der Datenquelle:	['source']	{'source': 'Datenquelle'}	['datenquellen']
310	{'level': 'Stufe'}	Packaging levels are used for the following purposes:	Verpackungsebenen werden für folgende Zwecke verwendet:	['level']	{'level': 'Ebenen'}	['ebene']
311	{'create': 'erstellen'}	Create a Target Table in Data Flow	Erstellen einer Zieltabelle in Data Flow	['create']	{'create': 'Erstellen'}	['erstellen']
312	{'mapping': 'Zuordnung'}	Enter an optional description for the mapping.	Geben Sie eine optionale Beschreibung für die Zuordnung ein.	['mapping']	{'mapping': 'Zuordnung'}	['zuordnung']
313	{'location': 'Ort'}	Specify the locations for the following options:	Geben Sie die Standorte für die folgenden Optionen an:	['location']	{'location': 'Standorte'}	['standort']
314	{'classification': 'Klassifikation'}	· Select Classification	· Klassifizierung auswählen	['classification']	{'classification': 'Klassifizierung'}	['klassifizierung']
315	{'document type': 'Dokumentart'}	To specify the document type as scheduling agreement.	Um die Belegart als Lieferplan festzulegen.	['document type']	{'document type': 'Belegart'}	['belegart']
316	{'term': 'Term'}	Enter the term.	Geben Sie den Begriff ein.	['term']	{'term': 'Begriff'}	['begriff']
317	{'create': 'erstellen'}	Go to the Filter tab Select Create filter and define your filter conditions:	Gehen Sie zur Registerkarte „Filter“, wählen Sie „Filter erstellen“ und definieren Sie Ihre Filterbedingungen:	['create']	{'create': 'erstellen'}	['erstellen']
318	{'schedule': 'Terminplan'}	Review the schedule.	Überprüfen Sie den Zeitplan.	['schedule']	{'schedule': 'Zeitplan'}	['zeitplan']
319	{'release': 'Release'}	Edit a Release	Eine Veröffentlichung bearbeiten	['release']	{'release': 'Veröffentlichung'}	['veröffentlichung']
320	{'limit': 'Grenzwert'}	For clearing, the lower of the limit defined for your user and the limit defined for your business partner applies.You can also define amount limits for your Financial Accounting users.	Beim Clearing gilt das niedrigere Limit aus dem für Ihren Benutzer definierten Limit und dem für Ihren Geschäftspartner definierten Limit. Sie können außerdem Betragsgrenzen für Ihre Finanzbuchhaltungsbenutzer festlegen.	['limit']	{'limit': 'Limit'}	['limit']
321	{'Group': 'Group', 'group': 'group'}	For more information, see Service Group Publishing.	Weitere Informationen finden Sie unter Service Group Publishing.	['Group', 'group']	{'Group': 'Group', 'group': 'Group'}	['group', 'group']
322	{'income': 'Einnahmen'}	Format for Income Classification	Format für die Einkommensklassifizierung	['income']	{'income': 'Einkommen'}	['einkommen']
323	{'access control': 'Zugriffskontrolle'}	You must select one or more columns containing filter criteria as Output Columns in your data access control.	Sie müssen eine oder mehrere Spalten, die Filterkriterien enthalten, als Ausgabespalten in Ihrer Datenzugriffskontrolle auswählen.	['access control']	{'access control': 'Datenzugriffskontrolle'}	['datenzugriffskontrollen']
324	{'space': 'Space'}	Name of the space the product belongs to.	Name des Bereichs, zu dem das Produkt gehört.	['space']	{'space': 'Bereich'}	['bereich']
325	{'restriction': 'Einschränkung'}	Restrictions on Capture:	Einschränkungen bei der Erfassung:	['restriction']	{'restriction': 'Einschränkungen'}	['einschränkung']
326	{'item': 'Element'}	Long descriptions are available for the following items:	Lange Beschreibungen sind für die folgenden Artikel verfügbar:	['item']	{'item': 'Artikel'}	['artikel']
327	{'schedule': 'Zeitplan'}	Save the schedule.	Speichere den Zeitplan.	['schedule']	{'schedule': 'Zeitplan'}	['zeitplan']
328	{'owner': 'Eigentümer'}	Click Select Owner.	Klicken Sie auf „Besitzer auswählen“.	['owner']	{'owner': 'Besitzer'}	['besitzer']
329	{'sequence': 'Abfolge'}	Clear as Sequence	Als Sequenz löschen	['sequence']	{'sequence': 'Sequenz'}	['sequenz']
330	{'joint venture accounting': 'Joint Venture Accounting', 'Accounting': 'Accounting'}	Setting up Joint Venture Accounting Cost Objects:	Einrichten von Kostenobjekten für die Joint-Venture-Buchhaltung:	['joint venture accounting', 'Accounting']	{'joint venture accounting': 'Joint-Venture-Buchhaltung', 'Accounting': 'Buchhaltung'}	['joint', 'buchhaltung']
331	{'load': 'Load'}	Download the following files:	Laden Sie die folgenden Dateien herunter:	['load']	{'load': 'Laden'}	['laden']
332	{'template': 'Vorlage'}	For more information about creating an equipment template, see .	Weitere Informationen zum Erstellen einer Ausrüstungsvorlage finden Sie unter .	['template']	{'template': 'Ausrüstungsvorlage'}	['ausrüstungsvorlage']
333	{'batch': 'Batch', 'call': 'Call'}	On the SAP Easy Access menu, choose  Joint venture accounting  Actual posting  Cash call batch ses.	Im SAP Easy-Access-Menü wählen Sie Joint Venture Accounting → Istbuchung → Cash-Call-Batch-Sitzung.	['batch', 'call']	{'batch': 'Cash-Call-Batch-Sitzung', 'call': 'Sitzung'}	['cash', 'sitzung']
334	{'type': 'Typ'}	Profile types include the following:	Zu den Profiltypen gehören die folgenden:	['type']	{'type': 'Profiltypen'}	['profiltypen']
335	{'project manager': 'Projektleiter', 'requested': 'angefragt'}	It allows you to create an assignment exactly as requested by the project manager.This action is available if the project manager requested a specific resource and no resource has been assigned to the request yet.	Damit können Sie eine Zuweisung genau so erstellen, wie sie vom Projektmanager angefordert wurde. Diese Aktion ist verfügbar, wenn der Projektmanager eine bestimmte Ressource angefordert hat und der Anforderung noch keine Ressource zugewiesen wurde.	['project manager', 'requested']	{'project manager': 'Projektmanager', 'requested': 'angefordert'}	['projektmanager', 'anfordern']
336	{'document class': 'Belegklasse', 'select': 'auswählen'}	The characteristic value columns list the values that have been maintained for the characteristics defined for the document class.You can select the characteristic value by entering the value manually (possible entries are then suggested by the app) or, alternatively, by choosing the value in the subsequent characteristic dialog screen.	Die Spalten für die Merkmalswerte zeigen die Werte an, die für die im Dokumenttyp definierten Merkmale gepflegt wurden. Sie können den Merkmalswert entweder auswählen, indem Sie ihn manuell eingeben (die App schlägt dann mögliche Einträge vor), oder alternativ, indem Sie den Wert im anschließenden Merkmalsdialog auswählen.	['document class', 'select']	{'document class': 'Dokumenttyp', 'select': 'auswählen'}	['dokumenttyp', 'auswählen']
337	{'action': 'Aktion', 'Action': 'Aktion'}	This column shows you if quick actions are available for a resource request.If a quick action is available, a link is shown.	Diese Spalte zeigt Ihnen, ob Schnellaktionen für eine Ressourcenanfrage verfügbar sind. Wenn eine Schnellaktion verfügbar ist, wird ein Link angezeigt.	['action', 'Action']	{'action': 'Schnellaktionen', 'Action': 'Schnellaktionen'}	['schnellaktion', 'schnellaktion']
338	{'obsolete': 'obsolet'}	Indicates whether the MRS item is obsolete.	Gibt an, ob das MRS-Element veraltet ist.	['obsolete']	{'obsolete': 'veraltet'}	['veraltet']
339	{'release': 'Release'}	Locking a Release	Sperren eines Releases	['release']	{'release': 'Releases'}	['release']
340	{'audit log': 'Audit-Protokoll'}	Audit log missing detailed information	Im Audit-Log fehlen detaillierte Informationen.	['audit log']	{'audit log': 'Audit-Log'}	['audit']
341	{'transaction': 'Transaktion'}	<description of the transaction>	<Beschreibung der Transaktion>	['transaction']	{'transaction': 'Transaktion'}	['transaktion']
342	{'apply': 'anwenden'}	Click Apply to save your new tile.	Klicken Sie auf Anwenden, um Ihre neue Kachel zu speichern.	['apply']	{'apply': 'Anwenden'}	['anwenden']
343	{'space': 'Space'}	The following views are made available in this space:	Die folgenden Ansichten werden in diesem Raum bereitgestellt:	['space']	{'space': 'Raum'}	['raum']
344	{'section': 'Abschnitt'}	In the Trusted Origins section, choose between the following options:	Wählen Sie im Abschnitt „Vertrauenswürdige Ursprünge“ zwischen den folgenden Optionen:	['section']	{'section': 'Abschnitt'}	['abschnitt']
345	{'operation': 'Vorgang'}	The dependencies are assigned to the operation.	Die Abhängigkeiten sind der Operation zugeordnet.	['operation']	{'operation': 'Operation'}	['operation']
346	{'template': 'Vorlage'}	Doc.Template Name in Structure	Dokumentvorlagenname in der Struktur	['template']	{'template': 'Dokumentvorlagenname'}	['dokumentvorlagenname']
347	{'primary contact': 'Hauptansprechpartner'}	Primary Contact Indicator	Kennzeichen für den Hauptansprechpartner	['primary contact']	{'primary contact': 'Hauptansprechpartner'}	['hauptansprechpartner']
348	{'message': 'Nachricht'}	These messages are enabled by default.	Diese Meldungen sind standardmäßig aktiviert.	['message']	{'message': 'Meldungen'}	['meldung']
349	{'transfer': 'Übertragung', 'check': 'Prüfung'}	Open Check and Transfer of Staffing Assignments.	Prüfung und Übertragung von Personaleinsätzen öffnen	['transfer', 'check']	{'transfer': 'Übertragung', 'check': 'Prüfung'}	['übertragung', 'prüfung']
350	{'compliance requirement': 'Compliance-Anforderung'}	Tasks are created in the compliance requirement.	Aufgaben werden in der Compliance-Anforderung erstellt.	['compliance requirement']	{'compliance requirement': 'Compliance-Anforderung'}	['compliance']
351	{'run': 'Lauf'}	Run In Simulation	In der Simulation ausführen	['run']	{'run': 'ausführen'}	['ausführen']
352	{'transfer amount': 'Überweisungsbetrag'}	Cash Pool Minimum Transfer Amount	Mindestüberweisungsbetrag im Cash Pool	['transfer amount']	{'transfer amount': 'Mindestüberweisungsbetrag'}	['mindestüberweisungsbetragen']
353	{'unit of measure': 'Mengeneinheit'}	This class is used to convert a quantity from one unit of measurement to another.	Diese Klasse wird verwendet, um eine Größe von einer Maßeinheit in eine andere umzuwandeln.	['unit of measure']	{'unit of measure': 'Maßeinheit'}	['maßeinheit']
354	{'project manager': 'Projektleiter', 'requested': 'angefragt', 'staffed': 'Person zugeordnet'}	If a resource has been requested and the request has not yet been staffed, you'll see a Quick Assignment link in the Actions column.This allows you to create the assignment exactly as requested by the project manager.	Wenn eine Ressource angefordert wurde und die Anfrage noch nicht besetzt ist, sehen Sie in der Spalte „Aktionen“ einen Link „Schnellzuweisung“. Dadurch können Sie die Zuweisung genau so erstellen, wie sie vom Projektmanager angefordert wurde.	['project manager', 'requested', 'staffed']	{'project manager': 'Projektmanager', 'requested': 'angefordert', 'staffed': 'besetzt'}	['projektmanager', 'anfordern', 'besetzen']
355	{'connectivity': 'Konnektivität'}	Under Connectivity, choose Destinations.	Wählen Sie unter Konnektivität die Option Ziele.	['connectivity']	{'connectivity': 'Konnektivität'}	['konnektivität']
356	{'open': 'offen'}	Open port in Cloud Foundry environments	Port in Cloud Foundry-Umgebungen öffnen	['open']	{'open': 'öffnen'}	['öffnen']
357	{'create': 'erstellen'}	Choose Create new contract from the dropdown list.	Wählen Sie „Neuen Vertrag erstellen“ aus der Dropdown-Liste.	['create']	{'create': 'erstellen'}	['erstellen']
358	{'space': 'Space'}	You can decide how important your space is compared to other spaces.	Sie können entscheiden, wie wichtig Ihr Raum im Vergleich zu anderen Räumen ist.	['space']	{'space': 'Raum'}	['raum']
359	{'business user': 'Geschäftsbenutzer'}	To add a business user, proceed as follows:	Um einen Business-Benutzer hinzuzufügen, gehen Sie wie folgt vor:	['business user']	{'business user': 'Business-Benutzer'}	['busineß']
360	{'location': 'Standort'}	Select a location.	Wählen Sie einen Standort aus.	['location']	{'location': 'Standort'}	['standort']
361	{'payment details': 'Zahlungsdetails'}	You can choose one of the following options for managing payment details:	Sie können eine der folgenden Optionen zur Verwaltung Ihrer Zahlungsdaten wählen:	['payment details']	{'payment details': 'Zahlungsdaten'}	['zahlungsdaten']
362	{'consumption model': 'Verbrauchsmodell'}	The exposed dimension sources can the be used in your consumption models.	Die offengelegten Dimensionsquellen können dann in Ihren Verbrauchsmodellen verwendet werden.	['consumption model']	{'consumption model': 'Verbrauchsmodellen'}	['verbrauchsmodellen']
363	{'document': 'Beleg'}	Specifies the revision date of the document.	Gibt das Revisionsdatum des Dokuments an.	['document']	{'document': 'Dokuments'}	['dokument']
364	{'create': 'erstellen'}	Create and delete teams.	Teams erstellen und löschen.	['create']	{'create': 'erstellen'}	['erstellen']
365	{'transfer': 'Transfer'}	You can also enter your own mass transfer ID.	Sie können auch Ihre eigene Massentransfer-ID eingeben.	['transfer']	{'transfer': 'Massentransfer-ID'}	['massentransfer']
366	{'scope': 'Konsolidierungskreis'}	Go to Scope Builder.	Gehen Sie zu Scope Builder.	['scope']	{'scope': 'Scope'}	['scopen']
367	{'type': 'Typ'}	Choose the relative date type.	Wählen Sie den relativen Datumstyp.	['type']	{'type': 'Datumstyp'}	['datumstyp']
368	{'property': 'Immobilie'}	Enter Additional Property Information	Zusätzliche Immobilieninformationen eingeben	['property']	{'property': 'Immobilieninformationen'}	['immobilieninformationen']
369	{'schedule': 'Terminplan'}	Build a schedule by adding and removing order operations	Erstellen Sie einen Zeitplan, indem Sie Auftragsoperationen hinzufügen und entfernen.	['schedule']	{'schedule': 'Zeitplan'}	['zeitplan']
370	{'query': 'Abfrage'}	The end date and time for the query.	Das Enddatum und die Uhrzeit der Abfrage.	['query']	{'query': 'Abfrage'}	['abfrage']
371	{'association': 'Zuordnung'}	Associations between entities	Assoziationen zwischen Entitäten	['association']	{'association': 'Assoziationen'}	['assoziation']
372	{'batch': 'Charge'}	You can perform batch postings for the activities.	Sie können Sammelbuchungen für die Aktivitäten durchführen.	['batch']	{'batch': 'Sammelbuchungen'}	['sammelbuchungen']
373	{'history': 'Verlauf'}	The history displays information such as:	Der Verlauf zeigt Informationen wie:	['history']	{'history': 'Verlauf'}	['verlauf']
374	{'report': 'Bericht'}	Click on the reporting task you want to process.	Klicken Sie auf die Berichtsaufgabe, die Sie bearbeiten möchten.	['report']	{'report': 'Berichtsaufgabe'}	['berichtsaufgaben']
375	{'business name': 'betriebswirtschaftlicher Name'}	Dimensions are used to group data whose content is logicallyBy default, you see your object’s business name.	Dimensionen werden verwendet, um Daten zu gruppieren, deren Inhalt logisch zusammengehört. Standardmäßig wird der Geschäftsname Ihres Objekts angezeigt.	['business name']	{'business name': 'Geschäftsname'}	['geschäftsname']
376	{'create': 'erstellen'}	Create and manage requisitions using Microsoft Excel	Bestellanforderungen mit Microsoft Excel erstellen und verwalten	['create']	{'create': 'erstellen'}	['erstellen']
377	{'service': 'Service'}	Create a Service Key	Erstellen Sie einen Service-Schlüssel	['service']	{'service': 'Service-Schlüssel'}	['service']
378	{'audit': 'Audit'}	Select the Store Audit tab page.	Wählen Sie die Registerkarte „Store Audit“.	['audit']	{'audit': 'Audit'}	['audit']
379	{'scenario': 'Szenario'}	Intelligent Scenarios Name	Name intelligenter Szenarien	['scenario']	{'scenario': 'Szenarien'}	['szenarienen']
380	{'item': 'Element'}	Select the item you want to change.	Wählen Sie das Element aus, das Sie ändern möchten.	['item']	{'item': 'Element'}	['element']
381	{'display': 'Anzeige'}	173 Display Phantom Hierarchy	173 Phantom-Hierarchie anzeigen	['display']	{'display': 'anzeigen'}	['anzeigen']
382	{'document type': 'Dokumentenart'}	Change the document type.	Ändern Sie den Dokumenttyp.	['document type']	{'document type': 'Dokumenttyp'}	['dokumenttyp']
383	{'report': 'Report'}	The report does not display any data.	Der Bericht zeigt keine Daten an.	['report']	{'report': 'Bericht'}	['bericht']
384	{'package': 'Paket'}	You can define the following which applies to the packages:	Sie können Folgendes definieren, das für die Pakete gilt:	['package']	{'package': 'Pakete'}	['paket']
385	{'access': 'Zugriff'}	For a simple step-by-step guide see Accessing your HDI container .	Eine einfache Schritt-für-Schritt-Anleitung finden Sie unter „Zugriff auf Ihren HDI-Container“.	['access']	{'access': 'Zugriff'}	['zugriff']
386	{'origin': 'Ursprung'}	Origin of Rule	Ursprung der Regel	['origin']	{'origin': 'Ursprung'}	['ursprung']
387	{'forecast': 'Forecast'}	Search for forecast.	Suche nach einer Prognose.	['forecast']	{'forecast': 'Prognose'}	['prognose']
388	{'asset': 'Anlage'}	Navigate to the superior asset.	Navigieren Sie zum übergeordneten Asset.	['asset']	{'asset': 'Asset'}	['assen']
389	{'indicator': 'Indikator'}	There are two types of busy indicator:	Es gibt zwei Arten von Busy-Indikatoren:	['indicator']	{'indicator': 'Indikatoren'}	['indikator']
390	{'reference characteristic': 'Bezugsmerkmal'}	Handling of reference Characteristics.	Handhabung von Referenzmerkmalen.	['reference characteristic']	{'reference characteristic': 'Referenzmerkmalen'}	['referenzmerkmalen']
391	{'document': 'Beleg'}	the document tab is clicked,	Die Registerkarte „Dokument“ wird angeklickt,	['document']	{'document': 'Dokument'}	['dokument']
392	{'work package': 'Work-Package'}	A work package combines the following information:	Ein Arbeitspaket fasst folgende Informationen zusammen:	['work package']	{'work package': 'Arbeitspaket'}	['arbeitspaket']
393	{'create': 'erstellen'}	You just need to create a Data Provider Profile.	Sie müssen lediglich ein Datenanbieterprofil erstellen.	['create']	{'create': 'erstellen'}	['erstellen']
394	{'item': 'Artikel'}	To add an item, select the item from the Items list.	Um ein Element hinzuzufügen, wählen Sie das Element aus der Elementliste aus.	['item']	{'item': 'Element'}	['element']
395	{'time frame': 'Zeitraum'}	You can define a time frame in the following ways:	Sie können einen Zeitrahmen auf folgende Weise definieren:	['time frame']	{'time frame': 'Zeitrahmen'}	['zeitrahmen']
396	{'panel': 'Bereich'}	If the Source Browser panel is not visible on the left of the screen, click Source Browser in the toolbar to show it.	Wenn das Source-Browser-Panel links auf dem Bildschirm nicht sichtbar ist, klicken Sie in der Symbolleiste auf Source Browser, um es einzublenden.	['panel']	{'panel': 'Panel'}	['panel']
397	{'facility': 'Objekt'}	Provides general information about the facility.	Bietet allgemeine Informationen über die Einrichtung.	['facility']	{'facility': 'Einrichtung'}	['einrichtung']
398	{'attribute type': 'Attributstyp'}	Select the attribute type from the following options:	Wählen Sie den Attributtyp aus den folgenden Optionen aus:	['attribute type']	{'attribute type': 'Attributtyp'}	['attributtyp']
399	{'entitlement': 'Anrecht'}	Displays the consumption data for the entitlement.	Zeigt die Verbrauchsdaten für die Berechtigung an.	['entitlement']	{'entitlement': 'Berechtigung'}	['berechtigung']
400	{'layer': 'Layer', 'item': 'Artikel'}	Displays the available item value on this layer.	Zeigt den verfügbaren Elementwert auf dieser Ebene an.	['layer', 'item']	{'layer': 'Ebene', 'item': 'Elementwert'}	['ebene', 'elementwert']
401	{'connector': 'Konnektor'}	Check the state of the connectors:	Überprüfen Sie den Zustand der Steckverbinder:	['connector']	{'connector': 'Steckverbinder'}	['steckverbinder']
402	{'package': 'Packstück'}	The package contents are displayed.	Die Paketinhalte werden angezeigt.	['package']	{'package': 'Paketinhalt'}	['paketinhalt']
403	{'message': 'Meldung'}	The X-Message is no longer raised.	Die X-Meldung wird nicht mehr ausgelöst.	['message']	{'message': 'Meldung'}	['meldung']
404	{'message': 'Meldung'}	A system messageconfirming that the changes have been saved appears.	Es erscheint eine Systemmeldung, die bestätigt, dass die Änderungen gespeichert wurden.	['message']	{'message': 'Systemmeldung'}	['systemmeldung']
405	{'process': 'Process'}	Process Additional information data	Zusätzliche Informationsdaten verarbeiten	['process']	{'process': 'verarbeiten'}	['verarbeiten']
406	{'order': 'Order'}	Order Fulfillment Cockpit	Cockpit zur Auftragsabwicklung	['order']	{'order': 'Auftragsabwicklung'}	['auftragsabwicklungen']
407	{'monitoring': 'Überwachung'}	This is a monitoring list.	Dies ist eine Überwachungsliste.	['monitoring']	{'monitoring': 'Überwachungsliste'}	['kberwachungsliste']
408	{'restriction': 'Einschränkung'}	Limitations and Restrictions	Beschränkungen und Einschränkungen	['restriction']	{'restriction': 'Einschränkungen'}	['einschränkung']
409	{'create': 'erstellen', 'type': 'Typ'}	You can create the following two types of hierarchies:	Sie können die folgenden zwei Arten von Hierarchien erstellen:	['create', 'type']	{'create': 'erstellen', 'type': 'Arten'}	['erstellen', 'art']
410	{'flag': 'markieren'}	If you flag the Execute ABC checkbox, the alternative control is active and will be used productively when you click Save.	Wenn Sie das Kontrollkästchen „ABC ausführen“ aktivieren, ist die alternative Steuerung aktiv und wird beim Klicken auf „Speichern“ produktiv verwendet.	['flag']	{'flag': 'aktivieren'}	['aktivieren']
