	terms	src_raw	mt_raw	src_terms	alg_terms	norm_tgt_terms
343	{'Activities': 'Операции'}	Activities for Destinations	Мероприятия для адресов	['Activities']	{'Activities': 'Мероприятия'}	['мероприятие']
344	{'supplier ID': 'идентификатор поставщика'}	Indicates the supplier ID.	Обозначает идентификатор поставщика.	['supplier ID']	{'supplier ID': 'идентификатор поставщика'}	['идентификатор поставщик']
345	{'type': 'вид'}	You can select the type of industry here.	Здесь вы можете выбрать тип отрасли.	['type']	{'type': 'тип'}	['тип']
346	{'type': 'тип'}	You can define rate elements of the following rating types:	Вы можете определить элементы тарифа следующих типов тарификации:	['type']	{'type': 'типов'}	['тип']
347	{'service confirmation': 'подтверждение сервиса'}	Displays service order items and service confirmation items by release status for billing	Отображает позиции заказов на обслуживание и позиции подтверждений обслуживания по статусу выпуска для фактурирования.	['service confirmation']	{'service confirmation': 'подтверждений обслуживания'}	['подтверждение обслуживание']
348	{'allocation': 'распределение'}	Standalone Selling Price-Weighted Allocation	Распределение, взвешенное по Единичной цене продажи	['allocation']	{'allocation': 'продажи'}	['продажа']
349	{'allocation': 'перерасчет'}	Allocation Cost Eelement	Элемент распределения затрат	['allocation']	{'allocation': 'распределения'}	['распределение']
350	{'get': 'получить'}	Select Get Values.	Выберите «Получить значения».	['get']	{'get': 'Получить'}	['получить']
351	{'action': 'операция'}	This is the main action.	Это основная операция.	['action']	{'action': 'операция'}	['операция']
352	{'input': 'вход'}	Input Parameters and Result Parameters	Входные параметры и параметры результата	['input']	{'input': 'Входные'}	['входной']
353	{'copy': 'скопировать'}	Copy Return Items	Копировать позиции возврата	['copy']	{'copy': 'Копировать'}	['копировать']
354	{'type': 'вид'}	Creating eDocument Types	Создание типов электронных документов	['type']	{'type': 'типов'}	['тип']
355	{'Personal Information': 'личная информация'}	Personal Information tab	Вкладка «Личная информация»	['Personal Information']	{'Personal Information': 'Личная информация'}	['личный информация']
356	{'claim': 'страховой случай'}	Select the claim to view details.	Выберите требование, чтобы просмотреть подробности.	['claim']	{'claim': 'требование'}	['требование']
357	{'contract': 'контракт'}	Manage Sales Contracts	Управление договорами купли-продажи	['contract']	{'contract': 'купли-продажи'}	['купля-продажа']
358	{'edit': 'редактировать'}	Choose Edit Orders.	Выберите «Изменить заказы».	['edit']	{'edit': 'Изменить'}	['изменить']
359	{'provider': 'провайдер'}	Name of the trusted identity provider	Имя доверенного поставщика удостоверений	['provider']	{'provider': 'поставщика'}	['поставщик']
360	{'go to': 'переход'}	Accrual objects that have been review confirmed go to the Review Finished status.As the review process is not required, you can still post accrual objects directly that need reviewing but haven't been reviewed.	Объекты разграничения, по которым подтверждена проверка, переходят в статус «Проверка завершена». Поскольку процесс проверки не обязателен, вы всё ещё можете напрямую проводить объекты разграничения, которые нуждаются в проверке, но не были проверены.	['go to']	{'go to': 'переходят'}	['переходить']
361	{'process': 'обработать'}	You can use the warehouse task link to navigate to warehouse tasks in the new Process Warehouse Tasks - Putaway app.	Вы можете использовать ссылку на складскую задачу, чтобы перейти к складским задачам в новом приложении Process Warehouse Tasks - Putaway.	['process']	{'process': 'Process'}	['process']
362	{'controller': 'оператор'}	You can assign multiple data controllers to the same business partner.	Вы можете назначить одному и тому же деловому партнёру несколько операторов данных.	['controller']	{'controller': 'операторов'}	['оператор']
363	{'Activities': 'действия'}	You can perform the following activities on imported procurement schedules:	Вы можете выполнять следующие действия с импортированными графиками закупок:	['Activities']	{'Activities': 'действия'}	['действие']
364	{'purpose': 'назначение'}	Specifies the purpose of a document that is assigned to a legal transaction.	Определяет назначение документа, привязанного к юридической сделке.	['purpose']	{'purpose': 'назначение'}	['назначение']
365	{'change': 'изменение'}	Change the priority of an authorization characteristic	Изменение приоритета характеристики авторизации	['change']	{'change': 'Изменение'}	['изменение']
366	{'withholding tax': 'налог на источники дохода'}	Withholding Tax at Row Level	Налог у источника на уровне строки	['withholding tax']	{'withholding tax': 'налог у источника'}	['налог у источник']
367	{'assignment': 'назначение'}	Pending PO Assignment	Ожидается назначение заказа на покупку	['assignment']	{'assignment': 'назначение'}	['назначение']
368	{'service': 'услуга'}	Service in Bank Statement	Услуга в банковской выписке	['service']	{'service': 'Услуга'}	['услуга']
369	{'space': 'пространство'}	Create and delete Spaces	Создание и удаление пространств	['space']	{'space': 'пространств'}	['пространство']
370	{'action': 'операция'}	Workflow Event Action	Действие события рабочего процесса	['action']	{'action': 'Действие'}	['действие']
371	{'attach': 'вложить'}	You can attach files or links to the object.	Вы можете прикреплять файлы или ссылки к объекту.	['attach']	{'attach': 'прикреплять'}	['прикреплять']
372	{'payment': 'оплата'}	Indicates the address to which payment is sent.	Указывает адрес, на который отправляется платеж.	['payment']	{'payment': 'платеж'}	['платёж']
373	{'output': 'вывод'}	You can generate output using the following:	Вы можете генерировать вывод с использованием следующего:	['output']	{'output': 'вывод'}	['вывод']
374	{'activity': 'операция'}	The activity can invite both internal and external users.	Мероприятие может приглашать как внутренних, так и внешних пользователей.	['activity']	{'activity': 'мероприятие'}	['мероприятие']
375	{'input': 'ввод'}	Select your input entity:	Выберите входную сущность:	['input']	{'input': 'входную'}	['входной']
376	{'input': 'ввод'}	Input data such as the following:	Входные данные, например, следующие:	['input']	{'input': 'Входные'}	['входной']
377	{'use': 'использование'}	Use Currency Conversion	Используйте пересчет валют	['use']	{'use': 'Используйте'}	['использовать']
378	{'change': 'изменение'}	These dates can't be changed.	Эти даты невозможно изменить.	['change']	{'change': 'изменить'}	['изменить']
379	{'type': 'тип'}	Displays the assigned actions for run types.	Отображает назначенные действия для типов прогонов.	['type']	{'type': 'типов'}	['тип']
380	{'type': 'вид'}	Filter by Document Type	Фильтрация по типу документа	['type']	{'type': 'типу'}	['тип']
381	{'change': 'изменить'}	Change Material Substitution	Изменить замену материала	['change']	{'change': 'Изменить'}	['изменить']
382	{'transport': 'транспорт'}	Application Help for Transport	Справка по приложению для транспорта	['transport']	{'transport': 'транспорта'}	['транспорт']
383	{'carrier': 'перевозчик'}	Information for carriers:	Информация для перевозчиков:	['carrier']	{'carrier': 'перевозчиков'}	['перевозчик']
384	{'connection': 'подключение'}	As a prerequisite, you must have already set up the connection to the ERP using Connection Management app.	Как предварительное условие, вам необходимо уже настроить подключение к ERP с помощью приложения Connection Management.	['connection']	{'connection': 'подключение'}	['подключение']
385	{'process': 'обработать'}	To process customer payments by credit card proceed as follows:	Чтобы обработать платежи клиентов по кредитной карте, выполните следующее:	['process']	{'process': 'обработать'}	['обработать']
386	{'activate': 'активировать'}	Create and activate a business rule	Создайте и активируйте бизнес-правило	['activate']	{'activate': 'активируйте'}	['активировать']
387	{'provider': 'провайдер'}	The name of the data provider company.	Название компании-поставщика данных.	['provider']	{'provider': 'компании-поставщика'}	['компания-поставщик']
388	{'total': 'сумма'}	Total Credit Line by Transaction Currency	Общая сумма кредитной линии по валюте транзакции	['total']	{'total': 'Общая'}	['общий']
389	{'controller': 'оператор'}	The data controller component is displayed.	Компонент контроллера данных отображается.	['controller']	{'controller': 'контроллера'}	['контроллер']
390	{'confirmation control key': 'управляющий ключ подтверждения'}	Enables you to select the confirmation control key.	Позволяет выбрать клавишу управления подтверждением.	['confirmation control key']	{'confirmation control key': 'клавишу управления подтверждением'}	['клавиша управление подтверждение']
391	{'reconcile': 'выполнить выверку'}	With this app, you can manually reconcile intraday bank statement flows with forecasted cash flows.	С помощью этого приложения вы можете вручную сверять внутридневные потоки банковских выписок с прогнозируемыми денежными потоками.	['reconcile']	{'reconcile': 'сверять'}	['сверять']
392	{'type': 'тип'}	Choose Assessment Type	Выбор типа оценки	['type']	{'type': 'типа'}	['тип']
393	{'provider': 'провайдер'}	The data provider's ZIP code.	Индекс поставщика данных.	['provider']	{'provider': 'поставщика'}	['поставщик']
394	{'type': 'тип'}	Relevant Order Type	Релевантный тип заказа	['type']	{'type': 'тип'}	['тип']
395	{'consumption': 'расход'}	Consumption in Month	Потребление в месяц	['consumption']	{'consumption': 'Потребление'}	['потребление']
396	{'category': 'категория'}	Stamp Duty Category	Категория гербового сбора	['category']	{'category': 'Категория'}	['категория']
397	{'pause': 'приостановка'}	Pause and Resume	Пауза и возобновление	['pause']	{'pause': 'Пауза'}	['пауза']
398	{'type': 'тип'}	Enter the type of document.	Введите тип документа.	['type']	{'type': 'тип'}	['тип']
399	{'transport': 'транспорт'}	Viewing Transport Requests	Просмотр транспортных запросов	['transport']	{'transport': 'транспортных'}	['транспортный']
400	{'tab': 'вкладка'}	Work Agreement Tab	Вкладка «Трудовой договор»	['tab']	{'tab': 'Вкладка'}	['вкладка']
401	{'type': 'тип'}	There are six types of Constant expressions:	Существует шесть типов константных выражений:	['type']	{'type': 'типов'}	['тип']
402	{'workflow': 'рабочий процесс'}	The following example describes a possible workflow:	В следующем примере описывается возможный рабочий процесс:	['workflow']	{'workflow': 'рабочий процесс'}	['рабочий процесс']
403	{'collection agency': 'коллекторское агентство'}	Send Update to Collection Agency	Отправить обновление в коллекторское агентство	['collection agency']	{'collection agency': 'коллекторское агентство'}	['коллекторский агентство']
404	{'type': 'вид'}	This is the default attachment type.	Это тип вложения по умолчанию.	['type']	{'type': 'тип'}	['тип']
405	{'type': 'тип'}	Activity Type Description	Описание типа ситуации	['type']	{'type': 'типа'}	['тип']
406	{'client': 'клиент'}	Corresponding DataSource (for use in SAP Analytics Cloud and analytical clients)	Соответствующий источник данных (для использования в SAP Analytics Cloud и аналитических клиентах)	['client']	{'client': 'клиентах'}	['клиент']
407	{'category': 'категория'}	Billing Plan Category - Text	Категория плана выставления счетов - текст	['category']	{'category': 'Категория'}	['категория']
408	{'edit': 'редактировать'}	You can also edit or download a virtual document.	Вы также можете редактировать или скачать виртуальный документ.	['edit']	{'edit': 'редактировать'}	['редактировать']
409	{'characteristic': 'характеристика'}	Creation, update, and deletion of characteristics	Создание, обновление и удаление характеристик	['characteristic']	{'characteristic': 'характеристик'}	['характеристика']
410	{'release': 'деблокировать'}	Release (Document OK)	Выпуск (Документ без ошибок)	['release']	{'release': 'Выпуск'}	['выпуск']
411	{'analytics chart': 'аналитическая диаграмма'}	Analytics Chart 1	Аналитическая диаграмма 1	['analytics chart']	{'analytics chart': 'Аналитическая диаграмма'}	['аналитический диаграмма']
412	{'provider': 'поставщик'}	Filter by Provider	Фильтрация по поставщику	['provider']	{'provider': 'поставщику'}	['поставщик']
413	{'assigned': 'присвоенный'}	Semantic Tag Assigned	Семантический тег присвоен	['assigned']	{'assigned': 'присвоен'}	['присвоить']
414	{'run type': 'тип прогона'}	Displays whether a run type is enabled.	Показывает, включен ли тип запуска.	['run type']	{'run type': 'тип запуска'}	['тип запуск']
415	{'exit': 'выход'}	Add an exit condition.	Добавьте условие выхода.	['exit']	{'exit': 'выхода'}	['выход']
416	{'data provider': 'провайдер данных'}	The country where the data provider is located.	Страна, где находится поставщик данных.	['data provider']	{'data provider': 'поставщик данных'}	['поставщик данные']
417	{'account': 'счет'}	Search for account information	Поиск информации об аккаунте	['account']	{'account': 'аккаунте'}	['аккаунт']
418	{'check': 'проверка'}	Check Service Contract Actuals	Проверить фактические данные сервисного контракта	['check']	{'check': 'Проверить'}	['проверить']
419	{'type': 'вид'}	You can view orders based on any of the following industry type:	Вы можете просматривать заказы по любому из следующих типов отрасли:	['type']	{'type': 'типов'}	['тип']
420	{'maintain': 'выполнять ведение'}	Allows you to maintain the story details.	Позволяет поддерживать подробных истории.	['maintain']	{'maintain': 'поддерживать'}	['поддерживать']
421	{'location structure': 'структура местоположений'}	With this app, you can edit the location structure.	С помощью этого приложения вы можете редактировать структуру местоположений.	['location structure']	{'location structure': 'структуру местоположений'}	['структура местоположение']
422	{'compliance': 'соответствие'}	For more information about integreting with contract compliance, see .	Для получения дополнительных сведений об интеграции с соблюдением условий контракта см. .	['compliance']	{'compliance': 'соблюдением'}	['соблюдение']
423	{'topic': 'раздел'}	This topic describes the G/L account renumbering process.	В этой теме описывается процесс перенумерации счетов G/L.	['topic']	{'topic': '▔'}	['▔']
424	{'compensation': 'возмещение'}	Specifies how customer compensation is to be processed.	Указывает, как должна обрабатываться компенсация клиенту.	['compensation']	{'compensation': 'компенсация'}	['компенсация']
425	{'pricing procedure': 'схема калькуляции'}	Pricing Procedure PP1	Процедура ценообразования PP1	['pricing procedure']	{'pricing procedure': 'Процедура ценообразования'}	['процедура ценообразование']
426	{'assembly': 'сборка'}	Assembly in Process	Сборка в обработке	['assembly']	{'assembly': 'Сборка'}	['сборка']
427	{'tab': 'вкладка'}	Default values tab page:	Вкладка «Значения по умолчанию»:	['tab']	{'tab': 'Вкладка'}	['вкладка']
428	{'edit': 'обработать'}	Edit Safety Observation	Редактировать наблюдение по безопасности	['edit']	{'edit': 'Редактировать'}	['редактировать']
429	{'pattern': 'шаблон'}	Set when the recurrence pattern ends:	Установите, когда шаблон повторения завершен:	['pattern']	{'pattern': 'шаблон'}	['шаблон']
430	{'type': 'тип'}	External Document Type	Внешний тип документа	['type']	{'type': '▔'}	['▔']
431	{'transaction': 'движение'}	Transaction in the past	Транзакция в прошлом	['transaction']	{'transaction': 'Транзакция'}	['транзакция']
432	{'stop': 'остановка'}	Stop Manual Forecasting	Остановить прогнозирование вручную	['stop']	{'stop': 'Остановить'}	['остановить']
433	{'tab': 'вкладка'}	Budget Adjustments Tab	Вкладка «Корректировки бюджета»	['tab']	{'tab': 'Вкладка'}	['вкладка']
434	{'activate': 'активировать'}	Activate a supplier list that is in preparation.	Активируйте список поставщиков, находящийся в стадии подготовки.	['activate']	{'activate': 'Активируйте'}	['активировать']
435	{'contract': 'контракт'}	Contract for Limit determines the price per unit for each item in the service entry sheet.	Контракт на лимит определяет цену за единицу для каждого пункта в листе ввода услуг.	['contract']	{'contract': 'Контракт'}	['контракт']
436	{'edit': 'редактировать'}	You can also edit these tasks with the following exceptions:	Вы также можете редактировать эти задачи со следующими исключениями:	['edit']	{'edit': 'редактировать'}	['редактировать']
437	{'wizard': 'мастер'}	New resource wizards	Мастера новых ресурсов	['wizard']	{'wizard': 'Мастера'}	['мастер']
438	{'object category': 'тип объекта'}	Purchasing Object Category	Категория объекта Закупки	['object category']	{'object category': 'Категория объекта'}	['категория объект']
439	{'cancel': 'отменить'}	Create, Change, Cancel	Создать, изменить, отменить	['cancel']	{'cancel': 'отменить'}	['отменить']
440	{'restricted': 'с ограничением'}	Restricted reuse views	Просмотры с ограничением повторного использования	['restricted']	{'restricted': '▔'}	['▔']
441	{'assets': 'активы'}	Assets or Liabilities	Активы или пассивы	['assets']	{'assets': 'Активы'}	['актив']
442	{'inspection': 'проверка'}	Inspection lot quantity	количества инспекционной партии	['inspection']	{'inspection': 'инспекционной'}	['инспекционный']
443	{'use': 'использование'}	Use plan data integration	Используйте интеграцию плановых данных	['use']	{'use': 'Используйте'}	['использовать']
444	{'reporting': 'отчеты'}	Reporting and analytics	Отчетность и аналитика	['reporting']	{'reporting': 'Отчетность'}	['отчётность']
445	{'classification type': 'вид классификации'}	Expense Classification Type	Тип классификации расходов	['classification type']	{'classification type': 'Тип классификации'}	['тип классификация']
446	{'in review': 'в проверке'}	The account status will change from In review to Active.	Статус аккаунта изменится с «На рассмотрении» на «Активно».	['in review']	{'in review': 'На рассмотрении'}	['на рассмотрение']
447	{'provider': 'провайдер'}	Find out how to become a data provider and deliver valuable data products to the users of SAP Data Marketplace.	Узнайте, как стать поставщиком данных и поставлять ценные продукты данных пользователям SAP Data Marketplace.	['provider']	{'provider': 'поставщиком'}	['поставщик']
448	{'type': 'вид'}	Select a compliance requirement type.	Выберите тип требования соответствия.	['type']	{'type': 'тип'}	['тип']
449	{'tab': 'вкладка'}	The Maintenance Orders tab opens and shows the material availability status for the relevant orders.	Открывается вкладка «Заказы на обслуживание» и отображает статус доступности материала для соответствующих заказов.	['tab']	{'tab': 'вкладка'}	['вкладка']
