	terms	src_raw	mt_raw	src_terms	alg_terms	norm_tgt_terms
0	{'container': 'container'}	Why would you need to access HDI containers?	¿Por qué necesitarías acceder a los containers HDI?	['container']	{'container': 'containers'}	['containers']
1	{'parallel processing': 'procesamiento paralelo', 'job': 'job'}	Decide if you want to use parallel processing for this job:	Decida si desea utilizar el procesamiento en paralelo para este trabajo:	['parallel processing', 'job']	{'parallel processing': 'procesamiento paralelo', 'job': 'trabajo'}	['procesamiento paralelo', 'trabajo']
2	{'report': 'report'}	Displays in the list report billing elements with or without planned prepayments.	Visualiza en el informe de lista los elementos de facturación con o sin anticipos planificados.	['report']	{'report': 'informe'}	['informe']
3	{'average': 'media'}	The KPI shows the average age in days of assets under construction, and individual items are listed below.	El KPI muestra la edad promedio en días de los activos en construcción, y los elementos individuales se enumeran a continuación.	['average']	{'average': 'promedio'}	['promedio']
4	{'item': 'elemento'}	Once exported, an item stays in the software collection for its entire lifecycle.	Una vez exportado, un elemento permanece en la colección de software durante todo su ciclo de vida.	['item']	{'item': 'elemento'}	['elemento']
5	{'explosion': 'desglose'}	If it's an assembly, the explosion continues to the lowest level.	Si se trata de un conjunto, la explosión continúa hasta el nivel inferior.	['explosion']	{'explosion': 'explosión'}	['explosión']
6	{'add': 'agregar'}	Add a New OAuth Client (Non-SAP Data Center)	Agregar un nuevo cliente OAuth (centro de datos no SAP)	['add']	{'add': 'Agregar'}	['agregar']
7	{'range': 'intervalo'}	Each compute block provides a certain number of vCPUs and a range of 60 to 64 GB of RAM, depending on the hyperscaler.	Cada bloque de cómputo proporciona cierto número de vCPUs y un rango de 60 a 64 GB de RAM, dependiendo del hiperescalador.	['range']	{'range': 'rango'}	['rango']
8	{'source': 'fuente'}	Source systems connected to an SAP LT Replication Server are supported down to:	Los sistemas fuente conectados a un servidor de replicación SAP LT son compatibles hasta:	['source']	{'source': 'fuente'}	['fuente']
9	{'template': 'modelo'}	After you create a new template, you will be directed to the template page, to add text blocks to the template.	Después de crear una nueva plantilla, se te dirigirá a la página de la plantilla para agregar bloques de texto a la plantilla.	['template']	{'template': 'plantilla'}	['plantilla']
10	{'source': 'fuente'}	Data is accessed directly from the source (federation) and read from the virtual table.	Se accede a los datos directamente desde la fuente (federación) y se leen desde la tabla virtual.	['source']	{'source': 'fuente'}	['fuente']
11	{'edit': 'editar'}	Edit Default Waste Generator	Editar productor de residuos predeterminado	['edit']	{'edit': 'Editar'}	['editar']
12	{'reset': 'restablecer'}	Resets the filters.	Restablece los filtros.	['reset']	{'reset': 'Restablece'}	['restablece']
13	{'add': 'añadir'}	You can copy existing items or item sets to add new ones to the sourcing project.	Puede copiar artículos existentes o conjuntos de artículos para añadir nuevos al proyecto de abastecimiento.	['add']	{'add': 'añadir'}	['añadir']
14	{'incident': 'incidencia'}	Access of this category is not based on individual support cases or incidents.	El acceso de esta categoría no se basa en casos de soporte individuales ni en incidentes.	['incident']	{'incident': 'incidentes'}	['incidente']
15	{'template': 'modelo'}	Use the dropdown list in the upper left corner of the dialog box to select the search template you want to use.	Utilice la lista desplegable en la esquina superior izquierda de la ventana para seleccionar la plantilla de búsqueda que desea usar.	['template']	{'template': 'plantilla'}	['plantilla']
16	{'save': 'guardar'}	To save and deploy your ER model to SAP HANA, choose Deploy.	Para guardar y desplegar su modelo ER en SAP HANA, seleccione Deploy.	['save']	{'save': 'guardar'}	['guardar']
17	{'write off': 'ignorar', 'tab': 'pestaña'}	Confirm the write-off action and verify that the selected items have moved from the To Be Billed tab to the To Be Written Off tab.	Confirme la acción de cancelación y compruebe que los elementos seleccionados se hayan movido de la pestaña Por facturar a la pestaña Por ignorar.	['write off', 'tab']	{'write off': 'ignorar', 'tab': 'pestaña'}	['ignorar', 'pestaña']
18	{'partner': 'socio', 'rule': 'regla'}	You create an installment plan, if there are one or more open items in the contract account of a business partner and the business partner cannot fulfill the payment obligation within the scope of the usual payment rules.	Se crea un plan de cuotas si hay uno o más ítems abiertos en la cuenta de contrato de un socio comercial y el socio comercial no puede cumplir con la obligación de pago dentro del alcance de las reglas de pago habituales.	['partner', 'rule']	{'partner': 'socio', 'rule': 'reglas'}	['socio', 'regla']
19	{'reset': 'restablecer'}	Defines when the valuation takes place and whether it is reset.	Define cuándo se realiza la valoración y si se restablece.	['reset']	{'reset': 'restablece'}	['restablecer']
20	{'category': 'tipo'}	Choose Service Part Items as the item category from the Show dropdown list.	Seleccione Partes de servicio como la categoría de artículo en la lista desplegable Mostrar.	['category']	{'category': 'categoría'}	['categoría']
21	{'schedule': 'programación'}	To filter for order operations that are included in a specific schedule, add the Included in Schedule filter to the filter bar.	Para filtrar las operaciones de pedido que estén incluidas en un programa específico, añada el filtro Incluido en la programación a la barra de filtros.	['schedule']	{'schedule': 'programación'}	['programación']
22	{'edit': 'editar'}	You can only edit headers for Inactive units.	Solo puedes editar los encabezados de las unidades inactivas.	['edit']	{'edit': 'editar'}	['editar']
23	{'completed': 'concluido'}	This overview contains all repair objects that have not been completed yet.	Esta visión general contiene todos los objetos de reparación que aún no se han completado.	['completed']	{'completed': 'completado'}	['completar']
24	{'pause': 'interrumpir'}	Pause real-time replication to enable editing connection properties.	Pausar la replicación en tiempo real para habilitar la edición de las propiedades de la conexión.	['pause']	{'pause': 'pausar'}	['pausar']
25	{'use': 'utilizar'}	Save your business entity to make it available for use in fact models and consumption models.	Guarde su entidad de negocio para que esté disponible para usarse en modelos de hechos y modelos de consumo.	['use']	{'use': 'usarse'}	['usar']
26	{'schedule': 'programación'}	This means that the work center change is only visible in your schedule and is not yet saved in the maintenance order.	Esto significa que el cambio de centro de trabajo solo es visible en tu programación y aún no está guardado en la orden de mantenimiento.	['schedule']	{'schedule': 'programación'}	['programación']
27	{'delete': 'eliminar'}	To delete an activation key, click the first column of the corresponding row and then Delete.	Para eliminar una clave de activación, haz clic en la primera columna de la fila correspondiente y luego en Eliminar.	['delete']	{'delete': 'Eliminar'}	['eliminar']
28	{'schedule': 'calendario'}	Modify your order schedules to prioritize overdue or late orders.	Modifica tus horarios de pedidos para priorizar los pedidos vencidos o atrasados.	['schedule']	{'schedule': 'horarios'}	['horario']
29	{'work center': 'puesto de trabajo'}	Reviewers do not require any work center assignment.	Los revisores no requieren ninguna asignación de centro de trabajo.	['work center']	{'work center': 'centro de trabajo'}	['centro de trabajo']
30	{'customer': 'deudor'}	For correspondence with the customer/supplier	Para la correspondencia con el cliente/proveedor	['customer']	{'customer': 'cliente'}	['cliente']
31	{'range': 'intervalo'}	Within a time range	Dentro de un rango de tiempo	['range']	{'range': 'rango'}	['rango']
32	{'delivery': 'entrega'}	Only one data delivery is provided without any additional corrections or updates.	Solo se proporciona una entrega de datos sin correcciones ni actualizaciones adicionales.	['delivery']	{'delivery': 'entrega'}	['entrega']
33	{'processing': 'procesamiento'}	If the credit memos are processed successfully, the system posts a document during the processing of the payment advice note by means of the amount credited and, if necessary, charges are posted.	Si las notas de crédito se procesan correctamente, el sistema contabiliza un documento durante el procesamiento del aviso de pago con el importe acreditado y, de ser necesario, registra cargos.	['processing']	{'processing': 'procesamiento'}	['procesamiento']
34	{'upgrade': 'upgrade'}	Post-upgrade test processes	Procesos de prueba tras el upgrade	['upgrade']	{'upgrade': 'upgrade'}	['upgrade']
35	{'tab': 'pestaña'}	You can see these items on the To Be Written Off  tab and verify that they're non-billable by looking at the Billing Control Category column.	Puedes ver estos elementos en la pestaña To Be Written Off y verificar que sean no facturables al mirar la columna Billing Control Category.	['tab']	{'tab': 'pestaña'}	['pestaña']
36	{'recurrence pattern': 'patrón de repetición'}	Define Recurrence Pattern	Definir patrón de recurrencia	['recurrence pattern']	{'recurrence pattern': 'patrón de recurrencia'}	['patrón de recurrencia']
37	{'public': 'pública'}	To directly consume data in data flows, the Oracle database must be available on the public internet.	Para consumir directamente datos en flujos de datos, la base de datos Oracle debe estar disponible en Internet pública.	['public']	{'public': 'pública'}	['público']
38	{'schedule': 'plan'}	Shows that the object will be activated automatically during the next scheduled data aging run for this object and the aging run is not scheduled for the selected data aging object.	Muestra que el objeto se activará automáticamente durante la próxima ejecución de envejecimiento de datos programada para este objeto y que la ejecución de envejecimiento no está programada para el objeto de envejecimiento de datos seleccionado.	['schedule']	{'schedule': 'programada'}	['programado']
39	{'save': 'guardar'}	Please note that date and time are not included when you save a filter variant.	Tenga en cuenta que la fecha y la hora no se incluyen al guardar una variante de filtro.	['save']	{'save': 'guardar'}	['guardar']
40	{'default': 'predefinir'}	The attribute can be used to identify bank accounts that belong to the same defaultable counterparty.	El atributo puede utilizarse para identificar cuentas bancarias que pertenecen a la misma contraparte predefinirse.	['default']	{'default': 'predefinirse'}	['predefinir']
41	{'reset': 'restablecer'}	Reset Availability Data	Restablecer datos de disponibilidad	['reset']	{'reset': 'Restablecer'}	['restablecer']
42	{'replenishment': 'reaprovisionamiento'}	The signal for replenishment is issued by an indicator, that is sent by a demand source (consumer) to the supply source (supplier).	La señal de reposición es emitida por un indicador, que es enviado por una fuente de demanda (consumidor) a la fuente de suministro (proveedor).	['replenishment']	{'replenishment': '▔'}	['▔']
43	{'tab': 'pestaña'}	Check the objects on the Business Builder and Data Builder tabs.	Comprueba los objetos en las pestañas Generador de Negocios y Generador de Datos.	['tab']	{'tab': 'pestañas'}	['pestaña']
44	{'template': 'modelo'}	You can create a new template by specifying the content type, governing law, and language.	Puedes crear una nueva plantilla especificando el tipo de contenido, la ley aplicable y el idioma.	['template']	{'template': 'plantilla'}	['plantilla']
45	{'process': 'procesar'}	You can define one or more preconditions that must be met before the credit memo request workflow can be processed.	Puede definir una o más condiciones previas que deben cumplirse antes de que se pueda procesar el flujo de trabajo de la solicitud de abono.	['process']	{'process': 'procesar'}	['procesar']
46	{'job': 'job'}	To change scheduled jobs	Para cambiar trabajos programados	['job']	{'job': 'trabajos'}	['trabajo']
47	{'recurrence pattern': 'patrón de repetición'}	Define the recurrence pattern, such as daily or weekly	Defina el patrón de recurrencia, como diaria o semanalmente.	['recurrence pattern']	{'recurrence pattern': 'patrón de recurrencia'}	['patrón de recurrencia']
48	{'tab': 'pestaña'}	Use the tabs in the Data Preview panel to review and process the results.	Utilice las pestañas en el panel de Vista previa de datos para revisar y procesar los resultados.	['tab']	{'tab': 'pestañas'}	['pestaña']
49	{'completed': 'concluido'}	When you're displaying service confirmations assigned to a standard service order, you can use this button to release service confirmations that have status Completed for billing.	Cuando visualice confirmaciones de servicio asignadas a una orden de servicio estándar, puede usar este botón para liberar las confirmaciones de servicio que tengan el estado Completado para la facturación.	['completed']	{'completed': 'Completado'}	['completado']
50	{'reporting': 'informes'}	It provides a consolidation view along this segment hierarchy by populating the Segment Eliminated reporting dimension.	Proporciona una vista de consolidación a lo largo de esta jerarquía de segmentos al poblar la dimensión de reporte Segment Eliminated.	['reporting']	{'reporting': 'reporte'}	['reportar']
51	{'save as': 'guardar como'}	Save As New Version:(Available for templates and text blocks)	Guardar como nueva versión: (Disponible para plantillas y bloques de texto)	['save as']	{'save as': 'nueva versión'}	['nuevo versión']
52	{'search result': 'resultado del proceso de búsqueda'}	You can use this field to filter your search results for the latest bank statements that you have received from your house bank accounts.	Puedes utilizar este campo para filtrar tus resultados de búsqueda de los últimos extractos bancarios que hayas recibido de tus cuentas bancarias internas.	['search result']	{'search result': 'resultados'}	['resultado']
53	{'schedule': 'programación'}	A schedule task is defined for this data flow.	Se define una tarea programada para este flujo de datos.	['schedule']	{'schedule': 'programada'}	['programado']
54	{'job': 'job'}	To change scheduled jobs, do the following:	Para cambiar los trabajos programados, haga lo siguiente:	['job']	{'job': 'trabajos'}	['trabajo']
55	{'customer': 'deudor'}	Customer/supplier branch number	Número de sucursal de cliente/proveedor	['customer']	{'customer': 'cliente'}	['cliente']
56	{'recurrence pattern': 'patrón de repetición'}	Define the recurrence pattern of the job.	Defina el patrón de recurrencia del job.	['recurrence pattern']	{'recurrence pattern': 'patrón de recurrencia'}	['patrón de recurrencia']
57	{'substitute': 'suplente'}	Define your personal settings for email notifications and substitutes.	Define tu configuración personal para las notificaciones por correo electrónico y los suplentes.	['substitute']	{'substitute': 'suplentes'}	['suplente']
58	{'review': 'revisión'}	Set fuzzy match scores to decide when to place input records in the Matched and Review results categories.	Configure las puntuaciones de coincidencia difusa para decidir cuándo colocar los registros de entrada en las categorías de resultados Coincidentes y Revisión.	['review']	{'review': 'Revisión'}	['revisión']
59	{'feature': 'característica'}	Find further information on the Extended Statistics feature in the product assistance.	Encontrará más información sobre la función de Estadísticas Extendidas en la ayuda del producto.	['feature']	{'feature': 'función'}	['función']
60	{'customer': 'deudor'}	As a search criterion for items in the customer/supplier account	Como criterio de búsqueda para las partidas en la cuenta del cliente/proveedor	['customer']	{'customer': 'cliente'}	['cliente']
61	{'call': 'llamada', 'tab': 'etiqueta'}	The variables are different for the different data source called to for the charts of a tab.	Las variables son diferentes según las distintas fuentes de datos llamadas para los gráficos de una pestaña.	['call', 'tab']	{'call': 'llamadas', 'tab': 'pestaña'}	['llamada', 'pestaña']
62	{'replication': 'reproducción'}	Required Permissions for Oracle Trigger-Based Replication in the SAP HANA Smart Data Integration and SAP HANA Smart Data Quality Installation and Configuration Guide	Permisos requeridos para la replicación basada en desencadenadores de Oracle en la Guía de instalación y configuración de SAP HANA Smart Data Integration y SAP HANA Smart Data calidad	['replication']	{'replication': 'replicación'}	['replicación']
63	{'set': 'definir'}	If you lock a release which is not the latest release, all releases which have been published after the release of the locked release are also set to locked.	Si bloqueas una versión que no es la versión más reciente, todas las versiones publicadas después de la versión bloqueada también se establecerán como bloqueadas.	['set']	{'set': 'bloqueadas'}	['bloqueado']
64	{'change': 'modificación'}	You need to re-deploy your intelligent lookup each time your make a change to it.	Necesitas volver a desplegar tu búsqueda inteligente cada vez que realices un cambio en ella.	['change']	{'change': 'cambio'}	['cambio']
65	{'delete': 'eliminar'}	Delete an Activation Key	Eliminar una clave de activación	['delete']	{'delete': 'Eliminar'}	['eliminar']
66	{'add': 'añadir'}	Click the Edit button to add or delete buttons or change column names and data types.	Haga clic en el botón Editar para agregar o eliminar botones o cambiar los nombres de las columnas y los tipos de datos.	['add']	{'add': 'agregar'}	['agregar']
67	{'account assignment': 'imputación', 'partner': 'socio', 'default': 'predefinir'}	You specify a defaultable business partner for banks when using bank reconciliation accounts in G/L account assignment.	Especifica un socio de negocios predefinirse para bancos cuando se utilizan cuentas de conciliación de bancos en la asignación de cuenta de mayor.	['account assignment', 'partner', 'default']	{'account assignment': 'asignación cuenta', 'partner': '▔', 'default': 'predefinirse'}	['asignación cuenta', '▔', 'predefinir']
68	{'write off': 'ignorar'}	On the To Be Billed tab, select one or more items as required and choose Write Off.	En la pestaña Por facturar, seleccione una o más partidas según sea necesario y elija Cancelar.	['write off']	{'write off': 'Cancelar'}	['cancelar']
69	{'measure': 'indicador'}	Select a type of measure and define the properties.	Seleccione un tipo de medida y defina las propiedades.	['measure']	{'measure': 'medida'}	['medida']
70	{'transaction': 'operación', 'customer': 'deudor'}	Transaction number under which a controversial transaction is managed at the customer/supplier	Número de transacción bajo el cual se gestiona una transacción conflictiva en el deudor/acreedor	['transaction', 'customer']	{'transaction': 'transacción', 'customer': 'deudor'}	['transacción', 'deudor']
71	{'record': 'registro'}	The RECORD COUNT type is a table-wide statistic.	El tipo RECORD COUNT es una estadística a nivel de tabla.	['record']	{'record': 'RECORD'}	['record']
72	{'header': 'cabecera'}	Click the column header in the table area.	Haga clic en el encabezado de la columna en el área de la tabla.	['header']	{'header': 'encabezado'}	['encabezado']
73	{'performance': 'rendimiento'}	At the performance obligation level they are calculated as follows:	En el nivel de obligación de desempeño, se calculan de la siguiente manera:	['performance']	{'performance': 'desempeño'}	['desempeño']
74	{'worklist': 'lista de trabajo'}	Adds a selected settlement date with the settlement status Open, Due, Due Today, or Overdue to a scheduling worklist to schedule the settlement of the selected settlement date.	Agrega una fecha de liquidación seleccionada con el estado de liquidación Abierto, Pendiente, Vence hoy o Atrasado a una lista de trabajo de programación para programar la liquidación de la fecha de liquidación seleccionada.	['worklist']	{'worklist': 'lista de trabajo'}	['lista de trabajo']
75	{'type': 'tipo'}	If you want the automated reprocessing rule to post your bank statement items in only one step, select 001 (One-Step Posting) as the value of the Procedure Type field.	Si desea que la regla de reprocesamiento automático contabilice sus partidas de extracto bancario en un solo paso, seleccione 001 (Contabilización en un paso) como valor del campo Tipo de procedimiento.	['type']	{'type': 'procedimiento'}	['procedimiento']
76	{'tab': 'pestaña'}	In the pane on the right, check the objects on the Business Builder and Data Builder tabs:	En el panel de la derecha, verifica los objetos en las pestañas Constructor de Negocios y Constructor de datos:	['tab']	{'tab': 'pestañas'}	['pestaña']
77	{'schedule': 'programación'}	If the operation is included in one schedule, the schedule opens directly.	Si la operación está incluida en un horario, el horario se abre directamente.	['schedule']	{'schedule': 'horario'}	['horario']
78	{'worklist': 'lista de trabajo'}	The new Manage Fixed Assets card replaces the Asset Master Worklist card from previous versions.	La nueva tarjeta Administrar Activos Fijos reemplaza la tarjeta Lista de Trabajo del Maestro de Activos de versiones anteriores.	['worklist']	{'worklist': 'Lista de Trabajo'}	['lista de trabajo']
79	{'add': 'añadir'}	Add or remove columns to the overview	Agregar o quitar columnas de la vista general	['add']	{'add': 'Agregar'}	['agregar']
80	{'allocation': 'imputación'}	Use this function to download a preformatted CSV file template that you can use to create new allocation cycles and segments or edit existing ones.	Usa esta función para descargar una plantilla de archivo CSV preformateada que puedes utilizar para crear nuevos ciclos de asignación y segmentos o para editar los existentes.	['allocation']	{'allocation': 'asignación'}	['asignación']
81	{'profile page': 'página del perfil'}	The data provider profile page provides additional information about the data provider and other products or product groups.	La página de perfil del proveedor de datos proporciona información adicional sobre el proveedor de datos y otros productos o grupos de productos.	['profile page']	{'profile page': 'página de perfil'}	['página de perfil']
82	{'allocation': 'imputación'}	You can only use it with the cost center and profit center allocation contexts.	Solo puede usarlo con los contextos de asignación de centro de costos y centro de beneficios.	['allocation']	{'allocation': 'asignación'}	['asignación']
83	{'partner': 'socio'}	You can maintain Sales Area Details, Sales Taxes, and Partner Functions.	Puede mantener los detalles del área de ventas, los impuestos sobre las ventas y las funciones de socios.	['partner']	{'partner': 'socios'}	['socio']
84	{'incident': 'incidencia'}	The incident ID is empty for SAP support user access with the Operations access category.	El ID de incidente está vacío para el acceso del usuario de soporte de SAP con la categoría de acceso Operaciones.	['incident']	{'incident': 'incidente'}	['incidente']
85	{'consumption': 'compensación', 'allocation': 'contingente'}	Displays data for allocation periods in which allocation consumption is below 20%.	Muestra datos de los períodos de asignación en los que el consumo de asignación está por debajo del 20%.	['consumption', 'allocation']	{'consumption': 'consumo', 'allocation': 'asignación'}	['consumo', 'asignación']
86	{'assembly': 'conjunto', 'icon': 'icono'}	The Information icon appears if any or all of following exists for an assembly:	El ícono de Información aparece si cualquiera o todos los siguientes existen para un ensamblaje:	['assembly', 'icon']	{'assembly': 'ensamblaje', 'icon': 'ícono'}	['ensamblaje', 'ícono']
87	{'delete': 'eliminar'}	To delete a mapping, click the link and then click the Delete tool.	Para eliminar una asignación, haga clic en el enlace y luego haga clic en la herramienta Eliminar.	['delete']	{'delete': 'Eliminar'}	['eliminar']
88	{'sorting': 'orden'}	Using filters, search, or sorting, you can quickly find the connection type.	Usando filtros, búsqueda u ordenación, puedes encontrar rápidamente el tipo de conexión.	['sorting']	{'sorting': 'ordenación'}	['ordenación']
89	{'job': 'job'}	The Number of Jobs and Package Size fields are deactivated and not relevant for this job.	Los campos Número de trabajos y Tamaño del paquete están desactivados y no son relevantes para este trabajo.	['job']	{'job': 'trabajo'}	['trabajo']
90	{'client': 'cliente'}	Enter the system client number.	Introduzca el número de cliente del sistema.	['client']	{'client': 'cliente'}	['cliente']
91	{'report': 'report'}	If you choose No, the system will exclude from the list report all billing elements with prepayment items.	Si elige No, el sistema excluirá del informe list todos los elementos de facturación con partidas de prepago.	['report']	{'report': 'informe'}	['informe']
92	{'job': 'tarea'}	If you change the ID, a background job will be created.	Si cambias el ID, se creará un trabajo en segundo plano.	['job']	{'job': 'trabajo'}	['trabajo']
93	{'trigger': 'iniciar'}	The update of the persistency has to be triggered again.	La actualización de la persistencia debe iniciarse de nuevo.	['trigger']	{'trigger': 'iniciarse'}	['iniciar']
