	terms	src_raw	mt_raw	src_terms	alg_terms	norm_tgt_terms
79	{'business name': 'betriebswirtschaftlicher Name'}	Modify the properties of objects, including providing business names for them to make them easier to identify and use for non-technical users.	Ändern Sie die Eigenschaften von Objekten, und geben Sie ihnen Geschäftsnamen, um sie einfacher zu identifizieren und für nicht technische Benutzer zu verwenden.	['business name']	{'business name': 'Geschäftsnamen'}	['geschäftsnamen']
80	{'work center': 'Arbeitsplatz'}	You can view all top-level materials of the work center.	Sie können alle Materialien auf oberster Ebene des Arbeitscenters anzeigen.	['work center']	{'work center': 'Arbeitscenters'}	['arbeitscenter']
81	{'residence period': 'Residenzzeit'}	The residence period is part of the overall retention period.	Der Aufenthaltszeitraum ist Teil des gesamten Aufbewahrungzeitraums.	['residence period']	{'residence period': 'Aufenthaltszeitraum'}	['aufenthaltszeitraumen']
82	{'trigger': 'Auslöser'}	[if Enable Compound Triggers = true] Flush Threshold of Compound Triggers	"[(""Enable Compound Triggers"" = ""Aktivieren Sie zusammengesetzte Auslöser""), (""true"" = ""wahr""), (""Flush Threshold of Compound Triggers"" = ""Schwellenwert für zusammengesetzte Auslöser"")]"	['trigger']	{'trigger': 'Auslöser'}	['auslöser']
83	{'identifier': 'Identifikator', 'ID': 'ID'}	If such a column does not exist, you may choose to create a calculated column and concatenate values from other columns into it to provide unique identifier values.	Wenn eine solche Spalte nicht vorhanden ist, können Sie eine berechnete Spalte erstellen und Werte aus anderen Spalten darin verketten, um eindeutige Identifikatorwerte bereitzustellen.	['identifier', 'ID']	{'identifier': 'Identifikatorwerte', 'ID': 'Identifikatorwerte'}	['identifikatorwerten', 'identifikatorwerten']
84	{'start': 'Start'}	If no period range is defined, the start date of the Period Range selection defaults to the current date.	Wenn kein Zeitbereich definiert ist, wird das Startdatum der Auswahl für Zeitbereich standardmäßig auf das aktuelle Datum festgelegt.	['start']	{'start': '▔'}	['▔ertrat<sos>']
85	{'key mapping': 'Schlüsselzuordnung'}	If switched on, it indicates that each data record of the currently opened business entity finds a match in the selected target business entity with the configured key mapping.	Wenn es aktiviert ist, zeigt es an, dass jeder Datenrekord der aktuell geöffneten Geschäftseinheit eine Übereinstimmung in der ausgewählten Zielgeschäftseinheit mit dem konfigurierten Schlüsselzuordnung findet.	['key mapping']	{'key mapping': 'Schlüsselzuordnung'}	['schlüsselzuordnungen']
86	{'data selection': 'Datenauswahl', 'item': 'Element'}	If you want to restrict the data to include in the release, select a view from the Items table and enter or paste your data queries in the Data Selection section.	"Wenn Sie die Daten, die in die Veröffentlichung einbezogen werden sollen, einschränken möchten, wählen Sie einen View aus der Elemente-Tabelle aus, und geben Sie Ihre Datenabfragen im Abschnitt ""Datenauswahl"" ein, oder fügen Sie sie dort ein."	['data selection', 'item']	{'data selection': 'Datenauswahl', 'item': 'Elemente'}	['datenauswahl', 'element']
87	{'minimum score': 'Mindest-Score'}	Set the minimum score needed to match an input record with a lookup record and place it in the Review results category.	Legen Sie die Mindestpunktzahl fest, die erforderlich ist, um einen Eingabedatensatz mit einem Nachschlageintrag abzugleichen und ihn in die Kategorie „Überprüfungsergebnisse“ zu platzieren.	['minimum score']	{'minimum score': 'Mindestpunktzahl'}	['mindestpunktzahl']
88	{'side panel': 'Seitenbereich'}	Control your join in the Mappings section of its side panel:	Steuern Sie Ihren Join im Bereich „Zuordnungen“ des Bedienfelds:	['side panel']	{'side panel': 'Bedienfeld'}	['bedienfeld']
89	{'space': 'Space'}	data related to spaces,	Daten, die sich auf Spaces beziehen,	['space']	{'space': 'Spaces'}	['space']
90	{'space': 'Space', 'allow': 'erlauben'}	You could also allow your space data to be consumed in your HDI containers.	Sie können auch zulassen, dass Ihre Raumdaten in Ihren HDI-Container verbraucht werden.	['space', 'allow']	{'space': 'Raumdaten', 'allow': 'zulassen'}	['raumdaten', 'zulassen']
91	{'minimum score': 'Mindest-Score'}	Set the minimum score needed to match an input record with a lookup record and place it in the Matched results category.	Legen Sie die Mindestpunktzahl fest, die erforderlich ist, um einen Eingabedatensatz mit einem Nachschlageintrag abzugleichen und ihn in die Übereinstimmungsergebnisse-Kategorie zu platzieren.	['minimum score']	{'minimum score': 'Mindestpunktzahl'}	['mindestpunktzahl']
92	{'action': 'Aktion', 'Action': 'Aktion'}	Possible quick actions are:	Mögliche schnelle Aktionen sind:	['action', 'Action']	{'action': 'Aktionen', 'Action': 'Aktionen'}	['aktion', 'aktion']
93	{'condition': 'Bedingung'}	The advantage of this attribute is that you can refer to certain business partners in one condition by using the correct payment clearing group.	Der Vorteil dieses Attributs besteht darin, dass Sie in einer Bedingung auf bestimmte Geschäftspartner verweisen können, indem Sie die korrekte Zahlungsabrechnungsgruppe verwenden.	['condition']	{'condition': 'Bedingung'}	['bedingung']
94	{'compliance requirement': 'Compliance-Anforderung'}	Specifies the Valid To date for compliance requirements.	Gibt das Gültig Bis-Datum für Compliance-Anforderungen an.	['compliance requirement']	{'compliance requirement': 'Compliance-Anforderungen'}	['compliance']
95	{'data provider': 'Datenprovider'}	The data provider has entered some details about the product:	Der Datenanbieter hat einige Details über das Produkt eingegeben:	['data provider']	{'data provider': 'Datenanbieter'}	['datenanbieter']
96	{'release': 'Release', 'create': 'erstellen'}	Information on the contained data, which is entered in the Create Release wizard.	"Informationen über die enthaltenen Daten, die im Assistenten ""Veröffentlichung erstellen"" eingegeben werden."	['release', 'create']	{'release': 'Veröffentlichung', 'create': 'erstellen'}	['veröffentlichung', 'erstellen']
97	{'type': 'Typ'}	In the Permissions page individual permissions assigned to privilege types are displayed	"Auf der Seite ""Berechtigungen"" werden die einzelnen Berechtigungen, die den Berechtigungsarten zugewiesen wurden, angezeigt"	['type']	{'type': 'Berechtigungsarten'}	['berechtigungsarten']
98	{'connector': 'Connector'}	Note that Cloud Connectors that you want to use for data flows only don't require an entry in this list.	Beachten Sie, dass Cloud Connectors, die Sie nur für Datenflüsse verwenden möchten, keinen Eintrag in dieser Liste benötigen.	['connector']	{'connector': '▔'}	['▔ertrat<sos>']
99	{'space': 'Space'}	The space that was selected to store the data product.	Der Speicherort, der für das Datenprodukt ausgewählt wurde.	['space']	{'space': 'Speicherort'}	['speicherort']
100	{'schedule': 'Zeitplan', 'change': 'Änderung'}	This means that the work center change is only visible in your schedule and is not yet saved in the maintenance order.	Das bedeutet, dass die Änderung des Arbeitsplatzes nur in Ihrem Zeitplan angezeigt und noch nicht im Wartungsauftrag gespeichert ist.	['schedule', 'change']	{'schedule': 'Zeitplan', 'change': 'Änderung'}	['zeitplan', 'änderung']
101	{'category': 'Kategorie'}	New records that have the same pairing column value as an existing pairing group are automatically placed in the appropriate results category for that pairing group.	Neue Datensätze, die den gleichen Paarungskolonnenwert wie eine vorhandene Paarungsgruppe aufweisen, werden automatisch in die entsprechende Ergebniskategorie für diese Paarungsgruppe zugeordnet.	['category']	{'category': 'Ergebniskategorie'}	['ergebniskategorie']
102	{'service': 'Service'}	SAP and other SAP products and services mentioned herein as well as their respective logos are trademarks or registered trademarks of SAP SE (or an SAP affiliate company) in Germany and other countries.	SAP und andere hier erwähnte SAP-Produkte und -Dienste sowie die jeweiligen Logos sind Marken oder eingetragene Marken von SAP SE (oder einem verbundenen Unternehmen von SAP) in Deutschland und anderen Ländern.	['service']	{'service': 'Dienste'}	['dienst']
103	{'data provider': 'Datenprovider'}	To be able to use the data product, the data provider will send an activation key via email that provides authorization to access one or multiple data products.	Um das Datenprodukt verwenden zu können, sendet der Datenanbieter einen Aktivierungsschlüssel per E-Mail, der die Berechtigung zum Zugriff auf ein oder mehrere Datenprodukte enthält.	['data provider']	{'data provider': 'Datenanbieter'}	['datenanbieter']
104	{'assigned': 'zugewiesen', 'space': 'Platz'}	It might make sense to delete unnecessary data in your space or to extend the assigned storage.	Es könnte sinnvoll sein, unnötige Daten in Ihrem Speicher zu löschen oder den zugewiesenen Speicher zu erweitern.	['assigned', 'space']	{'assigned': 'zugewiesenen', 'space': 'Speicher'}	['zuwiesen', 'speicher']
105	{'insight': 'Analysen'}	There are many ways to collect and combine data to create business insights:	Es gibt viele Möglichkeiten, Daten zu sammeln und zu kombinieren, um Geschäftsaussichten zu erstellen:	['insight']	{'insight': 'Aussichten'}	['aussicht']
106	{'create': 'anlegen'}	You can create a text block inside the text block library.	Sie können einen Textblock in der Textblockbibliothek erstellen.	['create']	{'create': 'erstellen'}	['erstellen']
107	{'space': 'Space'}	This space is no longer active.	Dieser Raum ist nicht mehr aktiv.	['space']	{'space': 'Raum'}	['raum']
108	{'storage': 'Speicher'}	Allocate your capacity units to compute and storage resources.	Weisen Sie Ihre Kapazitätseinheiten für Rechen- und Speicherressourcen zu.	['storage']	{'storage': 'Speicherressourcen'}	['speicherressourcen']
109	{'share': 'freigeben'}	Generate keys that you can share with consumers to allow them to use the licensed scope of data products.	Erstellen Sie Schlüssel, die Sie mit den Verbrauchern teilen können, damit diese den lizenzierten Umfang von Datenprodukten nutzen können.	['share']	{'share': 'teilen'}	['teilen']
110	{'release': 'Release'}	The release is highlighted on the landing page with the flag “Not published yet”.	Die Veröffentlichung wird auf der Landingpage mit dem Kennzeichen „Noch nicht veröffentlicht“ hervorgehoben.	['release']	{'release': 'Veröffentlichung'}	['veröffentlichung']
111	{'access control': 'Zugriffskontrolle', 'restriction': 'Beschränkung'}	For each business entity used as data restriction, you need to map each key member to the data access control's output column.	Für jede Geschäftseinheit, die als Datenbeschränkung verwendet wird, müssen Sie jeden Schlüsselmitglied zu der Ausgabespalte der Datenzugriffssteuerung zuordnen.	['access control', 'restriction']	{'access control': 'Datenzugriffssteuerung', 'restriction': 'Datenbeschränkung'}	['datenzugriffssteuern', 'datenbeschränkung']
112	{'snapshot': 'Snapshot'}	Create a schedule to load new snapshot of data asynchronously and recurrently in the background according to the defined settings.	Erstellen Sie einen Zeitplan, um neue Snapshots von Daten asynchron und wiederholt im Hintergrund gemäß den definierten Einstellungen zu laden.	['snapshot']	{'snapshot': 'Snapshots'}	['snapshot']
113	{'interface': 'Schnittstelle', 'message': 'Nachricht'}	The interfaces you have subscribed to for monitoring, including the status of the individual messages.	Die Schnittstellen, die Sie für Monitoring abonniert haben, einschließlich des Status der einzelnen Nachrichten.	['interface', 'message']	{'interface': 'Schnittstellen', 'message': 'Nachrichten'}	['schnittstelle', 'nachricht']
114	{'deployment': 'Implementierung'}	A pop up informs you about the source updates before you can go with deployment.	Ein Popup-Fenster informiert Sie über die Quellupdates, bevor Sie mit der Bereitstellung fortfahren können.	['deployment']	{'deployment': 'Bereitstellung'}	['bereitstellung']
115	{'data provider': 'Datenprovider'}	To edit an existing data provider profile, click .	Um ein vorhandenes Datenanbieterprofil zu bearbeiten, klicken Sie auf .	['data provider']	{'data provider': 'Datenanbieterprofil'}	['datenanbieterprofil']
116	{'reference': 'Referenz'}	In this app, you can create the reference data that are used for the simulations.	In dieser App können Sie die Referenzdaten erstellen, die für die Simulationen verwendet werden.	['reference']	{'reference': 'Referenzdaten'}	['referenzdaten']
117	{'deployment': 'Implementierung'}	Note that after a redeployment, the persistency is deleted and the data access is changed back to virtual.	Beachten Sie, dass nach einer Neuimplementierung die Persistenz gelöscht und der Datenzugriff wieder auf virtuell umgestellt wird.	['deployment']	{'deployment': 'Neuimplementierung'}	['neuimplementierungen']
118	{'release': 'Release'}	Specify date and text information for the release.	Geben Sie Datum und Textinformationen für die Veröffentlichung an.	['release']	{'release': 'Veröffentlichung'}	['veröffentlichung']
119	{'data provider': 'Datenprovider'}	You can search and browse for data products and data providers.	Sie können nach Datenprodukten und Datenanbietern suchen und diese durchsuchen.	['data provider']	{'data provider': 'Datenanbietern'}	['datenanbieter']
120	{'deployment': 'Implementierung'}	saving is available but deployment is blocked	das Speichern ist verfügbar, aber die Bereitstellung ist blockiert	['deployment']	{'deployment': 'Bereitstellung'}	['bereitstellung']
121	{'update': 'aktualisieren'}	You can donwload it to get a data update.	Sie können es herunterladen, um Daten zu aktualisieren.	['update']	{'update': 'aktualisieren'}	['aktualisieren']
122	{'skill': 'Qualifikation'}	Skills with a check mark are provided by the resource.	Fertigkeiten mit einem Häkchen werden von der Ressource bereitgestellt.	['skill']	{'skill': 'Fertigkeiten'}	['fertigkeit']
123	{'feedback': 'Feedback'}	This provides you feedback on how many entries within the current business entity there are and how many of them match to entries of the target business entity.	Dadurch erhalten Sie Rückmeldungen darüber, wie viele Einträge innerhalb der aktuellen Geschäftseinheit vorhanden sind und wie viele davon mit Einträgen der Zielgeschäftseinheit übereinstimmen.	['feedback']	{'feedback': 'Rückmeldungen'}	['rückmeldung']
124	{'data provider': 'Datenprovider'}	The data provider profile page provides additional information about the data provider and other products or product groups.	Die Profilseite des Datenanbieters enthält zusätzliche Informationen über den Datenanbieter und andere Produkte oder Produktgruppen.	['data provider']	{'data provider': 'Datenanbieter'}	['datenanbieter']
125	{'insert': 'einfügen'}	insert privilege is removed from the Space Manager	Das Einfügerecht wird aus dem Space-Manager entfernt	['insert']	{'insert': 'Einfügerecht'}	['einfügerecht']
126	{'Table': 'Tabelle'}	Remote Table Monitor - short descriptions	Remote Table Monitor - kurze Beschreibungen	['Table']	{'Table': '▔'}	['▔ertrat<sos>']
127	{'insight': 'Analysen'}	First Steps to Create Insights	Erste Schritte zum Erstellen von Geschäftsanalysen	['insight']	{'insight': 'Geschäftsanalysen'}	['geschäftsanalysen']
128	{'deployment': 'Implementierung'}	[read-only] Displays the deployment and error status of the object.	[read-only] Zeigt den Bereitstellungs- und Fehlerstatus des Objekts an.	['deployment']	{'deployment': 'Bereitstellungs-'}	['bereitstellungsen']
129	{'space': 'Space'}	Keeping an overloaded space active can impact running jobs.	Wenn ein überlasteter Raum aktiv bleibt, kann dies sich auf laufende Jobs auswirken.	['space']	{'space': 'Raum'}	['raum']
130	{'personal data': 'personenbezogene Daten'}	Personal data concerning insurances and bank or credit card accounts	Persönliche Daten zu Versicherungen und Bank- oder Kreditkartenkonten	['personal data']	{'personal data': 'Persönliche Daten'}	['versönlichen datum']
131	{'work center': 'Arbeitsplatz'}	Reviewers do not require any work center assignment.	Prüfer benötigen keine Zuordnung zu einem Arbeitscenter.	['work center']	{'work center': 'Arbeitscenter'}	['arbeitscenter']
132	{'create': 'anlegen'}	You can create clauses and signature blocks with this option.	Mit dieser Option können Sie Klauseln und Unterschriftsblöcke erstellen.	['create']	{'create': 'erstellen'}	['erstellen']
133	{'release': 'Release'}	Enter a text briefly describing the data contained in the release, and enter a comment.	Geben Sie einen Text ein, der die in der Veröffentlichung enthaltenen Daten kurz beschreibt, und geben Sie einen Kommentar ein.	['release']	{'release': 'Veröffentlichung'}	['veröffentlichung']
134	{'space': 'Space'}	Create users so you can assign them to a space.	Erstellen Sie Benutzer, damit Sie ihnen einen Raum zuweisen können.	['space']	{'space': 'Raum'}	['raum']
135	{'business': 'geschäftlich'}	This allows for multiple associations between the same business entities (in different contexts) and provides additional business meaning to the association.	Dies ermöglicht mehrere Assoziationen zwischen denselben Unternehmenseinheiten (in unterschiedlichen Kontexten) und verleiht der Assoziation zusätzliche geschäftliche Bedeutung.	['business']	{'business': 'Unternehmenseinheiten'}	['unternehmenseinheiten']
136	{'consumption model': 'Verbrauchsmodell'}	The associated business entities will be available as dimensions when you create a consumption model.	Die zugehörigen Geschäftsentitäten werden als Dimensionen verfügbar sein, wenn Sie ein Verbrauchsmodell erstellen.	['consumption model']	{'consumption model': 'Verbrauchsmodell'}	['verbrauchsmodell']
137	{'issue': 'Problem'}	Click an issue.	Wählen Sie ein Problem aus.	['issue']	{'issue': 'Problem'}	['problem']
138	{'consumption model': 'Verbrauchsmodell'}	They allow data to flow into the Business Builder and are combined together to produce fact models and consumption models.	Sie ermöglichen, dass Daten in den Business Builder einfließen, und werden kombiniert, um Faktenmodelle und Verbrauchsmodelle zu erstellen.	['consumption model']	{'consumption model': 'Verbrauchsmodelle'}	['verbrauchsmodell']
139	{'start': 'Start'}	Plant stock at start date of reference	Werksbestand am Startdatum der Referenz	['start']	{'start': 'Startdatum'}	['startdatum']
140	{'namespace': 'Namespace'}	Enable ABAP Manageable Trigger Namespace	Aktivieren Sie den Trigger-Namespace für verwaltbare Trigger in ABAP	['namespace']	{'namespace': 'Trigger-Namespace'}	['trigger']
141	{'deployment': 'Implementierung'}	If the view uses other views that were not changed, these views are not touched by the deployment and therefore the persistency is still available.	Wenn die Ansicht andere Ansichten verwendet, die nicht geändert wurden, werden diese Ansichten nicht vom Bereitstellen betroffen, und daher ist die Persistenz weiterhin verfügbar.	['deployment']	{'deployment': 'Bereitstellen'}	['bereitstellen']
142	{'job': 'Job'}	Using the Time From and Time To fields, you can filter for jobs that have been created between these two points in time.	"Mit den Feldern ""Zeit von"" und ""Zeit bis"" können Sie nach Jobs filtern, die zwischen diesen beiden Zeitpunkten erstellt wurden."	['job']	{'job': 'Jobs'}	['job']
143	{'space': 'Space'}	Select a space from the drop-down menu.	Wählen Sie einen Raum aus dem Dropdown-Menü aus.	['space']	{'space': 'Raum'}	['raum']
144	{'space': 'Space'}	A database user lets you ingest data from third-party SQL tools and also allows you to expose your space data to third-party SQL tools.	Ein Datenbankbenutzer ermöglicht es Ihnen, Daten aus SQL-Tools von Drittanbietern zu integrieren, und ermöglicht es Ihnen außerdem, Ihre Weltraumdaten für SQL-Tools von Drittanbietern verfügbar zu machen.	['space']	{'space': 'Weltraumdaten'}	['weltraumdaten']
145	{'available capacity': 'Kapazitätsangebot'}	In this popup you can select different periods and change the available capacity of the work center.	In diesem Popup können Sie verschiedene Perioden auswählen und die verfügbare Kapazität des Arbeitscenters ändern.	['available capacity']	{'available capacity': 'verfügbare Kapazität'}	['verfügbaren kapazität']
146	{'contract': 'Kontrakt'}	For example, while creating a contract, if you need to exit the contract creation process to double-check and clarify certain details, you can select Contract in Preparation.	Wenn Sie beispielsweise einen Vertrag erstellen und den Vertragserstellungsprozess beenden müssen, um bestimmte Details zu überprüfen und zu klären, können Sie „Vertrag in Vorbereitung“ auswählen.	['contract']	{'contract': 'Vertrag'}	['vertrag']
147	{'renewal': 'Erneuerung'}	All Dates:You can see all the dates that are auto-generated when the renewal and termination clauses are either defined in the legal transaction or predefined in the context.	Alle Daten:Sie können alle Daten sehen, die automatisch generiert werden, wenn die Verlängerungs- und Kündigungsbedingungen entweder im Rechtsgeschäft definiert oder im Kontext vordefiniert sind.	['renewal']	{'renewal': 'Verlängerungs-'}	['verlängerungsen']
148	{'data provider': 'Datenprovider'}	The Data Sharing Cockpit is the tool you use as a the data provider.	Das Data Sharing Cockpit ist das Tool, das Sie als Datenanbieter verwenden.	['data provider']	{'data provider': 'Datenanbieter'}	['datenanbieter']
149	{'space': 'Space'}	The business catalog gives you an overview of all the models you can use, across all the Spaces you are authorized for.	Der Geschäftskatalog bietet Ihnen einen Überblick über alle Modelle, die Sie verwenden können, und zwar in allen Spaces, für die Sie berechtigt sind.	['space']	{'space': 'Spaces'}	['space']
150	{'space': 'Platz'}	Check how much spaces the task logs are using on a tenant, and define criteria to manually or automatically delete them.	Überprüfen Sie, wie viel Speicherplatz die Aufgabenprotokolle in einem Mandanten verbrauchen, und legen Sie Kriterien fest, um sie manuell oder automatisch zu löschen.	['space']	{'space': 'Speicherplatz'}	['speicherplatz']
151	{'create': 'erstellen'}	With connection type Open Connectors you can now create connections to the third-party data sources available as connector instances with your  account.	Mit dem Verbindungstyp „Offene Connectors“ können Sie nun Verbindungen zu den Drittanbieter-Datenquellen herstellen, die als Connector-Instanzen in Ihrem Konto verfügbar sind.	['create']	{'create': 'herstellen'}	['herstellen']
152	{'restriction': 'Beschränkung'}	Based on implicit data restrictions, every user has access to the relevant data according to his or her role.	Basierend auf impliziten Datenbeschränkungen hat jeder Benutzer gemäß seiner Rolle Zugriff auf die relevanten Daten.	['restriction']	{'restriction': 'Datenbeschränkungen'}	['datenbeschränken']
153	{'transfer': 'übertragen'}	Transfer staffing assignments according to your selection criteria.	Übertragen Sie Personalzuordnungen gemäß Ihren Selektionskriterien.	['transfer']	{'transfer': 'Übertragen'}	['übertragen']
154	{'renewal': 'Erneuerung'}	All Dates:You can see all the dates that are auto-generated when renewal and termination clauses are predefined.	Alle Termine:Sie können alle Termine sehen, die automatisch generiert werden, wenn Verlängerungs- und Kündigungsbedingungen vordefiniert sind.	['renewal']	{'renewal': 'Verlängerungs-'}	['verlängerungsen']
155	{'consumption model': 'Verbrauchsmodell'}	Create a fact model to group associated analytical data sets and dimensions together for use in multiple consumption models.	Erstellen Sie ein Faktenmodell, um verknüpfte analytische Datensätze und Dimensionen für die Verwendung in verschiedenen Verbrauchsmodellen zusammenzufassen.	['consumption model']	{'consumption model': 'Verbrauchsmodellen'}	['verbrauchsmodellen']
156	{'space': 'Space'}	This is done to prevent over usage of the space.	Dies wird getan, um eine übermäßige Nutzung des Raums zu verhindern.	['space']	{'space': 'Raums'}	['raum']
157	{'Services': 'Dienste', 'service': 'Dienst'}	Table Services - Enable the In-Memory Storage option to store the table data directly in memory (see ).	Tabelle-Dienste – Aktivieren Sie die Option „Speicher im Speicher“, um die Tabeldaten direkt im Speicher zu speichern (siehe ).	['Services', 'service']	{'Services': 'Tabelle-Dienste', 'service': 'Dienste'}	['tabelle', 'dienst']
158	{'reference': 'Verweis'}	Attributes in consumption models can either reference attributes from the included fact or dimension sources or be calculated from other attributes of the current consumption model.	Attribute in Verbrauchsmodellen können entweder Attribute aus den enthaltenen Fakten- oder Dimensionsquellen referenzieren oder aus anderen Attributen des aktuellen Verbrauchsmodells berechnet werden.	['reference']	{'reference': 'referenzieren'}	['referenzieren']
159	{'item': 'Element'}	A configuration (or implementation) item may contain implementation steps which are executed in end user apps.	Ein Konfigurations-(oder Implementierungs-)element kann Implementierungsschritte enthalten, die in Endbenutzer-Apps ausgeführt werden.	['item']	{'item': '▔'}	['▔ertrat<sos>']
160	{'space': 'Space'}	Access SAP HANA Deployment Infrastructure containers through  and use your data in the Data Builder or gain access to your space data from your HDI container.	Greifen Sie über auf SAP HANA Deployment Infrastructure-Container zu, und verwenden Sie Ihre Daten im Datenbauer, oder greifen Sie auf Ihre Raumdaten aus Ihrem HDI-Container zu.	['space']	{'space': 'Raumdaten'}	['raumdaten']
