	terms	src_raw	mt_raw	src_terms	alg_terms	norm_tgt_terms
276	{'space': 'Space'}	Administration in Spaces	Verwaltung in Räumen	['space']	{'space': 'Räumen'}	['raum|räumen']
277	{'association': 'Assoziation'}	Select the association(s) to copy and click Create.	"Wählen Sie die Assoziation(en) zum Kopieren aus, und klicken Sie auf ""Erstellen""."	['association']	{'association': 'Assoziation'}	['assoziation']
278	{'space': 'Space'}	Choose a space from the drop-down list.	Wählen Sie einen Raum aus der Dropdown-Liste aus.	['space']	{'space': 'Raum'}	['raum']
279	{'create': 'erstellen'}	Choose Create Connection.	"Wählen Sie ""Verbindung erstellen""."	['create']	{'create': 'erstellen'}	['erstellen']
280	{'asset': 'Vermögenswert'}	There are two kinds of assets:	Es gibt zwei Arten von Vermögenswerten:	['asset']	{'asset': 'Vermögenswerten'}	['vermögenswert']
281	{'clearing entry': 'Ausgleichsbeleg'}	You can reset the clearing of line items as well as reverse the clearing entry.	Sie können die Buchung von Zeilenelementen stornieren und die Stornierungbuchung rückgängig machen.	['clearing entry']	{'clearing entry': 'Stornierungbuchung'}	['stornierungbuchen']
282	{'regulation': 'Vorschrift'}	Create New Regulation	Neue Verordnung anlegen	['regulation']	{'regulation': 'Verordnung'}	['verordnung']
283	{'change document': 'Änderungsdokument', 'type': 'Art'}	Type of Change Document	Typ des Änderungsdokuments	['change document', 'type']	{'change document': 'Änderungsdokuments', 'type': 'Änderungsdokuments'}	['änderungsdokument', 'änderungsdokument']
284	{'create': 'anlegen'}	Create a conditional	Erstellen Sie eine bedingte	['create']	{'create': 'Erstellen'}	['erstellen']
285	{'compliance requirement': 'Compliance-Anforderung'}	Compliance Requirement Country	Compliance-Anforderung Land	['compliance requirement']	{'compliance requirement': 'Compliance-Anforderung'}	['compliance']
286	{'category': 'Warengruppe'}	You must choose at least one category.	Sie müssen mindestens eine Kategorie auswählen.	['category']	{'category': 'Kategorie'}	['kategorie']
287	{'access control': 'Zugriffskontrolle'}	The column containing users ids must be selected as the Principal Name Column in your data access control.	Die Spalte, die Benutzer-IDs enthält, muss als Hauptnamensspalte in Ihrer Datenzugriffssteuerung ausgewählt werden.	['access control']	{'access control': 'Datenzugriffssteuerung'}	['datenzugriffssteuern']
288	{'notification': 'Benachrichtigung'}	List of Notifications	Liste von Benachrichtigungen	['notification']	{'notification': 'Benachrichtigungen'}	['benachrichtigung']
289	{'create': 'anlegen'}	Click AddCreate User.	"Klicken Sie auf ""AddCreate User"" (Benutzer erstellen)."	['create']	{'create': 'erstellen'}	['erstellen']
290	{'space': 'Space'}	Save your space.	Sparen Sie Platz.	['space']	{'space': 'Platz'}	['platz']
291	{'document': 'Beleg'}	Documents - Communication Status	Belege - Kommunikationsstatus	['document']	{'document': 'Belege'}	['beleg']
292	{'request': 'Antrag'}	Click Submit Request.	"Klicken Sie auf ""Anforderung senden""."	['request']	{'request': 'Anforderung'}	['anforderung']
293	{'grouping rule': 'Gruppierungsregel'}	You can trigger the creation of new grouping rules, search for existing grouping rules, and delete grouping rules that are no longer required.	Sie können die Erstellung neuer Gruppierungsregeln auslösen, nach vorhandenen Gruppierungsregeln suchen und Gruppierungsregeln löschen, die nicht mehr benötigte sind.	['grouping rule']	{'grouping rule': 'Gruppierungsregeln'}	['grupperungsregeln']
294	{'execute': 'ausführen'}	Check the status before you execute changes.	Prüfen Sie den Status, bevor Sie Änderungen ausführen.	['execute']	{'execute': 'ausführen'}	['ausführen']
295	{'asset': 'Anlage'}	Navigate from Asset Depreciation Values.	Navigieren Sie von den Vermögenswertwertminderungen aus.	['asset']	{'asset': 'Vermögenswert'}	['vermögenswert']
296	{'assignment': 'Einsatz'}	You have the following options to show assignment changes:	Sie haben folgende Optionen, um Auftragsänderungen anzuzeigen:	['assignment']	{'assignment': 'Auftragsänderungen'}	['auftragsänderungen']
297	{'requirement': 'Bedarf'}	Create a Custom Requirement	Erstellen Sie eine Benutzerdefinierte Anforderung	['requirement']	{'requirement': 'Anforderung'}	['anforderung']
298	{'comment': 'Comment'}	Click to add file comment	Klicken Sie, um einen Dateikommentar hinzuzufügen	['comment']	{'comment': 'Dateikommentar'}	['dateikommentar']
299	{'Procedure': 'Verfahren', 'create': 'erstellen'}	This procedure provides the option to create SAP HANA virtual tables in the open SQL schema that refer to objects in data lake.	Dieses Verfahren bietet die Möglichkeit, SAP HANA-virtuelle Tabellen im offenen SQL-Schema zu erstellen, die auf Objekte im Data Lake verweisen.	['Procedure', 'create']	{'Procedure': 'Verfahren', 'create': 'erstellen'}	['verfahren', 'erstellen']
300	{'cost component': 'Kostenkomponente'}	Enter the name of the cost component in the Name field.	Geben Sie den Namen der Kostenkomponente in das Name-Feld ein.	['cost component']	{'cost component': 'Kostenkomponente'}	['kostenkomponenten']
301	{'issue': 'Issue'}	Create an issue:	Erstellen Sie ein Problem:	['issue']	{'issue': 'Problem'}	['problem']
302	{'query': 'Abfrage'}	Save the query.	Sichern Sie die Abfrage.	['query']	{'query': 'Abfrage'}	['abfrage']
303	{'workflow': 'Workflow', 'create': 'anlegen'}	Create Workflow for Sourcing Projects	Erstellen Sie einen Workflow für Ausschreibungsprojekte	['workflow', 'create']	{'workflow': 'Workflow', 'create': 'Erstellen'}	['workflow', 'erstellen']
304	{'scope': 'Umfang'}	Delete a scope.	Löschen Sie einen Bereich.	['scope']	{'scope': 'Bereich'}	['bereich']
305	{'space': 'Space'}	Save the space.	Speichern Sie den Raum.	['space']	{'space': 'Raum'}	['raum']
306	{'tenant': 'Mandant'}	URL of the SuccessFactors Employee Central tenant	URL des SuccessFactors Employee Central-Mandanten	['tenant']	{'tenant': 'Mandanten'}	['mandant']
307	{'status': 'Status'}	Indicates the current status of a master data record.	Gibt den aktuellen Status eines Stammdatenelements an.	['status']	{'status': 'Status'}	['status']
308	{'stage': 'Abschnitt'}	Navigate to Stages.	Navigieren Sie zu Abschnitte.	['stage']	{'stage': 'Abschnitte'}	['abschnitt']
309	{'source': 'Source'}	Activation of Data Source:	Aktivierung von Datenquelle:	['source']	{'source': 'Datenquelle'}	['datenquellen']
310	{'level': 'Stufe'}	Packaging levels are used for the following purposes:	Verpackungsstufen werden für folgende Zwecke verwendet:	['level']	{'level': 'Verpackungsstufen'}	['verpackunstufen']
311	{'create': 'erstellen'}	Create a Target Table in Data Flow	Erstellen Sie eine Zieltabelle in Data Flow	['create']	{'create': 'Erstellen'}	['erstellen']
312	{'mapping': 'Zuordnung'}	Enter an optional description for the mapping.	Geben Sie eine optionale Beschreibung für das Mapping ein.	['mapping']	{'mapping': 'Mapping'}	['mapping']
313	{'location': 'Ort'}	Specify the locations for the following options:	Geben Sie die Speicherorts für die folgenden Optionen an:	['location']	{'location': 'Speicherorts'}	['speicherorten']
314	{'classification': 'Klassifikation'}	· Select Classification	· Klassifizierung auswählen	['classification']	{'classification': 'Klassifizierung'}	['klassifizierung']
315	{'document type': 'Dokumentart'}	To specify the document type as scheduling agreement.	Geben Sie als Planungsplan an, dass es sich um einen Vertrag handelt.	['document type']	{'document type': 'Vertrag'}	['vertrag']
316	{'term': 'Term'}	Enter the term.	Geben Sie den Begriff ein.	['term']	{'term': 'Begriff'}	['begriff']
317	{'create': 'erstellen'}	Go to the Filter tab Select Create filter and define your filter conditions:	"Gehen Sie zur Registerkarte ""Filter"" Wählen Sie ""Filter erstellen"", und definieren Sie Ihre Filterbedingungen:"	['create']	{'create': 'erstellen'}	['erstellen']
318	{'schedule': 'Terminplan'}	Review the schedule.	Überprüfen Sie den Zeitplan.	['schedule']	{'schedule': 'Zeitplan'}	['zeitplan']
319	{'release': 'Release'}	Edit a Release	Bearbeiten Sie eine Veröffentlichung	['release']	{'release': 'Veröffentlichung'}	['veröffentlichung']
320	{'limit': 'Grenzwert'}	For clearing, the lower of the limit defined for your user and the limit defined for your business partner applies.You can also define amount limits for your Financial Accounting users.	Für Ausgleich gilt die niedrigere Grenze, die für Ihren Benutzer und die Grenze, die für Ihren Geschäftspartner festgelegt wurde.Sie können auch Betragsgrenzen für Ihre Finanzbuchhaltungsbenutzer festlegen.	['limit']	{'limit': 'Grenze'}	['grenze']
321	{'Group': 'Group', 'group': 'group'}	For more information, see Service Group Publishing.	"Weitere Informationen finden Sie unter ""Service Group Publishing""."	['Group', 'group']	{'Group': 'Service', 'group': 'Service'}	['service', 'service']
322	{'income': 'Einnahmen'}	Format for Income Classification	Format für die Einkommensklassifizierung	['income']	{'income': 'Einkommen'}	['einkommen']
323	{'access control': 'Zugriffskontrolle'}	You must select one or more columns containing filter criteria as Output Columns in your data access control.	Sie müssen eine oder mehrere Spalten auswählen, die Filterkriterien enthalten, als Ausgabespalten in Ihrer Datenzugriffssteuerung.	['access control']	{'access control': 'Datenzugriffssteuerung'}	['datenzugriffssteuern']
324	{'space': 'Space'}	Name of the space the product belongs to.	Name des Bereichs, zu dem das Produkt gehört.	['space']	{'space': 'Bereichs'}	['bereich']
325	{'restriction': 'Einschränkung'}	Restrictions on Capture:	Einschränkungen beim Erfassen:	['restriction']	{'restriction': 'Einschränkungen'}	['einschränkung']
326	{'item': 'Element'}	Long descriptions are available for the following items:	Lange Beschreibungen sind für die folgenden Elemente verfügbar:	['item']	{'item': 'Elemente'}	['element']
327	{'schedule': 'Zeitplan'}	Save the schedule.	Sichern Sie den Zeitplan.	['schedule']	{'schedule': 'Zeitplan'}	['zeitplan']
328	{'owner': 'Eigentümer'}	Click Select Owner.	"Klicken Sie auf ""Eigentümer auswählen""."	['owner']	{'owner': 'Eigentümer'}	['eigentümer']
329	{'sequence': 'Abfolge'}	Clear as Sequence	Gemäß Gemäß	['sequence']	{'sequence': 'Gemäß'}	['gemen']
330	{'joint venture accounting': 'Joint Venture Accounting', 'Accounting': 'Accounting'}	Setting up Joint Venture Accounting Cost Objects:	Einrichten von Joint Venture-Rechnungsführungs-Kostenträgern:	['joint venture accounting', 'Accounting']	{'joint venture accounting': 'Joint Venture-Rechnungsführungs', 'Accounting': 'Rechnungsführungs'}	['joint venturen', 'technungsführungen']
331	{'load': 'Load'}	Download the following files:	Downloaden Sie die folgenden Dateien:	['load']	{'load': 'Dateien'}	['datei']
332	{'template': 'Vorlage'}	For more information about creating an equipment template, see .	Weitere Informationen zum Erstellen einer Equipment-Vorlage finden Sie unter .	['template']	{'template': 'Vorlage'}	['vorlage']
333	{'batch': 'Batch', 'call': 'Call'}	On the SAP Easy Access menu, choose  Joint venture accounting  Actual posting  Cash call batch ses.	Wählen Sie im Menü von SAP Easy Access die Optionen „Joint venture accounting“, „Tatsächliche Buchung“ und „Kassengeldanforderungstaktbatches“ aus.	['batch', 'call']	{'batch': 'Taktbatches', 'call': 'Kassengeldanforderungstaktbatches'}	['taktbatch', 'hassengeldanforderungstakches']
334	{'type': 'Typ'}	Profile types include the following:	Zu den Profiltypen gehören die folgenden:	['type']	{'type': 'Profiltypen'}	['profiltypen']
335	{'project manager': 'Projektleiter', 'requested': 'angefragt'}	It allows you to create an assignment exactly as requested by the project manager.This action is available if the project manager requested a specific resource and no resource has been assigned to the request yet.	Es ermöglicht Ihnen, einen Einsatz genau gemäß den Anforderungen des Projektmanagers anzulegen. Diese Aktion ist verfügbar, wenn der Projektmanager eine bestimmte Ressource angefordert hat und dem Antrag noch keine Ressource zugewiesen wurde.	['project manager', 'requested']	{'project manager': 'Projektmanager', 'requested': 'angefordert'}	['projektmanager', 'anfordern']
336	{'document class': 'Belegklasse', 'select': 'auswählen'}	The characteristic value columns list the values that have been maintained for the characteristics defined for the document class.You can select the characteristic value by entering the value manually (possible entries are then suggested by the app) or, alternatively, by choosing the value in the subsequent characteristic dialog screen.	In den Spalten mit charakteristischen Werten sind die Werte aufgeführt, die für die für die Dokumentklasse definierten Merkmale beibehalten wurden.Sie können den charakteristischen Wert erfassen, indem Sie den Wert manuell eingeben (dann werden mögliche Einträge von der App vorgeschlagen), oder alternativ den Wert im nachfolgenden Dialogfenster für charakteristische Werte auswählen.	['document class', 'select']	{'document class': 'Dokumentklasse', 'select': 'auswählen'}	['dokumentklasse', 'auswählen']
337	{'action': 'Aktion', 'Action': 'Aktion'}	This column shows you if quick actions are available for a resource request.If a quick action is available, a link is shown.	In dieser Spalte wird angezeigt, ob Schnellaktionen für eine Ressourcenanforderung verfügbar sind. Wenn eine Schnellaktion verfügbar ist, wird ein Link angezeigt.	['action', 'Action']	{'action': 'Schnellaktionen', 'Action': 'Schnellaktionen'}	['schnellaktion', 'schnellaktion']
338	{'obsolete': 'obsolet'}	Indicates whether the MRS item is obsolete.	Gibt an, ob das MRS-Element veraltet ist.	['obsolete']	{'obsolete': 'veraltet'}	['veraltet']
339	{'release': 'Release'}	Locking a Release	Sperren einer Veröffentlichung	['release']	{'release': 'Veröffentlichung'}	['veröffentlichung']
340	{'audit log': 'Audit-Protokoll'}	Audit log missing detailed information	Auditprotokoll fehlt Detailinfos	['audit log']	{'audit log': 'Auditprotokoll'}	['auditprotokoll']
341	{'transaction': 'Transaktion'}	<description of the transaction>	<Beschreibung der Transaktion>	['transaction']	{'transaction': 'Transaktion'}	['transaktion']
342	{'apply': 'anwenden'}	Click Apply to save your new tile.	"Klicken Sie auf ""Anwenden"", um Ihre neue Kachel zu speichern."	['apply']	{'apply': 'Anwenden'}	['anwenden']
343	{'space': 'Space'}	The following views are made available in this space:	Die folgenden Views sind in diesem Bereich verfügbar:	['space']	{'space': 'Bereich'}	['bereich']
344	{'section': 'Abschnitt'}	In the Trusted Origins section, choose between the following options:	"Wählen Sie im Abschnitt ""Vertrauenswürdige Ursprungsadressen"" zwischen den folgenden Optionen:"	['section']	{'section': 'Abschnitt'}	['abschnitt']
345	{'operation': 'Vorgang'}	The dependencies are assigned to the operation.	Die Beziehungen werden dem Vorgang zugewiesen.	['operation']	{'operation': 'Vorgang'}	['vorgang']
346	{'template': 'Vorlage'}	Doc.Template Name in Structure	Vorlagenname in Struktur	['template']	{'template': 'Vorlagenname'}	['vorlagenname']
347	{'primary contact': 'Hauptansprechpartner'}	Primary Contact Indicator	Primäres Kontaktkennzeichen	['primary contact']	{'primary contact': 'Kontaktkennzeichen'}	['kontaktkennzeichen']
348	{'message': 'Nachricht'}	These messages are enabled by default.	Diese Nachrichten sind standardmäßig aktiviert.	['message']	{'message': 'Nachrichten'}	['nachricht']
349	{'transfer': 'Übertragung', 'check': 'Prüfung'}	Open Check and Transfer of Staffing Assignments.	Öffnen Sie die Check- und Transfer-Funktion für Planstellenbesetzungen.	['transfer', 'check']	{'transfer': 'Transfer-Funktion', 'check': 'Check'}	['transfer', 'checken']
350	{'compliance requirement': 'Compliance-Anforderung'}	Tasks are created in the compliance requirement.	Aufgaben werden im Compliance-Anforderungsprofil angelegt.	['compliance requirement']	{'compliance requirement': 'Compliance-Anforderungsprofil'}	['compliance']
351	{'run': 'Lauf'}	Run In Simulation	Ausführen in Simulation	['run']	{'run': 'Ausführen'}	['ausführen']
352	{'transfer amount': 'Überweisungsbetrag'}	Cash Pool Minimum Transfer Amount	Minimaler Transferbetrag für Cash Pool	['transfer amount']	{'transfer amount': 'Transferbetrag'}	['transferbetrag']
353	{'unit of measure': 'Mengeneinheit'}	This class is used to convert a quantity from one unit of measurement to another.	Diese Klasse wird verwendet, um eine Menge von einer Maßeinheit in eine andere umzurechnen.	['unit of measure']	{'unit of measure': 'Maßeinheit'}	['maßeinheit']
354	{'project manager': 'Projektleiter', 'requested': 'angefragt', 'staffed': 'Person zugeordnet'}	If a resource has been requested and the request has not yet been staffed, you'll see a Quick Assignment link in the Actions column.This allows you to create the assignment exactly as requested by the project manager.	Wenn eine Ressource angefordert wurde und die Anfrage noch nicht bearbeitet wurde, sehen Sie in der Spalte Aktionen einen Link für die schnelle Zuordnung.Dies ermöglicht es Ihnen, den Einsatz genau so zu erstellen, wie er vom Projektmanager angefordert wurde.	['project manager', 'requested', 'staffed']	{'project manager': 'Projektmanager', 'requested': 'angefordert', 'staffed': 'bearbeitet'}	['projektmanager', 'anfordern', 'bearbeiten']
355	{'connectivity': 'Konnektivität'}	Under Connectivity, choose Destinations.	"Wählen Sie unter ""Konnektivität"" die Option ""Ziele""."	['connectivity']	{'connectivity': 'Konnektivität'}	['konnektivität']
356	{'open': 'offen'}	Open port in Cloud Foundry environments	Öffnen Sie den Port in Cloud Foundry-Umgebungen	['open']	{'open': 'Öffnen'}	['offnen']
357	{'create': 'erstellen'}	Choose Create new contract from the dropdown list.	"Wählen Sie ""Neuer Vertrag"" aus der Dropdown-Liste."	['create']	{'create': '▔'}	['▔ertrat<sos>']
358	{'space': 'Space'}	You can decide how important your space is compared to other spaces.	Sie können entscheiden, wie wichtig Ihr Raum im Vergleich zu anderen Räumen ist.	['space']	{'space': 'Raum'}	['raum']
359	{'business user': 'Geschäftsbenutzer'}	To add a business user, proceed as follows:	Um einen Geschäftsbenutzer hinzuzufügen, gehen Sie wie folgt vor:	['business user']	{'business user': 'Geschäftsbenutzer'}	['geschäftsbenutzer']
360	{'location': 'Standort'}	Select a location.	Wählen Sie einen Ort aus.	['location']	{'location': 'Ort'}	['ort']
361	{'payment details': 'Zahlungsdetails'}	You can choose one of the following options for managing payment details:	Sie können eine der folgenden Optionen für die Verwaltung von Zahlungsdetails wählen:	['payment details']	{'payment details': 'Zahlungsdetails'}	['zahlungsdetails']
362	{'consumption model': 'Verbrauchsmodell'}	The exposed dimension sources can the be used in your consumption models.	Die freigelegten Dimensionsquellen können in Ihren Verbrauchsmodellen verwendet werden.	['consumption model']	{'consumption model': 'Verbrauchsmodellen'}	['verbrauchsmodellen']
363	{'document': 'Beleg'}	Specifies the revision date of the document.	Legt das Datum der Überarbeitung des Dokuments fest.	['document']	{'document': 'Dokuments'}	['dokument']
364	{'create': 'erstellen'}	Create and delete teams.	Erstellen und löschen Sie Teams.	['create']	{'create': 'Erstellen'}	['erstellen']
365	{'transfer': 'Transfer'}	You can also enter your own mass transfer ID.	Sie können auch Ihre eigene Massentransfer-ID eingeben.	['transfer']	{'transfer': 'Massentransfer-ID'}	['massentransfer']
366	{'scope': 'Konsolidierungskreis'}	Go to Scope Builder.	Navigieren Sie zum Bereichsgenerator.	['scope']	{'scope': 'Bereichsgenerator'}	['bereichsgenarorern']
367	{'type': 'Typ'}	Choose the relative date type.	Wählen Sie den relativen Datentyp aus.	['type']	{'type': 'Datentyp'}	['datentyp']
368	{'property': 'Immobilie'}	Enter Additional Property Information	Zusätzliche Immobilieninformationen eingeben	['property']	{'property': 'Immobilieninformationen'}	['immobilieninformationen']
369	{'schedule': 'Terminplan'}	Build a schedule by adding and removing order operations	Erstellen Sie einen Zeitplan, indem Sie Auftragsvorgänge hinzufügen und entfernen	['schedule']	{'schedule': 'Zeitplan'}	['zeitplan']
370	{'query': 'Abfrage'}	The end date and time for the query.	Das Enddatum und die Uhrzeit für die Abfrage.	['query']	{'query': 'Abfrage'}	['abfrage']
371	{'association': 'Zuordnung'}	Associations between entities	Assoziationen zwischen Entitys	['association']	{'association': 'Assoziationen'}	['assoziation']
372	{'batch': 'Charge'}	You can perform batch postings for the activities.	Sie können Buchungen für die Aktivitäten im Batch durchführen.	['batch']	{'batch': 'Batch'}	['batch']
373	{'history': 'Verlauf'}	The history displays information such as:	Die Verlaufsliste zeigt Informationen wie folgende an:	['history']	{'history': 'Verlaufsliste'}	['verlaufslisten']
374	{'report': 'Bericht'}	Click on the reporting task you want to process.	Wählen Sie die Berichtsaufgabe aus, die Sie verarbeiten möchten.	['report']	{'report': 'Berichtsaufgabe'}	['berichtsaufgaben']
375	{'business name': 'betriebswirtschaftlicher Name'}	Dimensions are used to group data whose content is logicallyBy default, you see your object’s business name.	Dimensionen werden verwendet, um Daten deren Inhalt logisch ist, zu gruppierenStandardmäßig sehen Sie den Geschäftsnamen Ihres Objekts.	['business name']	{'business name': 'Geschäftsnamen'}	['geschäftsnamen']
376	{'create': 'erstellen'}	Create and manage requisitions using Microsoft Excel	Erstellen und verwalten Sie Bestellungen mit Microsoft Excel	['create']	{'create': 'Erstellen'}	['erstellen']
377	{'service': 'Service'}	Create a Service Key	Anlegen eines Dienstschlüssels	['service']	{'service': 'Dienstschlüssels'}	['dienstschlüsseln']
378	{'audit': 'Audit'}	Select the Store Audit tab page.	"Wählen Sie die Registerseite ""Store Audit"" aus."	['audit']	{'audit': 'Audit'}	['audit']
379	{'scenario': 'Szenario'}	Intelligent Scenarios Name	Intelligente Szenarien Name	['scenario']	{'scenario': 'Szenarien'}	['szenarienen']
380	{'item': 'Element'}	Select the item you want to change.	Wählen Sie das Element aus, das Sie ändern möchten.	['item']	{'item': 'Element'}	['element']
381	{'display': 'Anzeige'}	173 Display Phantom Hierarchy	173 Anzeigen von Dummyhierarchie	['display']	{'display': 'Anzeigen'}	['anzeige']
382	{'document type': 'Dokumentenart'}	Change the document type.	Ändern Sie den Dokumenttyp.	['document type']	{'document type': 'Dokumenttyp'}	['dokumenttyp']
383	{'report': 'Report'}	The report does not display any data.	Der Bericht zeigt keine Daten an.	['report']	{'report': 'Bericht'}	['bericht']
384	{'package': 'Paket'}	You can define the following which applies to the packages:	Sie können Folgendes festlegen, das für die Pakete gilt:	['package']	{'package': 'Pakete'}	['paket']
385	{'access': 'Zugriff'}	For a simple step-by-step guide see Accessing your HDI container .	Ein einfacher Schritt-für-Schritt-Leitfaden finden Sie unter „Zugriff auf Ihren HDI-Container“.	['access']	{'access': 'Zugriff'}	['zugriff']
386	{'origin': 'Ursprung'}	Origin of Rule	Herkunft der Regel	['origin']	{'origin': 'Herkunft'}	['herkunft']
387	{'forecast': 'Forecast'}	Search for forecast.	Suchen Sie nach einer Prognose.	['forecast']	{'forecast': 'Prognose'}	['prognose']
388	{'asset': 'Anlage'}	Navigate to the superior asset.	Navigieren Sie zu dem übergeordneten Asset.	['asset']	{'asset': 'Asset'}	['assen']
389	{'indicator': 'Indikator'}	There are two types of busy indicator:	Es gibt zwei Arten von Belegungsindikatoren:	['indicator']	{'indicator': 'Belegungsindikatoren'}	['belenngsindikatoren']
390	{'reference characteristic': 'Bezugsmerkmal'}	Handling of reference Characteristics.	Verarbeitung von Referenzmerkmalen.	['reference characteristic']	{'reference characteristic': 'Merkmalen'}	['merkmal']
391	{'document': 'Beleg'}	the document tab is clicked,	das Dokumentregister wird ausgewählt,	['document']	{'document': 'Dokumentregister'}	['dokumentregister']
392	{'work package': 'Work-Package'}	A work package combines the following information:	Ein Arbeitspaket kombiniert folgende Informationen:	['work package']	{'work package': 'Arbeitspaket'}	['arbeitspaket']
393	{'create': 'erstellen'}	You just need to create a Data Provider Profile.	Sie müssen lediglich ein Datenanbieterprofil erstellen.	['create']	{'create': 'erstellen'}	['erstellen']
394	{'item': 'Artikel'}	To add an item, select the item from the Items list.	Um ein Element hinzuzufügen, wählen Sie das Element aus der Elementliste aus.	['item']	{'item': 'Element'}	['element']
395	{'time frame': 'Zeitraum'}	You can define a time frame in the following ways:	Sie können einen Zeitrahmen auf folgende Möglichkeiten beziehen:	['time frame']	{'time frame': 'Zeitrahmen'}	['zeitrahmen']
396	{'panel': 'Bereich'}	If the Source Browser panel is not visible on the left of the screen, click Source Browser in the toolbar to show it.	"Wenn das Bedienfeld ""Quellenbrowser"" nicht auf der linken Seite des Bildes angezeigt wird, klicken Sie in der Symbolleiste auf ""Quellenbrowser"", um es anzuzeigen."	['panel']	{'panel': 'Bedienfeld'}	['bedienfeld']
397	{'facility': 'Objekt'}	Provides general information about the facility.	Bereitstellt allgemeine Informationen über die Einrichtung.	['facility']	{'facility': 'Einrichtung'}	['einrichtung']
398	{'attribute type': 'Attributstyp'}	Select the attribute type from the following options:	Wählen Sie den Attributtyp aus folgenden Optionen aus:	['attribute type']	{'attribute type': 'Attributtyp'}	['attributtyp']
