	terms	src_raw	mt_raw	src_terms	alg_terms	norm_tgt_terms
161	{'end user': 'Endbenutzer'}	Because the implementation step is executed in an end user app, the changes are not transportable from the Q system to P system.	Da der Implementierungsschritt in einer Endbenutzer-App ausgeführt wird, sind die Änderungen nicht von dem Q-System in das P-System übertragbar.	['end user']	{'end user': 'Endbenutzer-App'}	['endbenutzer']
162	{'creator': 'Creator'}	The BI Content Creator creates and changes stories.	Der BI-Content-Creator erstellt und ändert Storys.	['creator']	{'creator': 'Content-Creator'}	['content']
163	{'graphical view': 'grafischer View'}	Click the New Graphical View tile to enter the builder.	Klicken Sie auf die Kachel „Neue grafische Ansicht“, um den Builder aufzurufen.	['graphical view']	{'graphical view': 'grafische Ansicht'}	['grafischen ansicht']
164	{'issue': 'Problem', 'panel': 'Fenster'}	Click a colored cell or the entire row to view more details about the issues and their category in the Issues panel.	Klicken Sie auf eine farbige Zelle oder die gesamte Zeile, um im Probleme-Bedienfeld weitere Details zu den Problemen und ihrer Kategorie anzuzeigen.	['issue', 'panel']	{'issue': 'Problemen', 'panel': 'Bedienfeld'}	['problem', 'bedienfeld']
165	{'bucket': 'Periode'}	The quantities are displayed per month or week (bucket).	Die Mengen werden pro Monat oder Woche (Korb) angezeigt.	['bucket']	{'bucket': 'Korb'}	['korb']
166	{'script': 'Skript'}	SQLScript (Table Function) - Use SQL Script with support for  statements, loops, and other more complex structures.	SQLScript (Tabellefunktion) – Verwenden Sie SQL-Skript mit Unterstützung für ▁▁ Anweisungen, Schleifen und andere komplexere Strukturen.	['script']	{'script': 'SQL-Skript'}	['sql']
167	{'update': 'Aktualisierung'}	No updates are made on your system.	Es werden keine Aktualisierungen auf Ihrem System vorgenommen.	['update']	{'update': 'Aktualisierungen'}	['aktualisierung']
168	{'message': 'Nachricht'}	There are six types of messages:	Es gibt sechs Arten von Nachrichten:	['message']	{'message': 'Nachrichten'}	['nachricht']
169	{'space': 'Space'}	The Business Catalog gives an overview of all the models the business user can use, across all the Spaces they are authorized for.	Der Geschäftskatalog bietet einen Überblick über alle Modelle, die der Geschäftsbenutzer in allen Räumen, für die er autorisiert ist, verwenden kann.	['space']	{'space': 'Räumen'}	['raum|räumen']
170	{'trigger': 'Auslöser'}	For more information, see Oracle Trigger-Based Replication in the SAP HANA Smart Data Integration and SAP HANA Smart Data Quality Installation and Configuration Guide.	Weitere Informationen finden Sie unter „Oracle Trigger-Based Replication“ im Installations- und Konfigurationshandbuch für SAP HANA Smart Data Integration und SAP HANA Smart Data Quality.	['trigger']	{'trigger': 'Trigger-Based'}	['trigger']
171	{'side panel': 'Seitenbereich'}	Complete or consult other side panel sections as appropriate:	Füllen Sie andere Seitentafelabschnitte entsprechend aus, oder konsultieren Sie sie:	['side panel']	{'side panel': 'Seitentafel'}	['seitentafeln']
172	{'create': 'erstellen'}	Choose an appropriate data entity to provide data to your business entity and click Create to open the editor.	"Wählen Sie eine geeignete Datenentität aus, um Daten für Ihre Geschäftsentität bereitzustellen, und klicken Sie auf ""Erstellen"", um den Editor zu öffnen."	['create']	{'create': 'Erstellen'}	['erstellen']
173	{'type': 'Art'}	Choose from the following types:	Wählen Sie aus den folgenden Vertragsarten:	['type']	{'type': 'Vertragsarten'}	['vertragsart']
174	{'message': 'Nachricht'}	The messages are grouped in the following categories:	Die Nachrichten sind in die folgenden Kategorien eingeteilt:	['message']	{'message': 'Nachrichten'}	['nachricht']
175	{'order': 'Auftrag'}	Narrow down the list of orders based on their main work center.	Schränken Sie die Liste der Aufträge basierend auf ihrem Hauptarbeitsort ein.	['order']	{'order': 'Aufträge'}	['auftrag']
176	{'incident': 'Meldung'}	Once the incident has been processed, you can create the  bridge instance in the dedicated page SAP BW Bridge of the Configuration area with the size you’ve allocated (see ).	Nachdem der Vorfall verarbeitet wurde, können Sie die Bridge-Instanz auf der dedizierten Seite SAP BW Bridge des Konfigurationsbereichs mit der Größe erstellen, die Sie zugewiesenen haben (siehe ).	['incident']	{'incident': 'Vorfall'}	['vorfall']
177	{'session': 'Sitzung'}	Select a session.	Wählen Sie eine Sitzung aus.	['session']	{'session': 'Sitzung'}	['sitzung']
178	{'schedule': 'Dokument'}	Create a schedule:	Legen Sie einen Zeitplan fest:	['schedule']	{'schedule': 'Zeitplan'}	['zeitplan']
179	{'document': 'Beleg'}	Document - Action Required	Dokument - Erforderliche Aktion	['document']	{'document': 'Dokument'}	['dokument']
180	{'schedule': 'Terminplan'}	In the Share Schedule dialog, just remove the name of the person whose access you want to revoke.	"Im Dialog ""Freigabeplan"" entfernen Sie einfach den Namen der Person, deren Zugriff Sie widerrufen möchten."	['schedule']	{'schedule': 'Freigabeplan'}	['freigabeplan']
181	{'chart': 'Diagramm'}	You can change the start date and time of order operations by dragging them one at a time to the desired date in the chart.	Sie können das Startdatum und die Startzeit von Auftragsvorgängen ändern, indem Sie sie nacheinander auf das gewünschte Datum im Diagramm ziehen.	['chart']	{'chart': 'Diagramm'}	['diagramm']
182	{'release': 'Release'}	Release Restriction Note	Hinweis zu Einschränkungen bei Veröffentlichungen	['release']	{'release': 'Hinweis'}	['hinweis']
183	{'type': 'Art'}	You can only display and use these two Planned Count Date From - To fields, when you use the date selection type Static.	"Sie können diese beiden Felder ""Geplante Zählungsdatum Von"" und ""Geplante Zählungsdatum Bis"" nur dann anzeigen und verwenden, wenn Sie den Datumswahltyp ""Statisch"" verwenden."	['type']	{'type': 'Statisch'}	['statisch']
184	{'document': 'Beleg'}	Documents - Action Required	Belege - Maßnahmen erforderlich	['document']	{'document': 'Belege'}	['beleg']
185	{'revision': 'überarbeitete Version'}	Restoring an Older Version or Revision of a Text Block	Wiederherstellen einer älteren Version oder Revision eines Textblocks	['revision']	{'revision': 'Revision'}	['revision']
186	{'data provider': 'Datenprovider'}	The Data Provider profile provides additional information about other products or product groups.	Das Profil des Datenanbieters bietet zusätzliche Informationen über andere Produkte oder Produktgruppen.	['data provider']	{'data provider': 'Datenanbieters'}	['datenanbieters']
187	{'notification': 'Benachrichtigung'}	Notification Sent Date	Benachrichtigungs-Sendedatum	['notification']	{'notification': 'Benachrichtigungs-Sendedatum'}	['benachrigungs']
188	{'transfer': 'übertragen'}	Check and Transfer Staffing Assignments	Überprüfen und übertragen Sie Besetzungen	['transfer']	{'transfer': 'übertragen'}	['übertragen']
189	{'create': 'erstellen'}	You can also create your own scenarios.	Sie können auch eigene Szenarien erstellen.	['create']	{'create': 'erstellen'}	['erstellen']
190	{'page': 'Page'}	Select your homepage from the dropdown menu.	Wählen Sie Ihre Homepage aus dem Dropdown-Menü aus.	['page']	{'page': 'Homepage'}	['homepage']
191	{'restriction': 'Restriktion'}	The following restrictions are applicable:	Die folgenden Einschränkungen gelten:	['restriction']	{'restriction': 'Einschränkungen'}	['einschränkung']
192	{'about': 'über'}	About Approval Process	Über den Genehmigungsprozess	['about']	{'about': 'Genehmigungsprozess'}	['genehmigungsprozen']
193	{'compliance requirement': 'Compliance-Anforderung'}	Once you have selected a category, you must select a subcategory, such as Tasks by Status or Tasks by Status and Compliance Requirement, to refine your analysis results further.	Nachdem Sie eine Kategorie ausgewählt haben, müssen Sie eine Unterkategorie auswählen, beispielsweise Aufgaben nach Status oder Aufgaben nach Status und Compliance-Anforderung, um die Analyseergebnisse weiter zu verfeinern.	['compliance requirement']	{'compliance requirement': 'Compliance-Anforderung'}	['compliance']
194	{'table view': 'Tabellenansicht'}	You can perform the following actions in table view:	In der Tabellenansicht können Sie folgende Aktionen ausführen:	['table view']	{'table view': 'Tabellenansicht'}	['tabellenansicht']
195	{'routing': 'Weiterleitung'}	Routing Information Retrieval	Routeninformationsabruf	['routing']	{'routing': 'Routeninformationsabruf'}	['routeninformationsaben']
196	{'storage type': 'Speichertyp'}	You can filter by schema or by storage type.	Sie können nach Schema oder nach Speichertyp filtern.	['storage type']	{'storage type': 'Speichertyp'}	['speichertyp']
197	{'client': 'Client'}	Expose your data in lightweight, closely-focused perspectives to SAP Analytics Cloud and other analytics clients.	Präsentieren Sie Ihre Daten in leichten, eng fokussierten Perspektiven für SAP Analytics Cloud und andere Analytics-Clients.	['client']	{'client': 'Clients'}	['client']
198	{'check': 'Prüfung'}	Enterprise Edition check:	Enterprise Edition-Prüfung:	['check']	{'check': 'Prüfung'}	['prüfung']
199	{'consumption model': 'Verbrauchsmodell'}	You can add more specific measures to your consumption model.	Sie können Ihrem Verbrauchsmodell weitere spezifischere Kennzahlen hinzufügen.	['consumption model']	{'consumption model': 'Verbrauchsmodell'}	['verbrauchsmodell']
200	{'schedule': 'Terminplan'}	Reviewers are not allowed to make any changes to the schedule and they do not see the utilization forecast shown when the schedule is in Scoping and Refinement.	Die Überprüfer dürfen den Zeitplan nicht ändern, und sie sehen nicht die Auslastungsprognose, die angezeigt wird, wenn sich der Zeitplan in „Scoping und Verfeinerung“ befindet.	['schedule']	{'schedule': 'Zeitplan'}	['zeitplan']
201	{'query': 'Abfrage'}	In the side navigation area, click , select the space you want to work in, and click Remote Query Monitor to open the monitor.	Klicken Sie im Bereich für die Seitennavigation auf , wählen Sie den Raum aus, in dem Sie arbeiten möchten, und klicken Sie auf „Remote Query Monitor“, um den Monitor zu öffnen.	['query']	{'query': '▔'}	['▔ertrat<sos>']
202	{'space': 'Space'}	Enter your key, accept the terms of use and select a space where the data should be stored.	Geben Sie Ihren Schlüssel ein, akzeptieren Sie die Nutzungsbedingungen, und wählen Sie einen Speicherort für die Daten aus.	['space']	{'space': 'Speicherort'}	['speicherort']
203	{'assignment': 'Einsatz'}	Save the assignment.	Sichern Sie den Auftrag.	['assignment']	{'assignment': 'Auftrag'}	['auftrag']
204	{'queue': 'Warteschlange'}	Change queue assignments.	Ändern Sie die Zuordnungen in der Warteschlange.	['queue']	{'queue': 'Warteschlange'}	['warteschlange']
205	{'project': 'Project'}	The following project44 add-ons are available:	Die folgende Projekt44-Zusatzmodule sind verfügbar:	['project']	{'project': 'Projekt44'}	['projekt44']
206	{'work package': 'Work-Package'}	Create new Work Package	Neues Arbeitspaket legen	['work package']	{'work package': 'Arbeitspaket'}	['arbeitspaket']
207	{'type': 'Art'}	The following work item types are available:	Die folgenden Workitem-Typen sind verfügbar:	['type']	{'type': 'Workitem-Typen'}	['workitem']
208	{'item': 'Artikel'}	To create a new item, choose one of the following options:	Um ein neues Element zu erstellen, wählen Sie eine der folgenden Optionen:	['item']	{'item': 'Element'}	['element']
209	{'action': 'Aktion', 'Action': 'Aktion'}	This column shows you if quick actions are available.	Diese Spalte zeigt Ihnen, ob schnelle Aktionen verfügbar sind.	['action', 'Action']	{'action': 'Aktionen', 'Action': 'Aktionen'}	['aktion', 'aktion']
210	{'schedule': 'Terminplan'}	Included in Schedule (Filter)	Inbegriffen in Zeitplan (Filter)	['schedule']	{'schedule': 'Zeitplan'}	['zeitplan']
211	{'create': 'anlegen'}	Click Create Needs.	"Klicken Sie auf ""Bedürfnisse erstellen""."	['create']	{'create': 'erstellen'}	['erstellen']
212	{'intercompany': 'unternehmensübergreifend'}	Check Intercompany Transactions	Prüfen von Unternehmenskenntnissen	['intercompany']	{'intercompany': 'Unternehmenskenntnissen'}	['unternehmenskenntnissen']
213	{'usage': 'Nutzung'}	Provides additional information about metering of usage.	Stellt zusätzliche Informationen über die Messung der Nutzung bereit.	['usage']	{'usage': 'Nutzung'}	['nutzung']
214	{'Production Order': 'Produktionsauftrag', 'production order': 'Produktionsauftrag'}	The Production Order:	Der Produktionsauftrag:	['Production Order', 'production order']	{'Production Order': 'Produktionsauftrag', 'production order': 'Produktionsauftrag'}	['produktionsauftragen', 'produktionsauftragen']
215	{'document status': 'Dokumentstatus'}	Document Status - Text	Dokumentstatus - Text	['document status']	{'document status': 'Dokumentstatus'}	['dokumentstatusen']
216	{'appointment': 'Torbelegung'}	To create a dock appointment, proceed as follows:	Um einen Docktermin zu erstellen, gehen Sie wie folgt vor:	['appointment']	{'appointment': 'Termin'}	['termin']
217	{'space': 'Space'}	Limitation of a locked space:	Beschränkung eines gesperrte Raums:	['space']	{'space': 'Raums'}	['raum']
218	{'type': 'Typ'}	Select one of the following shipment types:	Wählen Sie einen der folgenden Übertragungstypen:	['type']	{'type': 'Übertragungstypen'}	['übertraguntstypen']
219	{'position': 'Bestand'}	You have the following position:	Sie haben folgende Position:	['position']	{'position': 'Position'}	['position']
220	{'load': 'Last'}	Highloaded Periods Card	Karte für hochbelastete Perioden	['load']	{'load': 'hochbelastete'}	['hochbelasten']
221	{'troubleshooting': 'Fehlerbehebung'}	The following troubleshooting modes are available:	Die folgenden Fehlerbehebungsmodi sind verfügbar:	['troubleshooting']	{'troubleshooting': 'Fehlerbehebungsmodi'}	['fehlerbehebungsmoden']
222	{'access control': 'Zugriffskontrolle'}	When a data access control is applied to a data layer view or a business layer object, the rows of data contained in the object are filtered based on the specified criteria.	Wenn eine Datenzugriffssteuerung auf eine Datenebenen-Ansicht oder ein Business-Ebenen-Objekt angewendet wird, werden die Datenzeilen im Objekt basierend auf den angegebenen Kriterien gefiltert.	['access control']	{'access control': 'Datenzugriffssteuerung'}	['datenzugriffssteuern']
223	{'reset': 'Reset'}	Reset not required	Zurückstellen ist nicht nötig	['reset']	{'reset': 'Zurückstellen'}	['zurückstellen']
224	{'pause': 'pausieren'}	Pause Real-Time Replication for an Agent	Echtzeit-Replikation für einen Agenten pausieren	['pause']	{'pause': 'Echtzeit-Replikation'}	['echtzeit']
225	{'refresh': 'aktualisieren'}	Enables you to refresh purchase requisitions.	Erlaubt es Ihnen, Bestellanforderungen zu aktualisieren.	['refresh']	{'refresh': 'aktualisieren'}	['aktualisieren']
226	{'accept': 'annehmen'}	Then choose Accept.	"Wählen Sie dann ""Akzeptieren""."	['accept']	{'accept': 'Akzeptieren'}	['akzeptieren']
227	{'item': 'Artikel'}	Item expiration Date	Datum des Ablaufs des Elements	['item']	{'item': '▔'}	['▔ertrat<sos>']
228	{'disclosure': 'Auskunft'}	Accept Legal Disclosure.	Akzeptieren Sie die rechtliche Offenlegung.	['disclosure']	{'disclosure': 'Offenlegung'}	['offenlegeng']
229	{'provider': 'Anbieter'}	You can edit the predefined email and then send it to the provider.	Sie können die vordefinierte E-Mail bearbeiten und dann an den Anbieter senden.	['provider']	{'provider': 'Anbieter'}	['anbieter']
230	{'task': 'Tätigkeit'}	This task is optional.	Diese Aufgabe ist optional.	['task']	{'task': 'Aufgabe'}	['aufgabe']
231	{'processing': 'Verarbeitung'}	Released for Processing	Freigegeben für die Verarbeitung	['processing']	{'processing': 'Verarbeitung'}	['verarbeitung']
232	{'collection': 'Sammlung'}	Enter the name and the description of your role collection.	Geben Sie den Namen und die Beschreibung Ihrer Rollenkollektion ein.	['collection']	{'collection': 'Rollenkollektion'}	['eollenkollektion']
233	{'icon': 'Symbol'}	Icon on the tab indicates the following:	Das Symbol auf der Registerkarte zeigt Folgendes an:	['icon']	{'icon': 'Symbol'}	['symbol']
234	{'default': 'Voreinstellung'}	By default the check box is unchecked.	Standardmäßig ist das Kontrollkästchen nicht gesetzt.	['default']	{'default': 'Standardmäßig'}	['standardmäßig']
235	{'sales': 'Verkauf', 'Sales': 'Verkauf'}	In the sales and delivery processes, the placeholders are resolved in the languages in which the document is printed.	In den Verkaufs- und Lieferprozessen werden die Platzhalter in den Sprachen aufgelöst, in denen das Dokument gedruckt ist.	['sales', 'Sales']	{'sales': 'Verkaufs', 'Sales': 'Verkaufs-'}	['verkauf', 'verkauf']
236	{'assignment': 'Einsatz'}	P Paste Assignment	P Paste Assignment (Paste-Zuordnung)	['assignment']	{'assignment': 'Zuordnung'}	['zuordnung']
237	{'document': 'Beleg'}	FICA document will be displayed.	Das FI-CA-Dokument wird angezeigt.	['document']	{'document': 'FI-CA-Dokument'}	['fi-ca']
238	{'payment method': 'Zahlweg'}	Payment Method Text	Zahlungsmethode Text	['payment method']	{'payment method': 'Zahlungsmethode'}	['zahlungsmetheden']
239	{'split criterion': 'Splitkriterium', 'material group': 'Materialgruppe'}	Create, edit and display a single order fulfillment responsibility for a specific split criterion (for example, plant or material group) or a combination of multiple split criteria.	Erstellen, bearbeiten und anzeigen Sie einen einzelnen Auftragsfertigungsauftrag für ein bestimmtes Unterteilungskriterium (z. B. Betrieb oder Materialgruppe) oder eine Kombination mehrerer Unterteilungskriterien.	['split criterion', 'material group']	{'split criterion': 'Unterteilungskriterium', 'material group': 'Materialgruppe'}	['unterteilungskriteriumen', 'materialgruppe']
240	{'personal data': 'personenbezogene Daten', 'report': 'Bericht'}	Personal Data Report	Bericht über personenbezogene Daten	['personal data', 'report']	{'personal data': 'personenbezogene Daten', 'report': 'Bericht'}	['personenbezogen datum', 'bericht']
241	{'check': 'Scheck'}	Choose Add Check.	"Wählen Sie ""Prüfung hinzufügen""."	['check']	{'check': 'Prüfung'}	['prüfung']
242	{'compliance requirement': 'Compliance-Anforderung'}	Choose View Compliance Requirements.	"Wählen Sie ""Anforderungen für Compliance anzeigen""."	['compliance requirement']	{'compliance requirement': 'Anforderungen Compliance'}	['anforderung compliance']
243	{'score': 'Punktzahl'}	Score Output Type	Score Output Type (Art des Ergebnisses)	['score']	{'score': 'Ergebnis'}	['ergebnis']
244	{'sequence': 'Reihenfolge'}	Display the segments in which the sequence is used.	Zeigen Sie die Segmente an, in denen die Sequenz verwendet wird.	['sequence']	{'sequence': 'Sequenz'}	['sequenz']
245	{'create': 'anlegen'}	Click Create Schedule.	"Klicken Sie auf ""Zeitplan erstellen""."	['create']	{'create': 'erstellen'}	['erstellen']
246	{'cancel': 'zurücknehmen'}	Choose Cancel Dispatch.	Wählen Sie „Einplanung von Sendungen“.	['cancel']	{'cancel': '▔'}	['▔ertrat<sos>']
247	{'difference': 'Abweichung'}	Differences between target costs and actual costs that cannot be attributed to any above mentioned category.	Unterschiede zwischen Zielkosten und Ist-Kosten, die nicht einer der oben genannten Kategorien zugeordnet werden können.	['difference']	{'difference': 'Unterschiede'}	['unterschied']
248	{'routing': 'Weiterleitung'}	The following routing methods are supported:	Die folgenden Routingmethoden werden unterstützt:	['routing']	{'routing': 'Routingmethoden'}	['routingmethoden']
249	{'notification': 'Mitteilung'}	via Notifications or	über Benachrichtigungen oder	['notification']	{'notification': 'Benachrichtigungen'}	['benachrichtigung']
250	{'verification': 'Verifizierung'}	Controls the verification of the host name field of the server certificate:	Steuert die Überprüfung des Hostnamensfelds des Serverzertifikats:	['verification']	{'verification': 'Überprüfung'}	['überprüfung']
251	{'following': 'Following', 'action': 'Action', 'Action': 'Action'}	Perform one of the following actions:	Führen Sie eine der folgenden Aktionen aus:	['following', 'action', 'Action']	{'following': 'folgenden', 'action': 'Aktionen', 'Action': 'Aktionen'}	['folgend', 'aktion', 'aktion']
252	{'upload': 'Upload'}	Upload Field Fuel	Upload-Feld für Fuel	['upload']	{'upload': 'Upload-Feld'}	['upload']
253	{'maintenance plan': 'Instandhaltungsplan', 'schedule': 'Terminplan', 'share': 'teilen'}	Maintenance planners can modify, share, or delete the schedule.	Instandhaltungsplaner können den Zeitplan ändern, teilen oder löschen.	['maintenance plan', 'schedule', 'share']	{'maintenance plan': 'Instandhaltungsplaner', 'schedule': 'Zeitplan', 'share': 'teilen'}	['instandhaltungsplaner', 'zeitplan', 'teilen']
254	{'percentage': 'prozentual'}	For example, you can specify which availability match percentage to use for the calculation of the total suitability match.	Beispielsweise können Sie festlegen, welcher Übereinstimmungswert für die Berechnung der Gesamtübereinstimmung verwendet werden soll.	['percentage']	{'percentage': 'Übereinstimmungswert'}	['übereinstimmungswert']
255	{'assigned': 'zugewiesen'}	The Product Allocation Order Items card displays only those order items which have product allocation confirmation quantity assigned to characteristic value combinations which belong to the selected product allocation object.	"Die Karte ""Bestellpositionen für Produktzuordnung"" zeigt nur jene Bestellpositionen an, denen für die Merkwertkombinationen, die zum ausgewählten Produktzuordnungsobjekt gehören, eine Produktzuordnungsbestätigungskvantität zugewiesen wurde."	['assigned']	{'assigned': 'zugewiesen'}	['zuweisen']
256	{'compliance requirement': 'Compliance-Anforderung'}	Unreleased Compliance Requirements	Nicht freigegebene Compliance-Anforderungen	['compliance requirement']	{'compliance requirement': 'Compliance-Anforderungen'}	['compliance']
257	{'value': 'Wert'}	By selecting the search button in the field, you are taken to the Define Conditions:the characteristics displayed here are the standard characteristic values that can be used when, for example, you configure product allocation objects.	"Wenn Sie die Suchschaltfläche im Feld auswählen, werden Sie zu ""Bedingungen definieren"" weitergeleitet: Die hier angezeigten Merkmale sind die Standardmerkmalwerte, die verwendet werden können, wenn Sie beispielsweise Kontingentierungsobjekte konfigurieren."	['value']	{'value': '▔'}	['▔ertrat<sos>']
258	{'create': 'erstellen'}	Create Analytic Applications	Erstellen Sie analytische Anwendungen	['create']	{'create': 'Erstellen'}	['erstellen']
259	{'history': 'History'}	History Retention Period:	Aufbewahrungszeitraum für die Historie:	['history']	{'history': 'Historie'}	['historie']
260	{'retention period': 'Aufbewahrungszeitraum'}	Setup of Retention Period	Einrichten der Aufbewahrungsfrist	['retention period']	{'retention period': 'Aufbewahrungsfrist'}	['aufbewahrungsfrist']
261	{'item': 'Element'}	Go to Items Completed.	"Gehen Sie zu ""Abschlossene Elemente""."	['item']	{'item': '▔'}	['▔ertrat<sos>']
262	{'create': 'erstellen'}	Create New Options	Neue Optionen erstellen	['create']	{'create': '▔'}	['▔ertrat<sos>']
263	{'payment advice': 'Avis'}	Manage Payment Advices	Verwalten von Zahlungsavisen	['payment advice']	{'payment advice': 'Zahlungsavisen'}	['zahlungsavise']
264	{'following': 'Following'}	You have entered the following data:	Sie haben die folgenden Daten eingegeben:	['following']	{'following': 'folgenden'}	['folgend']
265	{'dialog text': 'Text im Dialog'}	Select Dialog Text.	Dialogtext für Wählen.	['dialog text']	{'dialog text': 'Wählen'}	['wählen']
266	{'contract': 'Vertrag'}	No Valid Contract	Kein gültiger Vertrag	['contract']	{'contract': 'Vertrag'}	['vertrag']
267	{'report': 'Report'}	Enter the title for your report:	Geben Sie den Titel für Ihren Bericht ein:	['report']	{'report': 'Bericht'}	['bericht']
268	{'data point': 'Datenpunkt'}	Save Data Points	Punkten speichern	['data point']	{'data point': 'Punkten'}	['punkt']
269	{'side panel': 'Seitenbereich'}	In the side panel, do the following:	Führen Sie im Seitenfeld die folgenden Schritte aus:	['side panel']	{'side panel': 'Seitenfeld'}	['seitenfeld']
270	{'space': 'Space'}	Delete audit log entries by space.	Löschen Sie Auditprotokollelemente nach Raum.	['space']	{'space': 'Raum'}	['raum']
271	{'frame': 'Rahmen'}	To calculate the match percentage, the app sums up the free hours per month for the entire request time frame.The result is then divided by total number of required hours.	Um den Übereinstimmungsanteil zu berechnen, summiert die App die freien Stunden pro Monat für den gesamten Anfragezeitraum auf. Das Ergebnis wird dann durch die Gesamtanzahl der erforderlichen Stunden geteilt.	['frame']	{'frame': 'Anfragezeitraum'}	['anfragezeitraum']
272	{'store': 'Filiale'}	Select the Stores tab page.	"Wählen Sie die Registerkarte ""Stores"" aus."	['store']	{'store': 'Stores'}	['store']
273	{'deployment': 'Deployment'}	Deployment and Activation	Bereitstellung und Aktivierung	['deployment']	{'deployment': 'Bereitstellung'}	['bereitstellung']
274	{'create': 'erstellen'}	You need the DW Administrator role to create database user groups.	Sie benötigen die DW-Administrator-Rolle, um Datenbankbenutzergruppen zu erstellen.	['create']	{'create': 'erstellen'}	['erstellen']
275	{'type': 'Typ'}	Select the test plan type from the dropdown list.	Wählen Sie den Testplan-Typ aus der Dropdown-Liste aus.	['type']	{'type': 'Testplan-Typ'}	['testplan']
