	terms	src_raw	mt_raw	src_terms	alg_terms	norm_tgt_terms
111	{'global economic outlook': '環球經濟前景', 'hkma': '金管局', 'hong kong economy': '香港經濟', 'critical financial service': '關鍵金融服務', 'financial service': '金融服務', 'financial system': '金融體系', 'resilience': '抗震能力'}	The global economic outlook remains subject to significant uncertainties.  The HKMA will keep abreast of latest developments and stay vigilant against potential risks, with the aim of upholding the resilience and stability of the financial system, which are essential for the ongoing provision of critical financial services that support the functioning of the Hong Kong economy.	全球經濟前景仍然面臨重大不確定性。金管局將密切關注最新發展，提高警惕，防范潛在風險，旨在維護金融體系的韌性和穩定性，這對於持續提供支持香港經濟運作的關鍵金融服務至關重要。	['global economic outlook', 'hkma', 'hong kong economy', 'critical financial service', 'financial service', 'financial system', 'resilience']	{'global economic outlook': '全球經濟前景', 'hkma': '金管局', 'hong kong economy': '香港經濟', 'critical financial service': '關鍵金融服務', 'financial service': '金融服務', 'financial system': '金融體系', 'resilience': '韌性'}	['全球經濟前景', '金管局', '香港經濟', '關鍵金融服務', '金融服務', '金融體系', '韌性']
112	"{'china - us tension': '中美緊張關係', 'hkma': '金管局', ""hong kong 's financial system"": '香港金融體系', 'us federal reserve': '美國聯邦儲備局', 'ukraine situation': '烏克蘭局勢', 'buffer': '緩衝', 'financial market': '金融市場', 'financial stability': '金融穩定', 'financial system': '金融體系', 'geopolitical uncertainty': '地緣政治因素', 'global debt - servicing burden': '全球的債務負擔', 'global financial condition': '全球金融狀況', 'global growth and inflation': '全球增長及通脹', 'global supply bottlenecks': '環球供應鏈樽頸問題', 'lockdown': '封城', 'market volatility': '市場波動', 'monetary policy': '貨幣政策', 'monetary policy normalisation': '貨幣政策正常化', 'pandemic': '疫情', 'resilience': '抗震能力'}"	Looking ahead, markets may be subject to heightened volatilities amid increased uncertainties on various fronts. On the one hand, the US Federal Reserve’s monetary policy normalisation, if continuing at a fast pace, may tighten global financial conditions visibly ahead and increase the global debt-servicing burden.  On the other hand, following the escalation of the Ukraine situation in early 2022, geopolitical uncertainties including the China–US tension may continue to stay high and trigger bouts of financial market volatility again.  Last but not least, with the evolving pandemic developments, there might be a potential downside scenario where lockdowns were to be re-imposed at a large scale, leading to persistent global supply bottlenecks and adversely affecting global growth and inflation.  Having said that, Hong Kong’s financial system is well-positioned to withstand adverse shocks given the resilience and buffers built up over the years.  The HKMA also has the capability, resources and commitment to safeguard Hong Kong’s monetary and financial stability.	展望未來，在各方面的不確定性增加的情況下，市場可能面臨更高的波動性。一方面，如果美國聯邦儲備局的貨幣政策正常化持續以較快的速度進行，可能會顯著緊縮全球金融條件，增加全球債務償還負擔。另一方面，隨著2022年初烏克蘭局勢的升級，包括中美關係緊張的地緣政治不確定性可能持續處於高位，再次引發金融市場波動。最後但同樣重要的是，隨著疫情形勢的演變，有可能出現重新實施大規模封鎖措施的下行情景，導致持續的全球供應瓶頸，並對全球增長和通脹產生不利影響。儘管如此，鑒於多年來建立的抗壓能力和緩衝機制，香港金融體系仍具備應對不利衝擊的能力。金管局也具備能力、資源和承諾，以保障香港的貨幣及金融穩定。	"['china - us tension', 'hkma', ""hong kong 's financial system"", 'us federal reserve', 'ukraine situation', 'buffer', 'financial market', 'financial stability', 'financial system', 'geopolitical uncertainty', 'global debt - servicing burden', 'global financial condition', 'global growth and inflation', 'global supply bottlenecks', 'lockdown', 'market volatility', 'monetary policy', 'monetary policy normalisation', 'pandemic', 'resilience']"	"{'china - us tension': '中美關係緊張', 'hkma': '金管局', ""hong kong 's financial system"": '香港金融體系', 'us federal reserve': '美國聯邦儲備局', 'ukraine situation': '烏克蘭局勢', 'buffer': '▔', 'financial market': '金融市場', 'financial stability': '金融穩定', 'financial system': '金融體系', 'geopolitical uncertainty': '地緣', 'global debt - servicing burden': '全球債務償還負擔', 'global financial condition': '全球金融條件', 'global growth and inflation': '全球增長和通脹', 'global supply bottlenecks': '全球供應瓶頸', 'lockdown': '封鎖', 'market volatility': '波動性', 'monetary policy': '貨幣政策', 'monetary policy normalisation': '貨幣政策正常化', 'pandemic': '疫情', 'resilience': '抗壓能力'}"	['中美關係緊張', '金管局', '香港金融體系', '美國聯邦儲備局', '烏克蘭局勢', '▔', '金融市場', '金融穩定', '金融體系', '地緣', '全球債務償還負擔', '全球金融條件', '全球增長和通脹', '全球供應瓶頸', '封鎖', '波動性', '貨幣政策', '貨幣政策正常化', '疫情', '抗壓能力']
113	{'digitalisation programme': '數碼化計劃', 'hkma': '金管局', 'hong kong economy': '香港經濟', 'comprehensive analysis': '全面的監察及分析', 'digitalisation': '數碼化', 'domestic and external environment': '本地及外圍環境', 'financial stability': '金融穩定', 'financial system': '金融體系', 'risk and vulnerability': '風險與不穩定因素', 'surveillance': '監察', 'surveillance capability': '監察能力'}	The HKMA will continue to closely monitor risks and vulnerabilities in the domestic and external environments and stand ready to deploy appropriate measures where necessary to maintain Hong Kong’s monetary and financial stability. Research programmes in 2022 will study issues affecting the Hong Kong economy and assess their potential risks. Meanwhile, the HKMA’s ongoing Digitalisation Programme will help enhance its surveillance capabilities to support more holistic surveillance and comprehensive analysis of the financial system.	金管局將繼續密切監測本地及外圍環境中的風險與不穩定因素，並隨時準備在必要時採取適當措施，以維持香港的貨幣及金融穩定。2022年的研究計畫將探討影響香港經濟的問題，評估其潛在風險。同時，金管局的數碼化計畫將幫助提升其監察能力，以支持更全面的監察和對金融體系的綜合分析。	['digitalisation programme', 'hkma', 'hong kong economy', 'comprehensive analysis', 'digitalisation', 'domestic and external environment', 'financial stability', 'financial system', 'risk and vulnerability', 'surveillance', 'surveillance capability']	{'digitalisation programme': '數碼化計畫', 'hkma': '金管局', 'hong kong economy': '香港經濟', 'comprehensive analysis': '綜合分析', 'digitalisation': '▔', 'domestic and external environment': '本地及外圍環境', 'financial stability': '金融穩定', 'financial system': '金融體系', 'risk and vulnerability': '風險與不穩定因素', 'surveillance': '監察', 'surveillance capability': '監察能力'}	['數碼化計畫', '金管局', '香港經濟', '綜合分析', '▔', '本地及外圍環境', '金融穩定', '金融體系', '風險與不穩定因素', '監察', '監察能力']
114	{'banking stability': '銀行體系穩定'}	# Maintaining banking stability	# 維持銀行穩定	['banking stability']	{'banking stability': '銀行穩定'}	['銀行穩定']
115	{'hkma': '金管局', 'banking supervisory and regulatory frameworks': '銀行監管架構與政策', 'good practice': '最佳做法', 'credit landscape': '信貸環境', 'develop market': '已發展市場', 'digitalisation': '數碼化', 'international standard': '國際標準', 'monetary policy': '貨幣政策', 'pandemic': '疫情', 'supervisory effort': '監管工作', 'technological advancement': '科技發展'}	As developed markets tighten monetary policies and the impact of the pandemic lingers, the credit landscape facing the banking sector is expected to remain challenging. At the same time, rapid technological advancement and digitalisation present both opportunities and challenges to the banking sector.  Facing an ever-changing financial landscape, the HKMA strives to ensure banks’ ability to withstand shocks through its ongoing supervisory efforts. At the same time, the HKMA will also continue to enhance and refine its banking supervisory and regulatory frameworks and policies, taking into account international standards and best practices.	隨著主要市場收緊貨幣政策且疫情影響持續，銀行業面臨的信貸環境預計將依然具有挑戰性。同時，快速的技術進步和數碼化為銀行業帶來了機遇與挑戰。面對不斷變化的金融環境，金管局致力於通過持續的監管工作確保銀行具備承受衝擊的能力。同時，金管局也會繼續加強和完善銀行監管架構與政策，考慮國際標準和最佳做法。	['hkma', 'banking supervisory and regulatory frameworks', 'good practice', 'credit landscape', 'develop market', 'digitalisation', 'international standard', 'monetary policy', 'pandemic', 'supervisory effort', 'technological advancement']	{'hkma': '金管局', 'banking supervisory and regulatory frameworks': '銀行監管架構與政策', 'good practice': '最佳做法', 'credit landscape': '信貸環境', 'develop market': '主要市場', 'digitalisation': '數碼化', 'international standard': '國際標準', 'monetary policy': '貨幣政策', 'pandemic': '疫情', 'supervisory effort': '監管工作', 'technological advancement': '技術進步'}	['金管局', '銀行監管架構與政策', '最佳做法', '信貸環境', '主要市場', '數碼化', '國際標準', '貨幣政策', '疫情', '監管工作', '技術進步']
116	{'risk - base supervisory focus': '風險為本的監管重點'}	# A risk-based supervisory focus	# 風險為本的監管重點	['risk - base supervisory focus']	{'risk - base supervisory focus': '風險為本的監管重點'}	['風險為本的監管重點']
117	{'credit risk': '信用風險'}	# Credit risk	# 信用風險	['credit risk']	{'credit risk': '信用風險'}	['信用風險']
118	{'credit risk': '信用風險', 'hkma': '金管局', 'step': 'STEPS', 'credit risk exposure': '信用風險', 'surveillance': '監察'}	In 2022, the HKMA will step up the surveillance of banks’ credit risk exposures and take proactive steps to ensure that overall risk levels remain well contained.	2022年，金管局將加強對銀行信用風險敞口的監察，並採取主動措施以確保整體風險水平得到良好控制。	['credit risk', 'hkma', 'step', 'credit risk exposure', 'surveillance']	{'credit risk': '信用風險', 'hkma': '金管局', 'step': '採取', 'credit risk exposure': '信用', 'surveillance': '監察'}	['信用風險', '金管局', '採取', '信用', '監察']
119	{'hkma': '金管局', 'pandemic': '疫情', 'relief measure': '紓困措施'}	The HKMA will also continue to monitor the development of the pandemic and its effect on the operating conditions of corporates, as well as maintain close dialogue with the banking and commercial sectors while keeping the various relief measures under review.	金管局也會繼續監測疫情的發展及其對企業營運狀況的影響，同時與銀行業及商業部門保持密切溝通，並持續審視各種減輕措施。	['hkma', 'pandemic', 'relief measure']	{'hkma': '金管局', 'pandemic': '疫情', 'relief measure': '減輕措施'}	['金管局', '疫情', '減輕措施']
120	{'operational and technology risk': '業務操作及科技風險', 'technology risk': '科技風險'}	# Operational and technology risks	# 運作及科技風險	['operational and technology risk', 'technology risk']	{'operational and technology risk': '運作及科技風險', 'technology risk': '科技風險'}	['運作及科技風險', '科技風險']
121	{'ais': '認可機構', 'cyber resilience assessment framework 2.0': '網絡防衛評估框架2.0', 'hkma': '金管局', 'operational resilience': '運作穩健性', 'spm': '監管政策手冊', 'supervisory policy manual': '監管政策手冊', 'authorize institution': '認可機構', 'cyber resilience': '網絡防衛能力', 'operational resilience frameworks': '運作穩健性框架', 'resilience': '抗震能力', 'supervisory policy': '監管政策', 'technology service provider': '科技服務供應商', 'tertiary datum backup': '三重數據備份'}	With the issuance of the new Supervisory Policy Manual (SPM) module on “Operational Resilience” in May 2022, the HKMA will continue to engage the industry and understand authorized institutions’ (AIs’) progress in developing their operational resilience frameworks.  In parallel, the HKMA will seek to raise the banking sector’s cyber resilience by following up with AIs on issues revealed by the assessments under the Cyber Resilience Assessment Framework 2.0 and monitoring AIs’ implementation of secure tertiary data backup.  Another key supervisory focus will be evaluating and addressing the risks from AIs’ growing dependency on technology service providers.	2022年5月發布的新《監管政策手冊》（SPM）模組「運作穩健性」，金管局將繼續與業界互動，了解認可機構（AIs）在制定運作穩健性框架方面的進展。同時，金管局將跟進AIs在「網絡防衛評估框架2.0」評估中揭示的問題，並監督AIs落實安全的三重數據備份，以提升銀行業的網絡防衛能力。另一個重要的監管重點是評估和處理AIs日益依賴科技服務供應商所帶來的風險。	['ais', 'cyber resilience assessment framework 2.0', 'hkma', 'operational resilience', 'spm', 'supervisory policy manual', 'authorize institution', 'cyber resilience', 'operational resilience frameworks', 'resilience', 'supervisory policy', 'technology service provider', 'tertiary datum backup']	{'ais': '認可機構', 'cyber resilience assessment framework 2.0': '網絡防衛評估框架2.0', 'hkma': '金管局', 'operational resilience': '運作穩健性', 'spm': '監管政策手冊', 'supervisory policy manual': '監管政策手冊', 'authorize institution': '認可機構', 'cyber resilience': '網絡防衛能力', 'operational resilience frameworks': '運作穩健性框架', 'resilience': '運作穩健性', 'supervisory policy': '監管政策', 'technology service provider': '科技服務供應商', 'tertiary datum backup': '三重數據備份'}	['認可機構', '網絡防衛評估框架2.0', '金管局', '運作穩健性', '監管政策手冊', '監管政策手冊', '認可機構', '網絡防衛能力', '運作穩健性框架', '運作穩健性', '監管政策', '科技服務供應商', '三重數據備份']
122	{'ais': '認可機構', 'hkma': '金管局', 'associate': '聯營公司', 'hybrid work model': '混合工作模式', 'pandemic': '疫情'}	With enhanced digital capabilities and extensive remote working experience accumulated during the pandemic, some AIs are planning to transition to a hybrid working model on a business-as-usual basis.  The HKMA will keep track of this development and assess whether the associated risks are adequately addressed by the industry.	由於疫情期間增強的數碼能力及廣泛的遠程辦公經驗，一些AIs正計劃以正常營運方式過渡到混合工作模式。金管局將追蹤此項發展，並評估業界是否已充分應對相關風險。	['ais', 'hkma', 'associate', 'hybrid work model', 'pandemic']	{'ais': 'AIs', 'hkma': '金管局', 'associate': '▔', 'hybrid work model': '混合工作模式', 'pandemic': '疫情'}	['AIs', '金管局', '▔', '混合工作模式', '疫情']
123	{'liquidity and market risk': '流動性及市場風險', 'market risk': '市場風險'}	# Liquidity and market risks	# 流動性及市場風險	['liquidity and market risk', 'market risk']	{'liquidity and market risk': '流動性及市場風險', 'market risk': '市場風險'}	['流動性及市場風險', '市場風險']
124	{'ais': '認可機構', 'hkma': '金管局', 'libor': '倫敦銀行同業拆息', 'liquidity and market risk': '流動性及市場風險', 'london interbank offered rate': '倫敦銀行同業拆息', 'market risk': '市場風險', 'market risk management': '市場風險管理', 'risk management': '風險管理'}	The HKMA will focus on the supervision of AIs’ liquidity and market risk management in 2022.  In particular, the HKMA will continue to monitor AIs’ progress in transitioning away from the remaining London Interbank Offered Rate (LIBOR) settings before these settings cease to be published by 30 June 2023.	2022年，金管局將專注於對認可機構（AIs）流動性及市場風險管理的監督。特別地，金管局將繼續監測AIs在這些設定於2023年6月30日停止發佈之前轉向剩餘倫敦銀行同業拆借利率（LIBOR）設置的進展。	['ais', 'hkma', 'libor', 'liquidity and market risk', 'london interbank offered rate', 'market risk', 'market risk management', 'risk management']	{'ais': 'AIs', 'hkma': '金管局', 'libor': 'LIBOR', 'liquidity and market risk': '流動性及市場風險', 'london interbank offered rate': '銀行 利率', 'market risk': '市場風險', 'market risk management': '市場風險管理', 'risk management': '風險管理'}	['AIs', '金管局', 'LIBOR', '流動性及市場風險', '銀行 利率', '市場風險', '市場風險管理', '風險管理']
125	{'money laundering and terrorist financing': '洗錢及恐怖分子資金籌集'}	# Combating money laundering and terrorist financing	# 打擊洗錢及恐怖分子資金籌集	['money laundering and terrorist financing']	{'money laundering and terrorist financing': '洗錢及恐怖分子資金籌集'}	['洗錢及恐怖分子資金籌集']
126	{'aml / cft': '打擊洗錢及恐怖分子資金籌集', 'aml / cft ecosystem': '反洗錢生態系統', 'hkma': '金管局', 'regtech': '合規科技', 'financial crime': '金融罪行', 'information share': '訊息共享', 'risk - sensitive supervisory technique': '風險為本監管技巧', 'supervisory technology': '監管科技', 'suptech': '監管科技', 'transaction monitoring system': '交易監察系統'}	In 2022, the HKMA’s work on anti-money laundering and counter-financing of terrorism (AML/CFT) will continue to focus on strengthening response to fraud and financial crime through collaboration and information sharing, pursuing closer co-operation with various stakeholders in the AML/CFT ecosystem.  Other priorities are to implement a wider range of risk-sensitive supervisory techniques, by leveraging enhanced data and supervisory technology (Suptech) capabilities, and promote the use of Regtech by banks, including transaction monitoring systems.	2022年，金管局在打擊洗錢及恐怖分子資金籌集（AML/CFT）方面的工作將繼續聚焦於透過合作與資訊共享加強對詐騙及金融罪行的反應，追求與AML/CFT生態系統內各利益相關方更緊密的合作。其他優先事項包括利用增強的資料及監管科技（Suptech）能力，推行更多風險為本的監管技巧，並促進銀行使用合規科技（Regtech），包括交易監控系統。	['aml / cft', 'aml / cft ecosystem', 'hkma', 'regtech', 'financial crime', 'information share', 'risk - sensitive supervisory technique', 'supervisory technology', 'suptech', 'transaction monitoring system']	{'aml / cft': '打擊洗錢及恐怖分子資金籌集', 'aml / cft ecosystem': 'CFT', 'hkma': '金管局', 'regtech': '合規科技', 'financial crime': '金融罪行', 'information share': '資訊共享', 'risk - sensitive supervisory technique': '為 監管 技巧', 'supervisory technology': '監管科技', 'suptech': '監管科技', 'transaction monitoring system': '交易 監控 系統'}	['打擊洗錢及恐怖分子資金籌集', 'CFT', '金管局', '合規科技', '金融罪行', '資訊共享', '為 監管 技巧', '監管科技', '監管科技', '交易 監控 系統']
127	{'hkma': '金管局', 'hong kong money laundering and terrorist financing risk assessment': '香港洗錢及恐怖分子資金籌集風險評估', 'svf': '儲值支付工具', 'emerge risk': '前路的風險', 'international standard setter': '國際標準制定組織', 'international standard': '國際標準', 'money laundering and terrorist financing': '洗錢及恐怖分子資金籌集', 'regulator': '監管機構', 'store value facility': '儲值支付工具'}	The HKMA will also keep working closely with the Government, the banking and stored value facility (SVF) sectors to publish an updated Hong Kong money laundering and terrorist financing risk assessment, and assist the industry in combatting new and emerging risks.  Work will also continue on understanding evolving money laundering and terrorist financing risks, implementing changes to AML law and related guidance to align with international standards, and maintaining proactive engagement with other regulators and international standard setters.	金管局將繼續與政府、銀行業及儲值支付工具（SVF）行業密切合作，發表更新版的香港洗錢及恐怖分子資金籌集風險評估報告，並協助業界應對新的和不斷出現的風險。同時，金管局將繼續研究不斷演變的洗錢及恐怖分子資金籌集風險，實施更改AML法例及相關指引以符合國際標準，並積極與其他監管機構及國際標準制定機構接觸。	['hkma', 'hong kong money laundering and terrorist financing risk assessment', 'svf', 'emerge risk', 'international standard setter', 'international standard', 'money laundering and terrorist financing', 'regulator', 'store value facility']	{'hkma': '金管局', 'hong kong money laundering and terrorist financing risk assessment': '香港 及 恐怖分子 資金籌 集風險 評估', 'svf': '儲值支付工具', 'emerge risk': '出現', 'international standard setter': '國際標準制定機構', 'international standard': '國際標準', 'money laundering and terrorist financing': '洗錢及恐怖分子資金籌集', 'regulator': '監管機構', 'store value facility': '儲值支付工具'}	['金管局', '香港 及 恐怖分子 資金籌 集風險 評估', '儲值支付工具', '出現', '國際標準制定機構', '國際標準', '洗錢及恐怖分子資金籌集', '監管機構', '儲值支付工具']
128	{'mandatory provident fund': '強制性公積金（強積金）', 'wealth management': '財富管理', 'provident fund': '公積金'}	# Wealth management and mandatory provident fund-related businesses	# 財富管理及強積金相關業務	['mandatory provident fund', 'wealth management', 'provident fund']	{'mandatory provident fund': '強積金', 'wealth management': '財富管理', 'provident fund': '強積金'}	['強積金', '財富管理', '強積金']
