	terms	src_raw	mt_raw	src_terms	alg_terms	norm_tgt_terms
335	{'bp': '支持組合', 'exchange fund': '外匯基金', 'ip': '投資組合', 'ltgp': '長期增長組合', 'strategic portfolio': '策略性資產組合', 'the exchange fund': '外匯基金', 'annualised internal rate of return': '內部回報率年率', 'inception': '開展投資以來', 'internal rate of return': '內部回報率'}	The investment return of the Exchange Fund in 2021, excluding the Strategic Portfolio, was 4.1%.  Specifically, the IP achieved a rate of return of 3.7%, while the BP gained 0.4%.  The LTGP has recorded an annualised internal rate of return of 15.4% since its inception in 2009.	外匯基金在2021年的投資回報（不計策略性資產組合）為4.1%。具體來說，投資組合（IP）實現了3.7%的回報率，而支持組合（BP）則取得了0.4%的回報。自2009年成立以來，長期增長組合（LTGP）的年化內部收益率為15.4%。	['bp', 'exchange fund', 'ip', 'ltgp', 'strategic portfolio', 'the exchange fund', 'annualised internal rate of return', 'inception', 'internal rate of return']	{'bp': '支持組合', 'exchange fund': '外匯基金', 'ip': 'IP', 'ltgp': '長期增長組合', 'strategic portfolio': '策略性資產組合', 'the exchange fund': '外匯基金', 'annualised internal rate of return': '年化內部收益率', 'inception': '成立', 'internal rate of return': '內部收益率'}	['支持組合', '外匯基金', 'IP', '長期增長組合', '策略性資產組合', '外匯基金', '年化內部收益率', '成立', '內部收益率']
336	{'exchange fund': '外匯基金', 'the exchange fund': '外匯基金'}	The annual returns of the Exchange Fund from 1994 to 2021 are set out in Chart 1.  Table 2 shows the 2021 investment return and the average investment returns of the Fund over several different time horizons.  The average return was 5.3% during 2019–2021, 4.7% during 2017–2021, 3.3% during 2012–2021 and 4.8% since 1994.  Table 3 shows the currency mix of the Fund’s assets on 31 December 2021.	外匯基金自1994年至2021年的年度回報見圖1。表2顯示了2021年的投資回報及基金在不同時間段的平均投資回報。2019-2021年的平均回報為5.3%，2017-2021年的平均回報為4.7%，2012-2021年的平均回報為3.3%，自1994年起的平均回報為4.8%。表3顯示了2021年12月31日基金資產的貨幣組成。	['exchange fund', 'the exchange fund']	{'exchange fund': '外匯基金', 'the exchange fund': '外匯基金'}	['外匯基金', '外匯基金']
337	{'exchange fund': '外匯基金', 'the exchange fund': '外匯基金', 'financial statement': '財務報表'}	"See pages 211 to 319 for the audited 2021 financial statements of the Exchange Fund.
"	"請參閱第211至319頁，了解外匯基金2021年度經審計財務報告。
"	['exchange fund', 'the exchange fund', 'financial statement']	{'exchange fund': '外匯基金', 'the exchange fund': '外匯基金', 'financial statement': '財務報告'}	['外匯基金', '外匯基金', '財務報告']
338	{'corporate function': '機構職能', 'hkma': '金管局', 'information centre': '資訊中心', 'information technology': '資訊科技', 'information technology capability': '資訊科技能力', 'professionalism': '專業水準', 'transparency': '透明度'}	Corporate functions support the operation of the HKMA with a high level of transparency, accountability, efficiency and professionalism.  To facilitate public understanding about its policies and operations, the HKMA maintains effective communication with the community and the market through traditional and social media, its website, the Information Centre and other channels. Within the institution, the HKMA conscientiously builds an agile and sustainable workforce, institutes rigorous financial discipline and upgrades information technology capabilities to adapt to changes and ensure effective implementation of its policies and initiatives.	公司職能支持金管局的運作，並以高透明度、責任感、效率及專業水平進行。為促進公眾對其政策和運作的理解，金管局透過傳統媒體及社交媒體、網站、資訊中心及其他渠道與社區及市場保持有效溝通。在機構內部，金管局認真建設靈活且可持續的人力資源，建立嚴格的財務紀律，提升資訊科技能力，以適應變化並確保其政策和計劃的有效落實。	['corporate function', 'hkma', 'information centre', 'information technology', 'information technology capability', 'professionalism', 'transparency']	{'corporate function': '公司職能', 'hkma': '金管局', 'information centre': '資訊中心', 'information technology': '資訊科技', 'information technology capability': '資訊科技能力', 'professionalism': '專業水平', 'transparency': '透明度'}	['公司職能', '金管局', '資訊中心', '資訊科技', '資訊科技能力', '專業水平', '透明度']
339	{'transparency': '透明度'}	# TRANSPARENCY	# 透明度	['transparency']	{'transparency': '透明度'}	['透明度']
340	{'hkma': '金管局', 'transparency': '透明度'}	The HKMA works closely with the media to enhance transparency and promote public understanding of its policies and operations.  In 2021, the HKMA held or participated in 169 physical and virtual events, comprising eight press conferences, eight stand-up interviews and 153 other public functions. A further 27 media interviews were arranged.  A total of 632 bilingual press releases were issued over the course of the year and a large number of media enquiries were handled on a daily basis.	金管局與媒體密切合作，提高透明度，促進公眾對其政策和運作的理解。2021年，金管局舉辦或參與了169項實體及虛擬活動，包括八次新聞發佈會、八次現場訪問及153項其他公開活動。另安排了27次媒體訪問。全年共發出632份雙語新聞稿，並每日處理大量媒體查詢。	['hkma', 'transparency']	{'hkma': '金管局', 'transparency': '透明度'}	['金管局', '透明度']
341	{'financial technology': '金融科技', 'fintech': '金融科技', 'hkma': '金管局', 'mainland': '內地', 'interest rate': '利率', 'interest rate benchmarks': '利率基準'}	To raise awareness of the HKMA’s key functions, press conferences and media briefings were organised for local, Mainland and foreign media.  Topics included the Connect schemes, financial technology (fintech) and the reform of interest rate benchmarks.	為提高公眾對金管局主要職能的認識，分別為本地、內地及外國媒體舉辦新聞發佈會及媒體簡報會。主題包括「滬港通」、「深港通」、金融科技（FinTech）及利率基準改革。	['financial technology', 'fintech', 'hkma', 'mainland', 'interest rate', 'interest rate benchmarks']	{'financial technology': '金融科技', 'fintech': '金融科技', 'hkma': '金管局', 'mainland': '內地', 'interest rate': '利率', 'interest rate benchmarks': '利率基準'}	['金融科技', '金融科技', '金管局', '內地', '利率', '利率基準']
342	{'fintech': '金融科技', 'hkma': '金管局', 'green finance': '綠色金融', 'pandemic': '疫情', 'phishing scam': '網絡釣魚騙案'}	To engage and interact with the public in a timely manner, the HKMA maintains five social media channels (Facebook, Instagram, LinkedIn, Twitter and YouTube) with over 80,000 followers.  The HKMA utilises its social media channels to raise public awareness on a wide range of topics notably phishing scams, which increased significantly during the pandemic.  In addition, extensive promotion campaigns on green finance, fintech and the Connect schemes were conducted via social media to keep the public abreast of the latest development trends.	為及時與公眾互動，金管局設有五個社交媒體頻道（Facebook、Instagram、LinkedIn、Twitter及YouTube），擁有超過8萬名追蹤者。金管局利用社交媒體頻道提高公眾對多種主題的認識，特別是網絡釣魚騙案，在疫情期間大幅增加。此外，通過社交媒體進行廣泛推廣活動，內容涉及綠色金融、金融科技及「滬港通」「深港通」計畫，讓公眾掌握最新發展趨勢。	['fintech', 'hkma', 'green finance', 'pandemic', 'phishing scam']	{'fintech': '金融科技', 'hkma': '金管局', 'green finance': '綠色金融', 'pandemic': '疫情', 'phishing scam': '網絡釣魚騙案'}	['金融科技', '金管局', '綠色金融', '疫情', '網絡釣魚騙案']
343	{'eddie yue': '余偉文', 'fintech': '金融科技', 'hkma': '金管局', 'hong kong fintech week': '香港金融科技周', 'hong kong fintech week 2021': '香港金融科技周2021'}	Mr Eddie Yue, Chief Executive of HKMA, moderates a virtual panel discussion at the Hong Kong FinTech Week 2021	金管局行政總裁黃竹遙於2021年香港金融科技週舉行虛擬小組討論會	['eddie yue', 'fintech', 'hkma', 'hong kong fintech week', 'hong kong fintech week 2021']	{'eddie yue': '黃 竹遙', 'fintech': '金融科技', 'hkma': '金管局', 'hong kong fintech week': '香港金融科技週', 'hong kong fintech week 2021': '▔'}	['黃 竹遙', '金融科技', '金管局', '香港金融科技週', '▔']
344	{'deputy chief executive': '副總裁', 'fintech': '金融科技', 'fintech 2025': '金融科技2025', 'hkma': '金管局'}	Mr Howard Lee, Deputy Chief Executive of HKMA, hosts a media briefing on the HKMA’s “Fintech 2025” strategy	金管局副總裁李達志主持有關金管局「金融科技2025」策略的媒體簡報會	['deputy chief executive', 'fintech', 'fintech 2025', 'hkma']	{'deputy chief executive': '副總裁', 'fintech': '金融科技', 'fintech 2025': '金融科技2025', 'hkma': '金管局'}	['副總裁', '金融科技', '金融科技2025', '金管局']
345	{'deputy chief executive': '副總裁', 'hkma': '金管局', 'london interbank offered rate': '倫敦銀行同業拆息'}	Mr Arthur Yuen, Deputy Chief Executive of HKMA, hosts a media briefing on the Hong Kong banking sector’s preparation for London Interbank Offered Rate transition	金管局副總裁阮建強主持有關香港銀行業準備迎接倫敦銀行同業拆息過渡的媒體簡報會	['deputy chief executive', 'hkma', 'london interbank offered rate']	{'deputy chief executive': '副總裁', 'hkma': '金管局', 'london interbank offered rate': '倫敦銀行同業拆息'}	['副總裁', '金管局', '倫敦銀行同業拆息']
346	{'deputy chief executive': '副總裁', 'hkma': '金管局'}	Mr Edmond Lau, Deputy Chief Executive of HKMA, conducts an interview with an international news channel	金管局副總裁劉鳴煥接受國際新聞頻道採訪	['deputy chief executive', 'hkma']	{'deputy chief executive': '副總裁', 'hkma': '金管局'}	['副總裁', '金管局']
347	{'coin collection programme': '硬幣收集計劃', 'hkma': '金管局', 'public enquiry service': '公眾查詢服務', 'retail bond issuance programme': '零售債券發行計劃', 'banking policy and regulation': '銀行業政策及規例', 'banking product and service': '銀行產品及服務', 'bond issuance': '債券發行', 'consumer banking issue': '銀行消費者事宜', 'debt market development': '債券市場發展', 'financial infrastructure': '金融基建', 'guideline and circular': '指引與通告'}	The Public Enquiry Service provides an effective means for the public to better understand key HKMA functions and operations.  During 2021, it handled 9,781 enquiries. About half of them were related to banking policies and regulations, consumer banking issues, notes and coins, as well as financial infrastructure and debt market development. Some of the notable enquiries were about the Coin Collection Programme, banking products and services, banking-related guidelines and circulars and the Retail Bond Issuance Programme.	公眾查詢服務為公眾提供一個有效的途徑，更好地了解金管局的主要職能和運作。2021年間，該服務共處理了9,781宗查詢。約一半的查詢涉及銀行政策及規例、銀行消費者事宜、紙幣及硬幣、金融基建及債券市場發展等議題。一些具代表性的查詢包括硬幣收集計劃、銀行產品及服務、銀行相關指引及通告和零售債券發行計劃。	['coin collection programme', 'hkma', 'public enquiry service', 'retail bond issuance programme', 'banking policy and regulation', 'banking product and service', 'bond issuance', 'consumer banking issue', 'debt market development', 'financial infrastructure', 'guideline and circular']	{'coin collection programme': '硬幣收集計劃', 'hkma': '金管局', 'public enquiry service': '公眾查詢服務', 'retail bond issuance programme': '零售債券發行計劃', 'banking policy and regulation': '銀行政策及規例', 'banking product and service': '銀行產品及服務', 'bond issuance': '債券 發行', 'consumer banking issue': '銀行消費者事宜', 'debt market development': '債券市場發展', 'financial infrastructure': '金融基建', 'guideline and circular': '指引 通告'}	['硬幣收集計劃', '金管局', '公眾查詢服務', '零售債券發行計劃', '銀行政策及規例', '銀行產品及服務', '債券 發行', '銀行消費者事宜', '債券市場發展', '金融基建', '指引 通告']
348	{'hkma': '金管局', 'hkma annual report': '金管局《年報》', 'half - yearly monetary and financial stability report': '貨幣與金融穩定情況半年度報告', 'monthly statistical bulletin': '《金融數據月報》', 'quarterly bulletin': '《季報》', 'financial stability': '金融穩定'}	Apart from the HKMA Annual Report, the HKMA published two issues of the Half-Yearly Monetary and Financial Stability Report, and four issues of the Quarterly Bulletin, and it regularly updated the Monthly Statistical Bulletin to provide up-to-date and thematic information and analyses on monetary, banking and economic issues in Hong Kong. The HKMA also published 11 inSight1 articles to introduce its major new initiatives and policies and discuss topical issues of interest.	除了金管局《年報》，金管局還出版了兩期《貨幣與金融穩定情況半年度報告》，四期《季報》，並定期更新《金融數據月報》，以提供關於香港貨幣、銀行及經濟問題的即時及主題性資訊和分析。金管局亦發表了11篇《匯思》文章，介紹其主要新措施和政策，並探討受關注的熱門話題。	['hkma', 'hkma annual report', 'half - yearly monetary and financial stability report', 'monthly statistical bulletin', 'quarterly bulletin', 'financial stability']	{'hkma': '金管局', 'hkma annual report': '年報', 'half - yearly monetary and financial stability report': '貨幣與金融穩定情況半年度報告', 'monthly statistical bulletin': '金融數據月報', 'quarterly bulletin': '季報', 'financial stability': '金融穩定'}	['金管局', '年報', '貨幣與金融穩定情況半年度報告', '金融數據月報', '季報', '金融穩定']
349	{'good annual report award': '最佳年報評選', 'environmental , social and governance report': '環境、社會及管治匯報', 'hkma': '金管局', 'hkma annual report': '金管局《年報》', 'hong kong management association': '香港管理專業協會', 'non-profit make and charitable organisations': '非牟利及慈善機構', 'environmental , social and governance': '環境、社會及管治(ESG)'}	The HKMA Annual Report 2020 received a Silver Award in the “Non-profit Making and Charitable Organisations” category, and an Excellence Award in Environmental, Social and Governance Reporting at the Hong Kong Management Association’s 2021 Best Annual Reports Awards.	金管局《年報》2020年獲得香港管理專業協會「非牟利及慈善機構」年度最佳年報獎，並在「環境、社會及管治報告」項目中榮獲優秀獎。	['good annual report award', 'environmental , social and governance report', 'hkma', 'hkma annual report', 'hong kong management association', 'non-profit make and charitable organisations', 'environmental , social and governance']	{'good annual report award': '最佳 年 報獎', 'environmental , social and governance report': '環境、社會及管治報告', 'hkma': '金管局', 'hkma annual report': '年報', 'hong kong management association': '香港管理專業協會', 'non-profit make and charitable organisations': '非牟利及慈善機構', 'environmental , social and governance': '環境、社會及管治報告'}	['最佳 年 報獎', '環境、社會及管治報告', '金管局', '年報', '香港管理專業協會', '非牟利及慈善機構', '環境、社會及管治報告']
350	{'corporate website': '機構網站'}	# Corporate website	# 公司網站	['corporate website']	{'corporate website': '公司網站'}	['公司網站']
351	{'ais': '認可機構', 'hkma': '金管局', 'authorize institution': '認可機構', 'corporate website': '機構網站', 'local representative office': '本地代表辦事處', 'register of security staff': '證券業務員工紀錄冊', 'store value facility': '儲值支付工具', 'store value facility licensees': '儲值支付工具持牌人', 'banking ordinance': '銀行業條例', 'payment system and stored value facility ordinance': '支付系統及儲值支付工具條例'}	The corporate website (www.hkma.gov.hk) presents more than 44,000 pages of content in English and traditional and simplified Chinese, and is the public gateway to up-to-date information about the HKMA. It contains the register of authorized institutions (AIs) and local representative offices and the register of securities staff of AIs, both maintained under section 20 of the Banking Ordinance, as well as the register of stored value facility licensees under the Payment Systems and Stored Value Facilities Ordinance.	公司網站（www.hkma.gov.hk）提供英語、繁體及簡體中文的逾44,000頁內容，是公眾獲取金管局最新資訊的重要管道。網站包含根據銀行業條例第20條維護的認可機構（AIs）及本地代表辦事處註冊資料，以及認可機構證券業務員工紀錄冊，還有根據支付系統及儲值支付工具條例維護的儲值支付工具持牌人註冊資料。	['ais', 'hkma', 'authorize institution', 'corporate website', 'local representative office', 'register of security staff', 'store value facility', 'store value facility licensees', 'banking ordinance', 'payment system and stored value facility ordinance']	{'ais': '認可機構', 'hkma': '金管局', 'authorize institution': '認可機構', 'corporate website': '公司網站', 'local representative office': '本地代表辦事處', 'register of security staff': '證券業務員工紀錄冊', 'store value facility': '儲值支付工具', 'store value facility licensees': '儲值支付工具持牌人', 'banking ordinance': '銀行業條例', 'payment system and stored value facility ordinance': '支付系統及儲值支付工具條例'}	['認可機構', '金管局', '認可機構', '公司網站', '本地代表辦事處', '證券業務員工紀錄冊', '儲值支付工具', '儲值支付工具持牌人', '銀行業條例', '支付系統及儲值支付工具條例']
352	{'hkma': '金管局', 'open application programming interface': '開放應用程式介面', 'financial datum': '金融數據'}	The HKMA has been releasing financial data and important information on its website via Open Application Programming Interface (API) in phases since 2018. By end-2021, the HKMA had opened up 148 sets of Open APIs on its website, in line with the targeted schedule.	自2018年起，金管局已逐步在其網站上透過開放應用程式介面（Open API）發布金融數據及重要資訊。截至2021年底，金管局已在網站上開放148套開放API，符合預定時間表。	['hkma', 'open application programming interface', 'financial datum']	{'hkma': '金管局', 'open application programming interface': '開放應用程式介面', 'financial datum': '金融數據'}	['金管局', '開放應用程式介面', '金融數據']
353	{'information centre': '資訊中心'}	# Information Centre	# 資訊中心	['information centre']	{'information centre': '資訊中心'}	['資訊中心']
354	{'ais': '認可機構', 'hkma': '金管局', 'information centre': '資訊中心', 'local representative office': '本地代表辦事處', 'register of security staff': '證券業務員工紀錄冊', 'banking ordinance': '銀行業條例'}	The HKMA Information Centre, located on the 55th floor of Two International Finance Centre, is an important facility introducing the work of the HKMA to the community and promoting public awareness of monetary and banking matters.  It consists of an exhibition area and a library. The exhibition area presents an overview of the HKMA’s work and the development of money and banking in Hong Kong in an interactive manner.  It also contains information and exhibits for the study of Hong Kong’s monetary, banking and financial affairs.  The library, situated next to the exhibition area, houses more than 26,000 books, journals and other publications on Hong Kong’s monetary, banking and financial affairs as well as central banking topics.  It also maintains the register of AIs and local representative offices, as well as the register of securities staff of AIs, for public access as required by section 20 of the Banking Ordinance.	金管局資訊中心位於國際金融中心二期55樓，是一個重要的設施，用以向公眾介紹金管局的工作，並提高公眾對貨幣及銀行事務的認識。資訊中心包括展覽區及圖書館。展覽區以互動方式展示金管局的工作概況及香港貨幣與銀行業的發展歷程。同時也包含有關香港貨幣、銀行及金融事務的研究資料與展品。圖書館位於展覽區旁邊，收藏超過26,000本有關香港貨幣、銀行及金融事務以及中央銀行主題的書籍、期刊及其他出版物。圖書館亦按銀行業條例第20條的要求，提供認可機構及本地代表辦事處的註冊資料，供公眾查閱。	['ais', 'hkma', 'information centre', 'local representative office', 'register of security staff', 'banking ordinance']	{'ais': '認可機構', 'hkma': '金管局', 'information centre': '資訊中心', 'local representative office': '本地代表辦事處', 'register of security staff': '▔', 'banking ordinance': '銀行業條例'}	['認可機構', '金管局', '資訊中心', '本地代表辦事處', '▔', '銀行業條例']
355	{'covid - 19': '新冠病毒', 'covid - 19 pandemic': '新冠病毒疫情', 'information centre': '資訊中心', 'step': 'STEPS', 'pandemic': '疫情'}	To safeguard public health and safety during the COVID-19 pandemic, special operational arrangements were put in place at the Information Centre.  Cleansing and disinfection were stepped up, and facilities and exhibits were sanitised regularly with anti-microbial coating.	為保障公眾健康安全，在新冠病毒疫情期間，資訊中心採取了特別運作安排。加強清潔消毒工作，定期對設施及展品進行抗菌塗層處理。	['covid - 19', 'covid - 19 pandemic', 'information centre', 'step', 'pandemic']	{'covid - 19': '新冠病毒', 'covid - 19 pandemic': '新冠病毒疫情', 'information centre': '資訊中心', 'step': '加強', 'pandemic': '疫情'}	['新冠病毒', '新冠病毒疫情', '資訊中心', '加強', '疫情']
356	"{'currency section': '「貨幣」展區', 'hkma': '金管局', 'historical timeline': '「歷史長廊」', 'information centre': '資訊中心', ""information centre 's exhibition area"": '資訊中心轄下展覽館', 'policy section': '「政策」展區'}"	The HKMA Information Centre’s exhibition area comprises the Policy Section, the Currency Section and the Historical Timeline	金管局資訊中心的展覽區包括「政策」展區、「貨幣」展區及「歷史長廊」	"['currency section', 'hkma', 'historical timeline', 'information centre', ""information centre 's exhibition area"", 'policy section']"	"{'currency section': '▔', 'hkma': '金管局', 'historical timeline': '歷史長廊', 'information centre': '資訊中心', ""information centre 's exhibition area"": '資訊中心的展覽區', 'policy section': '▔'}"	['▔', '金管局', '歷史長廊', '資訊中心', '資訊中心的展覽區', '▔']
