	terms	src_raw	mt_raw	src_terms	alg_terms	norm_tgt_terms
0	"{""chief executive 's statement"": '總裁報告'}"	# Chief Executive’s Statement	# 行政長官報告	"[""chief executive 's statement""]"	"{""chief executive 's statement"": '長 官 報告'}"	['長 官 報告']
1	{'covid - 19': '新冠病毒', 'operational resilience': '運作穩健性', 'financial stability': '金融穩定', 'geopolitical tension': '地緣政治緊張局勢', 'global financial condition': '全球金融狀況', 'global supply chain': '全球供應鏈', 'inflation pressure': '通脹壓力', 'mutant variant': '變異株', 'pandemic': '疫情', 'resilience': '抗震能力'}	In 2021, the pandemic entered its second year unabated: global supply chains were disrupted, inflation pressures were on the rise, risk of premature tightening of global financial conditions increased.  Adding to the unpredictability were the emergence of mutant variants of COVID-19 and the intensification of geopolitical tensions.  Despite such a macro environment filled with uncertainties, we continued to safeguard monetary and financial stability and maintain operational resilience.	2021年，疫情進入第二年持續未止：全球供應鏈受到衝擊，通脹壓力不斷上升，全球金融條件過早收緊的風險增加。加上新型冠狀病毒變異株的出現以及地緣政治緊張局勢的加劇，使不確定性進一步加大。儘管面臨如此充滿挑戰的宏觀環境，我們仍繼續保障貨幣及金融穩定，維持運作彈性。	['covid - 19', 'operational resilience', 'financial stability', 'geopolitical tension', 'global financial condition', 'global supply chain', 'inflation pressure', 'mutant variant', 'pandemic', 'resilience']	{'covid - 19': '▔', 'operational resilience': '運作彈性', 'financial stability': '金融穩定', 'geopolitical tension': '地緣政治緊張局勢', 'global financial condition': '全球金融條件', 'global supply chain': '全球供應鏈', 'inflation pressure': '通脹壓力', 'mutant variant': '變異株', 'pandemic': '疫情', 'resilience': '運作彈性'}	['▔', '運作彈性', '金融穩定', '地緣政治緊張局勢', '全球金融條件', '全球供應鏈', '通脹壓力', '變異株', '疫情', '運作彈性']
2	"{'covid - 19': '新冠病毒', 'covid - 19 vaccine': '新冠疫苗', ""government 's pandemic relief measure"": '抗疫支援措施', 'hong kong economy': '香港經濟', 'monetary and fiscal policy': '貨幣及財政政策', 'pandemic': '疫情', 'relief measure': '紓困措施', 'vaccination programme': '疫苗接種計劃'}"	2021 also brought hope for recovery with the successful rollout of COVID-19 vaccines together with the accommodative monetary and fiscal policies introduced in multiple economies.  The global economy began to recover from the severe contraction in 2020.  Locally, after having endured economic contraction in 2019 and 2020, the Hong Kong economy grew by 6.3% in 2021, thanks to the rollout of the vaccination programme and the Government’s pandemic relief measures which have lent crucial support to our economic recovery.	2021年也帶來復甦的希望，隨著新冠疫苗接種計劃的成功推行，以及多個經濟體推出的寬鬆貨幣及財政政策，全球經濟開始從2020年的嚴重萎縮中恢復。本地方面，在經歷了2019年及2020年的經濟收縮後，香港經濟於2021年增長6.3%，這要歸功於疫苗接種計劃的推廣，以及政府抗疫支援措施對經濟復蘇的重要支持。	"['covid - 19', 'covid - 19 vaccine', ""government 's pandemic relief measure"", 'hong kong economy', 'monetary and fiscal policy', 'pandemic', 'relief measure', 'vaccination programme']"	"{'covid - 19': '新冠疫苗', 'covid - 19 vaccine': '新冠疫苗', ""government 's pandemic relief measure"": '政府 抗疫 支援 措施', 'hong kong economy': '香港經濟', 'monetary and fiscal policy': '貨幣及財政政策', 'pandemic': '抗疫', 'relief measure': '抗疫支援措施', 'vaccination programme': '疫苗接種計劃'}"	['新冠疫苗', '新冠疫苗', '政府 抗疫 支援 措施', '香港經濟', '貨幣及財政政策', '抗疫', '抗疫支援措施', '疫苗接種計劃']
3	"{'fintech': '金融科技', ""hong kong 's gateway role"": '香港作為通往內地的門戶', 'mainland': '內地', 'mainland market opportunity': '內地市場機遇', 'monetary stability': '貨幣穩定', 'financial and monetary stability': '金融及貨幣穩定', 'green finance': '綠色金融', 'strategic priority': '重點策略範疇'}"	With financial and monetary stability maintained, as well as a steadying macro environment, 2021 gave us some room to pursue more development work.  We seized the opportunity and pressed ahead with developmental initiatives that will help our financial sector remain highly competitive. Significant progress has been made across our three strategic priorities, namely fintech, green finance and Mainland market opportunities arising from Hong Kong’s gateway role.	在金融及貨幣穩定得到保障，以及宏觀環境逐步穩健的情況下，2021年為我們提供了更多進行發展工作的空間。我們把握機會，推動有助香港金融業保持高度競爭力的發展項目。在我們三個重點策略範疇——金融科技、綠色金融及香港作為通往內地市場的門戶所帶來的機遇方面，均取得顯著進展。	"['fintech', ""hong kong 's gateway role"", 'mainland', 'mainland market opportunity', 'monetary stability', 'financial and monetary stability', 'green finance', 'strategic priority']"	"{'fintech': '金融科技', ""hong kong 's gateway role"": '香港 的 門戶', 'mainland': '內地', 'mainland market opportunity': '▔', 'monetary stability': '貨幣穩定', 'financial and monetary stability': '金融及貨幣穩定', 'green finance': '綠色金融', 'strategic priority': '重點策略'}"	['金融科技', '香港 的 門戶', '內地', '▔', '貨幣穩定', '金融及貨幣穩定', '綠色金融', '重點策略']
4	{'international financial centre': '國際金融中心', 'financial system': '金融體系', 'monetary and financial system': '貨幣及金融體系'}	As we entered 2022, the global environment took a turn for the worse.  But as the saying goes, when the going gets tough, the tough get going.  We will continue to be proactive and pursue our developmental goals and priorities to be better prepared for the next challenge and to cement our status as an international financial centre.  We will also remain steadfast in our commitment to ensure the soundness of Hong Kong monetary and financial systems, as we have risen to the many challenges time and again as in the past.	踏入2022年，全球環境急轉直下。但正所謂「困難當前，勇者勝出」，我們將繼續積極主動，追求發展目標和優先事項，以更好地準備迎接下一個挑戰，並鞏固香港作為國際金融中心的地位。同時，我們也會堅定不移地履行承諾，確保香港貨幣及金融系統的健全性，正如過去一樣，我們一次次成功應對各種挑戰。	['international financial centre', 'financial system', 'monetary and financial system']	{'international financial centre': '國際金融中心', 'financial system': '金融系統', 'monetary and financial system': '貨幣及金融系統'}	['國際金融中心', '金融系統', '貨幣及金融系統']
5	{'international financial centre': '國際金融中心', 'financial stability': '金融穩定'}	# Monetary and financial stability: foundation of an international financial centre	# 貨幣及金融穩定：國際金融中心的基石	['international financial centre', 'financial stability']	{'international financial centre': '國際金融中心', 'financial stability': '金融穩定'}	['國際金融中心', '金融穩定']
6	"{'covid - 19': '新冠病毒', 'covid - 19 pandemic': '新冠病毒疫情', ""hong kong 's financial system"": '香港金融體系', 'lers': '聯匯制度', 'linked exchange rate system': '聯繫匯率制度', 'us monetary tightening': '美國收緊貨幣政策', 'exchange and money market': '外匯及貨幣市場', 'financial system': '金融體系', 'money market': '貨幣市場', 'pandemic': '疫情'}"	Since its establishment in 1983, the Linked Exchange Rate System (LERS) has been a strong anchor of Hong Kong’s financial system and has helped Hong Kong withstand numerous shocks and challenges.  Despite the lingering uncertainties surrounding the COVID-19 pandemic and market concerns about the pace of US monetary tightening, the Hong Kong dollar exchange and money markets continued to function in an orderly manner throughout the year, reflecting the robustness of the LERS.	自1983年成立以來，聯繫匯率制度（LERS）一直是香港金融體系的強大支柱，幫助香港度過了許多衝擊和挑戰。儘管新冠疫情的長期不確定性和市場對美國收緊貨幣政策步伐的擔憂依然存在，但香港掛鈴幣兌換及貨幣市場全年一直有序運作，反映出聯繫匯率制度的堅韌性。	"['covid - 19', 'covid - 19 pandemic', ""hong kong 's financial system"", 'lers', 'linked exchange rate system', 'us monetary tightening', 'exchange and money market', 'financial system', 'money market', 'pandemic']"	"{'covid - 19': '新冠疫情', 'covid - 19 pandemic': '新冠疫情', ""hong kong 's financial system"": '香港金融體系', 'lers': '▔', 'linked exchange rate system': '聯繫匯率制度', 'us monetary tightening': '美國收緊貨幣政策', 'exchange and money market': '兌換 及 貨幣 市場', 'financial system': '金融體系', 'money market': '貨幣市場', 'pandemic': '疫情'}"	['新冠疫情', '新冠疫情', '香港金融體系', '▔', '聯繫匯率制度', '美國收緊貨幣政策', '兌換 及 貨幣 市場', '金融體系', '貨幣市場', '疫情']
7	{'external sector report': '對外部門報告', 'international monetary fund': '國際貨幣基金組織', 'lers': '聯匯制度', 'fiscal and foreign reserve': '財政及外匯儲備', 'fiscal framework': '財政制度', 'prudent fiscal framework': '審慎的財政架構'}	This confidence in our systems did not happen overnight, but is based on the solid foundation which has been built up over the years.  In its 2021 External Sector Report, the International Monetary Fund once again reiterated that the credibility of the LERS has been assured by a transparent set of rules, ample fiscal and foreign reserves, strong financial regulation and supervision, a flexible economy, and a prudent fiscal framework.	這種對我們體系的信心並非一蹴而就，而是建立在多年來奠定的堅實基礎之上。在2021年《外匯部門報告》中，國際貨幣基金組織再次重申，聯繫匯率制度的可信度是由透明的規則、充足的財政及外匯儲備、強大的金融監管和監督、靈活的經濟結構，以及謹慎的財政框架所保證的。	['external sector report', 'international monetary fund', 'lers', 'fiscal and foreign reserve', 'fiscal framework', 'prudent fiscal framework']	{'external sector report': '外匯部門報告', 'international monetary fund': '國際貨幣基金組織', 'lers': '▔', 'fiscal and foreign reserve': '財政及外匯儲備', 'fiscal framework': '財政框架', 'prudent fiscal framework': '謹慎 財政 框架'}	['外匯部門報告', '國際貨幣基金組織', '▔', '財政及外匯儲備', '財政框架', '謹慎 財政 框架']
8	{'comprehensive analysis': '全面的監察及分析', 'datum analytics': '數據分析', 'financial stability': '金融穩定', 'macroprudential surveillance': '宏觀審慎監察', 'public and market engagement': '公眾及市場溝通', 'surveillance': '監察', 'technology and datum analytics': '科技及數據分析技術'}	The confidence is also a result of our efforts in public and market engagement, as well as effective surveillance.  On the latter, we have leveraged technology and data analytics to strengthen our capability for more timely and comprehensive analysis on financial stability and macroprudential surveillance.	這種信心也是我們在公眾及市場參與方面的努力，以及有效的監察結果。在後者方面，我們利用科技及數據分析技術加強了對金融穩定及宏觀審慎監察的即時且全面分析能力。	['comprehensive analysis', 'datum analytics', 'financial stability', 'macroprudential surveillance', 'public and market engagement', 'surveillance', 'technology and datum analytics']	{'comprehensive analysis': '全面分析', 'datum analytics': '數據', 'financial stability': '金融穩定', 'macroprudential surveillance': '宏觀審慎監察', 'public and market engagement': '公眾 市場 參', 'surveillance': '監察', 'technology and datum analytics': '科技及數據分析技術'}	['全面分析', '數據', '金融穩定', '宏觀審慎監察', '公眾 市場 參', '監察', '科技及數據分析技術']
9	{'asset quality': '資產質素', 'covid - 19': '新冠病毒', 'covid - 19 pandemic': '新冠病毒疫情', 'capital adequacy': '資本充足水平', 'liquidity coverage ratio': '流動性覆蓋比率', 'banking system': '銀行體系', 'capital adequacy ratio': '資本充足比率', 'classify loan ratio': '特定分類貸款比率', 'credit landscape': '信貸環境', 'financial stability': '金融穩定', 'international standard': '國際標準', 'liquidity position': '流動性水平', 'long - run historical average': '長期平均水平', 'pandemic': '疫情', 'statutory minimum requirement': '法定最低要求'}	The robustness of the banking system is of paramount importance to financial stability in Hong Kong.  Two years into the COVID-19 pandemic, our banks remained resilient with liquidity positions and capitalisation faring very well by international standards.  As at end-2021, the capital adequacy ratio of local banks stood at 20.2%, well above the minimum requirement of 8%, while the average Liquidity Coverage Ratio of large banks was 151.9% in the fourth quarter of 2021, also well above the statutory minimum requirement of 100%.  Despite a challenging credit landscape amid the pandemic, the asset quality of the banking sector remained largely stable during the year. The classified loan ratio of the industry was 0.88% at the end of 2021, down from 0.90% at the end of 2020, well below the long-run historical average of 1.8% since 2000.	銀行體系的堅韌性對於香港的金融穩定至關重要。在新冠疫情爆發兩年後，我國銀行仍然具備良好的流動性水平及資本充足率，符合國際標準。截至2021年底，本地銀行的資本充足比率達20.2%，遠高於8%的最低要求；而大型銀行在2021年第4季度的平均流動性覆蓋比率為151.9%，亦遠高於法定最低要求的100%。儘管疫情期間信貸環境嚴峻，銀行業的資產質量在該年度仍大致保持穩定。截至2021年底，銀行業的分類貸款比率為0.88%，較2020年底的0.90%有所下降，遠低於自2000年起的長期平均水平1.8%。	['asset quality', 'covid - 19', 'covid - 19 pandemic', 'capital adequacy', 'liquidity coverage ratio', 'banking system', 'capital adequacy ratio', 'classify loan ratio', 'credit landscape', 'financial stability', 'international standard', 'liquidity position', 'long - run historical average', 'pandemic', 'statutory minimum requirement']	{'asset quality': '資產質量', 'covid - 19': '新冠疫情', 'covid - 19 pandemic': '新冠疫情', 'capital adequacy': '資本充足比率', 'liquidity coverage ratio': '流動性覆蓋比率', 'banking system': '銀行體系', 'capital adequacy ratio': '資本充足比率', 'classify loan ratio': '分類貸款比率', 'credit landscape': '信貸環境', 'financial stability': '金融穩定', 'international standard': '國際標準', 'liquidity position': '流動性水平', 'long - run historical average': '長期平均水平', 'pandemic': '疫情', 'statutory minimum requirement': '法定最低要求'}	['資產質量', '新冠疫情', '新冠疫情', '資本充足比率', '流動性覆蓋比率', '銀行體系', '資本充足比率', '分類貸款比率', '信貸環境', '金融穩定', '國際標準', '流動性水平', '長期平均水平', '疫情', '法定最低要求']
10	{'pillar of support': '經濟支柱'}	# Banking sector: a pillar of support to the economy	# 銀行業：經濟活動的重要支柱	['pillar of support']	{'pillar of support': '重要支柱'}	['重要支柱']
11	{'covid - 19': '新冠病毒', 'credit risk': '信用風險', 'hkma': '金管局', 'ppphs': '預先批核還息不還本計劃', 'corporate customer': '企業客戶', 'economic sector': '行業', 'individual borrower': '個人客戶', 'loan principal payment': '貸款本金', 'pandemic': '疫情', 'pillar of support': '經濟支柱', 'real economy': '實體經濟', 'relief measure': '紓困措施', 'supervisory work': '監管工作'}	As always, the banking sector is an important pillar of support to economic activity.  This is ever more crucial in the face of economic fallout from the COVID-19 outbreak.  In the past year, a main challenge was to strike a balance between managing credit risk in the banking sector and maintaining the sector’s support for the real economy.  With our supervisory work over the years, banks continued to manage credit risks effectively.  At the same time, we worked closely with banks to provide the much needed relief to corporate and personal customers through the Pre-approved Principal Payment Holiday Scheme (PPPHS) and other relief measures.  The PPPHS, launched together with the Banking Sector Small and Medium-sized Enterprise (SME) Lending Coordination Mechanism in 2020 allowing eligible corporate customers to defer loan principal payments by six months on a pre-approval basis, was again further extended twice during 2021 until April 2022 recognising that some economic sectors were still hard-pressed by the lingering pandemic and were in need of continued credit relief.  Subsequently, in light of a resurgence of local coronavirus infections, in February 2022, the PPPHS was further extended until the end of October 2022.  It is encouraging to see that the banking sector has joined forces with the HKMA to help relieve cash-flow pressures on corporate and individual borrowers, even whilst the sector itself is experiencing its own difficult operating conditions due to the outbreak of the pandemic.	一如往常，銀行業是經濟活動的重要支柱。面對新冠疫情造成的經濟影響，這一角色尤顯關鍵。在過去一年中，主要挑戰是在管理銀行業信貸風險的同時，維持該行業對實體經濟的支持。經過多年的監管工作，銀行持續有效地管理信貸風險。同時，我們與銀行密切合作，通過預先批核還息不還本計劃（PPPHS）及其他紓困措施，向企業及個人客戶提供必要的援助。PPPHS於2020年與銀行業中小企貸款協調機制一同推出，允許合資格企業客戶在預先批准的前提下，延遲半年償還貸款本金，該計劃在2021年內兩次延長，直至2022年4月，以反映一些行業仍受疫情餘波影響，需要持續信貸支援。隨後，鑒於本地新型冠狀病毒感染情況再度升溫，PPPHS於2022年2月進一步延長至2022年10月底結束。令人鼓舞的是，銀行業已與金管局攜手合作，協助企業及個人借款人緩解現金流壓力，即使該行業本身因疫情爆發而面臨自身的困難營運環境。	['covid - 19', 'credit risk', 'hkma', 'ppphs', 'corporate customer', 'economic sector', 'individual borrower', 'loan principal payment', 'pandemic', 'pillar of support', 'real economy', 'relief measure', 'supervisory work']	{'covid - 19': '新冠疫情', 'credit risk': '信貸風險', 'hkma': '金管局', 'ppphs': '預先批核還息不還本計劃', 'corporate customer': '企業客戶', 'economic sector': '▔', 'individual borrower': '個人借款人', 'loan principal payment': '貸款', 'pandemic': '疫情', 'pillar of support': '重要支柱', 'real economy': '實體經濟', 'relief measure': '紓困措施', 'supervisory work': '監管工作'}	['新冠疫情', '信貸風險', '金管局', '預先批核還息不還本計劃', '企業客戶', '▔', '個人借款人', '貸款', '疫情', '重要支柱', '實體經濟', '紓困措施', '監管工作']
12	{'consumer protection': '消費者保障', 'step': 'STEPS', 'consumer and investor protection': '消費者及投資者保障', 'credit landscape': '信貸環境', 'cyber resilience': '網絡防衛能力', 'cyber threat': '網絡威脅', 'digital financial service': '數碼金融服務', 'digital landscape': '數碼環境', 'digitalisation': '數碼化', 'financial service': '金融服務', 'investor protection': '投資者的保障', 'operate environment': '經營環境', 'operational and cyber resilience': '運作穩健性及網絡防衛能力', 'pandemic': '疫情', 'phishing scam': '網絡釣魚騙案', 'resilience': '抗震能力'}	Apart from the challenging credit landscape, the pandemic also brought about a more difficult operating environment and a digital landscape with escalating cyber threat. We have stepped up our efforts to enhance operational and cyber resilience of the banking sector, as well as consumer and investor protection amid increasing digitalisation and a surge in phishing scams.  In particular, the Code of Banking Practice was revised to enhance consumer protection in digital financial services.	除了信貸環境的挑戰之外，疫情也帶來了更艱難的經營環境和日益升級的網絡威脅。我們加強了對銀行業運作穩健性及網絡防衛能力的建設，同時加強消費者及投資者保障，以應對數字化浪潮和詐騙電郵激增的趨勢。特別是修訂了《銀行業行為守則》，以加強對數位金融服務的消費者保護。	['consumer protection', 'step', 'consumer and investor protection', 'credit landscape', 'cyber resilience', 'cyber threat', 'digital financial service', 'digital landscape', 'digitalisation', 'financial service', 'investor protection', 'operate environment', 'operational and cyber resilience', 'pandemic', 'phishing scam', 'resilience']	{'consumer protection': '▔', 'step': '加強', 'consumer and investor protection': '消費者及投資者保障', 'credit landscape': '信貸環境', 'cyber resilience': '網絡防衛能力', 'cyber threat': '網絡威脅', 'digital financial service': '數位金融服務', 'digital landscape': '▔', 'digitalisation': '數字化', 'financial service': '金融 服務', 'investor protection': '投資者保障', 'operate environment': '經營環境', 'operational and cyber resilience': '運作穩健性及網絡防衛能力', 'pandemic': '疫情', 'phishing scam': '詐騙電郵', 'resilience': '穩健性'}	['▔', '加強', '消費者及投資者保障', '信貸環境', '網絡防衛能力', '網絡威脅', '數位金融服務', '▔', '數字化', '金融 服務', '投資者保障', '經營環境', '運作穩健性及網絡防衛能力', '疫情', '詐騙電郵', '穩健性']
13	{'hkma': '金管局', 'banking industry': '銀行業', 'banking service for person with intellectual disability': '為智障人士提供銀行服務', 'barrier - free banking service': '無障礙銀行服務', 'good practice': '最佳做法', 'customer - centric culture': '以客為本的文化', 'financial inclusion': '普及金融', 'industry guideline': '行業指引', 'person with dementia': '認知障礙症患者', 'supervisory work': '監管工作'}	Besides supervisory work, we are dedicated to promoting financial inclusion and customer-centric culture in the banking sector.  Enhancing accessibility to banking services by customers in need has been one of our priority areas and we have been working closely with the industry to develop industry guidelines.  Further to the guidance on barrier-free banking services and provision of banking services for persons with intellectual disabilities, the industry, with the support of the HKMA, published in December 2021 a guideline to set out the principles and good practices for the banking industry in providing banking services to persons with dementia and customers in need.	除了監管工作，我們致力於促進銀行業的金融包容性及以客為本的文化。提高有需要顧客對銀行服務的可及性一直是我們的優先領域，我們一直與業界密切合作開發行業指引。繼有關無障礙銀行服務及為智障人士提供銀行服務的指引之後，業界在金管局的支持下，於2021年12月發表了一項指引，闡述銀行業為認知障礙症患者及有需要顧客提供銀行服務的原則和良好實踐。	['hkma', 'banking industry', 'banking service for person with intellectual disability', 'barrier - free banking service', 'good practice', 'customer - centric culture', 'financial inclusion', 'industry guideline', 'person with dementia', 'supervisory work']	{'hkma': '金管局', 'banking industry': '銀行業', 'banking service for person with intellectual disability': '為智障人士提供銀行服務', 'barrier - free banking service': '無障礙銀行服務', 'good practice': '良好實踐', 'customer - centric culture': '以客為本的文化', 'financial inclusion': '金融包容性', 'industry guideline': '行業指引', 'person with dementia': '認知障礙症患者', 'supervisory work': '監管工作'}	['金管局', '銀行業', '為智障人士提供銀行服務', '無障礙銀行服務', '良好實踐', '以客為本的文化', '金融包容性', '行業指引', '認知障礙症患者', '監管工作']
