	terms	src_raw	mt_raw	src_terms	alg_terms	norm_tgt_terms
345	{'type': 'вид'}	You can select the type of industry here.	Вы можете выбрать вид отрасли здесь.	['type']	{'type': 'вид'}	['вид']
346	{'type': 'тип'}	You can define rate elements of the following rating types:	Можно указать следующие элементы значений рейтинга:	['type']	{'type': 'значений'}	['значение']
347	{'service confirmation': 'подтверждение сервиса'}	Displays service order items and service confirmation items by release status for billing	В этом ракурсе отображаются позиции сервисного заказа и подтверждения сервиса, деблокированные для расчета.	['service confirmation']	{'service confirmation': 'подтверждения сервиса'}	['подтверждение сервис']
348	{'allocation': 'распределение'}	Standalone Selling Price-Weighted Allocation	Единичная продажная цена-весовая распределение	['allocation']	{'allocation': 'распределение'}	['распределение']
349	{'allocation': 'перерасчет'}	Allocation Cost Eelement	Перерасчет косвенных затрат	['allocation']	{'allocation': 'косвенных'}	['косвенный']
350	{'get': 'получить'}	Select Get Values.	Получить значения	['get']	{'get': 'Получить'}	['получить']
351	{'action': 'операция'}	This is the main action.	Эта операция является основной.	['action']	{'action': '▔'}	['▔']
352	{'input': 'вход'}	Input Parameters and Result Parameters	Параметры ввода и результаты	['input']	{'input': 'ввода'}	['ввод']
353	{'copy': 'скопировать'}	Copy Return Items	Копировать возвратные позиции	['copy']	{'copy': 'Копировать'}	['копировать']
354	{'type': 'вид'}	Creating eDocument Types	Создание типов электронных документов	['type']	{'type': 'типов'}	['тип']
355	{'Personal Information': 'личная информация'}	Personal Information tab	Вкладка Персональные данные.	['Personal Information']	{'Personal Information': 'Персональные данные'}	['персональный дать']
356	{'claim': 'страховой случай'}	Select the claim to view details.	Выбрать страховой случай для просмотра деталей.	['claim']	{'claim': 'страховой случай'}	['страховой случай']
357	{'contract': 'контракт'}	Manage Sales Contracts	Управление контрактами на продажу	['contract']	{'contract': 'контрактами'}	['контракт']
358	{'edit': 'редактировать'}	Choose Edit Orders.	Нажмите Редактировать заказы.	['edit']	{'edit': 'Редактировать'}	['редактировать']
359	{'provider': 'провайдер'}	Name of the trusted identity provider	Имя доверенного удостоверяющего центра	['provider']	{'provider': 'центра'}	['центр']
360	{'go to': 'переход'}	Accrual objects that have been review confirmed go to the Review Finished status.As the review process is not required, you can still post accrual objects directly that need reviewing but haven't been reviewed.	"Завершенные подтвержденные объекты, которые были просмотрены, переходят в статус ""Проверено"".Так как проверка не требуется, вы можете еще раз просмотреть подтвержденные объекты, но не просмотренные ранее."	['go to']	{'go to': 'переходят'}	['переходить']
361	{'process': 'обработать'}	You can use the warehouse task link to navigate to warehouse tasks in the new Process Warehouse Tasks - Putaway app.	Вы можете использовать ссылку на складскую задачу для перехода к задачам склада в новом приложении Обработать складские задачи – Помещение.	['process']	{'process': 'Обработать'}	['обработать']
362	{'controller': 'оператор'}	You can assign multiple data controllers to the same business partner.	Можно присвоить несколько операторов персональных данных одному деловому партнеру.	['controller']	{'controller': 'операторов'}	['оператор']
363	{'Activities': 'действия'}	You can perform the following activities on imported procurement schedules:	Вы можете выполнять следующие действия на импортированных планах закупок:	['Activities']	{'Activities': 'действия'}	['действие']
364	{'purpose': 'назначение'}	Specifies the purpose of a document that is assigned to a legal transaction.	Указывает назначение документа, используемого в юридической операции.	['purpose']	{'purpose': 'назначение'}	['назначение']
365	{'change': 'изменение'}	Change the priority of an authorization characteristic	Изменить приоритетность перечня полномочий	['change']	{'change': 'Изменить'}	['изменить']
366	{'withholding tax': 'налог на источники дохода'}	Withholding Tax at Row Level	Налог на источники дохода	['withholding tax']	{'withholding tax': 'Налог на источники дохода'}	['налог на источник доход']
367	{'assignment': 'назначение'}	Pending PO Assignment	Назначение ожидающего заказа	['assignment']	{'assignment': 'Назначение'}	['назначение']
368	{'service': 'услуга'}	Service in Bank Statement	Услуга в банковском отчете	['service']	{'service': 'Услуга'}	['услуга']
369	{'space': 'пространство'}	Create and delete Spaces	Создание и удаление пространств	['space']	{'space': 'пространств'}	['пространство']
370	{'action': 'операция'}	Workflow Event Action	Операция события	['action']	{'action': 'Операция'}	['операция']
371	{'attach': 'вложить'}	You can attach files or links to the object.	Можно вложить файлы или ссылки на объект.	['attach']	{'attach': 'вложить'}	['вложить']
372	{'payment': 'оплата'}	Indicates the address to which payment is sent.	Указывает адрес, куда будет отправлен платеж.	['payment']	{'payment': 'платеж'}	['платёж']
373	{'output': 'вывод'}	You can generate output using the following:	Вывод можно генерировать с помощью следующих:	['output']	{'output': 'Вывод'}	['вывод']
374	{'activity': 'операция'}	The activity can invite both internal and external users.	Операция может приглашать как внутренних, так и внешних пользователей.	['activity']	{'activity': 'Операция'}	['операция']
375	{'input': 'ввод'}	Select your input entity:	Выберите вашу сущность ввода:	['input']	{'input': 'ввода'}	['ввод']
376	{'input': 'ввод'}	Input data such as the following:	Ввод данных, таких как:	['input']	{'input': 'Ввод'}	['ввод']
377	{'use': 'использование'}	Use Currency Conversion	Использование валюты конвертации	['use']	{'use': 'Использование'}	['использование']
378	{'change': 'изменение'}	These dates can't be changed.	Эти даты не могут быть изменены.	['change']	{'change': 'изменены'}	['изменить']
379	{'type': 'тип'}	Displays the assigned actions for run types.	Отображает назначенные действия для типов прогона.	['type']	{'type': 'типов'}	['тип']
380	{'type': 'вид'}	Filter by Document Type	Фильтрация по виду документа	['type']	{'type': 'виду'}	['вид']
381	{'change': 'изменить'}	Change Material Substitution	Изменение материала	['change']	{'change': 'Изменение'}	['изменение']
382	{'transport': 'транспорт'}	Application Help for Transport	Справочная информация по транспортным операциям	['transport']	{'transport': 'транспортным'}	['транспортный']
383	{'carrier': 'перевозчик'}	Information for carriers:	Информация для перевозчиков:	['carrier']	{'carrier': 'перевозчиков'}	['перевозчик']
384	{'connection': 'подключение'}	As a prerequisite, you must have already set up the connection to the ERP using Connection Management app.	Для перехода к следующему шагу ассистента необходимо установить соединение с ERP.	['connection']	{'connection': 'соединение'}	['соединение']
385	{'process': 'обработать'}	To process customer payments by credit card proceed as follows:	Для обработки платежей по кредитной карте следует проделать следующие действия:	['process']	{'process': 'обработки'}	['обработка']
386	{'activate': 'активировать'}	Create and activate a business rule	Создать и активировать бизнес-правило	['activate']	{'activate': 'активировать'}	['активировать']
387	{'provider': 'провайдер'}	The name of the data provider company.	Название компании провайдера данных.	['provider']	{'provider': 'провайдера'}	['провайдер']
388	{'total': 'сумма'}	Total Credit Line by Transaction Currency	Сумма кредитного лимита по операциям в валюте счета	['total']	{'total': 'Сумма'}	['сумма']
389	{'controller': 'оператор'}	The data controller component is displayed.	Отображается оператор персональных данных.	['controller']	{'controller': 'оператор'}	['оператор']
390	{'confirmation control key': 'управляющий ключ подтверждения'}	Enables you to select the confirmation control key.	Управляющий ключ подтверждения.	['confirmation control key']	{'confirmation control key': 'Управляющий ключ подтверждения'}	['управлять ключ подтверждение']
391	{'reconcile': 'выполнить выверку'}	With this app, you can manually reconcile intraday bank statement flows with forecasted cash flows.	С помощью этого приложения можно вручную выполнить выверку внутридневных выписок по счету с прогнозируемыми денежными потоками.	['reconcile']	{'reconcile': 'выверку'}	['выверка']
392	{'type': 'тип'}	Choose Assessment Type	Тип оценки	['type']	{'type': 'Тип'}	['тип']
393	{'provider': 'провайдер'}	The data provider's ZIP code.	Код провайдера данных.	['provider']	{'provider': 'провайдера'}	['провайдер']
394	{'type': 'тип'}	Relevant Order Type	Тип заказа	['type']	{'type': 'Тип'}	['тип']
395	{'consumption': 'расход'}	Consumption in Month	Потребление в месяц	['consumption']	{'consumption': 'Потребление'}	['потребление']
396	{'category': 'категория'}	Stamp Duty Category	Категория налога на добавленную стоимость	['category']	{'category': 'Категория'}	['категория']
397	{'pause': 'приостановка'}	Pause and Resume	Приостановка и перезапуск тиражирования	['pause']	{'pause': 'Приостановка'}	['приостановка']
398	{'type': 'тип'}	Enter the type of document.	Введите тип документа.	['type']	{'type': 'тип'}	['тип']
399	{'transport': 'транспорт'}	Viewing Transport Requests	Просмотр транспортных запросов	['transport']	{'transport': 'транспортных'}	['транспортный']
400	{'tab': 'вкладка'}	Work Agreement Tab	"Вкладка ""Соглашение"""	['tab']	{'tab': 'Вкладка'}	['вкладка']
401	{'type': 'тип'}	There are six types of Constant expressions:	Существует шесть типов константных выражений:	['type']	{'type': 'типов'}	['тип']
402	{'workflow': 'рабочий процесс'}	The following example describes a possible workflow:	Примером может служить рабочий процесс:	['workflow']	{'workflow': 'рабочий процесс'}	['рабочий процесс']
403	{'collection agency': 'коллекторское агентство'}	Send Update to Collection Agency	Отправить обновление к коллекторскому агентству	['collection agency']	{'collection agency': 'коллекторскому агентству'}	['коллекторский агентство']
404	{'type': 'вид'}	This is the default attachment type.	Это стандартный вид вложения.	['type']	{'type': 'вид'}	['вид']
405	{'type': 'тип'}	Activity Type Description	Описание типа операции	['type']	{'type': 'типа'}	['тип']
406	{'client': 'клиент'}	Corresponding DataSource (for use in SAP Analytics Cloud and analytical clients)	Соответствующий источник данных (для использования в SAP Analytics Cloud и клиентских приложениях)	['client']	{'client': 'клиентских'}	['клиентский']
407	{'category': 'категория'}	Billing Plan Category - Text	Категория фактурирования - текст	['category']	{'category': 'Категория'}	['категория']
408	{'edit': 'редактировать'}	You can also edit or download a virtual document.	Также можно редактировать или скачивать виртуальный документ.	['edit']	{'edit': 'редактировать'}	['редактировать']
409	{'characteristic': 'характеристика'}	Creation, update, and deletion of characteristics	Создание, обновление и удаление характеристик	['characteristic']	{'characteristic': 'характеристик'}	['характеристика']
410	{'release': 'деблокировать'}	Release (Document OK)	Деблокировать (документ OK)	['release']	{'release': 'Деблокировать'}	['деблокировать']
411	{'analytics chart': 'аналитическая диаграмма'}	Analytics Chart 1	Аналитическая диаграмма 1	['analytics chart']	{'analytics chart': 'Аналитическая диаграмма'}	['аналитический диаграмма']
412	{'provider': 'поставщик'}	Filter by Provider	Фильтр по поставщику	['provider']	{'provider': 'поставщику'}	['поставщик']
413	{'assigned': 'присвоенный'}	Semantic Tag Assigned	Смысловой тег присваивается	['assigned']	{'assigned': 'присваивается'}	['присваиваться']
414	{'run type': 'тип прогона'}	Displays whether a run type is enabled.	Отображает, активировано ли сообщение для типа прогона.	['run type']	{'run type': 'типа прогона'}	['тип прогон']
415	{'exit': 'выход'}	Add an exit condition.	Добавить выходное условие.	['exit']	{'exit': 'выходное'}	['выходной']
416	{'data provider': 'провайдер данных'}	The country where the data provider is located.	Страна, в которой находится провайдер данных.	['data provider']	{'data provider': 'провайдер данных'}	['провайдер данные']
417	{'account': 'счет'}	Search for account information	Поиск информации о счете	['account']	{'account': 'счете'}	['счёт']
418	{'check': 'проверка'}	Check Service Contract Actuals	Проверка фактических данных по договору	['check']	{'check': 'Проверка'}	['проверка']
419	{'type': 'вид'}	You can view orders based on any of the following industry type:	Вы можете просматривать заказы в соответствии с любым из следующих видов промышленности:	['type']	{'type': 'видов'}	['вид']
420	{'maintain': 'выполнять ведение'}	Allows you to maintain the story details.	Позволяет выполнять ведение истории.	['maintain']	{'maintain': 'ведение'}	['ведение']
421	{'location structure': 'структура местоположений'}	With this app, you can edit the location structure.	С помощью этого приложения можно редактировать структуру местоположений.	['location structure']	{'location structure': 'структуру местоположений'}	['структура местоположение']
422	{'compliance': 'соответствие'}	For more information about integreting with contract compliance, see .	Для получения дополнительной информации о интеграции с соответствием см..	['compliance']	{'compliance': 'соответствием'}	['соответствие']
423	{'topic': 'раздел'}	This topic describes the G/L account renumbering process.	Этот раздел описывает процесс переименования счетов в G/L.	['topic']	{'topic': 'раздел'}	['раздел']
424	{'compensation': 'возмещение'}	Specifies how customer compensation is to be processed.	Определяет, как возмещение будет обрабатываться.	['compensation']	{'compensation': 'возмещение'}	['возмещение']
425	{'pricing procedure': 'схема калькуляции'}	Pricing Procedure PP1	Схема калькуляции	['pricing procedure']	{'pricing procedure': 'Схема калькуляции'}	['схема калькуляция']
426	{'assembly': 'сборка'}	Assembly in Process	Сборка в обработке	['assembly']	{'assembly': 'Сборка'}	['сборка']
427	{'tab': 'вкладка'}	Default values tab page:	"Вкладка ""Настройки по умолчанию"""	['tab']	{'tab': 'Вкладка'}	['вкладка']
428	{'edit': 'обработать'}	Edit Safety Observation	Редактирование условий наблюдения.	['edit']	{'edit': 'Редактирование'}	['редактирование']
429	{'pattern': 'шаблон'}	Set when the recurrence pattern ends:	Установите, когда заканчивается шаблон повтора:	['pattern']	{'pattern': 'шаблон'}	['шаблон']
430	{'type': 'тип'}	External Document Type	Тип внешнего документа	['type']	{'type': 'Тип'}	['тип']
431	{'transaction': 'движение'}	Transaction in the past	Движение в прошлом	['transaction']	{'transaction': 'Движение'}	['движение']
432	{'stop': 'остановка'}	Stop Manual Forecasting	Остановить ручное планирование	['stop']	{'stop': 'Остановить'}	['остановить']
433	{'tab': 'вкладка'}	Budget Adjustments Tab	"Вкладка ""Изменения бюджета"""	['tab']	{'tab': 'Вкладка'}	['вкладка']
434	{'activate': 'активировать'}	Activate a supplier list that is in preparation.	Активировать список поставщиков, которые находятся в процессе подготовки.	['activate']	{'activate': 'Активировать'}	['активировать']
435	{'contract': 'контракт'}	Contract for Limit determines the price per unit for each item in the service entry sheet.	Контракт для лимита определяет цену за единицу для каждой позиции в ведомости учета работ/услуг.	['contract']	{'contract': 'Контракт'}	['контракт']
436	{'edit': 'редактировать'}	You can also edit these tasks with the following exceptions:	Также можно отредактировать эти задачи с следующими исключениями:	['edit']	{'edit': 'отредактировать'}	['отредактировать']
437	{'wizard': 'мастер'}	New resource wizards	Мастер ресурсов	['wizard']	{'wizard': 'Мастер'}	['мастер']
438	{'object category': 'тип объекта'}	Purchasing Object Category	Тип объекта категории закупок	['object category']	{'object category': 'объекта категории'}	['объект категория']
439	{'cancel': 'отменить'}	Create, Change, Cancel	Создать, изменить, отменить	['cancel']	{'cancel': 'отменить'}	['отменить']
440	{'restricted': 'с ограничением'}	Restricted reuse views	С ограниченным использованием	['restricted']	{'restricted': 'С ограниченным'}	['с ограниченный']
441	{'assets': 'активы'}	Assets or Liabilities	Активы или обязательства	['assets']	{'assets': 'Активы'}	['актив']
442	{'inspection': 'проверка'}	Inspection lot quantity	Количество проверок на партию	['inspection']	{'inspection': 'проверок'}	['проверка']
443	{'use': 'использование'}	Use plan data integration	Использование интеграции планов данных	['use']	{'use': 'Использование'}	['использование']
444	{'reporting': 'отчеты'}	Reporting and analytics	Отчеты и аналитика	['reporting']	{'reporting': 'Отчеты'}	['отчёт']
445	{'classification type': 'вид классификации'}	Expense Classification Type	Вид классификации расходов	['classification type']	{'classification type': 'Вид классификации'}	['вид классификация']
446	{'in review': 'в проверке'}	The account status will change from In review to Active.	Статус выбранного счета изменится с В проверке на Актив.	['in review']	{'in review': 'В проверке'}	['в проверка']
447	{'provider': 'провайдер'}	Find out how to become a data provider and deliver valuable data products to the users of SAP Data Marketplace.	Узнайте, как стать провайдером данных и предоставить пользователям SAP Data Marketplace ценные данные.	['provider']	{'provider': 'провайдером'}	['провайдер']
448	{'type': 'вид'}	Select a compliance requirement type.	Выберите вид требований.	['type']	{'type': 'вид'}	['вид']
449	{'tab': 'вкладка'}	The Maintenance Orders tab opens and shows the material availability status for the relevant orders.	Открывается вкладка Операции заказа ТОРО, показывающая состояние материала для соответствующих заказов.	['tab']	{'tab': 'вкладка'}	['вкладка']
450	{'stop': 'остановить'}	Click Edit in the Monitor eventStop event.	Нажмите кнопку Редактировать в событии остановки события.	['stop']	{'stop': 'остановки'}	['остановка']
451	{'update': 'обновление'}	Update Data Actions	Действия обновления данных	['update']	{'update': 'обновления'}	['обновление']
452	{'order': 'порядок'}	Alternative Logon Order.	Альтернативный вход в заказ.	['order']	{'order': 'заказ'}	['заказ']
453	{'schedule': 'планирование'}	Allows you to restart a schedule.	Позволяет приостановить планирование.	['schedule']	{'schedule': 'планирование'}	['планирование']
454	{'tab': 'вкладка'}	On the tabs, use the following features:	На вкладках, используйте следующие возможности:	['tab']	{'tab': 'вкладках'}	['вкладка']
