	terms	src_raw	mt_raw	src_terms	alg_terms	norm_tgt_terms
142	{'tab': 'вкладка'}	An additional filter is set and the Maintenance Order tab opens, showing the orders for the selected operations.	Задается дополнительный фильтр и открывается вкладка Операции заказа ТОРО, на которой отображается список операций для выбранных заказов.	['tab']	{'tab': 'вкладка'}	['вкладка']
143	{'type': 'вид'}	The following types of conditions are supported:	Доступны следующие виды условий:	['type']	{'type': 'виды'}	['вид']
144	{'schedule': 'планирование'}	How to Schedule Destruction Runs Using Data Destruction Objects	Как планировать уничтожение данных с помощью объектов уничтожения данных	['schedule']	{'schedule': 'планировать'}	['планировать']
145	{'wizard': 'ассистент'}	In the final wizard step, enter name and description for the connection and click Create Connection.	В последнем шаге ассистента по созданию соединения введите имя и описание соединения и нажмите Создать соединение.	['wizard']	{'wizard': 'ассистента'}	['ассистент']
146	{'request': 'заявка'}	Manage Resource Requests	Управление заявками на ресурсы	['request']	{'request': 'заявками'}	['заявка']
147	{'change': 'изменение'}	Change queue assignments.	Изменение очередей печати	['change']	{'change': 'Изменение'}	['изменение']
148	{'tab': 'вкладка'}	Code List tab	"Вкладка ""Кодовая таблица"""	['tab']	{'tab': 'Вкладка'}	['вкладка']
149	{'restart': 'перезапуск', 'pause': 'приостановка'}	Pause and Restart Real-Time Replication	Приостановка и перезапуск тиражирования в реальном времени	['restart', 'pause']	{'restart': 'перезапуск', 'pause': 'Приостановка'}	['перезапуск', 'приостановка']
150	{'relationship': 'связь'}	Once you remove the constraint for the successor operation, the operation is rescheduled automatically and the relationship is repaired.	После удаления ограничения на операцию преемника операция деблокируется автоматически и восстанавливается связь.	['relationship']	{'relationship': 'связь'}	['связь']
151	{'aggregate': 'агрегировать'}	Aggregate Notifications shows whether the notifications to be sent are aggregated (Yes) or separate for each situation instance (No).	Отображает, является ли отправка уведомлений агрегированной (Да) или же уведомления отправляются по отдельности для каждой ситуации (Нет).	['aggregate']	{'aggregate': 'агрегированной'}	['агрегированный']
152	{'contract': 'договор'}	Expiring service contracts	Деблокированные сервисные договоры.	['contract']	{'contract': 'договоры'}	['договор']
153	{'type': 'тип'}	New Order Type	Новый тип заказа	['type']	{'type': 'тип'}	['тип']
154	{'item': 'элемент'}	Select Add Item.	Добавить элемент	['item']	{'item': 'элемент'}	['элемент']
155	{'design time': 'среда дизайна'}	For more information, see Design Time.	Для получения дополнительной информации см. Среда дизайна.	['design time']	{'design time': 'Среда дизайна'}	['среда дизайн']
156	{'type': 'вид'}	Define a description for the type.	Определите описание для типа	['type']	{'type': 'типа'}	['тип']
157	{'schedule': 'расписание'}	Included in Schedule (Filter)	Включено в расписание (фильтр)	['schedule']	{'schedule': 'расписание'}	['расписание']
158	{'type': 'вид'}	Specifies the type of the compliance requirement.	Указывает вид требования соответствия.	['type']	{'type': 'вид'}	['вид']
159	{'get': 'вызвать'}	Get Email Information	Вызвать информацию о электронной почте	['get']	{'get': 'Вызвать'}	['вызвать']
160	{'update': 'обновление'}	Update Purchase Order	Обновить заказ на поставку	['update']	{'update': 'Обновить'}	['обновить']
161	{'download': 'выгружать'}	Download G/L mappings into a .csv file	Выгрузить присвоения в файл в формате CSV.	['download']	{'download': 'Выгрузить'}	['выгрузить']
162	{'check': 'проверить'}	Check Lot-Sizing Procedures	Проверить процедуры сортировки	['check']	{'check': 'Проверить'}	['проверить']
163	{'space': 'пространство'}	Under Spaces select the space you would like to work with.	Выберите пространство, которое вы хотите использовать.	['space']	{'space': 'пространство'}	['пространство']
164	{'type': 'вид'}	Descriptiion of Distinct Type	Описание вида	['type']	{'type': 'вида'}	['вид']
165	{'pause': 'приостановка'}	Pause Real-Time Replication for an Agent	Приостановка тиражирования в реальном времени для агента	['pause']	{'pause': 'Приостановка'}	['приостановка']
166	{'transaction type': 'вид движения'}	Accrual Transaction Type	Вид движения	['transaction type']	{'transaction type': 'Вид движения'}	['вид движение']
167	{'provider': 'поставщик'}	You can edit the predefined email and then send it to the provider.	Вы можете редактировать заданный email и затем отправить его поставщику.	['provider']	{'provider': 'поставщику'}	['поставщик']
168	{'wizard': 'ассистент'}	In the next wizard step, enter connection properties to configure your connection.	В следующем шаге ассистента введите свойства соединения для его настройки.	['wizard']	{'wizard': 'ассистента'}	['ассистент']
169	{'type': 'тип'}	Description of Project Type	Описание типа проекта	['type']	{'type': 'типа'}	['тип']
170	{'type': 'тип'}	For more information, see Creating Action Types	Создание типов операций	['type']	{'type': 'типов'}	['тип']
171	{'provider': 'провайдер'}	Purchase analytical data from data provider.	Покупайте аналитические данные у провайдера данных.	['provider']	{'provider': 'провайдера'}	['провайдер']
172	{'edit': 'редактировать'}	Choose Edit Operations.	Нажмите Редактировать операции.	['edit']	{'edit': 'Редактировать'}	['редактировать']
173	{'input': 'вход'}	Main input parameters	Основные входные параметры	['input']	{'input': 'входные'}	['входной']
174	{'allocation': 'перерасчет'}	Overhead Allocation for CO-PA	Перерасчет косвенных затрат для CO-PA	['allocation']	{'allocation': 'Перерасчет'}	['перерасчёт']
175	{'service confirmation': 'подтверждение сервиса'}	You cannot make changes to a service confirmation that has status Completed.	"Вы не можете изменять подтверждение сервиса, которое имеет статус ""Завершено""."	['service confirmation']	{'service confirmation': 'подтверждение сервиса'}	['подтверждение сервис']
176	{'request': 'заявка'}	The top-level bars show information about the requests to which a resource is assigned in the specified time period.	Верхние строки показывают информацию о запросах, к которым ресурс был или является приписан в указанном периоде времени.	['request']	{'request': 'запросах'}	['запрос']
177	{'use': 'использование'}	Please note that in some cases, certain country-specific functions may not be supported within Manage Global Accounting Hierarchies.This can occur because these two apps consume different data tables.	Пожалуйста, обратите внимание, что в некоторых случаях, некоторые страны-специфические функции могут не поддерживаться в приложении Управление глобальными учетными записями. Это может произойти из-за того, что эти два приложения используют разные таблицы данных.	['use']	{'use': 'используют'}	['использовать']
178	{'provider': 'провайдер'}	Manage Your Data Provider Profiles	Управление профилями поставщиков данных	['provider']	{'provider': 'поставщиков'}	['поставщик']
179	{'edit': 'редактировать'}	In the Edit menu, the following functions are available:	В меню Редактировать доступны следующие функции:	['edit']	{'edit': 'Редактировать'}	['редактировать']
180	{'space': 'пространство'}	On the Choose content page, expand the SPACE folder to show your spaces, select the objects you want to export, and then click Next.	На странице Выбор содержимого выберите папку СРЕДСТВА, чтобы показать ваши пространства, выберите объекты, которые вы хотите экспортировать, и нажмите Далее.	['space']	{'space': 'пространства'}	['пространство']
181	{'type': 'вид'}	Order Confirmation Type	Вид подтверждения заказа	['type']	{'type': 'Вид'}	['вид']
182	{'get': 'получить'}	Get mail information	Получить информацию о почтовом ящике	['get']	{'get': 'Получить'}	['получить']
183	{'purchase order': 'заказ на закупку', 'Purchase Order': 'Заказ на закупку'}	Purchase order inbound	Закупка заказа на поставку	['purchase order', 'Purchase Order']	{'purchase order': 'заказа на поставку', 'Purchase Order': 'заказа на поставку'}	['заказ на поставка', 'заказ на поставка']
184	{'sales order': 'заказ клиента'}	Enable Sales Order	Активировать заказ клиента	['sales order']	{'sales order': 'заказ клиента'}	['заказ клиент']
185	{'type': 'вид'}	Select the relevant source type	Выберите вид источника данных.	['type']	{'type': 'вид'}	['вид']
186	{'exception': 'исключение'}	There's only one exception:	Есть только одно исключение:	['exception']	{'exception': 'исключение'}	['исключение']
187	{'type': 'вид'}	Select one of the following work center group types:	Выберете один из следующих типов групп рабочих мест:	['type']	{'type': 'типов'}	['тип']
188	{'category': 'категория'}	The Name and Type fields are mandatory.Based on the team type, the team category is automatically populated.	Поле Название и Тип являются обязательными. Базируется на типе команды, категория автоматически заполняется.	['category']	{'category': 'категория'}	['категория']
189	{'item': 'позиция'}	You can perform the following actions when working with items:	Вы можете выполнить следующие действия при работе с позициями:	['item']	{'item': 'позициями'}	['позиция']
190	{'update': 'обновить'}	Update user information	Обновить информацию пользователя	['update']	{'update': 'Обновить'}	['обновить']
191	{'type': 'тип'}	For more information on the learner types, see .	Для получения дополнительной информации см. Типы обучающихся.	['type']	{'type': 'Типы'}	['тип']
192	{'regulation': 'предписание'}	If you want to enter a different description of different modes of transport or if you want to enter the description in different languages, select a regulation and navigate to the Classify Dangerous Good - Packaged Product app.	Если вы хотите ввести другую информацию о различных видах транспорта или если вы хотите ввести описание в разных языках, выберите предписание и перейдите к приложению Классификация опасных грузов - Пакетированные продукты.	['regulation']	{'regulation': 'предписание'}	['предписание']
193	{'source assignment': 'присвоение происхождения'}	Source Assignment 2	Присвоение происхождения 2	['source assignment']	{'source assignment': 'Присвоение происхождения'}	['присвоение происхождение']
194	{'term': 'оговорка'}	Organizational Assignment Term	Термин оговорки	['term']	{'term': 'Термин'}	['термин']
195	{'wizard': 'ассистент'}	Changed creation wizard:	Изменен ассистент по созданию соединения:	['wizard']	{'wizard': 'ассистент'}	['ассистент']
196	{'provider': 'провайдер'}	Enter the OData service provider URL.	Введите URL OData провайдера.	['provider']	{'provider': 'провайдера'}	['провайдер']
197	{'tab': 'вкладка'}	You can switch between the following tabs:	Вы можете переключаться между следующими вкладками:	['tab']	{'tab': 'вкладками'}	['вкладка']
198	{'tab': 'вкладка'}	Task Lists Tab	"Вкладка ""Таблица задач"""	['tab']	{'tab': 'Вкладка'}	['вкладка']
199	{'type': 'тип'}	You can delete all the monitored data for this situation type.	Вы можете удалить все данные мониторинга для указанного типа ситуаций, выбрав одну из следующих опций:	['type']	{'type': 'типа'}	['тип']
200	{'type': 'тип'}	This option is available for the following order types:	Эта опция доступна для следующих типов ордеров:	['type']	{'type': 'типов'}	['тип']
201	{'retention period': 'срок хранения'}	Retention Period for Users	Срок хранения пользователей	['retention period']	{'retention period': 'Срок хранения'}	['срок хранение']
202	{'transaction type': 'вид сделки'}	Transaction Type (SFHAART)	Тип операции (SFHAART)	['transaction type']	{'transaction type': 'Тип операции'}	['тип операция']
203	{'type': 'вид'}	You can change this to one of the following types:	Вы можете изменить это на один из следующих типов:	['type']	{'type': 'типов'}	['тип']
204	{'service confirmation': 'подтверждение выполнения сервиса'}	You can cancel service confirmations with status completed.	"Вы можете деблокировать подтверждения выполнения сервиса со статусом ""Завершено для расчета""."	['service confirmation']	{'service confirmation': 'подтверждения выполнения сервиса'}	['подтверждение выполнение сервис']
205	{'interest calculation': 'начисление процентов'}	The following types on interest calculation are available:	Доступны следующие виды начисления процентов:	['interest calculation']	{'interest calculation': 'начисления процентов'}	['начисление процент']
206	{'clearing item': 'перерасчетная позиция'}	Clearing Item Completed	Перерасчетная позиция	['clearing item']	{'clearing item': 'Перерасчетная позиция'}	['перерасчётный позиция']
207	{'edit': 'редактировать'}	Select Create and Edit.	Нажмите Создать и отредактировать.	['edit']	{'edit': 'отредактировать'}	['отредактировать']
208	{'edit': 'редактировать'}	In the Edit Variant pane that appears, do the following:	В окне Редактировать вариант, которое появляется, выполняйте следующие действия:	['edit']	{'edit': 'Редактировать'}	['редактировать']
209	{'purchase order': 'заказ на закупку', 'Purchase Order': 'Заказ на закупку'}	Purchase order outbound	Заказ на закупку	['purchase order', 'Purchase Order']	{'purchase order': 'Заказ на закупку', 'Purchase Order': 'Заказ на закупку'}	['заказ на закупка', 'заказ на закупка']
210	{'merge': 'объединить'}	Merge Tax Items	Объединить налоговые позиции	['merge']	{'merge': 'Объединить'}	['объединить']
211	{'work package': 'рабочий пакет'}	You can click on the work package to see its details.	Вы можете щелкнуть на рабочем пакете, чтобы просмотреть его детали.	['work package']	{'work package': 'рабочем пакете'}	['рабочий пакет']
212	{'type': 'вид'}	There are two types of service quotations:	Существует два вида ценовых предложений:	['type']	{'type': '▔'}	['▔']
213	{'schedule': 'планирование'}	Schedule is created for the data flow.	Планирование создано для данных потока.	['schedule']	{'schedule': 'Планирование'}	['планирование']
214	{'pause': 'приостановка'}	Pause Real-Time Replication for a Connection	Приостановить тиражирование в реальном времени для соединения	['pause']	{'pause': 'Приостановить'}	['приостановить']
215	{'association': 'связь'}	An association represents a relationship between two entities.	Связь представляет собой отношения между двумя объектами.	['association']	{'association': 'Связь'}	['связь']
216	{'type': 'вид'}	Document Type ID	Ид. вида документа	['type']	{'type': 'вида'}	['вид']
217	{'update': 'обновление'}	Update Existing PowerPoint	Обновить существующие презентации PowerPoint	['update']	{'update': 'Обновить'}	['обновить']
218	{'action': 'операция'}	It allows you to create an assignment exactly as requested by the project manager.This action is available if the project manager requested a specific resource and no resource has been assigned to the request yet.	Эта операция позволяет создать задание точно так, как было запрошено руководителем проекта. Эта операция доступна, если руководитель проекта затребовал определенного сотрудника и ни один сотрудник еще не был назначен на задание.	['action']	{'action': 'операция'}	['операция']
219	{'type': 'вид'}	For more information about restriction types, see .	Дополнительную информацию о видах ограничений см. ниже.	['type']	{'type': 'видах'}	['вид']
220	{'where-used list': 'журнал использования'}	WIP Batch Where-Used List	Журнал использования	['where-used list']	{'where-used list': 'Журнал использования'}	['журнал использование']
221	{'record': 'запись'}	Record SAPUI5 Application	Запись приложения SAPUI5	['record']	{'record': 'Запись'}	['запись']
222	{'repair': 'ремонт'}	Set the repair object to the status Completed.	Установите статус ремонта на завершенный.	['repair']	{'repair': 'ремонта'}	['ремонт']
223	{'contract': 'контракт'}	To create a new contract:	Для создания нового контракта:	['contract']	{'contract': 'контракта'}	['контракт']
224	{'Environment, Health and Safety': 'управление данными по охране здоровья и защите окружающей среды'}	A hyperlink name to the incident record in the Environment, Health, and Safety system.	Имя гиперссылок на инцидент в системе Управление данными по охране здоровья и защите окружающей среды.	['Environment, Health and Safety']	{'Environment, Health and Safety': 'Управление данными по охране здоровья и защите окружающей среды'}	['управление данные по охрана здоровье и защита окружающий среда']
225	{'type': 'вид'}	Start Date Type	Вид даты начала	['type']	{'type': 'Вид'}	['вид']
226	{'request': 'заявка'}	If a resource has been requested and the request has not yet been staffed, you'll see a Quick Assignment link in the Actions column.This allows you to create the assignment exactly as requested by the project manager.	Если ресурс был запрошен и не был еще заполнен, вы увидите ссылку в Действия в столбце. Эта позволяет создать задание точно так, как это было запрошено проектным менеджером.	['request']	{'request': 'запрошен'}	['запросить']
227	{'agent': 'агент'}	Register New Agent	Зарегистрировать новый агент	['agent']	{'agent': 'агент'}	['агент']
228	{'request': 'заявка'}	Resource Request Skill Tag	Запрос на ресурс	['request']	{'request': 'Запрос'}	['запрос']
229	{'run': 'выполнить'}	Run Overhead Calculation	Выполнить перерасчеты косвенных затрат	['run']	{'run': 'Выполнить'}	['выполнить']
230	{'service confirmation': 'подтверждение сервиса'}	Service Confirmation Item	Подтверждение сервиса	['service confirmation']	{'service confirmation': 'Подтверждение сервиса'}	['подтверждение сервис']
231	{'provider': 'поставщик'}	Deleting a Service Provider	Удаление поставщика услуг	['provider']	{'provider': 'поставщика'}	['поставщик']
232	{'characteristic': 'характеристика'}	Characteristic 1 Value	Характеристика 1 - Значение	['characteristic']	{'characteristic': 'Характеристика'}	['характеристика']
233	{'retention period': 'период хранения'}	Retention period is expired	Период хранения истек.	['retention period']	{'retention period': 'Период хранения'}	['период хранение']
234	{'carrier': 'перевозчик'}	Related Information for Carriers	Связанная информация для перевозчиков	['carrier']	{'carrier': 'перевозчиков'}	['перевозчик']
235	{'service confirmation': 'подтверждение сервиса'}	Service Confirmation (SVC1)	Подтверждение сервиса (SVC1)	['service confirmation']	{'service confirmation': 'Подтверждение сервиса'}	['подтверждение сервис']
236	{'use': 'использование'}	Use the planning panel	Использование панели планирования	['use']	{'use': 'Использование'}	['использование']
237	{'transport type': 'вид транспортировки'}	Select the transport type you would like to modify.	Выберите вид транспортировки, который необходимо изменить.	['transport type']	{'transport type': 'вид транспортировки'}	['вид транспортировка']
