	terms	src_raw	mt_raw	src_terms	alg_terms	norm_tgt_terms
65	{'provider': 'поставщик'}	In the Manage Cash Pools app, the following service providers are supported:	В приложении Управление пулами наличности (версия 2) поддерживается следующий поставщик услуг:	['provider']	{'provider': 'поставщик'}	['поставщик']
66	{'balance': 'баланс'}	Balance Transaction Currency – The currency of the G/L account where the journal entry was posted.	Валюта счета, в которой была сделана запись в журнале операций.	['balance']	{'balance': 'валюта'}	['валюта']
67	{'copy': 'скопировать'}	The Copy and Remove buttons are active only when at least one alternative control is selected.	Кнопки Копировать и Удалить активны только в том случае, если хотя бы один альтернативный контроль выбран.	['copy']	{'copy': 'Копировать'}	['копировать']
68	{'accrual': 'разграничение'}	Accruals that have been manually reviewed in the Review Purchase Order Accruals - My Inbox app	Разграничения, которые были автоматически проверены в приложении Разграничение покупок - Мой ящичек	['accrual']	{'accrual': 'Разграничения'}	['разграничение']
69	{'type': 'вид'}	Select Work Pack Type from the drop-down list.	Выберите вид пакета.	['type']	{'type': 'вид'}	['вид']
70	{'use': 'использование'}	Use the File Repository	Использование хранилища файлов	['use']	{'use': 'Использование'}	['использование']
71	{'type': 'тип'}	Substitution Item Type	Замена через позицию	['type']	{'type': 'позицию'}	['позиция']
72	{'schedule': 'планирование'}	You can also modify the existing schedule of a data flow or delete it.	Также можно изменить существующий график данных потока или удалить его.	['schedule']	{'schedule': 'график'}	['график']
73	{'type': 'тип'}	Displays the available run types.	Отображает типы прогонов.	['type']	{'type': 'типы'}	['тип']
74	{'output': 'вывод', 'input': 'ввод'}	To manually map an input column to an output column, drag it from the left list and drop it onto the column in the right list.	Чтобы вручную сопоставить столбцы ввода с со столбцами вывода объединения, перетащите столбец из списка слева на столбец в списке справа.	['output', 'input']	{'output': '▔', 'input': 'ввода'}	['▔', 'ввод']
75	{'type': 'вид'}	The RECORD COUNT type is a table-wide statistic.	Вид статистики — это таблица-вспомогательная.	['type']	{'type': 'Вид'}	['вид']
76	{'allocation': 'перерасчет'}	This means that essential features are missing, such as the allocation to a business area.	Это означает, что важные функции отсутствуют, такие как распределение контингента на бизнес-подразделение.	['allocation']	{'allocation': 'распределение'}	['распределение']
77	{'contract': 'договор'}	The point in time when the primary processing purpose ends, for example, a contract is fulfilled.	Период времени, когда основное назначение завершается, например, контракт выполнен.	['contract']	{'contract': 'контракт'}	['контракт']
78	{'edit': 'редактировать'}	Click the Edit Details link, to edit the technical details.	Нажмите Редактировать детали, чтобы редактировать технические детали.	['edit']	{'edit': 'Редактировать'}	['редактировать']
79	{'demand-driven': 'на основе потребности'}	Select the corresponding checkbox for demand-driven MRP components and/or top-level materials.	Выберите соответствующий переключатель для компонентов MRP на основе спроса и/или верхнего уровня материалов.	['demand-driven']	{'demand-driven': 'на основе спроса'}	['на основа спрос']
80	{'input': 'ввод', 'join': 'соединение'}	Select the Join operator from the toolbar and drop it in the canvas and then connect two sources or other nodes to it as inputs.	Выберите оператор Соединение на панели инструментов и перетащите его в рабочую область, а затем соедините с ним два источника или других узла в качестве ввода.	['input', 'join']	{'input': 'ввода', 'join': 'Соединение'}	['ввод', 'соединение']
81	{'space': 'пространство'}	Spaces are environments that bring data models, connections, compute and storage resources together for a specific line of business or use-case.	пространства являются средами, которые объединяют модели данных, связи, вычислительные и хранение ресурсов для конкретной бизнес-направления или использования-case.	['space']	{'space': 'пространства'}	['пространство']
82	{'accrual': 'разграничение'}	Accruals that have been manually reviewed in this app	Разграничения, которые были вручную проверены в этом приложении.	['accrual']	{'accrual': 'Разграничения'}	['разграничение']
83	{'residence period': 'период активного хранения'}	The retention period is a combination of the residence period and the blocking period.	Период активного хранения — это комбинация периода проживания и периода блокировки.	['residence period']	{'residence period': 'периода проживания'}	['период проживание']
84	{'contract': 'контракт', 'assembly': 'сборка'}	Enterprise Contract Assembly integrates with SAP S/4HANA for enterprise contract management, in order to generate virtual documents based on the templates and text blocks available in Enterprise Contract Assembly.	Enterprise Contract Assembly интегрируется с SAP S/4HANA для управления корпоративными контрактами, чтобы генерировать виртуальные документы на основе шаблонов и текстовых блоков, доступных в Сборке корпоративных контрактов.	['contract', 'assembly']	{'contract': 'контрактами', 'assembly': 'Сборке'}	['контракт', 'сборка']
85	{'copy': 'копирование'}	Copy existing item to add new one	Скопировать существующий элемент, чтобы добавить новый	['copy']	{'copy': 'Скопировать'}	['скопировать']
86	{'schedule': 'планирование'}	Delete the schedule if required.	Удалите расписание, если необходимо.	['schedule']	{'schedule': 'расписание'}	['расписание']
87	{'accrual': 'разграничение'}	Accruals that have been automatically reviewed because the amounts are between the threshold range.	Разграничения, автоматически проверенные из-за наличия сумм между пределами диапазона.	['accrual']	{'accrual': 'Разграничения'}	['разграничение']
88	{'provider': 'провайдер'}	Get information on the data provider and the products they sell	Получить информацию о провайдере данных и продуктах, которые они продают.	['provider']	{'provider': 'провайдере'}	['провайдер']
89	{'service entry sheet': 'ведомость учета услуг'}	A service entry sheet can be created in one of the following ways:	Ведомость учета услуг может быть создана одним из следующих способов:	['service entry sheet']	{'service entry sheet': 'ведомость учета услуг'}	['ведомость учёт услуга']
90	{'type': 'тип'}	If you like to see only free data products, select the option Free from the filter Contract Type.	Если вы хотите увидеть только бесплатные продукты данных, установите флажок Free в поле Тип контракта.	['type']	{'type': 'Тип'}	['тип']
91	{'change': 'изменение'}	Change Connection Properties	Изменение параметров подключения	['change']	{'change': 'Изменение'}	['изменение']
92	{'schedule': 'планирование'}	Create a simple or recurring schedule for your data flow.	Создайте простой или периодический план для вашего потока данных.	['schedule']	{'schedule': 'план'}	['план']
93	{'undo': 'отмена'}	Undo and Redo Transformations	Отменить и отменить трансформации	['undo']	{'undo': 'Отменить'}	['отменить']
94	{'pause': 'приостановка'}	Pause Real-Time Replication	Приостановите тиражирование в реальном времени	['pause']	{'pause': 'Приостановите'}	['приостановить']
95	{'content': 'контент'}	If objects or data on your system will be overwritten by the import, a warning appears in the import window, and next to the relevant objects in the Content list.	Если объекты или данные на вашей системе будут перезаписаны импортом, появляется предупреждение в окне импорта, и рядом с соответствующими объектами в списке Контент.	['content']	{'content': 'Контент'}	['контент']
96	{'set': 'определить'}	In the Manage Your Solution app under Configure Your Solution make system settings under FinanceContract AccountingPosting and DocumentsDefine Account Assignment Data Relevant to Transactions.	В приложении Управление вашей системой в меню Конфигурация вашей системы выберите Финансовые контракты, учет, отражение и документы, определите параметры отражения данных, связанных с операциями.	['set']	{'set': 'параметры'}	['параметр']
97	{'thread': 'тред'}	You can enter a number of threads or a percentage.	Вы можете ввести число нитей или процент.	['thread']	{'thread': 'нитей'}	['нить']
98	{'Personal Data': 'Личные данные', 'personal data': 'личные данные'}	The information retrieval feature supports you to comply with the relevant legal requirements for data protection by allowing you to search for and retrieve all personal data of a specified data subject.	Функция поиска информации позволяет вам соответствовать требованиям законодательства в области защиты персональных данных, позволяя вам искать и извлекать все персональные данные определенного субъекта.	['Personal Data', 'personal data']	{'Personal Data': 'персональные данные', 'personal data': 'персональные данные'}	['персональный дать', 'персональный дать']
99	{'provider': 'поставщик'}	Data Provider Page	Страница поставщика данных	['provider']	{'provider': 'поставщика'}	['поставщик']
100	{'type': 'тип'}	This option deletes all of the monitored data belonging to this situation type.	Эта опция удаляет все данные мониторинга для указанного типа ситуаций.	['type']	{'type': 'типа'}	['тип']
101	{'attachment': 'вложение'}	If a payment advice was not entered into the system in advance, but was instead used for clearing the current bank statement item or lockbox item, it can be uploaded as an attachment for more complete record keeping.	Если в системе не было введено предварительное платежное поручение, но вместо этого оно использовалось для перерасчета текущей позиции или позиции наличными, оно может быть загружено в качестве вложения для более полного ведения учета.	['attachment']	{'attachment': 'вложения'}	['вложение']
102	{'activate': 'активация'}	Activate a supplier list or supplier list version	Активация списка поставщиков или списка версий поставщика	['activate']	{'activate': 'Активация'}	['активация']
103	{'data provider': 'провайдер данных'}	It varies depending on how the data provider offers their products.	Она изменяется в зависимости от того, как провайдер данных предлагает продукты.	['data provider']	{'data provider': 'провайдер данных'}	['провайдер данные']
104	{'reporting': 'отчеты'}	Registration for Indirect Taxation Abroad (RITA) enables indirect tax calculation and reporting for multiple countries within a single legal entity.	Регистрация для начисления и отражения косвенных налогов за пределами страны (RITA) позволяет начислять и отчитываться за косвенные налоги для нескольких стран в одной юридической entity.	['reporting']	{'reporting': 'отчитываться'}	['отчитываться']
105	{'category': 'категория'}	For example, if a service technician works on a Public Holiday whereas the Overtime Category planned was Weekend, they can change the Overtime Category.	Например, если технический специалист работает в выходной день, а категория запланирована на выходной, он может изменить категорию.	['category']	{'category': 'категорию'}	['категория']
106	{'type': 'тип'}	Deletes the entire monitored data belonging to this situation type.	Удаляет все данные мониторинга для этого типа ситуации.	['type']	{'type': 'типа'}	['тип']
107	{'client': 'клиент'}	Add Client to Allowlist	Добавить клиента в список разрешений	['client']	{'client': 'клиента'}	['клиент']
108	{'type': 'тип'}	Licenses control access to your data products with contract type License Key (see ).	Контролирует доступ к данным с типом лицензионного ключа (см. ).	['type']	{'type': 'типом'}	['тип']
109	{'change': 'изменить'}	Change or Delete Assignments	Изменить или удалить присвоения	['change']	{'change': 'Изменить'}	['изменить']
110	{'provider': 'поставщик'}	You as a user can search and purchase analytical data from data providers.	Вы, как пользователь, можете искать и приобретать аналитические данные у поставщиков данных.	['provider']	{'provider': 'поставщиков'}	['поставщик']
111	{'schedule': 'планирование'}	If a schedule is set for the data flow, see by when the next run is scheduled.	Если для потока данных настроено расписание, см. когда следующее планирование будет выполнено.	['schedule']	{'schedule': 'расписание'}	['расписание']
112	{'provider': 'провайдер'}	The OData service provider URL needs to be publicly available.	URL OData сервиса должен быть доступен для публичного просмотра.	['provider']	{'provider': 'сервиса'}	['сервис']
113	{'rate': 'курс'}	Consolidation Monthly Average Rate	Курс консолидации ежемесячного среднего значения	['rate']	{'rate': '▔'}	['▔']
114	{'wizard': 'ассистент'}	For several connection types that use a Data Provisioning agent to connect to the source, you can define advanced properties in another wizard step.	Для некоторых типов соединений, использующих агент Data Provisioning для соединения с источником, например SAP ABAP, SAP HANA, или Microsoft SQL Server, в дополнительном шаге ассистента можно определить расширенные свойства, чтобы лучше контролировать установку соединения.	['wizard']	{'wizard': 'ассистента'}	['ассистент']
115	{'pattern': 'шаблон'}	Define a recurrence pattern for the job.	Определите шаблон повторения задания.	['pattern']	{'pattern': 'шаблон'}	['шаблон']
116	{'type': 'тип'}	The following product types are currently supported:	Доступны следующие типы продуктов:	['type']	{'type': '▔'}	['▔']
117	{'provider': 'провайдер'}	OData service provider URL of SAP SuccessFactors.	URL OData провайдера SAP SuccessFactors.	['provider']	{'provider': 'провайдера'}	['провайдер']
118	{'inactive': 'неактивно', 'edit': 'редактировать'}	Click Edit and use the Yes/ No switch to change the version to active or inactive respectively.	Нажмите кнопку Создать и отредактировать.	['inactive', 'edit']	{'inactive': '▔', 'edit': 'отредактировать'}	['▔', 'отредактировать']
119	{'provider': 'провайдер'}	Data Provider ID	Ид. поставщика данных	['provider']	{'provider': 'поставщика'}	['поставщик']
120	{'schedule': 'планирование'}	Define, edit or delete scheduling options for your persisted views under Schedule.	Определите, редактируйте или удалите параметры планирования для устойчивых ракурсов в разделе Планирование.	['schedule']	{'schedule': 'Планирование'}	['планирование']
121	{'copy': 'скопировать'}	Copy time entries	Скопировать время	['copy']	{'copy': 'Скопировать'}	['скопировать']
122	{'edit': 'редактировать'}	You could also chooseEdit Chart PromptsC_FINANCIALPOSITIONQUERY1, if you only want to change the variables for a specific chart.	Вы также можете выбрать Редактировать подсказки для графика Финансовые позиции, если вы только хотите изменить значения для конкретного графика.	['edit']	{'edit': 'Редактировать'}	['редактировать']
123	{'tab': 'вкладка'}	Process History tab	"Вкладка ""История версий"""	['tab']	{'tab': 'Вкладка'}	['вкладка']
124	{'provider': 'провайдер'}	As a data provider, your main objective is to offer valuable data products to the users of the Data Marketplace in SAP Data Warehouse Cloud.	Главная цель провайдера данных — предоставить пользователям Data Marketplace в SAP HANA Cloud ценные данные.	['provider']	{'provider': 'провайдера'}	['провайдер']
125	{'type': 'тип'}	Choose one of the following action types:	Выбери один из следующих типов действий:	['type']	{'type': 'типов'}	['тип']
126	{'schedule': 'планирование'}	How to Schedule Destruction Runs for Archiving Files	Как запланировать уничтожение тиражей для архивирования файлов	['schedule']	{'schedule': 'запланировать'}	['запланировать']
127	{'scope': 'объем'}	The Custom Code Migration app allows you to add or remove packages to/from the scope manually.	Приложение Миграция пользовательского кода позволяет вам добавить или удалить пакеты в/из объема вручную.	['scope']	{'scope': 'объема'}	['объём']
128	{'contract': 'договор'}	View and analyze expired or expiring service contracts	Просмотреть и анализировать деблокированные или деблокирующиеся сервисные договоры.	['contract']	{'contract': 'договоры'}	['договор']
129	{'retention period': 'срок хранения'}	The retention period consists of the residence period and blocking period.	Срок хранения состоит из периода проживания и периода блокировки.	['retention period']	{'retention period': 'Срок хранения'}	['срок хранение']
130	{'story': 'журнал'}	SAP Analytics Cloud Story	Журнал SAP Analytics Cloud	['story']	{'story': 'Журнал'}	['журнал']
131	{'space': 'пространство'}	To solve this problem, queries from certain spaces can be favored, meaning they will be processed faster than queries from other spaces.	Для решения этой проблемы запросы из некоторых пространств будут обрабатываться быстрее, чем запросы из других пространств.	['space']	{'space': 'пространств'}	['пространство']
132	{'rate': 'курс'}	Budget Consolidation Monthly Average Rate	Курс консолидации бюджета ежемесячно	['rate']	{'rate': 'Курс'}	['курс']
133	{'tab': 'вкладка'}	Process Flow tab	"Вкладка ""Финансовый поток"""	['tab']	{'tab': 'Вкладка'}	['вкладка']
134	{'type': 'вид'}	The following calculation types are supported:	Доступны следующие виды вычислений:	['type']	{'type': 'виды'}	['вид']
135	{'space': 'пространство'}	You can delete audit logs when needed in ConfigurationAudit, which will free up disk space.	Вы можете удалить журналы аудита, когда это необходимо в конфигурационном аудите, которое освободит место на диске.	['space']	{'space': 'место'}	['место']
136	{'transfer': 'перевести'}	If you have selected an item type by mistake, you can either delete the item and add a new one or use the Change Item Type button to transfer the data of the selected item to a different item type.	Если вы случайно выбрали вид позиции, вы можете либо удалить позицию и добавить новую, либо использовать кнопку Изменить вид позиции для перевести данные выбранной позиции в другой вид позиции.	['transfer']	{'transfer': 'перевести'}	['перевести']
137	{'type': 'тип'}	Purchase order type	Тип заказа на закупку	['type']	{'type': 'Тип'}	['тип']
138	{'instance': 'инстанция', 'open': 'открыто'}	Instance Set to Open	Инстанция, открытая	['instance', 'open']	{'instance': 'Инстанция', 'open': 'открытая'}	['инстанция', 'открытый']
139	{'type': 'тип'}	Business Partner Type	Тип партнера	['type']	{'type': 'Тип'}	['тип']
140	{'wizard': 'ассистент'}	Click New Export to open the wizard.	Нажмите кнопку Новая экспортная форма, чтобы открыть ассистент.	['wizard']	{'wizard': 'ассистент'}	['ассистент']
141	{'type': 'вид'}	You can choose one of the following processing types:	Вы можете выбрать один из следующих типов обработки:	['type']	{'type': 'типов'}	['тип']
