	terms	src_raw	mt_raw	src_terms	alg_terms	norm_tgt_terms
0	{'space': 'Space'}	The status of each individual space can be seen from the color code on the upper left corner.	Статус каждого отдельного пространства можно увидеть из цветового кода на верхнем левом углу.	['space']	{'space': '▔'}	['▔ertrat<sos>']
1	{'storage': 'Speicher'}	Your contract includes a total number of available capacity units per month which you can allocate as you wish to the compute and storage resources.	Ваш контракт включает в себя общее количество доступных единиц мощности в месяц, которые вы можете выделить по желанию вычислительных и запасных ресурсов.	['storage']	{'storage': '▔'}	['▔ertrat<sos>']
2	{'share': 'teilen'}	share the URL link to other users with the proper editing rights	поделиться ссылкой на СВР с другими пользователями с надлежащими правами редактирования	['share']	{'share': 'поделиться'}	['подеитьсen']
3	{'constraint': 'Einschränkung'}	Once you remove the constraint for the successor operation, the operation can be rescheduled automatically.	После того, как вы удалите ограничение для операции преемника, операция может быть перенаправлена автоматически.	['constraint']	{'constraint': '▔'}	['▔ertrat<sos>']
4	{'create': 'erstellen'}	As long as you have not configured the tenant, you can use only administration features of SAP Data Warehouse Cloud (but you cannot create spaces in the Space Management page).	До тех пор, пока вы не настроили арендатора, вы можете использовать только административные функции облака хранилища данных САП (но вы не можете создавать пространства на странице управления пространством).	['create']	{'create': '▔'}	['▔ertrat<sos>']
5	{'area of responsibility': 'Zuständigkeitsbereich'}	All resources in your area of responsibility will be displayed.	Все ресурсы в вашей области ответственности будут отображаться.	['area of responsibility']	{'area of responsibility': '▔'}	['▔ertrat<sos>']
6	{'trigger': 'Auslöser'}	Required Permissions for Oracle Trigger-Based Replication in the SAP HANA Smart Data Integration and SAP HANA Smart Data Quality Installation and Configuration Guide	Необходимые разрешения для репликации, основанной на триггере Оракула в Интеграции умных данных САП ХАНА и Руководство по установке и конфигурации качества смартфонов САП ГАНА	['trigger']	{'trigger': 'Триггере'}	['тригерen']
7	{'connector': 'Konnektor'}	Integrate an account with your space to be able to create connections for connector instances and use the connections for data flows.	Интегрируйте учетную запись с вашим пространством, чтобы иметь возможность создавать связи для случаев подключения и использовать соединения для потоков данных.	['connector']	{'connector': '▔'}	['▔ertrat<sos>']
8	{'customer': 'Debitor', 'supplier': 'Kreditor'}	A payment clearing group is an attribute with which you can categorize your suppliers and customers into groups.	Группа по очистке платежей - это атрибут, с помощью которого вы можете классифицировать своих поставщиков и клиентов в группы.	['customer', 'supplier']	{'customer': '▔', 'supplier': '▔'}	['▔ertrat<sos>', '▔ertrat<sos>']
9	{'demand-driven': 'bedarfsorientiert'}	Select the corresponding checkbox for demand-driven MRP components and/or top-level materials.	Выберите соответствующую контрольную коробку для компонентов МРП, ориентированных на спрос и / или материалов верхнего уровня.	['demand-driven']	{'demand-driven': '▔'}	['▔ertrat<sos>']
10	{'create': 'erstellen'}	Click Create License to create a license for one or multiple of your data products and generate activation keys that you can share with consumers to allow them to use the licensed scope of data products.	Нажмите Создать Лицензию, чтобы создать лицензию для одного или нескольких ваших продуктов данных и генерировать ключи активации, которые вы можете поделиться с потребителями, чтобы позволить им использовать лицензированный охват данных продуктов.	['create']	{'create': 'Создать'}	['соатьen']
11	{'side panel': 'Seitenbereich'}	Control your union in the Mappings section of its side panel:	Контролируйте свой союз в разделе Мапингс его панели:	['side panel']	{'side panel': '▔'}	['▔ertrat<sos>']
12	{'indicator': 'Indikator'}	The performance of the model version is evaluated using two main indicators.	Оценивается производительность модели версии с использованием двух основных показателей.	['indicator']	{'indicator': '▔'}	['▔ertrat<sos>']
13	{'query': 'Abfrage'}	The database then has to decide which job or query has to be dealt with first.	Затем база данных должна решить, с какой работой или запросом следует сначала заниматься.	['query']	{'query': '▔'}	['▔ertrat<sos>']
14	{'provider': 'Provider'}	Address, e-mail, phone number, etc of the provider	Адрес, электронная почта, номер телефона и т.д. поставщика	['provider']	{'provider': '▔'}	['▔ertrat<sos>']
15	{'space': 'Space'}	The name should be unique within a space.	Название должно быть уникальным в пространстве.	['space']	{'space': '▔'}	['▔ertrat<sos>']
16	{'intercompany': 'buchungskreisübergreifend'}	Display the IDs of intercompany customer invoices, customer invoices, and intercompany supplier invoices	Показать идентификаторы счета клиентов между компаниями, счета клиентов и счета поставщиков между компаниями	['intercompany']	{'intercompany': '▔'}	['▔ertrat<sos>']
17	{'history': 'Verlauf', 'release': 'Release'}	To lock a specific release of a data product, open the release history of the selected product, select the release you want to lock and select the checkbox Locked.	Чтобы заблокировать конкретное выпуск продукта данных, откройте историю выпуска выбранного продукта, выберите освобождение, которое вы хотите закрыть и выбрать чековый ящик.	['history', 'release']	{'history': '▔', 'release': '▔'}	['▔ertrat<sos>', '▔ertrat<sos>']
18	{'data provider': 'Datenprovider'}	This varies depending on how the data provider offers their products.	Это варьируется в зависимости от того, как поставщик данных предлагает свои продукты.	['data provider']	{'data provider': 'поставщик данных'}	['пооen данныen']
19	{'access control': 'Zugriffskontrolle'}	Create a data access control to filter data in views and business layer objects by one or more criteria.	Создайте контроль доступа к данным для фильтрации данных в взглядах и объектах делового слоя по одному или нескольким критериям.	['access control']	{'access control': '▔'}	['▔ertrat<sos>']
20	{'data provider': 'Datenprovider'}	Retrieve your favorite data providers and data products.	Воспользуйтесь вашими любимыми поставщиками данных и продуктами данных.	['data provider']	{'data provider': '▔'}	['▔ertrat<sos>']
21	{'section': 'Bereich'}	Choose Fuzzy Match to display the Match Thresholds section.	Выберите Фузи Матч, чтобы продемонстрировать раздел «Темпочки матча».	['section']	{'section': '▔'}	['▔ertrat<sos>']
22	{'provider': 'Provider'}	You can see which products were last released by the provider.	Вы можете увидеть, какие продукты были выпущены в последний раз провайдером.	['provider']	{'provider': 'провайдером'}	['проenden']
23	{'provider': 'Provider'}	It’s maintained by the provider and the information might differs from one provider to another.	Он поддерживается провайдером, и информация может отличаться от одного провайдера к другому.	['provider']	{'provider': '▔'}	['▔ertrat<sos>']
24	{'release': 'Release'}	To lock all the releases of a data product, select the product and select the checkbox Locked.	Чтобы заблокировать все выпуски продукта данных, выберите продукт и выбрать чековую коробку, запертую.	['release']	{'release': '▔'}	['▔ertrat<sos>']
25	{'assigned': 'zugewiesen'}	The Product Allocation Order Items card displays only those order items with confirmation quantity assigned to a characteristic value combination containing the specified characteristic or values.	Карта товаров заказа распределения продукта отображает только те пункты заказа с количеством подтверждения, выделенным на характерное сочетание стоимости, содержащее указанную характеристику или ценности.	['assigned']	{'assigned': '▔'}	['▔ertrat<sos>']
26	{'storage': 'Speicher', 'space': 'Platz'}	This space is close to exceeding it's storage quota.	Это пространство близко к превышению его квоты на хранение.	['storage', 'space']	{'storage': '▔', 'space': '▔'}	['▔ertrat<sos>', '▔ertrat<sos>']
27	{'period': 'Zeitraum'}	Older period includes data older than the last year.	Более старый период включает в себя данные старше прошлого года.	['period']	{'period': '▔'}	['▔ertrat<sos>']
28	{'data provider': 'Datenprovider', 'create': 'erstellen'}	Create or Edit a Data Provider Profile	Создание или редактирование профиля поставщика данных	['data provider', 'create']	{'data provider': '▔', 'create': '▔'}	['▔ertrat<sos>', '▔ertrat<sos>']
29	{'data provider': 'Datenprovider'}	In the Switch Data Provider dialog:	В диалоге Провайдера передачи данных:	['data provider']	{'data provider': '▔'}	['▔ertrat<sos>']
30	{'space': 'Space'}	Select your Space	Выберите свое пространство	['space']	{'space': '▔'}	['▔ertrat<sos>']
31	{'data provider': 'Datenprovider'}	Thanks to the product page created by the data provider you get detailed information on the data product and eventually access to sample data, if available.	Благодаря странице продукта, созданной поставщиком данных, вы получаете подробную информацию о продукте данных и в конечном итоге получите доступ к образцам данных, если они доступны.	['data provider']	{'data provider': 'данных'}	['данныen']
32	{'consumption model': 'Verbrauchsmodell'}	To guarantee a smooth roll-out of updates to any object without immediately affecting or even breaking fact models, consumption models, or perspectives, you can derive versions of objects.	Чтобы гарантировать гладкую выгрузку обновлений на любой объект без немедленного воздействия или даже нарушения фактических моделей, моделей потребления или перспектив, вы можете получить версии объектов.	['consumption model']	{'consumption model': '▔'}	['▔ertrat<sos>']
33	{'reference quantity': 'Referenzmenge'}	You can display the reference quantity and the simulation quantity side by side.	Вы можете отображать референтное количество и количество симуляции бок о бок.	['reference quantity']	{'reference quantity': 'количество'}	['количесen']
34	{'period': 'Periode'}	The inspector detects issues for each top-level material per time period.	Инспектор обнаруживает проблемы для каждого верхнего уровня материала в течение периода времени.	['period']	{'period': '▔'}	['▔ertrat<sos>']
35	{'root': 'Stamm'}	Any path used with this connection will be prefixed with this root path.	Любой путь, используемый с этой связью, будет префиксирован этим корневым путём.	['root']	{'root': '▔'}	['▔ertrat<sos>']
36	{'type': 'Art'}	It must be unique for the clause type in each language.	Он должен быть уникальным для типа клаузлы в каждом языке.	['type']	{'type': '▔'}	['▔ertrat<sos>']
37	{'acceptance': 'Abnahme'}	Enables you to indicate if the acceptance of an ordered item is to take place at the point of origin.	Позволяет указать, будет ли принятие заказанного пункта происходить в точке происхождения.	['acceptance']	{'acceptance': '▔'}	['▔ertrat<sos>']
38	{'space': 'Space'}	Enter a name for your space.	Введите имя для вашего пространства.	['space']	{'space': '▔'}	['▔ertrat<sos>']
39	{'revision': 'überarbeitete Version'}	Changes within the same version are saved as new revisions.	Изменения в пределах той же версии сохраняются как новые пересмотры.	['revision']	{'revision': ' пересмотры'}	['fересмотры']
40	{'data provider': 'Datenprovider'}	You can search and purchase analytical data from data providers.	Вы можете искать и покупать аналитические данные от поставщиков данных.	['data provider']	{'data provider': 'данных'}	['данныen']
41	{'start': 'Start'}	The projected plant stock can be calculated from the current stock- or requirements situation for the start date of the reference object.	Прогнозированный заводский запас может быть рассчитан из текущей ситуации с запасами или требованиями на дату начала референтного объекта.	['start']	{'start': '▔'}	['▔ertrat<sos>']
42	{'pricing date': 'Preisfindungsdatum'}	Provide all the mandatory details such as the Pricing Date, Currency, and Quantity, and choose Simulate.	Предоставить все обязательные детали, такие как дата ценообразования, валюта и количество, и выбрать моделирование.	['pricing date']	{'pricing date': '▔'}	['▔ertrat<sos>']
43	{'layer': 'Schicht'}	Data Layer Object Properties - Shared Content Between WA and HP	Предприятия объектов лайверных данных - общий контент между УА и ХП	['layer']	{'layer': '▔'}	['▔ertrat<sos>']
44	{'create': 'erstellen'}	Select Create Filter and add your filter conditions:	Выберите Создать фильтр и добавить ваши условия фильтра:	['create']	{'create': '▔'}	['▔ertrat<sos>']
45	{'space': 'Space'}	Create a new space.	Создайте новое пространство.	['space']	{'space': '▔'}	['▔ertrat<sos>']
46	{'type': 'Typ'}	In each condition record where you define a scale value, you can further specify the scale type.	В каждом записке состояния, где вы определяете размер величины, вы можете дополнительно указать тип шкалы.	['type']	{'type': '▔'}	['▔ertrat<sos>']
47	{'schedule': 'Zeitplan', 'summary': 'Übersicht'}	This is the summary of your schedule.	Это резюме вашего графика.	['schedule', 'summary']	{'schedule': '▔', 'summary': '▔'}	['▔ertrat<sos>', '▔ertrat<sos>']
48	{'space': 'Space'}	Select the Space you would like to work in.	Выберите пространство, в котором вы хотели бы работать.	['space']	{'space': '▔'}	['▔ertrat<sos>']
49	{'report': 'Bericht'}	The following reporting periods are not available in this app:	Следующие периоды отчетности не доступны в этом приложении:	['report']	{'report': '▔'}	['▔ertrat<sos>']
50	{'consumption model': 'Verbrauchsmodell'}	You can define measures for your consumption model.	Вы можете определить меры для вашей модели потребления.	['consumption model']	{'consumption model': '▔'}	['▔ertrat<sos>']
51	{'trigger': 'Auslöser'}	[if Enable Statement-level Triggers = true] Create Statement-level Insert Triggers	[если активизировать триггеров на уровне заявлений = правда] Создайте триггеров вложения уровня заявления	['trigger']	{'trigger': '▔'}	['▔ertrat<sos>']
52	{'order': 'Auftrag'}	The Work Center column lists the resource of the corresponding order.	Колунка Рабочий центр перечислит ресурс соответствующего порядка.	['order']	{'order': '▔'}	['▔ertrat<sos>']
53	{'client': 'Client'}	Make your view visible to analytical clients.	Сделайте свой взгляд видимым для аналитических клиентов.	['client']	{'client': '▔'}	['▔ertrat<sos>']
54	{'interval': 'Intervall'}	Defines a relative time interval for which you want to determine the creation of the necessary physical inventory documents for your cycle counting process.	Определяет относительный временный интервал, для которого вы хотите определить создание необходимых физических инвентарных документов для процесса подсчета вашего цикла.	['interval']	{'interval': '▔'}	['▔ertrat<sos>']
55	{'space': 'Space'}	see the storage status of your space	Посмотреть статус хранения вашего пространства	['space']	{'space': '▔'}	['▔ertrat<sos>']
56	{'create': 'erstellen'}	If you wish to create a role without extending a predefined standard role, choose the blank template.	Если вы хотите создать роль, не расширяя заранее определенную стандартную роль, выберите пустой шаблон.	['create']	{'create': '▔'}	['▔ertrat<sos>']
57	{'task log': 'Aufgabenprotokoll'}	You access these detailed task logs by navigating to the Data Integration Monitor - Details screen of the relevant task.	Вы получаете доступ к этим детальным задачам путем навигации на монитор интеграции данных - подробный экран соответствующей задачи.	['task log']	{'task log': '▔'}	['▔ertrat<sos>']
58	{'provider': 'Provider'}	When a new delivery is made available by the provider, the Status of your data product is outdated.	Когда новая доставка предоставляется поставщиком, статус вашего продукта данных устарел.	['provider']	{'provider': '▔'}	['▔ertrat<sos>']
59	{'connector': 'Connector'}	Cloud Connectors that you want to use for data flows only don't require an entry in this list.	Облачные подключения, которые вы хотите использовать для потоков данных, не требуют входа в этот список.	['connector']	{'connector': '▔'}	['▔ertrat<sos>']
60	{'release': 'Release'}	To publish the release at a later point in time, click Save.	Чтобы опубликовать выпуск в более поздний момент времени, нажмите «Сохранение».	['release']	{'release': '▔'}	['▔ertrat<sos>']
61	{'skill': 'Qualifikation'}	These skills are specified in the resource request.	Эти навыки указаны в запросе ресурса.	['skill']	{'skill': '▔'}	['▔ertrat<sos>']
62	{'provider': 'Provider'}	The provider has removed the data product from the available data product list.	Поставщик удалил продукт данных из списка доступных продуктов данных.	['provider']	{'provider': '▔'}	['▔ertrat<sos>']
63	{'data provider': 'Datenprovider'}	To activate a data provider profile for which you’ve received an activation key, click Activate, enter the key, and click Activate.	Чтобы активировать профиль поставщика данных, для которого вы получили ключ активации, нажмите «Активировать», введите ключ и нажмите «Активировать».	['data provider']	{'data provider': '▔'}	['▔ertrat<sos>']
64	{'Menu': 'Menü'}	Rename a column by clicking MenuChange Business Name	Переимять колонну, нажав менюИзменить название бизнеса	['Menu']	{'Menu': '▔'}	['▔ertrat<sos>']
65	{'allocation': 'Zuordnung'}	Dynamic Memory Allocation for Data Flows	Динамическое распределение памяти для потоков данных	['allocation']	{'allocation': '▔'}	['▔ertrat<sos>']
66	{'data provider': 'Datenprovider'}	To manage your products and licenses, to publish new releases, and to maintain your data provider profile page, the Data Sharing Cockpit offers you tailored apps for each task and workflow.	Для управления вашими продуктами и лицензиями, для публикации новых выпусков и для поддержания страницы профиля поставщика данных, Кокпіт обмена данных предлагает вам адаптированные приложения для каждой задачи и рабочего потока.	['data provider']	{'data provider': '▔'}	['▔ertrat<sos>']
67	{'release': 'Release'}	Save or publish a release.	Сохранить или опубликовать выпуск.	['release']	{'release': '▔'}	['▔ertrat<sos>']
68	{'message': 'Nachricht'}	Read the messages to understand if there are any errors or warnings, if the actions you performed on the template were successful, if further action is required from you, and so on.	Прочитайте сообщения, чтобы понять, есть ли какие-либо ошибки или предупреждения, если действия, которые вы выполнили на шаблоне были успешными, если от вас требуется дальнейшие действия и так далее.	['message']	{'message': '▔'}	['▔ertrat<sos>']
69	{'space': 'Platz'}	Resolve the memory issues by deleting unecessary data in your space or by assigning more memory to your space.	Решайте проблемы с памятью, удаляя ненужные данные в вашем пространстве или присваивая больше памяти вашему пространству.	['space']	{'space': '▔'}	['▔ertrat<sos>']
70	{'end user': 'Endbenutzer'}	Choose the Go to App button to open the end user app.	Выберите кнопку «Дойти до приложения» для открытия приложения для конечного пользователя.	['end user']	{'end user': '▔'}	['▔ertrat<sos>']
71	{'data provider': 'Datenprovider'}	Enter an email address for the internal communication between you as the data provider and SAP.	Введите адрес электронной почты для внутреннего общения между вами в качестве поставщика данных и САП.	['data provider']	{'data provider': '▔'}	['▔ertrat<sos>']
