	terms	src_raw	mt_raw	src_terms	alg_terms	norm_tgt_terms
72	{'data provider': 'Datenprovider'}	You can now switch to the data provider profile.	Теперь вы можете перейти на профиль поставщика данных.	['data provider']	{'data provider': '▔'}	['▔ertrat<sos>']
73	{'create': 'erstellen'}	Create Local Tables	Создайте локальные таблицы	['create']	{'create': '▔'}	['▔ertrat<sos>']
74	{'create': 'erstellen'}	If the required connection is not available for selection, you or an administrator need to create the tunnel connection before you can create the SAP BW/4HANA Model Transfer connection.	Если необходимая связь недоступна для выбора, вам или администратору необходимо создать туннельное соединение, прежде чем вы сможете создать подключение к модели передачи САП БВ/4ХАНА.	['create']	{'create': '▔'}	['▔ertrat<sos>']
75	{'space': 'Space'}	Set your space priority.	Установите свой космический приоритет.	['space']	{'space': '▔'}	['▔ertrat<sos>']
76	{'breadcrumb': 'Klickpfad'}	Click the consumption model name in the shell bar breadcrumbs to return to it, and then click the  Perspectives tab.	Нажмите на название модели потребления в лапках шалла, чтобы вернуться к нему, а затем нажмите таблицу Перспективы.	['breadcrumb']	{'breadcrumb': '▔'}	['▔ertrat<sos>']
77	{'provider': 'Provider'}	You can edit the predefined email and then send it to the provider who then gets in touch with you.	Вы можете редактировать заранее определенную электронную почту и затем отправить ее поставщику, который затем вступает в контакт с вами.	['provider']	{'provider': '▔'}	['▔ertrat<sos>']
78	{'incident': 'Meldung'}	For the Heath Check Support  access category, the incident ID references SAP internal incidents raised by automatic health checks.	Для категории доступа к поддержке Хит-Чака, идентификатор инцидента САП ссылается на внутренние инциденты, вызванные автоматическими медицинскими проверками.	['incident']	{'incident': '▔'}	['▔ertrat<sos>']
79	{'business name': 'betriebswirtschaftlicher Name'}	Modify the properties of objects, including providing business names for them to make them easier to identify and use for non-technical users.	Модифицируйте свойства объектов, в том числе предоставляя им деловые имена, чтобы облегчить их идентификацию и использование для нетехнических пользователей.	['business name']	{'business name': '▔'}	['▔ertrat<sos>']
80	{'work center': 'Arbeitsplatz'}	You can view all top-level materials of the work center.	Вы можете просматривать все материалы высшего уровня рабочего центра.	['work center']	{'work center': '▔'}	['▔ertrat<sos>']
81	{'residence period': 'Residenzzeit'}	The residence period is part of the overall retention period.	Период проживания является частью общего периода содержания под стражей.	['residence period']	{'residence period': '▔'}	['▔ertrat<sos>']
82	{'trigger': 'Auslöser'}	[if Enable Compound Triggers = true] Flush Threshold of Compound Triggers	[если активировать компонированные триггери = истинный] Летучий порог компонированных триггеров	['trigger']	{'trigger': '▔'}	['▔ertrat<sos>']
83	{'identifier': 'Identifikator', 'ID': 'ID'}	If such a column does not exist, you may choose to create a calculated column and concatenate values from other columns into it to provide unique identifier values.	Если такой колонны не существует, вы можете выбрать создать рассчитанную колонку и концетать ценности из других колоннн в нее, чтобы предоставить уникальные значения идентификатора.	['identifier', 'ID']	{'identifier': 'идентификатора', 'ID': '                     '}	['идентифиаторen', '']
84	{'start': 'Start'}	If no period range is defined, the start date of the Period Range selection defaults to the current date.	Если не определен период диапазона, дата начала отсрочки отбора диапазона периода до текущей даты.	['start']	{'start': '▔'}	['▔ertrat<sos>']
85	{'key mapping': 'Schlüsselzuordnung'}	If switched on, it indicates that each data record of the currently opened business entity finds a match in the selected target business entity with the configured key mapping.	Если он включен, то он указывает на то, что каждый отчет данных текущего открытого делового субъекта находит матч в выбранном целевом бизнес-интенте с конфигурированным ключевым картографией.	['key mapping']	{'key mapping': '▔'}	['▔ertrat<sos>']
86	{'data selection': 'Datenauswahl', 'item': 'Element'}	If you want to restrict the data to include in the release, select a view from the Items table and enter or paste your data queries in the Data Selection section.	Если вы хотите ограничить данные для включения в выпуск, выберите просмотр из таблицы предметов и введите или поместите ваши запросы о данных в разделе отбора данных.	['data selection', 'item']	{'data selection': '▔', 'item': '▔'}	['▔ertrat<sos>', '▔ertrat<sos>']
87	{'minimum score': 'Mindest-Score'}	Set the minimum score needed to match an input record with a lookup record and place it in the Review results category.	Установите минимальный балл, необходимый для соответствия записи ввода с записком поиска и поместите его в категорию результатов обзора.	['minimum score']	{'minimum score': '▔'}	['▔ertrat<sos>']
88	{'side panel': 'Seitenbereich'}	Control your join in the Mappings section of its side panel:	Контролируйте свое присоединение к разделу Маппингов его панели:	['side panel']	{'side panel': '▔'}	['▔ertrat<sos>']
89	{'space': 'Space'}	data related to spaces,	данные, связанные с пространствами,	['space']	{'space': '▔'}	['▔ertrat<sos>']
90	{'space': 'Space', 'allow': 'erlauben'}	You could also allow your space data to be consumed in your HDI containers.	Вы также можете позволить, чтобы ваши космические данные были потреблены в ваших контейнерах ГДИ.	['space', 'allow']	{'space': '▔', 'allow': '▔'}	['▔ertrat<sos>', '▔ertrat<sos>']
91	{'minimum score': 'Mindest-Score'}	Set the minimum score needed to match an input record with a lookup record and place it in the Matched results category.	Установите минимальный балл, необходимый для соответствия записи ввода с записком поиска и поместите его в результаты сопоставленной категории.	['minimum score']	{'minimum score': '▔'}	['▔ertrat<sos>']
92	{'action': 'Aktion', 'Action': 'Aktion'}	Possible quick actions are:	Возможными быстрыми действиями являются:	['action', 'Action']	{'action': '▔', 'Action': '▔'}	['▔ertrat<sos>', '▔ertrat<sos>']
93	{'condition': 'Bedingung'}	The advantage of this attribute is that you can refer to certain business partners in one condition by using the correct payment clearing group.	Преимущество этого атрибута заключается в том, что вы можете обратиться к определенным бизнес-партнерам в одном состоянии, используя правильную платежную клиринг-группу.	['condition']	{'condition': '▔'}	['▔ertrat<sos>']
94	{'compliance requirement': 'Compliance-Anforderung'}	Specifies the Valid To date for compliance requirements.	Указано Действительное до настоящего времени для требований соответствия.	['compliance requirement']	{'compliance requirement': '▔'}	['▔ertrat<sos>']
95	{'data provider': 'Datenprovider'}	The data provider has entered some details about the product:	Поставщик данных ввел некоторые детали о продукте:	['data provider']	{'data provider': 'данных'}	['данныen']
96	{'release': 'Release', 'create': 'erstellen'}	Information on the contained data, which is entered in the Create Release wizard.	Информация о содержащихся данных, которая входит в волшебник «Создание освобождений».	['release', 'create']	{'release': '▔', 'create': '▔'}	['▔ertrat<sos>', '▔ertrat<sos>']
97	{'type': 'Typ'}	In the Permissions page individual permissions assigned to privilege types are displayed	На странице разрешений отображаются индивидуальные разрешения, присвоенные видам привилегий	['type']	{'type': '▔'}	['▔ertrat<sos>']
98	{'connector': 'Connector'}	Note that Cloud Connectors that you want to use for data flows only don't require an entry in this list.	Обратите внимание, что облачные подключения, которые вы хотите использовать для потоков данных, не требуют входа в этот список.	['connector']	{'connector': '▔'}	['▔ertrat<sos>']
99	{'space': 'Space'}	The space that was selected to store the data product.	Пространство, которое было выбрано для хранения продукта данных.	['space']	{'space': '▔'}	['▔ertrat<sos>']
100	{'schedule': 'Zeitplan', 'change': 'Änderung'}	This means that the work center change is only visible in your schedule and is not yet saved in the maintenance order.	Это означает, что изменение рабочего центра видно только в вашем расписании и еще не сохранилось в порядке обслуживания.	['schedule', 'change']	{'schedule': '▔', 'change': '▔'}	['▔ertrat<sos>', '▔ertrat<sos>']
101	{'category': 'Kategorie'}	New records that have the same pairing column value as an existing pairing group are automatically placed in the appropriate results category for that pairing group.	Новые записи, которые имеют одинаковую ценность паритета колонны как существующую группу парнинга, автоматически помещаются в соответствующие результаты категории для этой пары группы.	['category']	{'category': '▔'}	['▔ertrat<sos>']
102	{'service': 'Service'}	SAP and other SAP products and services mentioned herein as well as their respective logos are trademarks or registered trademarks of SAP SE (or an SAP affiliate company) in Germany and other countries.	САП и другие продукты и услуги САП, упомянутые здесь, а также их соответствующие логотипы являются торговыми товарами или зарегистрированными торговыми товарами САП СЕ (или филиальной компании САП) в Германии и других странах.	['service']	{'service': '▔'}	['▔ertrat<sos>']
103	{'data provider': 'Datenprovider'}	To be able to use the data product, the data provider will send an activation key via email that provides authorization to access one or multiple data products.	Чтобы иметь возможность использовать продукт данных, поставщик данных отправит ключ активации по электронной почте, который предоставляет разрешение на доступ к одной или нескольким продуктам данных.	['data provider']	{'data provider': 'данных'}	['данныen']
104	{'assigned': 'zugewiesen', 'space': 'Platz'}	It might make sense to delete unnecessary data in your space or to extend the assigned storage.	Это может иметь смысл удалить ненужные данные в вашем пространстве или расширить выделенное хранилище.	['assigned', 'space']	{'assigned': '▔', 'space': '▔'}	['▔ertrat<sos>', '▔ertrat<sos>']
105	{'insight': 'Analysen'}	There are many ways to collect and combine data to create business insights:	Есть много способов сбора и комбинирования данных для создания бизнес-инферий:	['insight']	{'insight': '▔'}	['▔ertrat<sos>']
106	{'create': 'anlegen'}	You can create a text block inside the text block library.	Вы можете создать блок текста внутри библиотеки текстового блока.	['create']	{'create': '▔'}	['▔ertrat<sos>']
107	{'space': 'Space'}	This space is no longer active.	Это пространство больше не является активным.	['space']	{'space': '▔'}	['▔ertrat<sos>']
108	{'storage': 'Speicher'}	Allocate your capacity units to compute and storage resources.	Распределяйте свои единицы возможностей для вычисления и хранения ресурсов.	['storage']	{'storage': '▔'}	['▔ertrat<sos>']
109	{'share': 'freigeben'}	Generate keys that you can share with consumers to allow them to use the licensed scope of data products.	Создайте ключи, которые вы можете поделиться с потребителями, чтобы позволить им использовать лицензированный ассортимент данных продуктов.	['share']	{'share': '▔'}	['▔ertrat<sos>']
110	{'release': 'Release'}	The release is highlighted on the landing page with the flag “Not published yet”.	Выступление подчеркивается на landing-странице с флагом «До сих пор не опубликовано».	['release']	{'release': '▔'}	['▔ertrat<sos>']
111	{'access control': 'Zugriffskontrolle', 'restriction': 'Beschränkung'}	For each business entity used as data restriction, you need to map each key member to the data access control's output column.	Для каждого делового субъекта, используемого в качестве ограничения данных, вам необходимо составить карту каждого ключевого члена к производственной колонне управления доступом к данным.	['access control', 'restriction']	{'access control': '▔', 'restriction': '▔'}	['▔ertrat<sos>', '▔ertrat<sos>']
112	{'snapshot': 'Snapshot'}	Create a schedule to load new snapshot of data asynchronously and recurrently in the background according to the defined settings.	Создайте график для загрузки новых снимков данных синхронно и периодически на фоне в соответствии с определенными настройками.	['snapshot']	{'snapshot': '▔'}	['▔ertrat<sos>']
113	{'interface': 'Schnittstelle', 'message': 'Nachricht'}	The interfaces you have subscribed to for monitoring, including the status of the individual messages.	Интерфейсы, которые вы подписали для мониторинга, включая статус отдельных сообщений.	['interface', 'message']	{'interface': 'Интерфейсы', 'message': '▔'}	['интерфййыen', '▔ertrat<sos>']
114	{'deployment': 'Implementierung'}	A pop up informs you about the source updates before you can go with deployment.	Поп-оп информирует вас о обновленных источниках, прежде чем вы сможете пойти с развертыванием.	['deployment']	{'deployment': '▔'}	['▔ertrat<sos>']
115	{'data provider': 'Datenprovider'}	To edit an existing data provider profile, click .	Для редактирования существующего профиля поставщика данных, нажмите .	['data provider']	{'data provider': '▔'}	['▔ertrat<sos>']
116	{'reference': 'Referenz'}	In this app, you can create the reference data that are used for the simulations.	В этом приложении вы можете создать ссылки на данные, которые используются для симуляции.	['reference']	{'reference': '▔'}	['▔ertrat<sos>']
117	{'deployment': 'Implementierung'}	Note that after a redeployment, the persistency is deleted and the data access is changed back to virtual.	Обратите внимание, что после перераспределения настойчивость удаляется, а доступ к данным меняется обратно на виртуальный.	['deployment']	{'deployment': '▔'}	['▔ertrat<sos>']
118	{'release': 'Release'}	Specify date and text information for the release.	Указать дату и информацию текста для выпуска.	['release']	{'release': '▔'}	['▔ertrat<sos>']
119	{'data provider': 'Datenprovider'}	You can search and browse for data products and data providers.	Вы можете искать и просматривать продукты данных и поставщиков данных.	['data provider']	{'data provider': 'данных поставщиков данных'}	['данныen пооen данныen']
120	{'deployment': 'Implementierung'}	saving is available but deployment is blocked	экономия доступна, но развертывание заблокировано	['deployment']	{'deployment': 'развертывание'}	['fазверты']
121	{'update': 'aktualisieren'}	You can donwload it to get a data update.	Вы можете загрузить его, чтобы получить обновление данных.	['update']	{'update': '▔'}	['▔ertrat<sos>']
122	{'skill': 'Qualifikation'}	Skills with a check mark are provided by the resource.	Навыки с контрольной маркой предоставляются ресурсом.	['skill']	{'skill': '▔'}	['▔ertrat<sos>']
123	{'feedback': 'Feedback'}	This provides you feedback on how many entries within the current business entity there are and how many of them match to entries of the target business entity.	Это дает вам обратную связь о том, сколько вложений в текущем бизнес-организе есть и сколько из них совпадают с записями целевого делового субъекта.	['feedback']	{'feedback': '▔'}	['▔ertrat<sos>']
124	{'data provider': 'Datenprovider'}	The data provider profile page provides additional information about the data provider and other products or product groups.	Страница профиля поставщика данных предоставляет дополнительную информацию о поставщике данных и других продуктах или группах продуктов.	['data provider']	{'data provider': '▔'}	['▔ertrat<sos>']
125	{'insert': 'einfügen'}	insert privilege is removed from the Space Manager	Вставка привилегии удаляется от Космического менеджера	['insert']	{'insert': '▔'}	['▔ertrat<sos>']
126	{'Table': 'Tabelle'}	Remote Table Monitor - short descriptions	Отдаленный Табличный монитор - короткие описания	['Table']	{'Table': '▔'}	['▔ertrat<sos>']
127	{'insight': 'Analysen'}	First Steps to Create Insights	Первые шаги для создания проницательности	['insight']	{'insight': '▔'}	['▔ertrat<sos>']
128	{'deployment': 'Implementierung'}	[read-only] Displays the deployment and error status of the object.	[Прочитано только] показывает статус развертывания и ошибки объекта.	['deployment']	{'deployment': 'развертывания'}	['fазверты']
129	{'space': 'Space'}	Keeping an overloaded space active can impact running jobs.	Поддержание перегруженного пространства активным может повлиять на работу.	['space']	{'space': '▔'}	['▔ertrat<sos>']
130	{'personal data': 'personenbezogene Daten'}	Personal data concerning insurances and bank or credit card accounts	Личные данные, касающиеся страховых и банковских или кредитных счетов	['personal data']	{'personal data': 'Личные данные'}	['личiыеen данныen']
131	{'work center': 'Arbeitsplatz'}	Reviewers do not require any work center assignment.	Рецензенты не требуют каких-либо заданий рабочего центра.	['work center']	{'work center': '▔'}	['▔ertrat<sos>']
132	{'create': 'anlegen'}	You can create clauses and signature blocks with this option.	Вы можете создавать клаузлы и блок подписи с этой опцией.	['create']	{'create': '▔'}	['▔ertrat<sos>']
133	{'release': 'Release'}	Enter a text briefly describing the data contained in the release, and enter a comment.	Введите текст, который кратко описывает данные, содержащиеся в выпуске, и введите комментарий.	['release']	{'release': '▔'}	['▔ertrat<sos>']
134	{'space': 'Space'}	Create users so you can assign them to a space.	Создайте пользователей, чтобы вы могли назначить их в пространство.	['space']	{'space': '▔'}	['▔ertrat<sos>']
135	{'business': 'geschäftlich'}	This allows for multiple associations between the same business entities (in different contexts) and provides additional business meaning to the association.	Это позволяет для нескольких ассоциаций между одними и теми же предприятиями (в разных контекстах) и обеспечивает дополнительное деловое значение для ассоциации.	['business']	{'business': '▔'}	['▔ertrat<sos>']
136	{'consumption model': 'Verbrauchsmodell'}	The associated business entities will be available as dimensions when you create a consumption model.	Связанные предприятия будут доступны в качестве измерений, когда вы создаете модель потребления.	['consumption model']	{'consumption model': '▔'}	['▔ertrat<sos>']
137	{'issue': 'Problem'}	Click an issue.	Нажмите на проблему.	['issue']	{'issue': '▔'}	['▔ertrat<sos>']
138	{'consumption model': 'Verbrauchsmodell'}	They allow data to flow into the Business Builder and are combined together to produce fact models and consumption models.	Они позволяют данные течь в бизнес-строитель и объединяются вместе, чтобы производить фактические модели и модели потребления.	['consumption model']	{'consumption model': '▔'}	['▔ertrat<sos>']
139	{'start': 'Start'}	Plant stock at start date of reference	Заводный запас на начальной дате справки	['start']	{'start': '▔'}	['▔ertrat<sos>']
140	{'namespace': 'Namespace'}	Enable ABAP Manageable Trigger Namespace	Уключите АБАП управляемый триггерной сфера имен	['namespace']	{'namespace': '▔'}	['▔ertrat<sos>']
141	{'deployment': 'Implementierung'}	If the view uses other views that were not changed, these views are not touched by the deployment and therefore the persistency is still available.	Если вид использует другие взгляды, которые не были изменены, эти взгляды не затрагиваются развертыванием и, следовательно, настойчивость все еще доступна.	['deployment']	{'deployment': '▔'}	['▔ertrat<sos>']
